text,sen
It's gonna blow.,-1
The market's bitcoin wrap can see pullback as the volume of the lower market btc bitcoin cryptocurrency,-1
darknet mixer operator pleads guilty to washing M in bitcoinnews btc bitcoin,-1
bitcoin the bear market can take the price of btc to k say trader with stock because capitolation bitcoin through,-1
in pursuit of jpmorgan reported closing bank accounts of bitcoin mining companies bitcoin btc,-1
crypto crash trends on Twitter as bitcoin falls below dogecoin bitcoin,-1
Home panel calls for cryptancy fraud trade market bitcoin,-1
The central bank Honduras are clarified on Wednesday that they won't make their bitcoin law tender akacve in the report,-1
Bitcoins just got messed up in Nigeria with a huge volume of pp prank bitcoin btc one nice one,-1
See this is why a lot of us don't buy dips exactly this sentiment when it's not as bad as it used to be is as positive as Friday has gone down really ugly we go down to the low s and then hits moonbois go nuts and everyone puts money in so it can throw away and shorter can put in a new position everyone says zoom out and so we zoom out and look like interspersed dirt between moonbois and wyoff Wackoffoffoffoffoffoffs are actually normal people with real money who don't want to lose their only confidence,-1
microstrategy stock tank with bitcoin as s p nasdaq rally btc bitcoin cryptocurrency xbt,-1
bitboy is the dumbest name sounds like a stupid crypto comic book theme or bullshit,-1
You remember all i m gon na say it bitcoin will never again be lower than from the influence of your favorite ct be careful who you listen to,-1
The great investor Michael Burry returned to Twitter to spread fear and make more money btc eth ethereum crypto bitcoin,-1
btc bitcoin primary trend fixed bears right on support main cycle of k thursday is we do or die btc days,-1
Old liquidation sold in multibtc kill bitcoin scams in.,-1
Money laundering arrested in uae dubai with millions of cryptocurrency stolen in bitcoin good work by law enforcement agencies,-1
"Okay, now that's a bitcoin violence btc btc.",-1
The great pope manipulates the market for their benefit is the greatest weakness for crypto today in my opinion.,-1
btc update i hate to say it but it looks like bitcoin will make new lows ill wait until the daily close and tomorrow's for confirmation but it might be time to turn to the different view one i posted earlier k is a good target imo bt bc crypto,-1
i've been trying to make mathematics work on the whole bitcoin post as collateral and living off a free debt tax for the rest of your life thing and it just doesn't work with most retail lenders including blocksfi unless you consider double bitcoin in value every year where you might just go all the way around now with at least one year worth of cost and then sell half of the year's value from now to invest in income assets that maintain your life-force without a deadline that ever grew a fiat seems relatively risky if the bitcoin under your performance ever developed under the assumption,-1
mas do not trust retail crypto investment consider more crypto bitcoin ethereum regulations,-1
is it gon na drop again or buy now stop edit oh shit it down a little bit more lil,-1
Bull trap. We're not out yet. Bitcoinrash btc.,-1
Micalfred with parts between btc may die,-1
send to k bitcoin cryptocrash,-1
I love Willy but the more I read his tweets the more I saw him actually very vaguely a lot of time and not really giving a lot of detail,-1
Asia's getting crazy phippines duterte threatens prison for garbage while Chinese s crackdown on cryptocurrency is crashing bitcoin every other crypto is time to buy a dip or get out the market,-1
we re closer to k than we re to k btc,-1
buying top bitcoins and bottom bitcoins always feels really amazing investment thoughts,-1
btc is a hodl economy since when having a hodl economy working as for gold u can use it as jewelry jewelry it's very necessary in some industries it's really eternal it has its unique properties there are thousands of different chain blocks its largest hastrate can change,-1
bitcoin week social volume up to price down to btc bitcoin lunarshare lunarus,-1
davidgokhshtein no agency has any reason to buy shitcoin btc,-1
You back right? Better not buy if win t always just go straight up without ever correcting,-1
if you invest your stimulus check when bitcoin is an investment you are now worthy of your investment down the current Btc price,-1
They know it's going under.,-1
The current price of bitcoin is it has been dropped by in the last hour of bitcoin btc cryptocurncy,-1
Another kind of money. I'm more worried about the exchange filing bankruptcy than the btc people invested in crypto through this exchange are now stuck.,-1
pewdagoat frosttheproto nft bitcoin oh what's that sorry i ca nt heard you because my trust wallet got lost the mines stolen i need a sugar daddy too and I forgot to tell the coinbase account i got hacked that any help is getting my hearing working again,-1
wtf this sh t,-1
btc technical bitcoin analysis won't grow on top soon,-1
bitcoin downtrend support intact on k,-1
I have to go shopping in the stock market. Wow.,-1
"Bitcoin is one thing. The sbf can't control and manipulate, but it's probably not that big of a thing.",-1
bitcoins down here fast and soon,-1
yeah dat ist looking good bitcoin,-1
take your bitcoin out of the exchange instead of your key not your coin is very simple,-1
traditional market closed do the thing you panicked ponzi btc bitcoin btc,-1
Bitcoin offered a black deal Friday at the price of a sub k btc like there had to be a pony here somewhere,-1
The coinstelegraph is because Chinese quantum computers are almost ready. Once the world accepts Chinese btc will interfere. It's the only best way to invest in nxs which is quantum evidence.,-1
buy on forever bitcoin,0
Hard things don't break bitcoins,0
The new video subscribes to the warning insist that the central bank feed the binance pump is centered on the takeover of the bitcoin altcoin xrp,0
historical bitcoin prices for today's February th's tweet,0
btc movement coming in.,0
The drill team reports that we are passing through Australia's next stop core.,0
coinstelegraph btfd btc doge buy now is like buying at k sure it can go lower but overall a large dca entry for long-term people,0
well yes if you only got some sitting then the wallet hw nt needed but if you return have significant amounts then you must have a wallet HW in my opinion man,0
dogecoin bitcoin cryptto our doge friends how is everything,0
This one works on bitcoin bindancesmartchain nft,0
mind in btc bitcoin see navidmemar's ideas about tradingview below,0
will run regression on bitcoin vs. stock basket technology I have the following please suggest some more palantir desla alphabet feel free to either add or recommend another basket,0
short one entry price stop loss link in bio tz btc bitcoin one,0
btc price on bitcoin crypto q,0
xrp kick btc crypto,0
people want you to tell them what they want to hear not what you think bitcoin bear hodl,0
The moon chart for bc noverber lunar eclipse moon full moon on high tarus scorpio conjunct fixed an algol star This will be a violent full moon eclipse because it happens in the star remain called the algol moontrading,0
What year was Alexa in Alexa bitcoin btc?,0
The question is why bitcoins are negatively affected.,0
The worst-case prediction for bitcoins uses stock to flow analysis can see bitcoin hit by December according to planb crypto bitcoin,0
btc liquidated long k in,0
Let's get the trade experts to your bitcoin cryptocurrencymarket,0
btc btc eth bnb bnb,0
everyday bitcoins are closed over sr expect this to expand today to,0
Looks like it's still in sf range.,0
Shootingsbymatta bitcoin flux bitcoin predicting the price of winter crypto against global adoption.,0
btc rejects the current H'sma may be pulling back a bit as h graphs are extended far from the average after this step is more to do with the fact that sp has a good recovery day and not with some fundamental new crypto power,0
Everything in July bitcoin th work in federal revealed every day the mairead mcguiness and money laundering meme review rawvokado sponsor cryptocloaks host bitvolt coincus,0
no one knows but we spent a long time correcting at s i dont see us back again or if we're not for a long time,0
I've just done the longest podcast about my hours and minutes of babbling about bitcoins and crypto mattysats cryptocurator mashinsky Alexandrelores infinitysme kcrypriptski,0
every future bitcoin event and price update,0
bitcoin summary of thpool tx in the last second means median max th high link block nobs,0
technical bitcoin btc bitcoin technical score,0
looking at btc shorting again soon will update if I do,0
Yes. Sign the exec command for more.,0
"There won't be many of them. People tend to sell their shares after high enough prices for them to pay off their mortgages, retire or meet other life goals.",0
bitcoin block bytes transaction btc reward for further information visit,0
rsi up for btcusdt on min timeframe btc bitcoin click for chart,0
bitcoin hr chart interpretation,0
satsdart bitcoin btc btc adx shows the weekly fake bull trend,0
mind on btc bitcoin seeing danilblinkov's ideas at tradingview below,0
bitcoin block bytes transaction btc reward for further information visit,0
eudora funk byron harvey bart jim btc,0
Triangle up is about to break if we can break with a good volume hold on it we can expect to see btc in k range again in the next few days eyes to support the resistance in case of fake bitcoins,0
The new primelist huobi lists fz for sales taking the opportunity that leads to open trading wealth deposits on June click this link to join details crypto btc nfts,0
gegelsmr Imagine not taking any single cash loans you can get and apes into bitcoins like wtf,0
You ninies only bitcoin bitcoins are the purpose of it's conversion to meaningless fiat prices,0
The number of bitcoins given to the miners will be reduced in half in about a day,0
lol You must be new here,0
big btc bitcoin upside down head and shoulder if it breaks we see a krovercrcrc,0
Saylor nearly doubled his billion investment.,1
"That's incredible, lmao.",1
"fontcolor="" # FFFF00""adidisoriginalscoginscose hodlbitcoin future fontcolor="" # FFFF00""dontplay with shitcoin sand gamble",1
"You can mine bitcoins anywhere in the world. Hey, you've read the standard bitcoin by the saifedean, but it's a huge resource to get you started.",1
laying all the foundations of the Kai ecosystem getting ready to take Vietnam into a new era of defi. This has all been achieved in a short time in all the condition of the cardiachain team. Keep giving mass users the Btc eth kphi dpet.,1
Krakenfx crypto millionaires will be the greatest benefactor in the world we've ever seen. We know what it's like to have nothing.,1
just print a cashback gift at an online bitcoin store with lolli and get a free btc in your wallet,1
And your daring pain to tweet this to david goggins This is roller coaster ride we all wait can not have sweet without acid and it's definitely gon na sweet at last bitcoin,1
"fontcolor="" # FFFF00""wait fontcolor="" # FFFF00""thisweekbuy fontcolor="" # FFFF00""theninthe nexttwoweeksssellin k insteadof waitinguntil k getto getin hodl",1
Pay doesn't compete with inflation Wef says go live near birds and you'll be happy like a salary raise a bird or grow your wealth in bitcoin,1
taillarb tresolas deitone gold we are moving forward not backward btc,1
It's a song for bitcoins that's a little idiot.,1
Documenting the recent announcement banning mining in China created some new advantages for crypto miners btc everyone panicked that it's bought an opportunity it's all about bitcoin I went from having btc to btc with the signal tradng frm rore on what appapp,1
Chances are infinite while here hey i joined a network called surveyj and received today you get paid for testing new free software and posting on social media registering with my link for instant bonus signing surveilj bitcoin,1
In my opinion bitcoin is behind and really must k or above it must be far beyond the golden chamber,1
another chance to buy more btc cryptocurrency shib,1
btc fully deployed place here has only close and btc busy today got stopped at some position and done decently near so as a whole smoothly up to the day could be much worse,1
ee i think ee is feeling bullish bitcoin,1
i like the way you go back think we should buy a cabin log for fam i also go some homeless cat who needs a place to stay,1
el salvador has recognized bitcoin and why not another country imho el salvador only lab rats other countries will watch closely about how he does and other risk factors it will take long before cryptocurrency will be accepted as tender law,1
Solana activating the metagwaratoken is aiming for the moon when they arrange to launch their original mgt token list of this project will take place on the bitgert chain soon to get people as we move to the moon bitgert mgt,1
People sell their bitcoins while i'm here trying to figure out what i can sell to get more pay can't come fast enough,1
If not now soon people will play hot potatoes with some of these bitcoin assets are delicious and never end the loaded potatoes,1
Big project hswapdex sonitzy paradise broar ht airdrops btc hecochain,1
"All right, thanks, man.",1
Swedish convict got a million in bitcoins back to him twenty nothing bitcoin cryptocurrency,1
We're here with bitcoins,1
Warrendavidson bitcoin fixing this,1
It's finally good to see what bitcoins are designed to do the last few days of the stock market that are too valuable to pop up and bitcoins are still here.,1
The less money you have the more power they're expanding the wealth gap is an accident using bitcoins of the oligarch empire is actually easy to understand,1
lenfantebon opinion is you ask me if inflation produced from the rapid expansion of our money supply is the same thing as a sharp decline in the bitcoin price market as the denomination in our dollar,1
Buy a bitcoin gun and ammunition,1
i'm not an intelligent technology I only have one computer that i use for streaming school games and watching porn too i dont have a habit of using vpnstor pretty sure my money is safer in exchange than with me,1
When you fully understand the bitcoin you realize that it's a perfect global solution to the preservation of wealth all other projects are still experimental including the ethereum,1
Michael sayslor's microstrategy bought an extra m of bitcoin companies revealed buying bitcoins brought total ownership to place your bitcoin where your mouth is brought to another level,1
in all infinite oil practitioners gold unlimited unlimited real estate unlimited bitcoin although limited where best to store your value,1
knrubar johalmiles fed s planned error it always was then they pretend they didn't know bitcoin shouldn't pretend anything,1
i think bitcoin that can change a lot of lives if you read this you pioneer cryptocurrecy,1
The hut bitf nest btbt big chance buys for stock mine btc for those who take advantage all the way out of stock to sell so hallelujah has to reload everyone else no worries hanging on bitcoin would very likely go back to ktoday or this week,1
Imagine the effect of bitcoins as more and more of automatic lightning nodes management and growth releases hahaha fiat and shitcoins will go poof,1
mcshanewrites buy bitcoins buy hamstercoin,1
i had gone all at k right before the big dip but held through and the average down and boys am i glad atm,1
You just lose if you sell to the loss of i hoverd this last bear market and keep buying dips all the way lined up I buy a lot if you're here for s fortune hodl piled up repeating every possible disregarding price chatter if not speculating btc,1
The end diagonal is seen in btc if playing bitcoin well going to the k area so many confirmations suggest that let's see but this is my opinion what you say bitcoin,1
My helin beauty will continue to hold on to bitcoin and besides the world can never hate btc,1
Raining blood but the killer makes money in the blood leaving this trade running while I'm sleeping stop losing sniper fast trade btc thallaboutstructure,1
There's nothing I'd rather be than receiving bitcoins from the best tribute slaves to collect.,1
buy dip but do not go at once btc bnb bsc,1
Bitcoin is freedom that freed me from saving me,1
stay in fear if you want I won't btfd ltc btc,1
