text,sen
environmental impact bitcoin alone has the environmental impact co emissions from some small countries for a currency that is mainly used for value stored non-transactions this is incredibly problematic assuming that there will be no transformative advances in computing efficiency work test is going to be with us and obfuscating the long-term value of crypto complexity my non-technological smart friend literally just put k into titan s crypto fund because he does not trust himself to not make a costly mistake in buying the coins that I advised him in his early years and works for a technology company still does not trust in transacting the coins themselves that is going to continue to be a problem of wide adoption scammy coins this yarn loves to shit on the elizabeth warren to try to regulate the cryptic space I think his heart is in the right place but often gets the wrong details buuuuuut if we want wide adoption we need zero stories of people getting carpet hacked etc regulation specifically around verification of fundamental projects would be incredibly useful to give consumers confidence in what they are reacquired from people to be thrown away and become a little consumer casino.,-1
"currency is only useful if it can be exchanged for goods and services to the extent that it can be exchanged to buy your local country s currency so that it is cool, but especially at this time it is too volatile to be reliable as a means of exchange",-1
the best crypto thing I earn more per week than I did during the last few years of interest the bank was giving me combined banks are literally stealing people from their money that are running one of the most successful scams in the world,1
I have found that almost all coins are useless or are only there to serve a purpose or problem that the other currencies themselves create as government tokens do not need those if not crypto proctopcs where you can lend cryptopcs so that others can borrow cryptopcs so they can buy cryptopcs is a completely self-referential and closed loop system i real ed that got ros of all ambitions and dreams about it and just being a cold-blooded merchant helped,-1
a new shitcoin to buy pictures of monkeys,-1
"Diversification seems to me that recently had enough traction that died a lot of young people who believe in it can buy more and more traditional politicians and financials that mention it etc. It's also just great that said it's just a small part of my portfolio, although the increase despite not paying and I'm prepared to go to",1
"As traditional gold lacks intrinsic value that does not produce anything or creates cash flow and hardly anyone seems to fully understand how the underlying blockchain technology works could be tremendously valuable, but at this point it is difficult to see why any type of digital currency should be considered so valuable without much utility not obvious illicita",-1
make kwon collect billions before the collapse is the biggest scam job in history,-1
No crypto shit is nt safe at all between the volatility rugpulls honeypots and other scams if there's one thing we don't have is security so the higher returns are what make this market survive,-1
Bitcoin is young. Give it a little time. Give it a chance. You won't regret it.,1
"ten years ago I put my down payment money on bitcoin instead of real estate s up over x bitcoin s price continues to grow at a very fast rate over the medium long term you see that there were good reasons for bitcoin s fast increase most of those reasons still exist today there are even more good reasons that there were or years ago it is reasonable to expect that the average long-term growth rate of bitcoin to stay very high for the foreseeable future mortgage has significant tenure costs, for example insurance maintenance taxes sometimes real estate interest fees is nt very liquid and has extremely high transaction costs bitco bitco bitco bitco bitco bitco bitco bitco bitco bitco bitco bitco bitco bitco bitco bitco bitco bitco bitco bitco bitco bitco bitco bitco bitco bitco bitco bitco bitco bitco bitco bitco bitco",1
"For me I see it as a completely speculative asset that I have bought some in the past made a little money out of it and sold what I do not like from it because it is so immature that it can be legislated into oblivion also that it has no case of considerable use however, apart from negotiating it and laundering money I cannot see that it is being used as a currency like deflation inherently incorporated in it, as well as its price volatility is an impediment also the stock history of value is weak when it is considered that its price fluctuates massively unlike traditional assets the only thing I can see are international payments, but this will end up being done without needing any of the cryptographies out there no matter what the narrative feels and I believe that everyone is only maintaining to maximize their yields and then throwing out their bags to someone else who expects to do the same since there is no underlying asset to sustain the value of the currency other than supply and demand if the demand collapses the price will open up to the same measure that opens up to manipulation within the trade and so out these have been widely regulated dvered out of the stock markets while the wet or right",-1
"eth has the most ongoing development and it's ultimately more important than the block chain itself, but it's not usable by most people right now it's not a finished unscripted product can really justify its market cap with performance at this point that's why people say it's still early there's speculative value placed in crypts that can or can't come out with the eth road map eth has the best chance of being scalable and easy to develop",1
"I have not yet seen any useful case of use exit cryptography that cant is done without it easily people will jump over decentralization, but it remained decentralized its already getting more and more centralized governments will never allow it to be a happy playing field for cryptobros so the point is already dead apart from its basically useless",-1
I'd say that of all cryptocurrencies out there is a sad fact that we're lucky if half of them are safe investments.,-1
that is still investing in this kwonartist currency,-1
The situation hasn't changed in the last few decades fortunately bitcoin is here to give us an alternative to this system allowing us to regain power over money.,1
"So many things destroy this planet faster than bitcoin mining, but we don't hear about it. Crypto uses a little more energy and everyone is hanging.",1
"point is the real deal with bank-level security and kusama stability was essentially a point copy developed to test new updates in a real world and the real economic environment before implementing point ensures that point always works without problems and never falls or has security gaps most of the projects in point will also have a sister network in kusama that will essentially do the same, but you will get new features and capabilities first it is also cheaper to use in general kusama is becoming an art and game center because of this that it is so cool that moonrivermoonbeam kuraacala heikoparallel khalafala etc are only the sister networks kusamadot teams themselves to build them the kusama versions will only have more features than the dot versions than the",1
"the intrinsic true value of all cryptography is that s does not hyperbole that is just an objective fact about any virtual currency I guess the same is true of fiat money also in any great disaster scenario where society collapses it is likely that both would become just as useless immediately even if the Internet somehow continued to work no one would be interested in your cryptography as soon as there is scarcity and insecurity on that scale physical goods are all that matters it is possible that gold could come into use, but you have to be sure that other people are interested in it before you take it yourself in an exchange because you can end up starving in a lot of shiny metal otherwise",-1
too many frauds no inherent value displeased by the financial institutions in which I trust used by criminals apparently random value based mainly on manipulation of the environmental impact of the market,-1
is a currency however no one uses it as a currency that cant use to buy things for the city or the main bitcoin online stores can especially in places like venetuela venezuela is actually a great example of how it is good for the world because it exists they can feed their family from farming on runascape instead of dying of hunger due to dictatorship oppressing them,1
I've lost money on every purchase of crypto and I've never sold,-1
"better returns on investment than shares, although more volatile transactions without borders much better apy stacking crypto than leaving money in bank protection against inflation of my local currency my local currency loses value as fortnight at this point",1
Disrupting access to banking services for people who currently do not have access to banks cheap money transfers such as remittances to the family abroad smart contracts that guarantee property information reducing the need for expensive notaries I see crypto as the new industrial revolution the new Internet is the next step in how we live I think that in ten years we will look back at society without blockchains everywhere in the same way that we look back at society without smartphones we remember how it was but coming back is almost impossible and our children do not understand it at all,1
No possibility that dumping will only worsen any burning in any supply of circulation has changed nt per currency lol,-1
People have used cigarette salt shells etc as money because money is what we call the good or the tool that is used as money it is used to store value to exchange for other goods as a unit of account a good or tool becomes money when it is used as money in a prison cigarettes becomes money when it is the good used for money different goods or tools can be better or worse money depending on the qualities it has there is no requirement that it has to be tangible or physical the requirements are that it has to do its job more or less than it has to work as a store of value means of change unit of account and to make it have to be transportable and durable easy to verify etc bitcoin has all those properties and it is designed to excel in all of them some say that it does not store value because it is too volatile but bitcoin does not contain volatility the volatility is caused by other human beings and volatility is not a problem while it has kept in value or increases in value between time and time it is no more than it makes it more profitable at work and people don't do it anymore and people don't see it as it more valuable and people do it and it and it makes it more valuable and it and it and it more and it makes it more,1
Crypto is giving us a way not only to be passengers in the financial world,1
"cryptocurrency is a long-term investment in this dip newbies are selling panic which is a good thing, as this is the opportunity to buy bass and sell high in the future is the game of patience but keep more desire",1
How many times people have to burn before they learn not to trust this guy,-1
"green energy is already widely used for bitcoin mining, according to a recent bitcoin mining report they have already been using their total electricity through sustainable or renewable sources for council members the use is even better",1
bitcoin is a lot of things right now it's a final judgment day currency it's an inflation hedge it's a speculative asset it's a central banking hedge it's a tech game plus hundreds of things plus all things are components of its price and value people buy to sell and keep for different reasons you can't look and say why it's falling because of inflation it's a hedge against inflation you can also say it's a hedge against central banks because monetary policy and central banks is probably one of the worst places it's been in a while though btc is t in a whole time high btc is wearing many hats right now don't let anyone tell you that it's not any of a number of different things,1
"Since the cryptogram is fundamentally deflationary and limited in the offer it makes for a terrible currency the purpose of the currency is not an investment, but to facilitate deflationary trade currencies always gain value because of the limited offer, which means that people will sit on them instead of making transactions with them inflationary currencies on the other hand encourage people to use them for goods or investments as they are actively losing value",-1
I plan to invest a small amount every month,1
I really doubt it's that deep assuming that his fans are just greedy hopeful people and kwon knows how greedy people are in the cryptogram space and he knows even if he shits once he can do it again a few times it's like trust no longer means anything if you can make money,-1
"Yes, governments forbid it one important thing although it is that the entire backbone of cryptographic liquidity is through a stable currency called bondage that are a complete scam and are already banned in not once the second finds out that their currencies that must be backed by a dollar we are backed by nothing I think the feds will close the exchanges because it has become a huge ponzzi scheme",-1
"apecoin is going to become a worse version of shib i.e. not enough bomb, but still the same reason to dump because logic",-1
only buy real gold instead of cryptopaxg version does not serve any real purpose,-1
the disk we don't need,-1
crypto is the simple and simple future to buy or perish,1
I bought bitcoin and other cryptos because I believe in them if you don't have that feeling about your investments that's just better in the margin,1
Papa Bitcoin is the king.,1
This is good. I'll buy more.,1
harmony an algorand cardano solana vechain gon na fly if there is ever a next bull market otherwise just buy and stack satoshis,1
They don't even survive a bull market.,-1
It was backed up by the moon until the project failed because people are buying do kwon shit again they once cheat on me shame in do kwon they fool me twice it doesn't happen,-1
monero is probably the best coin we have atm to change my mind,1
You're going to bump into hoody cheerleading people.,-1
i m old may not be around in more years than it is too long a way to speculate about anything btc is the beginning the present and much of the future yet everything else is a bet,1
has been my stable gold defacto for years and I am very happy with it I have tried its exchange mechanism and collected some gold to verify the chips that are burned in that process,1
"Sceptical about Solana due to its low public allocation to launch the Solana team and vc support leaving retail investors susceptible to being dumped in not saying it will happen, but you never know",-1
We all like the vet.,1
This is the way to buy low high the only time I sell is when I spend it on something lol,1
Just buy it now and forget about it. Trust the process.,1
eth eth has been shown in a real operating environment i cant stress this enough is also sure of sec,1
Kwon's arrogance was Terra's fall so many examples of dumb ass tweets from him,-1
is an imo win pretty easy just get ta keep up to the next btc ath and you literally guarantee an x at current prices,1
so many things are worse for the environment than cryptography that only seems to be used as a default disagreement against cryptography.,1
"because he doesn't understand bitcoin there is bitcoin as an asset there is bitcoin as a payment network the payment network itself operates more efficiently with fewer fees than companies like Western Union is also safer and transparent than fast buffer should ask how much has been developed quickly and that's more or less the basis of bitcoin costs as a bitcoin payment network is like fiat, except it is more neutral and universal than most fiat out there",1
eth is too expensive and doesn't deserve to be higher alt,-1
bitcoin has been more stable than these populations I chose that are less stable.,1
I still see a completely speculative instrument that I doubt will call an underlying valueless asset other than the technology on which it is based could be quickly adopted by the federal reserve banking system blockchain I see an unregulated market that is likely to increasingly face regulation at both the national and international levels as we move forward,-1
mega alcista en dot,1
"Yeah, more or less this other blockchains have definitely improved the kudos technology to their devs but eth has so many brilliant or excited people working on it at least x the number of devs and it could be conservative so etheruem and layers in ethhereum are likely to stay here for some time and be a ground testing ground for things for a while doesn't mean that other things aren't going to thrive very much the opposite just don't expect ethhereum suddenly to become null at any time soon",1
The same thing I spent annoying months that prices were high and now I have another race in it,1
tying it up is kind of an open secret that doesn't have enough funds that will eventually crash and it's going to end everything big.,-1
literally on the same flippin boat made with these crappy chips that depend on news plays and tweets,-1
There have been three fraudulent do kwon scam coins and the basic terra currency team look into their first failed stablecoin where people lost all moon v ust and now the moon v scam this guy is going to ruin Crypto for all this is a case in which scammers do and terra have to be responsible and make an example of hope,-1
He's just exposing how useless cryptography is.,-1
eth is big but matic is the way,1
"If he's supposed to act like a coin, it sucks.",-1
research the stock of bitcoin to the flow model if it is new you wouldn't want to bet against a m btc s really if but when sustainably above m i d say around the real question is what will be the purchasing power of m usd in years,1
Buying there was a dip.,1
ethereum is a reverse robs the poor and gives rich gas rates pure extortion and only a matter of time before alt coins close in ethhereum,-1
"a is a loss, but then a is another loss that can always get worse",-1
Also your BTC is your BTC government cannot take from you,1
dollars are going down bitcoin is going down but the purchasing power of the dollar has gone down and btc is still in the middle you can see the massive adoption of btc in the future,1
Let's call it what a ruggull scam and the ponzi scheme is.,-1
"They don't hit me, but the moons really don't have a utility and it's too easy to get them for shit.",-1
yup still mega alcista in canary points chain kusama also,1
acab all cryptos are bad,-1
"Such negativity bitcoin has often maintained well bargains with nasdaq simply because traders trade, but there are moments of divergence that has surpassed a nasdaq bassist this year, so it is avoiding not a magical hedge, but it is a very strong financial network without hacked with a finite offer btc domain over another crypto has been increasing again as uncontrolled inflation weakens fiat naturally btc will cover to a degree that historically has been more volatile, although so cant depends on it as a short term hedges",1
Laugh all you want but it's practically inevitable that a cryptographic currency will take over as the world currency that would take a pretty big investment at this point so it's not bitcoin but I guess it's possible,1
bitcoin literally produces security in the order of times greater than the fastest supercomputer in the world,1
I'm buying more.,1
moon is going to be the easiest x this year is a fully developed ecosystem in a box soon these fuses are going to be whining about losing the boat lol,1
link is good and cheap right now I've been increasing my chain link position lately,1
I love to keep filling bags at bin bargain prices,1
You're not going to lose it all not bring out moonlight excuse me while I kiss the sky but wtf do nt bring out moonlight as a matter of fact bringing it shit is the perfect example of how a higher coin can be erased in days and why keeping no matter what is stupid hodl is for btceth,-1
"They haven't been in a while, but the last time I visited rterraluna was completely invaded by these separate moonbois, but only a few more pages were people contemplating suicide mind hallucinating",-1
Congratulations you have achieved level of understanding of bitcoin no one knows how many levels there are i m in bitcoin level is the most beautiful invention ever,1
Did you charge how stupid I have an erection for BTC but I'm pretty sure most cryptos are scams made to jump on the bomb train?,-1
"I think this good luck extends to me the novelty of polkadot is a way of seeing opportunities that have never been seen in other chains before balance, for example, it has a very low interest rate to borrow not to talk about the low guarantee",1
"Yeah, but Doge's going down much faster.",-1
as a developer yes is good in large part because of its first advantage of moving etherum has the largest and most active community of developers by a factor of I would estimate that this is a massive advantage for any technology platform that means that there are great apis documentation tools and resources that make it easy to learn and build with has a dark question about the feature that reconstructs there s probably some stack help guide or youtube tutorial to respond to it and that the community of massive developers also makes it much easier for startups and companies to hire engineers who already have experience and for any new skill again that often just google the answer that probably isn't what I expected to hear that they probably wanted a tps analysis or stairability ethereum chose the most logical solutions for scalability a lightweight post-striated layer system and excellent layer options for high transaction performance and because they have focused on that goal longer than any other project that are by far the most reliable robust and decentralized smart contract platform available,1
right ada is by far the leader when it comes to stacking I firmly believe in this coin,1
omfg your going up,1
"crypto winnings depend on a bigger fool to buy after you've bought it, of course, someone with their bitcoin portfolio going to shill that the reality is that crypto has only really exploited so spectacularly is because speculation loves low interest rates and easy money and that's been the world we live in since the origin of bitcoin while monetary policies harden speculation shits the bed as it is happening now",-1
open your eyes guys don't give their funds to the manipulators,-1
correct xrp is pure speculation and zero delivery,-1
"It's like the only stable thing in stable currencies is the name they go if it's not really linked to a dollar anymore, but too many don't care about it.",-1
Don't stop at the altcoins because that's how you become homeless.,-1
Can't go wrong with eth,1
I didn't invest in xrp when it crashed because it was a much more risky option than other projects at the time doesn't make sense to invest in something that's having problems almost all cryptos are going up in a bull market I don't feel bad at all for not investing in xrp or a little bit.,-1
The network is a disaster that constantly has problems. I can't even send sun to my defi portfolio because it's still failing.,-1
Bitcoin is going to win traditional finances is obsolete hey guys let only trade during hours of work lol hey I can move this without anyone's permission,1
I agree that this is why I am holding most of my crypto in currencies in which I believe and use coins with promising technology.,1
"Well, I think Crypto's here to stay, so I'm happy to increase my position on BTC and ETH.",1
The roller coasters go back up this is what is called the view from the middle down.,1
shit coin shit coin nothing nothing laugh nichts,-1
its very good chain safer and more decentralized other projects could look good because they sacrifice decentralization for the scalability that is useful for a lot of people until it is,1
I'm really excited because I had cash at times like this.,1
ethereum is safe ls built on top of a secure network includes everything you mentioned as best on those other networks that are not even close to ultrasound money,1
I don't like bitcoin.,-1
I've lost k to make kwon that was a third of my entire wallet and for me a lot of money I'm really made with this guy,-1
They are moving from a ponzi scheme to grow it very quickly is like lularoemonat for uncle bros lmmao,-1
Because a good portion of the alts are actually built on it ethhereum has the first advantage of the mover and it's really good wouldn't be where it is today if I didn't have both,1
I see a rapidly deflationary market where those with more and more wealth pursue declining returns because they keep coming back while they keep trying to trick other people into buying because without someone holding the stock market they crash,-1
c nt go wrong with btc and eth,1
your gon na bounce again for the weekend,1
"The macroeconomics look like shit, all you're looking at is a bull trap.",-1
don't worry btc k end of June,1
the main point is that bitcoin lacks any ability to give it access to cash flows,-1
You're defending a pile of shit with a postitnote that says dollar as a legitimate asset tracked to the dollar isn't shit in disguise that's why the pin didn't have,-1
bitcoin has just started and its issue has been lower in recent years after the fusion ethereal will have both superior technology and monetary policy and the market cap will continue at some point,1
