text,sen
the rates on the basis of coins are ridiculously high I tell people with accounts from the base of coins to transfer to gdax and retire there for free which reflects on the question if they can do it for free in gdax why nt do it for free at the base of coins,0
"Oh, look, I was right about today, Bitcoin.",0
btc buy pressure alert price trade around bitcoin crypto btc,0
"Normally yes basically as safe as any hot wallet if you do it properly with surveillance towers, etc.",0
Michael Saylor bought bitcoin for El Salvador bought bitcoin for Elon Musk bought bitcoin so they are not smart whales and do not want to follow them follow those who bought in the market funds,0
feels like a quick wick coming btc,0
altcryptocom take a look at sani with extreme burnt amounts of lp tokens and most important with long-term vision choose sani and keep for more profits in the future bitcoin sanin,0
I have all the parts for my complete bitcoin node waiting in the case of exciting cryptocloaks times,0
a new bitcoin price zone has just been detected going down to unlock all detections of btc area join our group of telegrams pm us if your trial period in the group has finished prediction no,0
Long position taken in pump dydx that btc btc,0
everything is human behavior and for everything that is happening I think this is an excellent time to enter safely and slowly not greedy metisdao sovrynbtc btc eth the graphics don't say it yet but reflect things a little slower,1
that alt coin that you are buying to we are going to start the bitcoin cryptocura discussion,0
binance recovers m in backgrounds connected to the ronin exploit btc cryptonews nft bridge,0
bryce Harper massive philanx chain rocks ahead of Philliesbraves game mlb bitcoin sports betting,0
How sweet this is gonna drop my D.C.A.,1
"shanethal tomarstrolight will regain its strength the movement towards k has begun, but there are some important things to consider waiting k soon btcanne is a super underestimated specialist who has great ideas ta tips in btc has been taking them seriously following her",1
People will complain that they didn't buy any more,1
inflation is one of those things that everyone sees no matter how hard the establishment tries to hide this advice about eating potatoes for cheap nutrition is currently one of the best posts in reddit here s a real lifeprotip if you don't have bitcoin re ngmi,1
btc d back to the July trend line,0
btc last block of block information contains transactions for a total bitcoin including block size reward blocks bytes,0
"bitcoin is better to be used as peer to peer that works better that way, but has a lot of fees now",1
bart is back bitcoin crypto btc,0
"coal oil and gas companies have received t n n from banks since the Paris climate agreement in, but bitcoin mining is a big problem hmkaaay neutral feeling the world's largest banks have brief",0
Internet scarcity was a one-time discovery that cannot be repeated because resistance to replicability is the invention knut svanholm,0
of this scalp long btc with microscopic benefit two wicks rejecting an upward thrust and equal bass below can re-enter after being swept,0
bitcoin ecash is the continuation of the bitcoin project in cash and continues to be developed by bitcoin abc ecash ecash revenue protocol is reinvested in ecash funds are allocated annually by the board of the global network gnc,0
twitter s btc plan of action against coinbase oversubscribed nfts more news crypto btc,0
I had a purchase limit on the cash app to buy some bitcoin and passed,0
I'm so fucking confused where this is going.,0
wejespn adamschefter btc invest with cryptisophia today and watch your life turn start winning daily contact management via telegram cryptisophia,1
apomplian vulkania supply million burned and distributes the remaining million to the circulation of the portfolio is also millions and around big jokes projects are coming one of them is the crypt league starting this month do you think zenkin will make vlk mdtusdt btc,0
in squawkcnbc saramucci says btc will hit k this year we like we have more than half a billion in bitc,1
bitcoin changes planet earth not a particular part,1
"your question assumes that there is only one btc cryptography is only the current market leader and has the name recognition may higher technology pass by perhaps not in the immediate future, but perhaps at some point generally superior technology wins",1
just away from ath btc,1
between May and May shiba inu saw a sudden increase in popularity in the price of around a high of all times according to the data of coinmarketcap through newsweek cryptocurrency investsmart bitcoin,1
Bitcoin and Crypto become more useful day after day hopefully a video falling for you tonight,1
It was k the fuse below. We're in the clearing now. It wasn't news driven dip.,0
look at the graphics could come to an agreement just below it's not possible,0
shhhh cash application is the king less they know the best lol,0
I'll find lambo under the bridge.,0
"If it doesn't break, don't fix it, bitcoin.",1
Bitcoin is the teacher in teaching us patience,1
Holy shit the last few minutes better than any television that's sure,0
"i m finally able to pull the trigger on the investment I was going to make a month ago when I was around k regardless of which I'm finally able to invest after I want for so long i m investment k atm i m I'm not sure which place I should go to do the transaction at first I was going to coinbase because apparently it's easy, but now people are telling me to use gdax then when I opened this thread a guy said he's transferring from gdax to gatehub I've never heard about that, so now I'm just asking for advice is fine to use cb if it's not really all in btc his I don't like the day trade and constantly change my coins to alts and trying to make a daily profit",0
jeevsthecurious now i m in love btc has a finite supply can be owned by anyone in any amount using a cell phone or internet connection is completely secure globally cannot be controlled by any government can not be hacked,1
Indian giant payments paytm could offer bitcoin services if the government makes crypto legal says cfo via coinjupiter,1
"Ha ha has you been stuck in time come to join us on it s a messy year, but you really should catch up with the rest of us make it come out of and get in real time where bitcoin s technology is all it has to be to function as an investment hedge against inflation join us where we know that for a fact that the vast majority of all bitcoin transactions are buying and selling and trading as a use of investment currencies very well could exploit once enough people own btc as a speculative investment, but there is plenty of time for development to recover once the demand for currency use grows coins take a long time to win the massive adoption and years is a little blip there no rush comes out of the past take the first step",1
again the whole world does not revolve around the US so it is unlikely that this news affected the rest of the world and its crypto,0
I move stock from the coin base anyway just curious if anyone else had connection problems.,0
Cryptohelspawn I think it's a very smart idea to give corporations power over their currency sarcasm nations let them print money which can go wrong bitcoin tied,1
and how your crypto btc morning begins,0
If I had to speculate the need for bitcoinlighting use for the remittances part is that it makes your entire business model work trade somethings you mentioned that it's a victory for him and a victory for the user plus it shows that lightning can scale this is great,1
a bitcoin break to new all maximum times for index btcusd per trader btcusd,1
whales going after those long and lol btc bitcoin,0
Suscanicola ryanvieira hodlberry torchain also what if I told you there are self-reimbursement loans in bitcoin without liquidation risks,1
countries paying in bitcoin which is something new,0
My personal prediction for bitcoin the next few days today we have a lot of volatility due to CPI data almost millions of dollars are settled we get a strong support every time between k showing bullish for me my ta btc crypto btc,1
Monday August as in hours Moscow time we can supply as much as btc in real time blockchain price from us is worth coins for each of us b we can buy as much as it is worth btc in real time blockchain price btc less service rate,0
encryptoverse so exactly the trading of bitcoin with high leverage and overly excited to only advance in three days after falling,0
Thursday has been a predictably volatile day after inflation data were released bitcoin dropped to k its lowest price level since September st however as traders were in the middle of stopping btc bleeding the sp quickly recovered,0
"It's pretty good that the people of the nation don't understand our banking and monetary system because if they did, I think there'd be a revolution before tomorrow morning, Henry Ford Bitcoin.",1
microstrategy puts another m in bitcoin price despite crashing below k through bitcoin descryptmedia cryptocurrency microstrategy,1
meitu now has millions in btc and ether after the last bitcoin bitcoinnews purchase,1
"Sure, Mr. Nostradamus, we keep going up billions.",1
If we fuck now it would be the most demoralizing bitcoin event good thing there's an offer shock,1
Everybody calms down shit Bitcoins done this before and then gets to new heights people act like they never submerged and recovered before all investments should be treated as investments if you were looking for a quick pump and dump well already done goofed could also hodl at now,0
link purchase at blockchaincom explorer,0
I remember being in college researching how buying bitcoin was about a currency I was afraid of losing didn't have much money I didn't understand investments they don't have regrets It's all been a learning experience,0
Sometimes when time or trades don't go their way it's best to sit down and relax it's not like the sign will hang you if you don't get your fiat for tomorrow enjoy your hodlidays and let the long ones buy the dip take care of the rest,1
"Thanks for the support, people didn't risk anything I couldn't lose, so I don't care about hodling for long-term applause.",1
zbdplay my favorite for sure great integration bitcoin i m expect more sarutobi is the best for meplevor zbdgg,1
There's this cryptocurrency sending a monthly newsletter from and saying we're going to launch a mobile app in the next few weeks bitcoin btc,0
bitcoin in the early rise this morning in the long term we see that there is only one way of bitcoin price going and that s up if you also feel this way to prepare for our bitcoin leotard coming so that you can also use that bitcoin orange with pride and passion btc,1
New York s next mayor wants to be paid on bitcoin newyork btc crypto,1
big names big projects great opportunity to buy a trilly to make a milly mcontent bitcoin documentary the saviour vs the world bank falls in September where s all the safemoon and dogearmy peps know how it goes,1
Stock market people tend to think that bitcoin is high now wait until s k per October k at the end of this year the price years from now I can not expect bitcoin following jorgevr tweets posts tips and predictions that I have added massively to my holdings has been impressive,1
"People believe that btc mining is and will always be harmful to our planet, but that doesn't have to stay as well as the hydroelectric whale club is using renewable energy to make the owners of very rich mines and save the planet at the same time.",1
Or it was supposed to be three digits people tend to talk about their position and amplify it especially around these parts.,0
Yes very unusual I don't support enough today to start the race let's hope it starts soon,0
btc has introduced into the processes to accelerate the realization of the mirror reflection of heaven on earth within the perception that is why I am an evangelist btc,1
bitcoin day h change usd is reduced to indefinite with the price to btc bitcoin,0
Can anyone explain to me why banks don't make payments on the weekend that's not how people manually do bitcoin correct this carl b messenger,1
which is a small step for an exchange of a giant leap for beer from the crypto community for usdt market spot allows less privileged communities to join the bitcoin market cafeswapfinance can take on the failures of any of our innovations and turn it into its success,1
printing money doesn't look like it's finishing bitcoin,0
new bitcoin report file entity digihost technology inc name frb record declaration ex reporting for the form,0
I'm not sure I bought gbtc on my roth ira account through fidelity,0
Most of them have btc as their trading pair so not so crazy.,0
I think this project is very strong and beneficial because the team has made great efforts and great development to make it the best btc crypto minutes,1
bitcoin btc amount of last active supply and barely reached a month high btc month previous high btc was observed in the June view metric,0
Bybitoficial s wsot starts June th am utc still time to register and join the team tealstreet bitcoin bybit wsot,0
beautyofhelin who is nt ready I have the feeling that Bitcoin will fall as one of the greatest eye innovations of the last century still in the ball system will change the cause of history,1
is only an abc correction of the bitcoin btc wave,0
Welcome to the full btc journey for btcusd btcusd by voxhit bitcoin btc,0
blk back to blackcoinorg for another update of the chart the last few days have shown some interesting developments higher volume a peak price and a long-term output of its descending channel have put this crypto in a course of positive accumulation btc,1
"bitcoin and ethereum are trading slightly below their new funding rates of all-time peaks and future premiums are in positive territory, but not as overheated as before the btc eth ethbtc sun point atom ltc",0
bitcoin is a Christmas,1
"Mikealfred with Celsius presentation chapter bankruptcy hope regulators do not use this opportunity for bash bitcoin, but fast track legislation to prevent bad actors like mashinsky from using customer funds to wager",0
gold market top t bitcoin market cap b progress bitcoin surpassing gold,0
so much to learn that I enjoy continuous learning that goes along with bitcoin,1
This is what I've been saying could be that it's one of those in or whatever the number is guys who are flexible enough.,0
c mon big tuna let go,1
care during the night usd up to jpy up to gold ustyear yields down bitcoin dn riskoff all over the board do not buy future pump emini make makers options trying to kill some vix uvxy call premium,0
moller is a long time bitcoin bull and has said he started to buy the coin in investor Bill Moller in crypto bitcoin is digital gold youtube btc btc,1
Exactly the people who talk about a whale attack think that people with a lot of money invested in crypto live their lives playing mind games against an ocean of joe doe s people investing their money wants to make the money period,0
already sent my email if spot gets approved gbtc gaps until overnight few,0
long ticket skl price stop loss link in bio tz btc bitcoin skl,0
In this episode of the podcast of the magazine bitcoin the host csnarks sat with the infamous personality twitter bitcoin and troll udiwertheimer to discuss why the faithful hardcore bitcoin should not be so concerned about the altcoins,0
bitcoin block bytes btc transactions reward for more information visit,0
the target for graphic btc s h is currently in as btc s price remains broken from its resistance trend that is positioned according to the technicians to scale to achieve this goal and this can still be early stages bitcoin can go,1
more than profits and m volume in the sky pump per megapump the most powerful bomb in binance history no,1
I think he's gonna start running next year.,1
Can you detail in the password-protected recovery seed what your method of protection is and where you store that looks like the weak link to me,0
"What if it's a trap that sells in k and then up to k in one night I think you shouldn't put all your money in it you just have to keep a small reserve in case of a big accident to buy some fresh coins, of course, if you can time the market and sell right before the fall it's time to open the champagne, but in the long term bitcoin always win",1
bitcoin btc current price gbp you liked reading my blog you can tip me in bcqtuzhlzezuueatkrrhaym,0
ars is satoshis now satoshi is ars now bitcoin,0
gm and welcome anon btc,0
pricedinbtc which is because bitcoin is free,1
Looks like everybody's talking about the sauce.,0
fschaeffler btc shib king,1
when btc is a thousand for whom he cares what he bought in,1
Never sell only hodl,1
mudon s first page in October bitcoin,0
bitcoin week altrank is down with price up to btc bitcoin lunarshare lunarcrush,0
This is fun to see Bitcoin,0
BTC to the moon,1
whales are stacking ape ftx sand bond ftx while bullish feelings hit the cryptomarket bitcoin,1
I'll worry if it doesn't happen sooner.,0
brokers are encouraging uk customers to trade with foreign firms fca the regulator has already taken action against some such brokers read more cryptocurrency bitcoin forex,0
google has launched a new cryptogram search feature that synchronizes etherscan portfolio address balances but why not start with bitcoin goog eth,0
a rookie in revolution tho has the base of coins and Kraken ready,0
"the secret with bitcoin is to have patience buying on a consistent basis through once a week or once a month, but have a plan stick to it don't think about your short-term long-term goals bitcoin",1
"as network growth continues to grow at its fastest pace in history, a series of short-term catalysts could solidify the network effect that is being formed and actually bring billions of people bitcoin",1
Peterschiff Michaelsaylor bitcoin this is the new rebirth via youtube bitcoin is or,1
from the telegram channel btc jasmine crypto premium btc eth bravo,1
messari ceo ryan selkis en bitcoin stablecoins y crypto regulation crypto news bitcoin cryptocurrency live,0
bitcoin mempool tx stats at last minute mean max th quant nobs block th,0
check out my list of articles in opensea via opensea bitcoin,0
johalmiles did btc ceo confirmed that,0
Why are ugly wicks hard to leave behind,0
ralf glabischnig in the crypto valley and crypto oasis btc cryptonews nft,0
You will want to give this one a listening lawrenzelepard hits you out of the park we cover a whole series of macro topics the potential recession rotation brics coins the European energy crisis Japan bitcoin and much more let us know what you think,0
"ps note that I have added two columns that I think will be useful and day balancing changes I have also added a third column volume the average day cant really explain in a tweet, but I think these new data will provide valuable information in the future go btc",1
What price we'll see first for bitcoin,0
incredible airdropdet and beautiful project I hope this project will be successful to let s join and support guys aagameruga atriantoko gillankperdhana airdrops betterdigital bitcoin,1
reality raoulgmi Maggielake maybe I asked the wrong question what does a bitcoin correction mean for the stock market dow nasdaq,0
impact on the Haithamalghais market in one direction before the energy transition ministerial meeting in Bali bitcoin,0
Coinbureau our analytical team has done a detailed analysis with respect to btc and its rate of fear and greed is neutral at this time with the price of usd so what do you think about the current status of bitcoin,0
"Cash is not traceable and many countries would still allow this to slow down the adoption of bitcoin or may even increase interest, regardless of whether there is no effective way to prevent the entire bitcoin exchange from slowing down perhaps, but not to stop that it would really benefit governments very much in the long term to adopt and adapt",0
what a btc date we've been waiting for at the bottom,0
thedustybc i m still long in btc which is more advisable than short with the determination to become rich by possession and accumulation of more cvp which is also a great altcoin for long-term investment and is currently one of the hidden and productive gem in space,0
watcherguru wlementeiii only one decentralized bitcoin protocol,0
nftholding Darrenpromoter btc is consolidating around the level k bassist impulse is exhausting with lower levels in the short term a possible stage for a liquidity hoarding between k and k is likely and everyone follows kimcaden she is a bitcoiner underestimated her tweets tips have been helpful,0
And from you cryptic nerds know you can grow bitcoin in tarkov,1
btc btc k support,0
joncomms equal for btc,0
bitcoin statistics each hour block hashrate ehs price last h fast fee sat slow fee sat tx unconfirmed diff t diff change in block next diff in blocks,0
bitcoin mempool rate summary in the second median th quant nobs interval block height,0
Next year will be amazing.,1
"Stop thinking about how you could have made more money by buying dips or selling highs seriously forget about it you are not going to pull that consistently sometimes you can most of the times that wont in an upward trend like this in the long run you will lose bitcoins like almost everyone who can still make money your loss is compensated by the upward trend just not as much as just hoddling will so at this point buy and seriously wait in a week or two or three or four will have a profit made in the near future there will be extreme dips and if you will benefit even more if perfectly time sell buy the dips, but trust me that you will not be able to be able to",1
Don't worry about it look at the larger picture k will be seen as low in ten years of time so it has ages to keep dca ing this milestone k is just an increase of a couple of hundred dollars at the end of the day and it's nothing near what reprojected,1
buying bitcoin is more than just getting rich its over dismantling the main states control mechanism fiat money getting rich is just one side affects a positive by choosing freedom and voluntary peaceful money over money with strong permission,1
ada update checkout bio link for cryptographic signals doge ocean btc og xrp dogecoin cardano enj tomo sxp sol eth bitcoin,0
The princeysov people think that bitcoin is high now waits for s k at the end of this month k at the end of this year and everyone should follow abtc she's a super underestimated bitcoiner I've been following her tweets and tips seriously I've been doing very well btc,1
Wait till the full moon and you'll see,1
cryptoednl tend to agree however a rational seller btc would not sell bulk volume on a long weekend we do not,0
"It might just happen, but you'd think the shorts would pile up on more things they have, but that doesn't have to happen for a long grip.",0
"bitcoin approached that area of fibrillation everything seems bullish, but this is a key obstacle for hitpass to see btc behavior",1
continue to accumulate continue stalking to build bitcoin shib torg dfi ada xrp bnb eth,1
In years it doesn't matter if you buy bitcoin in or the most important thing is that you bought it now with bank transfer and credit card or apple payment and google payment,1
bitcoin block bytes btc transactions reward for more information visit,0
yellow icoffenderii first day out bitcoin,1
bitcoin ethereum are trying to stay above kk this incoming red weekend again jumping for a begging leg down here so we can finally be completely oversold thoughts about btceth falling k this week,0
for anyone with empty drypowder is not able to take advantage of the sub k bitcoin rn breathing s well dca today is worth the same as dca when bitcoin s return to k and we are a long way from there if cant btd save for the future dca,1
daily purchases on the strike app have me up since I started December,1
"Get out of here, no, it's not.",0
fasb settles fair value accounting for the measurement of bitcoin cryptographic assets,0
Incryptoverse agreed that it is time that bitcoin to strengthen there are no excuses not to accumulate at this time,1
bitcoin by any measure is still a foam of clear beauty and reaffirming in the last month could still go down b,1
purse offer for crawfordporter combat game for sept bitcoin sports betting,0
btc leaf tweet derivatives every min cme delayed min gs delayed min and oi shares out,0
"iyiprofil all this is going to fly soon, but we have to look at alternative hard forks like bitcoinlatinum are trying to bring a better green and cheaper btc really think that forks can keep improving at work satoshi s",1
lefscrypto if you really understand Bitcoin you would never bet against Bitcoin is bullish if you are trading s payday everyone however you must follow lightning it is a super undervalued bitcoiner I have been making great,1
btc price h change no stunks bitcoin btc,0
absolutely love bottlepay app beautiful looking ui and recommend it to all my partners bitcoiners bitcoiners stackkinsats btc,1
makeroftools muatafagmi adamus blockstreamtalk funny how people quickly forget this is about money not technology money is just a book of accounts keep score the bitcoin problem solves is just score or sound money in a decentralised linear way is the only way because your a book of accounting everything else in layer,1
Buying the dip is a great way to average buying price down that makes your bitcoins cheaper overall,1
I only have one lil plus btc and et to calm the smoke shhhhhhhhhhhhhh k shhhh,0
nftworldnews that would be great it is very possible that pow coins die except bitcoin maybe eth could beat bitcoin I think the randomness test will become another protocol that will be greatly admired in blockchain technology as its popularity increases,1
Elonmusk btc mtn money makes us rich medicalchain makes us millionaires,1
