text,sen
"Well, I'll tell you what I've been pretty bass player on bitcoin though the wyckoff model looks pretty bullish that's how you get to k btc still think we're going to see the biggest carpet pull in history before k this could be a crazy good time for the alts to pump soon",0
Stay focused and consider your goals that would not regret trading cryptocurrency bitcoin btc bnb huge adjustment is inevitable,1
when the world is becoming worrying and unpredictable there is great comfort in knowing that there is always another block like bitcoin clock,1
the cryptographic world needs to follow your heart which is a heart that changes the bitcoin world nowhere,1
duwopyt bitcoin is holding support above k after a series of breaks during last week upwards seems to be limited to k k given the deceleration impulse thetradinqchick is a super underestimated bitcoiner I have been following your tweets and tips seriously,0
follow me in betfuryio let s bitcoin hunt together get an exciting experience on the platform of igaming wi,1
bitcoin is real money in,1
"Billnye, how much bitcoin do you have?",0
depends on the year or within the year,0
days for what s gon na pass after the days do not tell me that regon na dip even more from there because I do nt wan na see that,0
tesla now has approximately btc this is just an estimate of the reason behind btc cryptocurrency pump,1
It's really good to stack more and more like the passage of time that we would know the value and the value ahead in the future.,1
bitcoin points for daily low negative fulcrum,0
larry dunlop kirk mappherson regan judson btc,0
strategy hlh atrd dec utc short jst longgentrytrigger outputtrigger ent lastprice btcusd btcusd perpetual contract in bitmex,0
rumors etf means deleted discount,0
ergwl ergwl unlike ethereum bitcoin is not a company there are no employees or contractors to shoot bitcoiners and maxis are just people who believe in sound money and focus on solving real problems enjoying your distractions,1
Some of you sold don't make a habit of it.,0
only fyi as a general rule you should never reveal the amount of btcrypto you have on the Internet,0
If you like bitcoin as a coin why pay attention to the price,1
"Wow awesome wanted to ask something about this what s it like I mean to be a lightning node operator are always net negative weeks where rebalancing costs more than the fees assigned the previous week is what I'm saying completely false i my curiosity about it and looking at ways of low effort stacking with my existing sats and thinking of setting up something in my htpc to do this, but I've had nothing but bad experiences using lightning in mobile applications to mess with taps and try to get cheaper deals from buying on strike",0
bitcoin approaching a purchase sign on a daily basis,0
It only takes two things to be happy with bitcoin to secure your own private key extend your time horizon that it's buying price doesn't matter,1
Finally we get the long green candle in nice bitcoin k a k,1
Now here you go again you say you want your freedom well who I am to keep you down Stevienicks in Bitcoin,1
altcoin btc eth bitcoin inches higher ethereal and altcoins accelerate,1
ta time btc btc knows s way supercycle wave,1
"Well, guys, check your charts. It's a four-hour green sailing hour for Ath.",1
I thought K was the video of that fabulous Indian dancer.,0
Robocop scenario re deliberately let it burn so they can buy again for cheap,0
Guess what comes next ada btc,0
I'm about to ric flair wooo noisy in my lab chief knows that when I take a day off in k,0
I'm trying not to fuck right now.,0
btc is now in,0
India s Prime Minister Narendra Modi urges countries to collaborate in bitcoin cryptocurrency bitcoin btc,1
bitcointine bitcoin volatility index is ready for another massive move next week could be the beginning of a new price trend keeping your eyes on it bitcoin maximejosh is a super underestimated bitcoiner I've been taking your tweets and tips seriously I've been doing great following it,0
code when registering and makes a deposit that will receive a value of dfi btc btc cryptoairdrop airdrop,0
"If I were in New York, my bitcoin at home just to protest this nonsense.",0
you today crypto show it with this love in the valentines unisex ledger T-shirt buy it today with free shipping to just find it here cryptoropa bitcoin,0
"There is no need to apologize, while millions are nothing to laugh about, I think the influence of early and mid-month options is less significant in price action than end-of-month ones, as they tend to have much higher volumes.",0
ethereal before bitcoin ath,0
almost all of the centralization points of ethhereum are in America most of the developers chainlink multisig for defi oracles uniswap and opensea usdc seems that bitcoin would be a better choice for Russians with their energy resources for pow mining,1
silk path bitcoin hideout will be used to pay ross ulbricht s million fine decipher actadi btc bitcoin,0
"I always thought the mentality didn't make sense, but now it's mine.",0
biden and his experts believe that inflation will be temporary for two weeks to stop the spread said similar experts how long is time preceding set says years bitcoin helps to fix this,1
Hello bitcoin btc,0
Why so much hate in this guy that can't be inferior yet without trying the bottom again first this looks like a fake bomb and the volume of most altcoins continues to decrease from altcoins btc midjune,0
open for investment trade bitcoin btc investment weekly profits,1
This is the reason why you don't sell panic during dips remember shib pulled it up before making a peak x to buy cryptocurrencies cryptocurrencies btc shib diger,1
kim jong gravitas a coin a new ideology for North Korea paymeinbitcoin bitcoin,1
They changed everything to publish it alone.,0
For each seller there is a buyer is just that sellers are willing to separate themselves with their btc at a lower price than the market price for some reason the seller makes it go down because they are selling without sellers no buyer can get btc bar mining that buyers can not lower the price drive it up to sellers can why a seller is selling lower price on the market or even below what they bought it for sellers losers fear that they will be afraid that btc will go further down and that they will be the winning sellers and that no one wants to be the bearer of the bags because they need money and btc is the last of their liquidity so they have to sell it at the current value and they don't think it will go any further than the winning sellers who have bought those btc at a lower price than what they are selling it is even below the current price of the market and that they have to sell it at the current value and they don't think it will go higher and that they want to be the winning sellers if they feel that btc at a lower price that they are earning money they need more time and that they are going to have more money and that they will have them because they are going to have more money that they are going to have money that they are going to have it more and that they are going to have money that they are going to have it,0
itching to make a stack of lil btc,1
"Not for my chicken, sir, you'll do that to me in two weeks, but maybe you could be interested in rooster thighs, three eggs each.",0
mstr there is someone who has done the job in his free cash flow and how much is required to cover his debt service in his lazy bitcoin i m and have no position but my dogs are quite curious,0
davincij buy a whole coin btc,1
benefit of btcusd my goal is to buy more btcusd in itself less than I bought last time to reduce the impact of volatility on the overall purchase and sell it all in click to track btcbytorssus,1
"bitcoin under k is the safest purchase you can do the same for k, so spockyourself k btc everything is fine",1
many alts have been broken down much below the crucial support and some life long supports also like bel akro unfi sun etc jasmy etc is just a new proof of life support not to consider as mini season alt or cryptocurrencies bull rally btc alts,0
I want to sell a little btc for money to raise nk funds for an emergency right now pls anyone on the timeline purchase discount guaranteed deal will be made through video call one in one skee rond pls help retweet your urgent for someone,0
having patience the bottom is more likely in the carrot indicator says k in a month is a possibility,0
It didn't take long for everyone to use bitcoin.,1
af nfts nftcommunity bitcoin,1
Nobody tells you life is lonely after you've taken the orange bitcoin pill.,0
af nfts nftcommunity bitcoin,1
"Martiniguyyt I wish I could sell my father's house I'm bankrupt because of the current market, but I have faith in btc",1
Please everyone make the best decision for you during this time I keep seeing repetitive phrases such as buying dip whales are loading or selling crypto winter is coming in no one knows where the price is going and especially nobody throws repetitive a reddit lining simple rule of investing if s bitcoin or any other asset not investing with the money you need in the near future so many people get carried away and think what the damage is this could be the chance of a life could be but it could also be bankrupt no matter how bulky you are in bitcoin there is a chance that this thing falls much lower than this and never recovers to where today we are unlikely in my opinion but it is possible and anyone who says that you are not shedding your hopes and dreams not certain if you realized at this point that you have made a mistake and need to sell as you need the fiat for life expenses in the coming months and you can not risk to lose any more shame you have made a simple mistake that thousands of not millions before you have and are deeply in psychology let it be a painful lesson and you do not miss it and you do not risk to worry anymore.,0
Longs out were bought again netlongs reference checking the fingerprint statistics and comparing it to the reaction previous to it we always had a rebound a few days later will be different this time or we need an ema test to get fully sent BTC bitcoin crypto,0
passive income is here to join ember with my link and we will earn bitcoin daily crypto blockchain,1
Mirbtc but it cannot be denied that bitcoin is bad for the state monopoly,1
make any bitcoin bros want to buy this aluminum cube that I made in class hollow light welding as shit btc world shipping included s super light anyway don't miss,0
"you need a superstrong password to encrypt your disk, but you don't want to record that password anywhere passw of two factors",0
Good goood let the salt flow through you.,0
Imagine walking to a kiosk to buy some bitcoin while in the mall or returning home from work wazirxwarriors indiawantscrypto btc,1
bitcoin crypto el salvador buys more bitcoins as the cryptographic market falls,1
interesting level in BTC waiting for some rebound,1
Looks like cathie is in automash buy mode at these levels millions of gbtc shares in the last week bitcoin,1
nepalneedscrypto day nepalneedscrypto is a protest against the government's decision to ban bitcoin and crypto that are changing the world and we don't want them to leave us behind Join us and post Nepalneedscrypto hellosarkar mahabirpun,1
Houston stars vs texas rangers bets bitcoin,0
Peterschiff there's a difference between anything and the people of BTC control the price not the profits or Ceo or even the countries this was the idea from the beginning and most people who arrived so early just believing they won't sell even if it's going down,1
the friend s will pump,1
fsamueltolani home sweet bitcoin,1
"dylanleclair with the current price of usd bitcoin is fine on your way to the moon the price may feel incredibly high, but that's an unrouted emotional feeling and everyone should follow kathycryp she's a super underestimated bitcoiner who has amazing written tips tweets",1
I have to point this out another key person in the kadena foundation was Dr stuart having that is the co-inventor of blockchain technology and the author most cited in the bitcoin whitepaper kadena cap is built different bitcoin cryptocura,1
It's like Saturday never happened.,0
there is a lot of meme support in k,1
"some are seeing some are investing and withdrawing their profits, while some still have doubts to stop looking and start investing so that you can also start withdrawing contact management to start winning bitcoin mrsrebecca mrsrebecca",1
i m buy crypto for plan to retire in years instead of more years crypto cro bitcoin eth link grt uni,1
btc everything is under btc bitcoin control,1
btc usd just transferred from pseudopnxmhxtcvaytauhjpypwnkgpv to bcqxzsgszgatzdsalpnsgqyfuwckngg tx hash bcffbfeeceaeeafbfbbbedda bitcoin btc,0
justintrudeau absolute bitcoin garbage is the way,1
the history of the bassist bitcoin,0
the ledger's live software portfolio only reads and displays and allows you to interact with what is stored in the physical ledger device nothing is stored in the live ledger,0
"Good job, bullsss.",1
microstrategy undertakes to buy more btc despite the loss of paper in its shares of m in q bitcoinnews bitcoin,1
"According to the latest Canadian bank report, the proportion of Canadians who owned bitcoin increased sharply in",1
bitcoin our only hope of separating the money from the state no need for separation in it together is better that we all benefit bitcoin and some stablecoins and stacking will bring wealth and well-being ending the shortage of jobs all over the world ai and robots pundixlabs,1
knc short alert exchange ftx market knc usd volume price btc btc eth eth for verification of trade flow of live whales,0
watcherguru pete if you're so sure the bitcoin is going to zero why don't you put all your money and short bitcoin or short mstr let us see who wins in the end,1
We're waiting for your prediction.,0
The ledger has my vote both are good ledger has better documents and it's harder to fuck,0
Petermccormack misery this is what a supply of elastic money brings dogokers to be condemned the central bank is a main tenant of Marxism human beings are too fallible to be trusted with this level of bitcoin power to fix money fix the world,1
rdrlfe yea friend who is called a down payment go bitcoin,1
Actually bitcoin hasn't dropped any more for a month now and that could be a sign that the downward trend you're referring to is leveling to see bitcoin last month.,1
For this week is what you feel something huge is about to happen,1
layahheilpern just zoom out that early i btc crypto,1
bitcoin the metric that says bitcoin is about to become parabolic,0
"And there you go, you've discovered the dilemma hodler.",0
bitcoin clings to k on Easter Sunday as crypto seen to go down in the short term,0
food for thought BTC Crypto is here to stay let it sink into,1
My time horizon is years so I really don't care what the price is right now I'm buying bitcoin,1
okk sweet I was wondering if the release was the same day the code was released or if the code was released in the day,0
What time do you use in your letter?,0
Where does that person indicate that it is a Republican edition nvm post story checks,0
If you sell you just sold forever your chance to recover the losses you may have made and when selling you incur a real loss as long as you maintain your position you have not technically lost a penny it is crazy to sell with a loss,0
btc transferred from unknown portfolio to unknown portfolio tx blockchain btc,0
more will burn until there are millions of total tokens like btc and it burns all the time because it is a deflationary token this is a good opportunity to enter and keep the tokens purchased,1
It was written now we bought the dip btc btc ftm ftm,1
btc free signal future input btcusdt at or less x max put max of its total in the future tp,0
crypto is the final way to become millionaire hard work get rewards btc bnb,1
emergentbtc doesn't sound like bitcoin,0
Andrew Joesquawk only matters the autosecurity of bitcoin,1
big price action in the next few hours btc btc cryptocurrency cryptotrading,0
proof that work is essentially a single bitcoin vote,0
Kucoincom great project great opportunity ponting nelson airing kucoin btc usdt,1
But bitcoin is different,1
bitcoin eth doge will change banks forever bitcoin doge ethereum,1
bitcoinnews after bneth has been educational bitcoin is currently in k the bullfight has started the greatest risk with bitcoin has not been the owner at this point having no BTC feels irresponsible to buy the dip,1
China s repression means bitcoin is working says crypto miner,1
themooncarl lost that level of BTC by not losing the biggest chance that inari is accumulating the last few weeks tokeninari inariraffle,0
cryptonetwork project most wonderful thanks for sharing this wonderful opportunity hopefully you will soon go to the moon txantzin txantxin txantze xdccffcde tg aabbb btc bnb,1
The bullfight is between us sign bitcoin bitlord,1
womancryptonic wants to win even in any crypto or more on a weekly trading cryptography base do not hesitate to send me a dm for more details btc alts,0
shanghai high people s court has declared bitcoin to be a virtual asset protected by Chinese law,1
pure bitcoin bitcoin gold is better than gold,1
Russian-only multimillionaire oleg deripaska urges Russian bank to move to bitcoin fegtoken binance,1
Nice I'm interested. Could you hold it for years. I'll give you k for just one bitcoin.,1
Did Jedmccaleb just confirm that Joelkatz is satoshi bitcoin?,0
"marketsbylili bomborbacon elonmusk has less to do with intellectual laziness and more with understanding how the game is played at a higher level, regardless of how it feels that both are publicly buying bitcoin and keeping it that benefits all the other holders regardless of the reason you and I benefit",1
Will they close the economy in weeks again delta and reijik grhamstephan real meetkevin jl financial attention paymeinbitcoin bitcoin,0
coindesk canaanio aoyona nakamotogames offers players around the world the opportunity to participate in countless blockchain based games and generate a sustainable and considerable naka nakamotogames btc binance binance gateio,1
added to this candle to get above you re welcome,1
thekcsvt remember btc tends to be a omen of things that come in other classes of assets shares still have a lot to deflate and then there's the problem that mortgage costs just suddenly rise us you know what it means right to nowhere to hide,1
daily btc pitchfork median line captured capitulation wicks so far crypto bitcoin,0
alert bitcoin price in the short term oscillation high level of support m apr pm,0
bitcoin everyone yearned for right now we have to be more careful,0
"anthonyavinesh saylor btc previous rebound from his life support range kept hopes alive, but his recent fall below the ema and the daily ema have reaffirmed a solid sale advantage is the best time to buy and change the dive with Scottro in telegram scot",0
what the ice coin base association says about bitcoin surveillance news,0
I will speak at the summit of nations bitcoin coins,0
The big fan of yours the day you become a bitcoiner is going to be a great bitcoin.,1
updated prices in usd hour btc eth point,0
because many exchanged their alts for btc once they hit k,0
"do your own research, but for taxes I think you can treat everything as fifo lyfo or what you see convenient I don't think the minutiae of uxto inputs and outputs matters to the gos",0
something that I think contributes to this immersion of the same thing in,0
We've got a little Jackson action.,0
list of ashbit in the exchange of pancakes is days bitcoin binancesmartchain bitcoinashtech,0
Lol is this kind of rule that you can make those jokes.,0
does not happen on weekends,0
very interesting thread with a question at the end quoting harariyuval s sapiens imagine a simple example Mr. greedy a financier establishes a bank Mr. stone a contractor in the city finishes his first great job receiving the payment in cash per thousand btc cryptocurrency,0
read all the price predictions of bitcoin I feel your still in the zone of hope that you have to enter the zone of hopelessness before you really go back up means lower side hope we won't see,0
Cathie wood investment in cnbc digital portfolios with shares and bitcoin purchase will usurp the role of banks,1
Did you buy the dip anon bitcoin?,0
tuurdemeester the Lindy effect is why only bitcoin will survive,1
Good night fam go to bed with bitcoin until s absolutely more for bears k is bullish as always I will be looking in the morning to see if I can get a solid short entrance at BTC not open a trade before bed,1
"I absolutely don't want it too I'm worried about it, although unfortunately and I'm worried enough about the dollar I'm glad to have my bitcoin holdings",1
bitcoin btc plan for the rest of the week you are looking for to return to half of ks possibly up to k this weekend,0
moxifloxaci spencerkschiff peterschiff is not the history that supports the test of time is what you have done for me lately schiffty has cost your submarines approximately in potential profits by gold shilling at the same time hitting bitcoin brilliance not the legacy you strive to leave behind,1
i m high af btc,1
What is your apr if around percent yes,0
hr bitcoin price divergence update still has upward divergence going back to nov th pm st lol in the short term we will see if the price re-tests the pink dotted divergence projection along with the confluence of the regress of the fiber we will see if it develops,1
bitcoin has done this time btc will do it again I am waiting for the final capitulation and preparing to fly on the cryptocurrency rocket,1
the two most important rules of the bitcoin rule never sell your btc rule see rule,1
peterschiff anyone who thinks btc can't work because it needs to be backed up by gold assets obviously doesn't understand the principles behind crypto or the chain blocks and counterpart risks basic bitcoin what's crazy is already and people still don't get it,1
Not even the ancalagon the black could melt these diamond hands btc,1
btc additions to the monetary base pro btc,0
saylor morganlbrennan davidfaber carlquintanilla saylor the strength of bitcoin paradoxically is its weakness to know super fast to liquidate confirmed again this week in fall ftxofficial the good news is that it recovers quickly esp when czbinance buy k btc,0
cryptodevil aivaras hang on there if you believe in btc keeping an eye on an index of greed fear and every time you go below buying some btc,1
btc transferred from binance to binance internal transfer tx blockchain btc,0
Good conversation I'm going to chew on that a little bit and educate myself and form a thx opinion,0
Yups that why you should leave your emotion in a closed box somewhere and just hodl on,1
hardware portfolio ledger trezor is not the portfolio is the seed recovery that gives you access with any wallet with recovery in case a device breaks,0
cointelegraph btc but nimiq has my heart now nim is inspired by btc but provides an easier interface for users,0
Can we get a bitcoin tonight?,0
"coindesk starbucks xpolygon jamiecrawleycd eth looks ready for good bounce in the coming days, while above the minimums of k and bitcoin above k I think while we're holding this we're going to k soon check and follow keshgover that will certainly learn a lot from this genius with its guidelines",1
recycle and earn crypto for a better world to enter the recycling race and earn money with wings is worth prizes in crb convertcarbon crb bitcoin,1
random wikipedia s summary of the dotcom bubble and in the bubble explosion section there is an entry on the microstrategy itself the same mstr issue of debt to invest in btc announcing a review due to aggressive accounting practices not a take just share,0
what you were going to find with a guy to buy bitcoin rocking machines,0
btcusdt for the season of profit trading bitcoin via,0
the sbitcoin savior play what the current depression means for the adoption elsalvador,0
the great bearocratic iron fist that watches over the little man,0
I'm excited about a bitcoin event in Scotland follow jimduffy and bitcoinconfuk,1
bustarhymes jack elonmusk cathiedwood that only needs bitcoin eth is a scammer,1
I can't wait for Tesla to leave tomorrow.,1
I hope everyone is fine dca is a great way not to stress graphics price million just,1
I have a bitcoin cake for my btc birthday ray net,1
"Well, it's not gonna end well for you if you break this rule.",0
Yep like I always say this is scrolling coin we're talking about not the next version of an ipad lol takes time,1
shorts just lowers trade and they're cleaning shorts right now doesn't make any difference if they trade in rank or rank,0
"Depends on how fast you want to open it as it's a transaction you place and you put the rate on it may be an opening once from a channel to an important center if you do it you just have to pay the transaction fee one high enough to get confirmed once and pay through it until your channel closes the rules when the nearby channels are still ambiguous for me, but a big rule is that you would usually close it once you spend all the money you committed to the ray network through that channel",0
brb throw away my economy textbooks,0
rothschild investment corp is buying more bitcoin why aren't you,1
news chipotle now accept bitcoin ethereum and other cryptocurrencies as an alcista form of payment,1
how ocsc demo through youtube libonomy interoperable bitcoin,0
the cryptographic market at a glance all values vs bitcoin btc ethereum eth bnb xrp sun moon ada and many more,0
ilovejaneadams gmdavisphotogr rcnitropower I'm going to repeat my question I don't understand how the government we buy a billion dollars bitcoin will help the average American can explain why you think you're going to,0
