text,sen
goonrich dksgame is my favorite gem project is a game studio every day new association is very strong that carries accident btc plus mcap only m going very far with bloktopia enjin have own padmobi launchpad for more visit darkshieldg,0
I thought we were waiting for the future massive adoption of BTC and the price doesn't matter.,0
bitcoin dominates the market t crypto btc bch bsv btg bcd,1
Economicafiscal politics begins to show cracks the presidential election in triumph goes to jail if not re-elected spoils the economy in media trump wo nt getting re-elected trump tries anything out of despair chaos btc is the best place to maintain wealth,1
missydogelover michael catandradec att that is why it is necessary to load in bitcoin and dogecoin no nvda cards for countries like Russia and China where they can extract crypto this will constitute a lower offer and therefore the increase of prices for bitcoin this is the beginning of the next bullfight,1
has just opened a length in btc and eth isolated without sl tp use of nfa leverage,0
caution this program is under construction ethud jst usd wait bitcoin ethereum,0
cryptobusy snakeftking good luck brothers bitcoin twitter crypto,0
arcbtc steefbtc another bitcoin that was there moment amazing work of steefbtc,1
Now that we're in a bull market I miss these bitcoin bitcoinetf memes,1
a glimpse of whale activity in bitfinex wow,0
odell adamisapleb that s why you might want to reconsider if you want to be a public bitcoiner that is the ultimate proof of the greed integrity and ego of pride could become low key problems remain humble,0
encryptoverse remember when we joke about a bitcoin figure when I was saving women and babies we can plz stop talking about price and do actions that are you anyway,0
What did you call it?,0
Panteracapital Ceo a major hedge fund predicts a massive bitcoin rally this year saying that investors will run away from stock bonds and real estate for crypto danpantera also adds that increased institutional ownership and market value will make btc less volatile,1
The amount of time I spend thinking deeply about the powerful energy change that we are experiencing as a world is beginning to increase exponentially I feel that unique gravitational changes will probably begin to relate to bitcoin ethereum and other world powers,1
steps to live in peace under your preference for time discover bitcoin understand that do not look at the price,1
To master Bitcoin you must love Bitcoin and feel a deep connection with it Bitcoin,1
"Damn it, I should sleep or I should keep track of it.",0
I love that people get angry with one of my hobbies.,0
those who prefer bitcoin to gold,1
watch bitcoin go back to and you'll see the doubt disappear,1
Welcome to the future bitcoin,1
Remember when these people said Bitcoin is a good times scam,1
btc btc correction start time and altcoin par usdt will also carefully submerge usdt ad buy in dip some currency,0
I swear this sounds like a copypaste.,0
Are there sites where I can buy without identification verification or a site where I can buy a limited amount before I have to verify,0
proshares bitcoin futures etf to launch in New York's new bag Tuesday btc lightingnetwork,0
cashapp jackdorsey bitcoin s podcaster world's largest Joe rogan accepts bitcoin payment Joe rogan the world's most successful podcaster and comedian has accepted a bitcoin share payment for financially,1
walltreesilv silverguru orowitzerland digital gold bro bitcoin,1
public blockchains change the distribution of trust by replacing institutions that rely on centralized authorities with decentralized open source software the first deep application was bitcoin,1
cryptooptimist only BTC puts you on top of the riches of the world,1
"We are proud to announce that the bitcoin matrix podcast is now sponsored by hodlwitledn not only are building world-class financial products using btc, but this will allow me to offer harder hitting even more impressive content forward up lfg",1
"It is the very high leverage available to traders that will certainly be part of the game with or even sometimes leverage in a cash settled trade s so worth for a whale to buy the physical bitcoin even at a loss due to the huge leverage they will make in the cash settled contract, but they will make money both the physical money and cash settled contract operations, but someone could literally intentionally buy bitcoin to triple the current market price and theoretically overpayment by and still get out of this gold leverage using but they will make a profit in both as well as when the whales cut using leverage and took profits selling physical bitcoin is not that many bitcoin around to negotiate the game theory with physically backed btc and cash-liquidated contracts with x leverage is an entire chapter nee or wealth creation being part of the parade or see what goes for you can choose",0
saylor flag and cross moving in time h btc,0
thoughts about btc bitcoin see xcvbs s idea in tradingview below,0
cointelegraph our analytical team has done a detailed analysis on btc and its rate of fear and greed is fear at this time with the price of usd so what do you think about the current status of bitcoin,0
small game but the win was big btc btc crypto shares,1
Family members sharing the btc market,1
as much control as I have over my emotions I also like to be right about btc,1
"Oh, yeah, I look like a fool right now.",0
make bitcoin happen,1
in the overall panorama this bear market means almost nothing btc,1
which is proof that bitcoin cannot be hidden in any dark corner nor can it serve as a vehicle for criminals,1
illconnect is my cashtag if I have a little bitcoin that would be a big change of fortune for me today on the days of fortune,0
I just bought more bitcoin lol,1
cryptodiva given how stable these assets can be when it comes to individuals who get a strong roi i d have chosen btc or eth but sun will be my first choice especially now that I have discovered honeylandgamefi that is built in the same blockchain with a great guaranteed utility,1
mmcrypto fearful when others are greedy and greedy when others are fearful bitcoin cryptocurrency ethereum,0
is the American dream really dead or is that just a lot of people don't know how to get into the real estate market personally I think it's all about diversification buy real estate buy btc buy gold buy stocks be ready,1
When we break below k i m tired of buying so high,0
thoughts about btc bitcoin see aryanouri s idea in tradingview below,0
tired of forex flaws and crypto stop everything that our mining service is for you with us you can earn daily profits btc credited directly to your bitcoin wallet just by connecting your wallet to our type of mining pool connect to start babydogecoin bitcoin,0
Then they fight you and then you win btc.,1
btcoin weekly action bassist th red candle will close in this way alpha i btc retouched all the movement that re bass ma and rsi is under me bulls that we are still sitting in weekly support channel background,0
knowledge only has the potential to become power becomes power when we use it btc,0
btcusd abbreviated in binance utc btc cryptocurrency,0
fyi bitcoin is closer to a background than a top in case you wondered what's going on with bitcoin despite an obvious economic climate like most of us have never lived fundamental Bitcoin have not changed btc btc,0
btc still looks strong and I see another rally upside down while the current correction can't go as deep as I expected yesterday I'll close my short circuit inside the blue box and go there for a long time invalidation around bitcoin crypto,0
looking for a new gig job for one of the hottest companies in waterproof bitcoin is hiring for senior frontend and backend engineers to apply today to build the waterproof browser and Internet standard pp,0
so many buy orders in holy shit k,0
Peter Schiff is that you,0
Under construction lake satoshi is getting some preparatory work done in anticipation of establishing the first cabin in the road place moves inclined banks and the road is clear that this is the first of many cabins to rent for bitcoin only lake satoshi more to come,1
We are still in the pre-rich bitcoin btc crypto phase,1
"Bitcoin coming up, be happy.",1
institutional exchange of bitcoin bakkt is made public in the nise today bitcoin nft crypto,1
I was laughing that Bitcoin was a baby from day one if you brought me something instead of laughing you'd be a millionaire even now.,1
how beautiful it is when everything looks green how long do you think it's going to last crypto btc,1
b asset manager kkr s health fund tokenized on avalanche bitcoin altcoin blockchain,0
I would never recommend people to enter crypto unless they wanted to learn something luckily I don't have much in this nice game is nt it,0
"That explains it, you just hate money.",0
Now this is the volatility that separates men from boys.,0
Blockfi duh beats me bitcoin,1
maxkeiser silly bitcoin is a device that transfers money from impatient to patient brother,1
my price of raspberry ticker btc lightingnetwork bitcoin,0
Cryptosea moov dotmoovs soon bitcoin binance,0
k gn yall btc,0
btcusdt short circuit in binance utc btc cryptocurrency,0
Damn the race to k is really happening now just a wave of institutional money flooding every possible sector for fear of getting lost,1
Do you remember those times when bitcoin was euro btc alts,1
I just made a koinly account to track my taxes for next season was pleasantly surprised to see that tracking your average cost I wish the currency base would do this.,0
more sats bitcoin btc,1
After Crypto is regulated in us there will be more people trading crypto then stocks catsby trading academy will be the first successful educational platform to teach individuals how to trade ico tokens within the crypto market with btc efficiency,1
Game and get cashback the more you play in Betfury the higher rank and the amount of cashback you get my user name user betfurysuccess bitcoin stacking,1
k infringed on the basis of pro currencies,0
friendjlebowski maybe not for many years did not realize asic s have a fairly short service life of years would be good if there were mining bitcoin that optimized for the base load of energy output from longevity over immediate hashrate maximization,0
This is the i m content here for all noise there is no bitcoin bitcoin signal.,0
"Not your keys, not your coins.",0
only in bitcoin wallets have not been sold in more than a year,0
soon in other news just the other day dinosaurs became extinct btc,0
Ballenalert prepares to buy some btc before it shoots atta boy,1
"Garycgorski saylor potus federalreserves its preference for time is too low bitcoin s purchasing power has increased in recent years, while usd s has at least decreased and is the strongest fiat btc currency just started is bound to be volatile for a while to come",1
cryptocompanies prepare to pause the activity during the ethereal fusion of bitcoin,0
You can always wait for him.,0
jhonnycloating I like this slow crawl for tel vra claiming lost territory before we see massive expansion up I think that once tel goes up to cents vra is about cents we see them take off again ath assuming of course that btc remains strong claims k short get rekt,0
qeyladewi goldendoge czbinance elonmusk what is cycle btc,0
I think most new ones are afraid of bear season.,0
I'm playing inbingo this card is to draw the next block of bitcoin to be extracted learn to play in innbingo,0
I don't agree because you can't fund a ww with btc.,0
bitcoin passes the price mark for the first time as it can crash during the last week bitcoin is constantly recovering lost ground in the last three months and etherum is increasing even faster to buy cryptocura with cash using flexepin prepaid bonuses,1
discordance called btc i feeding the hungry,0
Any action against bitcoin is an attack on me and the hope of a free society,1
Sooo ideally make nt cash just buy the dip,1
btc really interesting how it will react this time it feels like relief because the negativity around the markets are extremely high,0
apecoin looking at btc as,0
I found a good house for another one of my bitcoin-paid prints. I want to trade some of your btc for art.,1
The culture of monetary secrecy in us is there to hurt the workers if people want to share their bitcoin wage savings whatever it is then I applaud them and we also know that it is full of nonsense about everything else has no credibility,0
bossgiveawayz bubbatoken giveawaywhale altcryptogems cryptopoorboy flurbnb banggarr bombshillers this symbol goes to boom and it is recommended to my Crypto friends to think no more just go for it docleiy lucky black man kalonk bcqwdeazrkhdasqcdnvjzzygauisczr btc,1
"his movements somehow make a concern to the price table and his predictions turns out to be true, but the fact that the guy looked and won a lot of possession and therefore has a clear view of the market",1
gm to all those who choose to build for our future in better systems stop building in bequeathed bitcoin technology,1
glmr is going to x remember my tweet look at the chart buy buy buy a big bag now bitcoin btc dog shib keep nu xec zec dent hot,1
have the same mentality and ignorance of the maxims who post here,0
jtsglobal utodayen govbrazil indiainbrazil apomplian Brazilian brodienbcs ukinbrazil jack amazing is a big country and it would not be bad to become the third country to make Bitcoin official btc,1
Would you rather have a gold medal or a bitcoin medal?,0
"When policymakers prioritize sustainable energy, bitcoin naturally takes advantage of this and becomes greener.",1
Stopping with this nonsense printing money is politics we can be interested in cryptocurrencies without spreading this nonsense,1
long ticket ocen price stop loss link in bio tz btc bitcoin ocen,0
Bitcoin has been up since China banned it.,1
whalealert whales sell bitcoin and expect to buy in depth to your very smart advantage,0
the only way to mitigate the effect of binding would be to use bitcoin as real world currency in daily transactions rather than how it is currently used mainly for speculation,0
all data science models suggest that btc peak much higher than another best cryptographic discordance group about k member and even have their own application join here shib btc eth doge sol crv ath sl something matic fib s boa gme tnt h amc ct tp,1
is swan a good place to buy bitcoin I love its ethos and what they represent but at the end of the day are the high s quota or is the price marked up,0
Matthe Whyland as if BTC cares what people say fallen here down there just hodl and relax,1
Bitcoin breaks k to establish a new high currency of all time told you that Bitcoin,1
Ibrycom there's no reason for another bitcoin is all we need.,1
Lol yeah makes no sense in selling when you can hodl your shit,1
"If you haven't invested in Bitcoin yet, you'll regret it and I'll tell you I told you not to be that person.",1
looking for a short tonight btc,0
mfhoz awaits you hodl bitcoin,1
k end of year worst case just looking at sf is good that ll make x instead of x but in you will make it rain,1
teslaspacex ceo musk said that tesla will probably start accepting bitcoin for the purchase of vehicles again I want to do a little more due diligence to confirm that the percentage of renewable energy use is more likely in or above if tesla will accept bitcoin musk again said,1
I'm a supporter of Bitcoin Elon.,1
"Wait, I think you like money, too.",0
coinsquare thanks for opportunity stpatricksday bitcoin coinsquare tag utksrvstv,0
marginally because you are not doing economic activity it would be better to point all your portfolios at your node or add your addresses as clock only to your node so you can verify that your wallets are not scammed by malicious actors,0
the price of bitcoin is currently crypto btc btc,0
we are excited to share that we have worked with our long-standing partner nydigbtc to add bitcoin to the analysis chain balance,1
olmeg adybug cryptovizart ittechpl blaakke therealplanc onchaincollege janwues cryptobirb pioestapowicz ekryptowalut wlementeiii mernest kraken ftxusderivs bitfinex but everyone was celebrating when they announced the first future btc etf I have said that it will happen why invest in the place when you can make long and short money and in a complete regulated environment,0
cmon btc fights for my love,1
mowgliasia krugermacro whale games btc will make new maximums within months or less,1
i m surprised how correlated bitcoin and ism index have been in recent years unfortunately bitcoin will probably continue to be more correlated with traditional assets as bitcoin btc matures,0
a bitcoin is now worth bittamp high low top of the billion bitcoin market,0
"Massive exodus love never saw this coming, but now it's a reality I feel blessed alhamdulillah exodus portfolio cryptolibertad bitcoin",1
"Congratulations, you'll be healthy again in no time.",0
This price action is annoying to walk away for a week or so.,0
the price of bitcoin has been decisively broken from a line of major downward resistance and seems to be consolidating ahead of the next upward movement it will be interesting to see if it exceeds the last significant peak of June that was near,0
the story behind texas and oklahoma s move to the second and why it's happening now bitcoin sportsbook,0
"Damn it, you fucking nut!",0
market movement alert in btc this signal was detected seconds ago remaining tuned for more btc btc,0
thoughts about btc bitcoin see the idea of donyakka in the view of trading under the trade here,0
"Hey, now I've bought in",0
ltc output this graph shows litecoin is being destroyed compared to bitcoin,1
a cryptographic market update is available in bitcoin ethereum crypto,0
for bitcoin is miners who charge tx rates,0
eth short alert exchange ftx market eth perp volume price btc btc eth eth,0
That's just the thing if you know how btc started then you should know about these things your last statement is just a short-term correlation,0
So German banks are bullies in btc but eu trying to block btc wtf,0
Harrybeck with Adamus thank you so much brother was really joking bitcoin,0
btc short deribit btc perp you learn in this business if you want a friend get a dog carl icahn,0
The bitcoin price has moved again and now sits again during the day in average motion so that short-term signals remain positive for btc there are experts on both sides of the fence some say that bitcoin will try k again and some say bitcoin is out to the moon,1
This is your brain in Bitcoin.,0
Obviously digging green today but it's a little disappointing to see bitcoin s win over alts I swear people don't learn,1
you don't need to connect it to see what's in it you just need to connect it if you want to send what's in it example I have a trezor and I have it connected to my mobile wallet so here on my phone I can see what's in my hot wallet and also what's in my trezor as a separate wallet both are live values the only difference is that I can't send coins from the trezor wallet because it's sitting in a safe place offline if I want to make that I need access to the trezor,0
Wheeleeee good trip for a few short ones out there,1
bitcoin price in Canadian dollar btc xbt btccad btc price now cad avg last hour avg hours h change h low h high more info here,0
looking at the tesla market saw a tesla model s smoking a demon dodged impressive investment ethereum bitcoin,0
Just days ago btc was trading down and today btc touched the growth in just days btc has not broken the support of the bull abhi baki hai,0
and good news bitcoin cum gap closed due to recent download due to higher than expected CPI numbers,0
"He will, but buying more dips will avoid it.",0
alert bitcoin price in the short term oscillation high level resistance m Oct pm,0
If the dive is deep enough they buy again in the new year and still benefit they are not fools just saying,0
"good question maybe temporarily, but this puts good long-term pressure plus competition between big players is good for btc",1
bitcoin btc cryptocurrency fact interesting btc has been establishing an annual negative candelabra after the crypto bubble however it has been making consecutive sticks of positive candles after the story will be repeated as and follow for more,0
Peterschiff this book saved my ass Peterschiff bitcoin eth cryptocurrency elonmusk joerogan,0
I guess Iran wants to buy cheaper btc s and is trying to keep prices low by taking the energy versus yep mining cost car that they need and need more days to conclude their purchase better hurry the price will not stay so low for long,0
Which is the billion dollar question.,0
Bollinger break for btcusdt in minute time btc bitcoin,0
I guess you shouldn't take yourself too seriously after all.,0
documentingbtc cynthiamlummis bitcoin is a magic,1
Remember all those youtube and twitter accounts saying that we could have seen the fund and the markets have already paid in our situation days ago just remember that it is better for them to feed the confirmation bias to their audience upside down that the disadvantage trusts yourself btc,0
new feature to help report misleading bitcoin misinformation from people like elonmusk mcuban thanks jack,1
you could do better than any last year if you choose the right day to compare prices,0
squirrels to the end btc,1
kshib long alert ticker kshib market kshibperp volume price btc btc eth eth,0
is getting bigger and bigger th of the end of November testing network what are your expectations after wagmi znn qsr btc bitcoin altcoin bullish,1
trend enter short longclose btcusd follow for all alerts btc doge crypto,0
btc bitcoin situation be like graphical btcusdt,0
hodlmagoo fossgregfoss I think limited is different from fixed right the offer of bitcoin is fixed to millions of the offer of ethereum is limited to some rate of production per unit of time,0
our mps will accept bitcoin even if it is not part of their pay but perhaps in donations the minimum bitcoin not altshitcoins helps protect their funds against the degradationinflation caused by the government more to help rakyat kasthurishankar yeobeeyin hannahyeoh syedsaddiq,1
ascendexindia btc is good,1
binanceus you have my attention without trading fees and dust cleaning BTC,1
bitcoin s explosion above the level did not last long and graph patterns indicate its rally as July is at risk of fading i m still making my profit with commercial signals given to me by robin moore telegram moorerobin to copy into my trades I left btc to btc,0
omnifinn princeysov lucky to have bumped into bitcoin on any lucky timeline of swallowing the lucky orange pill of having a lucid objective path for the future,1
bitcoin changing shape right now I'm an active passive bull bear,0
Lol's not near the circuit breaker.,0
all cryptocurrency bitcoin via,0
epic for all lucky bitcoin seekers,1
"Right Lol like anyone who follows those price predictions in the last few months could have made a lot of money idk why people are getting angry about it, especially here they're going to curse the next moon",0
separate money and the btc state,0
anyone here test the link application,0
bitcoin is going to surprise ct and everyone from September onwards,1
apomplian th trimester send me some liquidity baby connect to my bitcoin node,1
the failure of bitcoin banking and what holders can do to fix bitcoin,0
bitcoin is a unique event in our lives,1
"nftmechaen rainmakergaming has potential relationships with nitroleaguegame and some unique gems like championhunters therefore, with the market being so volatile it is better to focus on projects with great scope to make our future nfts bright rain btc rain",0
bitcoin bitcoin btc btcusd,0
bitcoin uploaded usd yesterday the last few days bitcoin,1
man I love guardian saylor against the fud and savior of btc who is fighting the good fight once again,1
bitcoin is hot right now.,1
totally possible but I think there will be a big setback after how people sell,0
Nebraskangooner take care of him one day that would be worth more than a real bitcoin,0
Is it diversified or is it all in bitcoin,0
He's betting that he's going down maybe we should ask him what the bets are.,0
I don't think it's due today. It wasn't just today when they stopped accepting comments.,0
"So I've been dollar average cost bitcoin over the last few months and I wonder if it's a good idea to see any altcoins with prices so low i m still quite new to all of this, but from what I skim it seems that the general attitude towards altcoins is pretty hard I should just stay with the btc or is altcoins a viable option too",0
which determines the price of bitcoin a very good reading in the dynamics of the market you can have a look,0
altcryptocom a token backed by mining btc and mining of other cryptos is bound to be safe to learn more in,1
viktamao rally project starting btc carecoinfamily,1
acldefi sure brother I've been doing it for btc for years this will change the game of defi accessdefi,1
This is supposed to be more than k today.,0
"It's only been minutes, but why does it seem btc price on this fed ratehuke already maybe people are slow nowadays to react bitcoin",0
Let's see that salsa are bought in after hours btbt bitcoin shortsqueeze baggers coming,0
Last chance for bulls btc resistance k stood out in the sea st if it doesn't break above k this time then it could break below k level in the next few days bitcoin btc crypto,0
pitchfinance bsc pitchfinance bitcoin project is good and amazing global cryptocurrency project is powerful project I am proud of your project I hope this project will be more developed and better,1
"long term may be more, but that's my short-term goal years",1
hastecoin and as a result many families are paying the price fighting to get to the clear end of the month that bitcoin is a big part of the solution,1
