text,sen
he s a child he seeks attention,0
how much energy is used on people masturbating i bet a lot but we don t hear about that,0
whalealert they keep transferred to multiple hundreds of wallet btc,0
this is a daily discussion group i am not criticizing anyone that s holding so please stop jacking my karma thank you,0
now lets check this metric s behavior after the massive drop in may which many people thought that btc will drop to k area and bull run had ended when bitcoin broke k level and rose up to k ath puell multiple was near blue box but could nt break it upwards,0
i bet we ll hit million subscribers by dec st if we do nt i ll eat john mcafees dick which is gross cause you know he s into some wierd shit,0
btc daily ma or weekly ma which ones gon na win,0
just doing some research on the last ath jan th it dropped from in a few weeks correct me if i m wrong is that expected if we reach a new ath or is the general consensus that the new floor sorry if this is a stupid question i m new and coming from stocks thanks,0
it was under a day ago lol relax buddy,0
transaction report gmo coin jst close sell btcjpy jpy bitcoin,0
btc usd transferred from coinbase to unknown wallet powered by,0
i auto buythedip collecting bitcoin ats daily via blockfi for purchases via trylolli foldapp grow ats on cakedefi defichain dfi bonus code,0
some questions i dabbled in bitcoin back when it was flirting with k made a pretty penny at the time but cashed it out had some ups and downs since then but never stopped following bitcoin and i m in a position where i may be able to start buying again however the landscape has changed a bit since then coinbase horror stories over the years make me not trust them anymore even when i was in before i transferred my coins away to a personal wallet i had setup on my phone and moved them back when i wanted to sell now i do nt even want to use coinbase period what is a good trustworthy android app for buyingselling bitcoin through exchanges second what is a good wallet setupsolution is there also a trustworthy android app i do nt recall the app i used previously unfortunately,0
the bitcoinpizza would be worth us right now up in the last hours bitcoin,0
the end of ww and the dismantling of the new deal meant the us government cut its spending by an astonishing between and the us economy witnessed an extraordinary boom during these years saifedean ammous thebitcoinstandard bitcoin cryptocurrency,0
prices update in usd hour btc eth xrp,0
get the most popular hardware wallet trezor one bitcoin,0
absolutely nothing coinbase users coinbase btc eth,0
you could just pray everyday for the price to go up i took out a small loan at celcius as an experiment not for serious investing lets say i need money in the future i want to know how this borrowing against your btc works so you dont have to sell your btc,0
btc weekly outlook coming to you prefutures open from the deep bitcoin haven t had an entry yet but we re so close,0
nothing is instant but if you want as fast as possible all you need is a wallet that let s you set your fee higher fee will get put into a block fastest,0
btc derivs sheet tweet every min cme delayed min gs delayed min and oi shares out,0
it s difficult to view btc outside of the broader market since the correlation with stocks jumped again with bitcoin remaining correlated to the nasdaq and s p index those markets have also been feeling the pain of the fed s quantitative tightening qt policy,0
what do you mean when you say any other wallet is nt the word phrase only good for the wallet you start with would my phrase for blue wallet work on the cake platform,0
not pathetic this is bitcoin s normal bullbear trend just look at past charts k is coming,0
computerart bitcoin blockchain s last block height see more on,0
btc is still retesting the ascending triangle top wicking below it but ultimately trying to stay above it downside wicks are fine as long as a daily close above occurs that s what s needed to confirm a successful third retest attempt btc crypto bitcoin,0
bitcoin btc impulse bar btc bar close crypto short term volatility detection,0
i m serious this pull back was expected after running that high in a short period of time we will be k by end of this year,0
is there a certain amount or comfort threshold at which a person should invest in a wallet if a wallet costs but you only have under in the game is it really worth it is everyone that paranoid that the exchanges in which their coin sits will get hacked or crash or whatever i use shakepay and while i wouldn t trust them with my life or anything i feel somewhat comfortable leaving my btc in there until i feel it s a good time to cash out maybe all you wallet diehards have way more invested than i do,0
place of entry in my opinion btc cryptocurrecy,0
fear and greed index for bitcoin and cryptocurrencies value status fear bitcoin price btc,0
thoughts on btc bitcoin see maleknafaa s idea on tradingview below,0
btc derivs sheet tweet every min cme delayed min gs delayed min and oi shares out,0
long bel entry price tz stop loss link in profile bel btc bitcoin,0
so far wan btc top price reached highest profit reached algotrade,0
thoughts on btc bitcoin see pnchan s idea on tradingview below,0
i m laughing so hard at people buying at k when they were too hesitant to buy at k,0
btc latest block info block holds transactions for a total of bitcoin including block reward block size bytes,0
can you drive a gokart what is fun can you buy this nft bitcoin ethereum,0
here we compare bitcoin s performance during asian european and american trading periods today btc returned in asia and in europe yesterday btc returned in the american session,0
anyone understand what bitcoin is clinging to not sure why we are nt blasting through k feed not bearish enough more pain please,0
just waiting for shibainucoin to go bonkers and beat bitcoin fun watching,0
bitcoin is finally recovering btc is still crashing all these people freaking out every single time the prices goes above or below k baffle me bitcoin is in the exact same pattern i called out months ago literally nothing has changed chill,0
bitcoin flirting with the day ma,0
mark sweet william gallacher sheila freeman btc,0
bitcoin market alert order balance sell buy sell bid ask spread,0
k combined bitcoin btc short liquidations in the last minute huobi k binance k bybit k,0
rovercrc depends on the day i hold very little btc,0
remember one year ago willy woo predicted k by the end of,0
emmalladro hi emma are we still gunning upward or as per rsi hr tf we re in the oversold region what s your bitcoin latest analysis tnx btc btc,0
next bitcoin support is,0
bitcoin adoption in africa with raypaxful full interview hosts dennisporter wsfoxley,0
andrew yang on crypto in politics ukraine golden dao and aapi community bitcoin,0
usd mkt cap changes last hours btc b luna b avax b xrp m xec m ftt m bitcoin cryptocurrency crypto,0
btc btc eth eth bnb bnb,0
long timei do nt want to care btc r i l about anything else,0
i am the dip the dip is me,0
i reckon there will be another biggish dip brought on by day traders and whales but people keep learning they rebound so it might be the last that s near k before people become more confident it s not a bear unless it is a bear market i have no idea,0
long lit entry price tz stop loss link in profile lit btc bitcoin,0
here comes those brand new chickens,0
altcoinsherpa to be honest less than the major part of my portfolio is spread out into some alts sol dot avax the bigcaps with each oin adax aioz the smallcaps with another each in other alts in eth and in btc,0
mkbhd looks a lot like bitcoin and altcoins,0
btc liquidated long k at,0
i do nt think you understand how bitcoin or investing works,0
with a hardware wallet nobody and nothing can see your private key so you can use your funds on your computer and other people s computers even if they have a keylogger without fearing of losing your funds,0
ahh i see makes sense,0
silly bears dips are for drips,0
the future of football btc btcusd,0
inversebull aneesbtc guys any thoughts about the recent btc inflowsoutflows feels a bit strange whalealert,0
just going to leave this here bitcoin,0
trillionusd i hear there is still bitcoin available to buy,0
today s bitcoin fear greed index is neutral crypto cryptocurrency,0
btc download an app bitcoin,0
very strange even from hacking the poly network to crypto lessons trademoneta crypto bitcoin,0
cleg is bitcoin of pe games,0
there s a real battle going on around the k and k range watching it live is quite the experience,0
btc clean breakout above the top range which we had been trading in for consecutive weeks nice retest to support which held during breakouts expect shallow dips as we continue higher waves lavax brwl opct luna kara vra trias axs gmt,0
bitcoin risk vs reward,0
pretty clear bart on the hourly it felt tedious need to bust through,0
i actually though it would bounce back earlier than that xd,0
from these we do see a diminishing return every cycle definitely expected and the diminishing rate was x also interesting to see cycle bottoms had been higher than previous cycle tops again very limited data points may mean absolutely nothing just observing btc,0
talking about this rejection zone and the dashed support line in a video coming out within the next hour stay tuned crypto cryptocurrency btc,0
largo plazo bitcoin btc eth ada link,0
i am buying this fear bitcoin k no financial advice,0
you to keep patience do not fomo based on a min chart,0
intocryptoverse for more knowledge about cryptocurrency bitcoin,0
yes of course a gain is a gain but do you think the same people from will want to fomo in now highly unlikely imo the price seems too high for someone to put money in right now,0
btc bitcoin day chart,0
nano xno should have bitcoin btc s marketcap and vice versa change my mind,0
gpu price inflation dips slightly as ether downtrend continues btc bitcoinnews bitcoin,0
this is development and change bitcoin btc crypto ada,0
bitcoin bnb that is all that is the message,0
the bitcoin mempool is currently mb with transactions waiting for a block total fees for these transactions are sats the median fee is satvb,0
do nt miss this week s money talks tune in this friday at am pst for an interview with cardano founder iohkcharles weekly update on bitcoin market the latest on abra your chance to ask billbarhydt anything about abra crypto,0
a blockchain analytics tool designed to help dark web users check how clean their bitcoin is has opened againjust one week after it was shut down,0
k held in theory we go back to test k now,0
everyone should be double checking those addresses anyways but this is good reminder,0
incomesharks cryptocevo let us not forget that bitcoin was in and it was years ago be prepared for dips alway be cautious y all follow btcy her tweets ta predictions tips have been so accurate i ve been following closely she s a supper underrated bitcoiner follow her,0
cmon you know you do it too bitcoin,0
hmmmm when did raoul become a cathie fanboy sorry maybe he always was i didn t pay that close attention arkk tsla bitcoin,0
moonpay to make web payments with unstoppable domains partnership cryptocurrency crypto bitcoin,0
i m not sure what the hash rate has to do with price but i think btc is mined at a regular rate so the supply rate remains consistent,0
bitcoin price in canadian dollar btc xbt btccad btc price now cad avg last hour avg hours h change h low h high more information here,0
the week graph kinda looks like the year graph,0
levels and trades given in advance again asia getting all the big moves but it s still respecting the technicals bitcoin btc trading cryptocurrency,0
schiffy is tweeting about bitcoin buy signal is here,0
btc ripping off that important yellow zone resistance turning it into a support now on hr next target the all important major resistance at k yellow zone bull flag breaking any moment now bitcoin,0
i reckon you re closer to the mark actually than i am your analysis is spot on doubtless based on years of trading experience just as mine is the trouble was with my analysis that i did nt factor in the number of candles divided by the length of the green ones and red ones or er something,0
btc transferred from unknown wallet to unknown wallet tx blockchain btc,0
i ll give you,0
maybe but that will not change the outcome the fundamentals are weak and banning me can not change that,0
if you used coinbase coinbase pro or bitstamp to buy you cna check my calculator cointaxwtf it even tells you short and long term gains if you sold or or your stack see page of this example,0
anyone buy direct on their trezor is it better than doing on an exchange and then transfer,0
tl dr public keys are used to lock bitcoin up and private keys are used to unlock them for spending nothing actually leaves the blockchain sources i use everyday to help me evolve bitcoin basics kiarabickers bitcoin clarity bitcoin philosophy breedlove,0
the viable reset in the eot looking good walk away and let the computer manage the price and time cycles remove,0
what is hash ribbons by caprioleio w prestonpysh bitcoin hashribbons merryoscar,0
credit carts are nt accepted most places,0
when someone sells at another one bought do you think the one who bought at will sell at too,0
bitcoin brainwallet recovery tool with python python bitcoin,0
sound like smart criminals to me,0
wjvalk investanswers fossgregfoss jeffbooth being canadian i started buying canadian spot etfs inside my tfsa until i was able to orange pill my amazing wife then we switched to buying bitcoin direct from shakepay and moving it to cold storage thank you investanswers jeffbooth fossgregfoss and others forhelping me,0
are you trolling me or is that a serious advice i dont wan na lose money i mean i wont be in debt or anything but is still a lot to me,0
nft news floki metaverse is integrating nfts and metaverse capabilities globenewswire nft btc bitcoin,0
surprisingly no because float and volume information is public you just need to have access to a large enough sum that can move that given market hedge funds do it all the time fpool does it with btc as well,0
falling wedge at daily bitcoin,0
do you believe it is possible for the stock market to go down while bitcoin and gold go up over the next weeksmonths,0
i do nt even pay attention lol if they want to spread fud they can,0
that s what s odd it s done that several times today,0
you have literally the exact comment history one might expect from someone who would post this,0
btc aggregated inflows to coinbase pro,0
btc equals eur bitcoin euro,0
these are the times that try men s souls,0
are you sure you can leave your node unsupervised be safe make sure you turn on the monitoring while you attend bitcoinconfeur or tabconf bitcoin lightningnetwork,0
btc new bottom incoming beware of fake pump would you buy before price drops altcoins max buy in price is just around the corner i am waiting patiently,0
btc btc eth eth bnb bnb,0
bitcoin btc hellow h,0
it is probably a good time to put my btc hat full set up for sale especially for those looking to clone a rare set hmu if interested nftcommunity nftcollector,0
pulte is this real pulte k of btc,0
bitcoin still holding the d ma red seems like it s really being defended because whales know if we close below it then likely we get a big selloff so maybe it holds and we go back up for a green april monthly btc close let s see,0
oaxbtc chart oaxx via coinigy opportunities everywhere are we slowly botteming out for the next altseason later this year bitcoin trading,0
btcusdt shorted on binance utc btc cryptocurrency,0
how did we get out of the recession by october congress approved a billion bank bailout now known as the troubled asset relief program by february obama proposed the billion economic stimulus package which helped avert a global depression btc,0
yes that is how market cap works you also do nt know what a maximalist is my favorite cryptocurrency is an altcoin,0
they waiting for the bear run well what if i told you about the panda run btc,0
yeah i m down on some alts too it s ridiculous i do nt know how that s going to go the major ones will get back stellar seems to be doing well even this month the shittier ones might not the funniest thing is that some of the most random ones i have are actually up in the last month so you never know,0
if we close below k we go lower to k if we hold k and consolidate then we see bitcoin,0
the most bearish thing about bitcoin right now is all these retail traders freaking out over a dip,0
if bitcoin is holding this green belt of support from december if we lose it it will be free fall btc crypto,0
btc is now at,0
btc bitcoin double top,0
price update bitcoin cryptocurrency btc source,0
when did i say that go for it day trade i do nt care either way the price goes up over the course of a year regardless,0
qsp xdb and ast post doubledigit gains amid sideways moving market fw f f btc btc sol,0
zerohedge michaelsaylor am i the only one that noticed a potential correlation between skepticism and asset performance most skeptical highest year treasury allocation least skeptical highest bitcoin allocation btc bitcoin,0
infographic about the history of money with bitcoin in french canadian msm sentiment neutral brief,0
transfer to your own wallet transfer to another exchange if you want to trade i buysell locally at obscene premiums but trade on polo bitstamp and bitmex if you re in australia use livingroomofsatoshi to pay bills with,0
philadelphia ers suspend ben simmons one game for detrimental conduct joel embiid says it s not our job to babysit somebody blockchain tron bitcoin,0
btc bitcoin most people are super bearish but what if we were already in the final stages of wyckoff cycle,0
bitcoin battleground convergence is coming together almost exactly when and where i said it would,0
gdax seems to cover the fee when sending out,0
btc price drops to fill bitcoin futures gap as focus turns to k bull target,0
btctokoloshe kendallnear magdawierzycka well we know she has no bitcoin so she just ngmi,0
that s the entire crypto market cap pal and absolutely the best indicator we have you do know publicly traded com companies were brand new at one point too right you do know websites are a relatively new thing in the grand scheme of things right,0
price update bitcoin cryptocurrency btc source,0
if you don t need to purchase anything don t take profits it will only result in less sats,0
the current price of bitcoin is it has decreased by in the last hours bitcoin btc cryptocurrency,0
ti real time stock scanning gappers scanning charting relative strength stockmarket spy spx tsla amzn amc spx gme nio aapl googl nflx amd gme baba btc eth pltr qqq wmt pypl roku shop bitcoin stocks,0
not sure which i like better when bitcoin price dips cheaper sats or tanking shitcoins,0
thoughts on btc bitcoin see desmondlzw s idea on tradingview below,0
crypto whalealert btc worth was recently transferred from unknown to unknown btc transaction hash fbefaaeddcdaaebbdcdebc,0
traders are ticking away on the profits in a down market bitcoin cryptotrading,0
oliviacryptos bitcoins volatility index is ready for another massive movethe next week could be the start of a new price trendkeep your eyes on it bitcoin christainsbtc is a super underrated bitcoiner i ve been taking his tweets and tips seriously i ve been doing great follow him,0
dot long alert exchange ftx market dot perp volume price btc btc eth eth,0
i only need it to drop k lol and that s what will happen,0
bitcoin bitcoin btc btcusd,0
short waves entry price stop loss link in bio tz btc bitcoin waves,0
lol vultures are coming and i can feel that coming to him,0
fsn shortterm trend is weak and continues to fall although the short volume shows signs of reduction but there is no reversal pattern shortterm attention to risk strong support below the day sma and fibonacci support pressure btc altcoin,0
new report bitcoin filing entity digihost technology inc name frb registration statement ex filed reporting for form,0
leverage is good and bad for bitcoin,0
i think we really need to wait for that before we get the answer,0
although they re not identical this would be cool af if it were to play out imo we are in the highlighted area of the diagram hypothetically bitcoin simpleta,0
saylor elonmusk you forgot to say bitcoin,0
btc transferred from unknown wallet to unknown wallet tx blockchain btc,0
bitcoin market alert order balance sell buy sell bid ask spread,0
can we get others to volunteer,0
join our m sat bitcoin lightningnetwork liquidity swap triangle btcln yep connect to my routing node,0
long audio entry price tz stop loss link in profile audio btc bitcoin,0
need a little primer on how crypto mining really works just finished up this piece for argoblockchain arbk arb riot bitcoin ethereum,0
russian crypto market worth b despite bad regulation says exec cryptocurrencies bitcoin technical analysis,1
top cryptocurrencies to watch this week btc ltc icp theta ftt btc bitcoinnews bitcoin,1
btc btc thanks for the play,1
life goals go to as many bitcoin conferences as possible and always earn a speaker s pass adoptingbtc,1
good morning intensified today bitcoin fixes this,1
coindcx i believe btc ogn will outperform the rest crypto this december,1
bitcoin is a way out of our current system which is exclusionary and unjust and tends to prey on the weak and disenfranchised while letting the corrupt davos crowd walk free alex gladstein bitcoin btc quote,1
bitcoin futures etfs good but not quite there,1
rckstardev bitblockboom if your investment time horizon is years there is no better asymmetric investment risk than bitcoin those who hold bitcoin will be financially free for life following ethbtc tweets and predictions i have added to my holding thank for being a mentor,1
shoegalnyc thank you jihanwu and peterrizun for your vision informative and honest presentations and hard work,1
to balance my feed we will see k usd btc sooner or later imo btc bitcoin cryptocurrencies btcusd,1
gm ct bitcoin target hope longs are smart enough to take profit of the table and at least adjust sl to be let s see if we make it to target,1
jackmallers lnstrike yesterday mallers company lnstrike announced it is adding a bitcoin buying tab to its app with the explicit goal of minimizing fees,1
bitcoin is in a great place to buy right now turn your holdings into x bitcoin,1
there are too many altcoins increasing their value at crazy rates and they increase the value of bitcoin itself,1
i d rather work and then get paid to buy btc that s better for me,1
outerblu michaelsaylor hi look at my page i will show you why btc not that bad for our environment is,1
the tragic life of a no coiner i thought this was a scam maybe i should ve gotten in earlier i should ve gotten in earlier bitcoin btc,1
many socalled specialists state that the golden days for bitcoin are already passed however there is much evidence that we just have seen the beginnings although btc keeps being volatile as traders we can properly take advantage of these onholding price swings,1
fidelity adds bitcoin exposure to traditional etfs bitcoin magazine,1
donic hey we love ethereum it has been amazingly profitable and those profits go right into bitcoin we wo nt wait around for the bug rug pull,1
peterschiff jackmallers powerlunch kellycnbc jackmallers is a real entrepreneur solving real world problems with bitcoin as his tool of choice you need to stop this clown show,1
nekoztek usually a great indication for what s coming next a small trap downwards maybe then back up and ath within a few months bitcoin,1
mutenro a team of professionals to guide you in your trades check our publications and follow us so you do nt miss anything crypto analysis is the best way to show our result and better understanding of crypto space btc trading,1
i spread peace love and joy to all the people of bitcoin,1
today was a great day for bitcoin you ca nt buy this type of national and global press bitcoin is officially on the main stage and no dinosaur can stop it bitcoin,1
rising wedges rising wedges everywhere target of current rising wedge is k btc bitcoin,1
geekwire buy bitcoin bitcoin,1
channelsfinance very strong project irenezhao budiman adibagor bsc channelsfinance btc,1
just in billionaire investor bmillervalue now has of his personal wealth in bitcoin,1
i m panicked i ve put all my money my house deposit to i m not gon na chill right now i believe in bitcoin i can t go and tell my family this so i m here,1
cryptovinco at least saylor is still holding onto his bitcoin dollars are worthless anyways,1
trillionusd bitcoin seems bearish but if you look at the metrics it s still bullish i think it will reach a new ath this year,1
peterschiff schiffgold you just said buy bitcoin,1
bitcoin mining difficulty adjusted miners now have greater incentive to expand operations this is the end of china fud,1
what just happened to btc now who pumped this k btc crypto bullish,1
btc go to moon k fly,1
new rabbit hole so so bullish bitcoin nuclearenergy,1
no i based on history yes i know no guide i would expect to see a reduction in volatility as things settle down after the fork drama and when stability starts to become the norm again i would expect a gradual price rise as people feel it is safe to enter the water again and as the halving get closer,1
vailshirecap bitcoin is the only asset in the galaxy i started with btc now i m a millionaire everything changed when i found bitcoin following aacrypt i ve learnt how to invest right through his post and tips i have added massively to my btc holdings,1
okay btc i see u,1
a man does not die of love or his liver or even of old age he dies of being a man be men today bitcoin,1
i hedl through three corrections so far still up quite happy to continue hodling,1
