,text,sen,sen_2
202,pyramid scheme promoters tyler cameron btc is a scam btc is not bitcoin,2,0
203,eth going to x remember my tweet look at the chart buy buy buy a big bag now bitcoin btc sol doge shib keep nu xec zec dent hot bnb om omg vet xrp ada polx poly pond bond,2,2
204,rovercrc hell yea baby dracarys bitcoin,2,2
205,swing up trend for btcusdt on minute timeframe btc bitcoin,2,1
206,princfilip some middle eastern monarchies might adopt bitcoin sooner than we think bitcoinadoption read more,2,2
207,documenting our journey to hyperbitcoinization starting with el salvador what is happening in el salvador will come to the rest of the world and it seems that bitcoin changes everything,2,2
208,i ve noticed that slow days on the btc daily often mean something big is brewing,2,1
209,danheld bitcoin is my savings account too now austria taxes bitcoin gains with ups buy hodl don t trade bitcoin,2,2
210,traderel bitcoin is still above ka bounce is expecting from here target at kthe biggest risk with bitcoin has been not owning it at this point not having any btc feels irresponsible buy the dip bravo bmon made us proud her ta tips have been very helpful i ve been superb,2,2
211,advisor to president of colombia calls bitcoin most brilliant piece of software ever bitcoin magazine bitcoinmagazine btc colombia cyptopotato,2,2
212,i ve been hodling and dcaing for around a year now not long in this space i know and am still extremely happy with my positions all of you chads that bought in at k need to stop crying and realize that this is bitcoin welcome to thunderdome bitches if you ca nt handle the erratic swings go buy some michael kors stock and shut the fuck up,2,2
213,someone transferred in bitcoin and paid a fee of that s a transaction fee of no government bank or third party had to verify the transaction nor could they have stopped it if they wanted to,2,0
214,peterschiff and you think you can change the mindset of a bitcoin hodlers they are as cool and calm as the great msd sick mind,2,1
215,btc pairs macd cross daily pairs agi cos dcr mana nkn rcn xvg zil condition macd cross bullish btc binance sign up,2,1
216,btc will be accepted in phone booths soon enough,2,1
217,used to be so lost in the space not realizing network news was nt it then i found the gentlemen of crypto krbecrypto blkbtcbillions kingblessdotcom bitcoinzay bigmarh now my eyes stay wide open in the crypto game accept these flowers guys bitcoin,2,2
218,conservmillen i see bitcoin slowly becoming a substtute currency for banks playing same role as gold did in the early days btc over fiat thanks to stellajeffreyfx he knows a lot when it comes to btcoin his tweets predictions have been helpful thanks for taking your time to educate us,2,2
219,jpmorgan will give retail wealth clients access to bitcoin funds the first big bank to open up bitcoin access to retail here we go,2,2
220,hey mate peterschiff your shiny rock crashed by almost while btc btc is up only mode,2,2
221,go to sleep wake up by the next halving don t look back if someone tells you there was a bear market you say oh really bitcoin holding till death,2,2
222,even if the bears tank the bitcoin price to k you are still in a good position if you buy now bitcoins price will be over k sooner or later just accumulate whenever you can maybe try to find some good altcoins to maximize your profits but do nt listen to influencers,2,2
223,people will soon realize in order to have their shit coin like ada to pump they must pump bitcoin first,2,0
224,just finished reading the bitcoin standard by professor saifedean best reading in recent years it will be difficult to maintain this level of quality in the next books i will read looking forward to the arrival of the fiat standard of that same author,2,1
225,central african republic has adopted bitcoin as reference currency office of the presidency btc cryptonews nft btc,2,2
226,born to run bitcoin weekend hustle,2,2
227,kennyligthart michaelsaylor miketyson man gold was the security of fiat payments with gold you could not pay as it is physically not possible with bitcoin this obstacle is overcome it will not be able to integrate functions in the gaming sector but it solves much bigger problems good luck brother,2,2
228,blockworks they did nt want to ban it a few months ago bitcoin will eat them alive,2,0
229,cnbc michaelsaylor bought your bitcoin dude,2,1
230,yall need to start crying when it s pumping because you ca nt stack as much and fomoing when it s crashing,2,0
231,bitcoin btc bitcoin daily chart alertbulls continue to gain power,2,2
232,i wanted ath today as much as anyone but honestly this slow and steady rise is best thing for bitcoin i m starting to think it ca nt be stopped no more crashes onward and upward slow and steady wins the race,2,2
233,if we do see k bitcoin i am looking forward to buying btc in a single order,2,1
234,whoissuperpower i will support this project until it is successful bsc airdrop btc maharunn earnpolash fuadfuad ahatikhasan trtizlehd,2,2
235,the greatest universal income redistribution event of all time is currently taking place but of the population isn t noticing bitcoin,2,2
236,elonmusk fix the money and make children affordable again jeff and i chata bit about the systems in place and how bitcoin and technology helps,2,2
237,step if you do nt have any btc head over to a centralized exchange like coinbase and buy some step now you re ready open the core extension and click the sign on the bottom and click bridge click from bitcoin on the drop down menu and click add bitcoin,2,1
238,does anyone know the devs they seem pretty cool so far daylightdefi btc currency krobitailleart blockepiccn luminarylovato andersonnavari anistricks akunwangy geektime andrewg,2,1
239,joecarlasare bitcoin the last bastion of free market pricing,2,1
240,i think we get a nice low that is a v good buy soon on bitcoin but we ll see,2,1
241,new development for our china whales bitcoin has been declared legal virtual property under chinese law,2,2
242,great time to buy for those of you who missed out before,2,2
243,buy bitcoin and ethereumclassic,2,2
244,i m heading to a gun show today hopefully i can buy ammo with bitcoin,2,1
245,tommycatbsc the reward is great keep going and get to the success thanks for shared this nice opportunity i will be forever grateful if i get the award dimples vexo luckel kukizp lon bnb btc solana,2,2
246,made this prediction back in may price action is following fairly close i hope it continues to do so aave bitcoin crypto,2,1
247,my cheat sheet for trading bitcoin hasn t failed me yet btc btc,2,1
248,keep telling people to buy bitcoin,2,2
249,tritadorxyz watcherguru you are being fooled research what it means in the mean time buy bitcoin,2,2
250,magdahromii techdev data analysis shows a minimum of k for bitcoin by end of this cycle a few things can prevent that from happening an apocalypse a giant asteroid hitting earth earth s entire power grid blows up chance of those things happening by end of this cycle btc,2,1
251,two bitcoin funds launched in singapore by masregulated fund manager the new bitcoin funds aim to provide simple and secure exposure to bitcoin for professional investors bitcoin btc btc cryptocurrency,2,2
252,i own of a bitcoin omg i feel so wealthy it,2,2
253,ponzi is when new money is printed and used to pay off old money it wo nt last utility value is when a lot of people use it as a tool crypto is used for global fundraising investments xborder remittances micro payments defi nfts by a few hundred million people btc,2,0
254,optimism this rally is real btc,2,2
255,bitcoin bnb binance important crypto new year,2,1
256,panama could offer a discount for canal usage when paid in btc,2,1
257,the current price of bitcoin is it has increased by in the last hours bitcoin btc cryptocurrency,2,2
258,bitcoin breakout beyond k brings bull market fractal back in view btc lightningnetwork,2,1
259,simuliu variety despite the fall and rise of bitcoin am still earning from it via mining and trading of bitcoin this not the time to sell this is the time to invest contact abrantesrene and invest your coins i earned investing,2,2
260,czbinance almost crypto was born for money was fighting for the freedom and progress of the people such as bitcoin ethereum xdag,2,2
261,crypto bill incoming russia s finance ministry kicks off public comment period btc cryptonews nft,2,1
262,haha lucky number in dice is mine it was a great win on betfury in the amount of usdt my username babygun betfurysuccess bitcoin staking,2,2
263,bitcoin maybe will up to k today crytpocurrency,2,1
264,like if you bought bitcoin below,2,1
265,projects like uos is how crypto will reach mass adoption change my mind btc,2,2
266,this chart is screaming buy and i must obey bitcoin flirting with the i m in for more btc i think my earlier cup and handle pattern analysis is likely correct so going to go big,2,2
267,join me in my space btc eth nfts,2,1
268,senlummis integrating bitcoin is priority by itself in its own proposal i hope can t mix it with altcoin securities it s not ethical and those are just companies trying to capitalize on this moment,2,0
269,mythical games raises million in series c funding round led by az bitcoin news bitcoin,2,1
270,i don t care about stocks bonds or the real economy bitcoin is detached from everything is the cyber light the cure the swarm of cyber hornets that s gon na fly to the moon and beyond transcend our human form to become pure energy ok michael you re grounded again,2,2
271,yes most definitely brave browser search engine i ve made the change now that i can stake my bat to earn dividends in bitcoin on the axionnetwork what more can i ask made my member family switch to brave,2,2
272,this is the way,2,2
273,the opportunity given to you to stack btc is insane use these next months wisely,2,2
274,haha i do enjoy the optimism and enthusiasm in these threads realistic or not,2,1
275,beincrypto without a doubt bitcoin and eth will be the first two followed by sol matic and i might also invest in torn torn in pptorn vault would give autocompounded returns as high as apy,2,2
276,bitcoin golden rules never sell out of fear minimum hodl is years plan to hodl for a decade ignore all price volatility stack through bear markets always build conviction,2,2
277,cartoonsnow keybb you will be missing out on a lifetime opportunity if you do nt invest in btc because bitcoin is here to stay go get a startup capital today send a dm me and learn how to grow your capital,2,2
278,bitcoin coinbase has passed tiktok on the apple us app store and is now in the position reiterating target for and for,2,1
279,so close to all time highs today btc crypto,2,2
280,hey i joined a network called surveyj and earned today you get paid for testing out new free apps and posting on social media sign up with my link for an instant signup bonus surveyj cashapp bitcoin,2,1
281,based on the wyckoff event distribution it is real look it up this will dip to k before slingshooting to k o,2,1
282,i bought my bitcoins through localbitcoinscom happened immediately,2,2
283,hey i joined a network called surveyj and earned today you get paid for surveys and posting on social media sign up with my link for an instant signup bonus surveyj cashapp bitcoin,2,1
284,bitcoin btc crypto btc oh oh will i wake up k,2,1
285,bitcoin surpasses k following massive volatility markets add b overnight market watch marketwatch,2,1
286,might buy some more bitcoin,2,2
287,hodlonaut all i see is the words buy bitcoin when i see that,2,1
288,make it happen bitcoin,2,2
289,omg i love today not only is it taco tuesday my two favorites are trending bitcoin d d,2,2
290,bitcoin bulls do not despair a leading model for predicting bitcoin s trajectory says we re still on track to hit tripledigit btc in,2,2
291,i do think these are the first signs of a trend break popular twitter account phoenix commented in a fresh post on the day btc it added that reaching and holding would be absolutely key for bulls this marking last week s high,2,1
292,bitcoin we are about to witness massive short squeeze and massive upside btc move within few hours we are going to the moon again i ve been following taking cryptochartsm tweets and every single tips seriously i ve been doing superb crypto follow her,2,1
293,bitcoin has so many passionate individuals,2,2
294,bitcoin can t be stopped so they will try to divert your attention away from bitcoin,2,2
295,let the future generations worry about that we have some adoption and scaling to do they the generation born in will most likely come to consensus on some form of minor inflation to secure the network see what peter todd said on it,2,1
296,danheld cagr the hell out of that financial freedom thanks bitcoin,2,2
297,levioo kingsalman has btc entered bullish or is mtn next medicalchain,2,1
298,dennisporter bitcoin will progress anyway,2,2
299,we re rebounding back to damn it is crazy speed that bitcoin is recovering from such falls,2,2
