text,sen
crypto markets trading like its an all hands on deck effort to keep tether from breaking its peg curious at what price they start to abandon ship and its every person for themselves looks totally broken the mother of all bitcoin waterfalls is close,-1
after looking at some indicators you might be right according to my fibonacci chart extensions blowoff top will be in the k range before year bear market,-1
breaking yearold man who owns mostly bank stonks says he hates btc again,-1
bitcoin funding rates stay negative as btc price spikes to k bitcoin btc crypto,-1
but the damage was done though we got rekt d it will now be a big hill to climb back up hodl,-1
here s why cryptos would remain in the bear market territory in bitcoin ethereum,-1
brentlindeque bitcoin rendered government a nonessential service,-1
thecryptolark if ethereum flips bitcoin then we ve lost fiat is still the winner nothing changes in the world,-1
monsterscoins i m everything except bullish right now i still have confidence in a few alts sys eth cvp syscoin optimistic l as of now has nearinstant fulfillment bitcoin pow in the background multiquorum finality syscoin,-1
bitcoin fear and greed terra luna classic scam via youtube,-1
i m sad that it s a few more days until the next paycheck,-1
because forex markets have years of solidity and millions in budget not to mention that they use their own datacenters these lame cryptomarkets are all supported by some amazoncloudstyle system they delegate and delegate their security and in the end get buttfucked,-1
dude no one here cares about the alts it could get you banned,-1
i m out of that project it s horrible was just in it cause andreas but we see now what it is,-1
k what dollars you ve got to be kidding,-1
cryptohammie the volume is fucking shit bitcoin btc is going to zero tomorrow,-1
everyone is getting in on the scam got ta dump their gains on an unsuspecting public bitcoin,-1
ripples seems to have left the red zone bitcoin please wake up,-1
so i think its pretty obvious that ethereum is lifting the crypto market not btc and i am bullish on both ethereum,-1
bitcoin people are literally angry because they see a picture of btc and bnb beside one another someone please slap me if i ever become that deranged,-1
another random dump lol,-1
fossgregfoss dylanleclair susiebdds how dare you btc,-1
overall every market is not performing well and looking at the current inflation war and covid situation it is highly unlikely we will see btc rise if you see a pump you will see a dump too cryptotrading,-1
bitcoin mining operation in finger lakes sparks local concerns,-1
ladyofcrypto bitcoin will b so cheap in coming days if not weeks if not minutes,-1
this is worrisome we will talk about this shortly btc futures perpetual funding rate all exchanges bitcoin,-1
what i find really odd is that people keep saying they want more regulation to legitimise the area and allow institutional money to come in and then when there are reports there will be more regulation the market seems to get scared,-1
guess bitcoin is going down again btc,-1
there is only twitter and specific coin related telegram groups which might be infested with scammers as well you re probably better off here if you find a better sub pls let me know,-1
economist says bitcoin is nt too big to fail warns btc can only establish itself if governments allow it,-1
let me play a sad song for you on the worlds smallest violin,-1
hey mr whale can you please pump bitcoin my position is underwater,-1
analyst who accurately called massive bitcoin crash has bad news for crypto traders here s his new target,-1
that sounds even bad lol that s something worse than gambling,-1
crypto investors cryptocrash bitcoin cryptocurrencynews,-1
czbinance in the child trafficking world pizza is a symbol for podephiles to have sex with kids interesting correlation with btc whom was stolen to use for human trafficking among other things,-1
anyone else hovering their finger over the instant sell button i mean this is unreal there has to be a violent pullback before going further,-1
i see have nt wanted to buy for a while,-1
buy high sell low lol,-1
to the people forcing bitcoin up and holding it for what s supposed to be when you lose all you re money don t cry bitcoin bitcoin,-1
got it so you want someone else to be bag holders of your shitcoin to bail you out of your poor choices grow up btc crypto celsiusnetwork,-1
whine call it what you want i just simply type out the opinion that i think bitcoin will continue to go down on value thats my opinion you can call it a whine or not i do nt care i m just bearish on bitcoin deal with it,-1
well welll bears at it btc bnb eth,-1
on a day bitcoin is getting a little battered and amp is on a downer for now very interesting on coinbase at this moment amp has jumped to number in popularity also the buy to sell ratio is way up at almost can you say amp accumulation she s going to go,-1
news on the block bitcoin falls under btc btc bitcoin bitcoin,-1
it s the last line of support guys bitcoin luna btc,-1
bitcoin broke k support not looking good at all,-1
bitcoin may not last that much longer academic warns,-1
i have low confidence that the boomers in charge understand bitcoin,-1
fell what s next support,-1
joshbtchodl ftxofficial unless vlp brings the financial benefits i see reason to continue to add btc there usdc still seems to reign supreme at investvoyager,-1
ryangarzone ukharvey orlandobravotb warrenbuffett madoff defrauded almos billion compared to bitcoin s market cap of trillion he was trillion billion from bitcoin pretty close right,-1
no i m not stupid enough to invest in something that is nt backed by anything,-1
thecryptolark i see dead btc,-1
bitcoin need defibrillator flatline,-1
those usd btc stimulus given to el salvador citizens the are now worth usd,-1
does the fact that mining btc costs money mean that the value of btc is inherently tied to their most hated of all financial assets fiat money do cryptonites imagine a world in which an energy company will accept btc as payment for energy production to mine btc,-1
new york clamps down on bitcoin mining in newly passed bill,-1
kevin o leary ftx collapse is a turning point for the industry crypto bottom is in bitcoin crypto,-1
bitcoin manipulation at its finest on the weekend nothing like dump and pump in the span of couple hours,-1
it s not like lamborghini said they won t accept bitcoin nobody wants a fucking tesla,-1
some very stupid people in my comments the irony,-1
nope they are not dumb just not experienced and if werent for dumb money btc wouldnt have gone so high and it will remain low from ath until that same dumb money returns,-1
we are now seeing the consolidation in bitcoin i was hoping for last week ethereum looks even better technically than bitcoin if you ask me,-1
we probably do nt see xxx for bitcoin ever,-1
just in the us has dropped the ball on bitcoin and crypto regulation sec commissioner,-1
you call this a dump yall do nt know bitcoin,-1
that s great he can get out before he gets stuck in this shithole but yea kinda agree just feels bad seeing people still make accounts for this dog shit website,-1
what a shaky day for the crypto market right btc binance ftx,-1
do bitcoin bugs have some kind of compulsive urge to come up with new statements like this every month or so first we were gon na revolutionize crossborder payments awesome now we re going to unite the gop and dems you have lost me sir,-1
btc monthly looks even more bearish than my last tweet about the same on april looks like a sell on rise market now post fed recovery rally if any could be shortlived unless powell shifts focus back to growth from inflation,-1
this just makes me think the asset was overvalued the last two years,-1
does coinbase pro allow you to withdraw to a bc address my withdrawals are failing,-1
edmonton international student warns others after losing k to phone scammers cbc news bitcoin btc,-1
btc also coming into a support level if this one does nt hold down towards k is possible,-1
bitcoin down to k btc bitcoin,-1
even if true they say crypto not bitcoin so shitcoins will be involved and it probably will be implemented horribly with users not allowing to withdraw to their own wallet or something i am not so much looking forward to the wave of newbie questions similar to i bought bitcoin on robinhood and ca nt withdraw them d,-1
full of fuds on internet btc bitcoin btc they just want to manipulate market by doing such things,-1
i can feel that we re going to brake some support on btc chart sooner weekly picture says a lot for me large investor is cooking for something really big b e c a r e f u l,-1
nope we will drop from k to k,-1
this probably gets asked a lot but how worried should we be about tether there s been talk for a long time that the btc price is artificially propped up by usdt it seems like a usdt collapse could really hurt the public perception of btc,-1
btcarchive i scammed someone into giving me btc for aud,-1
bitcoin dogecoin and ethereum are crashing here s why,-1
what if the grayscale btc etf gets approved by july th what if this is the cleansing of the btc defi ponzis before hand what if,-1
gradybooch bitcoin does nt belong on exchanges for this exact reason but twitter geniuses know everyting abt all tings,-1
markmoss any coin that is federally regulated goes against everything that bitcoin was created for too many idiots out there making crypto worse,-1
so glad i ve learn about crypto back in i ca nt imagine bitcoin is still over k,-1
cryptengineer heard of strikex while bitcoin is dipping strikex has been constantly rising big things happening great project strikexofficial,-1
bitcoin i m holding firm to no crypto until june is over i ve made my way thru the cheerleaders salesmen only to find meme traders gamblers finally find a serious guy making sense until he says he s concerned about the fed printing money c mon really headache,-1
sold everything i m moving on to bigger and better things bitcoin going to link going to,-1
metaverse and blockchain gaming altcoins rally while bitcoin looks for support blockchain altcoin bitcoin via,-1
rip to all the shorts taken out yesterday according to bitfinex positions have been closed out down nearly edit just read that million in bitcoin shorts was liquidated,-1
well something bots or somebody whales just gave btc a nice shot in the arse looks good after the flatline that has been this last couple days grabs moon boots justincase,-1
sideways and then down,-1
good morning everyone except for bitcoin bears i hope you re having a terrible day,-1
the european parliament voted against the introduction of the cryptocurrency market law mica which restricts the use of cryptocurrency under the socalled pow mechanism btc,-1
china fuck you bitcoin fuck you,-1
yes we can definitely compare bitcoin vs gold in terms of volatile,-1
punk that btc solves everything when it goes to zero,-1
bitcoin is having a shit day,-1
according to x y of people asked have held bitcoin at some point in their life i m yet to see a convincing study or report on bitcoin adoption for any country or for the whole world,-1
goingparabolic trillions of scam the others companys has assets bitcoin has smoke air nothing,-1
kucoincom btc is the greatest scam and money burning in th century and never worth more than btc ponzi,-1
it always leaves such a little amount in there that you can t do anything with like you can t just buy more of a coin because it s below the minimum amount for a purchase it s so annoying,-1
typical rbitcoin user he s and used his grandmas birthday money to buy btc and now he s crying because he s down to,-1
bitcoin btc back to earth with nice and easy landing all bullish hard work have been vanished with out any hard work thats why they call it bear market,-1
stackthefuture agreed diet and bitcoin are totally unrelated just another toxic part of the bitcoin community,-1
hhh balance stuck in cryptocurrency btc dawn,-1
it is impossible to graft a new branch of speculative currency onto the dying tree of capitalism bitcoin,-1
it is important for you to understand what is happening to bitcoin right now it is being manipulated by a momentum ignition algorithm btc example below here s a definition and source trading bitcoin right now is dangerous bc it is being manipulated,-1
btc gurus talking a giant head and shoulders in a weekly tf if that scenario happens we see k or even lower bitcoin,-1
you ca nt pay with bitcoin,-1
bitcoin mempool clears for the first time since november is it a bubble sign the current situation may indicate an upcoming market crash,-1
bitcoin just lost its footing but gold silver ready for ath chartwise,-1
elon musk s bitcoin bet cost tesla million bitcoin btc,-1
start to selling now btc bitcoin this bear market will stay at least years untill good luck to all,-1
here s a look at some of the scams surrounding cryptocurrency and how you can limit the risk if you own or trade in crypto bitcoin crypto fraud,-1
a lot of uneducated day traders here,-1
tmobile breach includes not only names phone numbers and physical addresses but also more sensitive data like ssn s driver s license information and imei numbers info sold for bitcoin tmus,-1
damn i miss the bull market bitcoin crypto,-1
forget bitcoin altcoins are moving with you can analyze where the volumeprice is movin,-1
bitcoin btc price falls sharply after brief rebound to k level new alltime high btc balances for a specific bitcoin address category were revealed by intotheblock when terra dumped its bitcoin into the market in early may,-1
another month of crashing,-1
i ve never had to transfer money out of country other than by credit card payment which was instant no fees major institutions may find this a compelling feature of bitcoin but major institutions wo nt be dumping millions or billions into an asset class with a chart like btc s just to save a couple days and dollars on transactions they ve been living with just fine for decades with the current paradigm btc solves a problem i ve never heard major concerns over the best use case for crypto is drug dealers and other criminals and that s a perfectly reasonable use case i m sure btc will find a floor around or or who knows where thanks to these market participants but other than them hmm,-1
no one other than michael saylor pomp joe lubein claytonhinman are buying movie tickets with btc and eth,-1
never had a job or did anything useful or good for the world tries to impress family friends with money withdrawals doesn t get invited to parties everyone hates the lazy knucklehead,-1
i m not talking about the network at all networks can always go underground and i agree there s no way to stop it i m talking about the monetary value of btc because currently what we re doing is exchanging fiat for btc btc can still be used for the exchange of tangible products like the examples you stated but what s stopping the us gov to officially and outright declare btc an illegal currency imposing hefty finesjail term on businesses big and small if they were caught transacting in btc do you still think businesses would risk accepting them it will slowly but surely fade away the monetary value for the exchange of physical goods of btc another example i walk into a store with a kilo of drugscontrolled substance in exchange for a van of soda that kilo definitely has much much much more monetary value but it s illegal for the business to accept it yes some businesses would still take it but most wo nt in layman terms what if the future of btc is actually just a super fancy technologically perfect hyped up digital ingame currency it has it s own value tagged to it but not something you can live off it monetarywordly value you spent years exchanging and dcaing fiat for it but you ca nt actually use it if regulations are officially imposed on a global scale get what i m trying to say,-1
same thing as last year it s bullshit bitcoin magazine is trying to create a big tent conference but it s just fucking affinity scammers,-1
bitcoin falls to k traders say bulls need a hail mary to avoid a bear market bitcoin via,-1
btc bitcoin is more fun to watch when it falls close to there will be many long term investors around,-1
exactly we don t even need governments and central banks to hold bitcoin the longer they don t the faster they get buried and are irrelevant to financial system,-1
jfcargo bryanbsolstin right not bitcoin,-1
bitcoin getting bashed bitcoin bearmarket down,-1
startonio czbinance binance bitcoin is dipping deeper into the old resistance area in an effort to flip it into a new support area weekly retest in progress ethbtc is a super underrated bitcoiner i ve been taking her tweets and tips seriously i ve been doing superb,-1
ok but that s entering mental sickness stage,-1
here is the intelligence squared bitcoin vs gold debate i did with scaramucci since you bitcoin pumpers forgot to rig the vote this time i was actually able to win this one check it out and judge for yourself,-1
bitcoin price very near bottom with k dip says bullish institutional report,-1
bitcoin plunges below for first time since january the world s top digital asset bitcoin has suffered a daily plunge of over dragging the cryptocurre bitcoin cryptocurrency digitalasset,-1
ummmm the bottom is zero at you needed a telescope to see it at you needed binoculars to see it but now you just need to look down,-1
bitcoin are you okay bro,-1
cashapp would be more of a party if bitcoin was nt dropping like it is cashappfridaynight crashrs,-1
if you invested in bitcoin year ago alltime high you d have,-1
switzerland hesitant with a possible mass adoption of bitcoin,-1
rovercrc when i checked btc there is nothing bullish about the price because it s still below as the market is still unstable however i find pptorn vault an auto compounding apr that maximizes users deposit into torn reward that increases profit and reduces gas fee bullish,-1
new to trezor i just paid a fee in btc to move k worth of btc from coinbase pro to trezor is this normal that s so much money just to transfer funds,-1
i dunno is the risk of not earning interest by holding btc yourself worth it lots of risk just managing your own crypto for most people,-1
it hurts to see the whole crypto portfolio fall into minus i have no more money to buy the dips dogecoin bitcoin eth,-1
bitcoin is literally crashing,-1
bitcoin be ready for a bearmarket btc take profit,-1
jamie dimon remains a skeptic of bitcoin stating that bitcoin should be regulated by the government click here for more details leapwealth texasadvisor bitcoin,-1
just in tesla is currently down over million in its bitcoin investment when buy the dip elon,-1
only buy a ford bitcoin can t buy money lose not wisdom,-1
btc has retraced from its all time highs still less than the retracement this past september btc crypto bitcoin,-1
tesla reverses decision on bitcoin car payments on environmental concerns bitcoin,-1
why is ethereum better than bitcoin better money as it continues to scale to meet demand better finance supporting all services that are required for money through defi better store of value with lower inflation long term security,-1
yes before the btc crash there was a run up sadly i missed that will btc ever be above k again i seriously doubt it but hey no one knows for sure anything is possible i m just saying in my opinion its not likely i think btc rose for the last time in and its just downhill from here on until it stops at around k would be my best nonexpert guess,-1
cryptohayes im willing to bet that you wont see btc at k,-1
depression these type of irresponsible statements are going to hurt new investors who will be misled to buy at the wrong time btc is going to fall further due to ftx genesis and other crisis in crypto market there is absolutely no chance of btc going to k in few weeks,-1
tonevays that is just an excuse for btc price manipulation,-1
i got ta say i fucking suck at trading btc,-1
head and shoulders inside of a bear flag not looking good for btc btc,-1
digital currencies are risky invest with caution btc ethereum,-1
monthly closed like shit whole summer will be boring gg bulls you are trash btc,-1
mathieusylvain i see on bfx that btc has already fallen to k so there are no signs of life again,-1
no buyers i lost last week trading bitcoin i m not coming back on this range my bias is that a lot of ppl cashed out with so much losses that they are not coming back soon i m still in profit planning to rebuy at lower prices my eyes are on spx untill,-1
are we having fun staying poor guys bitcoin,-1
does anyone know what this is about mana to the moon so hard it broke mana crypto bitcoin btc,-1
a smart company wouldnt say they are getting into bitcoin they wouldnt want to spike their on prices would they,-1
i am very curious to see what new imaginary support lines these permanentbull guys will find after bitcoin will fall below their expectations,-1
bitcoin pyramid schemes wreak havoc on brazil s new egypt currency worldnews,-1
this trading volume is extremely unusual suspicious looks exactly what you d expect in a heavily manipulated market bitcoin,-1
all those who sold their land houses cars even borrowed money and bought bitcoin at k in april thinking it will keep going up one day you will learn this lesson do nt make investment decisions because of greed praisesnuggets bitcoin,-1
bitcoin update btc ended up crashing through my bounce range and flipped support back into resistance clear range bottom at k was lost and price has since continued down pretty clear now the downtrend remains intact and the bounce to k was a relief rally btc,-1
bitcoin is so slow futile that you have to go offchain with an even crazier system just to try to save face of btc as a legit peertopeer system pump your bags,-1
mayhemmarkets the real question is what is going to happen when btc corrects these couple of days btc corrected less than,-1
unfortunately your ids are never safe that s the risk you take for buying using coinbase and other similar exchanges,-1
good morning east asia australia with a market cap of t we are down over the past h wagging it s tail between btc is now at with a dominance of a fear greed index of shows the market is in fear,-1
danheld bitcoin gives back for sometime than it will take it all together,-1
the total crypto market cap continues to crumble as the dollar index hits a year high crypto bitcoin cryptocurrency,-1
mind the gap looks as if gold has more upside potential given the huge drop in real yields and given that digital gold bitcoin keeps struggling wthe mark,-1
bitcoin czbinance is a scammer of crypto do nt use bnbchain stealing money from bnbchain and pumping gmt token and bnb token he can do rugpulls also czbinance is a scammer of crypto,-1
bitcoin is such a pussy sometimes,-1
muatafagmi peterschiff if someone offers me as a gift a gold ingot or the equivalent in bitcoin i will always take the ingot and the hard truth is that of the people would do the same even the crypto guys the hype of the crypto market is all the gambling nothing else,-1
just in chinese central bank prohibits banks from offering any financial services that could be used for trading cryptocurrencies like bitcoin,-1
wtf i just had dream seeing btc down and bnb eth down dream,-1
breedlove so you are saying that you will bribe with bitcoin to health passport guards massive asset appreciation black market mmm interesting theory it could work,-1
you guys still have got money for the food lol i m sleeping hungry,-1
easyeight can someone please delete btc now,-1
it s over for you betches bitcoin,-1
if you have resources you can always manipulate markets politics health,-1
bitcoin when bottom mike novogratz predicts bottom for bitcoin and ethereum,-1
their ev market share is already dropping like a rock,-1
it s best to treat btc like a child now you ca nt go below k but you know exactly what will happen to it eventually btc,-1
fuck them alts btc everything will be red when almighty is red,-1
i hate how finance bros took over bitcoin and pegged it to fiat bitcoin could have been the inflation hedge it was supposed to be were it not for finance bros,-1
i ve only used kraken did some small x leverage longs but the rollover fees every hours seemed very expensive,-1
nice vechain shill account do nt have to tell us you re a dirty mid thirty bottom dweller we could tell,-1
what happens if bitcoin falls below bitcoin is down nearly in the past week some experts believe it can still go lower,-1
i m getting off binance personally lost faith in them don t like my money been locked in there,-1
bonafidefluke fear btc umb isp,-1
i really wouldn t be asking strangers such an important question i m sure you d get well meaning answers but you probably need professional advice,0
would you say proofofstake is more or less secure,0
update to the bitcoin weekly chart btc jclcapital,0
you can buy on cash app which has a high fee for purchase but they eat the withdrawal fee which i personally like if you already have btc you can send to a lightning wallet and avoid such high fees in the future,0
rektcapital in this case btc would have to close weekly candle with a wick in other words renounce back upp to k until sunday midnight,0
it s not fun and does nt make any sense to look at it like that,0
yea i didn t think about that i have more now too thanks to the dip i ve stacked more,0
true though the energy consumption these days seems to be all on a massive rate and amount though the fact that the more we look into things the more we come closer to a world where resource being used up,0
tank baby i ll buy in at k,0
bitcoin note the red box that shows price went from about to about in four months reverse symmetry could have us back at around within the next four months or much less feel free to remind me,0
