text,sen
what are the advantages of bitcoin additionally merchant processors exist to assist merchants in processing transactions converting bitcoins to fiat currency and depositing funds directly into merchants bank accounts daily bitcoin,1
bitcoin never ending story no one uses it only criminals use it only nerds use it only speculators use it only a small of the world uses it only small companies use it only small countries use it,1
btc who is ready to buy btc k again orders in pending btc k eth k,1
davidgokhshtein choosing the right investment strategy can reduce your risk and make the most of your money i have made over btc profit this year regardless the market condition not just by buying the dip but understanding implementing trade with signals supplied by georgeleonel,1
maybe do a bit more than half now like and then get that dca in fast maybe daily purchases this thing really wants to go up,1
gabrielkurman bitcoin it is clear what market makers are still doing trapping bulls and preparing shorts for another move to the downside the last one before the impulse to kk be patient and buy the dip following ray tweets and predictions i ve been doing extremely superb,1
intocryptoverse sure bitcoin is king but we have other kings coming into limelight too cvp powerpool been part of them,1
bouquet of dreams bitcoin digitalart,1
btcfuel btc is always bullish fud is bullish signal,1
bitcoin lightning fixes this,1
saylor i feel like bulls are still in control here i m holding swing and scalp longs targeting k following rachelwolfson tweets prediction and tips i ve learnt a lot and i don t mind investing of my income in btc she has great tips and tweets they ve been helping me,1
huge volume in btc most probably after breaking the old ath of k,1
great way to look at your bitcoin accumulation don t worry about buying a whole coin stack sats and watch them grow over time the wealth will follow,1
there can be only one christopher lambert the highlander on bitcoin am i doing this right saylor,1
the strongest bullish signal flashed for bitcoin not trend reverse but price bounce is anticipated tradeosiann is a super btc trader i ve been following his tweets and tips seriously i ve been doing great dash luna lina rsr cryptocurrency bal hekl,1
i fuckin love watching these markets bitcoin litecoin,1
bitcoin is the amazon of crypto and everything else are bets says blocktower founder,1
altcryptogems if you manage to gain wealth by holding bitcoin over time people will say you did nt earn that but what they never acknowledge is the hardship of holding through multiple dips if btc ever gets above k beyond you earned it follow nbtc tweets tips on btc,1
natural selection weeding out the stupid and gullible from the bitcoin ecosystem makes it healthier in the long run,1
it should nt take an entire work week of grueling hour days to understand bitcoin and to secure funds with multisig our concierge team will get you up and running in hour starting from scratch and our bitcoin resources are some of the best,1
i m just doing my job even when i think is wrong bitcoin fixes this also,1
el salvador foreign investors are now exempt from tax on bitcoin profits sentiment positive brief,1
btc likely going between k to k before heading towards new high pushpendratech pushpendrakum openprofit cryptoamanclub sumitkapoor themooncarl mmcrypto alessiorastani cryptojebb bitboycrypto,1
bitcoin and there we wen t on our way to the range low currently hitting the mid range of the red range point which has imo the highest probability for some relief,1
everyone that bought at k do nt sell we coming back for you,1
i know i was making a point over a long period of time hodling always outperforms trading don t trade just hodl,1
bitzippofficial this project is very good and this project bella mohdshaanu nsnoman,1
mattwallace elonmusk therationalroot i d say put some on bitcoin and dogecoin we can have multiple currencies but with time we can see what gets adopted,1
btcusd may go up today btc,1
webcoin coinmarketcap bitcoin c tru its good project afgansaif alamzar andersoncooper,1
reminder that economics alone drives bitcoin to be green the most remote energy the most neglected the most boondoggly imaginable bitcoin does not discriminate no bureaucrats needed thanks,1
happy day bit coiners,1
only if you own at least bitcoin,1
every move you make is a risky every ship that sail is at a risk but the fact that will power and courage makes them face it,1
mayor mayorconger of jackson tennessee will convert his next paycheck into bitcoin,1
just used mine for the first time today nerveracking but then it begins to make sense good luck,1
for those in the cryptocurrency community who withstood the pressures to sell or abandon hope during the bitcoin and altcoin dip i salute you you won go forward and prosper,1
yeah in total i m ok,1
bitcoin will go higher from support long for bitstamp btcusd by signalprovider,1
shitcoins are still shitcoins even in self custody do nt be fooled turn into bitcoin,1
time is key your not far off the growth is coming which will reflect in price kda btc,1
but but but btc spiked because fake news but but but btc will go back to k tomorrow but but but dead cat bounce which btw of this sub do nt even know the meaning you must have such a sad life to be a fudder,1
cobie choosing the right investment strategy can reduce your risk and make the most of your money i have made over btc profit this year regardless the market condition not just by buying the dip but understanding implementing trade with signals supplied by georgeleonel,1
dmtland easyfinetwork illuviumio ferrumnetwork dmtland btc is about to break the recent high which would also result in ascending triangle breakout long it after a confirmation eth nft easy renbtc kpr bitcoin slp akro crypto cvp xrp easyfinetwork,1
ren tp bullish as fuck telegram channel forex guy vip btc eth bravo,1
i dont see it going as low as k i am thinking k and then bounce back to k,1
for this rocket to the moon,1
bullish af btc bitcoin btc,1
recommended yesterday went up so much today bsc btc for,1
have been hanging out out irl the past days happy to see btc pump a little today what else have i missed this weekend,1
joeyyusef that s us brother as i always say all bitcoin folk are welcome at my estate of niua fo ou anytime aka bitcoin island,1
bitcoin it s the f kin catalina wine mixer,1
over in gains so far on our minute btc trades you would have been short the decline in stocks all posted here and would have caught the rebound higher again all posted here,1
intocryptoverse beautiful bitcoin sidelines since k oh how i love making money,1
alexdreyfus cointelegraph turkey the country of crypto tokenavocado btc,1
inverse cramer index officially confirms bitcoin to the moon,1
btc bitcoin back above k as low as earlier,1
alright channel is still valid nailing it again atm btc is in the middle of the channel the market structure turning bullish on the min,1
hodlingcarla btc is the new normal,1
pyramid scheme promoters tyler cameron btc is a scam btc is not bitcoin,1
eth going to x remember my tweet look at the chart buy buy buy a big bag now bitcoin btc sol doge shib keep nu xec zec dent hot bnb om omg vet xrp ada polx poly pond bond,1
rovercrc hell yea baby dracarys bitcoin,1
swing up trend for btcusdt on minute timeframe btc bitcoin,1
princfilip some middle eastern monarchies might adopt bitcoin sooner than we think bitcoinadoption read more,1
documenting our journey to hyperbitcoinization starting with el salvador what is happening in el salvador will come to the rest of the world and it seems that bitcoin changes everything,1
i ve noticed that slow days on the btc daily often mean something big is brewing,1
danheld bitcoin is my savings account too now austria taxes bitcoin gains with ups buy hodl don t trade bitcoin,1
traderel bitcoin is still above ka bounce is expecting from here target at kthe biggest risk with bitcoin has been not owning it at this point not having any btc feels irresponsible buy the dip bravo bmon made us proud her ta tips have been very helpful i ve been superb,1
advisor to president of colombia calls bitcoin most brilliant piece of software ever bitcoin magazine bitcoinmagazine btc colombia cyptopotato,1
i ve been hodling and dcaing for around a year now not long in this space i know and am still extremely happy with my positions all of you chads that bought in at k need to stop crying and realize that this is bitcoin welcome to thunderdome bitches if you ca nt handle the erratic swings go buy some michael kors stock and shut the fuck up,1
someone transferred in bitcoin and paid a fee of that s a transaction fee of no government bank or third party had to verify the transaction nor could they have stopped it if they wanted to,1
peterschiff and you think you can change the mindset of a bitcoin hodlers they are as cool and calm as the great msd sick mind,1
btc pairs macd cross daily pairs agi cos dcr mana nkn rcn xvg zil condition macd cross bullish btc binance sign up,1
btc will be accepted in phone booths soon enough,1
used to be so lost in the space not realizing network news was nt it then i found the gentlemen of crypto krbecrypto blkbtcbillions kingblessdotcom bitcoinzay bigmarh now my eyes stay wide open in the crypto game accept these flowers guys bitcoin,1
conservmillen i see bitcoin slowly becoming a substtute currency for banks playing same role as gold did in the early days btc over fiat thanks to stellajeffreyfx he knows a lot when it comes to btcoin his tweets predictions have been helpful thanks for taking your time to educate us,1
jpmorgan will give retail wealth clients access to bitcoin funds the first big bank to open up bitcoin access to retail here we go,1
hey mate peterschiff your shiny rock crashed by almost while btc btc is up only mode,1
go to sleep wake up by the next halving don t look back if someone tells you there was a bear market you say oh really bitcoin holding till death,1
even if the bears tank the bitcoin price to k you are still in a good position if you buy now bitcoins price will be over k sooner or later just accumulate whenever you can maybe try to find some good altcoins to maximize your profits but do nt listen to influencers,1
people will soon realize in order to have their shit coin like ada to pump they must pump bitcoin first,1
just finished reading the bitcoin standard by professor saifedean best reading in recent years it will be difficult to maintain this level of quality in the next books i will read looking forward to the arrival of the fiat standard of that same author,1
central african republic has adopted bitcoin as reference currency office of the presidency btc cryptonews nft btc,1
born to run bitcoin weekend hustle,1
kennyligthart michaelsaylor miketyson man gold was the security of fiat payments with gold you could not pay as it is physically not possible with bitcoin this obstacle is overcome it will not be able to integrate functions in the gaming sector but it solves much bigger problems good luck brother,1
blockworks they did nt want to ban it a few months ago bitcoin will eat them alive,1
cnbc michaelsaylor bought your bitcoin dude,1
yall need to start crying when it s pumping because you ca nt stack as much and fomoing when it s crashing,1
bitcoin btc bitcoin daily chart alertbulls continue to gain power,1
i wanted ath today as much as anyone but honestly this slow and steady rise is best thing for bitcoin i m starting to think it ca nt be stopped no more crashes onward and upward slow and steady wins the race,1
if we do see k bitcoin i am looking forward to buying btc in a single order,1
whoissuperpower i will support this project until it is successful bsc airdrop btc maharunn earnpolash fuadfuad ahatikhasan trtizlehd,1
the greatest universal income redistribution event of all time is currently taking place but of the population isn t noticing bitcoin,1
elonmusk fix the money and make children affordable again jeff and i chata bit about the systems in place and how bitcoin and technology helps,1
step if you do nt have any btc head over to a centralized exchange like coinbase and buy some step now you re ready open the core extension and click the sign on the bottom and click bridge click from bitcoin on the drop down menu and click add bitcoin,1
does anyone know the devs they seem pretty cool so far daylightdefi btc currency krobitailleart blockepiccn luminarylovato andersonnavari anistricks akunwangy geektime andrewg,1
joecarlasare bitcoin the last bastion of free market pricing,1
i think we get a nice low that is a v good buy soon on bitcoin but we ll see,1
new development for our china whales bitcoin has been declared legal virtual property under chinese law,1
great time to buy for those of you who missed out before,1
buy bitcoin and ethereumclassic,1
i m heading to a gun show today hopefully i can buy ammo with bitcoin,1
tommycatbsc the reward is great keep going and get to the success thanks for shared this nice opportunity i will be forever grateful if i get the award dimples vexo luckel kukizp lon bnb btc solana,1
made this prediction back in may price action is following fairly close i hope it continues to do so aave bitcoin crypto,1
my cheat sheet for trading bitcoin hasn t failed me yet btc btc,1
keep telling people to buy bitcoin,1
tritadorxyz watcherguru you are being fooled research what it means in the mean time buy bitcoin,1
magdahromii techdev data analysis shows a minimum of k for bitcoin by end of this cycle a few things can prevent that from happening an apocalypse a giant asteroid hitting earth earth s entire power grid blows up chance of those things happening by end of this cycle btc,1
two bitcoin funds launched in singapore by masregulated fund manager the new bitcoin funds aim to provide simple and secure exposure to bitcoin for professional investors bitcoin btc btc cryptocurrency,1
i own of a bitcoin omg i feel so wealthy it,1
ponzi is when new money is printed and used to pay off old money it wo nt last utility value is when a lot of people use it as a tool crypto is used for global fundraising investments xborder remittances micro payments defi nfts by a few hundred million people btc,1
optimism this rally is real btc,1
bitcoin bnb binance important crypto new year,1
panama could offer a discount for canal usage when paid in btc,1
the current price of bitcoin is it has increased by in the last hours bitcoin btc cryptocurrency,1
bitcoin breakout beyond k brings bull market fractal back in view btc lightningnetwork,1
simuliu variety despite the fall and rise of bitcoin am still earning from it via mining and trading of bitcoin this not the time to sell this is the time to invest contact abrantesrene and invest your coins i earned investing,1
czbinance almost crypto was born for money was fighting for the freedom and progress of the people such as bitcoin ethereum xdag,1
crypto bill incoming russia s finance ministry kicks off public comment period btc cryptonews nft,1
haha lucky number in dice is mine it was a great win on betfury in the amount of usdt my username babygun betfurysuccess bitcoin staking,1
bitcoin maybe will up to k today crytpocurrency,1
like if you bought bitcoin below,1
projects like uos is how crypto will reach mass adoption change my mind btc,1
this chart is screaming buy and i must obey bitcoin flirting with the i m in for more btc i think my earlier cup and handle pattern analysis is likely correct so going to go big,1
join me in my space btc eth nfts,1
senlummis integrating bitcoin is priority by itself in its own proposal i hope can t mix it with altcoin securities it s not ethical and those are just companies trying to capitalize on this moment,1
mythical games raises million in series c funding round led by az bitcoin news bitcoin,1
i don t care about stocks bonds or the real economy bitcoin is detached from everything is the cyber light the cure the swarm of cyber hornets that s gon na fly to the moon and beyond transcend our human form to become pure energy ok michael you re grounded again,1
yes most definitely brave browser search engine i ve made the change now that i can stake my bat to earn dividends in bitcoin on the axionnetwork what more can i ask made my member family switch to brave,1
this is the way,1
the opportunity given to you to stack btc is insane use these next months wisely,1
haha i do enjoy the optimism and enthusiasm in these threads realistic or not,1
beincrypto without a doubt bitcoin and eth will be the first two followed by sol matic and i might also invest in torn torn in pptorn vault would give autocompounded returns as high as apy,1
bitcoin golden rules never sell out of fear minimum hodl is years plan to hodl for a decade ignore all price volatility stack through bear markets always build conviction,1
cartoonsnow keybb you will be missing out on a lifetime opportunity if you do nt invest in btc because bitcoin is here to stay go get a startup capital today send a dm me and learn how to grow your capital,1
bitcoin coinbase has passed tiktok on the apple us app store and is now in the position reiterating target for and for,1
so close to all time highs today btc crypto,1
hey i joined a network called surveyj and earned today you get paid for testing out new free apps and posting on social media sign up with my link for an instant signup bonus surveyj cashapp bitcoin,1
based on the wyckoff event distribution it is real look it up this will dip to k before slingshooting to k o,1
i bought my bitcoins through localbitcoinscom happened immediately,1
hey i joined a network called surveyj and earned today you get paid for surveys and posting on social media sign up with my link for an instant signup bonus surveyj cashapp bitcoin,1
bitcoin btc crypto btc oh oh will i wake up k,1
bitcoin surpasses k following massive volatility markets add b overnight market watch marketwatch,1
might buy some more bitcoin,1
hodlonaut all i see is the words buy bitcoin when i see that,1
make it happen bitcoin,1
omg i love today not only is it taco tuesday my two favorites are trending bitcoin d d,1
bitcoin bulls do not despair a leading model for predicting bitcoin s trajectory says we re still on track to hit tripledigit btc in,1
i do think these are the first signs of a trend break popular twitter account phoenix commented in a fresh post on the day btc it added that reaching and holding would be absolutely key for bulls this marking last week s high,1
bitcoin we are about to witness massive short squeeze and massive upside btc move within few hours we are going to the moon again i ve been following taking cryptochartsm tweets and every single tips seriously i ve been doing superb crypto follow her,1
bitcoin has so many passionate individuals,1
bitcoin can t be stopped so they will try to divert your attention away from bitcoin,1
let the future generations worry about that we have some adoption and scaling to do they the generation born in will most likely come to consensus on some form of minor inflation to secure the network see what peter todd said on it,1
danheld cagr the hell out of that financial freedom thanks bitcoin,1
levioo kingsalman has btc entered bullish or is mtn next medicalchain,1
dennisporter bitcoin will progress anyway,1
we re rebounding back to damn it is crazy speed that bitcoin is recovering from such falls,1
