text,sen
the fees on coinbase are ridiculously high i tell people with coinbase accounts to transfer to gdax and withdraw there for free which ponders the question if they can do it for free on gdax why do nt they do it for free on coinbase,0
oh look i was right about today bitcoin,0
btc buying pressure alert price trading around bitcoin crypto btc,0
typically yes basically as safe as any hot wallet if you do it correctly with watchtowers etc,0
michael saylor bought bitcoin for el salvador bought bitcoin for elon musk bought bitcoin for they are not smart whales and you do nt want to follow them we follow the ones who bought at market bottoms,0
feels like a fast wick coming btc,0
altcryptocom take a look at sani with extreme burned amounts of lp tokens and most importantly with long term vision choose sani and hold for more gains in the future bitcoin sanin,0
got all the parts for my full bitcoin node just waiting on the case from cryptocloaks exciting times,0
a new bitcoin price zone has just been detected going down to unlock all btc zone detections join our telegram group pm us if your trial period in the group has ended prediction no,0
long position taken on dydx from pump it btc btc,0
everything is human behavior and for all that s happening i think this is an excellent moment to enter safe and slowly no greedy metisdao sovrynbtc btc eth the charts don t say it yet but they reflect things a bit slower,1
which alt coin you are buying for let s start discussion bitcoin cryptocurency,0
binance recovers m in funds connected to ronin bridge exploit btc cryptonews nft,0
bryce harper rocks massive phillies chain ahead of philliesbraves game mlb bitcoin sportsbooks,0
like sweet this is going to drop my dca,1
shanethazel tomerstrolight will regain its strength the move towards k has begun but there is some important things to consider expect k soon btcanne is a super underrated specialist who has great insights tips ta on btc been taking them seriously follow her,1
people will whine that they didn t buy more,1
inflation is one of those things that everyone sees no matter how hard the establishment tries to hide it this tip about eating potatoes for cheap nutrition is currently one of the top posts on reddit here s a real lifeprotip if you don t have bitcoin you re ngmi,1
btc d back on trendline from july,0
btc latest block info block holds transactions for a total of bitcoin including block reward block size bytes,0
bitcoin is better to be used as peer to peer it works better that way but it has a lot of fees now,1
bart is back bitcoin crypto btc,0
coal oil and gas firms have received tn from banks since the paris climate deal in but mining bitcoin is a big issue hmkaaay sentiment neutral the world s biggest banks have brief,0
scarcity on the internet was a one time discovery it can not be repeated because resistance to replicability is the invention knut svanholm,0
out of this btc scalp long with microscopic profit two wicks rejecting a push upwards and equal lows underneath may get back in after they get swept,0
bitcoin ecash is the continuation of the bitcoin cash project and continues to be developed by bitcoin abc ecash ecash protocol revenue is reinvested into ecash funds are allocated annually by the global network council gnc,0
twitter s btc plan action against coinbase oversubscribed nfts more news crypto btc,0
i had a limit buy at cash app for buying some bitcoin at and it went through,0
i m so fucking confused with where this is going btc,0
wojespn adamschefter btc invest with cryptysophia today and watch your life turn around start earning daily contact admin via telegram cryptysophia,1
apompliano vulkania supply million burned and distributes the remaining million to the wallet circulation is also million and around jokingly big projects are coming one of them is the crypto league starting this month do you think zenkin will do vlk mdtusdt btc,0
on squawkcnbc scaramucci says btc will hit k this year we like it we have over half a billion in bitc,1
bitcoin changes planet earth not a particular part,1
your question assumes there is only one crypto btc is just the current market leader and has the name recognition can superior tech pass it by maybe not in the immediate future but maybe at some point usually superior tech wins out,1
just away from ath btc,1
between may and may shiba inu saw a sudden surge in popularity increasing in price from around to an alltime high according to coinmarketcap data via newsweek cryptocurrency investsmart bitcoin,1
bitcoin and crypto becomes more useful day after day hopefully a video dropping for you guys tonight,1
was k the wick below are we in the clear now it wasnt news driven dip,0
look at the charts could settle just under not not possible,0
shhhh cash app is king the less that know the better lol,0
i ll find lambo under bridge,0
if it ai nt broke do nt fix it bitcoin,1
bitcoin is the master in teaching us patience,1
holy shit the last few minutes better than any tv that s for sure,0
i m finally able to pull the trigger on investing i was going to do it month ago when it was around k regardless i am finally able to invest after wanting to for so long i m investing k atm i m not sure which place i should go to do the transaction at first i was going to do coinbase because apparently it is easy but now people are telling me to use gdax then when i opened this thread some guy said he is transferring from gdax to gatehub i never even heard of that so now i m just asking for adviceis it fine to use cb if i m not really all in on btc its not like i m day trading and constantly switching my coins to alts and trying to make a profit everyday,0
jeevsthecurious now i m in love btc has a finite supply can be owned by anyone in any amount using a cell phone or internet connection is completely secure globally can not be controlled by any government can not be hacked,1
indian payments giant paytm could offer bitcoin services if government makes crypto legal says cfo via coinjupiter,1
ha ha ha you re stuck in time come join us in it s a messed up year but really you must catch up with the rest of us do it step out of and get on real time where bitcoin s tech is all it needs to be to function as an investment hedge against inflation join us in where we know know for a fact that the large majority of all bitcoin transactions are buying and selling and trading as an investment currency use could very well explode once enough people own btc as a speculative investment but there s plenty of time for that development will catch up once demand for currency use grows currencies take a long time to gain mass adoption and years is a teeny blip there s no rush come on out of the past take the first step,1
again the entire world doesn t revolve around the usa so it s unlikely this news affected the rest of the world and their crypto,0
i move any holdings off of coinbase anyways just curious if anyone else had issue connecting,0
cryptohellspawn i think it s a very smart idea to give corporations power over your nations currency sarcasm let them print money what can possibly go wrong bitcoin tether,1
and how does your morning start crypto btc,0
if i had to speculate the need for the bitcoinlightning use for the remittances part is that it makes his whole business model work trading algos you mentioned it s a win for him and a win for the user plus it proves that lightning can scale this is genius,1
a breakout in bitcoin to new all time highs for index btcusd by trader btcusd,1
whales going after those longs already lol btc bitcoin,0
suscanicola ryanvieira hodlberry thorchain also what if i told you there are self repaying loans on bitcoin with no liquidating risks,1
countries paying in bitcoin that s something new,0
my personal prediction for bitcoin the next days today we got a lot of volatility due to the cpi data almost million dollars got liquidated we get strong support every time between k which shows bullish for me my ta btc crypto btc,1
monday august as at hrs moscow time a we can supply as much as btc at realtime blockchain price of us worth of coins for each us b we can buy as much as us worth of btc at realtime blockchain btc price minus service fee,0
intocryptoverse so who exactly trading bitcoin with high leverage and overly excited for only move up on three days after falling,0
thursday has been an expectedly volatile day after inflation data was released bitcoin dropped to k its lowest price level since september st however as traders were in the midst of stopping the bleeding btc the sp rapidly recovered,0
it is well enough that people of the nation do not understand our banking and monetary system for if they did i believe there would be a revolution before tomorrow morning henry ford bitcoin,1
microstrategy puts another m in bitcoindespite price crashing below k via decryptmedia bitcoin microstrategy cryptocurrency,1
meitu now holds million in btc and ether after latest bitcoin purchase bitcoinnews,1
sure lol mister nostradamus we re still up billion,1
if we dumped now it would be the most demoralizing event bitcoin good thing theres a supply shock,1
everyone calm the fuck down bitcoins done this before and then it reaches new heights people act like it s never dipped and recovered before all investments should be treated as they are investments if you were looking for a quick pump and dump well ya done goofed might as well hodl on now,0
link the buy on blockchaincom explorer,0
i remember being in college researching how to buy bitcoin it was about a coin i was scared of losing didn t have much money didn t understand investments have no regrets it s all been a learning experience,0
sometimes when time or trades do nt go your way its best to sit back and relax its not like the cartel will hang you if they do nt get their fiat by tomorrow enjoy your hodlidays and let the longs who buy the dip take care of the rest,1
thanks for the support folks didn t risk anything i couldn t lose so i don t really care about hodling for the long term cheers,1
zbdplay my favourite for sure great bitcoin integration i m waiting for more sarutobi is the best one for meplevor zbdgg,1
there is this cryptocurrency sending out a monthly newsletter since and saying we will be releasing a mobile app in the coming weeks bitcoin btc,0
bitcoin on the early rise this morning long term we see there only being one way bitcoin price is going and that s up if you also feel this way get ready for our up and coming bitcoin jersey launch so you too can wear that bitcoin orange with pride and passion btc,1
new york s next mayor wants to be paid in bitcoin newyork btc crypto,1
big names big projects big opportunity buy a trilly to make a milly mcontent bitcoin documentary el salvador vs the world bank drops in september where s all the safemoon and dogearmy peeps they know how it goes,1
stockmarketpr people tend to think bitcoin is high now wait till it s k by by october k by end of this year the price years from now i can t wait bitcoin following jorgevr tweets posts tips and predictions i have added massively to my holdings it s been awesome,1
people believe that btc mining is and will always be damaging our planet but that doesn t have to stay that way hydrowhalesclub is using renewableenergy to mine making holders very wealthy and saving the planet at the same time,1
or it was supposed to be triple digits people tend to talk their position and amplify it especially around these parts,0
yes very unusual not enough support today to start the run let s hope it starts soon,0
btc has ushered in the processes to expedite the realization of the mirror reflection of heaven on earth within perception that is why i am a btc evangelist,1
bitcoin day h change usd is down to undefined with price down to btc bitcoin,0
can someone explain to me why banks do nt make payments at the weekend it s not like people do it manually bitcoin fixes this carl b menger,1
that s one small step for an exchange one giant leap for the crypto community brew to usdt spot market enables the less privileged communities to join the bitcoin market cafeswapfinance can take up the failures from any of our innovations and turn it to your success,1
money printing doesn t look like it is ending bitcoin,0
new report bitcoin filing entity digihost technology inc name frb registration statement ex filed reporting for form,0
i m not sure i purchased gbtc in my roth ira account through fidelity,0
most of them have btc as their trading pair so not that crazy,0
i believe this project is very strong and beneficial because team has done superb efforts and great development to make it the best minutes btc crypto,1
bitcoin btc amount of supply last active yy just reached a month high of btc previous month high of btc was observed on june view metric,0
bybitofficial s wsot begins june th am utc still time to register and join the tealstreet team bitcoin bybit wsot,0
beautyofhelin who is nt ready i have a feeling that bitcoin will go down as one of the biggest innovation of the st century eyes still on the ball sys will change the cause of history,1
its just a abc correction of th wave bitcoin btc,0
welcome to the full journey of btc for bitstamp btcusd by voxhit bitcoin btc,0
blk back to blackcoinorg for another chart update the last few days have shown some interesting developments greater volume a price spike and an exit from its longterm descending channel have put this crypto on a positive accumulation course btc,1
bitcoin and ethereum are trading slightly below their new alltime highs funding rates and futures premiums are in positive territory but not nearly as overheated as before the may crash btc eth ethbtc sol dot atom ltc,0
bitcoin is a christmas,1
mikealfred with celsius filing chapter bankruptcy hope regulators will not use this opportunity to bash bitcoin but instead fast track legislation to prevent bad actors like mashinsky from using customer funds to gamble,0
gold market cap t bitcoin market cap b progress bitcoin surpassing gold,0
so much to learn i enjoy the continued learning that goes along with bitcoin,1
this is what i ve been saying could be he is one of those in or whatever the number is guys who are flexible enough,0
c mon big tuna lets go,1
beware overnight usd up jpy up gold up ustyear yields down bitcoin dn riskoff across the board not buying the emini futures pump the options maket makers trying to kill some vix uvxy call premium,0
miller is a longtime bitcoin bull and has said he began buying the coin at investor bill miller on crypto bitcoin is digital gold youtube btc btc,1
exactly people talking about a whale attack think that people with lots of money invested in crypto live their lives playing mind games against an ocean of joe doe s people investing their money want to make money period,0
already sent my email if spot gets approved gbtc gaps up overnight few,0
long skl entry price stop loss link in bio tz btc bitcoin skl,0
on this episode of the bitcoin magazine podcast host cksnarks sat down with the infamous bitcoin twitter personality and troll udiwertheimer to discuss why the hardcore bitcoin faithful should not be so worried about altcoins,0
bitcoin block bytes transactions btc reward for more information visit,0
the target for btc s h chart is currently at as btc s price holds broken out of its resisting trend it is positioned according to technicals to climb over to reach this target and this may still be early stages bitcoin can go,1
more than profits and m volume in sky pump by megapump the most powerful pump in binance history dont,1
i think it s going to start sprinting next year,1
can you elaborate on the password protected recovery seed what s your method of protection and where do you store it seems like the weak link to me,0
what if it s a trap you sell at k and then go up to k in a night i think you should don t put all your money in it just keep a little reserve in case of a big crash to buy some fresh coins of course if you can time the market and sell just before the crash it s time to open the champagne but in long term bitcoin always win,1
bitcoin btc current price gbp did you enjoy reading my blog you can tip me at bcqtuzhlzexuueatkrrhajm,0
ars is satoshis right now satoshi is ars right now bitcoin,0
gm and welcome anon btc,0
pricedinbtc that is because bitcoin is free,1
this looks like the dip everyone is talking about,0
fschaeffler btc shib king,1
when btc is mil per who cares what you bought it at,1
never sell only hodl,1
barron s front page on bitcoin october,0
bitcoin week altrank is down to with price up to btc bitcoin lunarshare lunarcrush,0
this is fun to watch bitcoin,0
btc to the moon,1
whales are stacking ape ftx sand link ftx as bullish sentiments hits the crypto market bitcoin,1
i ll worry about it if it happens not before,0
brokers are encouraging uk clients to trade with foreign firms fca the regulator has already taken action against a few such brokers read more cryptocurrency bitcoin forex,0
google has released a new crypto search feature that syncs eth wallet address balances from etherscan but why not start with bitcoin goog eth,0
same a newbie on revolut tho got coinbase and kraken ready,0
the secret with bitcoin is having patience buying on a consistent basis via once a week or once a month but have a plan stick with it don t over think your short term long term goals bitcoin,1
as network growth continues to surge at its fastest pace in history a number of nearterm catalysts could solidify the network effect being formed and truly bring bitcoin to billions of people bitcoin lightningnetwork,1
peterschiff michaelsaylor bitcoin this is the new renaissance via youtube bitcoin is o,1
oof very good bounce straight to from btc telegram channel jasmine crypto premium btc eth bravo,1
messari ceo ryan selkis on bitcoin stablecoins and crypto regulation crypto news live media bitcoin crypto cryptocurrency,0
bitcoin mempool tx stats in the last minute mean median max th quant nobs block height,0
check out my item listing on opensea via opensea bitcoin,0
johalmiles did btc ceo confirm that,0
why are ugly wicks hard to leave behind,0
ralf glabischnig on crypto valley and the crypto oasis btc cryptonews nft,0
you ll want to give this one a listen lawrencelepard knocks it out of the park we cover a whole host of macro topics the potential recession rotation brics currencies the european energy crisis japan bitcoin and a whole lot more let us know what you think,0
ps note that i have added two columns that i think will be useful and day rolling changes i also added a third volume column the day average ca nt really explain in a tweet but i think these new data will provide valuable insights going forward go btc,1
which price will we see first for bitcoin,0
airdropdet amazing and nice project i hopefully this project will be successfull let s join and support guys aagameruga atriantoko gillankperdhana airdrops bettermentdigital bitcoin,1
realvision raoulgmi maggielake maybe i asked the wrong question what does a correction in bitcoin mean for the dow nasdaq equity market,0
market impact haithamalghais in an address before the g energy transitions ministerial meeting in bali bitcoin,0
coinbureau our analytical team has done a detailed analysis regarding btc and its fear and greed index is neutral at the moment with price of usd so what do you think about the current bitcoin state,0
cash is nt traceable and many countries would still allow it this may slow bitcoin adoption or it may even increase interest regardless there would be no effective way to prevent all exchange bitcoin can be slowed perhaps but not stopped it would actually benefit governments greatly in the long run to adopt and adapt,0
what a quote btc we ve been waiting for the bottoming,0
thedustybc i m still long on btc which is more advisable than short with the determination of becoming rich by holding and accumulating more cvp which is also a great altcoin for long term investment and it is currently the one of the hidden and productive gem in the space,0
watcherguru wclementeiii only one decentralised protocol bitcoin,0
nftholding darrenpromoter btc is consolidating around the k level bearish momentum is exhausting with higher lows in the short term a possible leg up for a liquidity grab between k and k is likely y all follow kimcaden she is an underrrated bitcoiner her tweets tips have been help,0
and of you crypto nerds know you can farm bitcoin on tarkov,1
btc btc k support,0
joncomms same for btc,0
bitcoin stats every hour block hashrate ehs price last h fast fee sat slow fee sat tx unconfirmed diff t diff change in block next diff in blocks,0
bitcoin mempool fees summary in the seconds mean median max th quant nobs interval feevb block height,0
next year is gon na be amazing,1
stop thinking about how you could have made more money trading buying dips or selling highs seriously forget about it you are not going to pull that of consistently sometimes you can most of the time you wo nt in an uptrend like this long term you ll lose bitcoins like nearly everyone you may still make money your loss is compensated by the uptrend just not nearly as much as simply hodling will so at this point buy and wait seriously in a week or two or three or four you ll have a made a profit in the near future there will be extreme dips and yes you will profit even more if you could perfectly time sellingrebuying the dips but trust me that you wo nt be able to,1
don t worry about it look at the bigger picture k will be seen as low in ten years time so you have ages to keep dca ing this k milestone is only a couple hundred dollar increase at the end of the day and is nothing close to what we re projected,1
buying bitcoin is about more than just getting rich its about dismantling the states main control mechanism controlling fiat money getting rich is just a side affect a positive one by choosing freedom and voluntary peaceful money over forceful permissioned money,1
ada update checkout the link in bio for crypto signals doge ocean btc omg xrp dogecoin cardano enj tomo sxp sol eth bitcoin,0
princeysov people think bitcoin is high now wait till it s k by the end of this month k by end of this year y all should follow abtc she is a super underrated bitcoiner i ve been following her tweets and tips seriously i ve been doing really great btc,1
just wait until the full moon then youll see,1
cryptoednl tend to agree however a rational btc seller would nt sell massive volume into a long us weekend no,0
fair could happen but one would think shorts would pile on more things they have but that doesn t need to happen for a long squeeze,0
bitcoin got close to that fib area everything looks bullish but this is a key hurdle to hitpass see the behavior btc,1
keep accumulating keep staking keep hodling keep building bitcoin shib torg dfi ada xrp bnb eth,1
in years it wo nt matter if you bough bitcoin at or most important thing is that you bought buy now with bank transfer and credit card or apple pay and google pay,1
bitcoin block bytes transactions btc reward for more information visit,0
icoffenderii yellow first day out bitcoin,1
bitcoin ethereum are trying hard to stay above kk this weekend red week incoming again hopping for a beg leg down here so we can finally be completely oversold thoughts on btceth dropping bellow k this week,0
for anyone with empty drypowder not able to take advantage of the sub k bitcoin rn breathe it s okay dca today is worth the same as dca when bitcoin s back at k and we re a loooong way from there if you ca nt btd save for future dca,1
daily purchases on the strike app have me up since i started december th,1
get out of here no it isn t,0
fasb settles on fairvalue accounting for measuring crypto assets bitcoin,0
intocryptoverse agreed it s time for bitcoin to strengthen there are no excuses for not accumulating right now,1
bitcoin by any measure is still a beauty froth clearing and firming up over the last month could still go down b,1
purse bid for crawfordporter bout set for sept bitcoin sportsbook,0
btc derivs sheet tweet every min cme delayed min gs delayed min and oi shares out,0
iyiprofil this all going to fly soon but we need to look at alternatives hard forks like bitcoinlatinum are aiming to bring a better greener and cheaper btc i truly believe that forks can continue to improve on satoshi s work,1
leavescrypto if you truly understand bitcoin you would never bet against bitcoin it s bullish if you are trading it s pay day everyone however should follow ray he s a super underrated bitcoiner i ve been doing great,1
btc price h change not stonks bitcoin btc,0
absolutely love bottlepay app beautiful looking ui and recommending it to all my fellow uk bitcoiners stackinsats btc,1
makeroftools muatafagmi adamus blockstreamtalk funny how people quickly forget this is about money not tech money is just a ledger keeping scorepow the problem bitcoin solves is fair score or sound money in a decentralised manner linear is the only way because its one ledger everything else in layer,1
buying the dip is a great way to average you purchase price downwards it makes your bitcoins cheaper overall,1
just got a lil more btc and eth to calm the fomo shhhhhhhhhhhhhhhhh k shhhh,0
nftworldnews that would be great it is very possible that the pow coins will die out except bitcoin maybe eth might overtake bitcoin i think proof of randomness will become another protocol that will be greatly admired in blockchain technology as its popularity rises,1
elonmusk btc mtn money makes us rich medicalchain makes us millionaires,1
