text,sen
it is indeed good to stack more and more as per time pass we would know the value and the worth ahead in the future,1
bitcoin points for the daily fulcrum daily negative under,0
larry dunlop kirk macpherson regan judson btc,0
strategy hlh atrd dec utc short jst longentrytrigger exittrigger ent lastprice btcusd btcusd perpetual contract on bitmex,0
etf rumors means discount removed,0
ercwl ercwl unlike ethereum bitcoin is not a company there is no employees or contractors to fire bitcoiners and maxis are just people that believe in sound money and are focused on fixing real problems enjoy your distractions,1
some of you sold do nt make a habit of it,0
just fyi as a general rule you should never disclose how much btccrypto you have on the internet,0
if you like bitcoin as a currency why do you pay attention to the price,1
wow awesome i wanted to ask something about this what s it like i mean being a lightning node operator are there ever net negative weeks where rebalancing costs more than fees yielded the week prior is what i m saying completely false i m curious about it and looking at low effort ways of stacking with my existing sats and thinking about setting something up on my htpc to do this but i ve had nothing but bad experiences using lightning on mobile apps to mess around with faucets and try to get cheaper transactions from buying on strike,0
bitcoin approaching a buy signal on daily,0
it only takes two things to be happy with bitcoin secure your own private key extend your time horizon that s it the purchase price does not matter,1
we finally got the long green candle on bitcoin k to k nice,1
now here you go again you say you want your freedom well who am i to keep you down stevienicks on bitcoin,1
altcoin btc eth bitcoin inches higher ethereum and altcoins accelerate,1
ta time btc btc knows it s way supercycle wave,1
well boys check your charts its a green four hour candle time for ath,1
i thought k was the video of that fabulous dancing indian dude,0
robocop scenario they re purposely letting it burn so they can buy it back for cheap,0
guess what comes next ada btc,0
i m about to ric flair wooo loudly in my lab boss knows that when i take a day off it s at k,0
me trying not to fomo right now,0
btc is now at,0
india s prime minister narendra modi urges countries to collaborate on bitcoin cryptocurrency bitcoin btc,1
bitcointina bitcoin volatility index is ready for another massive move the next week could be the start of a new price trend keep your eyes on it bitcoin maximejosh is a super underrated bitcoiner i ve been taking his tweets and tips seriously i ve been doing great follow him,0
code when signing up and makes a deposit you will receive worth of dfi btc btc cryptoairdrop airdrop,0
if i was in new york i d mine bitcoin at home just to stand in protest of this nonsense,0
do you hodl crypto show it with this love in the ledger valentines unisex tshirt buy it today with free shipping for only find it here cryptoclothing bitcoin,0
no need to apologise while million is nothing to laugh about i think the influence of early and mid month option expiries is less significant on price action than the end of month ones since those tend to have much higher volumes,0
ethereum before bitcoin ath,0
pretty much all the centralization points of ethereum are in america most of the developers chainlink multisig for defi oracles uniswap and opensea usdc seems like bitcoin would be a better choice for russians with their energy resources for pow mining,1
silk road bitcoin stash will be used to pay ross ulbricht s million fine decrypt actadi btc bitcoin,0
same i always thought that mindset made no sense but now it is mine,0
biden and his experts believe inflation will be temporary two weeks to stop the spread said similar experts how long is temporary precedent set says years bitcoin helps fix this,1
hi there bitcoin btc,0
why so hate on this guy it can t be bottom yet without retesting the bottom first this looks like a fake pump and the volume of most altcoins is still decreasing since midjune btc altcoins,0
open for investment trade bitcoin btc investment weekly profits,1
this is why you do nt panic sell during dips remember shib it dumped by from to before doing a x spike to buythedip cryptocurrencies btc shib dinger,1
gravitas kim jong un coins a new ideology for north korea paymeinbitcoin bitcoin,1
they switched everything to post only,0
for every seller there is a buyer it s just that the sellers are willing to part with their btc at a lower price than the market price for some reason the seller makes it go down because they are selling without sellers no buyer can get btc bar mining it buyers can not make the price go down they ll drive it up sellers can so why a seller is selling bellow market price or even below what they purchased it for the loosing sellers fear they fear that btc is going any lower and that they ll be the bagholders and no one wants to be the bagholder because they need money and btc is the last of their liquidity so they have to sellspend it at the current value even if its a loss late comer that need the money the winning sellers they ve purchased those btc at a lower price than they are selling it even it it s below current market price and they do nt believe it will go any higher and do nt want to be the bagholder if they feel like btc is overevaluated they are still selling with a profit and do nt believe in any more profit and they are parting their btc because they need the liquidity for a better performing asset whatever it might be long time hodler that need the money once we run out of late comer that need the money and long time hodler that need the money the btc will just be recirculating and stabilise at some value that the miner will agree to spend energy money to secure the network at,0
itching to do a lil stack btc,1
ha not for my hen sir she ll make me that in two weeks but perhaps i can interest you in rooster thighs three eggs apiece,0
mstr is there anyone who has done the work on their free cash flow and how much is required to cover its debt service on its bitcoin i m lazy and have no position but my dogs are quite curious,0
davincij buy a whole coin btc,1
profit of btcusd my target is to buy more btcusd at if less than what i bought last time to reduce the impact of volatility on the overall purchase and sell it all at click to track btcbytorshis,1
bitcoin under k is the most safe buy you can do the same was for for k so slapyourself k btc eveything is fine,1
many alts have broken down much below the major crucial support and some lifetime supports too like bel akro unfi sol etc jasmy etc its just a retesting of the lifetime support dont consider as mini alt season or bull rally cryptocurrencies btc alts,0
i want to sell some btc for cash to raise nk funds for an emergency right now pls anybody on the timeline buying discount guaranteed deal will be done via video call one on one sega ronaldo pls help retweet its urgent for someone,0
have patience the bottom is most likely in the carrot indicator says k in a month is a possibility,0
it wo nt take long for everyone to use bitcoin,1
accurate af nfts nftcommumity bitcoin,1
no one tells you life is lonely after you ve taken the orange pill bitcoin,0
accurate af nfts nftcommumity bitcoin,1
martiniguyyt i wish i could sell my father s home i am bankrupted due to current market but have belief on btc,1
please everyone make the best decision for you during this time i keep seeing repetitive phrases such as buy the dip whales are loading up or sell crypto winter is incoming nobody knows where the price is headed and especially not anybody spouting repetitive one liners on reddit simple rule of investing whether it s bitcoin or any other asset do not invest with money that you need in the near future so many people get carried away and think what s the harm this could be the opportunity of a lifetime yes it might be but it could also bankrupt you no matter how bullish you are on bitcoin there is a chance this thing drops a lot lower than this and never recovers to where we are today unlikely in my opinion but it s possible and anybody who says it s not is spilling out their hopes and dreams not certainties if you realised at this point that you made a mistake and need to sell as you need the fiat for living expenses in the coming months and can t risk losing more don t feel ashamed you made a simple mistake that thousands if not millions before you have made and is deep routed in human psychology let it be a lesson albeit a painful one and come back to the table if you want to when you have spare money that you can afford to invest and not worry about summary do what is right for you not what people you don t know on a sub are telling you,0
exited longs got bought back reference netlongs checking out footprint stats and comparing it to the previous reaction to it we always had a bounce some days after will it be different this time or do we need a a test of ema to get fully sent btc bitcoin crypto,0
passive income is here join ember with my link and we ll both earn bitcoin daily crypto blockchain,1
mirbtc but you can not deny that bitcoin is bad for the state monopoly,1
do any bitcoin bros want to buy this aluminum cube i made in welding class hollow light as shit btc worldwide shipping included it s super light anyway don t miss out,0
need a superstrong password to encrypt your disk but do nt want to record that password anywhere twofactor passw,0
good goood let the salt flow through you he he,0
imagine walking to a kiosk to buy some bitcoin while at the mall or heading home from work wazirxwarriors indiawantscrypto btc,1
bitcoin crypto el salvador buys more bitcoins as crypto market falls coindesk,1
interesting level on btc expecting some bounce,1
looks like cathie is in autosmash buy mode at these levels million worth of gbtc shares in the last week bitcoin,1
nepalneedscrypto day nepalneedscrypto is a protest against the government s decision to ban bitcoin and crypto which are changing the world and we do nt want to be left behind join us and post with hashtag nepalneedscrypto hellosarkar mahabirpun,1
houston astros vs texas rangers bitcoin betting,0
peterschiff there is a different between anything and btc people control the price not earnings or ceo or even countries this was the idea from beginning and most of the people who got in this early just believing that they will not sell even if it s going down,1
the buddy s will pump,1
fsamueltolani home sweet bitcoin,1
dylanleclair with the current price of usd bitcoin is well on its way to the moon the price may feel incredibly high but that is a nonrouted emotional feeling y all should follow kathycryp she s a super underrated bitcoiner who has incredible writings tweets tips,1
i have to point this out another key persona in founding kadena was dr stuart haber who is the coinventor of blockchain technology and the most cited author in the bitcoin whitepaper coinmarketcap kadena is built different bitcoin cryptocurency,1
is like saturday never happen,0
thhere is alot of meme support at k,1
some are watching some are investing and withdrawing their profit while some are still having doubts stop watching and start investing so you too can start withdrawing contact admin to start earning bitcoin mrsrebecca mrsrebecca,1
i m buying crypto for the plan of retiring in years instead of more years crypto cro bitcoin eth link grt uni,1
btc everything is under control btc bitcoin,1
btc usd just transferred from seudpnxmhxtcdvaytauhjpypwnkgpv to bcqxzsgszgatzdsalpnsgqyfuwckngg tx hash bcffbfeeceaaaeeafbfbbbedda bitcoin btc,0
justintrudeau absolute trash bitcoin is the way,1
the history of bearish bitcoin,0
the ledger live software wallet just reads and displays and allows you to interact with what s stored on the physical ledger device nothing is stored on the ledger live,0
btc ath good job bullssss,1
microstrategy pledges to buy more btc despite paper loss on its holdings of m in q bitcoinnews bitcoin,1
according to the latest bank of canada report the share of canadians owning bitcoin rose sharply in,1
bitcoin our only hope to separate money from state no need for seperation in it together is better we all benefit bitcoin and some stablecoins and staking will bring wealth and wellbeing end the shortage of jobs worldwide ai and robots pundixlabs,1
knc short alert exchange ftx market knc usd volume price btc btc eth eth for live whale trade flow check,0
watcherguru pete if you are so sure about bitcoin going to zero why do not you put up all your money and short bitcoin or short mstr let us see who wins in the end,1
we re waiting for your prediction,0
ledger has my vote both are good ledger has better docs and is harder to fuck up,0
petermccormack misery this is what an elastic money supply brings dogooders be damned central banking is a core tenant of marxism humans are too fallible to be trusted with this level of power bitcoin fix the money fix the world,1
rdrlfe yea buddy it s called a down payment go bitcoin,1
actually bitcoin has nt gone down any lower for a month now and that could be a sign that the dropping trend you re referring to is leveling off see bitcoin past month,1
by this week is what you guys feel something huge is about to happen,1
layahheilpern just zoom out we early i btc crypto,1
bitcoin the metric that says bitcoin is about to go parabolic,0
and there you go you ve discovered the hodler s dilema,0
bitcoin clings to k on easter sunday as crypto seen to head lower in the short term,0
food for thought btc crypto is here to stay let that sink in,1
my time horizon is years so i actually do nt care what the price is right now i m buying bitcoin,1
okk sweet i was just wondering if the launch was the same day of the release of the code or if the code was released on the day,0
what time are you using on your chart,0
where did that person indicate that they re a republican edit nvm post history checks out,0
if you sell you ve just forever sold your chance of recovering any losses you may have made and by selling you incur an actual loss as long as you maintain your position you have nt technically lost a cent it s insane to sell at a loss,0
btc transferred from unknown wallet to unknown wallet tx blockchain btc,0
more will be burn until there are million total tokens like btc and it burn all the time because it is a deflationary token this is a good opportunity to enter and keep the purchased tokens,1
it was written now we buy the dip btc btc ftm ftm,1
btc free signal future btcusdt entry at or less x max put max of your total in future tp,0
crypto is the final way to become millionaire work hard get rewards btc bnb,1
emergentbtc doesn t sound like bitcoin,0
andrewrsorkin joesquawk only bitcoin selfcustody matters,1
major price action happening within the next hours btc btc cryptocurrencies cryptotrading,0
proofofwork is essentially onecpuonevote bitcoin,0
kucoincom great project great opportunity ponting nelson airking kucoin btc usdt,1
but bitcoin is different,1
bitcoin eth doge will change the banks forever bitcoin doge ethereum,1
bitcoinnews following bneth has been educative bitcoin is currently at k the bull run has begun the biggest risk with bitcoin has been not owning it at this point not having any btc feels irresponsible buy the dip,1
china s crackdown means bitcoin is working says crypto miner,1
themooncarl missed that btc level not missing the biggest opportunity which is inari accumulating the past weeks tokeninari inariraffle,0
cryptonetwork most wonderful project thanks for shared this wonderful opportunity hopefully it will go to the moon soon txantzin txantxin txantze xdccffcde tg aabb bsc btc bnb,1
the bull run is among us signal bitcoin bitlord,1
ladycryptonic want to earn up to in any crypto or more on a weekly basis from crypto trademining feel free to send me a dm for more details btc alts,0
shanghai high people s court has declared bitcoin to be a virtual asset protected by chinese law,1
gold pure bitcoin bitcoin is better than gold,1
just in russian billionaire oleg deripaska urges bank of russia to move to bitcoin fegtoken binance,1
nice i m interested could you plase hold it for like years i wil give you k for just that one bitcoin,1
did jedmccaleb just confirm joelkatz is satoshi bitcoin,0
marketsbylili beeforbacon elonmusk it has less to do with intellectual laziness and more with understanding how the game is played at a higher level regardless of how you feel they are both publicly buying bitcoin and holding it which benefits all other hodlers regardless of reason you and i benefit,1
will they shut down the economy in weeks again delta andreijikh grahamstephan realmeetkevin jlfinancialcare paymeinbitcoin bitcoin,0
coindesk canaanio aoyona nakamotogames offers gamers worldwide the opportunity to participate in countless blockchainbased games and generate a sustainable and sizable income naka nakamotogames btc binance binance gateio,1
added to this candle to get it above you re welcome,1
thekcsvt remember btc tends to be a harbinger of things to come in other asset classes equities still have far to deflate and then there is the issue that us mortgage costs just went up suddenly you know what that means right nowhere to hide,1
daily btc pitchfork median line caught capitulation wicks so far crypto bitcoin,0
alert bitcoin price at short term swing high support level m apr pm,0
bitcoin everyone longed at now we have to be more careful,0
anthonyavinesh saylor btc previous bounceback from its vital support range kept up hopes alive but its recent fall below the daily ema and ema have reaffirmed a robust selling edge its the best time to buy and trade the dip with scottro on telegram scot,0
what coinbase s partnership with ice says about bitcoin surveillance news from bitcoin,0
i ll be speaking at the coin nations summit bitcoin,0
elerianm big fan of yours the day you become a bitcoiner is going to be a great one bitcoin,1
prices update in usd hour btc eth dot,0
because many traded their alts for btc once it hit k,0
do your own research but for taxes i believe you can just treat everything as fifo lifo or whatever you see fit i do nt think the minutiae of uxto inputs and outputs matters to the irs,0
something i think contributing to this dip same thing in,0
we got some action jackson,0
ashbit listing on pancakeswap is days bitcoin binancesmartchain bitcoinashtech,0
lol is this kinds some kinda rule that you ca nt make those jokes,0
not happening at weekends,0
very interesting thread with a question at the end quoting harariyuval s sapiens imagine a simple example mr greedy a financier sets up a bank mr stone a contractor in town finishes his first big job receiving payment in cash for mil btc cryptocurrency,0
reading all the bitcoin price predictions i feel its still in the hopeful zone it has to enter the hopeless zone before it really goes back up does it mean more down side hope not let s see,0
investor cathie wood on cnbc digital wallets with stock and bitcoin buying will usurp the role of banks,1
did you buy the dip anon bitcoin,0
tuurdemeester the lindy effect is why only bitcoin will survive,1
goodnight fam going to bed with bitcoin up it s absolutely over for bears k is bullish as ever i ll be looking in the morning to see if i can get a solid short entry on btc not opening a trade before bed,1
i absolutely do nt want it too i am worried about it though unfortunately and it has me worried enough about the us dollar i m glad i have my bitcoin holdings,1
bitcoin btc plan for the rest of the week looking for it to tag back into mid ks possibly up to k this weekend,0
moxifloxaci spencerkschiff peterschiff it s not the track record that stands the test of time it s what have you done for me lately schiffty has cost his subs approximately in potential gains by shilling gold all while bashing the brilliance of bitcoin not the legacy one strives to leave behind,1
i m high af btc,1
what s your apr if around percent yes,0
hr bitcoin price divergence update still has bullish divergence dating back to nov th pm st lol in the short term we ll see if price retests the pink dotted divergence projection along with confluence of the fib retracement we ll see if it plays out,1
bitcoin has done this times will btc do it again i m waiting for the final capitulation and preparing to fly into the rocket cryptocurrencies,1
the two most important rules of bitcoin rule never sell your btc rule see rule,1
peterschiff anyone who thinks that btc can not work because it needs to be backed by goldassets obviously does nt understand the principles behind crypto or the blockchain and counterparty risks it s basic bitcoin what s crazier is it s already and people still do nt get it,1
not even ancalagon the black could melt these diamond hands btc,1
btc aggregated inflows to coinbase pro btc,0
saylor morganlbrennan davidfaber carlquintanilla saylor the strength of the bitcoin paradoxically is its weakness namely super fast to liquidate confirmed again this week in ftxofficial downfall the good news is that it rebounds quickly esp when czbinance buy k btc,0
aivaras cryptodevil hang in there if you believe in btc keep an eye on a fear greed index and every time it goes below buy some btc,1
btc transferred from binance to binance internal transfer tx blockchain btc,0
good conversation i ll chew on that a bit and educate myself and form an opinion thx,0
yups that why you should leave your emotion in a locked box somewhere and just hodl on,1
hardware wallet ledger trezor it s not the wallet it s the recovery seed that gives you access with any wallet with recovery in case a device gets broken,0
cointelegraph btc but nimiq has my heart now nim is inspired by btc but provides an easier interface for users,0
can we reach for one bitcoin tonight,0
coindesk starbucks xpolygon jamiecrawleycd eth looks ready for good bounce in the coming few days while above the lows of k and bitcoin above k i believe while we are holding this we will go to k soon check out and follow keshglover you ll definitely learn a lot from this genius with her guidelines,1
recycle and earn crypto for a better world enter the recycling race and win money with wings worth of prizes in crb convertcarbon crb bitcoin,1
randomly read wikipedia s summary of dotcom bubble and in section bursting of the bubble there s an entry about microstrategy yes the same mstr issuing debt to invest in btc announcing a rev restatement due to aggressive accounting practices not a take just sharing,0
what you were meeting a guy to buy rocking chairs with bitcoin,0
btcusdt by theprofitstation trading bitcoin via,0
el salvador s bitcoin play what does the current slump mean for adoption elsalvador,0
the great bearocratic iron fist that looks out for the little man,0
i m excited a bitcoin event in scotland follow jimduffy and bitcoinconfuk,1
bustarhymes jack elonmusk cathiedwood you only need bitcoin eth is a scam man,1
can t wait for tesla to dump tomorrow,1
btc hope everyone is well dca is great way to not stress charts price million only,1
i got a bitcoin cake for my birthday btc lightningnetwork,1
well it s not gon na end well for you if you break this rule,0
yep like i always say this is displacing currency we re talking about not the next version of an ipad lol it takes time,1
shorts just trade drops and are cleaning up right now to shorts it makes totally no difference if they trade the range or the range,0
depends how quickly you want to open it since it s a transaction you place and you put the fee on it it can be a onetime opening of a channel to a major hub if you do that you just have to pay the transaction fee one high enough to get it confirmed once and pay through it until your channel is closed the rules of when channels close are still ambiguous to me but a big rule is that you would generally close it once you spend all of the money you committed to the lightning network through that channel,0
brb throwing away my economics textbooks,0
rothschild investment corp is buying more bitcoin why aren t you,1
breaking news chipotle now accepting bitcoin ethereum and other cryptocurrencies as form of payment bullish,1
the how to ocsc demo via youtube libonomy interoperable bitcoin,0
the crypto market at a glance all values vs bitcoin btc ethereum eth bnb xrp sol luna ada and many more,0
ilovejaneadams gmdavisphotogr rcnitropower i ll repeat my question i don t understand how the us government buying a trillion dollars of bitcoin will help the average american can you explain why you think it will,0
broke people argue online rich people make money online do not use your phone only for social networks search for bitcoin change your life,1
spy consolidating towards ath reminds me of a certain btc that was doing the exact same thing last week more evidence to suggest a decrease in btc volatility shift in spy and btc from being inversely correlated to moving in the same direction,1
looks like we re going to be dipping to around k over the next hrs just a healthy pullback,0
good morning let s stay positive,1
nothing sometimes the price needs to simmer before it comes to a boil,0
bitcoin approaches resistance breaking this would mean a test of the k area needs to hold k for continuing the local uptrend i think we ve seen the bottom btc,0
see this is what the euro would have been if they had any sense not necessarily bitcoin but a single currency acceptable as legal tender across the block in addition to national currencies hope it works out for south america could do wonders for their trade etc with each other and tourism etc,1
