text,sen
cryptobusy snakenftking good luck brothers bitcoin twitter crypto,0
arcbtc steefbtc another bitcoin i was there moment amazing work from steefbtc,1
haha now that we are in a bull market i miss these memes bitcoin bitcoinetf,1
a glimpse of whale activity on bitfinex wow,0
odell adamisapleb that s why you might want to reconsider if you want to be a public bitcoiner it is the ultimate test of integrity greed and pride ego could become problems low key stay humble,0
intocryptoverse i remember when we joked about a figure bitcoin back when i was saving women and babies can we plz quit talking about price and make actions who are you anyways,0
how did he call it,0
ceo of panteracapital a major hedge fund predicts a massive bitcoin rally this year saying that investors will flee stock bond and real estate for crypto danpantera also adds that more institutional ownership and a higher market value will make btc less volatile,1
the amount of time i spend thinking deeply about the powerful shift in energy we are experiencing as one world is beginning to increase exponentially i feel unique gravitational shifts will likely begin likely relating to bitcoin ethereum and other world powers,1
steps to live in peace low your time preference discover bitcoin understand it do nt look at the price,1
in order to master bitcoin you must love bitcoin and feel a profound connection to it bitcoin,1
damn should i sleep or should i keep track of it idk i hate sleeping damnit,0
i just love getting people riled up one of my hobbies look at my history,0
those prefer bitcoin to gold,1
watch bitcoin go back to and you ll see the doubt disappear,1
welcome to the future bitcoin,1
remember when these folks said bitcoin is a scam good times,1
btc btc correction time start and altcoin usdt pair also going to dip carefully hold usdt ad buy at dip some coin,0
i swear this sounds like a copypasta,0
are there any sites where i can buy without id verification or a site where i can buy a limited amount before i need to verify,0
proshares bitcoin futures etf to launch on new york stock exchange tuesday btc lightningnetwork,0
cashapp jackdorsey bitcoin world s biggest podcaster joe rogan accepts bitcoin payment joe rogan the world s most successful podcaster and comedian has accepted a bitcoin payment of shared by financely,1
wallstreetsilv silverguru goldswitzerland digital gold bro bitcoin,1
public blockchains shift the distribution of the trust replacing institutions that rely on centralized authorities with decentralized opensource software the first profound application was bitcoin,1
cryptoptimist only btc puts you in the top riches of the world,1
we are proud to announce that the bitcoin matrix podcast is now sponsored by hodlwithledn not only are they building worldclass financial products utilizing btc but this will allow me to deliver harder hitting deeper even more awesome content onwards upwards lfg,1
it s the very high leverage available to traders that will for sure be part of the play with or or even times leverage on a cash settled trade it s so worth it for a whale to buy up the physical bitcoin even at a loss because of the massive leverage they will make on the cash settled contract but they will make money on both the physical and cash settled contract trades but someone could literally buy bitcoin intentionally at triple the current market price and theoretically overpay by and still come out of this golden using leverage but they will make a profit on both just like when the whales shorted using leverage and took profits selling physical bitcoin there s not that many bitcoin around to trade the game theory with physically backed btc and cash settled contracts with x leverage is a whole nee chapter or wealth creation be part of the parade or watch it go by you can choose,0
saylor flag and cross moving in timeframe h btc,0
thoughts on btc bitcoin see xcvbs s idea on tradingview below,0
cointelegraph our analytical team has done a detailed analysis regarding btc and its fear and greed index is fear at the moment with price of usd so what do you think about the current bitcoin state,0
tiny play but gain was great btc btc stocks crypto,1
btc market sharing family members hold on,1
as much control as i have over my emotions i also like being right about btc,1
oh yeah you re right now i look like quite the fool,0
make it happen bitcoin,1
in the big picture this bear market means almost nothing btc,1
that is proof that bitcoin can not be hidden in any dark corner nor can it serve as a vehicle for criminals,1
illconnect is my cashtag if i got some bitcoin that would be quite a change of fortune for me today fortunedays,0
i just bought more bitcoin lol,1
cryptodiva given how stable these assets can be when it comes to individuals getting a strong roi i d have chosen either btc or eth but sol will be my first pick especially now that i ve discovered honeylandgamefi which is built on the same blockchain with an assured great utility,1
mmcrypto fearful when others are greedy and greedy when others are fearful bitcoin cryptocurrency ethereum,0
is the american dream really dead or is it that just a lot of people do nt know how to enter into the real estate market personally i believe it s all about diversification buy real estate buy btc buy gold buy stocks be ready,1
when we breaking below k i m tired of buying so high,0
thoughts on btc bitcoin see aryanouri s idea on tradingview below,0
tired of forex and crypto failures stop everything our mining service is for you with us you can can earn daily btc profits credited directly to your bitcoin wallet by just connecting your wallet to our mining pool type connect to get started babydogecoin bitcoin,0
then they fight you then you win btc,1
bitcoin weekly action bearish th red candle will it close this way alpha yo btc retraced the entire move up we re under ma and rsi is under yo bulls we are still sitting at weekly support bottom of channel,0
knowledge only has the potential to become power it becomes power when we use it btc,0
btcusd shorted on binance utc btc cryptocurrency,0
fyi bitcoin is closer to a bottom than a top in case you were wondering what s up with bitcoin regardless of an obvious economic climate like most of us have never lived bitcoin fundamentals haven t changed btc btc,0
btc still looking strong and i see another rally to the upside while the ongoing correction might not go that deep as yesterday expected i ll close my short within the blue box and go long there invalidation around bitcoin crypto,0
looking for a new gig work for one of the hottest companies in bitcoin imperviousai is hiring for senior frontend and backend engineers apply today to build the impervious browser and the pp internet standard,0
so many buy orders at k holy shit,0
peter schiff is that you,0
under construction lake satoshi is getting some prep work done in anticipation of setting the first cabin in place road is moved banks sloped and the path is clear this is the first of many cabins to be rented for bitcoin only lake satoshi more to come,1
we are still in the pre rich phase bitcoin btc crypto,1
bitcoin going up be happy,1
institutional bitcoin exchange bakkt goes public on the nyse today bitcoin nft crypto,1
i was laughing about bitcoin being beanie babies from day one if you brought worth instead of laughed you would be a millionaire even now,1
how beautiful it is when everything looks green how long do you think it will last crypto btc,1
b asset manager kkr s health care fund tokenized on avalanche bitcoin altcoin blockchain,0
i would never recommend people get in on crypto unless they wanted to learn something luckily i do not have a whole lot in this game enjoyable is nt it,0
that explains it you just hate money,0
now this is the volatility that separates the men from the boys,0
blockfi duh it earns me bitcoin,1
maxkeiser tontarquico bitcoin is a device that transfers money from the impatient to the patient bro,1
my raspberry price ticker btc lightningnetwork bitcoin,0
cryptosea moov dotmoovs coming soon bitcoin binance,0
k gn yall btc,0
btcusdt shorted on binance utc btc cryptocurrency,0
goddamn the race to k is really happening now just a tidal wave of institutional money flooding in from every possible sector for fear of missing out,1
you remember those times when bitcoin was euro btc alts,1
just made a koinly account to track my taxes for the upcoming season was pleasantly suprised to see they track your average cost i wish coinbase would do this,0
stacked more sats bitcoin btc,1
imo after crypto gets regulated in the us there will be more people trading crypto then stocks gatsby trading academy will be the first successful educational platform to teach individuals how to trade ico tokens within the crypto market with efficiency btc,1
i play and get cashback the more you play on betfury the higher rank and cashback amount you will get my username user betfurysuccess bitcoin staking,1
k breached on coinbase pro,0
dudejlebowski maybe not for many years did nt realize asic s have a fairly short lifespan of years would be nice if there were bitcoin miners that optimized for baseload heat energy output longevity over maximizing immediate hashrate,0
this is the content i m here for all noise no signal bitcoin bitcoinaudible,0
not your keys not your coins,0
just in of bitcoin wallets have not sold in over a year,0
soon in other news just the other day dinosaurs went extinct btc,0
whalealert getting ready to buy some btc before it shoots up atta boy,1
garycgorski saylor potus federalreserve your time preference is way too low bitcoin s purchasing power has increased in the past years whereas usd s has decreased at least and it is the strongest fiat currency btc is just getting started it is bound to be volatile for awhile to come,1
crypto firms prepare to pause activity during ethereum merge bitcoin,0
you can always wait for it,0
jhonnyclothing i like this slow creep up for tel vra claiming lost territory before we see massive expansion up i think once tel climbs to cents vra is around cents we see them take off again ath assuming of course btc remains stout claims k shorts get rekt,0
qeyladewi goldendoge czbinance elonmusk what is btc cycle,0
i think most of the new ones are scared of the bear season,0
i m playing lnbingo this card is for draw the next bitcoin block to be mined learn how to play at lnbingo,0
i disagree because you wo nt be able to fund a ww with btc,0
bitcoin passes price mark for first time since may crash up over the last week bitcoin is steadily regaining ground lost over the last three monthsand ethereum is rising even faster buy cryptocurency with cash using flexepin prepaid vouchers,1
discord call btc i feed the hungry,0
any action against bitcoin is an attack on me and hope of a free society,1
soooo ideally do nt cash out just buy the dip,1
btc really interesting how it will react this time it feels like relief is due as the negativity around the markets are extremely high,0
apecoin looking at btc like,0
found a good home for another of my prints paid for with bitcoin want to trade some of your btc for art let m,1
eh the culture of money secrecy in the us is there to hurt workers if people want to share their numbers salary savings bitcoin whatever then i applaud them and besides that we know he s full of bluster about everything else he has no credibility,0
bossgiveawayz bubbatoken giveawaywhale altcryptogems cryptopoorboy flurbnb banggarr bombshillers this token will boom and it is recommended to my crypto friends do nt think more just go for it docleiy luckymanno blackkalonk bcqwdeazrkhdasqqcdnvjzzygauysczr btc,1
his moves somewhat make a concern to the price chart and his predictions turns out to be true but the fact that guy looked and earned a lot from holding and thus has a clear view of the market,1
gm to everyone who chooses to build for our future on better systems stop building on legacy technology bitcoin revofico,1
glmr going to x remember my tweet look at the chart buy buy buy a big bag now bitcoin btc sol doge shib keep nu xec zec dent hot,1
they have the same mindset and ignorance of the maxis that post here,0
jtsglobal utodayen govbrazil indiainbrazil apompliano brazilbrian brodienbcs ukinbrazil jack amazing it is a large country and it would not be a bad thing to become the third country to make bitcoin official btc,1
would you rather have a gold medal or a bitcoin medal btc,0
when policy makers prioritize sustainable energy bitcoin naturally takes advantage of this and becomes more more green thebword,1
stop with this nonsense money printing is politics we can be interested in cryptocurrencies without spreading this nonsense,1
long ocen entry price stop loss link in bio tz btc bitcoin ocen,0
bitcoin is up since china banned it,1
whalealert whales sell bitcoin and wait buy in deep to his advantage very clever,0
the only way to mitigate tether s effect would be to use bitcoin as a real world currency in daily transactions rather than as it is currently used mostly for speculation,0
all data science models suggest that btc will peak much higher than other s best crypto discord group over k member and even have their own app join here shib btc eth doge sol crv ath sl algo matic fib s boa gme tnt h amc ct tp,1
is swan a good place to buy bitcoin i love their ethos and what they stand for but at the end of the day are the fee s high or is the price marked up,0
matthewhyland as if btc cares what people say fallen here fallen there just hodl and relax,1
bitcoin breaks k to set a new alltime high currencytimes itoldyouso bitcoin,1
lbrycom there s no reason for another one bitcoin is all we need,1
lol yeah no point in selling when you can hodl your shit,1
if you have not invested yet in bitcoin you will regret it and i will say to you i told you don t be that person,1
looking for a short tonight btc,0
mfhoz looking forward to it hodl bitcoin,1
k end of year worst case only looking at sf you re good you ll do x instead of x but in you ll make it rain,1
teslaspacex ceo musk said tesla will likely start accepting bitcoin for vehicle purchases again i want to do some more due diligence to confirm that the percentage of renewable energy usage is most likely at or above if so tesla will resume accepting bitcoin musk said,1
i am a support of bitcoin elon,1
whoa i ca nt believe you like money too we should hang out,0
coinsquare thanks for opportunity stpatricksday bitcoin coinsquare tag utksrvstv,0
marginally because you are not doing economic activity it would be better to point all your wallets to your node or add your addresses as watch only to your node so as to being able to verify that your wallets are not conned by malicious actors,0
the price of bitcoin is currently crypto btc btc,0
we are excited to share that we ve worked with our longstanding partner nydigbtc to add bitcoin to the chainalysis balance sheet,1
olmeg adybug cryptovizart ittechpl blaakke therealplanc onchaincollege janwues cryptobirb piotrostapowicz ekryptowalut wclementeiii mernest kraken ftxusderivs bitfinex but everyone was celebrating when they announced the first btc future etf i have said it will happen why invest in spot when you can make money longin and shorting and in a full regulated environment,0
cmon btc fight for my love,1
mowgliasia krugermacro whale games btc will make new highs within months or less,1
i m surprised how correlated bitcoin and the ism index have been over the last few years unfortunately bitcoin will probably continue to become more correlated to traditional assets as it matures bitcoin btc,0
one bitcoin now worth bitstamp high low market cap billion bitcoin,0
massive love from exodusio never saw this coming but now its a reality i feel blessed alhamdulillah exoduswallet cryptofreedom bitcoin,1
congrats you ll be made whole again in no time p,0
this price action is annoying stepping away for a week or so,0
the price of bitcoin has decisively broken out of a major downwardsloping resistance line and appears to be consolidating ahead of the next move upward it will be interesting to see whether it surpasses last june s significant peak which was near,0
the history behind texas and oklahoma s move to the sec and why it s happening now bitcoin sportsbook,0
damn all absolute madman,0
market move alert on btc this signal was detected sec ago stay tuned for more btc btc,0
thoughts on btc bitcoin see donyakka s idea on tradingview below trade it here,0
hey now i bought at,0
exit ltc this chart show litecoin is getting destroyed compared to bitcoin,1
a crypto market update is available at bitcoin ethereum crypto,0
for bitcoin it s the miners who collect tx fees,0
eth short alert exchange ftx market eth perp volume price btc btc eth eth,0
that s just the thing if you know how btc was started then you should know about these things your last statement is just a short term correlation,0
so germany banks are bullish in btc but eu trying to block btc wtf,0
harrygbeckwith adamus thank you so much brother i was really just joking bitcoin,0
btc short deribit btc perp you learn in this business if you want a friend get a dog carl icahn,0
the bitcoin price has moved up again and it now sits back over the day moving average so shortterm signals continue to remain positive for btc there are pundits on both sides of the fence some say bitcoin will test k again and some say bitcoin is off to the moon,1
this is your brain on bitcoin,0
obviously digging the green today but it s somewhat disappointing to see bitcoin s gains outpaced by alts i swear people just don t learn,1
you don t need to plug it in to see what s in it you only need to plug it in if you want to send what s in it example i have a trezor and i have it linked to my mobile wallet so right here on my phone i can see what is in my hot wallet and also what is in my trezor as a separate portfolio both are live values the only difference is that i can t send any coins from the trezor wallet because it is sitting in a safe place offline if i want to do that i need to have access to the trezor,0
wheeeee good ride for a few shorters out there,1
bitcoin price in canadian dollar btc xbt btccad btc price now cad avg last hour avg hours h change h low h high more information here,0
looking in the tesla market saw a tesla model s smoke a dodge demon impressive investing ethereum bitcoin,0
just days ago btc was trading below and today btc touched growth in just days btc has not broken support bull abhi baki hai,0
and a good news bitcoin cme gap was closed because of the recent dump due to the higher than expected cpi numbers,0
it will but buying more dips will prevent it,0
alert bitcoin price at short term swing high resistance level m oct pm,0
if the dip is deep enough that they buy back in in the new year and still profit they re not fools just saying,0
good question maybe temporarily but this puts good long term pressure more competition among big players is good for btc,1
bitcoin btc cryptocurrency interesting fact btc has been establishing a negative yearly candlestick subsequent to the crypto bubble however it has been making consecutive positive candle sticks after that will history repeat itself like and follow for more,0
peterschiff this book saved my ass peterschiff bitcoin eth cryptocurrency elonmusk joerogan,0
i guess iran wants to buy more cheap btc s and is trying to keep prices low by taking the wagon of energy costs vs mining yep they need them and they need more days to conclude their purchase better hurry up the price will not stay this low for long,0
that s the trillion dollar question,0
bollinger break up for btcusdt on minute timeframe btc bitcoin,0
i guess it s not to be taken too seriously after all,0
documentingbtc cynthiamlummis bitcoin is a magic,1
remember all those youtube and twitter accounts saying we might have seen the bottom and the markets have already priced in our situation days ago just remember it s better for them to feed confirmation bias to their audience to the upside than the downside trust yourself btc,0
new feature to help report misleading misinformation on bitcoin from people like elonmusk mcuban thanks jack,1
you could do better than any last years if you pick the correct day to compare prices,0
squirrelbits til the end btc,1
kshib long alert ticker kshib market kshibperp volume price btc btc eth eth,0
it s getting bigger and bigger th of november end of the testnet what are your expectations after wagmi znn qsr btc bitcoin altcoin bullish,1
trending enter longclose short btcusd follow for all alerts btc doge crypto,0
btc bitcoin situation be like btcusdt chart,0
hodlmagoo fossgregfoss i believe limited is distinct from fixed right the bitcoin supply is fixed to million the ethereum supply is limited to some production rate per time unit,0
will our mps accept bitcoin even if not part of their pay but maybe in donations the very least bitcoin not altshitcoins helps to protect your funds against debasementinflation caused by govt more to help rakyat kasthurishankar yeobeeyin hannahyeoh syedsaddiq,1
ascendexindia btc is good,1
binanceus you have my attention with no fee trading and btc dust cleanup,1
bitcoin s burst above the level didn t last long and chart patterns signal its rally since july is at risk of fading i m still making my profit with trade signals given to me by robin moore telegram moorerobin to copied in my trades i went from btc to btc,0
omnifinn princeysov lucky to have bumped into bitcoin in any timeline lucky to swallow the orange pill lucky to have a lucid goal path for the future,1
bitcoin shapeshifting right now i am an active bear passive bull,0
lol it s nowhere close to circuit breaker,0
everything cryptocurrency bitcoin via,0
epic for all the aspiring lucky bitcoin ers,1
right lol like anybody following those price predictions over the last few months could ve made a lot of money idk why people are getting angry about it especially here are they going to curse the moon next,0
separate money and state btc,0
anyone here try the nexo app,0
bitcoin going to surprise ct and everyone starting in the month of sept,1
apompliano th quarter send me some liquidity baby connect to my node bitcoin,1
the failure of bitcoin banking and what hodlers can do to fix it bitcoin,0
bitcoin is a unique event in our life,1
nftmechaen rainmakergaming has potential relationships with nitroleaguegame and some unique gems like championhunters therefore with the market being so volatile it s best to focus on projects with a lot of scope to make our future bright nfts rain btc rain,0
bitcoin bitcoin btc btcusd,0
bitcoin went up usd yesterday last days bitcoin,1
man i love saylor guardian against fud and saviour of btc he is fighting the good fight once again,1
bitcoin is hot right now,1
totally possible but i think there will be a big pullback after that as people sell off,0
nebraskangooner take care of it one day it would be worth more than an actual bitcoin,0
are you diversified or are you all in on bitcoin,0
he is betting that it wo nt go below maybe we should ask him what are the stakes,0
i dont think its due today wasnt today just the date they stopped accepting comments,0
so i ve been dollar cost averaging bitcoin the past few months and i m wondering if it s a good idea to look at any altcoins with prices so low i m still fairly new to all this but from what i skimmed it seems the general attitude towards altcoins is quite dour should i just stick with the btc or is altcoins a viable option as well,0
what determines the bitcoin price a very good read on market dynamics you can have a look,0
altcryptocom a token backed by btc mining and mining of other cryptos is bound to be safe learn more at,1
viktamao rally project starting btc carecoinfamily,1
acceldefi for sure bro i ve been doing it for btc for years this will change the defi game acceldefi,1
this is supposed to be over k today,0
its only been minutes but why does it look like btc priced in this fed ratehike already maybe people are slow today to react bitcoin,0
let s see that dip get bought up in after hours btbt bitcoin shortsqueeze baggers coming,0
the last chance for the bulls btc resistance k was highlighted on the mar st if it fails to break above k this time then it could break below k level in coming days bitcoin btc crypto,0
pitchfinance bsc pitchfinance bitcoin project is good and amazing project cryptocurrency global is powerful project i proud of your project i hope this project will be more developed and better,1
long term it might be more but that s my short term years target,1
hastecoin and as a result many families are paying the price struggling to make ends meet more more clear that bitcoin is a big part of the solution,1
cameron for reference look at elsalvador btc is just part of what they are doing for the country and most importantly their citizens daniagonzalz y nayibbukele are true leaders of the people for the people it excites me seeing a government actually working for their citizens,1
fair enough i do get the growing concern around hardware wallets though at the end of the day people just want to have their stuff safe and the wallets ui and seed word protection stress is kind of shitty,0
binance walked from the deal hang on crypto btc,0
week is great and day too strap in,1
assuming they did nt paper hands it which unfortunately many have,0
what is holding you from benefit from bitcoin,1
here s how we knew that bitcoin bottom was in and was nt a bull trap,0
whatbitcoindid w davidzell excellent minute bitcoin core thesis summary in much the same way that the internet changed the world and changed how we interact with information bitcoin has changed the way humanity interacts with value,1
true that bitcoin is a preferred hedge against inflation says paul tudor jones,1
crazy to think i ve been trading bitcoin now since years in the game,1
