text,sen
i ve found that nearly all coins are either useless or are only there to serve a purpose or problem that the other coins themselves create like governance tokens do nt need those if no crypto proctopcs where you can lend crypto so others can borrow crypto so they can buy crypto it s a nearly fully selfreferential and closed loop system i real ed that got ros of all ambitions and dreams about it and just be a cold blooded trader it helped,-1
a brand new shitcoin to buy monkey pictures,-1
diversification seems to me that it recently got enough traction that it wo nt die lots of young people believing in it can buy etfs more and more politicians and traditional finance people mentioning it etc also it s just cool that said it s only a tiny part of my portfolio though rising despite not paying in and i m prepared for it to go to,1
like traditional gold it lacks intrinsic value it doesn t produce anything or create cash flow and almost nobody seems to fully grasp how it works the underlying blockchain technology might prove to be tremendously valuable but at this point it s difficult to see why any one type of digital coin should be considered so valuable without much obvious nonillicit utility,-1
do kwon cashing out billion before collapse is the biggest con job in history,-1
no shit crypto is nt safe at all between the volatility rugpulls honeypots and other scams if there s one thing we do nt have is safety thus the higher returns are what make this market survive,-1
bitcoin is young give it some time give it a chance you won t be sorry,1
ten years ago i put my down payment money into bitcoin instead of real estate it s up about x bitcoin s price continues to grow at a very rapid rate long term average you see there were good reasons for bitcoin s rapid rise most of those reasons still exist in fact today there are even more good reasons than there were or years ago it is reasonable to expect the long term average growth rate of bitcoin to stay very high for the foreseeable future real estate has significant holding costs eg taxes maintenance insurance sometimes fees interest real estate is nt very liquid and it has extremely high transaction costs ultimately the price of real estate and rents is limited by incomes for example in the long run people ca nt pay more for mortrent than they earn realistically they might be able to afford or percent of their net income for a place to live thus real estate prices are limited by incomes in the long run incomes tend to barely keep up with inflation looking at long term historical data such as caseshiller for popular real estate markets we see in fact that real estate prices barely track the rate of inflation especially when the significant holding costs are properly accounted for bitcoin has no such limit bitcoin has no holding costs bitcoin is liquid bitcoin transactions are typically very little bitcoin s price has been more than doubling every year long term average and as mentioned before can reasonably be expected to continues its rapid ascent real estate is currently in a bubble as evidenced by the pricetoincome ratios the current bubble will pop as the prior bubble eventually had to pop real estate is nailed down bitcoin can be taken with you to anywhere in the world real estate is a sitting duck for higher taxes real estate can be confiscated when the private keys are properly stored bitcoin can not be confiscated knowing all this a person would be a total idiot to purchase real estate instead of investing in bitcoin having said that i do plan on eventually using a small fraction about or percent of my bitcoin holdings to buy my dream home and to pay for it with bitcoin but still end up sitting on a serious stack of sats i have zero regrets for investing in bitcoin instead of real estate and i never will,1
for me i see it as a completely speculative asset i ve bought some in the past made a bit of money off it and sold what i don t like about it because it s so immature it can be legislated to oblivion also that it doesn t have any sizeable use cases yet other than trading it and money laundering i can t see it becoming used as a currency as deflation inherently built into it as well as its price volatility is an impediment also the story of store of value is weak when you consider that its price fluctuates massively unlike traditional assets the only thing i can see is international payments but this will end up being done without needing any of the cryptos out there no matter what the narrative i feel and believe that everyone is just holding to maximise their returns then dump their bags to someone else who s hoping to do the same as there is no underlying asset to underpin the value of the coin other than supply and demand if demand collapses the price will as well it s open to manipulation insider trading and so forth these have been largely regulated out of the mature stock markets while crypto is the wild west right now it s not diversified enough a tracker find tracks thousands of companies while something like that doesn t exist in the crypto sphere to provide a notion of stability it s like investing in a super volatile stock i d be happy to speculate with some play money but it s lack of regulation is putting me off from making it a primary investment choice,-1
eth has the most development going on and that s ultimately more important than the blockchain itself but it s not useable by most people right now it s not a finished product no crypto can really justify it s market cap with performance at this point that s why people say we re still early there is speculative value placed on cryptos that may or may not pan out with the eth roadmap eth has the best chance to be scalable and developer friendly,1
i am yet to see any useful use case come out of crypto that ca nt be done without it easily people will jump on decentralization but it wo nt remain decentralized its already getting more and more centralized governments will never let it be a happyplaygroundforcryptobros so that point is already dead aside from that its basically useless,-1
i would say of all the crypto currency s out there it s a sad fact that we are lucky if half of them are safe investments,-1
who is still investing in this kwonartist coin,-1
the situation has not changed over the past decades fortunately bitcoin is here to give us an alternative to this system by allowing us to take back the power over money,1
so many things destroy this planet faster than bitcoin mining but we do nt hear about it crypto uses a little bit more energy and everybody is up with pitchforks,1
dot is the real deal with bank level security and stability kusama was essentially a copy of dot developed to test new updates in a real world and real economic environment before implementing on dot it ensure dot always runs smooth and never goes down or has security breaches most of the projects on dot will also have a sister network on kusama that will essentially do the same thing but will get new features and capabilities first it s also cheaper to use in general kusama is turning into an art and gaming hub because of this which is really cool so moonrivermoonbeam karuraacala heikoparallel khalaphala etc are just the kusamadot sister networks same teams building them the kusama versions will just have more features than the dot versions,1
the intrinsictrue value of all crypto is that s not hyperbole that s just an objective fact about any virtual currency i guess the same is true of fiat money too in any big disaster scenario where society collapses it s likely they would both become equally worthless pretty much immediately even if the internet somehow continued running no one would be interested in your crypto as soon as there is scarcity and insecurity on that scale physical goods are all that matters it s possible that gold could come into use but you d have to be confident that other people are interested in it before taking it yourself in an exchange because you may end up starving to death on a pile of shiny metal otherwise,-1
too many scams no inherent value disliked by the financial institutions i rely on used by criminals seemingly random value mostly based it seems on manipulating the market environmental impact,-1
it is a currency yet no one uses it as a currency you ca nt use it to buy things around town or from major online stores bitcoin you can especially in places like venezuela venezuela is actually a great example of how it s good for the world because it exists they can feed their family off farming in runescape rather than starve to death because of the dictatorship oppressing them,1
i ve lost money on every single crypto buy and have never sold,-1
better returns on investment than stocks although more volatile borderless transactions far better apy staking crypto than leaving money in the bank protection from inflation of my local currency my local currency loses value like per fortnight at this point,1
debanking access to bankinglike services for people who currently have no access to banks cheap transfers of money like remittances to family abroad smart contracts securing ownership information reducing need for expensive notaries i see crypto as the new industrial revolution the new internet it s the next step in how we live i believe that in tenfifteen years we will look back to society without blockchains everywhere the same way we look back to society without smartphones we remember what it was like but going back is just about impossible and our kids don t understand it at all,1
not a chance the dumping will just get worse no burning going on either circulation supply has nt changed by coin lol,-1
people have used salt seashells cigarettes etc as money because money is what we call the good or tool that is used as money the is used to store value to exchange for other goods as a unit of account a goods or tool becomes money when it is used as money in a prison cigarettes becomes money when that is the goods used for money different goods or tools can be better or worse money depending on the qualities it has there is no requirement that it has to be tangible or physical the requirements are that is has to do its job more or less it has to work as a store of value means of exchange unit of account and to do so it has to be fungible transportable and durable easy to verify etc bitcoin has all those properties and is designed to excel at all of them some say it does not store value because it is too volatile but bitcoin does not contain volatility the volatility is caused by other humans and volatility is not a problem as long as it has remained in value or increase in value between time a and time b the volatility in between does not matter at all so far that requires could require that you hold it for more than years but it will go down and become better and when it does it becomes even more valuable as more and more people see that it is here to stay and see that they can trust that it stores value and even increase in value so far it have and it seems like a given that it will continue to work and i would not bet against bitcoin gold is not bad but today it does not work as a means of exchange for daily items and it probably can not as people will not go back from digital digital is superior at saving time and being verifiable,1
crypto is giving us an avenue to not just be passengers in the financial world,1
cryptocurrency is a long term investment in this dip newbies are panic selling which is a good thing as this is opportunity to buy low and sell high in future it s the game of patience more you hold more you gain,1
how many times do people have to get burned before they learn not to trust this guy,-1
green energy is already widely used for mining bitcoin according to a recent report bitcoin miners have already been using of their total electricity through sustainable or renewable sources for the members of the council the usage is even better,1
bitcoin is a lot of things right now it s a doomsday currency it s an inflation hedge it s a speculative asset it s central banking hedge it s a technology play plus hundred more things all of things are components of its price and value people buy sell and hold for different reasons you can t look at it and say why is it dropping due to inflation it s a hedge against inflation also you can t say it s a hedge against central banks because monetary policy and central banks is in probably one of the worst spots it s been in a while yet btc isn t at an all time high btc is wearing many hats right now don t let anyone tell you it s not any one of a number of different things,1
given that crypto is fundamentally deflationary and limited in supply it makes for a terrible currency currency s purpose is not be an investment but to facilitate trade deflationary currencies always gain value due to limited supply which means people will just sit on them instead of transacting with them inflationary currencies on the other hand incentivize people to use them for goods or investments as they are actively losing value,-1
i plan to invest a small amount every month,1
i really doubt it s this deep i m assuming his fans are just greedy hopeful people and do kwon knows how greedy people are in the crypto space and he knows even if he fucks up once he can do it again a few times it s like trust means nothing anymore if you can make them money,-1
yes governments ban it one major thing though is that the entire backbone of crypto liquidity is through a stable coin called tether they are a complete scam and are already banned in ny once the sec finds out that their coins which should be backed by one us dollar are backed by nothing i believe the feds will shut down exchanges because it has become one huge ponzi scheme,-1
apecoin is going to become a worse version of shib ie not enough pump but still the same dump reason because logic,-1
just buy real gold instead of the crypto version paxg serves no real purpose,-1
the record we did nt need,-1
crypto is the future plain and simple buy or perish,1
i bought bitcoin and other cryptos because i believe in them if you do nt have that feeling about your investments you re simply better off on the sidelines,1
daddy bitcoin is indeed the king,1
this is good i ll buy more,1
harmony one algorand cardano solana vechain gon na fly if there is ever a next bull market otherwise just buy and stack satoshis,1
of shitcoins dont even survive a bull market,-1
it was backed by luna until it was nt the project failed idk why people are buying do kwon s bullshit again fool me once shame on do kwon fool me twice not happening,-1
monero is probably the best coin we have atm change my mind,1
going to crash peoples lively hoods,-1
i m old might not be around in more years that s too long a ways out to speculate about anything btc is the beginning the present and lots of the future still everything else is a gamble,1
it has been my defacto gold stable for years now and i am really pleased with it i tested their exchange mechanism and picked up some gold to verify the tokens being burned in that process,1
i m skeptical about solana due to its low public allocation launch the solana team and vc backing leave retail investors liable to be dumped on not saying it will happen but you never know,-1
we all like vet,1
this is the way buy low buy high the only time i sell is when i spend it on something lol,1
just buy it now and forget about it trust the process,1
eth eth has proven itself in a real operational environment i ca nt stress this enough it is also safe from the sec,1
do kwon s arrogance was terra s downfall so many examples of dumb ass tweets from him,-1
it s a pretty easy win imo just got ta hold it till next btc ath and you re literally guaranteed a x at current prices,1
so many things are worse for the environment than crypto it just seems like this statement is used as a default disagreement against crypto,1
because he does nt understand bitcoin there is bitcoin as an asset there is bitcoin as a payment network the payment network alone operate more efficiently with less fee than companies like western union it also is more secure and transparent than swift buffer should ask himself how much went into developing swift and that s pretty much the cost basis of bitcoin as a payment network bitcoin is like fiat except it is more neutral and universal than majority of fiat out there,1
eth is overpriced and doesnt deserve to be biggest alt,-1
bitcoin has been more stable than these stocks i chose that are less stable,1
i still see a completely speculative instrument i hesitate to call it an asset with no underlying value other than the technology upon which it rests of which could be adopted rather quickly by the federal reserve banking system blockchain i see an unregulated market that is likely to face more and more regulation both domestically and internationally as we move forward,-1
mega bullish on dot,1
yeah pretty much this other blockchains definitely have improved technology kudos to their devs but eth has so many brilliant or excited people working on it at least x the number of devs and that might be conservative so etheruem and layers on ethereum are likely here to stay for some time and be a proving ground testing ground for things for a while it does not mean that other things are not going to thrive quite the contrary just do nt expect ethereum to suddenly become null anytime soon,1
same i spent months annoyed that prices were high and now i get another run at it,1
tether it s sort of an open secret they do nt have enough funds it will crash eventually and it s going to take everything down big time,-1
literally on the same flippin boat done with these crappy tokens that rely on news plays and tweets,-1
there has been three fraudulent scam coins from do kwon and the terra team basic coin look it up his first failed stablecoin where people lost everything luna v ust and now the luna v scam this guy is going to fucking ruin crypto for everyone this is one case where the scammers do and terra need to be held accountable and made an example out of hopefully,-1
he s just exposing how pointless crypto is,-1
eth is great but matic is the way,1
if it s supposed to act as a currency it kinda sucks at it,-1
investigate the bitcoin stock to flow model if you re new you would nt want to bet against a m btc it s really not if but when sustainably above m i d say around the real question is what will the purchasing power of m usd be in years,1
buy there was a dip,1
ethereum is a robinhood character in reverse it steals from the poor and gives to the rich gas fees pure extortion and only a matter of time before the alt coins close in on ethereum,-1
to is a loss but then to is another loss it can always get worse,-1
also your btc is your btc government can not take it from you,1
dollars are going down bitcoin is going down but the purchasing power of dollar is down and btc is still in between you can see mass adoption of btc in future,1
let s call it what it is a scam rugpull and ponzi scheme,-1
do nt hit me but moons they do nt really have an utility and it s too easy getting them by shitposting,-1
yup still mega bullish on dots canary chain kusama also,1
acab all cryptos are bad,-1
such negativity bitcoin has held up well it often trades with the nasdaq simply because traders trade but there are times of divergence it has outperformed a bearish nasdaq this year so it is hedging it s not a magical hedge but it s a very strong unhacked financial network with a finite supply btc dominance over other crypto has been rising again as runaway inflation weakens fiat naturally btc will hedge to a degree it has historically been more volatile though so you ca nt depend on it as a short term hedges,1
laugh all you want but it s practically inevitable that a crypto coin will take over as the world exchange currency it would take a pretty big reversal at this point for it to not be bitcoin but i suppose it s possible,1
bitcoin literally produces security on the order of times greater than the world s fastest supercomputer,1
i am buying more,1
luna is going to be the easiest x this year it s a fully developed ecosystem in a box soon these fudders are going to be whining about missing the boat lol,1
link is good and cheap right now i ve been increasing my chain link position lately,1
love it keep on filling bags at bargain bin prices,1
you will not loose it all do nt bring up luna excuse me while i kiss the sky but wtf do nt bring up luna as a matter of fact bring it the fuck up it s the perfect example of how a top coin can be obliterated in days and why hold no matter what it s just stupid hodl is for btceth,-1
haven t been in a while but the last time i visited rterraluna it was completely overrun by these detached moonbois yet only a few pages further were people contemplating suicide mind boggling,-1
congratulations you have achieved bitcoin understanding level nobody knows how many levels there are i m on level bitcoin is the most beautiful invention ever,1
did they cash out what assholes i have a hardon for btc but i m pretty sure most cryptos are scams made to jump on the hype train,-1
i believe this good luck stretches to me the newness of polkadot is a way of seeing opportunities that has never been seen on other chains before equilibrium for instance has a very low interest rate for borrowing not to talk of the low collateral,1
yeah but doge is going down way faster,-1
as a developer yes it s good in large part because of its first mover advantage ethereum has the largest and most active community of developers by a factor of i would estimate this is a massive advantage for any technology platform it means there is great documentation tools apis and resources that make it easy to learn and build with got an obscure question about the feature you re building there s probably some help guide stack overflow post or youtube tutorial to answer it and that massive developer community also makes it much easier for startups and businesses to hire engineers who already have experience and for any new skills again they can often just google the answer that s probably not what you expected to hear you likely wanted some analysis of tps or scalability ethereum chose the most logical solutions for scalability a lightweight layer pos system with sharding and excellent layer options for high transaction throughput and because they have been focused on that goal longer than any other project they are by far the most reliable robust and decentralized smart contract platform available,1
right ada is by far the leader when in comes to stacking i strongly believe in this coin,1
omfg its going up,1
crypto gains depend on a greater fool to buy in after you ve bought it of course someone with of their portfolio in bitcoin is going to shill it the reality is that crypto has really only exploded so spectacularly is because speculation loves low interest rates and easy money and that has been the world we live in since the origin of bitcoin as monetary policies tighten speculation shits the bed as is happening now,-1
open your eyes guys do nt give your funds to manipulators,-1
correct xrp is pure speculation and zero delivery,-1
it s like the only stable thing on stable coins is the name they go yeah it s not really pegged to a dollar anymore but too many did nt care about it,-1
do nt dwell on altcoins much cause that is how you become homeless,-1
ca nt go wrong with eth,1
i didn t invest in xrp when it crashed because it was a much riskier option than other projects at the time doesn t make sense to invest into something that is having issues almost all cryptos are going to go up in a bull market i don t feel bad at all for not investing in xrp not one bit,-1
the network is a disaster constantly having issues i can t even send sol to my defi wallet because it keeps failing,-1
bitcoin is going to win traditional finance is obsolete hey guys let s only trade during business hours lol hey i can move this without anybodys permission,1
i agree this is why i am holding most of my crypto in coins i believe in and use coins with promissing technology,1
well i fully believe crypto is here to stay so i m happy i can increase my position on btc and eth,1
rollercoasters go back up this is what you call the view from halfway down,1
shit coin shit coin nothing nada rien nichts,-1
its really good most secure and most decentralized chain other projects might look good because they sacrifice decentralization for scalability which is useful for a lot of people until it isnt,1
i m actually excited because i had cash on the side for moments like this,1
ethereum is secure ls built on top of a secure network includes everything you mentioned as better in those other networks that are not even near ultrasound money,1
i do nt like bitcoin at all,-1
unbelievable i lost k to do kwon which was a third of my whole portfolio and for me a lot of money i m really done with this guy,-1
they re moving from ponzi scheme to cult real fast it s like lularoemonat for dude bros lmao,-1
because a good portion of the alts are actually built on it ethereum does have the first mover advantage and it s actually good would nt be where it is today if it did nt have both,1
i see a rapidly deflationary market where those with more and more wealth chase diminishing returns because they re still returns while they keep trying to con other people into buying in because without someone holding the bag the market crashes,-1
ca nt go wrong with btc and eth,1
its gon na bounce back by the weekend,1
macro economics are looking like shit the only thing you re looking at is a bull trap,-1
dont worry btc k end of june,1
the main point is that bitcoin lacks any ability to give you access to cash flows,-1
