text,sen
It's a very high influence available to traders who will certainly be part of playing with or even the guarantee on the money trade settles so that it's appropriate for whales to buy the physical bitcoin bitcoin even at great losses they'll make on cash settle the contract but they'll make money on both physical and cash settle the trade but someone can actually buy bitcoin on purpose at three times the market's current price and theoretically pay in excess by and still get out of this gold influence but they'll make a profit on both like a short whale using a little bitcoin profit and take no physical bits there's no trade around the theory with a physical-supported Brevented and physically fix with a contract and it won't be a huge amount of cash and will be a large amount with the amount that you can choose in the chapter or you can choose a large selection of its or you can choose a large selection of the creation,0
wordlor and cross marks move in timeframe h btc,0
mind on btc bitcoin see xcvbs s ideas at tradingview below,0
Our cointelegraph team analytics has done detailed analysis of btc and his fear and greed index fear at this time at the price of usd so what do you think about the country's bitcoins today?,0
Play small but profit is a big btc btc stock crypto,1
the btc market share family members survive,1
As much control as I have over my emotions I also like to be right about btc,1
oh yeah you re right now i look like quite the fool,0
Make it bitcoin.,1
In the big picture of the bear market this means almost no btc,1
It's proof that bitcoins can't be hidden in every dark corner or can serve as a vehicle for criminals.,1
illconnect is my cashtag if I get some bitcoin that will be enough change of luck for me today,0
I just bought more bitcoin lol,1
Cryptodiva remembers how stable these assets could be when coming into individual get a strong roi i d had chosen either btc or eth sol would pick my first especially now that I had found honeylandgamefi that was built on the same chain block with the same massive utility,1
mmcrypto is afraid when others are greedy and greedy when others fear bitcoin cryptocrency etereum,0
is the American dream really dead or is it just a lot of people don't know how to get into the real estate market personally I believe it's all about diversified buying real estate buys btc buys the gold shares ready,1
When we broke under i'm tired of buying so high,0
mind in btc bitcoin see aaryanouri s idea at tradingview below,0
tired of forex and crypto failure stopping all of our mining services is for you with us you can get the daily benefits btc credited directly into your bitcoin purse by just connecting your wallet to the type of mine we're connected to getting started babydogecoin bitcoin,0
"So they fought you, and you prevailed against them.",1
The bearish weekly action bitcoin of th red wax will it close this way alpha yo btc retraced all over moving up we're back under ma and rsi is under yo bull we're still sitting in support of weekly channels,0
Knowledge only has the potential to be the power it becomes when we use it btc,0
bt,0
fyi bitcoin is closer down than up in case you wonder what's up with bitcoins regardless of the obvious economic climate as most of us have never lived fundamental bitcoins have never changed btc btc btc,0
btc still looks strong and I see another rally up while that correction may not go that in like yesterday expected i will close my short in blue box and go long there is validation around bitcoin crypto,0
Finding a new job for one of the hottest companies in the bitcoin imperviosai is hiring for senior frontend and backend engineers in effect today to build a resistant browser against and standard pp internet,0
So much for buying orders in holy fucking k,0
Peter Schiff is that you,0
Beneath Satoshi's construction lake is getting some preparation work in the first cabin arrangement on the way of a lean bank and clear road this is the first of many cabins to be rented for bitcoin only more satoshi lakes to come,1
We're still in the pre rich phase bitcoin btc crypto,1
Bitcoin ride would be happy,1
institutional bitcoin exchange bkkt go public on the nose today bitcoin nft crypto,1
"I'm laughing about bitcoin being a baby from day one. If you had brought anything more valuable than laughing, you'd be a millionaire. Even now.",1
how beautiful when everything looks green how long do you think it'll be crypto btc last,1
Health care fund b asset kr on an avalanche of bitcoin altcoin blockchain,0
I would never recommend people go in crypto unless they want to learn something luckily I don't have a whole lot of fun in this game is that t,0
that explains that you only hate money,0
Now this is the volatility that separates the boys from the boys.,0
duh blockfi it generates my bitcoin,1
maxkeiser totarquico bitcoin is a device that transfers money from impatientness to patient bro,1
My raspberry price ticker btc lightning network bitcoin,0
cryptosa moov dotmoovs come soon bitcoin bind,0
k gt yall btc,0
bt,0
Damn race to k is really happening right now just a tidal wave of institutional money flooding in from every possible sector because of the fear of being lost,1
You remember those times when bitcoins were euro btc alts,1
just making a coinly account to track my taxes to next season it's fun to suprised to see them track your average charge i hope the coinbase will do this,0
more sats bitcoin btc,1
imo after crypto gets set inside us there will be more people trading crypto then gatsby market stock trading academy will be the first successful platform to teach individuals how to trade ico tokens in the crypto market with btc efficiency,1
I play and get cashback the more you play on betfury the higher rank and cashback number you will get my user user named befurysucices bitcoin staining,1
k breaking on pro coinbase,0
dudejlebowski may not for years not realize asics have a pretty short age. Years would be good if there was a bitcoin miner optimizing for a baseload of hot energy output.,0
This is the contents I'm here for all the noise. No bitcoin bitcoinudiable signal.,0
not your key not your coin,0
Only in bitcoin wallets aren't sold in over a year.,0
Soon in other news just another day the dinosaurs went extinct btc,0
whalelert gets ready to buy some btc before buds up atta child,1
Garycgorski sayslor potus federalreserve your time preference is way too low bitcoin buy power has increased in recent years while usd s has decreased at least and it's the strongest fiat the btc currency has just begun it's bound to be volatile for a while to come,1
The company crypto prepares for pause activity during the joint of the bitcoin ethereum,0
You can always wait for it,0
Johnnyclothing i like this slow creep up for tl vra claims to lose territory before we see the big expansion up I think once tel goes up to the penny vra around the penny we see them taking off again assuming of course btc still strong claim k shorts get the rect,0
qeyladewi goldendoge czbinance elonmusk What is the cycle btc,0
i think most of the new ones are scared of bear season,0
i'm playing lnbingo This card is to draw the next bitcoin block to become a mine learn how to play in lnbingo,0
i disagree because you can't fund aww with btc,0
Bitcoins passed the price tag for the first time because maybe an accident during last week bitcoin kept getting land lost over the last three months and the ethereum increased faster by buying cryptic cash using flexepin prepaders,1
The dispute calls btc i feed the hungry,0
Every action against bitcoin is an attack on me and the hopes of free society,1
"So, ideally don't t cash out just buy a dip",1
btc is really interesting how it's going to react right now. It feels like relief because the negativeity around the market is very high.,0
apecoin see btc like,0
find a good home for another mold I paid with bitcoin want to trade some btc you for art let m,1
"Uh, the secret culture of money inside of us is there to hurt the workers. If people want to share their amount of bitcoin salary, anything. Then I clapped their hands, and besides, we know she's full of blouses about everything else.",0
bossgivenawayz bubbatken giveawayhale altcryptogems cryptopopoboy flubbenb proudrr buckhillers this token will boom and it is supposed to my crypto friends do not think more just go for it docleiy lucky manno blackkkalonkhdsqcvzzyusgayr btc,1
The movement kind of brought attention to the price graphs and predictions turned out to be true but the fact that the guy was looking and getting a lot of holding and thus having a clear view of the market,1
gm for all those who choose to build our future on a better system stop building on the relics of bitcoin revofico technology,1
glmr will x remember tweet I saw a graph buying a big bag now bitcoin btc sol doge shib keeping nu xec zec heat dent,1
They have the same mindset and ignorance of the maxis that posts here.,0
Jtsglobal utodayen govbrazil Indiainkrazil apompliano brazilrian brodiebcs awesome ukinbrazil jack it is a big country and it would not be a bad thing to be the third country to make bitcoin official btc,1
You prefer gold medals or btc bitcoin medals,0
When policy makers priority the bitcoin sustainable energy naturally take advantage of this and become greener thebword,1
Stop with this nonsense. Printing money is political. We could be interested in cryptocurdency without spreading this nonsense.,1
price value stop entry loses link in bio tz btc bitcoin ok,0
The bitcoins have been exhausted since the Chinese banned it.,1
Whalalert whales sell bitcoins and wait to buy in for their profit is very clever,0
The only way to reduce the effect of the tether s would be to use bitcoin as real world currency in daily transactions than are currently used mostly for speculation,0
All data models of science suggest that btc will peak much higher than s best crypto mismatch groups over k members and even have their own apps join here shib btc eth doge sl rv algo s boa gme tnt h amc ct},1
swans are a good place to buy bitcoins I love their ethos and what they stand for but at the end of the day is high costs or prices marked up,0
Matthe whyland as if btc cares what people say fallen here fallen there just hodl and relax,1
bitcoin break k to set new alltimes high currency itoldyouso bitcoin,1
Ibrycom no reason for one other bitcoin is all we need,1
lol yes there's no use selling when you can hodl your shit,1
"If you haven't invested in bitcoins, you'll regret it. And I'll tell you what. I told you not to be that guy.",1
Looking for tonight's btc short,0
mfhoz look forward to that hodl bitcoin,1
k end of year worse case only looking at sf you re good you will do x instead of x but in you will make it rain,1
Teslaspacex ceo musk said the tesla would likely start receiving bitcoins for more vehicle purchases. I'd like to do some more because crafts to confirm that the percentage of renewable energy use is likely on or above if so Tesla would continue to receive bitcoin musk says,1
i am a support of bitcoin elon,1
whoa i don't believe you like money too we have to hang out,0
Thank you for the opportunity Stpatricksday bitcoinsquare tag forsrv,0
Marginally because you don't do economic activity it would be better to show all your wallets to your node or add your address as a watch just for your node so as to be able to verify that your wallet is not deceived by an evil actor,0
current bitcoin price cryptto btc btc,0
We're very happy to share that we've been working with our old pair of undigbtcs to add bitcoins to the balance sheet chainysis.,1
olmeg adybug cryptovizart it techpl blaakke therealplanc on chaincollege janwues cryptobbb piopapatowicz ecowawalut clearei merneist croken ftxusderivs bitfx but everyone celebrates when they announce the first future btc etf I've said it's going to happen in a place when you can make money long and in an environment set full,0
cmon btc fighting for my love,1
wreadygliasi Krugermacro whale game btc will make new heights in a few months or less,1
i m surprised how bitcoin and index relationships have been over the last few years unfortunately bitcoin may continue to be more associated with traditional assets because it's adult bitcoin btc,0
one bitcoin is now bitstamp high market cap billion bitcoin,0
Great love of exodusio never saw this coming but now in fact I feel blessed alhamdulilllah exoduswallet cryptofreedom bitcoin,1
Congratulations. You'll be made whole again in no time.,0
This annoying price action stepped away for a week or so,0
The bitcoin price has been firmly broken out of the resistance line down main and seems to be consolidating the front of the next step will be interesting to see if it's superior to June's last significant peak close.,0
History behind texas and oklahoma moves to seconds and why it's happening now bitcoin sportsbook.,0
Damn everyone's absolute crazy,0
market displacement warning at btc this signal was detected seconds ago fixed for further btc btc,0
mind on btc bitcoin see donyakka's idea on tradingview under trade here,0
Hey now I'm buying in,0
exiting This chart shows the litecoin getting crushed compared with bitcoin,1
Crypto market updates are available at the ethereum crypto bitcoin,0
To bitcoin it's the miner who collects tx charges,0
eth short warning market ftx eth price volume btc btc eth,0
that's just the thing if you know how btc starts then you should know about these last statements you just short-term correlation,0
So German banks are bullshit in btc but eu try to block btc wtf,0
harrygbeckwithadamus Thank you so much my brother really was just joking bitcoin,0
btc short deribit btc villain you learn in this business if you want friends get carl ican dog,0
Bitcoin prices have been moving again and now sitting back all day moving average so that the short-term signal keeps positive for btc there's a sign on both sides of the fence some say bitcoin will test k again and some say bitcoin is off to the moon,1
This is your brain on bitcoin,0
Obviously digging green today but kinda disappointing to see bitcoins getting outpaced by alts I swear people just don't learn,1
You don't need to plug it in to see what's in it you just need to put in if you want to send what's in it the example I have a trezor and I have it linked to my cell phone wallet so here on my cell phone I can see what's in my hot wallet and also what's in my portfolio as a separate portfolio both the value of living difference is that I can't send any coin from a tremble purse because it's sitting in a secure place if I want to do that I need to have access to the Trepologs.,0
wheeeee a good trip for some shorter out there,1
bitcoin prices in dollars Canadian btc xbt btccad prices are now btc cad avg hours past h change h low h information is higher here,0
looking at Tesla's market looking at a Tesla model smoking demons avoid impressing the ethereum bitcoin,0
Just a few days ago btc was trading downstairs and today btc touched growth just in btc days unbroken support of the Bhi Bhi-hi,0
and the good news bitcoin cme gap closed due to a recent dump because it was higher than expected cpi number,0
it will but buy more dips will prevent it,0
Bitcoin prices alert on short-term swing high resistance levels m okt pm,0
If dip's deep enough that they buy it back in New Year's and still profits they're not stupid just saying,0
Good question may be temporary but this puts good long-term pressure more competition between big players good for btc,1
bitcoin btc cryptocurncy fact interesting btc has built a negative candle later on into the crypto bubble however it has made a positive candle stick after it will repeat itself like and follow for more,0
Peterschiff this book saved my ass peterschiff bitcoin eth crypturency elonmust joerogon,0
i guess i guess i want to buy cheaper btc s and try to keep the price low by taking the cart energy cost vs. mine yep more days to conclude their purchase better hurry the price won't stay this low for a long time,0
That's a million-dollar question.,0
blender break to btcusdt at minute timeframe btc bitcoin,0
I don't think that would be taken too seriously after all.,0
documentingbtc cynthiamlummis bitcoin is magic,1
Remember all your accounts and Twitters say we may have seen the bottom and the market has been at a price in our situation the other day just remember it's better for them to confirm bias to their audience to capsize than the self-assured downside btc,0
A new feature to help report misinformation on bitcoins of people like lonmust mcuban thank you Jack,1
You can do better than the last years if you choose the right day to compare prices,0
squirrelbits til the end btc,1
kshib alert long ticker kshib market kshibperp volume btc btc eth,0
It's getting bigger and bigger than the noverber tip of the testnet. What do you expect after zinn qsr btc bitcoin altcoin bullish?,1
trending enter btcusd short longclose follow for all btc doge crypto warnings,0
btc bitcoin situation like btcusdt chart,0
hodlmagoo foss gregfoss I believe is limited to a fixed bitcoin supply for millions of ethereum supplies is limited to some level of production per unit time,0
Our mps will receive bitcoins even if it's not part of their salary but perhaps in the least bitcoins no altshitcoins help to protect your funds against the detachment of demarcation caused by more govts to help the casturishants yebeeyin hannahyeoh siedsaddiq,1
gasexindia btc well,1
Your binanceus has my attention with no trading charges and btc dust cleaning,1
bitcoin s burst above the level didn't last long and chart signal rally pattern since July was the risk of fading i m still making my profit with a trade signal given to me by robin telegram mooring moore to be copied in my trade i went from btc to btc,0
Omnifinn princeysov lucky to have hit bitcoin in every lucky timeline swallowing orange pills has a clear purpose for the future.,1
Bitcoin shapeshifting now. I'm an active passive bear bull.,0
That lol is nowhere near the circuit breaker.,0
Everything's cryptocurncy bitcoin via,0
epic for all lucky bitcoiners,1
"That's right, Lol. Like anyone who's been following them. Price predictions over the past few months could have made a lot of idk money.",0
separate money and state btc,0
Whoever's here tried the nexo app.,0
Bitcoins will shock ct and everyone starts in sept moon,1
apopliano th quarter sent me some liquidity baby connected to my bitcoin node,1
banking bitcoin failure and what hodlers can do to fix the bitcoin,0
Bitcoins are unique events in our lives,1
nftmechaen rainmakergaming has potential relationships with nitroeguegame and some unique gems like championhuners therefore with that market so volatile it's best to focus on projects with much scope to make our future bright nfts rain btc,0
bitcoin bitcoin btc btcusd,0
bitcoins went our way yesterday the bitcoin of the last day,1
Man i love saylor guardian against fud and btc savior he fought against both once more,1
hot bitcoin now,1
It's really possible but I think there will be a huge advantage after that as people sell,0
Nebraskangooner takes care of it one day. It'll be worth more than real bitcoins.,0
Are you diversified or are you all in bitcoin,0
He bet that it wo nt went under. Maybe we should ask him what the stakes are.,0
i dont think because today is not just the date they stopped receiving comments,0
So I've had dollars on average bitcoins in the last few months and I'm wondering if it's a good idea to look at any altcoins at such low prices i m is still quite new to all of this but from what I skimed seems to be a common attitude toward the altcoins should I just stick with the btcoins or is an altcoin option worth as well,0
What determines the price of excellent bitcoin reading dynamics? You can have a look.,0
Altcryptocom token supported by btc mines and other cryptos mines must be safe to learn more at,1
project rally viktamao started btc carecoinfamily,1
"fontcolor="" # FFFF00""aceldefi fontcolor="" # FFFF00""surely broi vehavebeen doing it over btc over the years fontcolor="" # FFFF00""thiswillchangethegame defi acckeldefi",1
It's supposed to be more than k today.,0
It's only for a few minutes but why it looks like the price of btc in this feeding rate is already probably people are slow today to react bitcoin,0
Let's see that dip can buy in after the btbt bitcoin baggersqueeze comes in.,0
Last chance for a btc resistance k highlighted in mar st if it fails to break over k this time then it can break under k levels in come bitcoin btc crypto day,0
The bitcoin pitchfinance project bsc pitchfinance is good and the incredible global cryptocurrency project is a powerful project I am proud of your project I hope this project will be better developed and better,1
Long term it may be over but that's my short term year target,1
Hurry up and as a result many families are paying the price fighting to make it end up fulfilling more clearly that bitcoin is a big part of the solution,1
The cameron for reference to seeing elsalvador btc is just part of what they do for the country and the most important citizens and the citizens y nayibpukele is the true leader of the people it excites me to see the government actually working for their citizens,1
It's fair that I get concerns that develop around hardware wallets even at the end of the day people just want to have their stuff safe and ui wallets and seed word protection stress is kind of annoying,0
bind walked from the deal hang on crypto btc,0
Big week and day too rope on,1
Assuming they're handing out papers that unfortunately have a lot of,0
what's holding you back from the benefit of bitcoins,1
here how do we know that bitcoin' down it at and nt bulltrap,0
what a very good bitcoid w davidzell minute bitcoin summary core in many of the same ways that the Internet changes the world and changes how we interact with bitcoin information has changed the way humans interact with values,1
It's true that bitcoins are fences preferable to inflation saying paul tudor jones,1
crazy to think I've been trading bitcoins now since years in the game,1
What do you think about the current bitcoin condition because its fear index and greed are neutral today at the price of our analytic team we've done detailed analysis of the btc but we'd like to hear your opinion too,0
The price of spaghetti alla carbonara is satoshis or btc btc usd sit on Saturday June pm edt bitcoin carbonarainex,0
btc btc k will be destroyed on Saturday then pump to k and Monday will do a retest to fill cme gap maybe,0
also possible btc bitcoin btc,0
It depends on whether the op is like a coin.,0
Hope everyone had a good weekend.,1
eager to bring bitcoin chain bitcoin atms to leybitcoin nayibpukele bitcoinbeach,0
We'll no longer let them hold us here standing strong. We'll hodl through the storm and hodl for the people once and for all.,1
btcperp shorted on ftx utc btc cryptocurrency,0
btc crypto this country legalizes cryptocurrency bitcoins,1
Did you feel it? We touched the wall. Sell it.,0
Bojidardostov although this is backwards we've not long enough I'm still sure bitcoin saw another high this year but everyone should follow the ethb tweets and predictions I've held firmly following him,1
The amount of taxes in that case depends on where you counted as selling cheap or more expensive. I always wondered this because I've been dcaing for the last few months. I think I have to work out the average price for the tax calculations but it seems I can only sell a few bitcoins and pay less taxes by saying that I'm selling the most expensive ones.,0
really made the decision to buy dip at a bar like in the morning lol don't regret here,0
Bitcoin h denial h bear resee ya,0
All day long I dream about sats bitcoin,1
cryftowhale hey btc in bull trap,0
gt is warming from btc btc,0
can crypto technology increase clean energy global bitcoin warming through,1
finexcz m for everyone who's gonna make it through the market of btc bitcoin bears,1
Good Hswapdex project Hakz ochendoglobal Mary Airdrop cypto bitcoin,1
dianaprealtors stay at home and make money online believe it or leave it produce every hour instant cashout no referral required no hidden cost bitcoin ask me how or message me through direct message,1
Everyone did themselves a favor and get some cast. It has made me a lot of money. These last few days were perfect.,1
Bears and swaggers are coming out of their caves friends see ya going in the next ath,0
btc derivs sheet tweet every cme min pending min gs delayed min and oi shares out,0
exahash mil mc rict ge expr sole spy bil mc gme amc spce tsla inside aampl sndl pltr nvx krt ge expr spy sole diss pfe gno jnj aal nokb ccfi expects nr fflpfl bt bt bt bc bc bc,0
bitcoin bitcoin btc btcusd,0
♪ Widia the magic of a playtoorn ♪ ♪ metaverse bitcoin silence blockchain ♪,1
This step looks like a btc cryptocurrancy fix.,0
Herro tyler's still out tonight in the game for btc's hot bet.,0
Sparrowwallet bitcoin's best practice should be read.,0
bitcoinquates bitcoin advocate pleb here,0
solution for inflation is bitcoin,1
I sell bitcoins but I also get heavier bitcoins on selling from hodl,1
goonrich minikishu babybitcoinbsc follows the path from btc to ath btc new bnb,1
Coinswitchkuber bitcoin fell down a month after diving dropped btc into k we believe that this support area will continue after bear traps finally bravo mjtru makes us proud his tweets ta have helped me greatly,0
bitcoin is currently rising due to the upcoming bitcoin conference in miami florida april,1
You have to report every trade for that year regardless if you consider it while well of course it depends on your country,0
