text,sen
Your investment is based on investment in the work of other people you have bonds that lend money lend money to companies that make that money and pay you interest from their profits you have equities invest in the work of other people's work you have bonds that lend bonds that lend the bonds that lend the bonds that lend money to the companies that make that money and pay your interest from their profit and pay the interest from their profit you have the interest from their profit you have equitties you have equitties that invest in the company and then share in the company and then share in their profits that money in their profit to the profits down to the companies that make up to those companies that make up down to those companies that make no down there are no value down there are no means down to the means that there are no profit down to the company that there are no profit that there are no interest you have no interest and no interest to gain interest from their profit from their profit from their profit from their profit you have no e or the profit from their profit from their profit from the profit from their profit you have no e or profit you have no e or profit from their profit from their profit from their profit from their profit from their profit you have no e or their profit you have no e or interest you have no e or interest you have no e or interest you have no e or their profit you have no e or their profit in their profit you have no e or their profit you have these interest you have no e interest you have no e or their profit you have no e no e no e or their profit from their profit from their profit from their profit from their profit from their profit from their profit you have no e or their profit from their profit from their profit from their profit you have no e interest you have no e interest you have no e interest you have no e the profit from their profit from their profit from their profit from their profit from their profit from their profit you or their profit you have no e interest you have no e interest you have no e interest you have no e interest you have no e interest you have no e interest you have these interest you or their profit your interest you have their profit you have their profit your interest you or their profit your interest you have no e interest you have money you have no e interest you have no e interest you have the profit you have no e interest you have no e interest you have no e interest you have no e interest you have no e that you have that,-1
I bought a crypto just to surf on a wave inhibiting hypo I don't beleieve crypto into a long-term investment and think most people there just for a quick advantage too,-1
complete audit of usdc as well,-1
Its potential for both disrupting the market and offering services and solutions at the blue sea level and I'm excited to see how the chain blocks will change the game in the next decade.,1
People don't want to lose all their money with a typo.,-1
I haven't heard of the use cases that would cause me to want to have bitcoins even if I stay in argentina and try to keep against inflation I'll still buy usd that wants something drops in a matter of months,-1
Wouldn't trust this horrible man and never gon na invest in luna ever,-1
It's just a problem for those who do not understand the full potential bitcoin bitcoin bitcoin is a nonpermissioned pure esp trade if for whatever reason this is valuable to you you you will spend bitcoin bitcoins more valuable to you than fiat you will fill your bitcoin by buying more bitcoin see how that works if you don't prefer to have some correlation looking over your shoulders for every payment you'll pay in bitcoin just say,1
The main prize for money laundering taxes avoids and regimes avoid sanctions as if it were an n easy enough pyramid scheme and other kinds of large-scale fraud never faster or easier to lose everything to phoshing or consumption of new energy pow roads for gambling addicts to be invented or suffer relapses outside of carpets pulling and coining most projects still massively rising bubbles because most buyers know about fuck and just want to get rich fast,-1
I personally invested in btc and eth reasons diversified if the trend of getting everything online and the whole metaverse thingy keeps getting will also be going on a consistent increase rate of adoption eth is the whole new ecosystem of crazy apps sure the number of other better crypto could replace it but so could better search engines replace Google and yet I'm not too worried that btc is the real proptystore of any value that you call your complete control worthy and predictable you can see code,1
The massive ecosystem that has been developed in the ethereum and many applications on the other chain is a fork of what has been developed in the ethereum that says a lot just see crypturise up how many of them are tokens on the ethereum that are in the ethereum and almost all applications in the ethereum can have lower costs by sacrificing decentializations like many other chains but they're doing NTT skipping on these values and in this case they put the safety first and even if the ethereum does the proper sacrifice for the ethereum just go as far and that's all of those things that will increase the user's face on the scaled solutions for the trilbulity of the trilbulity is a solution and now scrolling and now have been properly implemented and even if you're going to use them even if you're going to use them even if you're going to use a higher layer of ice.,1
Allways want to invest money into stockings but it doesn't have to be complicated and expensive plus back you get with stock that most often only Crypto inflation has everything accessible it's cheap it can return the huge advantage it operates and I know one or two things about technology,1
i first bought bitcoin in i honestly just liked the idea of sending money online in a way untrustworthy seemed revolutionary to me and i was right,1
The sooner this shit falls the fuck better be justin the sun,-1
I like the coin.,1
It's a decentralized scheme of ponzi just because there's no one person or entity is orchestrating it Nt means it doesn't have a typical mechanism of pontique scheme doing the profit coming from anywhere but the only new investor that's the only question that's needed to determine whether or not it's a pontzi scheme some of them promise back big and the rest while they might not really promise it's any fun to stay poor is a way that it's not going to go away to the whole poor hodd doctrine of the hodl which is going to push you back long enough if it's a stupid promise to have a short way of subbuilting is that they know that it's not going to go to super poor and try to do a new wall in their friend's at home and try to do what they're doing at home in their homes in the stadium,-1
creators are shady outposts like do kwon,-1
no one wins with this unless you're very lucky pure gambling,-1
i m pretty sure most transactions on the chain block are set and dump,-1
no bitcoin thil request has actual value,-1
too much shitcoins,-1
No ceo makes false promises. No problem. Which is why bitcoins are king.,1
let s go btc,1
Drug dealers and dark web users and money laundering. They really make crypto look bad.,-1
Ethereum bye,-1
It's not an investment you just have to look at the way it's described in social media where it's pumped with all the enthusiasm that a traveling merchant used to pedal snake oil in the past it gambled where you hope to find some mugs willing to pay more for it than you do and you re not the one left holding the bag there is no intrinic value and even though all the white paper in the world it did what was said on the lead people who had it purely to pay more idiots to pay them than to argue about how money and how they constantly did the value of the underground spaces there essentially nothing could be done in the pureest way to have the money to convince for me to pay for the idiot to pay for more to do things that they didn't deserve but continue to do in the things that they didn't have to do in terms that they didn't deserve to do but continue to do in that.,-1
Because the future payment system talks about backends here is gon na going to use blockchains b through crypto we can have an effective financial decentralization cut the middle man's bank and start producing results on our assets,1
I've been holding my bitcoin because I've bought and sold a lot of other crypto but never sold my bitcoins as long as you're back not expecting wealth soon and can tolerate some paper loss going for it,1
The biggest con job in history is more than doing kwon no one buys your cans stfu,-1
Two words free fall,-1
The gold bitcoin I still don't understand how it gets so much value for what it is,-1
It's so easy to make money in crypto with patience and horizon long-time investing in sound projects over dips and planning years back from now and not weeks of being a patient value investor and stop trying to pick a winning number. It's not a fundamental investment ticket. It stops clicking.,1
Honestly the most interesting thing for me about crypto has been how it really pays me to learn shit. I've got half a dozen degrees of diploma and certification in some really different areas. I like to learn clearly in the pursuit of career opportunities because I also love to make a comfortable life but I pay to learn all the things I put in time and money to delay paying the cryptotical pay actively to pay me to learn about the macroeconomical development political infrastructure of political advertising.,1
Crypto is an immature market with high levels of volatility with traditional investments you can hold for growth or you can trade people's days going on and even some of what's left may not have to trade days with crypto no mean return and this means crypto is very difficult to fit in an investment strategy received,-1
Just add a mile to my long-term bag. Stay strong. Bada bing bada boom.,1
to be fair. A man on this sub makes a guide about how to make shitcoin and actually called buttcoin and pumped so I'm not surprised at this point.,-1
Almost as bad as an ape with this you hope it fails with an ape even though you never know when they'll pump it and throw it away,-1
It's not safe we could lose this week and take years to recover or could take months anyway we just have a typical drop when people say they're safe they're referring to a lack of consistent volatility back and limited loss of crypto mostly not that,-1
And it will rise. I may hate on but the ethereum is the best smart contract platform now with the number of dapps and smart contracts. That's no competition.,1
Hype around nft collections is a very bad thing why someone would throw thousands or even hundreds of thousands on jpeg monkeys that look exactly like five thousand other jpeg monkeys except with different color teeth outside me the market nft is currently a giant bubble ready to explode when it's going to punish those who create the really unique and artistic Nfts rather than just randomly modified from the same picture,-1
Bitcoin is more like a natural dmt floating in your brain. Everyone has the possibility of accessing it without cost. You process it.,1
Why crypto helps its value shock and they'll need to turn it into cash for that money to have real liquidity as well they've been talking about using crypto as an exchange form for developing countries for years and still haven't been adopted there upside down for crypto as a way to send money and lots of downsides,-1
The Internet decentralization seems cool The smart contract the title of the selection of deeds and what is not digitized and on the blockchain,1
I like the nature of crypto decentralization and good profit too,1
There are three coins of fraud from do kwon and team terra coins looking for it first failed stablecoin where people lost everything luna v ust and now luna v scam this guy will fucking ruin the cryptto for all these people this is one case where scammers do and terra need to be held responsible and make an example out of hopefully,-1
developing countries that don't have traditional banks but having Internet connections will be able to do much more efficient business,1
Well of crypto are shitcoins and scamcoins,-1
I'll smoke and still buy more bitcoins.,1
i'm in crypto since then and so far i found out no money transfer was the only one that came to mind and defi well that so far only costs money,-1
You think bitcoins will continue to increase by an infinite percentage one day it will crash and stay down noob,-1
i use xrp for that i can send thousands of dollars below seconds at zero cost,1
Like it technology just so damn cool mixed up with all we are today and coming technology it gon na continue to be a wild trip,1
i m is also very excited for when the ethereum moves from the pow to the post that should remove the biggest criticism as some studies estimate the reduction around in further energy costs et is working hard to increase the rate of transactions that will be necessary if wanted to challenge such as visas or masterscards that order the scale of more ps transactions,1
I've bought orders scattered all over the bear market game accumulated,1
Celsius smashed the ust peg and caused the retailer to lose a huge amount of money they would do anything and everything to recover the money when push comes to shove,-1
A worthless ghost chain that will die in a few years. No one cares about any other than Ada Tards.,-1
i had bought over the years and kept rising no matter what said and no matter how volatile it was itself was evidence enough for me that crypto was an NT go anywhere,1
If only they knew bitcoins were starting to take off today,1
It happened selling i m gon na get so fat on the bitcoin that when I sell it people will call me a whale,1
The impact of the bitcoin environment alone had the impact of the environmental emissions of several small countries for the currency that was used mainly for values that were stored. This deal was very troubled with the assumption that there would be no transformational breakthroughs in the efficiency evidence of the work being with us and obfuscating the long-term complexity of my clever friend's crypto was literally put into the financial giant scripto because he didn't believe himself to make an expensive mistake in buying coins i advised him at the beginning of s and working for a tech company not sure transacturing in coins which would continue to be a major problem in elbeth's coin trade to try not to organize his basement in the first place and he would continue to believe that we would let all the information that was actually in the project that we wanted to confirmortrictrictretretretretretttretretretre real project,-1
currency is only useful if it can be traded for goods and services to the degree you can trade to buy your local currency so it's cool but most of the time it's too volatile to be reliable as an exchange broker,-1
The best thing about crypto is I get more per week lurking than I do for the last few years it gives me a combined bank literally robbing people of their money they run one of the most successful frauds in the world,1
i have found that almost all coins are either useful or just there to serve the purpose or matter that other coins themselves create such government tokens do t need them if no proctopc crypto where you can lend crypto so others can borrow crypto so they can buy crypto it's almost entirely self-recitative and closed loop system i actually get ros from all ambitions and dreams about it and just be the cold-blooded merchant it helps,-1
New shitcoin to buy monkey pictures,-1
Diversification seems to me that recently got quite the appeal that it wo nt dead many young people believe in it can buy more and more politicians and traditional financial people mention etc. it's just cool that it's just a small part of my portfolio though it's not paying and I'm ready to go to,1
like traditional gold it doesn't have intrinsic value it doesn't produce anything or create a flow of money and almost no one seems to fully understand how working down the tech block might prove very valuable but at this point it's hard to see why one kind of digital coin should be considered so valuable without much obvious nonillilic utility,-1
doing kwon cashing out billions before the collapse was the biggest con job in history,-1
No crypto shit is the safe nt at all between the volatility of the honeypots and the other scams if there's one thing we do nt is safety so the higher benefits are what keep this market alive,-1
Young bitcoins give some time give you a chance you won't regret,1
"Ten years ago I put my payments to bitcoin money to bitcoin instead of real estate it's up about x bitcoin prices keep growing on the average long-term average. On average, you see there's a good reason for bitcoins to be faster.",1
For me to see it as really speculative assets I've bought some in the past made a little money off of it and sold what I don't like about it because it's so immature it can be preceded to forget too that it doesn't have the size cases that can be used but other than trade and money laundering I can't see it being used as currency as deftlation as being built into it as it's details as it's about as it's volatility the price disorder also the value of the story is weak when you consider that the price of the traditional fluctely as an asset can see it as a payment without any explanations to do in any other way and then there is no other matter to save the same item that there is to save the same item that is weak stuff that people when it's a large amount of old value in this amount of stock is a large stock and there is a large amount as if there's not going to a large amount and there's not going to be the same amount in the same amount in the same amount of money in the same amount in the amount of money that there's and then there's in there's in there's not going to the same amount that there's not going to the same amount of money in the same amount of money as there is not going to me in the amount of money as there's in the amount of money that there's,-1
eth has the most development going on and that s end up more important than the chain block itself but it can't be used by most people now instead of finished product no crypto can really justify it's closed market with performance at this point why people say we're back early there's speculative value placed on cryptos that may or may not pan out with et roadmap eth has the best chance of being on a scale and developing friendly,1
i am yet to see any use case come out of crypto that ca nt be done without it easily people will jump on decentlation but it wo nt stay decentralized its already getting more and centralized government will never let it become happyplaygroundforccrys so that the point is dead apart from basically useless,-1
I'd say from all the crypto currency out there it's a sad fact that we're lucky if half of them are safe investments,-1
who still invests in the kwonartist coin,-1
"The situation hasn't changed over the last few decades. Fortunately, bitcoins are here to give us an alternative to this system by allowing us to take back power over money.",1
So many things destroyed this planet faster than mine bitcoin but we didn't hear about that crypto using a little more energy and everyone was ready with a fork,1
The dot is real deal with bank-level security and the same stability is basically a copy of the dot developed to test new updates in the real world and real economic environment before implementing on the dot it guarantees that dot always goes smooth and never goes down or has security violations most of the projects at the same point will have tissue sisters that will basically do the same thing but will also get the first feature and the ability it will also be cheaper to use in the Kusama common is transformed into the art and peat because it's really cold so that the month of the urabealalajapa kola dlla team will make the same version of the same tissue that will have a similar version of the same version of the same version of kutkut will have only a version of kut,1
The intrinsictrue value of all crypto is that s is not hyperbole that s is just an objective fact about virtual currency I think is equal to fiat money in the great disaster scenario where society collapses it may be both of them will be equally worthless pretty soon even if the Internet continues to go on it won't be interested in your crypto as quickly as there is scarcity and insecurity on the physical matters of the scale that all of that gold could possibly be used but you'd have to be sure that others are interested in it before taking in the exchange because you might end up dead a pile of shiny metal instead if you might end up on a pile of broken metals if there're not there,-1
Too much fraud. There's no built-in value disliked by financial institutions. I rely on being used by criminals.,-1
it's currency but no one uses it as currency you ca nt use it to buy things around town or from your main bitcoin stores especially in places like venezuela venezuela actually a great example of how it's good for the world because there they can feed their families off farms in runescape instead of starving to death because dictatorships,1
i had lost money on every single crypto purchase and never sold,-1
It's better to return to investments than stocks although the volatile border transactions are much better than the crypto crates than leaving money in the bank protection of local currency inflation. My currency loses value like a two-week value at this point.,1
Banking access to banking services for people who currently don't have access to cheap bank transfers like money transfers to foreign families smart contracts secure ownership information reduces the need for expensive notaries. I see crypto as a new industrial revolution. That's the next step in how we live. I believe that in ten fifteen years we'll look back to society without blockchains in any way.,1
There's no chance of dumping just gonna get worse. No burn happens at either circulation supply hasn't changed by the coin lol.,-1
People can't use these salt cigarettes as money as money because money is what money is what we call good or tools that are used as money that can be used as money that can be used as money that can be used as money that can be used as money that can be used as money that can be used as stuff that can be used as money for other things that can be used as money for other things that can be used for other things that can be used for other things that can be value for other things as units as units as units as units as units as units as things as tools as money as money as money as money as money as money as money when that money is used as money as money is money as money as money is money as money is what money is money is what money what money is money is what it is money is what it' what it' what it is what it is what it is what it is what it is what it is what it is what we call or what we call or what we call or what we call or stuff is what we call or what we call or tools or tools or tools or tools or tools or tools or tools or tools as tools or tools that tools that tools that is used as tools as tools as tools as tools as tools as tools as tools or tools as tools that is used as tools as tools as money can use as tools that is used as money is used as money can use as money that is used as money that is used as money that is used as tools as money can use as money can use as money can use as money can use as money can use as money can use as money can use as money that stuff as money that can use as money that stuff as money that can use as money that stuff as money that stuff as money that is used as money that can use as money that that can use as money can use as money can use as money can use as money as money that that that that that that that that stuff as money can use as money can use as money that can use as money can use as money as money that that that that that that that can use as money that can use as money can use as money that can use as money that can use as money can use as money that can use as money that can use as money that can use as money that can use as money that can use as money that can use as money that can use as money that can use as money that can use as money that can use as money that,1
Crypto gives us a way not to just be a passenger in the financial world.,1
Cryptocurrency is a long-term investment of these panic newbies selling which is a good thing because this is an opportunity to buy low and sell high in the future it's more patient game you keep more you get,1
How many times do people have to burn before they learn not to trust this guy?,-1
Green energy has been widely used for bitcoin mining according to recent reports the bitcoin miners have used their total electricity through sustainable or renewable sources for board members even better,1
Bitcoin is a lot of things now. This is the currency of the apocalypse. It's the currency of inflation it's a speculative asset.,1
given crypto which is basically deflationer and limited in supplying it makes for a terrible currency it's purpose not to be an investment but to facilitate trade currency always get value because a limited supply which means people will only sit on top of them instead of transacting with their inflation of currency in other hands intervenes people to use it for goods or investment because they actively lose value,-1
i plan to invest a small amount every month,1
