text,sen
You're all please everybody everybody to make a best decision for you over this time I've kept to this I keep this phrase of of you I keep this back to to you I keep this word of of of of of of you I keep this of of of of of of you I keep this call of of to to to to to to to to to to buy to buy to buy the dip to buy the di to buy or sell a winter winter winter pass a winter winter winter pass in winter come you nobody nobody know you know where everyone knows where the better make the best of this decision once whoever whoever whoever whoever you've made the second once whoever whoever whoever you've been of this decision of this time I keep this once i keep this once always keep this once i keep this call of this very word I keep this very back always I keep this very back always I keep this very back always I keep this very back always I keep this very back of of of of of this very back of of this very back I keep this very back sort I keep this call of this call of this call of this call of this call of this call of this call of this call of this call of this call of this call of this call of this call of this call of this call of this call of this call of this call of this call of this call to to to to to to to to to to to to to to to to to to to to to to to to to to to to to to to to to to to to to to to to to to to to to to to to to to to to buy and I buy and I buy and to to to to to to to to to to to to to to to to to to to to to to to to to to to to to to to to to to to to to to to to to to to to to to to to to to to to to to buy to buy to buy to buy to buy to buy to buy to buy to buy to buy to buy to buy to buy to buy to buy to buy to buy to buy to buy to buy to buy to buy to buy to buy to buy to buy to buy to buy to buy to buy to buy to buy to buy to buy to buy to buy to buy to buy to buy to buy to buy to buy to buy to buy to buy to buy to to buy to buy to buy to buy the to buy to buy to buy to buy to buy to buy to buy to buy to buy to buy,0
old out has repurchased netlong references checking trace statistics and comparing it to previous reactions to it we always have risen several days after will it be different this time or we need ema tests to get fully sent btc bitcoin crypto,0
The passive income here joins the bucket with my link and we'll both get the daily bitcoin crypto blockchain,1
mirbtc but you can't deny bad bitcoins for country monopoly,1
Is there a bitcoin bros wants to buy this aluminum cube? I made it in alading zero-light class as a btc shit delivery throughout the world. Including superlight still doesn't lose.,0
requires super-strong passwords to encrypt your disk but nt wants to record the password anywhere via two factors,0
good good good let the salt flow through you he,0
Imagine walking to the kiosk to buy a temporary bitcoin at the mall or returning from the work of the wazixwarrior in the crypto btc,1
bitcoin crypto el salvador buys more bitcoins as market crypto falls coindesk,1
interesting level at btc expects some bounce,1
Looks like cathie's in autosmash purchase mode at this rate. Millions worth of gbtc stock in last week's bitcoin.,1
Nepalnedscrypto day nepalneedscrypto is protesting against the government s decision to ban bitcoin and crypto that changed the world and we do nt want to be left to join us and post with hashtag nepalneedscrypto halosarkar as pun,1
houston astros vs. texas ranger bitcoin bet,0
Peterschiff there's a difference between anything and btc people control prices not income or ceo or even these countries are ideas from the beginning and most people that come in this early just believe that they won't sell even if it's going down,1
Dude's gonna pump,1
Sweet bitcoin home Fsueltolani,1
Dilanleclair at our current price beetcoin well on its way to the month price may feel very high but it's an emotional feeling nonroute y all have to follow Kathycrypt her super underrated bitcoin which has incredible tweet tips,1
I had to show this out another key figure in finding the kadena is from the statart haber which is the coinventor of blockchain technology and the author most quoted in bitcoin kaden is a different bitcoin cryptic bitcoin.,1
It's like Saturday never happened.,0
Thhere is alot of meme support at k,1
Some are watching some investments and pulling their profits while some still have doubts stop watching and start investing so you can also start pulling back the admin contacts to start getting Mrs.srebecca's bitcoin,1
i m buy crypto for a retirement plan in a few years instead of a year of crypto cro bitcoin eth link gt uni,1
btc everything is under control of btc bitcoin,1
btc usd has just been transferred from seudpnxmxxxtvaytahpwnkppv to bcqxszgszgszgszgsgqyfuwckngg tx hash bcffeeaaaeeeeeabbbbbbbbbbbbbcoin btc,0
Bitcoin is the way,1
bearish bitcoin history,0
The large book's software wallet lives just to read and display and allow you to interact with what's stored on a physical ledger device nothing is stored in a living ledger,0
btc ath good job bullsss,1
microstrategy promises to buy more btc even though the missing paper on m ownership in q bitcoinnews bitcoin,1
According to the last Canadian bank reports the Canadian part of the bitcoin owner went up sharply,1
The bitcoins we just hope to separate money from the country don't need to separate in it together is better we all profit the bitcoins and some stacking and stacking will bring wealth and welfare to an end of lack of work in the whole world ai and robot pundixlabs,1
knc short alert exchange ftx market knc usd volume price btc eth to life trade flow check,0
Watcherguer Pete if you're so sure about bitcoin going zero why don't you put up all your money and bitcoin short or mstr short let's see who wins at the end,1
We're waiting for your prediction.,0
The ledger has my voice well is a ledger that good has better documents and it's harder to screw up,0
Petermccormack this misery is what the supply of elastic money carries the damned dogooders central bank is the core tenant of human marxism too wrong to believe with this level of bitcoin power fixing money fix the world,1
rdrlfe yes friend it's called a deposit go bitcoin,1
actually bitcoin has nt been down lower for a month now and it could be a sign that the dropping trend that you mean is the level off seeing bitcoin last month,1
This week is what you feel. Something big is going to happen.,1
lsahheilpern just zoom out our early i btc crypto,1
The bitcoin metric that says bitcoin is about to go parabolic,0
And there you go. You've found the hodler's dilemma.,0
bitcoin attached to k on Easter sunday as crypto seen for lower head in short term,0
food to think crypto btc here to keep letting drown in,1
My time horizon is a year so I really do not care what price now I'm buying bitcoin,1
okk sweet i was just wondering if the launch was the same day of the release of the code or if the code was release on the day,0
What time do you use on your chart,0
where those people show that they're Republican editing nvm post history check out,0
If you sell you've just forever sold your chance to recover the losses you might have made and by selling you bring real losses as long as you maintain your position you have nt technically lost a penny it's crazy to sell on losses,0
btc transferred from unknown wallet to tx blockchain btc purse,0
More will burn until there's a million total tokens like btc and it burns all the time because it's a sign of deflationer. This is a good chance to get in and save the bought token.,1
It's written now. We bought a dip btc btc ftm ftm.,1
btc free free future signal entry btcusdt in or lack x max puts the maximum of your total in the future,0
Crypto is the last way to be a millionaire. Work hard to get a btc bnb prize.,1
appearntbtc doesn't sound like bitcoin,0
Andrewrsorkin joesquawk was just a bitcoin selfcustody thing,1
Main price action occurs within the next few hours of btc btc cryptity cryptotrading,0
proofwork is basically one cpuonevote bitcoin,0
icoincom big project big chance of ponting nelson airing kucoin btc usdt,1
but bitcoins are different,1
bitcoin eth doge will change the bank forever bitcoin doge ethereum,1
Following bitcoinnes bneth has educative bitcoin at present on k running the bull has begun its greatest risk with bitcoins has not had it at this time not having btc to feel irresponsible buying dip,1
Chinese crack means bitcoin work says crypto miner,1
The mooncarl missed that the btc level didn't lose its greatest inari opportunity to collect the last weeks of inariraffle tokenary.,0
The most beautiful kryptonite project. Thank you for sharing this wonderful opportunity. Hopefully going to the moon soon txantzin txantxin txantze xdcccde tg aabb btc bnb,1
Bull run is among our bitcoin bitlord signals,1
ladycryptonic wants to get up in any crypto or more on the weekly basis of a crypto trade feel free to send me a dm for further details btc alts,0
The court has declared bitcoins a virtual asset protected by Chinese law,1
pure gold bitcoin bitcoin better than gold,1
Only in russian billionaire Oleg Delipapaska urged the Russian bank to move to bitcoin fegnoken bind,1
nice i'm interested can you place hold it over the years i'll give you k for just that one bitcoin,1
Whether jedmccaleb only confirms joelkatz is satoshi bitcoin,0
It has less to do with intellectual laziness and more to understand how this game is played at a higher level regardless of how you feel they're good at buying bitcoins and holding it that benefit all other hodlers regardless of your reason and I benefit,1
will they shut down the economy within a week of delta andreijikh grahamstephan realmekevin jlfinancialcare paymebitcoin bitcoin,0
Coindesk canaanio aoyona Nakamotogames offers games worldwide to participate in countless games based on block chains and produce a sustainable income of Nakamotogames natc binance binance gateio,1
added to this candle to get it on top of your welcome,1
Remember that BTC tends to be a sign of things to come into the other asset class the equities still have to be far away for deflates and then there's a problem that our mortgage costs just go up suddenly you know what really means a place to hide,1
The daily bound of btc fork Median was caught capitulation wicks as far as crypto bitcoin,0
bitcoin prices alert on short-term swing high-support levels m apr pm,0
Everybody's bitcoins are missing now. We need to be more careful.,0
Anthonyavinesh said the previous btclor rose back from the reach of vital support kept up hope of life but fell recently under ema daily and ema had asserted the strong sell edges of her best time to buy and trade dip with Scotland on a telegram scott,0
What the coinbase partnership with the ice says about bitcoin surveillance news from bitcoin,0
I'll speak at the top of the bitcoin state coin.,0
You elerianm fans of your day to be bitcoiner will be one big bitcoin,1
price update in usd hour btc eth dot,0
because many traded their alts for btc once hit k,0
doing your own research but for taxes I believe you can only treat everything as fifo lyfo or whatever you see fit I dont think minutiae input uxto and output are important to irs,0
something I think contributes to the same dip in,0
We got some Jackson action.,0
the ashbit list on pancakeswap is the day bitcoin bindances smartchain bitcoinshtech,0
lol is kind of some kinda rule that you ca nt make jokes,0
It didn't happen on the weekend.,0
The very interesting thread with the question at the end quotes the harariyuval s sapiens imagine the simple example of Mr. Greed the financier setting up Mr. Stone contractors in town finishing his first job receiving cash payment for the cryptoccurrence of miles,0
reading all the predictive bitcoin prices I felt still in the hope zone it had to enter the desperate zone before it actually went back up does it mean more down hope not to let s see,0
Wood cathie investors in digital cnbc wallets with stocks and bitcoins buy will seize the role of banks,1
did you buy a dip anon bitcoin,0
Tuurdemeester of the yinry effect is why only bitcoins will survive,1
Good night fam will sleep with bitcoin up It's really more to bear k is bullish as usual I'll look in the morning to see if I can get a solid short entry in btc not opening trade before bed,1
I really don't want to either. I worry about it though unfortunately and it makes me pretty worried about our dollar. I'm glad I have my bitcoin possession.,1
bitcoin btc plan for the rest of the Sunday looking for it to tag back into middle ks possible up to k this weekend,0
Moxifloxacci spenceschiff peterschiff it wasn't track record that stood test time it was what you had done for me lately schiffty had cost the sub around in the potential profits by the gold shilling all while hitting the intelligence bitcoin did not attempt to leave behind,1
i m high af btc,1
What would you do if about a percent yes,0
hr bitcoin the price of the upgrade divergence still has a bullish divergence dating back to annov th pm st lol in the short term we'll see if the price of the pink retestence projection along with the cofluence of the reracement fib we'll see if it plays out,1
bitcoin has been done this time it will btc do it again i m wait for the final capitulation and prepare to fly to the cryptocurrancy rocket,1
The two most important rules of the bitcoin rule never sell the btc rule. You see the rules.,1
Peterschiff anyone who thinks that btc can't work because it needs to be supported by the goddassets obviously doesn't understand the principles behind crypto or the block chain and the basic bitcoin risk partner what's crazy already and people still do nt get it,1
Even a black ancalagon can melt the hands of this diamond btc,1
btc agregat inflows to copenbase pro btc,0
saylor morgannan davidfaber carlquintanilla says the power of bitcoin paradox is his weakness is super fast to liquidate again this week in the fall of ftxoffial good news is that it's reinbound fast esp when czbinance buys k btc,0
aivaras cryptodevil hang in there if you believe in btc keep an eye on a fear greed and every time it goes below buy some btc,1
btc transferred from bind to internal bindance transfer tx blockchain btc,0
well conversation i would chew that bit and educate myself and form thx opinions,0
"Yeah, that's why you have to leave your emotions in a locked box somewhere and just hodl at",1
Trezor's book hardware wallet. It's not that wallet. It's that seed recovery that gives you access to with any wallet with recovery in case the device gets damaged.,0
cointelegraph btc but nimiq has my heart nownim inspired by btc but provides an easier interface for the user,0
can we reach for one bitcoin tonight,0
coinsdesk starbucks xpolygon jamiecd eth look ready for bounce well in a few days that will come while above the low k and bitcoin above k I believe while we hold this we'll go to k immediately check out and follow keshglover you'll surely learn a lot of these geniuses with his guidelines,1
recycling and producing crypto for a better world entering the recycling race and winning money with prize worth wings in the kreb transforms carbon kreb bitcoin,1
Randomly reading wikipedia s summary dotcom bubble and in the burst part bubble there's an entry about microstrategi ya mstr equally publishing debt to invest in btc announcing restoration rev because aggressive accounting practices are not just sharing,0
what you meet a guy to buy a rocking chair with bitcoin,0
btcusdt by the profitstation trading bitcoin through,0
el salvador s bitcoin plays what the current decline means to adopt elsalvador,0
Big bearocracic iron hands that look out for little people.,0
I'm excited about the bitcoin event in Scotland following jimduffy and bitcoinconfuk,1
Bustarhymes jack elonmust cathiedwood You just need bitcoin eth is a scam man,1
Can't wait for tesla to dump tomorrow,1
btc hoping everyone is good dca is a good way to not stress the price graph is just a million,1
I got a bitcoin cake for my birthday btc lightningnetwork,1
well it doesn't gon na ends well for you if you break this rule,0
Yep. Like I always say this is a reduced currency. We go back to talking about not the next version of the iPad lol.,1
Short pants are just trading drops and cleaning up now for shorts It really doesn't make any difference if they trade range or range,0
Depends on how fast you want to open it because it's a transaction you place and you put a charge on it it it can open one channel to the main center if you do that you just have to pay a transaction fee high enough to get it confirmed once and pay through it until the channel closes the rules to me but the big rule is that you'll generally close it once you're committed to all the lightning networks through that channel,0
brb threw away my economic textbook,0
corp investment rothschild buy more bitcoin why don't you,1
Breaking news chips chipotle now accepting bitcoin ethereum and other cryptocurrency as form of payage bullish,1
how oxc demo through youtube libonomi interoperable bitcoin,0
the cryptto market at sight of all values vs bitcoin btc ethereum eth bnb xrp sol luna exist and many more,0
ilovejaneadams gmdavisphotogr rcnitrotropical ill repeat my question i don't understand how our government buying trillions of bitcoins will help the average American can you explain why you think it would be,0
Poor people think rich people online make money not using your phone just for social networks looking for bitcoins to change your life.,1
The spy consolidated in the direction of the ath reminds me of certain btcs that did exactly the same thing last week more evidence to suggest a drop of volatile btc shift in the spy and btc from being upside down corroding to moving in the same direction,1
Looks like we'll be swimming around y'all as long as the next pullback is healthy.,0
Good morning. Let's stay positive.,1
No price needs boiling sometimes before coming to the boil,0
bitcoin approach resistance violates this will mean section k test needs to hold k to continue the local uptrend. I think we've seen the btc down,0
See this is what the euro would have been if they had any sense not always bitcoin but one currency was accepted as a legal tender across the block other than national currency hoping it worked for South America could do wonders for their trade etc. with each other and tourism etc.,1
Aluner triiliond skwp if I could make a wish it would be for self-powering through swabeitcoin and celleducation about btc i looking for no contribution to follow controversy or influence i m just pleb ty skwp that took out of the day to never see the case edge to make me,1
for btc customer forecast has given a short exit and retreated to a long signal at the minute frame on this resulting in loss at the previous short position of per coin,-1
Margin loans have multiple effects but once assets and obligations are neutralized supply is what the chain says yes bitcoin is possible and will be used for the backup system fragment over the network itself holding the basic money only,1
Recently human history is full of disasters caused by the state control sheeple wakes up if you're stuck in the present with the thought linear you ca nt see the forest for the humanitarian tree yet broken bitcoin free is an escape valve that promises hope,1
What percentage of your current investment portfolio is allocated in bitcoin,0
bitcoin btc bull divs on h I open small target area length around k,0
Are you a witch?,0
I have a transaction getting confirmed when they belong in the mine block unless you go back to talking about past confirmation first but every transaction must be included in the mine block,0
Imsogame repeats after me btc cannot possibly be considered security under any circumstances ever,-1
According to the glassnode of millions of incredible bitcoins sitting in a position of loss is not real now,-1
You go back to asking questions our stupid ass nt able to track shit but no shit or dudes who rule that shit what you ask about called blockchain analysis no dude named willy woo he's a young dude named William clemente iii dude also analyzes that dude through a database called glassesnode looking for twitter they all did track coins that how they went to investment woo willy had done some incredible interview was a bitcoin with Peter mccormack,0
bitcoin eth what do you think about two cats,0
btc now in,0
btc derivs sheet tweet every cme min pending min gs delayed min and oi shares out,0
It's the haha way. It's certainly best for mental health and long-term finance.,0
"Hi, do you believe bitcoins will give you financial freedom?",0
bitcoin ethereum tron xrp looted in exchange for a large cryptto hack the ethereum bitcoin through,-1
The cost reduction per storage unit is already outpacing the growth of the bitcoin block chain so that too large it will never occur storage instead of the main bottleneck here it's bandwidth and computing costs when synchronized chains from early esp on the weaker device like raspberry or similar,0
How could someone suggest you to invest in bitcoin now crypto investors today?,-1
Bitcoin strikes h ema again. It's been rejected from ema. It's since we hit it close above.,0
The letter I published in bitcoinmagazine taught my daughter about bitcoin,1
bitcoins always go down during superbowl getting ready to pick up some cheap coins,-1
bitcoin seems surprising rn,-1
transaction reported jst gmo coin close buy btcjpy jpy bitcoin,0
Lisaabramowicz bitcoin fixed this,1
bitcoins are the only assets that deflationer precious metals,1
Alxberman wow man deep one thing wrong with bitcoin the bitcoin is bitcoin,1
There may be nothing but a thread roll on a businessman exploring the value of creation along a full bitcoin potential bitcoin as a monetary wall jeffboodeist saifedean perbylukphyecon bobmumjluther stephanlivera,0
btc destroyed anth today billions still don't have the proper chain block and crypto knowledge survived to all that had to be new to our crypto here to educate millions of courses at one time,1
bitcoin wont hold k this time,-1
Mikejvoorhees jimmyjacked the americannhodl it is bitcoin trading history partner nothing is really new I want to remind us under the march k and now we're trading k this is how absurd it gets to talk to some people,0
The annual bitcoin candle will turn red,-1
The central eastern block chain of the crypto oasis ecosystem is expected to reach organization s target by q btc kryptews nft,1
Many bitcoin lil bita doge ethereum,0
deitone the bitcoin bully is playing out right now i m happy to be in a long right here big resistance up at k though btcct is a super underrated bitcoiner i've been following her tweets and tips really i've been doing really great follow her great,1
"Can you give me a reason to be adopted? Even if it's a currency, then I want to hear how it's going to get stable enough to use it.",0
do janet yegen dump his bitcoins,0
Borttinthewoods because for them prices seemed to be high crazy My answer was they hated it because unit bias and mind covered road leads to shitcoinnery and time short profit fiat preference otherwise you could have made twitter account read standard bitcoin sitting,-1
ilmealim why btc dropped the bindepk,-1
Bobbyclee but I never bought another bitcoin or sold new bitcoin accumulated,0
Isahheilpern was right. The Chinese communist Party did a little help and they didn't know it.,1
Yop just sit back and start working on you You think you have it rough back in my day story,0
Not all but many who treat bitcoins like half the gods you do that even though you stop asking delusional questions of grandeur kicking as soon as the price stops riding a real psychosis start,-1
btc price changes h bitcoin btc,0
some not all too you have friends or brothers here s go buy me in bitcoin there more where that came from,0
Bitcoins are still considered experiments. There may be fatal defects found in code that could actually destroy it. Nothing was found as far as bitcoin.,1
titan banking jpmorgan recommends avoiding btc bitcoins between high risk recession reports crypteers bitcoin,-1
cryptoichnl do you still think we see bitcoin at used at some point,0
What all the backpackers models are going to do now is get a real job eth btc,0
So basically bitcoins are enjoying a bitcoin ride.,1
don't trust verify bitcoin nayibbebele,0
Checkout flyover update chain riot mw bitcoin mining facilities at rockdale texas bitcoin texas construction esmetron through youtube,0
"Look on the bright side. You may be a bitcoin degenerate gambler, but at least you're back. Not a degenerate dogecoin gambler.",-1
urobro bitcoin volatility index ready for another big step next week could be the beginning of a new price trend keeping your eye on that bitcoin kycee is super underrated bitcoiner i've been taking his tweet seriously I've done great following his kycee,0
Pretty good bounce on the btc btc daily,1
skipping the Paris block week conference here is the key takeover of the coinstelegraph blockchain bitcoin event,0
fossgfosssss msm treat btc as the equities apply the same metrics that are not applied,0
never shared your seed words with anyone ever,0
I sense things better move in positive direction bitcoin btc,1
btc will k before b c retracement brings on alts,0
Saifedean had just finished your first lecture at the academy of saylor iM in an entirely different field and yet found content that was deeply digested would have continued bitcoin,1
at a lower time frame sweeps lower recently before moving was btc possible,0
Best website for reading live crypto news.,0
Breaking only in bitcoins keep not giving fuck,1
wsbchairman if you yourself dogecoin press follow echoforpresident Eastmankodak kodk,0
evil we may have approached that party over the moment when everyone realized there was no value in matters other than to make tons of original creators of btcusd bitcoin money,-1
