text,sen
The cost on coinbase is ridiculously high. I tell people with commercial accounts to transfer to gdax and pull there for free who ponder the question if they can do it for free on gdax why they do it for free on coinsbase.,0
"Oh, look. I was right about today. Bitcoin.",0
btc buys pressure prices alert trade around bitcoin crypto btc,0
Usually yes is basically as safe as any hot wallet if you do it right with the watchtower etc,0
Michael told me to buy bitcoins for el salvador to buy bitcoins for lon musk bought bitcoins because they're not smart whales and you don't want to follow them we follow people who buy under the market,0
Feels like a quick axis coming btc,0
altcryptocom takes a look at sani with extreme burn a number of lp tokens and most importantly with long-term vision picking sani and continuing to profit more in the future of bitcoin satin,0
Got all the parts for the full bitcoin point. I'm just waiting on the case of the cryptocloaks. Interesting times.,0
bitcoin price zones have just been detected will descend to open all btc detection zones join our telegram group if your trial period in the group has ended predicting no,0
position length taken on dydx of pump it btc btc,0
Everything is human behavior and for everything that's happened I think this is a very good time to get in safe and slowly there's no metista sovrynbtc btc eth graph not to say it yet but they reflect things a little bit slower,1
The alt coin you bought for the let's start the cryptic bitcoin discussion,0
binance recovers m in funds connected to the ronin bridge exploit btc kryptonites nft,0
Brice harper rocks fillies big front chain filiesbves game mlb bitcoin sportsbooks,0
♪ Like sweet this is going to drop my dca ♪,1
Shanethazel tomerstrolight will regain its power moving in the direction k has begun but there are some important things to consider k soon expect k btcanne is a super underrated specialist who has great insight ta ta c has taken them seriously following him,1
People will whine that they don't buy more.,1
inflation is one of those things that everyone sees no matter how hard the stand tries to hide it this tip about eating potatoes for cheap nutrients right now is one of the posts up on Reddit here's real life props if you don't have your bitcoin rengmi,1
btc d back on the trendline of July,0
recent btc info block blocks store transactions for total bitcoins including gift block size,0
Bitcoins are better used as peers for peers It works better that way but it has a lot of cost now,1
bart back bitcoin crypto btc,0
Coal oil companies and gas companies have received tn from banks since the Paris climate deal in but the bitcoin mining is a big problem hmkaay neutral sentiment the world's largest bank has shorted,0
The scarcity on the Internet is the one time that discovery can't be repeated because resistance to replication is the discovery of the knut svanholm.,0
come out of btc's long scalp with microscopic advantages two axes refusing to push up and equally low may return once they get swept,0
bitcoin ecash is the continuation of the bitcoin cash project and continues to be developed by bitcoin abc ecash income protocol reinvested into the ecash fund allocated each year by the Gnc network board,0
Twitter s btc plans action against coinsbase oversubscripted nfts more Crypto btc news,0
I had a limit buy at cash app for buying some bitcoin at and it went through,0
I'm so fucking confused with where this is gonna btc.,0
wojespn amschefter btc invested with cryptysophia today and watched your life spin start getting admin daily contacts through a cryptysophia telegram,1
Apompliano volcanonia supply of millions burned and distributes the remaining millions for the circulation of wallets as well as millions and around big projects joking coming one of them is the crypto league starting this month. Do you think zenkin will do vlk mdtust btc,0
At squawkc scaramucci says btc will hit k this year we like it we have more than half a billion bits,1
Bitcoin converting planet Earth is not a particular part,1
Your question assumes there's only one crypto btc just current market leader and has a recognition that names can excel technology pass by perhaps not in the future but perhaps at some point it's usually superior technology wins out.,1
only away from btc ath,1
Between possible and possible shiba Inu see a sudden surge in popularity increase prices from around to high all the time according to the data coinmarketcap through the week news cryptocurrency investment of the smart bitcoin,1
Bitcoins and crypto become more useful day after day hopefully the video drops for you tonight,1
is k axis below this is us in the clear now it's not news driven dip,0
see graph can finish only below impossible,0
The shhhh cash application is the less-know-what king.,0
I'll find a lambo under the bridge.,0
If it's ai nt broke don't fix it bitcoin,1
Bitcoins are masters in teaching us patience,1
Damn the last few minutes are better than TV's for sure,0
i'm finally able to pull the trigger on the investment i was going to do it last month when it was about k regardless i could finally invest after so long i'm not sure i wasn't sure where i had to go to do the deal i was going to do the first time i was going to do the combo because it seemed easy but now people are telling me to use gdax then when i opened this thread some guy said he transferred from gdax to the gate i never even heard that i never even heard that now i was just asking for the advice it was okay to use the cb if i wasn't really in bc like mc and now people are constantly changing my metal money and constantly making profit even i'm asking you to make good advice to use it if i'm not really using it in all the c-c like the day and i'm constantly changing the money i'm not making the day,0
jeevsthecurious now i m in love btc has a limited supply can be owned by anybody in any number using a cell phone or internet connection is totally safely can not be controlled by any government can not be hacked,1
Indian payment on a high salary could offer a bitcoin service if the government made a legal crypto say cfo via coinsjupiter,1
ha ha ha you're stuck in time come join us in it s year messed up but really you have to chase up with the rest of us doing it step out and get on real time where bitcoin s tech is all it needs to function as investment investors against inflation join us where we know that most of all bitcoin transactions buy and sell as currency investment can be very good using a pretty many people's own bc investment but there's a lot of time to develop the demand for long-growing money to take a long time and there's a big development in the past,1
Again the whole world isn't spinning around usa so it's impossible for this news to affect the whole world and their crypto,0
i moved every holding off of coinbase anyways just wanted to know if anyone else had a problem connecting,0
I think it's a very smart idea to give the company power over your country sarcasm currency let them print what money could possibly go bitcoin wrong tether,1
and how morning you start crypto btc,0
If I had to speculate the need to use bitcoinning for the remittances part is that it makes the entire business model of algos trade you mention it's a victory for him and a victory for the user plus that proves that lightning can scale this is genius,1
breakout in bitcoin to new all time highs for index btcusd by trader btcusd,1
whales going after those longs already lol btc bitcoin,0
"fontcolor="" # FFFF00""Suscanicola ryanvieira hodlberry thorchain fontcolor="" # FFFF00""toowhatifI saythereisself paying a loan on bitcoin without liquidation risk",1
The countries are paying the bitcoin that's something new,0
My personal predictions for the bitcoin the next day we had a lot of volatility because the cpi data almost million dollars got liquidated we get strong support every time between k that shows bullish for me ta btc crypto btc me,1
Monday august as at least must moscow time a we can supply as much as btc at realtime block chain price of us worth of coins for each of us b we can buy as us worth of btc at realtime block chain price source source minus service fee,0
Incryptopverse so that which really trades bitcoin with high leverage and is too excited to just move up on three days after the fall,0
thursday has been suspected of volatile days after the data inflation released bitcoin went down to k the lowest price rate since September St. However as the merchant was in the middle of stopping the bleeding btc sp quickly recovered,0
It's good enough that the people of the nation don't understand us banking and the monetary system for if they do I believe there will be a revolution before tomorrow morning Henry ford bitcoin,1
microstrategy puts another m in bitcoind even price crashing below k via descriptingmedia bitcoin microstrategy cryptocurncy,1
It now holds millions of btc and ether after the latest bitcoin bitcoinnews purchase,1
Of course lol mister Nostradamus we're back still to billions,1
If we get dumped now it'll be the most demolized bitcoin event the good thing there's a surprise supply,1
Everybody quiet bitcoin did this before and then reaching new heights people act like it's ever dipped and recovered before all investments should be treated as their investment if you're looking for a quick pump and dump ya done goofed probably also hodl now,0
link purchases to blockchaincom explorers,0
I remember being in college researching how to buy the bitcoin. It was about the coin. I was afraid of losing it.,0
Sometimes when the time or trade doesn't go the way you nt best to sit back and relax her not like the cartel will hang you if they dont get their fiat tomorrow enjoy your hodlidays and let the long buy that swim take care of the rest,1
Thanks for the support of the people not taking any risk I can't lose so I don't really care about hodling for long-term cheerers,1
My favorite zbdplay for sure bitcoin integration i'm waiting for more sartobi is the best for meplevor zbdgg,1
There's this cryptocurrency send a monthly bulletin since and say we'll release the mobile application in the coming week bitcoin btc,0
bitcoins on early rise this morning long term we see there's only one way bitcoin prices will be and that's over if you also feel this way get ready for us and come bitcoin jersey launch so you can also wear orange bitcoins with pride and btc spirit,1
The next mayor of New Yorks wants to be paid in new York btc crypto.,1
The big names of the big projects buy trilly to make mcontent bitcoin milly documentaries el salvador vs. world banks drops in September where s all the safemoons and dogearmy peeps they know how to go,1
Stock market people tend to think the bitcoin is high now wait until k by October k by the end of this year's price year from now I can't wait for bitcoin following tweets jorgevr posts and predictions I've added massively to holding it's awesome,1
People believe that the btc mine is and will always destroy our planet but that doesn't have to remain that way hydrowhalesclub uses renewable energy for me to make very rich holders and store planets at the same time,1
Or it's supposed to be three digits. People tend to talk about their position and strengthen especially around this part.,0
"Yes, very unusual. Support is not enough today to start running. Let's hope it starts soon.",0
btc has led in the process of accelerating the realization of the mirror reflection of the sky on earth in perception. That's why I'm a btc evangelizer.,1
day bitcoin h converts usd down to undefined with prices down to btc bitcoin,0
Can someone explain to me why banks make payments on weekends? It's not like people do it manually. Bitcoin fix carl b inn.,1
that one small step to exchange one giant leap for the crypto community brewed for the market where usdt allowed society less special to join the market bitcoin cafe swapfinance can take the failure of any of our innovations and change it for your success,1
Money printing doesn't look like it's a bitcoin ending,0
new bitcoin report filed a tech entity digihost inc name registration statement frb ex filed report for form,0
i'm not sure I bought gbtc in my roth account through loyalty,0
Most of them have btc as their trade partner so it's not crazy.,0
I believe this project is powerful and beneficial because the team has made extraordinary efforts and great progress to make it the best minute of btc crypto,1
bitcoin the last available btc supply count yy reached only one high month btc months earlier high btc observed on the metric view of june view,0
bybitofficial s wsot begins June th am utc still time to register and join the teelstreet team bitcoin bybit wsot,0
The helin beauty that's nt ready I have a feeling that bitcoin is going down as one of the greatest innovations of st century eyes still on sys balls will change the cause of history,1
It's just abc correction of btc bitcoin wave bitcoin,0
Welcome to the full btc trip to bitam btcused by voxhit bitcoin btc,0
bk back to blackcoinorg for the update of another chart the last few days has shown some interesting developments in volumes greater increase in prices and coming out of long-term channels has put this crypto on positive accumulated course btc,1
bitcoin and ethereum are trading a little bit below their new alltime high funding levels and future premiums are in positive areas but not nearly as hot as before can crash btc ethbtc sol dot atoms ltc,0
Bitcoin is Christmas,1
Mikefred with celsius filed a chapter of bankruptcy hope the regulator won't use this opportunity for bash bitcoin but quickly track down laws to prevent bad actors like mashinsky from using customer funds to gamble,0
The gold market stamp t bitcoin stamp market b progress bitcoin exceeds gold,0
So much learning. I enjoy continuing to study that goes along with bitcoin.,1
This is what I've been saying she could be one of them in or whatever the number is a pretty flexible person,0
c mon big tuna lets go,1
Be careful. Every night wearing jpy up gold up useyear up produces bitcoin dn riskoff all over the board. Don't buy the future.,0
The miller was a bitcoin bull long ago and had said he had started buying coins at investor Bill Miller on a bitcoin crypto is a digital gold Andube btc btc,1
exactly people talk about whaling attacks think that people with a lot of money invested in crypto their lives play mind games against ocean joe doe people invest in money they want to make a period of money,0
has e-mailed me if the place gets received gbtc gaps up overnight some,0
long skl entry price stop loss link in bio tz btc bitcoin skl,0
in this episode of the bitcoin podcast host cknarks sit with famous bitcoin twitter personality and trolludierthemer to discuss why faithful hardcore bitcoins shouldn't be so worried about altcoins,0
bitcoin block bytes transaction btc reward for further information visit,0
target for btc s h chart at present when the price of btc s holds broken from the trend it's positioned according to technically to climb to this target and this may still be the early stage bitcoin can go,1
More than profit and volume m in the sky pumps by the most powerful megap pump in the history of bindance,1
i think it will start running next year,1
Can you explain to the seed of a protected recovery password what your method of protection is and where you keep it seems like a weak link to me?,0
What if it's a trap you sell in k and then go to k in a night I don't think you should put all your money in it just saves a small reserve in case of a big accident to buy some fresh coins of course if you can sell it right before the accident it's time to open champagne but in the long run bitcoin always wins,1
bitcoin btc prices currently gbp do you enjoy reading my blog you can tip me at bcqtuzhlxueatrrhajm,0
"fontcolor="" # FFFF00""ars satoshisnow fontcolor="" # FFFF00""S Ashshiis fontcolor="" # FFFF00""is now fontcolor="" # FFFF00""arsnowbitcoin",0
gm and welcome anon btc,0
pricedinbtc is because bitcoin is free.,1
It looks like dip everybody's talking about,0
fschaefler btc shib king,1
when btc is miles per who cares what you buy it in,1
never sell only hodl,1
front page of Barron s on bitcoin october,0
bitcoin week altrank down to at price until btc bitcoin lunarshare brush,0
It's fun to watch bitcoin.,0
btc to moon,1
whales that accumulate ape ftx sand links ftx as a bullish sentiment hits the market crypto bitcoin bitcoin,1
I'd worry about it if it happened not before,0
The broker encourages uk clients to trade with foreign companies fca regulators has taken action against some brokers such as reading more crypticrency bitcoin forex,0
Google has released a new crypto search feature that synchronizes eth the balance wallet address of the etherscan but why not start with bitcoin eth,0
Just like the new kid in Revolut Tho had coinsbase and Kraken ready,0
The secret with bitcoin is to have patience buying consistently through once a week or once a month but having a stick plan with it doesn't overthink your long-term purpose bitcoin,1
"Because tissue growth continues to rise at the fastest rate in history, a number of long-term catalysts can reinforce tissue effects that form and actually carry bitcoin for billions of people bitcoin lightningwork.",1
Peterschiff Michaelsaylor bitcoin This is a new renaissance through youtube bitcoin is o,1
oof very well bounce directly from the btc telegram channels melati crypto premium et bravo,1
Messari ceo ryan selkies on the stablecoins bitcoins and crypto rules live news bitcoin cryptocurrency media,0
bitcoin statistics pool tx in the last minute means median max th tatant nobs block high,0
Check out my items list in open ocean via Opensea bitcoin,0
johalmiles btc ceo confirms that,0
why the ugly wick is hard to leave,0
ralf glabischnig di crypto valley and crypto oasis btc kryptews nft,0
You're going to want to give this one an energy crisis errenlepard knocked out of the park. We're covering the entire host macro topic of potential recession recessions currancy energy crisis european and much more. Let's know what you're thinking.,0
ps notes that I've added two columns that I thought would be useful and the day rolling changes I also added the volume of the third day column of ca nt really explained in tweets but I think this new data will give valuable insights go btc,1
How much will we see first for bitcoins?,0
The airdropdet is amazing and great projects. I hope this project will succeed in letting s join and support people aagameruga ariantoko glenkperhana airdrops better digital bitcoin.,1
Realvision raoulgmi maggielake may I ask you the wrong question what correction in bitcoin means to market dow nasdaq equity,0
market impact Haithamalghais in an address before the transfer of energy g meeting ministeral in the returning bitcoin,0
Our analytic team has done detailed analysis of btc and its fear and greed neutral index at this point at the price of usd so what do you think about the country's bitcoin today?,0
Cash is trackable nt and many countries will still allow it to be slow bitcoin adoption or even increase interest regardless there will be an effective way to prevent all bitcoin exchanges can slow down maybe but will not stop will actually benefit the government in the long run to adopt and adapt,0
What a btc quote we've been waiting for bottoming,0
debugc i m is still long in btc which is more recommended than short by determining to be rich by holding and gathering more cvp which is also altcoin for long-term investment and currently one of the hidden and productive gems in space,0
Watcherguer clementei only one decentralized bitcoin protocol,0
nftholding btc darrenpromoter is consolidating around K bearish momentum levels tiringly higher in the short term that it is possible to achieve liquidity between k and k is the possibility that y all follow the gimcaden he is the underrated bitcoiner tip his tweet has helped,0
And from you crypto nerds know you can farm bitcoins in tarkov,1
btc btc k support,0
same joncomm for btc,0
bitcoin status every block hashrate ehs last price cost of fast-sit-sit-sit-sit-sit-sit-sit-sit-sit-tex unconfirmed diff changes in the next block on blocks in blocks,0
bitcoin summary cost of pooling in seconds means the median max th measures the height of the feevb interval block,0
Next year is gon na be amazing,1
Stop thinking about how you can make more trade money buy dips or sell serious highs forget about it you wouldn't draw that from consistently sometimes you can make most of the time you wo nt in a long term like this you'll lose bitcoins like almost all people you might still make money your losses compensated by uptrend just not as much as hobling will at this point and seriously in two or four you'll make a profit in the near future you'll make it at extreme times and even if you can't sell more time and even if you can sell more if you can't believe that I can still sell that I can get to get you to gain in two or three weeks or three weeks or you'll make profits in the near profit and yes you can even get a lot more time if you can actually sell more time,1
don't worry about it look at the bigger picture k will be seen as low in ten years of time so you have the age to keep dca post this only a few hundred dollars increase at the end of the day and nothing close to what we return projected,1
"Buying bitcoins is about more than just getting rich about dismantling the country's primary control mechanism, controlling fiat money, getting rich, just having a positive side by choosing freedom and peaceful money over the money license.",1
There's an update checkout link in the bio for a cryptto doge signal ocean btc omg xrp dogecoin cardano enj tomo sxp sol bitcoin,0
princeov people think the bitcoin is high now wait till s k at the end of this month k by the end of this year y all have to follow abtc he's a super underestimated bitcoin i've been following his tweets and a serious tip i've been doing a really big btc,1
just wait till the full moon then you'll see,1
"Cryptoednl tends to agree, but the rational btc seller will be selling large volumes to our weekends. No.",0
Fair can happen but one would think shorts would pile up on more things they had but that didn't have to happen to be a long squeeze,0
bitcoins are getting closer to the fib area all look bulish but this is the key obstacle for hitpass see the btc behavior,1
Keeps accumulated lurking keep hoddling keep building the bitcoin shib torg dfi no xrp bnb eth,1
In that year wo nt care if you branch bitcoins in or the most important thing is that you buy now with bank transfers and credit cards or apple salary and Google pays,1
bitcoin block bytes transaction btc reward for further information visit,0
yellow iicoffendii first day out bitcoin,1
The bitcoin ethereum is trying hard to stay above kk This week red came in again jumping to beg for feet here so that we can finally be really too expensive mind on btceth dropping the bellows this week,0
For anyone with an empty drypowder can't take advantage of a sub k bitcoin rn breathing it's okay dca today is worth the same as dca when bitcoin's back in k and we're re loooking the way from there if you ca ntd save for future dca,1
everyday purchases on the strike app have been mine since I started December th,1
Get out of here. No. No.,0
fasb settled on fairvalue accounting to measure the bitcoin crypto asset,0
Incryptoverse agreed. It's time for bitcoins to strengthen. There's no reason not to collect now.,1
Bitcoins of any size are still beauty drifth clearing and company during the last month can still drop b,1
bid bag for crawlfordporter fight set for sept bitcoin sportsbook,0
btc derivs sheet tweet every cme min pending min gs delayed min and oi shares out,0
This iyiprophyil is all going to fly soon but we need to see alternative hard forks like bitcoinlaum aim to bring better green and cheaper btc i actually believe that forks can keep fixing on the work of satoshi s,1
If you actually understood the bitcoin you would never bet against that bitcoin if you were trading that day pay everyone but had to follow Ray he's super bitcoiner underrated bitcoiner i'd been doing great,1
btc h changed price instead of a btc bitcoin stonks,0
really love an advance app looking for ui and recommending to all my colleagues uk bitcoiners stackins btc,1
"fontcolor="" # FFFF00""maketoolloadafagmi fontcolor="" # FFFF00""adamusblockstreamtalkfuellow fontcolor="" # FFFF00""how quicklyforgetthis isaboutmoney fontcolor="" # FFFF00""tech fontcolor="" # FFFF00""onlythe bigbookkeepsscoinsong bitcoin solve matters fontcolor="" # FFFF00""fairsorthesoundof money in linear manners istheonlywaybecausethegreatbook is everythingelseinlay",1
Buy a dip is a nice way to average you buy a price down it makes your bitcoins cheaper overall,1
just got more btc and eth to calm down fomo shhhhhhh k shhhh,0
nftworld news that would be great i think proof of randomness will be another protocol that will be very admired in blockchain technology as its popular rising,1
lonmusk btc mtn money makes us rich medical chain makes us millionaires,1
