text,sen
hattankhalifah hi liquidated around dollar please help to recover transfer trading usdt portfolio really need tzadfwmwdwpfyxfqhqdyjelkmbye trc Bitcoin btc eth,0
nobsideers danheld total asset world approximately trillion according to asking Bitcoin best store value all currently existence Bitcoin easily address much,1
bossgiveawayz bubbatoken donawaywhale altcryptogems cryptopoorboy banggarr bombshillers token boom recommended crypto friend don't think going docleiy luckmanno blackkalonk bcqwdeazrkhdasqqcdnvjzzygauyscrr btc,1
altsaison shocked kick remembering bullrun could close eyes throwing darts choice alt would give wild profits well arrived altsaison btc dca,1
bitcoinfreak saivamaguru strategy failed launch token app toued best app failed miserably crashing failure strategy btc know failure time strategy intentionally,-1
infirmedogecoin thecryptolark yea paid doge there shiba inu ski cant buy doge without buying large variety of doge food doge bitcoin,-1
fiyi bitcoin closer bottom case wondering bitcoin regardless of the obvious economic climate as u has never experienced fundamental bitcoin changed btc btc,0
oslttraderview April Bitcoin in development triangle model pullback coincides fiscal day u ttt flip busd become rd greater stablecoin find today edition,0
Bitcoin way current system unfair exclusion tend prey weak disfranchised let corruption davos crowd walk free alex gladstein Bitcoin btc citation,1
good night family go bed Bitcoin absolutely bear k bulls never watch morning see getting solid short entry btc opening business bed,1
btc pair macd cross daily pair act co dcr mana nkn rcn xvg zil state macd cross bulls btc sign of Binance,1
lots of fun thank everyone crypto wisdom built year experienced trader pressed time session Bitcoin cryptobanter cryptotrading sheldonsniper fibonaccli cryptobanter cryptomanran mammasniper,1
coinbase used coinbase pro bitstamp buy cna check calculator cointaxwtf even say short long-term gain sale pile see page example,0
issue discussion environment macro current win yield Bitcoin find problem useful consider social sharing shipping medium someone thinking might interest Bitcoin,0
thought overcome established institution accomplished any difficult task moral imperative destroy tyranny make world better place child bitcoin fix thing,1
ercwl ercwl contrary to ethereum bitcoin company employee fire contractor bitcoin maxi people believe money its concentrated fixation real problem enjoy distraction,1
dogecoin a faster cheapest crypto fresh crypto want to send money friend American india westernunion take day send dogecoin cent max minute,1
Cameron reference look elsalvador btc part country important citizen daniagonzalz nayibbukele true leader people excited people see government actually citizen worker,1
hey joined network called surveyj earned today get paid survey social publication average sign instant link registration bonus surveyj cashapp bitcoin,1
bojidarkostov despite pullback long enough still confident Bitcoin see another high year however everyone follow ethb tweet prediction hold firmly follow,1
yes certainly courageous browser search engine ive makes change stake bat win dividend Bitcoin axionnetwork ask made family member switch brave,1
Last summer accident a person built huge position short bitfinex could come back position short bitfinex increased today good luck guy,1
Bitcoin golden rule never sells fear minimum hodl year plan hodl decade ignore price volatility pile bear market always build conviction,1
biden expert believe temporary inflation two weeks stop spread said expert similar long temporary previous together say year Bitcoin help fix,1
ive planned take btc celsius involved taking can get a good reading risk gains btc seems as good way to win still hold,1
a crypto investment convinced anything ponzi schema see utility currency does not think big question posing useful feature support current price,-1
transfer portfolio transfer other exchange want trade buy locally obene premium trade polo bitstamp bitmex youre australia use salonofsatoshi pay invoice,0
odell adamisapleb thats might want to reconsider wanting to bitcoin public ultimate test integrity greed pride ego might become problem low key remain humble,0
trial process great week go barry said great week crashing real estate company China default nest waiting see spot etf accepted Bitcoin,0
Tmobile breach includes name phone number physical address also sensitive data as ssn driver's license information imei number info sold bitcoin tmus,-1
cashapp jackdorsey bitcoin world largest podcaster joe rogan accepts bitcoin payment joe rogan world successful podcaster actor accepted bitcoin shared payment financially,1
Continuous Network Growth Overvoltage Rhythm Historical Fastest Number Short Term Catalyst Could Solidify Network Effect Formed Really Bring Bitcoin Billion People Bitcoin Lightningnetwork,1
find path trace let know sent first given address node never shown anywhere several confirmation im versed im well versed bitcoin wallet,0
jtsglobal utodayen indiainbrazil indiainbrazil apompliiano brazilbrian brodienbcs ukinbrazil amazing big country jack would be bad thing to become third country make official bitcoin btc,1
Bitcoin price Canadian dollar btc xbt btcad btc price cad avg last hour avg hour h change h low h high information,0
usd elsalvador bitcoindy obtained sat usd btc usd sat ven oct cdt btc usd sat tue sep cdt bitcoin,0
erossiniuk despite pullback long enough still confident Bitcoin see another high soon year but everyone follow sotbc tweet prediction hold firmly follow,1
hour update cryptomarket score btc score alt v btc score alt v market cap t btc dom eth btc,0
project built good development open long term opportunity each user also development project fasti cru success future astex bitcoin defi hariom sumitk jaising,1
yes could fix the statement although under worse analysis except bitcoin analysis real value crypto currency people so love matter a lot of percentage get,1
cryptotowneu project implemented professionally clear development plan created professional experienced team no doubt better project itsmaryan mahaburtech topondy bos airdrop Bitcoin,1
see quickly deflationary market wealth hunting down back they are always back to continue trying people to buy without someone holding crash bag market,-1
right lol like anyone following the price forecast last month could make a lot of money idk angry people especially go curse next moon,0
Bitcoin mines containers shipped through the united state take the vented methane atmosphere recycle Bitcoin mining industry remote travel gas vented location,1
last chance bull btc resistance k highlighted mar st failed break k time could break k upcoming level bitcoin btc crypt,0
airdropfather project bright future really think perfect project true cool project innovative future belongs project mizimaruf munna ahsankabirsanto ummenipa airdrop airdrop Bitcoin,1
Bitcoin ethereum try to stay hard kk red weekend week entering leg to beg finally completely oversold thought btceth fall breath k week,0
movement offers income streams earn simply display sharing as social used average sell the rental item market win job support Bitcoin platform keyboardrevolutionaries,1
Search New Concert Work A Hottest Company Bitcoin Impervieuxai Hiring Senior Frontend Backend Engineer Apply Today Build Waterproof Browser pp Internet Standard,0
Bitcoin advantage besides merchant processor exist help merchant processing transaction convert Bitcoins fiat deposit currency funds directly merchant daily bank account Bitcoin,1
all human behavior happens to think excellent moment enter into security slowly avid metisdao sovrynbtc btc Graphic Eth still to say reflect the little slower thing,1
Immediate cashing of every penny red soon makes it fully repay the victim enough losing confidence trusts enough wants to lose confidence,-1
michael saylor bought Bitcoin el salvador bought Bitcoin elon mu bought Bitcoin smart whale only want to follow a market purchased background,0
vibraniumvbn project bright future really think perfect project true cool project innovative future belongs project mizimaruf munna ahsankabirsanto ummenipa airdrop airdrop Bitcoin,1
all bitcoin July e interior work fed revealed failure daily mayorad mcguiness money laundering same exam raw lawyer sponsor cryptocloaks host bitvolt coinicarus,0
anyone travel experience app support seems non-existent maybe overloaded free btc donaway know want to keep active take the same week hear email support,-1
simuliu variety despite drop Bitcoin increase always win by bitcoin mining time sale time invest contact abrantesrene invest coin earned investment,1
mikejvoorhees jimmyjacked theamericanhodl bitcoin usdt trading pair story nothing really new want to recall based walking k trading k absurd get talking people,0
Nah doesn't think celebrating satoshi spirit Bitcoin thinking pizza day thing a lot of bitcoin fit are celebrating head community maybe el salvador day,0
probably nothing thread roll entrepreneur explore valuecreation along bitcoin full potential spectrum bitcoin moneywall jeffbooth jeffdeist saifedean perbylund bobmurphyecon williamjluther stephanlivera,0
btc fully deployed spot ownership near btc hectical day today has been arrested position made decent near general sligthly day could much worse,1
go run regression Bitcoin v cart tech stock according to mind please suggest palantir tesla nio alphabet don't hesitate or add suggest cart,0
whatever the case im always bullish failed part btc first kick id millionaire im make error point im conversion hold as shiryo dca,1
We have banned the interposition under sound investment frantically ban any silence even at a negative distance while constantly finding a new buyer losing money,-1
credit multiplier margin active effect passive net supply chain say yes Bitcoin can used high network fractional reserve system hold basic money,1
btc tear important zone yellow resistance rotating support hr next target important great resistance k yellow zone bull flag moment break Bitcoin,0
btc hipd fake news btc go back k tomorrow dead bouncing cat btw sub don't even know what means you need sad life fudder,1
Bitcoin price Canadian dollar btc xbt btcad btc price cad avg last hour avg hour h change h low h high information,0
jack ceo twitter confirmed btc role future mr dorsey lawyer btc long plan integrates cryptocurrency existing service info scn,1
coal oil gas company has received tn bank since paris climate deal mine bitcoin big problem hmkaaay neutral feeling world bigger brief bank,0
availabilityshirecap Bitcoin active galaxy started btc millionaire everything changed bitcoin found after aacrypt learn investing right post tip added massively btc holding,1
nepalneedscrypto day nepalneedscrypto protest government decision ban Bitcoin crypto change world don't want left behind join u post hashtag nepalneedscrypto hellosarkar mahabirpun,1
Ashwsbreal let make big move Bitcoin crypto lovers everyone buy Bitcoin let make wagmi imagine millions of people bought future btc Bitcoin crypto,1
difficulty mines world greater cryptocurrency Bitcoin reaches all time high trillion scale mine cultivated difficulty compared last year number around btc cryptos,-1
end ww dismantling new business means u government cut amazing spending u economy has seen extraordinary boom saifédéan year amous thebitcoinstandard Bitcoin cryptocurrency,0
cz reveals the possibility ipo binance u future changpeng zhao cz ceo binance allusion initial public possibility offers ipo its cryptocurrency bitcoin forex,0
silver partner silver point youll love tech upgrade offered search deip lens tokenize active intangible bringing em onchain interesting move challenge whole,1
slow blockchain expensive slow transaction costly transaction sufficiently encourage people footmine security network recourse cases of fraud extremely inefficient design of non-competitive system,-1
speculate need bitcoinlightning use transfer of funds party do all the work business model trading algos mentioned win user more teacher flash scale engineering,1
in the middle of the worldwide repression Binance Singapore regulator my soon to follow crypto exchange Binance in the face of increasing global regulator pressure uk fca reduced bitcoin binance,0
marketsbyllili beuforbacon elonmusk the intellectual laziness understanding game played higher level independently feel publicly buying Bitcoin holding advantage hodlers independently reason advantage,1
Bitcoin cryptogist price dip k genesis wrong exec defend gbtc last accident ftx wallpaper raise concern grayscale Bitcoin trust institutional investment funds,-1
point another key persona founder kadena dr stuart haber coinventor blockchain technology cited author Bitcoin Whitepaper coinmarketcap kadena built different Bitcoin cryptocurrency,1
Bitcoin neutral support resistance a bull counter-trend signal requires weekly near Bitcoin btc continuous rally around week signaling uncertainty among market participants,0
May shiba inu saw sudden surge popularity increase price around a top of all time according to coinmarketcap data via newsweek cryptocurrency invest intelligent bitcoin,1
question assumes a crypto btc current market leader name higher recognition technology perhaps not immediate future perhaps point generally superior technology victory,1
value store hedge big investors trade as stock market go market still early take long come fruition people resistant change,1
in the middle of the worldwide repression Binance Singapore regulator my soon to follow crypto exchange Binance in the face of increasing global regulator pressure uk fca reduced bitcoin binance,0
coindesk canaanio aoyona nakamotogames offer players worldwide opportunity to participate countless blockchain-based game generate sustainable income naka nakamotogames btc Binance gateio,1
thebitcoinbum bitcoinissaving well think Bitcoin huge freedom to flee country take small amount of money difference fleeing nothing running away little money start somewhere else,1
make sure that the future payment system speaking backend go na using blockchains b crypto decentralized financing effectively cutting the intermediate bank start to earn return assets,1
finished reading Bitcoin standard teacher Saifedean best reading last year difficult maintain level quality next book read the future arrival fiat standard author,1
nftmechaen pleatgaming potential relationship nitroleaguegame unique gem as championchuntersthen the volatile market best focus project carried make future nfts bright rain btc rain,0
know safekeyuf coldstore device used store heriticom plan share want secure delivery inheritance recipient order safekeys configuration plan decentralized crypto btc safehavenio,0
say something break small amount minute negate ta may like enjoy vast majority trading run bot algorithm use your real explanation price movement,0
spy consolidation to Ath recalls some exact things btc last week evidence suggest decrease of volatility btc move btc inversely correlated direction mobile,1
mp accept Bitcoin same party pay maybe donate less Bitcoin altshitcoins help to protect funds debash inflation caused government aid rakyat kasthurishankar yeobeyin hannahyeoh syedsaddiq,1
should not take all week work exhausting hour day include Bitcoin secured multisig concierge team get start time of the best bitcoin resource,1
said whining hoping to answer question instead of overwhelming answer question posed far prediction make type as always enjoy well reasoned prediction so low bull,-1
Bitcoin price decisively broken major slope downline of resistance appears consolidation before next move up interesting see if exceeds last June significant peak near,0
gokhshteinmedia davidgokhshtein despite pullback long enough still confident Bitcoin see another high soon year yet everyone follow georgeleonel tweet forecast trading firmly follow,1
gokhshteinmedia davidgokhshtein despite pullback long enough still confident Bitcoin see another high soon year yet everyone follow georgeleonel tweet forecast trading firmly follow,1
btc worked inflation hedge considering record gold price v Bitcoin price store value adagic also play is happening cryptomichnl raoulgmi trillionsusd thecryptolark scottmelker woonomic,-1
best crypto thing win per week taken last year interest bank give combined bank literally steal people's money run a successful esquery world,1
glmr will x remember tweet look chart buy buy buy big bag Bitcoin btc soil doge shib keep nude xec zec tooth warm,1
monsterscoins im anything except bullish right still trust alt sys eth cvp syscoin optimistic l almost fulfillment Bitcoin pow background multiquorum finality syscoin,-1
mmcrypto market panorama btc price trade k top traded different direction xrp ada luna market cap t btc dominance fear index greed fear,0
fairly fair get growing concerns around the material portfolio although people want wallet stuff safe ui seen word protection stress kind shit,0
crypto think bitcoin current state since fear greed neutral index moment price usd analytical team makes detailed analysis about btc want to hear opinion,0
target btcs h graph currently btcs price hold broken resistance trend positioned according to the technical climb reaching target can still stage bitcoin go,1
long-term outlook Bitcoin prediction best thing start remember monthly channel understand bullish logarithmic graphics best tool see true trend of value without cloudy judgment,1
crypto opinion bitcoin current state since fear avidity index neutral price usd analytical team did the extensive search about btc want to hear the opinion also,0
Jackmallers living time generation future writing moment nd rd country adapt Bitcoin legal course domino fallen strike played great role jack Youre amazing,1
whatbitcoindid w davidzell excellent minute bitcoin basic thesis summary many way Internet changed world changed interact Bitcoin information changed way humanity interact value,1
pantera first fund enter crypto investment Bitcoin founder danpantera remains bullish defi belief weve seen start institutional adoption listen to the latest podcast camirusso,1
Bitcoin ecash continuation Bitcoin cash project continues developed Bitcoin abc ecash protocol ecash revenues reinvested ecash fund allocated annually global network board gnc,0
el salvador recognized Bitcoin country imho el salvador laboratory rat country watch closely does risk factor take long cryptocurrency accepted legal course,1
interesting courses people who have made money crypto go vehemently disagree wallet crypto btc Eth fully understand risk af strongly believe profitable long term,1
usd elsalvador bitcoinday got sat usd btc usd sat ven feb pm cst btc usd sat tue sep cdt bitcoin,0
now good time start after reflective news happens getting bitcoin learning could better opinion value align you accumulating bitcoin slowly low good idea,1
trace common thread hippie counterculture s california today the valley of silicon ethos remains indisputable lsd inspired great music art crypto donated u monkey jpegs,-1
usd elsalvador bitcoindy obtained sat usd btc usd sat sun apro pm cdt btc usd sat tue sep cdt bitcoin,0
couple btc scenario watch find support around k move next level around k strong closing k flip resistance test mid range Bitcoin crypt,0
hold bag exit strategy good thing new proposal need change implement burn new code already written need community approve far voted yes,1
usd elsalvador bitcoindy obtained sat usd btc usd sat sat may pm cdt btc usd sat tue sep cdt bitcoin,0
problem many thousand cryptos does nothing much copied little difference limit case of use a diluted market means many chain fade darkness,-1
recycle win crypto green world recycle today better tomorrow don't miss opportunity win crb recycle contest use link registry convert carbon crb bitcoin,0
chrisllucas lexrlxrqamjcz cel whale moving btc eth coordinated way ftx pulling the cat from the carpeting mat leak could happen independence day next week people distracted,0
sell youve for always sold chance to recover loss can make sell in case of real long loss maintain position technically haunted lost hundred crazy sell loss,0
curious nautiluscap could put together the historical study back before btc pushed of the momentum i.e. a positive consecutive day thanks to the advance work of love by usual btc,0
Trojan timevalueofbtc brother sorry cant make sense say buyer disclosed diff property ad fiat real estate online platform all price bitcoin future,1
price margin exchange exchange owner other dumping market different parts time short u usual make huge money soon all green until next shorting,1
tommycatbsc reward great continue going to get success thanks shared beautiful opportunity to forever recognizing getting prize dimple vexo chancel kukizp lon bnb btc solana,1
two Bitcoin funds launched singafor masregulated fund manager new Bitcoin fund goal provide simple secure exposure Bitcoin professional investor Bitcoin btc btc cryptocurrency,1
petermccormack elastic misery of money brings dogooders damned central bank kernel tenant Marxism human bankrupt confidence level power bitcoin fix money fix world,1
Bitcoin hope separately the state of money need separation together better benefit Bitcoin stablecoins take bring wealth well-being end shortage job anywhere in the world have robot pundixlabs,1
beincrypto no doubt Bitcoin Eth first two follow-up sol matic could also invest torn pptorn cellar would give autocomposed back top apy,1
constitutioncan end despotismwhen people will become corrupt need despotic government incapable b franklin Bitcoin a chance sprate money state youre reading resistance does not fuck,1
Bitcoin ethereum trading slightly new alltime high financing rate future positive territory almost overheated can plant btc ethbtc soil dot atom ltc,0
Bitcoin bug kind compulsive craving to come new declaration as every month first gon na revolutionize impressive cross-border payment go unir gop dems lost sir,-1
Revenuesharks general feeling cheap market crypto also spend difficult time btc fall cvp leader cypto sphere term raw technology that they started to commercialize,-1
mikealfred celsius deposit chapter bankruptcy hope regulator use opportunity bash Bitcoin instead quick legislation prevent bad actor as mashinsky using client fund bet,0
mutenro team professional guide trade check publication follow u don't miss anything crypto analysis best result show better understanding crypto space btc trading,1
proud announcement bitcoin matrix podcast sponsored hodlwithledn construction world class financial product using btc allow delivery harder hit deeper even awesome content from up lfg,1
Bitcoin note red box show price went four months reverse symmetry could u back around in the next four months a lot feel free to recall,0
rckstardev bitblockboom investment time horizon year better asymmetric investment risk Bitcoin holding Bitcoin life financially free suite Ethbtc tweet prediction added holding mentor thanks,1
green energy already widely used bitcoin mining according to recent report bitcoin minor already using total sustainable electricity renewable source member use advice even better,1
btc go k refute cycle previous high next cycle background good do not see point never worse macro environment btc era interesting see play,-1
ending cashing croeuro investment cryptocom year but regret sale fund since made profit fund average cost im gon na buy cro enjoy next rally btc,1
I wanted ath today a lot of anyone honestly slow regular increase better bitcoin thing im start thinking cant stopped crashing up slow regular victory race,1
iyiprofile go fly soon need to look for alternative hard fork as bitcoinlatinum aiming to bring better green cheaper btc really believe fork continue improving satoshi work,1
shibreports thats grande news watch add another zero let u know bitcoin hit bull run watch shib boom until trade forex makes money,1
could mean a long-term price action btc eth even if and the product traded much lower volume see clearly large player pushing serious volume bito,0
"Well, even new investors say the experience crypto accident kill make you stronger as the last find way back relax enjoy life buy philosophy",1
juanfraescudero best decision make today invest Bitcoin gtextrade minimum deposit Bitcoin signature wallet start winning every week send dm google gtextrade learn to get started,0
hey joins network called surveyj won today get paid testing new application free social display medium sign instant link registration bonus surveyj cashapp bitcoin,1
do not miss week money talk song Friday pst interview cardano founder iohkcharles weekly update Bitcoin market last chance abra ask billbarhydt anything abra crypto,0
"cobie choose the right investment strategy reduce the risk making money made btc profit year, regardless of the state of the market buying dip understanding implementing trade signal provided georgeleonel",1
probably get asked a lot worried fixation talk long time btc price artificially propped usdt seems like collapse usdt could really harm public perception btc,-1
"davidgokhshtein choose the right investment strategy reduce the risk making money made btc profit year, regardless of the condition of the market purchase dip understanding implement the commercial signal provided georgeleonel",1
speaker no thecakechat ben founder ceo cake also ux design elliptic talk based decentralized support crypt ecosystem speaker looking forward hear crypt blockchain bitcoin,0
Bitcoin Used Interesting Technology Prototype Digital Money Failed Volatile Slow Useful Bag Holder Rebranded Digital Gold Try Dump Investment Bag Bitcoin Functionally Identical Ponzi Schema,-1
