text,sen
legendary amount crypto trader Bitcoin onchain metric analyst discuss perp future financing option expiration correlating price action show u early plus b derivative dominant price action in the short term,0
count that you are closer brand in fact analysis spot no doubt based year experience trading mine problem analysis does not factor number candle divided length green a red a er something,0
depression type declaration irresponsible go wrong new investor induced buy fake time btc go fall due ftx genesis crisis crypt market absolutely luck btc go k week,-1
well peterschiff malnourished destroy active market bad treatment bitcoin active riskon bitcoin decouple month head better altcoins as eth ground head a lot of blood destroyed come,-1
Bitcoin traderel always ka rebound wait target kthe greater risk Bitcoin own point btc feel irresponsible buying dip bravo bmon makes u proud your great helpful tip,1
peterschiff anyone thinks btc work need goldassets supported obviously does not understand the principle behind crypto blockchain and the risk of counterpart bitcoin basic whats crazier already people do not get it,1
read random wikipedias summary section bubble dotcom burst bubble there entry microstrategy yes mstr emission debt investment btc announcement rev restauration due aggressive accounting practice take share,0
goonrich dksgame favorite gem project game studio every day new partnership fort bear btc crash over mcap m go far bloktopiaenjin launchpad padmobi visit darkshielddg,0
btc still looking strong see another rally upside-down correction in progress could go deep yesterday expected badly close short in blue box go long invalidation around Bitcoin crypt,0
im still new crypto know safe retail investor new doesn't care a lot more put money crypto market belief btc maximalists everyone fair doesn't mean a lot of control wealth,0
Exited long got bought reference netlongs verification of fingerprint statistics comparing the previous reaction always bounce day different time need test ema get fully sent btc Bitcoin crypt,0
green green according to the exchange one we seem radically narrative change btc made the mind but strong argument feeling support your side tread carefully head weekend monthly closing nopaidservice,0
unkonfined unfinished opportunity hey joined network called surveyj earned today get paid testing new free apps social display medium sign instant link registration bonus surveyj cashapp Bitcoin,1
documentingbtc recent announcement banning mining China creates a new advantage crypto miner btc everyone panic that buying Bitcoin opportunity has become btc btc tradng signal enm robin moore whatsapp,1
foundation of laying ecosystem kai prepare to take vietnam new era of challenge reached short period circumstances kardiachain team continue to deliver mass incoming user btc eth kphi dpet,1
easy peasy open tha dizy bitcoin path week bitcorn priceaction h tf analysis said first death dance supply zone zerooooo prudence remember flip short dead man dance,0
Bitcoinmagazine wendyrogersaz new installation Argentiniana considerably expand global bitfarms Bitcoin mining production considerably less cost anticipated add mw infrastructure capacity accommodate minor a bigger btc mining world,1
ive lesson learned today makes gain loss year chosen check chart wallet more next couple month but Bitcoins start het pump huge ath news everyone start fomo,1
Ask technology people think blockchain vast majority expert technology finance recognize crypto esquery hey excar vendors ceo regularly get dry issues security fraud know they speak well,-1
crypto news city rio de janeiro brazil allocate the treasure of the city Bitcoin store value mayor eduardo paes rio recently made announcement brazil next country accept btc submission lmk,1
integer crypt market cap pal absolutely better indicator know company of public exchange all new point right know site relatively new thing great scheme thing right,0
under the construction satoshi lake get the work of preparation made the anticipation setting first cabin place road moved bench slope clear path first lot of cabin rented bitcoin lake satoshi come,1
cancellation btc spot limit order high end k kept reasonable lowball spot limit order open place made June th im banking u dance inside goblintown nightclub lulz,0
track price increase buyer advanced trading cryptoscanner btc eth ksm hot trx lrc xem dash comp kc chz omg grt hnt amp miota wave neo leo crv,0
bigger buy would suggest to buy usdc money base transfer binance taking advantage fees bigger buy suggest buy bnb offer even more discount buy binance assuming haunt used binance,0
oliviacryptos Bitcoin volatility index ready another massive move next week could start new price trend eyeguard Bitcoin christainbtc super underestimated Bitcoin take tweet tip seriously great follow,0
reduction cost per storage unit already faster growth bitcoin blockchain great never gets storage primary neck bandwidth calculation of synchronization costs string scratch esp lower similar raspberry device,0
btc always retest triangle ascending highwicking ultimately try to stay upside down fine long firm day wick happens that what needs to confirm success third attempt to retest btc crypt Bitcoin,0
visa service suspension russia paypal service suspension russia service suspension russia mastercard service suspension russia bitcoin always serf russia a stop crypto-currency cryptocurrency shibtoken btc matwallace,1
urobro Bitcoin volatility index ready another massive move next week could start a new pricing trend keep Bitcoin eye super underestimated Bitcoin take tweet seriously great follow kycee,0
saylor feel like the bull still controls im holding swing scalp long targeting k suite rachelwolfson tweet prediction tip learned a lot of mind investing income btc great tip tweet help,1
Monday August h hours moow time supply a lot btc real time blockchain price u worth coin u b buy much u worth btc real time blockchain btc price minus service charge,0
recent human history complete catastrophe has caused the state of nation control sheep wake stuck present linear thought can see tree forest humanity but broken free Bitcoin escape valve promise hope,1
btc clean cashout top range trading consecutive week nice support of retest held cashout expect a shallow immersion continue higher wave lavax brwl opct luna kara vra trias ax gmt,0
see yield decreasing at each cycle certainly expected rate decreasing x also interesting see lower cycle higher cycle previous high limited data point can mean absolutely nothing watching btc,0
all quiet bitcoin fuck makes you reach new heights people act as never tempered recovered investment processed in search quick pump discharge well makes you goofed may well hodl,0
Anthonyavinesh Saylor btc Previous bounce back vital range of support has kept the hope alive recent autumn daily ema ema reaffirmed robust selling edge best time buy trade dip scottro telegram scot,0
tldr public key used Bitcoin lock used private key unlocking spend nothing actually blockchain sheet source use daily help evolve Bitcoin base kiarabickers Bitcoin clarity Bitcoin philosophy generationlove,0
kennyligthart michaelsaylor miketyson man or security fiat payment gold could physically pay possible Bitcoin obstacle overcome ability integration feature game sector solves much bigger problem good luck brother,1
Speculation on the investment system ponzi it underlying company generating profit assets appreciate the reason for the future price rise someone else seeing price rise want to speculate continue the increase of self satisfaction,-1
step not btc centralized exchange head as the currency base buy a step you are ready to open the extension kernel click low sign click bridge click Bitcoin drop menu click add Bitcoin,1
since read literature blockchain web technology potential exposure crypto could brainwash read risk assessment conviction blockchain technology stay really cares currency to come anytime soon tbh,1
realtahinis ive wait year someone find the petrodollar haram btc halal move el salvador sharia Bitcoin revolution hot cock halal cc maxkeiser stacyherbert need whole series show thread,1
Bitcoin still holding my red seems like really defended whale know close probably get big selloff maybe hold go green April monthly btc close view,0
do not understand Bitcoin true Bitcoins ever sell fiat so major lol calling fiat real money known money really would include Bitcoin more hard form planet money ever seen,1
Bitcoin volatility index ready another massive move next week could start a new price trend keep eye Bitcoin maximejosh super underestimated Bitcoin take tweet tip seriously great follow,0
altcryptogems manage winning wealth hold Bitcoin time people say never win recognizing the difficulty holding several dip btc ever get k beyond won follow nbtc tweet tip btc,1
want give one listen lawrencelepard knock park cover whole host macro topic potential recession rotation price European currency energy crisis japan bitcoin all lot let u know think,0
better profitable investment stock although volatile borderless transaction much better apy scanning crypto leaving money bank protection inflation local currency loses value as by fifteen point,1
satoshi place sleevester goal education on board user bitcoin space offering drink food workshop game hot art office events merchant support bazaar bitcoin focused hub built education connect support,1
rovercrc checked btc nothing price still raise the unstable market but find the safe pptorn compounding auto after maximizes user's torn deposit reward increase profit reduced gas bullish,-1
guess iran want buy cheap btcs try to keep the price low by taking the price of car energy v mining yes need day conclude the purchase better press price stay low long,0
crypto taught way too not crypto term also general life quit smoking spending fiat useless things learned humble thrifty living healthy recognizing crypto im always happy seeing other good,1
startonio czbinance Binance Bitcoin dipping deeper old field of resistance effort flip new weekly support area retest progress ethbtc super underestimated Bitcoin ive take tweet tip seriously ive superb,-1
nftholding darrenpromoter btc consolidation around k level downswing exhausting lower possible short term leg taken liquidity k k probably follow kimcaden underrated bitcoiner tweet tip help,0
garycgorski Saylor potus federalreserve time preference way low bitcoin purchasing power has increased last year while usd has decreased less strong fiat currency btc get bound volatile while coming,1
scottmelker btc broken last ath currently k finally Bull run phase expected long yes alt follow everyone follow btcidd super underestimated Bitcoin writing amazing tweet tip follow,1
btc btc open interest position big short position cut still net short non professional wildly long trader typically means the downside wiper market asset manager super bullx could save non pros,0
let forget lot coup top people prediction September back got pushed December might well get pushed on June seems like thing can get extended roll top btc think,0
conservation see bitcoin slowly become substute currency bank play role or early day btc fiat thank you stellajeffreyfx know lot come btcoin tweet useful prediction thank you take time education u,1
uzyn ldfimember defichain see Bitcoin etheruem in the end to become a bank of reserve currencies playing a lot of gold early role bank bank could issue digital money more anonymity effective dm investment whatsapp,1
Bitcoin update btc finished crashing bounce range returned back back resistance clear range k lost price since continued fairly clear downward trend remains intact rebound k relief rally btc,-1
thread interesting question fine citing hariyuval sapiens imagine the simple example mr cupidy financier set bank mr stone entrepreneur city end first big job receive payment cash mil btc cryptocurrency,0
total absence intrinsic value buying basic currency country supported economy always intrinsic value time low value hanging on to investment storm investment crypto could go smoke could lose everything,-1
dmtland easyfinetwork illuviumio ferrumnetwork dmtland btc recent high break would also result ascent triangle breakout long confirmation and nft easy renbtc kpr bitcoin slp akro crypto cvp xrp easyfinetwork,1
may seem terrible gon right na worsenfor nothing change still fund buy but lot cryptos sink right swimmake break careful project start fold lose a lot of liquidity btc cryptocrash eh,-1
want sell btc cash raised nk emergency funds right pls any timeline purchase discount guaranteed agreement made by video call a sega ronaldo pls help retweet urgent someone,0
coindesk starbucks xpolygon jamiecrawleycd eh look ready good rebound to come day low k Bitcoin k believe hold go k soon check follow keshglove youll certainly learn a lot of genius guideline,1
Bitcoin early morning long term see a bit bitcoin way price go that so also feel way get ready to come bitcoin jersey launch wear bitcoin orange pride passion btc,1
a lot of broken alt a lot of crucial support major support for life like beautiful akro unfi soletc jasmy etc lifetime support test do not consider mini alt bull season rally cryptocurrencies btc alt,0
btstocktrading short cover eod tomorrow proceed June th bitfinex almost b short position taken the highest point two years right China minor extra repression short covered btc hr bitcoin left,0
davidgokhshtein hi david update shib worries memecoin hold looking btc guesses perfect time give ccd m mc wish purchased listing kucoin always continues x anyway concordiumnet defi,0
based nothing belief future think level risk involved manipulation associated shilling cause people didn't like could easily go tomorrow you left nothing maybe pain punt if his invesmtent type discussed,-1
chiqshoes gandalfcryptto warpigstoken cryptodeb lot people have ready opportunity strike buy dip Bitcoin always recovers you are patient enough follow anthonycrypt much better understanding value investment tweet profitable win rate,1
making money doesn't hate kr tax doesn't hate bank want to buy land mine crypto hoping this little spin a lot doesn't worry hide the happy income paying tax like all life,1
care stock bond real economy bitcoin detached any cyber light cure swarm cyber hornet gon na fly moon beyond transcending human form become pure energy ok michael you put to the ground,1
magdahromii techdev data analysis show minimum k bitcoin end cycle thing prevent happens giant asteroid apocalypse strike earth entire power network coup luck thing happening end cycle btc,1
garrettgroce bustarhymes adouble whybitcoinj accord love bitcoin obvs fantastic project real utility thats worth investing that they compete btc whats problem huge challenge allows creative content artist make more paid,0
buyer lost last week trading bitcoin im return range bias lot ppl cashed a lot of loss return soon im always profit planning repurchase low price eye spx until it,-1
whats special dat sat fixed Supply holding gains bitcoin passively bitcoin dat think that itll form base layer future money put btc hand investor passively self-sustaining dat btc cryptogems crypto,1
Bitcoin burst last level long graphic rally signal pattern since july risk Fading im always make profit trade sign given robin moore telegram moorerobin copied trade is gone btc btc,0
Bitcoin holding company crypto june makes way by the seller of pom-pom girl find me betting trader finally find serious guys make sense about food printing money c my really bad head,-1
Mexican billionaire ricardo salina say a factor do Bitcoin btc or higher via thedailyhodl current high trend Bitcoin news frequents share strong engagement through social social milieu insight btc btc,1
lose sale loss hodled last bear market continues to buy immersion along the route purchased lot you s wealth hodl accumulate repeat whenever possible ignore price discussions otherwise speculate btc,1
ruve hut bitf btbt big buy opportunity btc mine btc stock has taken profit during racing action sell hallelujah got reloading everyone other worries hang overbitcoin probably return ktoday week,1
junebigwonx fallofiat bitcoin tempered deeper old resistance zone k effort flip new resistance catalyst next rally btc report betc start buying keep simple socket btceth your tweet seriously follow,0
wojfinance bitcoin k zone of broken resistance could see k close week would confirm long term view hodl buybitcoin everyone however follow xhl super underestimated bitcoin great tip your superb,1
btc update hate say look bitcoin make new low daily expectation close tomorrow confirmation may change time to different view an earlier proposal k good target imo btc crypt,-1
krakenfx crypto millionaire the biggest philanthropic world ever seen know as nothing always works minimum wage job discount shop despite winning strongly crypto follow berniedoranfx guide btc gain tip tweet,1
patiently wait Bitcoin make mind people race around the world bring a new behavioral adaptation structural btc yesterday adaptation cococola allowing Bitcoin payment distributor machine australia new zeal and speak personally coffee starbucks,1
yeah im alt ridiculous doesn't know that going major a get back stellar seems even month boring the more funny thing could be random in fact last month never know,0
take away day a fantasy patty mill best three points shooter league nemanja bjelica go second place player fantasy season there obvious sarcasm make serious alignment change one day hodl nba btc,0
Brettinthewoods price seems crazy high response hate cuz unit bias closed mind lead path chitcoinery short preference time fiat gain instead could make twitter account read Bitcoin standard stacked sat,-1
funny thing people have already added liquidity see algo explorer folk already put silver shid coin to less portfolio associated say case point people even buy even clearly labeled packaging smell a lot like,-1
crypto high risk investment would recommend no one cent crypto created unique purpose attract investors pump devs people promote cash letting everyone the reason for loss crypto go a lot opportunity to burn,-1
personal prediction Bitcoin the next day today got a lot of volatility due cpi data almost million dollars got liquidated get strong support every time k show bullish me your btc crypto btc,1
Bitcoin pass price mark first time since May crash last week Bitcoin regularly find the lost ground the last three months and ethereal climb even faster buy cryptocurrency cash using prepaid flexepin voucher,1
ceo panteracapital main hedge fund predicted massive Bitcoin rally year saying investor run away bonds in real estate shares crypto danpanter will also add the higher institutional property market value do btc the volatile,1
Bitcoin daily update daily calendar btc decrease trend bear losing power also afd print signal lower since June rsi also exaggerated divergence sign bullish today also bull keep control cpi,0
able to send a fund from another country instantly without environmental impact own mobile portfolio interface knowing zero decentralized secure inflation network funds secure flight inflation give hot feeling blurred every time,1
hahaha think entire crypt industry dangerous esquery destructive run idiot advantage idiot cost idiot believe defend no laughable idea anyone thinks false advertising reasonable way pursue remedy anyone gourd,-1
but see the case of useful use come cryptocant made without people easily skip  will not remain decentralized already get centralized government never let happyplaygroundforcryptobros point already dead except fundamentally useless,-1
mattstirner get not done btc old gas guzzling tech fundamentally obsolete compared new blockchain tech as the theory behind btc utopia society without shark whale conartists as musk saylor might actually work,-1
well wrong say ive bitcoin quite down but wickoff model look bullish get k btc always think well see bigger rug sweat history k could crazy good time alt pump soon,0
pewdagoat givrytheproto nft Bitcoin oh sorry cannot hear metamask trust wallet has lost nfts mine stolen need sugar dad well forgotten say money base account hacked note assistance get audition work,-1
u economyfiscal policy starting show crack u presidential election over go jail re-elected tanking u economy average over want to get re-elected tover trisfait anything despair chaos btc best place hold wealth,1
btcarchive thks man Caribbean nation st kitts nevis may adopt Bitcoin money money legal court country Prime Minister say considering the introduction Bitcoin money legal base despite in the territory pioneer cbdc dcash,1
sobbitcoiner triiilionusd skwp could make the wish would be self-auto-auto-self-education by swabitcoin btc seek don following controversy influence im simple recognition pleb ty skwp taken day never seen case of board make mine,1
ponzi new printed money used to pay old money want the last utility value lot people use crypto tool used global fund-raising investment xborder discount micro payment defi nfts 100 million people btc,1
would crypto help to the shockingly unstable value would need to convert money cash real liquidity also talk using crypto form exchange developing countries year still adopted upside down crypto way to send money lot upside down,-1
wjvalk Investanswers fossgregfoss jeffbooth Canadian has started to buy Canadian spot etf inside tfsa capable orange amazing pill woman has changed purchase Bitcoin directly shakepay move cold storage thank you investanswers jeffbooth fossgregfoss other to help,0
based history yes know guide would expect to see the reduction of volatility thing settle the drama of the fork stability starting to become the norm would expect a gradual rise in prices people feel safe enter the water by half getting closer,1
far from knowing perhaps even speculating advancement made bitcoin fundamentally minor always paid for bitcoin fees continues advances even small fraction fresh rate far replace the current huge volume transaction reward value happening,0
p note added two columns think useful day rollover change also added third volume middle column day can really explain tweet think new data provide a valuable preview go ahead btc,1
long btc general lot of institutional money the retail investor a lot of money from the great finance btc general crypto thinking completely go a lot liquid cash splashed altcoins really low value hold next year,1
textd number back says its good please give the call resolution problem new bitcoin thing could really use the tips get phone go try chain the day pretend stupid maybe give fake seed,0
makeroftools muatafagmi adamus blockstreamtalk funny people quickly forget money money technology grand pound keeping scorepow the bitcoin problem just solves score his money decentralized linear mode way a grand pound all the rest layer,1
need to see btc do fast time near k also almost high term k day near level bulls send btc great resistance day k bull has to break k week k also important,0
trap sell k go k night think put money keep small case of reserve big accident buy fresh room price time market sell crashing time open champagne long term Bitcoin always win,1
sell bch gdax right unfortunately that exchange use today does not affect btc right seem to remember someone explaining key two linked something people try to sell bch accidentally finished sending the buyer bch btc problem,0
crypt immature market high volatility degree of traditional investment hold growing day trade people hold even probably staying shant day trade crypto sense medium yield crypto difficult adjustment in the accepted investment strategy,-1
let check metric massive gout behavior may a lot of people thought btc gout k bull zone run finished bitcoin broken k level pink k ath puell multiple near blue box could not break up,0
hh Bitcoin price divergence always updated divergence bullish dating from Nov th pm st lol short term well see prices retests pink pointed divergence projection along confluence fib retracement well see game,1
make sure that people think btc casually going k left lot victim made low short has taken the path of profit less resistance lower going down almost half year value beach lost imo btc,0
cash app nice small a stock Bitcoin app great hold cash also rate bad bitcoin buy like fee love cash app one reason square stock cash app hold thru bitcoin dive,1
see the fully speculative instrument hesitating to call active underlying rest value technology could soon adopt federal reserve banking system blockchain see non-regulated market likely to face regulation at national level move forward,-1
person convince people panic selling people reference huge triangle down graph monthly yes theory of technical analysis say break massive support hard fast kk price k support become massive resistance decide u want bet,-1
Eth will x remember tweet look chart buy buy buy big bag Bitcoin btc soil doge shib keep nude xec zec hot tooth bnb om omg vet xrp ada polx poly pond link,1
"Diversification seems to have recently got enough traction will not die many young people believing buying andf politician traditional finance people mention etc also cool said small portfolio of the game, although growing despite imm payment prepared to go",1
update btc harmonic take profit level k strong resistance area annual confluence open point ventilation market structure can break low low in the short term cost base tp clear level tp next lvl k,0
ive dollar average cost Bitcoin month past im wondering good idea look altcoins low price im still quite new foam seems general attitude towards altcoins quite dour stick btc altcoins viable option well,0
