text,sen
Remember the accident of last summer a person built huge short position bitfinex could return short position bitfinex increased today good luck boy,1
gold rule bitcoin never sell fear minimum hodl year plan today decade ignore price volatility pile bear market always build conviction,1
expert biden believes that temporary inflation of two weeks of propagation stop said similar long expert previous established time say year bitcoin helps to fix,1
btc celsius stacking involved cannot get good risk gains from btc reading seems a good way to win still keep,1
a crypto investment convinced anything crypto ponzi scheme see currency utility does not think very well any of the questions make useful feature of current price support,-1
transfer purse transfer another change wants trade buy locally obscene sale premium trade polo bittamp bitmex youre australia use livingroomofsatoshi pay invoice,0
odell adamisapleb who might want to reconsider want public bitcoiner ultimate proof integrity greed pride ego could become problem under key remain humble,0
trial process big week go Barry said great week accident Chinese real estate company defaulted does not expect to see spot etf accepted bitcoin,0
tmobile gap includes name phone number physical address also sensitive data such as ssn driver information license imei number info bitcoin sold tmus,-1
cashapp jackdorsey bitcoin world bigger podcaster joe rogan accepts bitcoin payment joe rogan world successful comedian podcador accepted bitcoin payment financially shared,1
Network growth continues to increase faster pace story number short term catalyst could solidify network effect actually formed bring bitcoin billions of people bitcoin ray network,1
find path trace let know sent first address knot given never showed any place multiple confirmation im verse im bitcoin well versed wallet,0
jtsglobal utodayen govbrazil indiainbrazil apomplian brazilian brodienbcs ukinbrazil jack amazing big country it would be bad thing to become third country make official bitcoin btc,1
bitcoin price Canadian dollar btc xbt btccad btc price cad avg last minute avg hour h change h low h high information,0
usd elsalvador bitcoinday sat down usd btc usd sat fri oct cdt btc usd sat sate sep cdt bitcoin,0
erossiniuk despite quite long retreat still confident bitcoin see another high soon year however everyone follows sotbc tweet prediction keep firmly following,1
update hour crypto market score btc score alt v btc score alt v market cap t btc dom  btc,0
project built good development long-term open opportunity each user also development project quickly believed future success ascen bitcoin defi hariom sumitk jaising,1
yeah could correct the statement though sub worst analysis except analysis bitcoin real value crypto currency people therefore love matter much percentage get,1
cryptotowneu project professionally implemented clear development plan created professional team experienced certainly a better project your marian mahaburtech topondey bos airdrop bitcoin,1
See fast deflationary market wealth pursuit decrease return still are to keep trying scam people buy without someone holding market shock bag,-1
right llol like anyone following the price prediction last month could make a lot of money idk people who get especially angry go cursing the next moon,0
Bitcoin mining container shipped through the united state take methane gas aired atmosphere recycled bitcoin bitcoin mining industry travel location remote ventilated gas,1
last chance btc bull resistance k highlighted sea st fail to break k time could break k level next day bitcoin btc crypto,0
airdropfather project bright future really think project perfect true cool innovative project future belongs to the project mizimaruf Munna ahsankabirsanto ummenipa airdrop airdrop bitcoin,1
bitcoin ethereum trying to stay hard kk weekend red coming week jumping leg begging finally completely oversold thinking btceth falling down k week,0
movement offer income flow gain simply publish share as social media used sale rental article market gain job support platform bitcoin keyboardrevolutionaries,1
look for new gig job a warmer bitcoin company waterproofi hiring senior frontend engineer backend apply today build waterproof browser pp internet standard,0
bitcoin advantage additionally merchant processor there is aid merchant processing transaction conversion of bitcoins fiat foreign exchange deposit fund directly market bank account daily bitcoin,1
everything that happens human behavior think excellent moment slowly enter safely greedy metisdao sovrynbtc btc  graph to say still reflect something slower,1
immediately collect every red penny soon made it fully refunding enough victim losing confidence made trust matters enough to lose confidence scam,-1
Michael Saylor bought bitcoin the saviour bought bitcoin elon musk bought bitcoin smart when dont want follow one buy market bottom,0
project vibraniumvbn bright future really think perfect project real cool innovative project future belongs project mizimaruf Munna ahsankabirsanto ummenipa airdrop airdrop bitcoin,1
All bitcoin July th interior work fed revealed daily fail mcguiness mcguiness money laundering meme review rawavocado sponsor cryptocloaks host bitvolt coinicarus,0
Any person experience travel support app seems non-existent maybe overloaded free btc Giveaway know want to keep active takes week even listen to email support,-1
Simulyu variety despite fall increase bitcoin still win through mining trade bitcoin time sell time invest contact abrasiverene invest money earned investment,1
Mikejvoorhees jimmyjacked the Americanhodl bitcoin udt trading pair story nothing really new wants to remember background march k trading k absurd get talk people,0
I don't think celebrating the spirit satoshi bitcoin thinking pizza day very appropriate thing bitcoin isn't celebrating leading community maybe Salvador Day,0
Probably nothing business thread roll exploring value creation along bitcoin spectrum potential bitcoin bitcoin money pays wall jeffbooth jeffdeist saifedean perbylund bobmurphyecon williamjluther stephanlivera,0
btc fully deployed place owning near btc agitated day today stopped the position made decent near day slender in general could much worse,1
going run regression bitcoin v basket tech stock following mind please suggest palantir tesla nio alphabet feel free well add suggest basket,0
Any case im still bully failed part btc first kicked id millionaire im commit error point im convert the celebration as shirio dca,1
Forbidden cold crossposting sub know solid investment frantically forbid to silence anyone even remotely negative while constantly finding new buyer lose money,-1
margin credit multiplier effect asset liability net supply chain say yes bitcoin can use fractionary reserve system top network maintain base money,1
btc torn important yellow zone resistance turned support h next important objective greater resistance k zone yellow bull flag moment break bitcoin,0
btc pinched fake news btc back k tomorrow dead cat rebound that btw sub don't even know meaning must sad fuse of life,1
bitcoin price Canadian dollar btc xbt btccad btc price cad avg last minute avg hour h change h low h high information,0
Jack ceo twitter confirms btc paper future company Sr Dorsey defender btc long plan integrates existing cryptocurrency product service info scn,1
coal oil gas company received t n bank from paris climate agreement mining bitcoin big problem hmkaaay feeling neutral world bigger briefing banking,0
vailshirecap bitcoin active galaxy started btc millionaire everything changed found bitcoin after aacrypt learned invert right post tip massively added btc holding,1
nepalneedscrypto day nepalneedscrypto protest government decision ban bitcoin crypto change world do not want to leave behind join u post tag nepalneedscrypto hellosarkar mahabirpun,1
ashwsbreal let make great move bitcoin crypto lover everyone buy bitcoin let make wagmi imagine millions of people bought future bitcoin btc crypto,1
biggest cryptocurrency mining difficulty in the world bitcoin reached all times high trillion scale of mining difficulty increased compared to last year number about billion btc cryptos,-1
end ww dismantling new agreement meant u government cutting off surprising spending or economy witnessed an extraordinary boom year saifedean ammous the standard bitcoin bitcoin cryptocurrency,0
cz reveals possibility ipo binance or future changpeng zhao cz ceo binance mentioned initial public possibility to offer ipo its cryptocurrency bitcoin forex,0
money matte money point youll love technology upgrade offered looking deip target intangible tokenize active bringing onchain em interesting movement defi everything,1
slow blockchain costly transaction slow transaction costly enough to incentivise people secure stakemine network resource fraud case extremely inefficient system design uncompetitive,-1
speculating need bitcoinlighting use shipping part make all business model work trade something mentioned gain user more prof genius of the lightning scale,1
In the midst of global repression binance Singapore regulator will soon follow crypto binance exchange increasing pressure regulator around the world uk fca bitcoin restricted binance bitcoin,0
marketsbyli biflorbawith eonmusk le intellectual laziness understanding game played highest level regardless of publicly feeling buying bitcoin holding profit hodlers regardless of reason profit,1
cryptogista bitcoin price dip k genesis ay exec defend gbtc latest victim ftx fusion increase concern gray bitcoin trust institutional investment fund,-1
point another key person kadena founder dr stuart have co-inventor blockchain technology cited author bitcoin whitepaper coinmarketcap kadena built different bitcoin cryptocurrence,1
Bitcoin neutral support resistance an upward countertrend signal requires a continuous weekly Bitcoin btc rally around the week signaling uncertainty among market participants,0
can shiba inu saw sudden increase in popularity increasing the price around a high of all times according to data of coinmarketcap through newsweek cryptocurrency investsmart bitcoin,1
question assumes a current market leader crypto btc name recognition top technology pass maybe immediate future maybe generally top point technology win,1
store value hedge big investor trade as stock market go market still early takes a long time thing comes fruity people resistant change,1
In the midst of global repression binance Singapore regulator will soon follow crypto binance exchange increasing pressure regulator around the world uk fca bitcoin restricted binance bitcoin,0
coindesk canaanio aoyona nakamotogames offer players opportunities around the world participate countless blockchainbased game generate considerable sustainable revenue naka nakamotogames btc binance binance gateio,1
bitcoinbum bitcoinis savings well think big bitcoin freedom flee country take small amount of money difference running away from nothing running little money start elsewhere,1
cause future payment system that speaks backend gon na using blockchains b decentralised funding crypto effectively cut the average man's bank start earning performance assets,1
finished reading bitcoin standard teacher saifedean best reading the recent year difficult to maintain next level quality book read looking forward arrival fiat standard author,1
"nftmechaen raingaming relationship potential nitroleaguegame unique gem as champions therefore, the volatile market best approach project lot achieves to make future nfts bright rain btc rain",0
know safekeyuf cold storage device used store heredicom plan share want secure liberation heredition benefity order safekeys setting decentralized plan crypto btc sha safehavenio,0
saying something break small amount minute deny ta may like to appreciate great majority of negotiation run bot algorithm use ta explanation real price move,0
spy consolidation towards ath remembers a certain exact thing btc last week evidence suggests decrease btc volatility change btc inversely correlated direction of motion,1
mp accept bitcoin even part pay maybe the donation less bitcoin altshitcoins help protect funds degradationinflation caused by government aid rakyat kasthurishankar yeobeeyin hannahyeoh syedsaddiq,1
should not take all week work tiring day hour understand bitcoin fund safe multisig concierge team get running time start bitcoin resource better,1
he said whining in the hope of answering the question instead of answering the question question question question question away prediction do type as always enjoy well-reasoned prediction if downcast bullish,-1
price bitcoin decisively broken higher slope down resistance line appears consolidating forward next movement upward interesting see if it exceeds the last significant peak of June near,0
gokhshteinmedia davidgokhshtein despite retreating long time still confident bitcoin see another high soon year however everyone follows georgeleonel tweet prediction trade firmly follow,1
gokhshteinmedia davidgokhshtein despite retreating long time still confident bitcoin see another high soon year however everyone follows georgeleonel tweet prediction trade firmly follow,1
btc job inflation coverage considering record gold price v bitcoin price warehouse value adagio also play happening cryptomichnl raoulgmi billionusd thecryptolark scottmelker woonomic,-1
the best thing that earns crypto per week at stake last year interest bank giving bank combined literally stealing from people money running a world of successful scams,1
glmr goes x remember tweet watch graphic buy big bag bitcoin btc sol doge shib keep nu xec zec dent hot,1
monstercoins im everything except right bullish still trust alt sys  cvp syscoin optimistic l almostinstant compliance bitcoin pow fund multiquarum finality syscoin,-1
mmcrypto market overview btc price trade k top quoted different address xrp ada moon market cap t btc dominance fear greed rate fear,0
"pretty just get growing concern around the hardware portfolio, though end-of-day people want safe purse stuff or seed word protection stress type shit",0
crypto think current status of bitcoin as fear rate of greed neutral moment price usd analytical equipment done detailed analysis regarding btc want to hear the opinion,0
objective btcs h graphic currently btcs price maintenance broken resistance trend positioned according to scale technical reach target can still early stage bitcoin go,1
Long-term perspective Bitcoin prediction best thing to start remembering monthly channel understanding logarithmic alcista card best tool see true value trend without cloudy judgment,1
crypto review bitcoin current status as fear greed index neutral price usd analysis team done extended research regarding btc want to hear the opinion as well,0
Jackmalers time alive generation future writing moment rd country adaptation bitcoin course legal domino strike played a great role jack youre amazing,1
what bitcoindid w davidzell excellent minute bitcoin core theses greatly summarizes Internet changed world changed interaction bitcoin information changed way humanity interacts value,1
panther a first fund enter crypto investment bitcoin founder danpantera remains belief defi alcista we have seen start institutional adoption listen last podcast camirusso,1
bitcoin ecash continuation bitcoin cash project continues developed bitcoin abc ecash ecash protocol revenue reinvested cash fund allocated annually Global network council gnc,0
the salvador recognized bitcoin country imho the salvador lab rat country observes closely realizes risk factor takes long time cryptocurrency accepted legal course,1
Interesting course people who have made crypto money go vehemently disagree crypto portfolio btc  understand completely risky af firmly believe profitable in the long term,1
usd elsalvador bitcoinday sat usd btc usd usd sat fr Feb pm cst btc usd sat sate sep cdt bitcoin,0
Now good time to start following the news reflecting happens I have bitcoin learning might better value opinion align accumulating bitcoin little to little low good idea,1
trace common thread hippie contraculture s california today silicon valley os remains indisputable lsd inspired great music art crypto given or monkey jpegs,-1
usd elsalvador bitcoinday got sat usd btc usd sat sun apr pm cdt btc usd sat sate sep cdt bitcoin,0
par btc observation scenario find support around k move next level around k strong closure k flip resistance test mid-range bitcoin crypto,0
the exit strategy of the stock exchange good thing new proposal needs change to implement a new code already written need the community approves widely voted yes,1
usd elsalvador bitcoinday sat usd btc usd usd sat may pm cdt btc usd sat sate sep cdt bitcoin,0
problem many thousands cryptos dont anything many copied little stuck difference limit use case a diluted market means many chains fade darkness,-1
recycling win crypto green world recycling today better tomorrow don't miss opportunity win crb join recycling contest use register convertcarbon crb bitcoin,0
chrisllucas lexrlxrqamjcz cel whale in motion btc  coordinated way ftx pull carpet whale talk filtered could happen independence day next week people distracted,0
selling youve for ever sold opportunity recovery loss can cause the sale to incur real loss long maintenance position has not technically lost penny crazy sale loss,0
curious nautiluscap could put together historical study forward return btc impulse impulse i.e. positive day consecutive graces advance work of love by usual btc,0
trojan timevalueofbtc sorry brother can not make sense saying buyer revealed diff property ad fiat real estate platform online world all price bitcoin future,1
course exchange margin trading owner of another market dump different time short or usual to make huge money soon all green until the next short circuit,1
tommycatbsc reward great keep getting success thanks shared good opportunity for always grateful get prize vex dimple luck kukizp lon bnb btc solana,1
two bitcoin fund launched Singapore more regulated fund manager new bitcoin fund objective provide a safe exposure simple bitcoin professional investor bitcoin btc btc cryptocurrency,1
petermccormack elastic misery money supply brings condemned dogooders central banking center tenant human Marxism fallible level of confidence bitcoin energy fix money fix world,1
bitcoin hope money separate state needs separation together best benefit bitcoin stablecoins stacking bring wealth well-being end of labor shortage ai robot pundixlabs worldwide,1
beincrypto certainly bitcoin  first two followed sun matic could also invert broken vault pptorn would auto compound return high apy,1
constitution can end despotism when people corrupt need for despotic government unable b Franklin Bitcoin a spaced opportunity money state you are reading resistance no shit,1
bitcoin ethereum marketing slightly new all times high rate of financing future premium territory positive almost overheated can crash btc  btc sun point atom ltc,0
bitcoin bug type compulsive impulse comes new declaration as every month first gon na revolutionizing the impressive cross-border payment will unite gop dems lost sir,-1
incomessensations of the general market good cryptography of the market also spending time difficult  btc fall cvp leading cypto sphere term raw technology that have begun the commercialization,-1
Mikealfred celsius archive chapter bankruptcy hope regulator use opportunity bash bitcoin instead of fast track legislation avoid bad actor like mashinsky using customer fund game,0
mutenro team professional guide trade check publication follows or dont missing anything crypto analysis better way to show result better understanding crypto space btc commerce,1
proud to announce bitcoin matrix podcast sponsored hodlwitledn construction of world-class financial products using btc allow you to offer harder hitting deeper content even impressive lfg onwards,1
bitcoin note red box display price was four months inverse symmetry could or come back around within the next four months much feel free to remember,0
rckstardev bitblockboom investment time horizon year best risk asymmetric investment bitcoin keep life financially free from bitcoin after btc tweet prediction added celebration thanks mentor,1
"green energy already widely used bitcoin mining, according to recent bitcoin mining report already using sustainable total electricity renewable sources member use for even better use",1
btc go k refutes previous cycle top next cycle bottom good not to see no points ever worse macro environment btc was interesting to watch play,-1
find cashing croeuro investment cryptocom year and yet regrets the sale of fund from fact profit mediocosto fund im gon na buy cro enjoy next rally btc,1
I wanted ath today much no one honestly slow up constant best thing bitcoin im starting to think cant stopped crashing forward slow race of constant victory,1
iyiprofil fly soon needs to look for alternative hard fork like bitcoinlatinum aiming to bring better green cheaper btc really believe fork continue to improve satoshis work,1
shibreports which is a great news clock add another zero let you know bitcoin punch bull cumshot watch shib boom until you let the forex trade earn money,1
could mean long term btc  price action even though  product marketed much lower volume clearly see big player pushing serious volume bit,0
"Well, even newer investors say cryptocrypto shock kill you to make stronger as the last find the way back keep relaxing enjoy life buy philosophy",1
juanfraescudero best decision to make today invest bitcoin gtextra deposit minimum bitcoin portfolio sign start winning every week send dm google gtextrade learn to start,0
Hey joined network called surveyj won today get payment for tests new free applications social media sign publication instant registration link bonus surveyj cashapp bitcoin,1
don't miss week money talk melody Friday pst interview Cardano founder iohkcharles weekly update bitcoin market last chance open ask billbarhydt anything open crypto,0
should choose the right investment strategy reduce risk make money made btc profit year regardless of market condition purchase dip understanding implementation commercial signal supplied georgeleonel,1
you are probably very concerned to talk long time btc artificially propped price usdt seems that usdt collapse could really damage public perception btc,-1
davidgokhshtein choose the right investment strategy reduce risk make money profit btc year regardless of market condition purchase dip understanding implementation commercial signal supplied georgeleonel,1
talker no thecakechat ben founder ceo cake also ux elliptical talk design based on decentralized support cryptoecosystem speaker looking forward to hear crypto blockchain bitcoin,0
bitcoin used interesting technology prototype digital currency failed slow volatile useful bag holder re-baptized gold digital attempt dump bag investment bitcoin functionally identical ponzi scheme,-1
I think another Biggish Dip brought the whale traders day continuing learning rebound could last near k people become confident bear unless the bear market idea,0
Bitcoin is witnessing a massive bitcoin movement within an hour of taking cryptocartsm tweeting each tip seriously excellent crypto follow,1
ethereum best bitcoin best money continues to scale meet demand best financing support service required money defi best warehouse value less inflation security in the long term,-1
inflation one thing that everyone sees matters hard establishment try to hide tip eating potato cheap nutrition currently a top post real lifeprotip bitcoin ngmi,1
altcryptogems investment horizon of time year best investment asymmetric risk bitcoinlos have financially free life bitcoin after btcy tweet prediction greatly added celebration thanks mentor,1
Remember the twitter account of youtube saying you could see the lower market and price situation one day remember better feedback public bias reverse confidence btc,0
bitcoin attacking h ema rejected ema from the near blow could finally mean watching htf channel break follow cryptoella know things come btc cryptocurrency,0
Basically leaving crypto only year spruce powerful man world happened probably saw half attention Elon getting comments could not pay attention highly doubt crypto idea,0
eh culture secret money or hurt the workers want to share number salary savings bitcoin what they applaud besides knowing that everything else was blushed credibility,0
Fee fucked buy btc price go heaven luck a right sell problem benefit total right bc shit say make benefits fees facts give name,0
bitcoin price moved sits back day in average short-term signal movement still positive btc pundit side fence say bitcoin test k say bitcoin moon,1
every new ath reformulates the bitcoin price narrative really reads the market price news every day distorts the understanding of the long-term opportunity daily news panic fomo keep clear,0
still hearing the case of use would cause bitcoin even Argentina to live trying to safeguard inflation would still buy that you want something gout matter month,-1
said invert bitcoin youre answer subreddit need basic work reddit skill last time checked responded comment taking facial value look even worse using sarcasm,-1
intelligent human actually still hearing boylo emotionally bad weak interpretation bad is better to admit sucking get the right next time rather to continue leading the emotion sucking bitcoin,-1
bitcoin attacking h ema rejected ema from the near blow could finally mean watching htf channel break follow cryptochartsm know things come btc cryptocurrency,0
btc hodl economy from today economy worked gold or use jewelry ornament indispensable industry really timeless unique property thousands of different blocks hashrate larger change,-1
