text,sen
"saying go day trade doesn't care about one way or the other price go course year, no matter",0
Bitcoin btc mining nate food co buy sj pro Bitcoin mining new,0
see Bitcoin consolidation hoping last week ethereal look even better technically Bitcoin ask,-1
Bitcoin need rest need time learn overfin Bitcoin panel via bigcoing Bitcoin cryptonews,0
Mythical game raising millions of series c Round financing led az Bitcoin news Bitcoin,1
Immersion suddenly winning concerned people k minimum eoy btc hodl cooling invest Bitcoin,1
will sell im gon na get big bitcoin sell people will call whale,1
kristinekrypto top bag beyond massive defichain dfichain in reverse of decentralized Bitcoin finance its great,1
ok ban actually took place let think price still strong considering bitcoin btc ctm,0
crypt implode celsius will take beat billions lost know cornerbase made announcement,-1
although identical would be cool af play imo highlighted area diagram hypothetically bitcoin simpleta,0
graybooch Bitcoin does not belong to the exchange exact reason twitter genius know all abt ting,-1
good news Bitcoin cme recent closed gap due more expected number cpi,0
markmoss piece under federal regulation go all bitcoin created a lot of idiot making crypto worse,-1
Bitcoin btc plan rest week watch tag back middle k possibly k weekend,0
ahmadosiddiqi read thread say or standard better Argentiniana offer people improve life Bitcoin,1
typical user rbitcoin it used grandmother birthday money buy btc it cries it,-1
don't see would sell luna righ people have the chance to sell instead obviously take,-1
btc btc k destroyed Saturday pump k Monday retest fill cme gap maybe,0
Bitcoin still measures beauty foam compensation firming last month could still go b,1
o good right rebound btc telegram channel jasmine crypto premium btc eth bravo,1
absolutely love bottlepay app beautiful search him recommend comrade uk Bitcoiners stacksats btc,1
michaelmwebe embettled president nmwendwa busy trading Bitcoin crypto linkedin new company company swerriapp,1
ecosystem developer Eth make one seems like community Eth let fail easily adaptable,1
missing themooncarl level btc missing the greatest opportunity inari accumulating last week tokeninari inarirafle,0
bought per room holding all sold a month ago helped to buy larger house,1
andydestroyer only buy btc bsv Bitcoin only follow hype crowd andy speak kurtwuckertjr,-1
coercion coexistence el salvador Bitcoin law can change global finance cointelegraph magazine cointelegraph,0
The turkey of the central bank followed el salvador would immediately see the economy of deflation think btc btc,1
Whale stacking ape ftx sand link ftx hullish feeling hit crypto Bitcoin market,1
major Bitcoin relief upcoming rally salesman lose confidence say crypto analyst nicholas merten,-1
cryptocrash Bitcoin investment without base cryptocurrency run computer institutional structure aman agrawal Wednesdaythought,-1
send worth Bitcoin friend see long take send worth nano see long take,0
Bitcoin ethereum xrp is worth massive looting crypt exchange hack ethereum bitcoin via,-1
btc small pump rejection r mentioned anterior link video under haunt already and tradingpsychology,0
each piece outside Bitcoin ethereum invented only make rich creator would be a different,-1
mention bitcoin devsusersminers trinity keeping checking something in part not obeying user devs,1
Bitcoin demand will logically start to replace currency fiduciary maybe one day world reserve,1
material time spread although the soft sound believe to survive true crypt winter a lot of alt,1
Watch fake lmao accept wrong everyone downvoted crystal ball think know how to happen next,0
microstrategy put another m bitcoindespite price crashing k via decryptmedia bitcoin microstrategy cryptocurrency,1
utc btc price increase currently up change since midnight Bitcoin btcusd btcusd btc,0
Yep like always saying move the currency talk next version ipad lol take the time,1
whats big deal done cant bitcoin used legal course Bitcoin never controlled legality,0
cryptocurrency monthly mailing newsletter since saying release mobile application to come week Bitcoin btc,0
btc process of rapid opening realization mirror reflection sky earth in the perception btc evangelist,1
as seen day past couple manipulating big society shit fear last time,-1
Finally Beautiful See Bitcoin Designed Days Past Weeks Overvalued Stock Market Popping Bitcoin Always,1
wanting to make money as a safe future problem holding the wrong press that is safe,-1
heeyy anon try to relax im mr beeseeks email me mrbeeseekshodlrodeo lazybitcoinization Bitcoin btc,0
ive used kraken small x lever effect long fresh rolling every hour seemed expensive,-1
apecoin will become worse version shib ie enough pump still dump logical reason,-1
"The risk that dumping will not increase does not burn, nor the supply in circulation has changed currency",-1
laughing bitcoin beanie baby day we brought value instead of laughing would be millionaire even,1
holding tight get better take low dive shoot moon cryptocurrecy Binance Bitcoin,1
every move makes risky every boat sailing risk makes power courage make face,1
matwallace elonmusk therationalroot say put bitcoin dogecoin several currency times see get adopted,1
metaufo best drop of air ever as an amazing project ashenafimeaza gautambhir silinoff Bitcoin utk tct,1
remember im gon na say Bitcoin never lower favorite ct influencers attention listen,-1
baltimore oriole adley rutschman provides spark gunnar hendersons arrival flippin bat bitcoin sportsbook,0
Everyone understands Bitcoin hanging safe arent blasting k diet down enough pain please,0
found good house other printed paid Bitcoin want trade btc art let m,1
part first bitcoin long rise accumulates end period price back exactly started fall,0
gm everyone chooses to build the future best system stop building the past Bitcoin revof technology,1
useless stupidly named token of greed vanter apy see spammed continuous rcryptomoonss absolutely safe investment,-1
small chance btc price could hit k say trader u cool bitcoin dollar,-1
kshib long alert kshib market kshibperp volume price btc btc eth,0
stage live petergwall typing operation update rn new mining platform churning thro,0
new feature help to report deceptive misinformation bitcoin people like elonmusk mcuban thank you jack,1
story always produced hero despair more depth of time despair greater hero appears Bitcoin,1
bitcoin billionusd looks pretty metric look still bullish thinking to reach new ath year,1
Bad triangle Bitcoin sine June th really lacks volume pump cctipcom airdrop eth,-1
massive love exodusio never seen the reality coming to feel blessed alhamdulillah exoduswallet cryptoliberty Bitcoin,1
love tech dam cool mixed current next technology gon na continuous wild ride,1
Bitcoin rallied asian last night cause asian don't give shit u infrastructure bill,1
balance power supply see k usd btc sooner later imo btc Bitcoin cryptocurrencies btcusd,1
btc court deribit btc perp learn company want friend get dog carl icahn,0
Bitcoin always work find new high chitcoins always work find new low understand,1
search market Tesla has seen tesla model smoke dodge awesome daemon investment ethereum Bitcoin,0
will sell im gon na get big bitcoin sell people will call whale,1
hanging irl past happy day see btc pump little today other missed weekend,1
collision two stars created black hole occurs bitcoin collisions defi portalfinance know the answer,0
thinking reliable choice right stablecoin managing risk as a result generally higher return higher risk,1
say two years to come slowly receive token of so-called trust Luna two years,-1
average daily average active user volume of positive long-term price action,1
The price of the volume of information and the price of the volume of information and the price of the volume of information and the price of the volume of information and the price of the volume of information and the price of the volume of information and the price of the volume of information and the price of the volume of information and the price of the volume of information and the price of the volume of information and the price of the volume of information and the price of the volume of information and the price of the volume of information and the volume of information and the volume of information and information on the market of information and information on the market of information and information on the market of information and information on the market of information and information on the market of information on the market of information and information on the market of information on the market of information and information on the market of information on the market of information and information on the market of information on the market of information and information on the market of information on the market of information on the market of information and information on the market of information on the market of information on the market of information and information on the market of information on the market of information on the market of information on the market of the market of information on the market of information on the market of information on the market of the market of information on the market of information on the market of information on the market of information on the market of the information on the market of information on the market of information on the market of the information on the information of the market of the information of the information of information of information of the information of the information of the information of the information of the information of the information of the information of the information of the information of the information of the information of the information of the information of the information of the information of the information of the information of the information of the information of the information of the information of information of the information of the information of the information of the information of information of the information of the information of the information of the information of the information of the information of the information of the information of the information of the information of the information of the information of the information of the information of the information of the information of the information of the information of the information of the information of the information of the information of the information of the information of the information of the information of the information of the information of the information of the information of the information of the information of the information of the information of the information of the information of the information of,0
Central African Republic adopted Bitcoin reference currency office presidency btc cryptonews nft btc,1
Just under-doing guy guide make money shit literally called pumped buttcoin caught point,-1
apompliiano country of wish would replace old fiat minded head personality as nayibbukele Bitcoin,1
People soon realize shit order piece as the Ada pump must pump bitcoin first,1
never calm see net value take the absolute nose dive in real time epic Bitcoin,-1
the price of hashing thinks that the regular rate of supply of the holding btc remains constant,0
btc derivs sheet tweet each min cme delayed min g delayed min oi share,0
good storage crypto electricity consumption waste produced along huge specualtion apart from use crypto,-1
welp hell realize where community doesn't come back project finally fail implement burn lunch guess,-1
buy cro first time start the tanking the next day the entire crypto market will learn lesson,-1
you didn't know bitcoin pump two weeks doesn't expect pump next two weeks,1
absolutely do not want to worry though unfortunately worried enough u dollar im happy bitcoin holding,1
bitcoin mempool tx last minute statistics mean median max th quant nob block height,0
realvision raoulgmi maggielake may ask bad question bitcoin correction average dow nasdaq share market,0
btc derivs sheet tweet each min cme delayed min g delayed min oi share,0
panicked put money home deposit gon na cooling right believe bitcoin go say family,1
preaching happy brother finally take interest focus privacy decision factor hold ccd monero,1
Bitcoin mempool currently mb transaction waiting block total fee transaction sat median fee satvb,0
want know central banking work petrodollar printed silver actually get circulation etc book recommendation,0
btc derivs sheet tweet each min cme delayed min g delayed min oi share,0
Russian crypto market value b despite bad regulation say exec cryptocurrency bitcoin technical analysis,1
elonmusk fix money make child affordable jeff chata bit system place bitcoin technology help,1
safe leave node unsupervised safe ensure tour monitoring wait bitcoinconf tabconf bitcoin lightningnetwork,0
btc free signal future btcusdt input x max mis max future total tp,0
sold bought a lot of used red wallet since started right game shark know cheating code,-1
first bought Bitcoin honestly liked idea send money online way untrusted seemed revolutionary right,1
made prediction back May price action following fairly close hope continues aave Bitcoin crypto,1
citizenbitcoin thought Bitcoin sale ask someone to buy invest security crypto strategy reach the financial goal,1
Bitcoin btc Bitcoin hitting k ahead of July inflation ratio fractal index next correction,0
btc hovering k today fed base point rate increase historically announces the highest year increase,1
trolling serious advice don't want to lose money mean debt anything yet a lot,0
btc derivs sheet tweet each min cme delayed min g delayed min oi share,0
viable reset eot look good walk away let computer manage price time cycle delete,0
people dca alcohol every weekend a lot of things buy excessive waste useless battery sat btc,1
Bitcoin got close fib zone all watch the hurdle key hitpass see btc behavior,1
just could happen we'd think short stack the thing need to happen long pressure,0
want know central banking work petrodollar printed silver actually get circulation etc book recommendation,0
cryptodnl tend to agree however rational btc seller would not sell massive volume long u weekend,0
btc derivs sheet tweet each min cme delayed min g delayed min oi share,0
Maybe a little like getting dca fast maybe daily buying thing really want to go,1
started to play seems great far also the idea of love getting coins listed anywhere believe great,1
btc derivs sheet tweet each min cme delayed min g delayed min oi share,0
time ive never used crypto game site illegal buying same ball ache sort,-1
btc price be pressed lower higher break hour determine next direction,0
Bitcoin btc perp oi climbing financing soaking rebound negative seems shortened could get funny,0
like way to think buy log cabin fam also go homeless cat need place stay,1
philakonecrypto Bitcoin could be found illegal child porn link integrate blockchain maybe reason panic sell,-1
tun tesla Bitcoin bet up yield ed take bank real vision finance business the,0
Hmmmm raoul become fanboy cathie sorry maybe still make attention arkk tsla bitcoin,0
OK channel still valid nailing atm btc channel medium market structure spinning bullish min,1
bull take control must see price quickly revisit k Bitcoin btc btc eth bnb,1
russia implement plan disconnect internet internal limit of address medium haschrate btc go therefore price,-1
bitcoin bull despair leader model predict bitcoins trajectory always say track hit three digits btc,1
I want someone else to carry chitcoin lease bad choice grow upbtc crypto celsiusnetwork,-1
dogecoin simple simple payment method crypto nothing fancy too complicated someone understand the greatest strength,1
absolutely amazing substance fan investor Bitcoin company thank woonomic provide u pleb great info,1
agreement does not care to believe that wanting point making an exaggerated claim would seem something to want to believe,-1
india crypto exchange btc trading volumehours zebpay btc coindcx btc wazirx btc bitcoin btc,0
aave short alert trading market ftx aave perp volume price btc btc eth eth,0
cryptocurrency community resisted pressure to sell give up hope Bitcoin altcoin plunges hi go ahead prosperity,1
boursish prudent look range too hullish pa retesting range low seems likely Bitcoin btc,0
btc derivs sheet tweet each min cme delayed min g delayed min oi share,0
state-of-the-art news African Central Republic voted bill adopt Bitcoin legal course amp as domino,1
senlummis Bitcoin integration priority proposal hope mix altcoin ethical security company try capitalizing moment,1
ananavarro makes money btc altcoins learn to earn money of growth complaining follow by telegram cryptosophy,1
Bitcoin first decentralized player crypto market that the right people also use a lot of option along,1
enjoy the annual rush people wanting to hit gym a lot of idea part month up amazing selfies,0
Bitcoin memppool tx summary last second median max th quant nob block height,0
know every sale out there buyer right buy fearsell greed wish could dca way dca,1
btc derivs sheet tweet each min cme delayed min g delayed min oi share,0
Imagine impact Bitcoin lightning node automated growth management take hahaha fiat chitcoins go poof,1
well see something well connected price security is going good shit happy to invest good future,1
bitcoin danheld savings account too austria tax bitcoin gain ups buy hodl trade bitcoin,1
cryptengineer heard strike bitcoin soaking strike constantly rising big thing going big strikexofcial project,-1
hat finance bros has taken bitcoin footed fiat bitcoin could inflation hedge assumed finance bros,-1
dot long exchange alert ftx market dot perp volume price btc btc eth eth,0
k combination Bitcoin btc short liquidation last minute huobi k Binance k bybit k,0
atom long alert market atom perp volume price btc btc eth eth,0
really ask foreign question important of course get well sense answer probably need professional advice,0
Chinese central bank bans bank offering a financial service could use commerce cryptocurrency like Bitcoin,-1
foldapp omg game a lot of fun getting better first time guy sat metaverse foldapp btc,1
still slight bitcoin divergence launch tick toe indicator circle gain cryptocurrency indicator,1
depends new hit k dip back k always spot end on previewed the future,0
btc derivs sheet tweet each min cme delayed min g delayed min oi share,0
garyblack unless elonmusk introduces solar tesla integration make bitcoin extraction lots of efficient green energy,1
remember michaelsaylor get clowned borrowing millions buy bitcoin k michael please send condolence bear,1
knownews Bitcoin Eth Major League Australian Baseball Team Perth Heat Pay Player Bitcoin Hold,1
looks like autosmash cathie buy mode level million value gbtc share last week bitcoin,1
btc derivs sheet tweet each min cme delayed min g delayed min oi share,0
broken btc k support im iudi investment uninstalled apps twitter health gon na die,0
Jamie dimon remains bitcoin sceptic declaring bitcoin regulated government click detail leapwealth texasadvisor bitcoin,-1
staying focused considering goal would not regret trading cryptocurrency Bitcoin btc bnb huge adjustment inevitable,1
minute look like btc price powered ratehike already maybe people slow today react Bitcoin,0
Bitcoin mempool currently mb transaction waiting block total fee transaction sat median fee satvb,0
cortrobinson anarchocanadian comicdavesmith patrickbetdavid guyswann sum total wealth connected Bitcoin network easily remain decentralized,1
btc derivs sheet tweet each min cme delayed min g delayed min oi share,0
btc usd move several unknown address wallet date gmt blockchain Bitcoin symbol btc detail,0
ha chicken sir shell do two weeks maybe interest cock thigh three egg per piece,0
good part alt actually built Ethereum first mobile advantage actually good would not today nestt,1
btc nayibbukele presidentenciasv bought el salvador average purchase price of one million buying time of one million,1
do panic sell dip remember subvalued shib x pic buy cryptocurrency btc shib dinger,1
Bitcoin mempool currently mb transaction waiting block total fee transaction sat median fee satvb,0
high interest yield win program crypto ready already big enough become huge disruptor cefi,1
silk road bitcoin stash used pay ross ulbrichts million fine decrypt actadi bitcoin,0
bitcoin mempool tx last minute statistics mean median max th quant nob block height,0
back dry ripple case judge order release hinman speech ethereum nfts cryptocurrency bitcoin cryptocurrency,0
Monero genuine piece use case serving purpose without shilled influencers continue to buy market bear,1
blockchainchick equalizer Bitcoin system without human trust currently central banker has caused untolduncountable misery suffering around the world,1
diet reached pure capitulation bitcoin idea go next may enough pain bull rising ash,0
future woman juice given man dry hand work thought bitcoin fall in time im bitch,-1
pwthornton Bitcoin Fan Fucking Fdic Big Government Regulation Also Bitcoin Fan Fucking Arrived Money,-1
stopped checking the price crypto rbitcoin back any normal return but shit always hit fan,-1
sher tri secret open not enough to crash funds will eventually take all the time,-1
The market for the exchange of short alerts and the price of the volume of the exchange of information and the price of the volume of the exchange of information and the price of the volume of the exchange of information and the price of the volume of the exchange of information and the price of the volume of the exchange of information and the price of the volume of the exchange of information and the price of the volume of the exchange of information and the price of the volume of the exchange of information and the price of the volume of the exchange of information and the price of the volume of the exchange of information,0
Algo short alert algo exchange market perp volume price btc btc eth eth,0
Tonton dogboss airdrop new round total airdrop swimming pool valant dogboss airdrop Bitcoin di youtube,0
btc derivs sheet tweet each min cme delayed min g delayed min oi share,0
last year thing bitcoin magazine trying to create big tent conference fucking affinity scam,-1
swan good place to buy Bitcoin love Ethos stand end day fresh high price marked,0
Bitcoin fall k trader say bull need hail mary avoid bear market Bitcoin via,-1
Obviously dig green today somewhat disappointing see Bitcoin gain more alt sworn people learn,1
btc reaction time really interesting feel like a relief due to negativity around the extremely high market,0
total crypto market cap continuous crumble dollar index hit year high crypto Bitcoin cryptocurrency,-1
feel hit sell wall hit kool help man break sell wall ohhhh ohhhh,0
money bleached stopped u dubai million stolen Bitcoin cryptocurrency good work of the authority of the law,-1
need small primer crypto mine really finished work piece argoblockchain ark riot Bitcoin ethereum,0
hastecoin result a lot of family pay the price in difficulty make end clearly meet Bitcoin much solution,1
new video subscribe urgent alert powered central bank pump central binance take control Bitcoin xrp altcoins,0
Bitcoin bear market can take btc price k say trader stock due Bitcoin capitulation via,-1
as stable thing stable coin name go yes really trapped dollar more a lot don't care,-1
wait k week buy next two weeks sell k wait until get k get hodl,1
bullish scenario going exactly shown the latest video youtube subscribe not to miss update Bitcoin cryptocurrency cryptocurrency,0
joshioung jameshmackay think bitcoin different well anti cryptos looking forward other bitcoin burning rising ash,1
Bitcoin price move great win next week prudence trader may bull trap cryptocurrency new via coinjupiter,0
fix money fix Bitcoin world generational riches short film matt hornick tomer via youtube,1
"btc last block info block hold transaction total bitcoin, including block reward block size byte",0
play get cashback play betfury top rank up cashback get username betfurysuccess bitcoin sneaking,1
hodl crypto show love ledger valentine unisex tshirt buy today free shipping find cryptoclothes Bitcoin,0
take two things bitcoin happy secure private key extend horizon of time that the purchase price counts,1
rektcapital case btc would close weekly candle wick word give up back upp k Sunday midnight,0
longer podcast hour minute grating bitcoin crypto btc mattysats cryptocurator mashinsky alexandrelores infinitytimesme kryptovski,0
monetary system enemy money transfer base create targeted rarity Bitcoin born set u free enemy,1
the money power widening wealth gap is accident use bitcoin oligarchic empire in fact easy to understand,1
a lot of people tend to sell the holding price get pretty high salary mortgage retirement meet the goal of life,0
"deeply understand Bitcoin realize the seamless global solution plan to preserve wealth still experience, including ethereal",1
Today snapshots new subject average competitor btc Bitcoin crypto analyzed global article average feeling negative,-1
Get a Boneless Cause Purchased Dip Noobies Child Common Cree Sale Made Money Lost Cause Noob,1
the search indicator could well according to fibonacci graphic extension blowoff top k range bear market of the year,-1
see a lot of people calling k low bull market support band go k would mean party,0
im crypto since distant found usecase money transfer come mind challenge far away money cost,-1
btc Bitcoin trend primary remains downright primary cycle support k thursday die day btc,-1
zrx symmetrical triangle h tf wait touch red line decided if enter btc Bitcoin cryptotrading,0
congratulations obtained Bitcoin level of understanding no one knows much level im level Bitcoin beautiful invention ever,1
