text,sen
stronger network before price follow soon,1
I'll smoke still buy bitcoin,1
raspberry price ticker btc bitcoin ray network,0
taking coin seller don't deserve lol,0
agricultural bitcoin ocean fire open inbox,0
Miss K Bitcoin is coming back tonight.,0
low price crypt ist is going to disappear,1
beautyofhelin purchased btc hodling next option,1
btcusd abbreviated binance utc btc cryptocurrency,0
pure gold bitcoin bitcoin best gold,1
any brain stacking much possible right,1
plan to invest a small amount each month,1
check ousd look great return moderate,1
bennsimmo hegde dominance of global adoption bitcoin,1
congratulations youll made all the time p,0
btcusdt abbreviated binance utc btc cryptocurrency,0
action bitcoin attack hope free society,1
Thought get a better chance in mid-July,0
Like Decentralized Crypto Nature Win Nice,1
people appreciate buying bitcoin  bnb,1
Long bitcoin entered btc coming bull,1
obiwankenobit bitcoin year compared last year,1
price bitcoin currently crypto btc btc,0
quantumbrix ipfs built bitcoin im interested,1
bad-mouthed coin nation summit bitcoin,0
The guy of the week feels like something huge is happening.,1
development change bitcoin btc crypto ada,0
Lol yeah point of sale hodl shit,1
crypto future plain simple buy perish,1
It feels nice you could buy bitcoin idk,1
No one knows bluewallet that allows withdrawal yet,0
xlm work really well exchange transfer,1
watcherguru wlementeiii a decentralized bitcoin protocol,0
many shops alt btc hit k,0
crypto nerd knows farm bitcoin tarkov,1
Someone has juicy bitcoin conference clip,0
btc bitcoin situation as btcusdt graph,0
cryptooptimist btc put the higher rich world,1
never share seed word no one ever,0
best website read live cryptographic news,0
last round interval previous number at,0
btc btc   bnb bnb,0
hodlonaut see word buy bitcoin see,1
amitchemka doge wala also love bitcoin,1
iohkcharles bro sell cordano buy btc,1
There's a lot of law. Something's wrong.,0
billionusd listen still bitcoin available buy,0
I think I really need to wait to get an answer.,0
feels like atm bitcoin cryptocurrency planb,0
laynio laynio as a simpson bitcoin,1
need to fall k lol happening,0
has enjoyed the optimism thread of realistic enthusiasm,1
price update bitcoin cryptocurrency font btc,0
High closing time today btc crypto,1
that you don't try to convince anyone good,0
pretty good rebound daily btc btc,1
update the weekly bitcoin btc jclcapital chart,0
so-called e-mail Senator finger cross bitcoin,0
bitcoin technical score btc bitcoin technical,0
lot bitcoin lil bita doge ethereum,0
ilovejaneadams opportunity to buy bitcoin a year ago,1
Today xmr equals btc monero privacy,0
dogecoin bitcoin crypto doge friend all,0
btc btc   bnb bnb,0
Don't think about understanding bitcoin's investment work.,0
btc price change h bitcoin btc,0
ee thinks ee feels bullish bitcoin,1
buy low brand difference keep bitcoin,1
another chance to buy shib cryptocurrency btc,1
hawaiicryptogod as bitcoin love dfi defichain,1
as original digital gold know bitcoin,1
ok basically bitcoin enjoying the bitcoin ride,1
best practices sparrowwallet bitcoin should read,0
random term bitcoin glossary bitcoin btc,0
Whatever I have to keep buying sat,1
btcusdt abbreviated binance utc btc cryptocurrency,0
buy fear bitcoin k financial advice,0
"Uh, I didn't expect to refer today to bass.",0
keep the fomo patience based on graph min,0
BTC accepted phone booth very soon,1
real beauty crypto cant printed government,1
bitcoin read full bitcoin analysis cryptocurrencynews,0
Get rude cold watch money increase,1
go up baby give or buzz weekend,1
Yeah baby dracarys bitcoin,1
still alcista dogecoin favorite currency right,1
Next time I tell you to buy bitcoin,1
btc bitcoin back k bass before,1
view high-hour zoom frame bitcoin,1
Elonmusk comes clutch btc bitcoin crypto,1
mining bitcoin preparing to take maraplane,1
bitcoin supply crunchy action love see,1
Good morning intensified today bitcoin fix,1
great way to bring money help ukraine,1
jasonplowery bitcoin hope best world bro,1
bitcoin circulation btc remaining mined,0
desire repeatedly as long as possible,1
officialtravlad made sir mufc bnb btc,0
price update bitcoin cryptocurrency font btc,0
love see btc btc respect ta,1
Umm don't say word man soon,0
btc breakout binancebtcusdt tawfiktrading bitcoin btc,0
btcusdt abbreviated binance utc btc cryptocurrency,0
btc btc   bnb bnb,0
peterdiamandis many others with lucky bitcoin definitely,0
Pizza day beat record john bitcoin,0
btcusdt abbreviated binance utc btc cryptocurrency,0
The stable stock of bitcoin chose the stable,1
mkbhd looks a lot like bitcoin altcoins,0
feels like a quick wick coming btc,0
btcperp abbreviated ftx utc btc cryptocurrency,0
Stay scared wants btfd ltc btc,1
Bitcoin changes the particular part of planet earth,1
"Hi, I think Bitcoin gives you financial freedom.",0
id to say well the investment worthy of point,1
polygon lowno cost ethereum good book,1
Percentage of portfolio investment currently allocated bitcoin,0
btc crypto legalized country cryptocurrency bitcoins,1
there is also possibility btc bitcoin btc,0
published letter bitcoinmagazine education daughter bitcoin,1
binance walked agreement hang crypto btc,0
bitcoin daily point ful daily negative,0
as bitcoin currency pay attention price,1
The fun doesn't make sense.,0
assuming no paper hand unfortunately many,0
integer crypto needs to gain rooting smooth transition,1
Ballenalert keep transferred several hundred btc wallet,0
agreement guide market uncertain crypto btc bitfinex,0
absolutely nothing coinbase user coinbase btc,0
thought btc bitcoin see danilblinkovs idea vision of commerce,0
"However, the driver of the delivery marks the year of the figure",0
price update usdt hour btc  xrp,0
mining bitcoin recovering btc go bitcoin binance,1
paulserious kinghoward still the domain thinks bitcoin fix,1
would prefer gold medal bitcoin medal btc,0
sure ready to buy blood btc btc bitcoin,1
zerosumx sundhaug hacked bitcoin using weird trick,-1
sold k always happens pile btc time,0
recommended yesterday was a lot today bsc btc,1
whale can't manipulate how to sell sorry btc,0
recover zero from recovery plan site soon,1
Well gon na fin well break the rule,0
wait bear runwell said panda run btc,0
bitcoin bnb binance important New Year crypto,1
airdropteam bnbbull bitcoin dao good project peacekelly,1
amount txns that take place btc red bullist,1
yep time accumulates big boy btc,1
apomplian apomplian kevinolearytv quite stupid eats btc,-1
buy dip do not go btc bnb bsc,1
bitcoin absolute piece shit technology antiquated slow,-1
btc usd transferred portfolio unknown portfolio unknown,0
Remember that people said bitcoin scam good weather,1
accumulate even better price next week,1
retweet wants lunc hit year cryptocurrency bitcoin,0
Remember exactly that the party started to come together late,1
computerart bitcoin blockchain last block height view,0
forget bitcoin altcoins in motion analyze volumepremovin,-1
The prediction of the xrp wave price continues to surpass bitcoin,0
impressive post-rational metric see supply shock October,0
Ibrycom There Is Reason Another Need for Bitcoin,1
Long position taken pump dydx btc btc,0
thoughtstore valuewhered value go btc nothing,-1
btc pumped k btc crypto alcista,1
big fist iron bearocratic look small man,0
love keep filling bag of bargain bin price,1
bitcoin was used yesterday last day bitcoin,1
bitcoin regretted saying he told the person,1
totally possible to think that big people back down sell,0
thought k fabulous Indian dance type video,0
bought the first bitcoin today to learn however,1
rdrlfe yea friend called go bitcoin payment,1
Excited bitcoin scotland event follow jimduffy bitcoinconfuk,1
joecarlasare Bitcoin last free market price bastion,1
entire market backing back red the last few weeks of cargo months,1
btc market shared family member waits in,1
get popular hardware portfolio trezor a bitcoin,0
grab satoshi staying market is never going to fall,1
glorified ponzi scheme losing people time electricity,-1
chart of the week a little looks like graph of the year,0
purchase july watch fly btc cryptocurrency crypto,1
advisorshares latest future bitcoin signature file etf,1
buy bitcoin can not sell half sell none,0
oscillating trend btcusdt minute time frame btc bitcoin,1
bitcoin square treasure is worth usd usd bitcoin,0
btc weekly daily a gon na win,0
saylor flag cross time movement h btc,0
bitcoin can last much longer academic warnings,-1
thanks diffusion of the word monkey really everyones portfolio,1
new bitcoin ath sooo time of cautious closure,1
fucking alt btc all red almighty red,-1
microstrategies bitcoin treasure is worth usd usd bitcoin,1
whale goes long and lol btc bitcoin,0
steveinmanuic fbi bitcoin steve protect the neck,1
Elonmusk please say green positive bitcoin portfolio,1
btcusdt m macd cross btc btc bitcoin,0
sometimes the price needs to boil over low heat comes to boil,0
Everyone double check direction anyway a good reminder,0
reverse cramer index officially confirms bitcoin moon,1
soon Dinosaur news day became extinct btc,0
Cryptoshillnye hey fuck trx next bitch bitcoin,-1
k Holdin's theory back to test k,0
potential scam udt large enough crypto demolisher,-1
alexdreyfus cointelegraph turkey country crypto tokenavocado btc,1
k wick clear wasn't moving news dip,0
way to talk meme room noise speculation bitcoin,0
last line of support boy bitcoin moon btc,-1
bitcoin awoke the day and yet the fall of nuclear bombs,0
ocsc demo via youtube libonomy interoperable bitcoin,0
continue the tip producing great bitcoin fix content,1
Yeh agreed to try to think the reason for the way done,0
A lot of shit substance put black casino anyway.,-1
means please stay as bitcoin v spx,1
elelongwave gjbangar bitcoin asset secure advantage confiscated,1
think btc bitcoin see xcvbss idea tradingview,0
Cryptosea moov dotmoovs soon bitcoin binance,0
short even increasing probably in some way the option backed up,0
Crazy Thinking Bitcoin Trading Since Year game,1
price update usd hour btc  xrp,0
uston astros v texas ranger bets bitcoin,0
perfect morning shop buy fucking dip folk,1
btc stimulus is worth btc hr bitcoin change,0
"Actually, although it would recover before xd",0
think btc bitcoin see selectiontrades idea tradingview,0
altcoindayio bitcoin crypto exists without bitcoin,1
continuation of the expectation of real change of bitcoin year of trajectory,-1
bitcoin brainwallet Python Python bitcoin recovery tool,0
long term bitcoin btc  ada,0
nikantmine neiljacobs let buy bitcoin k well,1
word regulation triggering cryptocurrency bitcoin community lol,-1
order save market need satoshi make appearance,0
walltreesilv silverguru orowitzerland digital gold bro bitcoin,1
Here I knew the bitcoin bottom wasn't a bull trap.,0
terra bad investment cryptos operate ponzi scheme,-1
anyone buys direct trezoris best transfer change,0
perhaps the result of fundamental change weak prohibition of change,0
bitcoin looks good next week looking good,1
opinion though start small win smart bitcoin,1
btc usd transfer the base of coin portfolio unknown fed,0
cash purchase limit bitcoin purchase application was,0
Not proud everyone knew I'm sorry friend btc,-1
thought btc bitcoin see desmondlzws idea tradingview,0
btctokoloshe kendallnear magdawierzycka well knows bitcoin ngmi,0
k bitcoin btc settlement short bybit btcusdt,0
Bitcoin formshifting right bear active passive bull,0
btc lost support btc crypto bitcoin,-1
wtf dream see btc bnb  sleep,-1
Cryptomichnl still plans to see point bitcoin usd,0
think btc bitcoin see shipmemaris idea tradingview,0
"Before the garbage falls, you better fuck Justin Sun.",-1
Haha Bull Market Miss Meme Bitcoin Bitcoinetf,1
Waiting shibainucoin going crazy beat bitcoinfun watching,0
ton alt built suffer a crazy rate,-1
btc price h change stones bitcoin btc,0
another arrogant algorithmic puncture stablecoin inevitable failure,-1
ar satoshis satoshi ar bitcoin right,0
bitcoin hit weekend give lucky follower,0
Yups leave emotion box closed somewhere hodl,1
bullfighting between or sign bitcoin bitlord,1
doge coiner buy doge shitcoin buy bitcoin,1
Think bitcoins volatile effective youre delusional,-1
Danheld cagr hell financial freedom thanks bitcoin,1
think btc bitcoin see Maleknaphaas idea tradingview,0
bitcoin stopped trying to divert bitcoin attention,1
think btc bitcoin see fxcms idea tradingview,0
crypt market update available bitcoin ethereum crypto,0
crypto giving or avenue financial world of passengers,1
make you think active overvalued the last two years,-1
Damn market sick cryptocurrency crypto btc bitcoin,-1
help even the way bitcoin crash make bullish,1
think btc bitcoin see aryanouris idea tradingview,0
defiantnews camirusso ftxofficial question bitcoin negatively affected,0
crypto wild walk high under dogo hodl,1
attention rate binanceus dust cleaning trade btc,1
newbie revolution tho has the kraken coins base ready,0
check the list of opensea articles via opensea bitcoin,0
btcfuel btc alcista signal of alcista fud,1
someone tip invest crypto bitcoin investor today,-1
Bitzippofficial project good project beautiful mohdshaanu nsnoman,1
They don't live altcoins much cause become homeless,-1
Lol rule class can't make a joke.,0
eudora funk byron hardey bart jim btc,0
ashbit list pancakeswap day bitcoin binancesmartchain bitcoinashtech,0
shib will work much longer tbh,-1
think btc bitcoin see pnchans idea tradingview,0
Yeah dat I don't look good bitcoin,-1
Every altcoin scam you're diversifying is a victim.,-1
monero probably better currency atm change of mind,1
btc  ltc something solid starting point,1
think bitcoin change lot life read pioneer cryptocurrence,1
Danheld bitcoin return sometime take together,-1
price update usd hour btc  point,0
sorcery magic playtoarn metaverse bitcoin diamond blockchain,1
Bollinger break btcusdt minute time frame btc bitcoin,0
bitcoin sr closed daily expects to expand today,0
gokart drive fun buy nft bitcoin ethereum,0
altcryptocom first btc second  third usdt,1
a week ago a month ago a year ago bitcoin,0
inverted bitcoin year all time high yud,-1
buy ford bitcoin buy money lose wisdom,-1
btc goes k abc back bring alt,0
see bitcoin again see the doubt disappear,1
Let's play the smallest sad violin song in the world,-1
much control emotion also as right btc,1
exchange irresponsible token list moon allowed to die,-1
Everyone bought k not to sell back,1
buy in writing dip btc btc ftm ftm,1
think retest k region that seems likely btc,0
larry dunlop kirk mappherson regan judson btc,0
Eye open kid don't give fund manipulator,-1
"Well, that's what's going on.",-1
hold a lot of time really complain a lot great benefit,0
still pre rich phase bitcoin btc crypto,1
afaqshah philakonecrypto wishing bad bitcoin rude,-1
mullvat vpn email log name take bitcoin,1
a week ago a month ago a year ago bitcoin,0
bitcoin bullrun could do indexbtcusd shytrader btcusd,0
price update usdt hour btc  xrp,0
beffjin of a shitcoiner buy bitcoin save shitcoins,1
a cristopher lambert Highlander bitcoin right saylor,1
Happy Friday Fiat is still useless bitcoin,1
food thought btc crypto stay let sink,1
people trash xlm think long term beyond,1
dogecoin b although everything goes a lot others,-1
use the real coin hell lot place could,1
btc girl nft world btc nft,1
trader branding profit market bitcoin cryptotrading,0
Tell crypto currency to invest bitcoin back,1
I have to say shit suck the btc trade,-1
break publish newsletter pleb stacking sat bitcoin,0
brand sweet william gallacher sheila freeman btc,0
The high rate of ethereal gas makes it worth using,-1
bitcoin go higher long support bittampbtcusd signprovider,1
Yep youre right can't come to the conclusion as,0
btc keep line binancebtcusdt minameisjeffxyz bitcoin btc,0
I have to think year cro still early,1
Cryptocurrecy of bitcoin crypto exchange no kyc,0
actually sent the wrong bitcoin direction wow fml,-1
"Dude, one care, Alt could be banned.",-1
Creo opinion crypto summed up effectively simple lol,-1
ready to get put cryptominer pop btc maintain k,0
shit coin shit coin nothing nothing laugh nichts,-1
general rule fyi will never reveal much internet btcrypto,0
big market image bear means almost nothing btc,1
Rogerkver really disappointed bcash headline million expensive friend,-1
got a lot bigger unless you bought it the last two weeks.,1
bitcoin bull soon sent epic mission bitcoin moon,1
loyalty add bitcoin exhibition traditional magazine etf bitcoin,1
think btc bitcoin see telofxs idea trade vision commercial,0
Last month annoying price high get another race,1
New York mine bitcoin home stand pointless protest,0
"Go say you want freedom, so keep Stevienicks Bitcoin.",1
test bitcoin hidden dark corner serving the criminal vehicle,1
lost money every purchase of crypt was never sold,-1
Damn dream keep track Idk hate to fucking sleep,0
mega bitcoin dump starting right x btc short,0
cryptobusy snakeftking good luck brother bitcoin twitter crypto,0
encryptoverse again in a precise prediction of short-term bitcoin,-1
crypto crash trend twitter bitcoin fall dogecoin bitcoin,-1
rolandstautz bitcoin real cbdc decentralised currency cryptographically backed,1
cryptos would remain market territory bitcoin ethereum,-1
Ballenacointalk probability bitcoin extracted life uncertain turn,0
bad news bitcoin decrease current rate usd btc,-1
ta time btc btc know supercycle wave mode,1
bad news bitcoin decrease current rate usd btc,-1
usdt worth bitcoin sold big order at last minute,0
get really tired bipolar bitcoins bitch like btc,-1
lots of energy used people masturbating bet a lot to listen,0
free economy equal access to create free world btc,1
small game win big btc btc stock crypto,1
"Oh, yeah, you're right, he seems pretty dumb.",0
apomplian normal bear season btc k landfill,0
support real passive support anything good that will probably come,-1
change of detail h low h high bitcoin btc,0
goingparabolic drop imo well opinion other bitcoin hodl,0
bitcoin block byte transaction btc rewards visit information,0
knowledge potential becomes power becomes energy use btc,0
spend bitcoin flex bitcoin faster way le bitcoin,0
m portfolio negotiated took k crypto bitcoin discipline,1
bitcoin latent monetary energy moment of explosion ready stopped,1
Bito bitcoin fight trade tdameritrade etfbitcoin billionusd period,1
marriage Christmas all bitcoin crypto update bitcoin btc,0
think btc bitcoin see tradinghubs idea tradingview trade,0
two regulated exchanges lcx eos bullish lcx btc,0
arcbtc steefbtc another time bitcoin amazing work steefbtc,1
tesla currently millions of bitcoin investment buy dip eon,-1
love get people irritated a hobby look at the story,0
coindcx cree btc ogn outperform resto crypto December,1
Many times people burn to learn trust boy,-1
marble does not know bitcoin love love marble bitcoin,1
open investment trade bitcoin btc investment weekly profit,1
Stone Ridge firm archived file sec mentions bitcoin,0
stevephilipsmd mangan bitcoin say shit one take buybitcoin,1
You don't mind broken bitcoin badly arranged tomorrow thinking,-1
humanifold blockstream shesek sorry Bitcoin interested best coin,-1
Cryptohayes im bet willing will not see btc k,-1
go long term btc  coin buy imo,1
Drewpflaum bitcolncash Bitcoincashfund bchmeetups sorry Bitcoin interested in cash,-1
yobit yobit scam steal xrp blocked answer post,-1
wrong never to remember anything in fixed term lesson learned,-1
go long term btc  coin buy imo,1
panama could offer discount use channel paid btc,1
Ceo making false promise problem that bitcoin king,1
purchase of currency alt let begin discussion cryptocurrence of bitcoin,0
Save the shares appreciate Malawi beneth sneakerheadsoff nft btc rates,1
hot price arrive spring binanceusdt wildbill bitcoin crypto,0
Nothing like receiving slave bitcoin best collect tribute,1
excited to bring chainbytes bitcoin atm leybitcoin nayibbukele bitcoinbeach,0
Get binance personally lost faith like blocked money,-1
bitcoin quantity granted miner reduced half day approximately,0
Ninny Bitcoin Bitcoin conversion goal fiat pointless price,0
good time for the good luck of lrc,1
dead bitcoin crypto tweeter fake va rekt enjoy,-1
America right carry gun state wants oh wait,0
shhhh cash app king le know better lol,0
Last minute shit better tv that's for sure,0
you need to buy anything takes the result of the profit you sat,0
Welcome full trip btc btampbtcusd voxhit bitcoin btc,0
i insurance purchased gbtc roth anger account loyalty,0
new york bitcoin mining clamp recently passed bill,-1
lead today's gun show hopefully buy bitcoin ammunition,1
bitcoin gold still don't understand gained much value,-1
determines bitcoin price good reading market dynamic look,0
pretty safe transaction blockchain orchestrated bomb dump,-1
work im even think bad bitcoin solution also,1
btc maxi running output k bitcoin shitcoin link,-1
long term may be the short-term goal of the year,1
scratching itchy game make you learn investment general economy,1
Breakout bitcoin new time high indexbtcusd trader btcusd,1
downer thing Bitcoin right retailer damn dip,0
bitcoin currently commercial resistance zone please care longsbtc,0
I think that's enough sub moon advice. Nail coffin.,-1
cheat bitcoin trading sheet failed however btc btc,1
buy moon deserves financial ruin pure boy scammers,-1
bitcoin h rejection h bassist retest see you,0
bitcoin block byte transaction btc rewards visit information,0
drilling equipment reporting past next core australia stop,0
historical price bitcoin today February th via twitter,0
coinbase pro allows to withdraw the direction withdrawal of bc failing,-1
Feel better movement of the thing in positive direction bitcoin btc,1
Sounds even bad Lol which is something worse game,-1
wsbchairman dogecoin click the button below elonforpresident Eastmankodak kodk,0
bitcoin btc crypto btc oh oh wake k,1
levioo kingsalman btc entered bullist mtn next medical chain,1
shaky day crypto market right btc binance ftx,-1
u drop ball bitcoin crypto regulation sec commissioner,-1
Today bitcoin fear rate of neuter greed cryptocurrency,0
"Hey, Mr. Whale, please pump bitcoin position underwater.",-1
Another exchange celebrated fucking Native Symbol Valueless Attacked,-1
positive sign halfway down little the next day pumping,0
probably popular opinion criminally understated monero spoken enough,1
thedustybc don't know yet nobody knows job btc,0
btc kraken transfer wallet unknown tx blockchain btc,0
much learn to enjoy continuous learning go along bitcoin,1
bounce back fucking crazy speed bitcoin recovery fall,1
symptoms of methamphetamine addiction humanity disconnects nature bitcoin way,1
bitcoin mining finger operation spark lake local concern,-1
Lady Crypto Bitcoin b cheap next week day minute,-1
cryptotechnology drive clean energy global warming bitcoin via,1
bitcoin block byte transaction btc rewards visit information,0
Winning unless you're very lucky with pure play.,-1
bear gloating cave friend see yall next ath,0
think final official drainage swamp run  btc,0
bitcoin grabs k fed signal up speed bitcoin,0
Wassup larry sad seen withdrawal time wins annually,1
Layahheilpern correct Chinese Communist Party bitcoin please know,1
Tyler Hero still tonight hot bet game btc,0
Bitcoin ready asleep woke up everything he wanted problem,1
sell bitcoin also earn heavier bitcoin sell hodl,1
backpackers model them going to get real job  btc,0
colarb tresolas deitaone gold moving backwards btc,1
mayor conger jackson tennessee convert next bitcoin paycheck,1
really interesting going back year sub reading thought,0
Huge volume btc probably break old ath k,1
yes definitely compare bitcoin v gold volatile term,-1
valkyrie liquidate btc et f fin october btc et f,0
evaluation of the possibility of large-scale bitcoin bullfighting cryptonews bitcoin,1
follow many people lose mind stick plan btc,0
ledger vote good ledger best doc hardest fucked,0
Sea shell could call the sea shell exchange,0
Elon Reason Doge Perpetual Dip since the appearance of the snl,-1
binance made around bitcoin lost forever bitcoinboton binance,-1
Even worried wrong making money back in a month,1
coinsquare thanks opportunity stpatricksday bitcoin coinsquare tag utksrvstv,0
person indicate Republican edit nvm after checking history,0
purchase order distributed in the bear market game accumulate,1
bitcoin alert pause strong bar m oct am,0
feeling of fallen pain bounced off a lot btc pattern,0
Bitcoin Bitcoin Bitcoin Bitcoin Bitcoin Bitcoin Bitcoin Bitcoin Bitcoin Bitcoin Bitcoin Bitcoin Bitcoin Bitcoin Bitcoin Bitcoin Bitcoin Bitcoin Bitcoin Bitcoin Bitcoin Bitcoin Bitcoin Bitcoin Bitcoin Bitcoin Bitcoin Bitcoin Bitcoin Bitcoin Bitcoin Bitcoin Bitcoin Bitcoin Bitcoin Bitcoin Bitcoin Bitcoin,-1
really sad to see money right charge two years,-1
bitcoin block byte transaction btc rewards visit information,0
coin coin renbtc usd  darknodes fee btc usd,0
helpful bitcoin tips saying buy id ended up charging,1
kirthpal deitaone more chances of increasing bitcoin next month,0
Like said idiot bitcoin holding rgbo very soon,1
whalert get ready buy btc shoot atta boy,1
czbinance pidgin translator no dey control bitcoin network,0
crypto signature prepare pause activity ethereum fusion bitcoin,0
trying to shock price buy cheaper cryptocurrency bitcoin cryptocrash,-1
life really easy get vaccinated buy btc,1
Ununderstood curiosity going home taking a nap seems nervous,-1
bitcoin lost half the value since hitting high record,-1
Bitcoinpizza would be worth the last hour Bitcoin,0
dollar average cost position bitcoin grandkids thank you,1
bearwhale sold for the value of bitcoin btc bitfinex cash market,0
um bitcoin constantly improves the root in fairly large evolution,1
Oh hai crypto trader keep calm hodl btc,1
kwon collect billions collapse biggest scam in labor history,-1
btc was k k everyone speaks k opinion,0
