text,sen
documentingbtc recent announcement of ban on mining China creates new crypto advantage mining btc all panic that the purchase of opportunity bitcoin was btc btc tradng signal frm robin moore whatsapp,1
the construction of the foundation kai ecosystem enlist takes vietnam new era defi achieved short period of time circumstance kardiachain team continue delivering massive user incoming btc  kphi dpet,1
easy peasy open tha dizy bitcoin path week bitcorn pricing h tf analysis said the first dead dance Zerooo supply area caution remember flip short dead man dance,0
bitcoinmagazine wendyrogersaz new Argentine facility vast much of the global bitcoin farms bitcoin mining production considerably lower expected cost add infrastructure capacity mw accommodate mining a bigger btc mining world,1
uve lesson learned today won loss year chosen portfolio graphic check plus next couple of months however bitcoins home bomb het huge news ath everyone start fomo,1
Ask tech people think blockchain vast majority tech experts finance recognize cryptography scam hey excar seller ceo routinely get second security fraud problems knowing they're talking right,-1
cryptonoticias ciudad rio de Janeiro brazilian assign city treasure bitcoin valor shop mayor eduardo paes rio announcement recently made brazil country next accept btc tender lmk,1
all crypto market cap friend absolutely better indicator know company com publicly quoted new a point right to know website relatively new great scheme thing right,0
under construction lake satoshi get preparation work done advance establishment first cabin place displaced road bank slope clear road first many cabin rented bitcoin lake satoshi come,1
btc spot limit order high end k wave reasonable lowball spot limit order open place made th June im banking u dancing inside goblintown nightclub lulz,0
cryptoscanner btc  ksm trx lrc xem dash comp kc chz omg grt hnt amp miota wave neo leo crv,0
larger purchase would suggest buying usdc coinbase transfer binance taking advantage rate higher purchase suggest purchase bnb offer even higher discount buy binance assuming havent binance used,0
oliviacryptos bitcoins volatility index ready another massive move next week could start new price trend keep eye bitcoin christainsbtc super underestimated bitcoiner taking seriously great advice tweet follow,0
reduction cost per storage unit already surpassing big bitcoin blockchain growth never happens main storage bottleneck computational bandwidth cost synchronization chain scratches sp weaker device similar raspberry,0
btc still try again top ascending triangle wicking ultimately trying to stay side negative long fine fuse closure daily happens that what you need to confirm success third attempt of retest btc crypto bitcoin,0
visa suspension service Russia paypal suspension service Russia suspension service Russia suspension service Russia mastercard suspension service Russia bitcoin still serf Russia a cryptocurrency cryptocurrency stop cryptocurrency shibtoken btc mattwallace,1
urobro bitcoin volatility index ready another massive move next week could start new price trend keep eye bitcoin kycee super underestimated bitcoiner taking seriously big tweet follow kycee,0
saylor feels like bull still control im celebration swing scalp long pointing k after rachelwolfson tweet prediction tip learned much mind revenue investment btc great tip tweet help,1
Monday August hr moscow time supply a lot btc in real time blockchain price u worth coin u b buy a lot u worth btc blockchain price btc in real time less service fee,0
recent human history complete catastrophe caused nation State control bird wake up stuck present thought linear cannot see forest tree humanity but broken free bitcoin escape valve promise hope,1
btc clean breakout top range trading week consecutive pleasant retest support sustained breakout wait dip shallow continue higher wave lavax brwl opt moon kara vra trias ax agreements,0
See decrease return each cycle definitely expects to decrease rate x also interesting to see cycle upper upper cycle top data point limited can mean absolutely nothing to observe btc,0
Everybody quiet shit bitcoins made to reach the new height people act like they never submerged recovered investment treated investment looking fast bomb dump well already done goofed well could hodl,0
anthonyavinesh saylor btc previous range of life support rebound maintained the vivid hope recent fall daily ema ema reaffirmed robust selling edge best time buy trade dip scotro telegram scot,0
tldr key public used lock Bitcoin key private used unlock spending nothing really blade blockchain source daily use helps evolve Bitcoin kiarabickers Bitcoin clarity bitcoin philosophy upbringing love,0
kennyligthart michaelsaylor miketyson man gold security fiat payment gold could pay physically possible bitcoin obstacle overcome able to integrate the function game sector solves much bigger problems good luck brother,1
Speculation of the investment ist ponzi scheme there underlying business generation of profit assets appreciate the reason future price rise someone else see price increase wish speculate continue to increase complacent ist,-1
step no btc centralized exchange head as coinbase buy some step youre list open kernel extension click on background sign click on bridge click on bitcoin drop menu click on add bitcoin,1
Since reading literature blockchain potential web technology crypto exposure could brainwash read risk assessment conviction blockchain technology stay really doesn't care about the currency coming anytime soon tbh,1
Therealtahinis ive waiting year some figure out petrodollarlar haram btc halal move el salvador sharia bitcoin revolution tail halal cc maxkeiser stacyherbert need all series show thread,1
bitcoin still holding d ma red looks like whale really defended know close probably get big sale maybe keep back green April monthly btc close let us see,0
They don't understand Bitcoin real Bitcoiners never sell fiat also the main thing that calls fiat real money I knew that money would really understand Bitcoin harder shape money planet ever seen,1
bitcointine bitcoin volatility index ready another massive move next week could start new price trend keep eye bitcoin maximejosh super underestimated bitcoiner taking seriously great advice tweet follow,0
altcryptogems handle the wealth of profit that sustains bitcoin time people say they never won they never recognize the difficulty that sustains the dip multiples btc get never k beyond what gained follow nbtc tweet tip btc,1
want to give a listening lawrenzelepark knock park cover the entire host macro theme potential recession rotation brics European currency energy crisis Japan bitcoin whole lot let us know how to think,0
best return investment shares though volatile without borders transaction much better apy stacking crypto leaving money bank protection inflation local currency local currency loses value as for fifteen days point,1
satoshi place manchester goal educate on board user bitcoin space offering food drink workshop game art desk hot event support merchant bazaar bitcoin concentrated center built education connect support,1
rovercrc checked btc no price bullish still the market is still unstable however find pptorn vault auto compound apr maximizes the user deposit torn increase reward benefits reduce gas rate bullish,-1
I guess Iran wants to buy cheap btcs trying to keep the price low by taking cart cost of energy v mining yep need day conclusion buy better hurry price stay low long time,0
Crypto taught too no Crypto term also general life stopped smoking fiat useless things learned humble saving living healthy thankful Crypto im always happy to see other good,1
startonium czbinance binance bitcoin deeper immersion old resistance area effort flip new weekly support area retest progress btc super underestimated bitcoiner ive taking tweet tip seriously ive excellent,-1
nftholding Darrenpromoter btc consolidation around k level bassist impulse exhausting lowest short term possible liquidity leg grip k k likely follow kimcaden underestimated bitcoiner tweet tip help,0
"garycgorski saylor potus federalreserve time preference way low bitcoin purchasing power increased last year, while usd decreased less strong fiat currency btc start forced volatile a time arrives",1
scottmelker btc broke last ath currently k finally bullfighting phase waited a long time yes alt follow everyone follow btcided super underrated amazing bitcoiner write Twitter tips follow,1
btc btc open interest positioning large short position cut still net short non professional trader wildly long typically medium market delete revers asset manager super bullish could save no pros,0
Let them forget about lot blowing people prediction September back was pushed December might well get pushed March June seems that the thing can get extended rolling top btc think,0
keepmillen see bitcoin little by little become a currency bank substtute play gold paper early day btc fiat thank you stellajeffreyfx know a lot to come btcoin tweet useful prediction thank you take time to educate u,1
uzyn ldfimember defichain see bitcoin etheruem ultimately become reserve currency bank playing a lot of paper gold bank early day could issue digital money greater anonymity efficient dm investment whatsapp,1
bitcoin update btc finished colliding rebound range flipped support back light resistance range lower k price lost as it continues fairly clear downward trend still intact bounce k relief rally btc,-1
interesting thread final question quote harariyuval sapiens imagine simple example Mr. greedy financial set bank mr stone contractor city finish first great job receiving cash payment thousand btc cryptocurrency,0
total lack of intrinsic value purchase of raw materials money backed country economy always intrinsic value time low value hanging on investment wait storm crypto investment could go smoke could lose everything,-1
dmtland easyfinetwork iluviiumio ferrumnetwork dmtland btc break recent high would also result in rupture of the long ascending triangle confirmation  nft easy renbtc kpr bitcoin slp akro crypto cvp xrp easyfinetwork,1
may seem terrible right gon na make no change yet fund buy but lot cryptos right sink swim break careful project start fold lose lot of liquidity btc cryptocrash,-1
want sell btc cash raise nk fund emergency right pls any line of time purchase discount guaranteed agreement made through video called one one sega rondo pls helps to retweet urgent someone,0
coindesk starbucks xpolygon jamiecrawleycd  look ready good rebound coming day under k bitcoin k I think celebrating go k soon check follow keshgover yulll definitely learn a lot of genius guide,1
bitcoin up early in the morning long term see a way bitcoin price goes that if you also feel way to get ready bitcoin leotard launch carry bitcoin orange pride passion btc,1
many broken alt much greater crucial support lifetime support like bel akro unfi soletc jamy etc try back life support not consider mini alt season bull rally cryptocurrencies btc alt,0
btstocktrading short cover eod tomorrow proceed June th bitfinex almost b short position took the highest point two years of porcelain right extra miner repression short cover btc hr left bitcoin,0
davidgokhshtein hi david update shib worrycup memecoin hold looking btc guess perfect time giving shot ccd I have m mc wish purchased list kucoin still chasing x anyway concordiumnet defi,0
base no future belief thinking level risk involved associated shilling manipulation cause upset people could easily go tomorrow yud didn't leave anything maybe worth punt though the type invesmtent sound discussed,-1
chiqshoes gandalfcrypto warpigstoken cryptodeb lot people are not ready opportunity strike buy dip bitcoin always recovers patient enough follow anthonycrypt many better understanding value investment tweet profitable rate of profit,1
Making money don't hate taxes kr don't hate bank want to buy land crypto mine waiting bit cardo spin much don't worry hiding profits gladly paying taxes like all life,1
careful stock bonds real economy bitcoin detached all cyber light cure swarm cyber waspero gon na fly moon beyond human form become pure energy ok Michael youre punished,1
magdahromii techdev data analysis show k minimum bitcoin final cycle thing to prevent happening apocalypse giant asteroid hit earth entire energy network hit accident thing happening cycle final btc,1
garrettgroce bustarhymes double whybitcoinj agreement love bitcoin obvs fantastic real project utility worth investing that are competing btc which huge defi problem allows creator of artist content to make more paid,0
buyer lost last week trading bitcoin im back range bias lot ppl claimed a lot of loss coming soon im yet profit planning buy back lower price eye spx up!,-1
what is special date date fixed supply holding gains bitcoin passively bitcoin dat think itll form base of the future money layer put btc hand passive investor empowering dat btc cryptogems crypto,1
level of explosion of bitcoin last rally of the long chart pattern signal since July risk fading im still making commercial sign of profit given robin moore telegram moorerobin copied trade was btc btc,0
bitcoin holding firm crypto June made way through cheerleader seller find meme trader player finally find serious guy that makes sense to say worried fed print money c mon really headache,-1
Mexican billionaire ricordo salina says a factor makes bitcoin btc gold superior through the current newspaper top trending news bitcoin frequent share strong commitment through social media insight btc btc,1
losing sale loss holdled last market bear continued buying dip along the way purchased lot youre s wealth hodl accumulate repetition whenever it is possible to ignore prices talk otherwise speculate btc,1
hive hut bitf btbt great opportunity to buy btc mining stock was benefited throughout the execution of shares sell hallelujah has recharged all other worries hang onbitcoin probably back ktoday week,1
Junebigwonx faultffiat Bitcoin submerged deeper old resistance area k effort flip new resistance catalyst next rally betc bassist report start buying keep simple ive taking btceth ta tweet seriously follow,0
wojfinance bitcoin k area of broken resistance could see k next week would confirm long-term bullish vision hodl buybitcoin everyone however follow xhl super underestimated bitcoiner great tip ta excellent,1
btc update hate to say look bitcoin make new low daily wait close morning confirmation could change time to different view a previous proposal k good goal imo btc crypto,-1
krakenfx crypto millionaire greatest philanthropist world ever seen know how nothing im still work minimum wage job discount shop despite gaining heavily crypted follow Bernidoranfx guide btc earn tip tweet,1
patiently expects bitcoin to make mind people running around the world brings new structural adaptation of behavior btc yesterday adaptation cococola allowing bitcoin payment selling machine australia new zeal and personally speaking starbucks coffee,1
Yeah im alt ridiculous I don't know what's going to grow up one getting stellar looks good even month shit one can be more fun random thing one actually last month you never know,0
to wear day a fantasy patty mill best three points shooter lega nemanja bjelica goes second class fantasy season player there sarcasm obvious not to make serious list change one day hodl nba btc,0
Brettinthewoods price looks crazy high response hate unit bias closed mind road lead shitcoinery short time preference fiat gain instead could have made Twitter account read bitcoin standard stacked sat,-1
Funny thing is that people already added liquidity to see something explorer folk and put money hidden money unless the associated portfolio say case point people buy even clearly labeled packaging smells a lot like,-1
crypto high risk investment would not receive anyone 100 crypto created unique purpose attractive investor bomb devs people promote cash leaving all other loss crypto reason goes a lot of opportunity burned,-1
personal prediction bitcoin the next day today has lot volatility due to CPI data almost millions of dollars are settled to get a strong support each time k show bullist me ta btc crypto btc,1
bitcoin passes price mark for the first time since it can crash last week bitcoin constantly recovering lost ground over the last three months and ethereal increasing even faster to buy cryptocura in cash using flexepin prepaid voucher,1
Ceo panteracapital important hedge fund predicted massive rally bitcoin year saying investor fled shares real estate bonds crypto danpantera also add institutional property greater market value make btc le volatile,1
bitcoin daily update timeline btc downtrend bear lose power also afd indicator printed signal lower since June rsi also exaggerated divergence bullish sign today also keep control cpi,0
capable of sending funds to another country instantly without problems without environmental impact mobile wallet interface clean knowledge of zero inflation decentralised network security fund safe theft inflation give warm feeling blurring each time,1
jajaja thinks the whole industry of dangerous cryptography destructive scam run idiot profit idiot stupid cost I think im defend anything laughable idea someone thinks advertising false way reasonably looking for remedy any pumpkin,-1
"However, seeing case of useful use come crypto cant made without easily the people jumping  will not continue to be decentralized and the centralized government will never leave happy playing field for cryptobros already dead end to a basically useless side",-1
Mattstirner get pass fact btc old gas puzzling technology basically obsolete compared new blockchain technology as the theory behind the utopia btc society without conartists whale shark as saylor musk could really work,-1
well wrong to say ive pretty bass player bitcoin however wyckoff model look bullish get k btc still think well see bigger story of traction carpet k could crazy good weather pump alt soon,0
Pewdagoat Frostytheproto nft Bitcoin Oh sorry I can't hear Metamask's trusted portfolio was lost nfts my stolen need sugar dad well forgotten say account currency base was hacked attendance note get hearing job,-1
U fiscal political economy from showing crack or presidential elections over going to jail re-elected tank or economy means triumph not getting re-elected triumph tries to do nothing despair chaos btc better place keeping wealth,1
btcarchive thks man caribbean nation st kits nevis can adopt bitcoin effective legal course go prime minister country say consider the introduction of bitcoin effective legal basis even though within territory pioneer cbdc dcash,1
sober bitcoiner triilionusd skwp might want self-empowerment through self-education btc btc search for donation follows controversy influence im mere grateful pleb ty skwp took day never seen case border make mine,1
Ponzi new money printed used pay money old not lot last utility value people use tool crypto worldwide use fundraising investment xborder sending micro payment defi nfts hundred million people btc,1
cryptohelp surprisingly unstable value would need to convert cash to real liquidity also speaking using cryptoform exchange developing nation year still adopted upside down cryptoform send money lot disadvantage,-1
wjvalk invertanswers fossgregfoss jeffbooth Canadian started to buy canadian spot etf inside tfsa capable orange pill amazing wife changed buy direct bitcoin shakepay movement cold storage thanks investerswers jeffbooth fossgregfoss others for helping,0
story based if knowing guide would expect to see reduction volatility thing adjustment fork drama stability start to be standard would expect gradual price increase people feel safe to enter water in half approach,1
far away possibly know even speculate advance made bitcoin basically still paid bitcoin fee continues advance even small fraction rate away rate replace current reward value massive volume transaction occurring,0
p note added two column think useful day of balancing change also added third volume column average day cannot really explain tweet thinking new data provide valuable information in the future go btc,1
long btc lot general institutional money retail investor you lot big financial money btc crypto general think completely go lot cash would splash real low value altcoins keep next year,1
Text number again said good sound please give solution to the so-called new bitcoin problem might actually use guidance getting phone will try chain throughout the day pretending stupid maybe giving false seed,0
makeroftools muatafagmi adamus blockstreamtalk people fun quickly forget money technology money book accounting keep scorepow problem bitcoin solves just score sound money decentralized way linear accounting book everything else layer,1
need to see btc make strong hour close k also short term high k daily level near bull send btc greater resistance day k bull must break k week k also important,0
trap sell k go k night think about putting money keep little case big crash booking buy new currency course market sell shock time open champagne long term bitcoin always win,1
selling bch gdax right unfortunately that the use of exchange today does not affect btc right seems to remind someone explaining key two linked some people trying to sell bch accidentally ended up sending buyer bch btc problem,0
crypto immature market high degree volatility traditional investment keep the day of growth trade people keep even staying probably should not day negotiation crypto average significant return crypto average difficult to fit into the accepted investment strategy,-1
allows you to check the metric behavior mass drop maybe many people thought btc fall k area bull run ended broken bitcoin k level pink k at puell multiple near blue box could not break up,0
hr bitcoin price divergence update still upward divergence dating back Nov th pm st lol short term well see prices retests pink dotted projection divergence along the confluence fib recoil well see game,1
sure people who think btc casually go k lot left low low low low low took the path of gain less resistance lower range of going down almost half a year range of value lost imo btc,0
cash app nice little one stock bitcoin app great hard cash also rate bad bitcoin buy get like fee love cash app one reason stock cash app through bitcoin slip,1
still see completely speculative instrument vacillating underlying active call at rest value technology could fairly quickly adopt blockchain federal reserve banking system seeing unregulated market likely faces regulation at national international level advance,-1
no one convince people panic sale of people reference huge triangle down monthly graph yes theory of technical analysis say break massive support hard fast kk price k support become massive resistance decide u want to bet,-1
going x remember tweet watch graphic buy big bag bitcoin btc sol doge shib keep nu xec zec dent hot bnb om og vet xrp ada polx poly pond link,1
Diversification seems that recently got enough traction is not going to die many young people who believe to buy traditional political etf finance people mentioning etc. also cool said portfolio small part despite going up despite paying im prepared go,1
btc harmonic update takes the level of profit k resistance strong area confluence annual open point market structure breakdown can break lower low short term operator cost base tp clear level tp next lvl k,0
price of altcoins low im still quite new skim seems general attitude towards altcoins pretty hard btc altcoins viable option well,0
jhonny covering as slow drags tel vra claiming lost territory seeing massive expansion until thinking tel up cent vra around cent see taking ath assuming course btc remains strong claim k short get rekt,0
bscpitbulltr bscpitbull pitmagcommunity bscpitbullkr pitbullbsces target billion market value end of year safe community token burn bitget bit mex latoken cointiger zt indoex swap pitswap pancakeswap nchnetworkswap k holder bscpitbull bitcoin btc,0
keep btc ta simple watch tmrws wkly close stay k followed wkly open close k full candle body upside down follow stitch near wkly k followed wkly open close wait test background grn box,0
im super bulldozer point better keep imho love team love technology ecosystem growth good pace instance ive tonkering parallel finances lately really how thinking will see great thing polkadot future good luck point headline,1
preparing waking rude great short November point covered became expensive to see big jump November yeah hasnt paid back btc clear side sell every book order every important exchange take u well k,1
olmeg adybug cryptovizart ittechpl blaakke therealplanc onchaincollege janwues cryptobirb piofostapowicz ekryptowalut wlementeiii mernest kraken ftxusderivs bitfinex everyone celebrating announced first future btc and f said that it happens to invest money making for a long time short circuit complete regulated environment,0
Yes btc crash run sadly lost btc never k seriously doubt hey one knows for sure anything possible im review probably think btc pink the last time downhill stop around k would be better not expert guess,-1
ive hodling dcaing around year long space know still extremely happy position chad purchased k need to stop crying notice bitcoin welcome Thunderdome bitch can't handle erratic swing go buy Michael Kor stock closed shit,1
im super bulldozer point better keep imho love team love technology ecosystem growth good pace instance ive tonkering parallel finances lately really how thinking will see great thing polkadot future good luck point headline,1
