text,sen
cash ano erdon btc im pretty sure cryptos scam made the train jump bombo,-1
value inchain bitcoin spent currency utxos is worth btc transfer of internal exchange very likely,0
ashwsbreal back load bull broken k resistance k very soon bitcoin k imminent,1
as willy read tweet notice really vague a lot of time really provide a lot of detail,-1
crypto invoice incoming Russian Ministry of Finance Public kick comment period btc cryptonews nft,1
world becomes worrying unpredictable great comfort knowing always another block like watch bitcoin,1
say go day trade does not matter anyway the price goes year course despite,0
bitcoin btc mining nate food co compra sj pro bitcoin mining news,0
see bitcoin consolidation waiting last week ethereum look even better technically bitcoin ask,-1
bitcoin needs rest needs time to learn surfin bitcoin panel through Bigcoinpge bitcoin cryptonews,0
mythical game increase of millions series c funding round led to az bitcoin bitcoin news,1
dip win suddenly worried people k minimum eoy btc hodl chill invest bitcoin,1
It's going to sell im gon na get fat bitcoin sell people it's going to call whale,1
kristinekrypto top bag beyond massive dfi defichain rising decentralised bitcoin finances sounds great,1
ok ban really happened to think price still strong considering Bitcoin btc ctm,0
Crypto implode celsius go  takes beating billions of lost coins know that the coin base made announcement,-1
Although identical af play imo highlighted area diagram hypothetically bitcoin simpleta,0
Gradybooch bitcoin does not belong to exchange exact reason twitter genius know every abt ting,-1
good news bitcoin cme recently dump closed breach due to increased number of CPI expected,0
markmoss federally regulated currency go all bitcoin created many idiots making crypto worse,-1
bitcoin plan btc week rest looking for mid-k return label possibly k weekend,0
ahmadosiddiqi read yarn say gold standard best Argentine propose people improve life bitcoin,1
typical rbitcoin user used granny birthday money buy btc he cries it,-1
Not seeing would sell moon righ people have a chance to sell instead of obviously taking,-1
btc btc k sabbatical bomb destroyed k Monday retest fill the cme space perhaps,0
bitcoin still measured foam of clear beauty reaffirming last month could still go b,1
good bounce straight btc telegram channel jasmine crypto premium btc  bravo,1
absolutely love bottlepay application beautiful look ui recommending companion bitcoiners stackkinsats btc,1
michaelmwebe besieged president nmwendwa busy trading bitcoin crypto edin new business swerriapp,1
developer ecosystem  make one seems community  let fail easily adaptable,1
themooncarl lost BTC level missing the biggest inari opportunity accumulating last week tokeninari inariraffle,0
buy for currency everything sold a month ago helped buy bigger house,1
andydestroyer do not buy btc bsv bitcoin do not follow advertising crowd and and speak kurtwuckertjr,-1
coaction cohabitation the salvador bitcoin law can change global finances cointelegraph magazine cointelegraph cointelegraph,0
Centralbanktrf turkey followed by El Salvador see economy deflation immediately think btc btc,1
whale stacking ape ftx sand bond ftx bullish feeling hit crypto market bitcoin,1
big rally relief bitcoin seller imminent losing confidence say cryptoanalyst nicholas merten,-1
cryptocrash bitcoin investment without base crypto currency run computer institutional structure aman agrawal Wednesday thought,-1
Sending friend bitcoin worth seeing long take sending nano worth seeing long take,0
bitcoin ethereum xrp is worth looting massive crypto exchange hackeo ethereum bitcoin via,-1
btc little bomb rejecting r mentioned above link video sub already havet  tradingpsichology,0
Every coin out of bitcoin ethereum invented just making the creator rich would be a different one.,-1
Mention bitcoin devsusersminers trinity keeping control of something po coin dont user obeying devs,1
demand bitcoin go logically start replacing the fiat coin perhaps a global reservation day,1
Time-split matter although bassist sound believes to survive true winter crypto many alt,1
see bad lmmao bad accept everyone glass ball with negative vote think know what happens next,0
microstrategy put another m bitcoindeepite price crash k via cryptocurrency microstrategy bitcoin descryptmedia,1
utc btc btc btc btc btc btc btc btc btc btc btc btc btc btc btc btc,0
yep as always say scrolling coin talking next version ipad lol take time,1
What's a big deal can't really bitcoin use of legal course bitcoin never controlled legality,0
cryptocurrency that sends monthly newsletter since it says mobile app release next week bitcoin btc,0
btc process initiated speeding up realization mirror reflection sky earth within the perception btc evangelist,1
as seen the past couple of days being manipulated big corporation fucking fear last time,-1
finally nice to see bitcoin designed past daysweeks overvalued stock market bitcoin popping still,1
I want to make money as a sure future problem keeping copping bad press that is safe,-1
e-mail me mrbeeeekshodlrodeo perezosa bitcoinización bitcoin btc,0
ive used kraken small x leverage long roll over quota every hour seemed expensive,-1
apecoin is going to be worse shib version is to say enough bomb still dump logic reason,-1
the possibility of dumping to get worse the burning that goes well the supply of the circulation has not changed the currency,-1
Riseño bitcoin cap baby day one brought worth instead of laughing millionaire even,1
Holding firmly get better take under diving shot moon cryptocurrence binance bitcoin,1
Every move makes every ship risky to navigate risk made able to face courage,1
mattwallace elonmusk theoreticalroot say put bitcoin dogecoin multiple coin watch time be adopted,1
metaufo best aerodrop never as an incredible project ashenafimeaza gautamgambhir flintoff bitcoin utk tct,1
"Remember, ""bitcoin never lowers favorite CT influencers.""",-1
baltimaire oriole adley rutschman provides spark gun hendersons arrival flippin bitcoin sportsbook,0
Someone understands bitcoin to hold on safely arent explosion k feeding bassist enough pain please,0
Found good house another bitcoin print paid want trade art btc let m,1
Part first bitcoin increase longs accumulates final period return price exactly started drop,0
gm everyone chooses to build the future better system stop building bequeed bitcoin revofico technology,1
uselessly called symbol of greed boasting apy see spam continuously rcryptomoonss investment absolutely safe,-1
small chance btc price could hit k say trader or cool dollar bitcoin,-1
kshib long alert ticker kshib market kshibperp volume price btc btc,0
live scene petergwall typing march operational update rn new mine rig churning thro,0
new feature helps report misleading bitcoin misinformation people like elonmusk mcuban thanks jack,1
history always produced the hero's despair deeper despair greater hero appears bitcoin,1
billionusd bitcoin seems bassist metric look still bullish to think of coming to new year,1
bitcoin triangle bad sine June th really missing volume pump cctipcom airdrop,-1
Massive love exodus never saw the coming reality feels blessed alhamdulillah exodus portfolio cryptolibertad bitcoin,1
love technology damn cool mix current technology next gon na continue wild ride,1
bitcoin joined Asia last night because Asia doesn't give a shit about the infrastructure bill.,1
balance feed view k usd btc later imo btc bitcoin cryptocurrencies btcusd,1
btc short deribit btc perp learning business wants friend getting dog carl icahn,0
bitcoin always working finding new shitcoins always working finding new under understanding,1
looking tesla market saw tesla model smoke dodge demon impressive investment ethereum bitcoin,0
It's going to sell im gon na get fat bitcoin sell people it's going to call whale,1
hang up irl past happy day see bomb btc little today another weekend lost,1
collision two stars creates black hole happens bitcoin collisions defi portalfinance know answer,0
"Therefore, generally higher return higher risk higher risk",1
Saying that the next two years will slowly receive moon token supposed confidence two years,-1
average daily active user average long-term price positive action volume,1
short alert ticker  market perp volume price btc btc,0
Central African Republic adopted bitcoin reference currency office Presidency btc cryptonews nft btc,1
Just sub boy made guide do shitcoin literally called pumped point surprised buttcoin,-1
apomplian country wish would replace old fiat mind leader personality as nayibbukele bitcoin,1
People soon realize that shitty order coin like ada pump must pump bitcoin first,1
never calms down see net worth taking absolute nose diving in real time epic bitcoin,-1
insurance hash price rate thinks btc min regular supply rate remains consistent,0
btc leaf tweet derivatives every min cme delayed min g delayed min oi share,0
good cryptotank electric consumption waste produced along the immense side apart spectrum crypto use,-1
welp hell realize where the community does not back up project fails to finally implement burning lunc conjecture,-1
purchased cro first time start tank the next day the entire crypto market learn the lesson,-1
You got the bitcoin pump wrong for two weeks. Don't wait for the bomb for the next two weeks.,1
I absolutely don't want to worry though unfortunately worried enough or dollar im happy bitcoin celebration,1
bitcoin mempool tx stats last hour median max th quant nob block th,0
reality raoulgmi maggielake perhaps asked incorrect question correction bitcoin media dow nasdaq stock market,0
btc leaf tweet derivatives every min cme delayed min g delayed min oi share,0
panic put money deposit house gon na cold right believe bitcoin go tell family,1
Preach happy brother ltc finally take interest in the privacy approach decision factor keep ccd monero,1
bitcoin mempool currently mb transaction expects block total share transaction sat medium rate satvb,0
want to learn central banking work petrodollar printed money really get circulation etc book recommendation,0
btc leaf tweet derivatives every min cme delayed min g delayed min oi share,0
Russian cryptographic market is worth b despite bad regulation say exec cryptocurrencies bitcoin technical analysis,1
Elonmusk fix money make child affordable jeff chata bit system place bitcoin technology help,1
safe leave node without secure supervision make sure turn monitoring assist bitcoinconfeur tabconf bitcoin lightingnetwork,0
btc free signal future input btcusdt le x max put max future total tp,0
sold bought many occasions red wallet since it started game right shark know trap code,-1
First bought bitcoin honestly liked the idea of sending money online without confidence way seemed revolutionary right,1
prediction fact back can price action following pretty close hope continues aave bitcoin crypto,1
citizenbitcoin think bitcoin sale ask someone who buys invest crypto secure strategy achieve financial objective,1
bitcoin btc bitcoin hit k ahead July inflation report a fractal track that is coming correction,0
btc hovering k today fed rate increase base point announcement historically highest year increase,1
trolling serious advice don't want to lose money means you don't owe anything yet much,0
btc leaf tweet derivatives every min cme delayed min g delayed min oi share,0
viable reset eot look good march away let the computer manage the price time cycle remove,0
people dca alcohol every weekend many things buy excessive waste unnecessary battery sat btc,1
bitcoin has close to the fib area everything looks like bullish key obstacle hitpass see behavior btc,1
Just might happen one would think short stack thing needs to happen long grip,0
want to learn central banking work petrodollar printed money really get circulation etc book recommendation,0
cryptoednl tend to agree however rational btc seller would not sell bulk volume long or weekend,0
btc leaf tweet derivatives every min cme delayed min g delayed min oi share,0
Maybe half how to get dca fast maybe the daily shopping really wants to go,1
started to play it seems very good also the idea of love getting coins anywhere believe big,1
btc leaf tweet derivatives every min cme delayed min g delayed min oi share,0
time live use crypto game site buy illegal even ball pain get sorted,-1
btc price get squeezed lowest low hour high distance break determine next direction,0
bitcoin btc perp oi climbing funding dive negative rebound seems short circuit could be fun,0
as the way to think to buy log cabin fam also go homeless cat need room stay,1
philakonecrypto bitcoin could illegally found child porn link embed blockchain maybe reason panic sell,-1
tesla tesla bitcoin bet performance increase ed take bank real vision finance business the,0
hmmmm raoul becoming cathie fanboy I'm sorry maybe always pay close attention to Arkk tsla bitcoin,0
channel well still valid nailing atm btc channel medium market structure turn up min,1
bull take control should see the price quickly go back to visit k bitcoin btc btc  bnb,1
Russia implement Internet disconnection plan internal address limit medium hashrate btc go therefore price,-1
bitcoin bull despair leader model predicting path bitcoins still say triple-digit stroke btc,1
I have to someone else bag holder shitcoin bail bad choice grow upbtc crypto celsiusnetwork,-1
simple dogecoin simple method of payment crypto nothing fantasy too complicated anyone understands the greatest strength,1
absolutely amazing things fan investor bitcoin company thanks woonomic provide u pleb great information,1
"Okay, I don't mind believing that the point of wanting to make an overstatement seems like something wants to believe.",-1
India crypto change btc trade volumehours zebpay btc coindcx btc wazirx btc bitcoin btc,0
aave exchange short alert ftx market aave perp volume price btc btc,0
cryptocurrency community resisted pressure sell give up hope bitcoin altcoin dip greeting go ahead prosper,1
bassist watch range cautiously exaggeratedly bullish low retest range seems likely bitcoin btc,0
btc leaf tweet derivatives every min cme delayed min g delayed min oi share,0
News breaking Central African Republic passed bill adopt legal course bitcoin amp as domino,1
senlummis integration of bitcoin priority proposal hope mix altcoin ethical security company trying to capitalize moment,1
Ananavarro made money btc altcoins learn to earn growth money complain to follow through telegram cryptysophia,1
bitcoin first crypto player decentralized market that is good people also uses many options throughout,1
enjoy the annual rush people who want to go to the gym many ideas last month selfies incredible amount,0
bitcoin mempool tx last summary second median max th quant nob block th,0
know every sale there right buyer buy fears desire greed could dca way dca,1
btc leaf tweet derivatives every min cme delayed min g delayed min oi share,0
Imagine impact bitcoin automated growth beam node management take hahaha fiat shitcoins go poof,1
Well see something good security related prices happens good shit happy investment good future,1
Danheld bitcoin savings account also Austrian tax bitcoin gain ups buy today trade bitcoin,1
cryptengineer heard strikex bitcoin immersion strikex constantly increasing big thing happening big strikex official project,-1
I hate finance bros took bitcoin linked fiat bitcoin could inflation cover financial assumptions bros,-1
long alert point trade ftx market point perp volume price btc btc,0
k combination of bitcoin btc short settlement last hour huobi k binance k bybit k,0
atom long alert exchange ftx market atom perp volume price btc btc,0
really ask strange important question sure get answer well meaning probably needs professional advice,0
Chinese Central Bank Bans Bank Offering Financial Service Could Use Commercial Cryptocurrencies as Bitcoin,-1
followapp omg game lots of fun getting better first time guy sat metaverse followapp btc,1
still slight bitcoin bullish divergence launch tick toe circle indicator win cryptocurrency indicator,1
depends again ath hit k sup back k end point one predicts future,0
btc leaf tweet derivatives every min cme delayed min g delayed min oi share,0
galyblack unless elonmusk introduces integrationtech solar tesla makes bitcoin mining much more efficient in green energy,1
"Remember Michaelsaylor borrowing millions buy bitcoin k Michael, please send a condolence bear",1
knownews bitcoin  major Australian baseball league team perth heat payer bitcoin,1
Looks like cathie autosmash buy mode level millions of gbtc shares last week bitcoin,1
btc leaf tweet derivatives every min cme delayed min g delayed min oi share,0
btc broken k support im hearing inversion applications uninstalled twitter cority gon na die,0
James Dimon remains skeptical bitcoin declaring bitcoin regulated government click on jumpwealth texasadvisor bitcoin detail,-1
Stay focused consider objective would not regret trading cryptocurrency bitcoin btc bnb huge inevitable adjustment,1
minute look like btc price fed ratehuke already maybe slow people today react bitcoin,0
bitcoin mempool currently mb transaction expects block total share transaction sat medium rate satvb,0
cortrobinson anarchocanadian comicsmith patrickbetdavid guys want total wealth plugged in bitcoin network easily stay decentralized,1
btc leaf tweet derivatives every min cme delayed min g delayed min oi share,0
btc usd move multiple address unknown wallet date blockchain bitcoin symbol btc detail,0
He has hen shell do two weeks maybe interest rooster thigh three eggs each,0
good portion alt really built hereum first advantage of the really good mover today wouldn't do it,1
btc nayibbukele presidesv bought the savior average price worth millions of times buys worth millions,1
do not panic sell dip remember shib pour x pico buy cryptocurrencies btc shib diger,1
bitcoin mempool currently mb transaction expects block total share transaction sat medium rate satvb,0
high return interest winning crypto loan program already large enough to become huge disruptive cefi,1
Silk road bitcoin hiding used pay ross ulbrichts millions of fine decipher actadi btc bitcoin,0
bitcoin mempool tx stats last hour median max th quant nob block th,0
second case second case order of wave judge release hinman speech ethereum nfts cryptocurrency bitcoin,0
monero coin genuine use case serve purpose without influencers shillings continue buying the bear market,1
blockchainchick equalizer system without confidence bitcoin human currently central banker caused incalculable miseries all over the world,1
food reached pure idea of capitulation bitcoin go next can enough pain bull up ash,0
future wife jus gave uncle work hand dry thought Bitcoin fall in meanwhile im bitch,-1
pwthornton bitcoin fan fuck fdic big government regulation also bitcoin fan shit spent money,-1
Stop checking crypto price rbitcoin back everything back normal but shit keeps hitting fan,-1
Tither order secret open not enough shock fund will eventually take everything big,-1
short alert exchange ftx market  perp volume price btc btc,0
somewhat short alert exchange ftx market something perp volume price btc btc,0
silly dogboss airdrop new round total airdrop pool worth dogboss airdrop bitcoin di youtube,0
btc leaf tweet derivatives every min cme delayed min g delayed min oi share,0
last year shit bitcoin magazine trying to create big shop conference scammer fucking affinity,-1
swan good place to buy bitcoin love os stand end day tariff high price marked,0
bitcoin fall k trader say bull needs hail Mary avoid bear market bitcoin through,-1
obviously digging green today a little disappointing to see bitcoin win faster than alt swear that people learn,1
btc really interesting reacting time feels like relief due to negativity around the extremely high market,0
The total ceiling of the cryptogram market continues to break down the dollar index reached high year crypto bitcoin cryptocurrency,-1
Feels touched sell wall knock knock knock kool help man break sell wall ohhhh yeahhhh,0
money launderers arrested u dubai million stolen cryptocurrency bitcoin good job law enforcement agency,-1
Need little first crypto mining really finished work piece argoblockchain arbk arb mountain bitcoin ethereum,0
hastecoin result many family members who pay the price fight end compliance bitcoin solution largely clear,1
new video subscribe emergency alert powered central bank binance pump central bitcoin xrp socket altcoins,0
bitcoin bear market can take btc price k say trading shares due capitulation bitcoin via,-1
As a stable thing stable currency name go yes really fixed dollar more many did not care,-1
Wait k week buy next two week sell k wait until get k get hodl,1
Alcista scenario goes exactly displayed latest video youtube subscribe do not miss bitcoin cryptocurrency update crypto,0
joshyoung jameshmackay think bitcoin different well anti cryptos looking forward others burning bitcoin growing ash,1
bitcoin price movement great victory next week the cautious trader can catch cryptocurrency news via coinjupiter,0
fix money fix world bitcoin bitcoin generation wealth short film mate horny tomer through youtube,1
btc last block block information keep transaction total bitcoin including block reward block size byte,0
play get cashback play betfury higher range cashback amount get user betfurysuccess bitcoin stacking,1
hodl crypto show amor valentine accounting book unisex t-shirt buy today free shipping find cryptoconfection bitcoin,0
takes two things bitcoin happy private key secure extend horizon of time than the material purchase price,1
rektcapital btc case would close week sail wick word quit back upp k Sunday midnight,0
podcast longer hour minute rambling bitcoin crypto btc matysats cryptocurator mashinsky alexandrelores infinitytimesme kryptovski,0
enemy monetary system base money transfer creation of bitcoin-directed scarcity born put or free enemy,1
The power of money widening the wealth gap is not an accident to use bitcoin empire oligarch really easy to understand,1
many people tend to sell the price of retention get high enough mortgage pay retire meet the life goal,0
deeply understand bitcoin realize complete perfect project of preservation of wealth global solution still experimented including ethereum,1
Today snaps news topic medium competing crypto btcoin bitcoin analyzed general article medium negative feeling,-1
has cause of erection bought dip noobies boy running screaming sale made money lost cause noob,1
looking indicator could according to the extension of the top blown fibonacci letter k range year bear market,-1
Seeing a lot of people calling k support band to the bottom bull market goes k would mean party,0
Crypto im from afar found money transfer box come mind defi good money cost far away,-1
btc bitcoin primary trend remains right bassist primary cycle support k Thursday die day btc,-1
symmetric triangle zrx h tf wait touch red line decided whether to enter btc bitcoin cryptotrading,0
congratulations reached level of understanding of bitcoin no one knows many level im level beautiful bitcoin invention ever,1
The world's largest market for bitcoin cryptocurrencies lost trade in general suffered wide sale losing billions of forbes,-1
the last time you visited rterraluna completely invaded independent moonbois and yet people contemplate the mind suicide hallucinating,-1
highest dca k month ago dcaed k im still costing average btc bit k bit,0
Damn career k really happening tidal wave institutional money flooding every possible sector fear missing,1
long entrance yfi price stop loss telegram channel link bio tz btc bitcoin lrc inch,0
profit away minute btc trade short decrease stock published would recover higher published,1
try to find good information bip article sketched a well synthesized concern final thought sounds bad,-1
omnifinn princeysov lucky bitcoin hit chronology luck swallow orange pill luck lucid goal road future,1
bitcoin hope love many people buying investment son long grandson neices nephew hope love,1
defacto gold stable year really satisfied tested exchange mechanism chosen gold verify token burn process,1
natbrunell araksya foxla inflation ruin long-term investment unless investing something btc gain value time,1
first trial of the dumping season since January btc barely moved alt arnt even medium value January,-1
man rupture comes btc ethereum gala sand mana lrc shib vet trx sol xrp ada,0
advisor president Colombia call bitcoin brilliant software piece always bitcoin magazine bitcoinmagazine btc colombia cyptopotato,1
level of trade given advance to achieve great movement still respecting technique bitcoin btc cryptocurrency trade,0
Good vechain shill counts don't say or youre mean dirty thirty inhabitants from below could say,-1
sheldonevans btc  strategy holder loan hodlanautdotcom earn decent amount interest fund secure withdrawal free,1
btc last block block information keep transaction total bitcoin including block reward block size byte,0
Bitcoin derived data suggest that bitcoin crypto bitcoin bitcoin bitcoin bitcoin bitcoin bitcoin bitcoin bitcoin bitcoin bitcoin bitcoin bitcoin bitcoin bitcoin bitcoin bitcoin bitcoin bitcoin bitcoin bitcoin bitcoin bitcoin bitcoin bitcoin bitcoin bitcoin bitcoin bitcoin bitcoin bitcoin bitcoin bitcoin bitcoin bitcoin bitcoin bitcoin bitcoin bitcoin bitcoin bitcoin bitcoin bitcoin bitcoin bitcoin bitcoin bitcoin bitcoin bitcoin bitcoin bitcoin bitcoin bitcoin bitcoin bitcoin bitcoin bitcoin bitcoin,-1
Internet allows the transfer of information around the world bitcoin allows the transfer of money around the world incredible revolutionary technology,1
Haha lucky number given mine big win betfury quantity usdt user name babygun betfury success bitcoin stacking,1
