text,sen
network always stronger before price follow soon,1
im will still smoke buy Bitcoin,1
raspberry price kicker btc lightningnetwork Bitcoin,0
take seller of parts do not deserve lol,0
Bitcoin agriculture ocean fire inbox open,0
Miss k Bitcoin coming back tonight,0
low price crypto is not gone,1
beautydehelin bought btc hodling next option,1
btcusd shorted binance utc btc cryptocurrency,0
or bitcoin bitcoin bitcoin bitcoin bitcoin bitcoin bitcoin bitcoin bitcoin bitcoin bitcoin bitcoin bitcoin bitcoin bitcoin bitcoin bitcoin bitcoin bitcoin bitcoin bitcoin bitcoin b.,1
any brain stacking much possible straight,1
plan to invest small amount each month,1
check ousd look great moderate return,1
bennsimmo hegde global adoption Bitcoin domination,1
congratulations youll do all the time p,0
btcusdt shorted binance utc btc cryptocurrency,0
Action Bitcoin Attack Hope Free Society,1
I thought I'd have a better chance in mid-July.,0
as decentralized crypto nature win pleasant,1
People thank the buy bitcoin eth bnb,1
Bitcoin long entered btc coming bull,1
obiwankenobit Bitcoin year compared last year,1
Bitcoin price currently crypto btc btc,0
quantumbrix ipfs built bitcoin im interested,1
mistalented corner nation top bitcoin,0
The guy of the week feels something huge happening,1
development Bitcoin change btc crypto ada,0
"Lol yeah, he's not selling hodl shit.",1
crypto future purchase simple and simple perish,1
cute feelin could buy bitcoin idk,1
Everyone knows the bluewallet allowing the withdrawal still,0
xlm really work well exchange transfer,1
watcherguru wclementeiii a decentralized bitcoin protocol,0
many have exchanged alt btc success k,0
crypto nerd know the Bitcoin farm Tarkov,1
anyone has juicy Bitcoin video conference,0
btc Bitcoin situation as graphic btcusdt,0
cryptoptimist btc put top rich world,1
never share a seed word no one ever,0
best website read live crypto news,0
last round previous interval number ath,0
btc btc eth eth bnb bnb bnb,0
hodlonaut see word buy bitcoin see,1
amitkhemka doge wala also like Bitcoin,1
iohkcharles bro sell cordano buy btc,1
"There's a lot of law, a bad thing.",0
billionusd hear still bitcoin available buy,0
think really need to wait for an answer,0
feeling like amm Bitcoin cryptocurrency planb,0
laynio laynio as a bitcoin simpson,1
need a drop k lol thats coming,0
haha enjoy optimism enthusiasm thread realistic,1
update Bitcoin prices cryptocurrency btc source,0
close the high time today btc crypto,1
It's not trying to convince someone good.,0
pretty nice daily rebound btc btc,1
Bitcoin weekly graphic update btc jclcapital,0
called e-mailed Senator cross finger Bitcoin,0
Bitcoin technical score btc Bitcoin technical score,0
lot bitcoin lil bita doge ethereum,0
illovejaneadams chance to buy Bitcoin year ago,1
Today xmr equals btc monero privacy,0
dogecoin Bitcoin crypto doge friend all,0
btc btc eth eth bnb bnb bnb,0
does not think to understand Bitcoin invest work,0
btc price change h bitcoin btc,0
Thinks of feeling bitcoin bull,1
low buy make the difference hold Bitcoin,1
another opportunity to buy btc cryptocurrency shib,1
hawaiicryptogod as Bitcoin love dfichain,1
like original digital gold know bitcoin,1
ok basically Bitcoin enjoy bitcoin ride,1
best practice sparrowwallet bitcoin should read,0
random term bitcoin glossary bitcoin btc,0
"Anyway, you keep buying sitting.",1
btcusdt shorted binance utc btc cryptocurrency,0
buy fear Bitcoin k financial tips,0
eh wasn't expected referring to today low,0
keep patience fomo based min chart,0
btc telephone booth accepted soon enough,1
true beauty crypto cant printed government,1
Bitcoin read complete bitcoin analysis cryptocurrencynews,0
get rough cold see the money go up,1
ascension baby give u ringing weekend,1
rovercrc hell yea baby dracarys bitcoin,1
still bullish dogecoin favorite room right,1
next time say u buy bitcoin,1
btc Bitcoin back k lows earlier,1
high-time frame look zoom bitcoin,1
elonmusk to come clutch btc Bitcoin crypto,1
Bitcoin minor preparing to take maraplane,1
Bitcoin offers crunch action love see,1
Hello intensified today Bitcoin fix,1
great way to bring money to help ukrain,1
jasonplowery bitcoin hope better world brother,1
Bitcoin already traffic btc remaining mined,0
wish several times as much time as possible,1
Officialtravlad fait Sir mufc bnb btc,0
update Bitcoin prices cryptocurrency btc source,0
love see btc btc respect your,1
umm doesn't say word man soon,0
btc breakout binancebtcusdt tawfiktrading bitcoin btc,0
btcusdt shorted binance utc btc cryptocurrency,0
btc btc eth eth bnb bnb bnb,0
peterdiamandis many others I hope Bitcoin certainly,0
pizza day beat record john bitcoin,0
btcusdt shorted binance utc btc cryptocurrency,0
Bitcoin stable stock has chosen the stable,1
mkbhd looks a lot like Bitcoin Altcoins,0
feeling like a quick wick to come btc,0
btcperp shorted ftx utc btc cryptocurrency,0
Staying scared wants btfd ltc btc,1
Bitcoin change planet Earth particular part,1
hi believe Bitcoin give financial freedom,0
id say dot worth investing well,1
polygon lowno cost ethereum good book,1
Percentage of investment portfolio currently allocated Bitcoin,0
btc crypto country legalized Bitcoin cryptocurrency,1
there is also possibility btc Bitcoin btc,0
published letter bitcoinmagazine education girl bitcoin,1
Binance market market hangs crypto btc,0
Bitcoin Daily Point Fulcrum Daily Negative,0
like Bitcoin currency pay attention price,1
fun doesn't make sense looks like,0
assuming that there is no paper hand unfortunately a lot,0
crypto all need to win root smooth transition,1
Whaleert guard transferred several hundred portfolio btc,0
guide uncertain market crypto btc bitfinex,0
absolutely nothing from the user parts base of the parts base btc eth,0
bitcoin thought btc see danilbovs idea tradingview,0
work still driver of delivery make figure year,0
update of the price usdt hour btc eth xrp,0
Bitcoin extraction recovery btc go Bitcoin binance,1
paulserious kinghoward still domain think bitcoin fix,1
would rather Bitcoin gold medal btc,0
safe ready to buy blood btc btc bitcoin,1
zerosumx sundhaug hacked bitcoin using something weird,-1
sale k always happens pile time btc,0
recommended yesterday went a lot today b btc,1
whale can't handle like selling sorry btc,0
recover zero from recovery plan soon,1
Well gon na end up breaking the rule well,0
the bear of waiting runwell says panda run btc,0
Bitcoin bnb important binance crypto new year,1
airdropteam bnbbull Bitcoin dao beautiful project peacekelly,1
Number of txns taking place btc Hullish network,1
Yep time to accumulate big guy btc eth,1
apompliano apompliano kevinolearytv pretty stupid come btc,-1
buy dip of which go btc bnb b,1
Bitcoin absolute piece of shit slow technology outdated,-1
btc usd unknown portfolio transferred unknown portfolio,0
Remember folk says Bitcoin scams good times,1
Accumulate even better price next week,1
retweet want lunc hit year Bitcoin cryptocurrency,0
Remember exactly that the party started to reach late,1
computerart bitcoin blockchain last block height see,0
Forget bitcoin moving altcoins analysis volumeprice movin,-1
xrp drive price forecast continue overperformance bitcoin,0
great post-reasonmetric see supply shock October,0
lbrycom there is reason another need for a bitcoin,1
long position dydx pump socket btc btc,0
the value of the thought shop where the value goes btc nothing,-1
it happened btc pumped k btc crypto bullish,1
big fist of ureocratic iron look small man,0
Love continue to fill bag Trash price,1
Bitcoin went to us yesterday last bitcoin,1
invested but bitcoin regrets saying no one says,1
It's quite possible to think that people in retreat are selling.,0
thought k fabulous video dancing Indian man,0
bought first Bitcoin today your learn well,1
rdrlfe yea my buddy called payment go bitcoin,1
Bitcoin excitement event Scotland follow jimduffy Bitcoinconfuk,1
joecarlasare Bitcoin latest free market price bastion,1
the whole market receding red the last few weeks,1
btc market share member of the family hold on,1
get popular Trezor hardware portfolio a Bitcoin,0
seizing satoshi staying the market will never fall,1
glorified ponzi system waste people time electricity,-1
week graph like a graph of the year,0
buy july watch fly btc cryptocurrency crypto,1
advisor shares the latest company Bitcoin file future etf,1
buy Bitcoin cant sell half sell none,0
swing trend btcusdt minute delay btc Bitcoin,1
bitcoin square treasure worth usd bitcoin usd,0
btc daily weekly a gon na wins,0
the Saylor flag cross the travel time h btc,0
Bitcoin can last much longer academic warnings,-1
Thank you for spreading the word monero really everyone portfolio,1
Bitcoin new ath soooo close careful hour,1
Damn btc all red all-powerful red,-1
Bitcoin treasure microstrategies worth usd bitcoin,1
whale already along lol btc bitcoin,0
steveinmanuic fbi bitcoin steve protect your neck,1
elonmusk please say positive Bitcoin green wallet,1
btcusdt m mcd cross btc btc bitcoin,0
there is no price that needs to simmer boiled,0
everyone double control address anyway good reminder,0
inverse crater index officially confirms Bitcoin moon,1
soon day of new dinosaur went off btc,0
cryptoshillnye hey fucking trx next bitcoin slut,-1
k Theory of holding back test k,0
usdt potential scam quite large demolished crypto,-1
alexdreyfus cointelegraph turkey country crypto token avocado btc,1
k wick clear want news drived dip,0
way to speak same room noise speculation bitcoin,0
last support line bitcoin luna btc,-1
Bitcoin woke up the lol day but down the neck,0
oc demo via youtube libonomy interoperable bitcoin,0
Follow advice producing large content Bitcoin fix,1
You agree to try to think that reason was made.,0
lot chitcoins substance put casino black anyway,-1
means please stay like Bitcoin v spx,1
theelongwave gjbangar bitcoin asset safe advantage confiscated,1
bitcoin thought btc see xcvbss idea tradingview,0
cryptosea moov dotmoovs to come soon Bitcoin Binance,0
short even by probably increasing one way or another the saved option,0
crazy thinking Bitcoin commerce since the game of the year,1
price updated usd hour btc eth xrp,0
houston astros v texas store Bitcoin bet,0
perfect morning store buy fucking dip folk,1
btc stimulus is worth btc hr change bitcoin,0
"In fact, although it would bounce earlier xd",0
bitcoin thought btc see dessisiontrades idea tradingview,0
altcoindailyio Bitcoin crypto crypto exists without Bitcoin,1
path year bitcoin real change expectation continuation,-1
Bitcoin brainwallet python recovery tool python bitcoin,0
largo plazo bitcoin btc eth ada link,0
nikcantmine neiljacobs let buy bitcoin k fine,1
word regulation triggering cryptocurrency bitcoin community lol,-1
order save market need satoshi make appearance,0
walltreetsilv argentguru orswitzerland digital gold bro Bitcoin,1
here known bitcoin bottom bull glove trap,0
terra bad investment cryptos operate ponzi system,-1
anyone buys directly trezoris best exchange transfer,0
Maybe change basic result low ban change,0
Beautiful bitcoin next week looks good,1
opinion though start small win bitcoin smart,1
btc usd basic currency transfer unknown portfolio fed,0
limit buy money app buy Bitcoin went,0
Nothing proud that everyone knows sorry man btc,-1
bitcoin thought btc see worldlzws idea tradingview,0
btctokoloshe kendallnear magdawierzycka know well bitcoin ngmi,0
k Bitcoin btc short liquidation bybit btcusdt,0
Bitcoin shapelifting right active bear bull passive,0
arrived btc lost support btc crypto Bitcoin,-1
wtf dream see btc bnb eth dream,-1
cryptomichnl still think to see bitcoin point usd,0
bitcoin thought btc see navidmemaris idea tradingview,0
sooner trash fall better fuck Justin sun,-1
market of bulls haha miss even Bitcointf bitcoinetf bitcoinetf bitcoinetf bitcoinetf bitcoinetf bitcoinetf bitcoinetf bitcoinetf bitcoinetf bitcoinetf bitcoinetf bitcoinetf bitcoinetf bitcoinetf bitcoinetf bitcoinetf bitcoinetf bitcoinetf bitcoinetf bitcoinetf bitcoinetf bitcoinetf bitcoinetf bitcoinetf bitcoinetf bitcoinetf bitcoinetf bitcoinetf bitcoinetf bitcoinetf bitcoinetf bitcoinetf,1
wait shibaiinucoin go bonkers beat bitcoinfun watch,0
Eth your built alt suffers crazy fresh,-1
btc price h change stonks bitcoin btc,0
another arrogant prick algorithmic stable break-up inevitable,-1
ar satoshis right satoshi ar right Bitcoin,0
Bitcoin hitting weekend give lucky follower,0
oops leave emotion locked box somewhere hodl,1
bull run between u bitcoin signal bitlord,1
doge corner buy doge chitcoin buy bitcoin,1
think bitcoins the volatile cash youe delusional,-1
danheld cagr infer financial freedom thank you Bitcoin,1
thought btc Bitcoin see Maleknafaas idea tradingview,0
Bitcoin stopped trying to divert bitcoin attention,1
bitcoin thought btc see fxcms idea tradingview,0
crypto market update available Bitcoin ethereum crypto,0
crypto giving u avenue financial world passenger,1
make think asset overvalued two last years,-1
Damn market sick cryptocurrency crypto btc Bitcoin,-1
even help the bitcoin way crash make bulls,1
bitcoin thought btc see aryanouris idea tradingview,0
defantnews camirusso ftxofcial question Bitcoin negatively affected,0
crypto wild ride high low doge hodl,1
binanceus attention exchange of dust cleaning costs btc,1
newborn revolut tho obtained kraken currency base loan,0
check the list of opensea articles via opensea Bitcoin,0
btcfuel btc always bullish fud bullish signal,1
someone tip investing Bitcoin crypto investor today,-1
bitzippofficial project good project bella mohdshaanu nsnoman,1
do not live altcoins a lot cause become homeless,-1
Lol sort of rule can't make a joke,0
Eudora funk byron archey bart jim btc,0
Ashbit listing pancakeswap day bitcoin binancesmartchain bitcoinashtech,0
think that shib will work much longer tbh,-1
bitcoin thought btc see pnchans idea tradingview,0
yeah dat i Nott looks good bitcoin,-1
Every Altcoin scam you diversify you're a victim,-1
Monero best currency game change your mind,1
btc eth ltc algo solid starting point,1
thinking bitcoin change lot life read pioneercryptocurrecy,1
bitcoin danheld make one day take together,-1
price updated usd hour btc eth dot,0
Magicia magic playtoearn metaverse bitcoin diamond blockchain,1
bollinger break btcusdt minute delay btc bitcoin,0
Bitcoin daily closed sr wait to expand today,0
drive gokart fun buy nft Bitcoin ethereum,0
altcryptocom first btc second and third usdt,1
week month ago year ago Bitcoin,0
Bitcoin invested year there are all the time high youd,-1
buy Ford Bitcoin buy money lose wisdom,-1
btc go k abc retracement bring alt,0
Watch Bitcoin come back to see the doubt disappear,1
let play the smallest violin in the world of sad songs,-1
a lot of controlling emotion also as right btc,1
exchange irresponsible list young authorised die,-1
Everyone bought k doesn't sell back,1
Purchase in writing dip btc btc ftm ftm,1
think retest k region to air probably btc,0
larry dunlop kirk macpherson regan judson btc,0
Open eyes guys don't give a fund manipulator,-1
"Well, that's what happens. People panic when they sell.",-1
hold long complaining really a lot of profit,0
still pre rich bitcoin phase btc crypto,1
afaqshah philakonecrypto wishing bad on impolite bitcoin,-1
mullvat vpn name e-mail recording take bitcoin,1
week month ago year ago Bitcoin,0
bitcoin bullrun could make indexbtcusd timingtrader btcusd,0
update of the price usdt hour btc eth xrp,0
beffjindel a magnate buy bitcoin save magnates,1
a christopher lambert bitcoin highlander right dilor,1
Happy Friday fiat continues to become worthless bitcoin,1
food thought btc crypto stay let go,1
people waste xlm think long term beyond,1
dogecoin b although everything goes a lot more,-1
using the real currency hell lot place could,1
btc girl nft world btc nft eth,1
trading ticking away profit Bitcoin market cryptotrading,0
say crypto currency invest Bitcoin return,1
I learned to say it was trading btc.,-1
Break publication newsletter pleb stacking sat bitcoin,0
sweet brand william gallacher sheila freeman btc,0
Ethereum high fresh gas make the value to use,-1
Bitcoin go more support bitstampbtcusd signalprovider,1
yep youre right cannot come the conclusion as,0
btc hold line binancebtcusdt mynameisjeffxyz Bitcoin btc,0
the year of reflection is still early,1
non kyc exchange bitcoin crypto crypto cryptocurrecy,0
really sent bad Bitcoin address wow fml,-1
"Dude, alt treatment could be banned.",-1
believe opinion crypto summary effectively lol simple,-1
Prepare to put cryptominer pop btc hold k,0
Shit piece shit piece nothing nothing nichts,-1
fyi general rule never discloses much btccrypto internet,0
big bear market means almost nothing btc,1
rogerkver really disappointed bcash holder million expensive boyfriend,-1
has become much bigger unless you buy two last weeks,1
bitcoin bull soon sent mission epic moon Bitcoin,1
Loyalty add Bitcoin traditional exhibition etf Bitcoin magazine,1
thought btc Bitcoin see telofxs idea tradingview trading trade,0
Last month annoyed high price get another race,1
new york mine bitcoin house stand protest nonsense,0
go say want freedom well keep stevienicks bitcoin,1
Bitcoin proof hidden dark corner serve criminal vehicle,1
loss of money every purchase of crypto has never been sold,-1
Dam dorm keep track idk hates sleeping damnit,0
mega bitcoin dump starting right x short btc,0
cryptobusy serpentnftking good luck brother Bitcoin twitter crypto,0
incryptoverse again a precise short-term prediction Bitcoin,-1
crypto crash trend twitter Bitcoin fall dogecoin Bitcoin,-1
rolandstautz Bitcoin true cryptographically supported cbdc decentralized currency,1
cryptos would remain the market of bears Bitcoin territory ethereum,-1
Whalecointalk probability bitcoin exploited uncertain tour of life,0
bad news Bitcoin decline current rate usd btc,-1
your time btc btc know how supercycle wave,1
bad news Bitcoin decline current rate usd btc,-1
usdt is worth Bitcoin sold great order last minute,0
become really tired bipolar bipolar slut like btc,-1
a lot of energy used people masturbating bet hear a lot,0
free economy equal access create a free world btc,1
small game win big btc btc stock crypto,1
"Oh, yes, you look like an idiot.",0
apompliano normal season bear brother and sister btc k discharge,0
actual support passive support anything good to come probably,-1
details change h low h high bitcoin btc,0
goingparabolic drop imo opinion other bitcoin hodl,0
Bitcoin block byte transaction btc rewards information visit,0
Knowledge potential becomes power becomes the use of power btc,0
spend bitcoin flex bitcoin faster way the bitcoin,0
portfolio m exchanged taken k discipline crypto Bitcoin,1
Bitcoin money latent energy ready burst moment stopped,1
Bitcoin ready trade tdameritrade andfbitcoin trillions of puntocripto,1
wedding Christmas all bitcoin update crypto bitcoin btc,0
thought btc Bitcoin see tradinghubs idea tradingview trading trading,0
two regulated trade lcx hullish eos lcx btc,0
arcbtc steefbtc other bitcoin amazing moment work steefbtc,1
Tesla currently million Bitcoin investment buy dip elon,-1
Love getting people riled a hobby look history,0
coindcx believe btc agn overperformance rest crypt December,1
Many times people burn themselves to learn to trust,-1
canica doesn't know bitcoin love canica bitcoin,1
free investment trade Bitcoin btc weekly investment profit,1
stone ridge confidence deposited dry deposit mentioning Bitcoin,0
stevephilipsmd bitcoin mangan say fuck we take buybitcoin,1
doesn't care bitcoin broken wrong fix tomorrow think,-1
humanifold blockstream Shesek sorry interested Bitcoin best coin,-1
cryptohayes im willing bet will not see btc k,-1
long term btc eth parts buy imo,1
drawnpflaum bitcolncash bitcoincashfund bchmeetups sorry interests bitcoin cash,-1
yobitexchange yobit esquerie fly xrp blocked post response,-1
evil never restore anything from the fixed-term lesson learned,-1
long term btc eth parts buy imo,1
panama could offer discount channel usage paid btc,1
ceo make false promise problem that Bitcoin King,1
alt Coin Purchase Let Start Bitcoin Discussion Cryptocurrency,0
hold stock enjoy illawi pricesben sneakerheadsoff nft btc,1
hot price reach spring binanceusdt wildbill Bitcoin crypto,0
nothing like receiving Bitcoin slave best tribute collection,1
excited to bring chainbytes bitcoin atm leybitcoin nayibbukele bitcoinbeach,0
get binance personally lost faith as locked money,-1
bitcoin assigned minor reduced about half day,0
ninny Bitcoin Bitcoin goal conversion fiat price without meaning,0
price thinks good time get Irc good luck,1
Bitcoin dead crypt tweeter fake go rekt enjoy,-1
America right weapon state transport want oh wait,0
shhhh the application of king cash know better lol,0
Holy shit last minute better TV than it's for sure,0
need to buy anything take profit result the sat,0
Welcome full trip btc bitstampbtcusd voxhit bitcoin btc,0
It is certain that the fidelity of the account gbtc roth will have been purchased,0
new york claw bitcoin mine newly passed bill,-1
cannon position show today hope to buy ammo Bitcoin,1
Bitcoin gold still don't understand gained much value,-1
determines bitcoin price good reading market look dynamic,0
im almost sure transaction blockchain orchestrated pump dump,-1
im work even think bad bitcoin fix also,1
btc maxi running output k bitcoin chitcoin link,-1
long-term could achieve the year's short-term objective,1
scratch itching game make learn the general investment economy,1
Bitcoin breakout new time high indexbtcusd trader btcusd,1
low bitcoin thing right retail trader creepy diver,0
Bitcoin currently trading resistance zone please care longbtc,0
think enough advice under luna nail coffin,-1
cheating bitcoin trading sheet failed again btc btc,1
buy luna deserve financial ruin guys pure fraudsters,-1
Bitcoin h reject h lower tester retest see you,0
Bitcoin block byte transaction btc rewards information visit,0
the drilling team reporting the nucleus past next australia stop,0
historic bitcoin price today February e via twitter,0
cornerbase pro allows removal bc address withdrawal failure,-1
better detection thing moving positive direction Bitcoin btc,1
even bad lol is something worse,-1
wsbchairman dogecoin hit follow button elonforpresident eastmankodak kodk,0
Bitcoin btc crypto btc oh oh wake k,1
levioo kingsalman btc entered bullish mtn next medical channel,1
shake day crypto market right btc binance ftx,-1
u dumped ball Bitcoin crypto dry regulation commissioner,-1
today Bitcoin fear greed neutral index cryptocurrency cryptocurrency,0
hey mr whale please pump bitcoin position under water,-1
another exchange held of indigenous bullshit tokens with no value attacked,-1
positive sign midway down little the next day pumping,0
probably the popular opinion mono criminally underestimated spoken enough,1
thedustybc doesn't know anyone yet know how to work btc,0
btc transfer kraken unknown portfolio tx blockchain btc,0
a lot of learning to enjoy continuous learning going along Bitcoin,1
Bounce back fucking crazy bitcoin speed recover fall,1
meth addiction symptom humanity disconnecting bitcoin nature way,1
Bitcoin mining operation finger lake spark local concern,-1
Ladyofcrypto Bitcoin b Cheap to come day week minute,-1
crypto technology stimulate clean energy globalHeating Bitcoin via,1
Bitcoin block byte transaction btc rewards information visit,0
it wins unless you are extremely lucky game pure,-1
bear gluttons friend cave see Yall next ath,0
think final official drain run eth btc marsh,0
Bitcoin hanging k powered hiking signal rate Bitcoin,0
wassup larry sad seeing the withdrawal time win every year,1
layahheilpern correct Chinese Communist Party Bitcoin favor know,1
tyler herro again tonight game heat bet btc,0
Bitcoin ready to sleep woken up everything wanted this problem,1
sell bitcoin also win bitcoin heavier sell hodl,1
Eth backpackers models will get a real job and btc,0
tresolas deitaone gold moving forward btc,1
MayorConger Jackson Tennessee Convert Next Bitcoin Paycheque,1
really interesting going back year under thought,0
huge volume btc probably break old ath k,1
yes certainly compare Bitcoin v or volatile term,-1
valkyrie liquidate btc etf end of October btc etf,0
Bitcoin evaluation possibility full-scale bull run cryptonews Bitcoin,1
follow many people lose mind stick plan btc,0
Grand Livre vote good grand Livre better doc more difficult fuck,0
sea char could call the exchange of sea char shellys,0
reason elon doge perpetual immersion since appearance snl,-1
binance made around bitcoin lost forever bitcoinbutton binance,-1
even worried about making bad money back in the month,1
coinssquare thank you opportunité stpatricksday Bitcoin coinssquare tag utksrvstv,0
person indicates republican edit nvm post history check,0
purchase order distributed on the market of the bear game accumulate,1
Bitcoin alert break strong bar m Oct am,0
a feeling of pain bounced a lot of pattern btc,0
New bitcoin block fall btc btc bitcoin,-1
really sad to see coin just cashing two years,-1
Bitcoin block byte transaction btc rewards information visit,0
consumer price index and consumer price index and consumer price index and consumer price index and consumer price index and consumer price index and consumer price index and consumer price index and consumer price index and consumer price index and consumer price index and consumer price index and consumer price index,0
useful bitcoin tips say buy id finished cashing,1
kirthpal deitaone better chance to increase next month Bitcoin,0
as said Bitcoin idiot holding rgbo really soon,1
whaler prepare to buy btc shoot atta boy,1
czbinance pidgin translator person dey control Bitcoin network,0
crypto cabinet prepare pause activity ethereum merge Bitcoin,0
try crash price buy cheaper cryptocurrency Bitcoin cryptocrash,-1
life really easy enough get vaccinated buy btc,1
