text,sen
bitcoin price Canadian dollar btc xbt btccad btc price cad average last hour half hour h change h baixo h high information,0
looking at tesla market saw tesla model smoking dodge impressive demo investment ethereum bitcoin,0
day ago btc trading today btc touched growth day btc broken support bull abhi baki hai,0
good news bitcoin cme gap closed the recent dump due to higher expected CPI number,0
bitcoin price alert short term fluctuation high level of resistance m oct pm,0
dive deep enough repurchase the new year still profit theyre crazy saying,0
good question maybe temporarily put a good long term pressure competition between the big good player BTC,1
"bitcoinbtccryptocurrency interesting fact btc setting a negative yearly candlestick, a subsequent crypto bubble, but making the history of consecutive positive candles repeat as follows",0
Peterschiff&#39;s book saved as peterschiff bitcoin eth cryptocurrency elonmusk joerogan,0
i guess iran want to buy cheap btcs trying to keep the price low taking the cost of wagon energy v mining yes need one day conclude buy better hurry price stay low long time,0
Bollinger break btcusdt minute time frame btc bitcoin,0
documenting btc cynthiamlummis bitcoin magic,1
remember the youtube twitter account saying i could see the market below the situation already with the price a day ago remember best feed confirmation bias reverse audience trust btc,0
new feature helps report misleading misinformation bitcoin people like elonmusk mcuban thanks jack,1
could better last year choose the right day compare the price,0
squirrel bits for that btc,1
kshib long alert ticker kshib market kshibperp volume price btc btc eth eth,0
getting bigger at the end of november testnet expectation wagmi znn qsr btc bitcoin altcoin bullish,1
trends enter longclose short btcusd follow alert btc doge crypto,0
bitcoin btc situation like btcusdt chart,0
"hodlmagoo fossgregfoss believes limited, distinct, fixed right, bitcoin supply, fixed millions, ethereum supply, limited production rate per unit of time",0
mp accept bitcoins even partially pay maybe min donations bitcoins altshitcoins help protect deflation funds caused by inflation govt help rakyat kasthurishankar yeobeeyin hannahyeoh syedsaddiq,1
trading of attention fees binanceus btc dust cleaning,1
bitcoin burst level last chart pattern rally since july the risk fade i keep winning profit trade signal given robin moore moorerobin telegram copied trade was btc btc,0
omnifinn princeysov lucky hit bitcoin timeline lucky swallow orange pill lucky lucid goal future path,1
bitcoin shape shift right active bear passive bull,0
lol nowhere preto circuit breaker,0
all cryptocurrency bitcoin via,0
Epic lucky wannabe bitcoin er,1
"right lol, like anyone who followed the price prediction last month could make a lot of money.",0
separate monetary statement btc,0
any try the nexus app,0
bitcoin will surprise everyone from the month of September,1
apompliano th quarter send liquidity baby connect node bitcoin,1
fail bitcoin bank hodlers fix bitcoin,0
bitcoin single event life,1
nftmechaen rainmakergame potential relationship nitroleaguegame unique gem like championhunters therefore volatile market the best project focus lot scope make bright future nfts rain btc rain,0
bitcoin bitcoin btc btcusd,0
bitcoin was USD yesterday last bitcoin day,1
home love saylor gardián fud salvador btc loitando boa loita,1
entirely possible to think that people of great withdrawal sell,0
The nebraskangooner is wary of one day being worth an actual bitcoin,0
"the bets don&#39;t go, maybe ask for a bet",0
Don&#39;t think that today wasn&#39;t the date today stopped accepting comments,0
Average dollar cost of bitcoins last month I wonder good idea seems the price of altcoins low still pretty new skim seems general attitude towards altcoins pretty harsh stick btc altcoins viable option ok,0
determines the price of bitcoin good reading the dynamic aspect of the market,0
Altcryptocom token backed by btc mining mining cryptos bound secure learn,1
viktamao rally project starting btc carecoinfamily,1
acceldefi insurance bro btc year exchange defi xogo acceldefi,1
minute it seems that the increase in feed rates to btc prices already maybe people react slow today bitcoin,0
let&#39;s see what dip is bought hour btbt bitcoin shortsqueeze bagger coming,0
last chance bull resistance btc k highlighted mar st fails break ko time could break ko level next day bitcoin btc crypto,0
pitchfinance bsc pitchfinance bitcoin project good amazing project cryptocurrency project powerful global project proud hope project developed best,1
long term could be the short term goal of the year,1
hastecoin it turns out that many families pay the price that they struggle to get a clear solution of a large part of bitcoins,1
cameron reference mira elsalvador btc part important country citizen daniagonzalz nayibbukele true leader people people excited to see government really working citizen,1
fair enough have a growing concern about the hardware wallet though at the end of the day people want secure things wallet ui seed word protection stress type shit,0
binance passed a hang crypto btc deal,0
strap of great day of the week,1
"assuming he didn&#39;t send the paper, unfortunately, many",0
here i knew bitcoin bottom was not a bull trap,0
whatbitcoindid w davidzell excellent minute summary of basic bitcoin thesis much way the internet has changed the world it has changed the information to interact bitcoin has changed the way humanity interacts value,1
true inflation of preferred bitcoin coverage by Paul Tudor Jones,1
crazy think bitcoin trading since game of the year,1
crypto i think the current state of bitcoin since fear greed index neutral moment price usd analytical team did a detailed analysis on btc i want to hear opinion,0
price spaghetti alla carbonara satoshis btc btc usd usd saturday saturday june pm edt bitcoin carbonaraindex,0
btc btc k destroyed saturday bomb ko monday retest fill cme gap maybe,0
there is also possibility of btc bitcoin btc,0
depends op as currency,0
wish everyone a good weekend,1
emocionado traer chainbytes bitcoin atm leybitcoin nayibbukele bitcoinbeach,0
longer let you stand strong hodl storm hodl people,1
btcperp cryptocurrency shorted ftx utc btc,0
btc crypto country legalized cryptocurrency bitcoins,1
feel touched sell wall hit kool aid home break sell wall ohhhh yeahhhh,0
"bojidarkostov, despite the rather long withdrawal, still confident in bitcoin sees another high year, however, everyone follows the prediction of the tweet ethb firmly holding continue",1
"amount the tax case depends on a counted sell cheaper expensive one I always wondered ive dcaing last month I think I work the initial average price the tax calculation seems to sell bitcoin pay the tax saying I am selling btc expensive bought for example buy btc k other k decides to sell btc says that a payment ka purchase schedule does not matter well, I hope it makes sense",0
literally made the decision to buy a dive bar the regret of the morning,0
bitcoin h rejection h retest bearish see you,0
day dream sat bitcoin,1
cryptowhale hey btc bull trap,0
grt heating btc btc,0
Cryptographic technology increases global warming clean energy bitcoin through,1
Finexcz everyone going to do bear market btc bitcoin,1
hswapdex bo proxecto hakz ochendoglobal mary airdrop cypto bitcoin,1
dianaprealtor stay at home make money online believe let earn every hour instant cashout no referral needed no hidden fee bitcoin ask message by direct message,1
Everyone favors the last day to be perfect to win a lot of money,1
oso gloaters grave friend vexoos next door ath,0
btc derivs sheet tweet every min cme delayed min g delayed min oi share,0
exahash mil mc riot exahash bil mc gme amc spy spce tsla mrin aapl sndl pltr nvda tlry rkt ge expr sol spy dis c coin pfe ge nio jnj plug amzn aal nok bb ccl sofi wish hood snap nflx apearmy wall bcstreet,0
bitcoin bitcoin btc btcusd,0
wizardia magic playtoearn metaverse bitcoin diamante blockchain,1
move ollar corrector cryptocurrencies btc,0
Tyler Herro still play heat bet btc tonight,0
sparrowwallet bitcoin best practices must read,0
bitcoinqutes bitcoin advocate pleb,0
sell bitcoins also earn bitcoins heavier sell hodl,1
goonrich minikishu babybitcoinbsc following the path btc rumbo new ath btc bnb,1
coinswitchkuber bitcoin fall month low dip dip btc k believe what support area hold bear trap finally bravo mjtru made you proud tweet that was great,0
"bitcoin is currently scheduled for the next bitcoin conference to take place in Miami, Florida, April",1
report each business year independently consider temporal ben course depends on country,0
rate jodida buy btc price go sky luck one right sell problem benefit total right bc joder dicir obtain benefits rate made give name,0
basically leave crypto alone fir year the world of mighty man happened probably saw medium attention elon getting comments couldn&#39;t pass attention doubt crypto a lot,0
Dineke metatravelers believe that history should be registered back came back chronic idea history bitcoin onchain led crypto cards minted collection jan discord all environment come say hello,0
get bitcoin pa trigger wanted ride through chop city see,0
citizenbitcoin thinking of selling bitcoin ask someone to buy invest secure crypto strategy reach financial goal,1
btc lost short low luns,0
special shoutout new friend great thing btc susiebdds oflowshow jerimican kobiduran camilacampton youngest plebe make trip very fun inspirational win for the kids sincere thank you one year old boomer,1
quantity legendary crypto trader bitcoin onchain metrics analyst discussing perp option funding future maturity correlate price action show earlier b derivative dominant short term price action,0
Meth addiction symptom humanity disconnect nature way bitcoin,1
bitcoin cling k signal rate rise powered by bitcoin,0
asset traded with bitcoins assets traded whales controlled whales take money control assets think like whales control money bitcoins showing wyckoff means bitcoins future invalidated half money need moon bitcoin normally bitcoin will always go big money make way could keep control conscious market done push anyone sell the contrary fact know that will happen thing return eventually likely keep,0
iohkcharles bro sell cordano buy btc,1
californiahodl bullish stack get sat market dip bye fiat buy bitcoin,1
layer built above Keep fresh hope I&#39;m also wise enough to know that technology is not guaranteed to move lightning pace day many old technologies have left the dust behind hear a lot of people saying hold on to btc another year is really worth something. reasonable person could admit,0
"ah sorry man, someone nice attacked earlier, maybe i&#39;m a little touchy",0
laynio laynio like a simpson bitcoin,1
positive sign halfway down little pumping the next day,0
sbfftx way see rare type try differentiate international you like it ok fuck south america american people ok great business ftx bitcoin,0
statistically the best time to buy pst interestingly never bought time lol,0
thedustybc I don&#39;t know yet does anyone know how to work btc,0
recycle win crypto green world recycle today better tomorrow don&#39;t miss chance win crb join the recycling contest use link sign up convertercarbon crb bitcoin,0
flurnft crazylizarmy bitcoin eth the best option trade accumulate profit think better place put money want to accumulate wealth bitcoin mining follow cryptostewart help achieve goal,1
long term outlook bitcoin prediction the best start remember the monthly channel understand the bullish log chart the best tool see the real value trend without clouded judgment,1
bitcoin ready slept woke up all wanted what&#39;s the problem,1
whatever you have to keep buying sitting down,1
bitcoin attacking ah ema rejected ema since it finally hit could mean look break channel htf follow cryptographicsm know things are coming cryptocurrency btc,0
wassup larry sad seen gaining retirement time annually,1
very correct slow grind higher,0
what is big thing really can&#39;t bitcoin used legal tender bitcoin never controlled legality,0
jasonplowery bitcoin I hope for a better world bro,1
"bitcoin xa circulates, btc is mined",0
btc settled longa k,0
Btc google trend last day cryptocurrency detail btc bitcoin,0
hey plebs blessed opportunity join ukbitcoinmaster podcast today talk bitcoin trading card wanna know project check podcast interview start minute,0
the current price of bitcoin has increased in the last hour cryptocurrency bitcoin btc,1
btc hold k ill,0
themooncarl btc willing to see the gem holding the bag tight,1
umm don&#39;t say word home ready,0
queen dani doge taking the flying carpet moon thc eth btc,0
airdropfather project bright future i really believe perfect project true innovative project future belongs project mizimaruf munna ahsankabirsanto ummenipa airdrop airdrop bitcoin,1
see bad lmao accept bad everything or world downvoted crystal ball think know what will happen next,0
coinbase anyone else bitcoin,0
someone really pushing well,0
"paulserious kinghoward, still from the domain, I believe that the correction of bitcoins",1
come diamond bitcoin unsustainable earning shitcoins left right center earning s percent hour completely unknown coin winning way could continue pure gambling may less honest currency prevail hardly anyone buy base technology gambling well bottom fall correct honest currency rise happen partner would rather which had not passed logical basis good bitcoin edition edited,1
garrettgroce bustarhymes adouble whybitcoinj ok love bitcoin obvs awesome project real utility worth investing they are competing btc what is the problem defi huge lets content creator artist pay more,0
pizza day broke john bitcoin&#39;s record,0
stackinfatsats goldshellminer kadenaio necesita kda box btc prediction you wait it soon kda start enorme pump hmmmmm,0
Bitcoin test week sure that you,0
Balajis ledger record built bitcoin,0
download github put a usb device put a device offline indexhtml offline device follow the instructions get a private public key send exchange funds to the public key make sure you see the private key don&#39;t lose it also keep the device key permanently offline use a old rapsbey pi laptop,0
btc stimulus worth btc hr cambiar bitcoin,0
nada malo mal dismissal meaningless altcoin shitcoin coexist happily bitcoin,0
"Yes, I am saying that the market cannot be manipulated",0
will talk btc dogecoin xrp,0
blockchain bitcoin amount btc amount usd transaction type transfer hash dcbacbefbcbdabeacfefdefcebd,0
burned renbtc usd avax darknodes btc rate usd,0
UK blockchain argo becomes first climate-positive crypto miner to trade in bitcoin,1
protect savings defi exploit upgrade bitcoin secure multisig,1
btc ltf min wave chart,0
storing bitcoins is easy,1
btc derivs sheet tweet every min cme delayed min g delayed min oi share,0
project built a good development open long term opportunity each user also project developing quickly Create future success ascendex bitcoin defi hariom sumitk jaising,1
eh I did not expect reference today low,0
know that money will reach market level money adoption matter of impression world know could happen i would think it would hit k quickly bitcoin k year ago one thing i learned year bitcoin surprise less waiting to see happens last quarter bitcoin normally good year market bull time pretty good institution jumped hoop I also don&#39;t know the big news around the corner country adopting etf twitter integrating network lighting big company like facebook purchase from amazon bank adopting nydig feel like a bull run started fundamental never stronger,1
bitcoin btc perp hi climbing funding dip negative rebound seems short it might be fun,0
Bitcoin looks good next week,1
quick return of bitcoin k show you will hibernate anytime hodl,1
nobody austrianschoolb knows couple guy extra talented creating big bitcoin management company retired year i think it&#39;s happening accelerated rate lately,1
marketspotter investing usdt with altcoins bitcoin best day big accumulation today,1
the key to the cryptocurrency bitcoin,0
joshyoung jameshmackay i think bitcoin is different well anti cryptos hoping others burn bitcoins rising ashes,1
evaluating the possibility of full-scale bitcoin cryptonews bitcoin,1
state america interested bitcoin ethereum find answer article research study coingecko,0
it becomes rude to see the money go up,1
btc gains since yesterday i think the bull trap is going back k,1
valkyrie liquidate btc etf end of october btc etf,0
let&#39;s see volatile next hour minute btc option expire utc midnight pst april,0
toro take control must see the price quickly review k bitcoin btc btc eth bnb,1
kevinolearytv disagrees the future looking process of mining requires heat generation glass house home heating pool etc. look at the btc mining produced as a byproduct you need to stop discarding heat,0
feeling a little tense here lol the long term holder is very concerned in the next hour looking to see stay in february why would the long term holder be concerned even though you bought the year i still absolutely want to see the support level in february. support level law permanence creep investor mind many still have difficulty buying remember you buy a cheaper price every week the price becomes part consider the normal price the memory the purchase of bitcoins becomes further the memory replaces the new rule respecting the support level Feb. gratitude sold people sign solidarity admire,0
zodasadi elonmusk teslaownerssv boringcompany btc global justice mtn global health medicalchain,1
microstrategys bitcoin treasure vale usd usd bitcoin,1
steveinmanuic fbi bitcoin steve protects his neck,1
btc derivs sheet tweet every min cme delayed min g delayed min oi share,0
wclementeiii see great bitcoin open source project also interested monetary innovation represents asset potential makes everything else sustainable thanks to wilkes advice foresight allowed to add mass retention,1
bitcoin social activity galaxy score altrank social mention social commitment social collaborator social domain shared connection btc bitcoin lunarshare,0
profit btcusd target buy btcusd le last bought reduce impact volatility general buy sell click move,1
tomorrow everyone wait girl usdt atm btc bitcoin,1
coinbureau bitcoin life rent free mind buffet munger protests constant collectively tuned,0
btcusdt shorted binance utc btc cryptocurrency,0
I think you may have time to tell the story became a btc artist soon,1
Bitcoin is currently trading resistance zone please watch out longsbtc,0
btc btc open interest positioning big short position cut still net short non-professional trader very long usually means clear reverse market super bullish asset manager could save non-professionals,0
travlad official feito sir mufc bnb btc,0
pascalnajadi retrospective bitcoin always stalling,1
Lopp Bank uses information money as reason enough to stop using technology start using cryptocurrencies like bitcoin ethereum eth ox near others,1
peterschiff btc ready rally gold,1
btc transferred kraken unknown wallet tx blockchain btc,0
interval number of last previous roll ath,0
track price rise buyer trading advanced crypto scanner btc eth ksm hot trx lrc xem dash comp kc chz omg grt hnt amp miota wave neo leo crv,0
hawaiicryptogod como bitcoin love dfi defichain,1
buy low makes a difference hold bitcoins,1
jermehlikeshash maxkeiser looking at kk next resistance bitcoin breakout range confirmation and half bull market starting to continue taking rawkzt tweets every advice seriously great follow up,0
bitcoin daily update daily calendar btc downtrend bear losing power also afd indicator lower signal printed since june rsi also exaggerated divergence bullish signal today also bull keeps control cpi,0
liquidated sell long btc size super huge rekt bitcoin,0
called senator sent by email finger crossed bitcoin,0
dca highest k months ago dcaed k still costs one bit btc average k bit,0
aave short alert exchange ftx market aave perp volume price btc btc eth eth,0
people love love around love achieve thing know difference bitcoin bitcoin love story,1
shorting btc though leverage can boost btc venus borrowed using usdt collateral sold yesterday basically cashing short btc no leverage Altcoins good day still going,0
btcusdt m macd cross btc btc bitcoin,0
Acmecryptocorp happy to see bitcoin helping the country of Mexico or El Salvador,1
lol exactly i want to play blackjack bet roulette spin go casino,0
saying something break small amount minute deny ta may like appreciate the vast majority of trading run algorithm bot use ta real explanation price movement,0
try robinhood cashapp update i want to send wallet try cash app allow withdraw deposit but still robin hood option,0
sold k always occurs stack btc time,0
adrianoferia rocketfuel log scale respectfully disagree honestly not likely to move a coin either come clearly ahead winner bitcoin always interesting eth ever manage flip mcap though,1
pair watching btc scenarios find support around k move to next level around k strong close k mid range reversal resistance test bitcoin crypto,0
bitcoin taught true maximalism ready evolution,1
crypto exchange india btc trading volume zebpay btc coindcx btc wazirx btc bitcoin btc,0
wrap bitcoin market could see a decline in retracement volume btc bitcoin market cryptocurrency,-1
part say called bitcoin hit k half hit c pivot abcd harmonic around area price turn bullish rsi apparent divergence bear look low steam small bull,0
btcusd two years is the first time since March that I buy bitcoins,0
bitcoin price understanding telegram group action advance market knowledge telegram also know how to navigate the market competition efficiency like a telegram know how to invest instructions telegram know how to expect btc cryptocurrencies,0
open long position btc tight stop loss lets see,0
final bitcoin diamond upgrade,1
today rise crypto fueled inflation global adoption crypto news bitcoin fueled,0
decentralized computing platform ethereum uses eth also called ether pay transaction fee gas development use ethereum run ethereum bitcoin binance,0
"next time, spare money, the price of the September wonder will then go",0
thought people far crypto start share news bitcoin sell news first goal k already the next retreat lost start looking k correction far seems btc cryptocurrency btc,0
honey badger give a shit,0
cokedupoptions wholemarsblog a lot of people are not ready opportunity strike buy dive bitcoin always recover you are patient enough follow anthonycrypt many better understanding value invest tweet profitable win rate,1
dcg liquidate grayscale bitcoin trust gbtc position bitcoin blockchain ui via,0
sure you need to hear stop buying nfts go back pumpingmybags bitcoin miss,1
analysis bitcoin th of september current price btc market dominance sentiment point fear total figure market capitalization millions approx,0
usd elsalvador bitcoinday sáb usd btc usd usd sab dom abr pm cdt btc usd usd sab mar sep cdt bitcoin,0
feelin cute can buy bitcoin idk,1
people dca alcohol every weekend a lot of things buy excessive waste unnecessary battery sat btc,1
amount of txns taking place bullish btc network,1
bitcoin rest day later fund that&#39;s a quick opportunity come go alt done lower low know want to accumulate movement happen prepare worse,0
btc usd transferido bcqnwupzkytuzfkmevylrngumlgy bcqjsfahjdtkccqngfvzzmesrgqheq tx hash fdcbcafebcdbbeecfbbcdfbae bitcoin btc crypto,0
futuro brightorange bitcoin bitcoinkiddos,1
alcista scene that shows exactly the last youtube video subscribe don&#39;t miss the bitcoin cryptocurrency update,0
has anyone noticed that people shill bitcoin investment quote price appreciation usd instead percentage term diminishing return year roi occasionally high start seem stock market performance,0
Darknet crypto mixing operator pleads guilty to laundering m btc bitcoinnews bitcoin,-1
never mind buy even plan to keep year two buy whole coin wait k sell stupid tax difference negligible dollar,1
Bitcoin bear market can take btc price k say trader stock due to bitcoin capitulation,-1
dead cat rebounding short to meet with cryptomarket crypto btc,0
bitcoin needs a near daily time frame still stuck inside the ichimoku btc cloud,0
btc floating k today feed rate hike base point announcement of the highest historical increase year,1
bitcoin neutral support resistance a sign of bullish countertrend require a weekly share bitcoin btc continued to rise throughout the week signaling uncertainty among market participants,0
never bend the knee bitcoin,1
btc still varies within next hour pennant watch market volatility,0
America right carry gun state want oh wait,0
detail exchange h low h high bitcoin btc,0
celsius rally quite compensation pay debt nft crypto bitcoin,0
river laser focused accelerating bitcoins adoption warehouse value exchange middle river app power building american wealth bitcoin river lightning service empowers businesses worldwide lightning network access,1
btcusd coinbasebtcusd mrsoufcoast bitcoin btc,0
therealtahinis ive been waiting for the year for someone to discover petrodollar haram btc halal move the savior sharia bitcoin revolution hot tail halal cc maxkeiser stacyherbert needs the whole series show hilo,1
Jpmorgan Chase seizes the bank account of the bitcoin mining company bitcoin btc,-1
jackmallers time alive future generation time writing second country adaptation bitcoin legal tender domino fall strike played a big role Jack you are amazing,1
Crypto opinion current state of bitcoin as fear greed index neutral price USD analytical team has done extended research on BTC I want to hear opinion too,0
cryptodaily think bitcoin bank exchange loita central bank cbdc cbdc attack bank omission process private banking doesn&#39;t jump loose btc table,1
