text,sen
Many things destroy the planet faster. Bitcoin mining does not listen cryptor us a little energy everyone,1
dot real business bank level security stability kusama essentially copy dot developed test new update real world economic environment real implementation dot ensure dot always works smoothly never go security breach project dot also network sister kusama essentially thing get new features first also cheaper to use general kusama giro art game center very cool moonrivermoonbeam karuraacala heikoparallel khalaphala etc kusamadot red sister team building version kusama version dot,1
intrinsic value cryptography that&#39;s hyperbole that&#39;s a fact objective virtual currency guess real fiat money big disaster scenario society collapse likely to become equally useless almost immediately even internet somehow kept working would anyone be interested crypto soon scarcity insecurity physical scale good matter possible gold could come use you confident people interested in bartering can end up starving,-1
many inherent value of scam did not like financial institution trust seemingly random criminal value based mostly seems to manipulate the environmental impact of the market,-1
currency still a US currency can not be used buy things around the city important online store bitcoin especially place like venezuela venezuela really great example good world exists feed family farming runescape rather starve death dictatorship oppress,1
lost money every cryptocurrency purchase that was never sold,-1
best investment stock return though borderless volatile transaction much better apy bet crypto leave money banking protection inflation local currency local currency loses value as per fortnight point,1
Unbanking banking access service similar to banking people currently access the bank cheap transfer money as remittance family abroad smart contract insure property information reducing need expensive notary see crypto new industrial revolution new internet next step believe ten fifteen years look back society without blockchains in everywhere way look back society without smartphones remember how to return impossible to understand,1
the possibility of dumping gets worse without burns or circulation the supply has not changed the currency lol,-1
"people used salt cigarette shell etc. money, call money, good tool, used money, store value change, good unit, count good tool, turn into money, used money, prison, cigarette, turn into money, used money, different, good tool, better, worse , based on the quality requirement, tangible physical requirement, work, work, shop value average unit of exchange account fungible transportable durable easy verify etc bitcoin designed property excel say volatile storage value bitcoin contain volatility volatility caused human volatility problem time that remained value increase value time time b volatility matter requires a lot could demand keep year go get better become even valuable people see stay see confidence store value even increase value away seems given continue working would bet bitcoin gold bad today work medium exchange daily article probably people return digital digital superior verifiable time savings",1
crypto giving avenue to the financial world of passengers,1
cryptocurrency long term investment dive newbie panic sell thing good opportunity buy low sell high future game patience hold profit,1
often people get burned learn to trust face,-1
green energy already widely used bitcoin mining according to a recent report bitcoin miner is already using total electricity renewable source sustainable use of the board even better,1
bitcoin lot right thing doomsday currency inflation hedge speculative asset central banking hedge technology play more hundred things thing component price value people buy sell keep different reason look let&#39;s say fall due to inflation inflation hedge they also say hedge central bank monetary policy bank central probably a worse place still btc high time btc wearing many hats right anyone say a number different thing,1
given crypto fundamentally deflationary limited supply make terrible currency the purpose of investment currency facilitate trade deflationary currency always gain value due to limited supply means people sit instead of transacting inflationary currency incentivize people to use good investment losing value actively,-1
plan to invest small amounts each month,1
"I really doubt it deeply, I guess the greedy and hopeful fans know that the greedy know that the crypto space knows to fuck time like trust means nothing to make money anymore",-1
yes the government bans a major thing though the entire backbone crypto liquidity stable coin called tether full scam is already banned ny sec find dollar backed currency u nothing backed.,-1
"apecoin will do worse shib version that is, enough bomb still overturn logical reason",-1
buy real gold instead of crypto version paxg serves a real purpose,-1
crypto future simple simple buy perish,1
"Cryptocurrencies purchased in bitcoins do not feel like investments, they are simply better",1
papa bitcoin really the king,1
"harmony one algorand cardano solana vechain gon na fly ever next bull market se non, compre stack satoshis",1
Shitcoins don&#39;t even survive the bull market,-1
backed moon project was not a failure people buying kwons crazy shit shame kwon fool happened twice,-1
monero probably the best coin atm change your mind,1
going to crash lively hood people,-1
"I&#39;m old maybe around the year, that&#39;s long to speculate on anything, btc starting present and much future still betting everything else",1
de facto gold stable year really satisfied tested exchange mechanism chose gold verify token burned process,1
Solana skeptical due to low public allocation launch solana team backing vc leave responsible retail investor abandoned saying you never know,-1
way buy cheap buy time sell spend something lol,1
buy forget trust process,1
eth eth proven real operating environment can&#39;t stress enough also sure sec,1
kwons arrogance lands fall many dumb example like tweet,-1
"win quite easy, imo you have to wait until the next btc and you are literally guaranteed x current price",1
Many things worse crypto environment seems that the statement used by default disagree crypto,1
don&#39;t understand bitcoin asset bitcoin payment network only payment network operate efficiently fee company like western union also ensure transparent fast buffer.,1
overpriced eth does not deserve the highest alt,-1
bitcoin stable stock escolleu le stable,1
still see completely speculative instrument doubt call asset underlying value technology after rest could be adopted fairly quickly federal reserve banking system blockchain see unregulated market likely to face domestic regulation advance internationally,-1
yes practically blockchains technology definitely improved congrats eth developers many brilliant people excited working less x number of devs could conservative layer of etheruem ethereum probably time left testing the proving ground things that mean the thing will prosper well on the contrary don&#39;t expect ethereum of suddenly becomes null soon,1
spend a month annoying high price get another race,1
tether sort secret to voices not enough funds crash eventually it will take all long time,-1
literally flippin boat made crappy token trust news play tweet,-1
three scam coins kwon terra scam team basic coin look first stablecoin failed people lost everything luna v ust luna v scam uncle ruining crypto all one case scammer terra need to be held accountable made the example,-1
exposing worthless cryptos,-1
eth great way matic,1
the supposed currency act is bullshit,-1
research bitcoin stock flow model is new you don&#39;t want to bet m btc really sustainable m say about the real question purchasing power m usd year,1
"bitcoin big hedge demand inflation rising fiat keep printing even less btc put year of existence trend towards buy btc k held ten years btc very scarce k worth a lot le way stock market asset hedge inflation usually counts sell inflation happens preformed cryptography great last two years lagging cpi ethereum hedge inflation people spend millions of block space mint day m new coin the day it goes on sale people want block space next year mint mo new coin day forever i bet that people pay same block space future l compression protocol batch block space demand finate strong good bet make here great site compare pow po ethereum something like x energy reduction some year bitcoin mining done specialized hardware economy much different gpu mining strongly incentivize new development clean energy access to large corporations the cost of selling energy is not sustainable true decentralization whatever keep the coal mine profitable hashrate cheap high argument generally allows the existing mine to stay open longer recycling, otherwise way waste of energy btc means you can go bankrupt that is still a right path compared to the burning sky even though btc sent somewhere power create energy like oil used every year. new amount get a block reward the average cost k mine btc that&#39;s worth k today the next cost halved k would receive k btc force me to stop mining find an alternative price cheaper btc double sure even though btc maxi i think you can&#39;t double forever without solving the problem ideally cost people buying blockspace crypto rate drastic enough do today halve inflation rate half ton pow done win rate today miner already pivoting clean energy choice can&#39;t imagine year easier to use coal if not global energy argument one choosing crypto stupid people completely ignorant crypto they were taught btc legit currency various countries used crypto world place no bank expensive real inflation argentina spend card buy online visa using cheaper faster existing rail track reason volatility means buy the price deserves the price said housing bounced every time you weren&#39;t bound two bedroom house maybe you&#39;d be fine real problem crypto nothing mentioned",1
ethereum robinhood character reverse roubar poor give rich gas rate pure extortion matter time alt coin close ethereum,-1
loss another loss always worsens,-1
also btc btc government take,1
dollar go bitcoin go dollar purchasing power btc still see mass adoption btc future,1
let&#39;s call the rugpull scam a ponzi scheme,-1
outdated btc,-1
"don&#39;t touch the moon, it&#39;s really not easy to do shit",-1
sip still mega bullish dot canary chain kusama too,1
cryptos ended badly,-1
negativity bitcoin held well often trade nasdaq simply trader trade time divergence surpassed bearish nasdaq year hedge magic hedge strong financial network unbroken finite supply btc dominance crypto rise rampant inflation weakens fiat naturally degree of hedge btc historically volatile though cannot depend on hedge in the short term,1
laugh I want practically inevitable crypto currency take world exchange currency would take a pretty big inversion point that bitcoin suppose possible,1
bitcoin literally produce security order time major fastest supercomputer in the world,1
luna will donate more x year fully developed ecosystem box ready fudders will complain about lost boat lol,1
good link cheap right ive been increasing the position of the chain link lately,1
love continues to fill the bag with cheap prices,1
loose don&#39;t bring moon excuse sky kiss wtf don&#39;t bring moon matter fact bring hell example perfect currency top day deleted guard matter stupid hodl btceth,-1
last time you visited rterraluna completely invaded Moonbois separated still page people contemplating suicide mind blowing,-1
congratulations you have reached the level of bitcoin understanding no one knows many levels bitcoin level beautiful invention ever,1
cash idiot Hardon Btc I&#39;m pretty sure the crypto bust will jump the bandwagon,-1
believe good luck stretch novelty polkadot way see opportunity never seen chain balance instance low interest rate borrowing talk low guarantee,1
"yes, the doge goes much faster",-1
developer yes good part good first mover advantage ethereum larger active community developer factor would estimate a massive advantage technology platform means great documentation tool apis resource makes it easy to learn compilation got obscure questions building functions probably helps guide stack overflow post tutorial of youtube response massive developer community also makes it much easier startup companies hire an engineer already experience a new skill many times google response probably expected listen likely wanted analysis tps scalability ethereum chose logical solution scalability light layer po system sharding excellent choice of layer high transaction performance target focused longer project far reliable robust decentralized smart contract platform available,1
kwon swindler,-1
right ada distant leader come stacked believe firmly currency,1
crypto profit depend major crazy buy shopping course someone wallet bitcoin go shill reality crypto really exploded spectacularly speculation love low interest rate easy money world live from origin bitcoin monetary policy tighten speculation shit bed happening,-1
The open-eyed type does not make a fund handler,-1
correct xrp pure speculation zero delivery,-1
"as a stable thing stable name of the currency goes yes, dollar really linked already many did not care",-1
don&#39;t dwell on altcoins too much because you become homeless,-1
can&#39;t go wrong eth,1
invest xrp fell much riskier option the time of the project makes sense invest something problem almost cryptos will go bull market feel bad invest xrp a little,-1
"Network disaster constantly problem, even sending sol defi wallet keeps failing",-1
bitcoin is going to make traditional finance obsolete hey guy stop trading trading hours lol hey move without anyone&#39;s permission,1
agree to keep cryptocurrencies i think it uses promising coin technology,1
Ben fully believes that crypto remains happy increases btc eth position,1
roller coasters return the call view to half,1
shit coin shit coin nothing nothing rien nothing,-1
very good secure decentralized chain project may seem good sacrifice decentralization useful scalability many people are not,1
really excited moment on the money side like,1
ethereum secure l built the top secure network includes everything mentioned better those other networks even close to ultrasound money,1
he doesn&#39;t like bitcoin,-1
amazing lost k kwon third whole wallet a lot of money really made face,-1
they are moving the cult ponzi scheme real fast like lularoemonat dude bros lmao,-1
good part alt really built ethereum first move advantage really good would not be today,1
quickly see a deflationary market chase after wealth diminishing returns they are still coming back keep trying scammers people buying without someone having the stock market crash,-1
can&#39;t go wrong btc eth,1
recover the weekend,1
"macroeconomics looks like shit, you&#39;re looking for a bull trap",-1
don&#39;t worry btc k end of june,1
The main point of bitcoin&#39;s lack of ability to access cash flow,-1
are you defending the shitcoin stack postitnote say active dollar legit tracked dollar shitcoin disguise the peg didn&#39;t hold,-1
bitcoin headstart lower issue last year merge ethereum top technology monetary policy market tracking point,1
used despise bitcoin cash really doesn&#39;t see value politics used think bitcoin cash traitor avoided cost i think no one trust ecosystem bitcoin currency everyone has belief end dethroned someone would invest space king btc thought the day will come the deadline bch copy paste clone bitcoin all holders of bitcoins planet received the same amount bitcoin cash forked bitcoin means even bitcoin cash became cryptocurrency bitcoin holder one fault is not equal portion bitcoin cash given free guess think bitcoin cash bitcoin previous transaction history literally everyone who has bitcoin received the same amount bitcoin cash grab money bitcoin can scale small block size thanking bitcoin cash created give a counter argument see increase block size finalize a scalability fee good end take care of cryptocurrency everyone who has bitcoin time fork keep an equal amount bitcoin cash i am not sure it took year epiphany wanted to share thought bitcoin cash,1
I feel totally excited,1
forbidden go ponzi go well distributed really decentralized mlm scheme shilling centralized database stored decentralized matter people write through decentralized convoluted form due to negative sum nature mechanism leadership scheme needing ever increasing supply fiat electronics collapse system of energy also benefits people who bought early oce buy late aka mlm extra step extra step pyramid scheme ponzi extra step,-1
Crypto another poor scratch bill tax digi pipe dream fall,-1
thanks for spreading everyone&#39;s monero wallet,1
true meme coin lot alt coin bitcoin remain low exposure portfolio risk tolerance allows good,1
monero coin authentic use case serving without full influences keep buying bear market,1
ask tech people think blockchain vast majority tech finance experts recognize crypto scam hey excar seller CEO usually has problems sec security fraud know they are talking right,-1
yes i could fix the statement though the worst analysis except bitcoin analysis real value cryptocurrency people therefore love a lot of percentage.,1
something a better top,1
moon return scam,-1
ousd check looks great moderate return,1
still show tons of degenerate player space,-1
"yes, great cliff jumping",-1
you will not believe forever,1
maximal competition of btc construction of tent value highly secure ethereum surprise innumerables cutting heel covers btc gold ethereum internet problem innumerables additional parts that want internet,1
Tether also supported a lot of hope for prayer,-1
i&#39;m a super bullish dot better hold on my love team love tech ecosystem growing pace nice instance ive tinkering with parallel finance lately i really like think go see big thing polkadot future good luck dot holder,1
intrinsic value produce anything,-1
ltc cheap fast exchange transfer,1
The low price of crypto is not going away,1
drop literally zero atm in real time moon worth you,-1
whenever you feel stupid incapable of anything life look at the crypto space lol,-1
cause still tied to the dollar btc actually bitcoin bitcoin c inflation,1
way back go out enjoy pastime keep onnnn buyin well looking forward to a cheap day as soon as possible,1
I think I&#39;m surprised to see people jumping at the chance to keep their hair,-1
quédate lonxe luna scam,-1
the entire market has moved back into the red under the burden of the past few weeks,1
ethereum future people fud lost boat want to buy cheap,1
Honestly reading the post many answers conclude cryptospace totally screwed concept crypto totally lost wave new arrival island crypto instead of revel freedom all plan way back island,-1
elon reason dux perpetual immersion since snl appearance,-1
bitcoin used technology prototype interesting digital currency failed volatile slow useful wallet renamed digital gold try investing in trash exchange bitcoin ponzi scheme functionally identical,-1
zero value,-1
It is always better to buy bitcoins instead of waiting a long time to leave the peak behind,1
safemoon is not safe,-1
much has changed actually hundred cryptocurrencies competitive read different thing name huge dilution customer group top dice sports field called crypto multiple super bowl likely announcement crypto reached almost all possible customers expect a lot of future growth user base large majority customer looking for return on investment good lately great customer retention running miner exchange advertising campaign ongoing costs huge customer needs cover perpetuity no huge user base growth hard to imagine it getting better,-1
"time to always be present, safe, never invest, allow yourself to get lost, always investigate",1
an even greater plunge followed,-1
bo tempo dca btc btc,1
k incoming get ready raptor,1
spend cryptocurrencies sensibly,-1
"yes, accumulate the big time like btc eth",1
ada terrible post cope,-1
"Seriously, tell everyone not to try. Dollar cost, average Crypto, exchange money, year, literally year, look back.",1
dogecoin b although everything goes much others,-1
"crypto currency pure garbage discussion second limit of crypto currency market world market though gecko coin show still it&#39;s crap wonder not crypto friend i think crypto simply penny stock market you know project good intention fail success hang many others pure scam know guess decentralization of prices sometimes fight I don&#39;t think censorship would be the business count new project is not allowed already many spaces, sadly, many people invest their lives. scam project determine shady scam project officially scam many people crypto world still say shib scam example that&#39;s the opinion many people say bitcoin scam many bitcoiners say ethereum scam go a review the politician usually use the cryptography police project tribe i can&#39;t stand littering twitter hope people come better educational tool newbies aware of fire danger optimistic people want hope hit moonshot gloomy scammer know imagine number written probable title range time",-1
crypto fashion crypto underlying value zero depends on bigger crazy theory grow get lucky bubble growing people with crypto loose money,-1
buy another dollar for value,1
Worried eth someone would buy crypto well I think stay down guy guy long crypto honest question,-1
bitcoin better return on bitcoin stocks compared to much higher stocks,1
cardano fan strongly believes that the future cardano cannot wait for sundaeswap deployed smart contract,1
failed stablecoin project removed stablecoin tried to relaunch obviously,-1
people using btc world every day import investment ton transaction btc used intended to use freely making popular day,1
keep telling everyone every day of the week polygon ethereum match made the sky nothing is going to stop the mass adoption of duos coming slowly surely,1
i love bitcoin fiat community i hope to be sick alive one day people say a lot of satoshis bothering to convert fiat status,1
bought ico for coin keep everything sold a month ago helped buy a bigger house,1
funny thing people have already added liquidity see something explorer people have already put money shid currency unless the associated wallet let&#39;s say people buy even clearly labeled packaging smells a lot,-1
wow tron copied eth copying tfl folly tron coin tagged coinsider yt founder tron like idea to steal look bad theft once whoever triggered the death spiral also triggered a usdd also predict unguaranteed stablecoin finally banned,-1
long btc lot general money institutional read retail investor lot big finance money btc crypto general I think it&#39;s going to be a lot of cash liquid would splash altcoins very low value hold next year,1
he didn&#39;t sell a moon dollar,-1
xlm works very well with exchange transfer,1
nooooo he said hedging inflation everyone said the best store value rate people could pay BTC pretty tulip,-1
I think the crypto opinion summarized effectively simple lol,-1
release another,-1
renewable energy already used btc mine yet unused renewable energy bank tested consume energy btc year,1
hype narrative crypto constantly change based promoter need to push basically repeat similar phrase propaganda first medium exchange found slow cost medium exchange anonymous government came way track required exchange record customer information active uncorrelated failed highly correlated nasdaq digital gold storage value inflation hedge it is not panoramic nor does it think that anyone is surprised,-1
well failed original purpose people tried to assign property year current narrative inflation coverage guess can time put a bed,-1
baby big climber coming to crypto,1
eth developer ecosystem make an opinion eth community let fail easily adaptable,1
fuck kwon version,-1
care monero privacy coin think represents an easy way to operate the human trafficker&#39;s radar,-1
"Yes, crypto mainly preys on poor and illiterate people",-1
bitcoin offers millions of people around the world bank account access store way spend grow wealth gain time adoption becomes volatile due to higher trading volume market cap look around the world today think a huge need decentralized incorruptible money sure it&#39;s not of I agree a lot btc,1
blockchain even works properly,-1
Digital tulip fertilized a lot of crap,-1
great step crypto German congratulations German I hope rest I follow soon,1
the dead may never die bitcoins declared dead as time always turns,1
wow really supporting estafa,-1
bear market money made continue dca active believe,1
moon scam dark guy degen scammer still trying loot public nd time governance admission calendar moon small letter parachute vcs kwon make money bank for living people second time fall trap player den compromised judgment due to loss incurred take irrational risks not good mind soul court of loss like sick member live pride survive loss lesson expensive life learning try to help people effort never considered waste give unfortunate people world around second chance change chip like river flow take risk underlying economy bad interested rates like sell trash willing buyer current price of the market never fair never change the subject arrangement manipulation that the market made the wealth redistribution scheme the worst it printed money in the open air,-1
keeping paxg normally go rest go ben diversify portfolio basic products get interests paxg I&#39;m getting interests nexus,1
don&#39;t see would sell moon the right people have the opportunity to sell instead of having obviously,-1
"think smart, still buying altcoins, guess the cosmos, buy smart since it was recently messed up.",1
Never give grateful crypto a boring time ahead veteran mantra,1
