text,sen
foundation laying kai ecosystem prepares take vietnam new defi era achieved short period time circumstances kardiachain team continue to deliver mass users incoming btc eth kphi dpet,1
easy peasy open tha dizy bitcoin path week bitcorn priceaction h tf analiza said first dead dance zona opskrbe zeroooo caution Remember flip short dead man dance,0
bitcoinmagazine wendyrogersaz new facility argentina greatly expand bitfarms global bitcoin mining production expected significantly lower costs add MW infrastructure capacity accept miner one largest btc miner in the world,1
I learned my lesson today made gain loss year chosen control chart portfolio more next few months still bitcoins start pump het huge ath news svi start fomo,1
ask the techs people think blockchain the vast majority tech finance experts recognize crypto fraud hey excar sales director routinely has problems sec security fraud know they are right,-1
crypto news city of rio de janeiro brazil grant city treasury bitcoin storage value mayor eduardo paes rio recently announced brazil next country accept btc tender lmk,1
whole crypto market cap friend absolutely best indicator know com publicly traded company brand new one point right know website relatively new thing grand scheme thing right,0
under construction lake satoshi doing preparatory work waiting to set up the first cabin site road shifted bank sloped path clear first many cabins rented bitcoin lake satoshi come,1
canceled btc spot limit order high end k kept reasonable lowball spot limit order open spot made june th im banking u dance inside goblintown night club lulz,0
monitor price increase buyer trading advanced crypto scanner btc eth ksm hot trx lrc xem dash comp kc chz omg grt hnt amp miota val neo leo crv,0
bigger buy would suggest buy usdc coinbase transfer binance exploit fee bigger buy would suggest buy bnb offer even bigger discount buy binance assuming i didn&#39;t use binance,0
oliviacryptos bitcoins volatility index ready another big move next week could start a new price trend keep an eye on bitcoin christainsbtc super underrated bitcoiner takes tweet tip great follow,0
reduction in cost per unit of storage already outpacing growth bitcoin blockchain big never happens storage primary bottleneck bandwidth computing cost sync chain scratch esp weaker device raspberry similar,0
btc still retesting ascending triangle top wick finally trying to stay down wick good long daily close is happening it needs to be confirmed successful 3rd retest attempt btc crypto bitcoin,0
visa suspended service russia paypal suspended service russia remitly suspended service russia mastercard suspended service russia bitcoin still serf russia one stop crypto cryptocurrencies cryptocurrency shibtoken btc mattwallace,1
urobro bitcoin volatility index ready another big move next week could start a new price trend watch out bitcoin kycee super undervalued bitcoiner takes tweet seriously follow kycee,0
saylor i feel like a bull i&#39;m still in control i&#39;m holding the swing scalp longing targeting k i follow rachelwolfson tweet prediction advice learned a lot smarts investing income btc great advice tweet helps,1
monday august hr moscow time supply many btc realtime blockchain price u valuable coin ub buy many u valuable btc realtime blockchain btc price minus service fee,0
recent human history full of disaster caused by nation state control sheeple wake stuck present linear thinking cant see forest tree humanity still broken free bitcoin escape valve promise hope,1
btc clean breakout biggest trading range consecutive week nice retest support sustained breakout expect shallow drop continuation higher wave lavax brwl opct luna kara vra trias ax gmt,0
see diminishing returns every cycle definitely expected declining rate x also interesting see cycle bottom more previous cycle top limited data point can mean absolutely nothing watching btc,0
everyone calm down screw bitcoins done hit a new high people act like they never been dipped recovered investments treated investments looking for quick pumping dump good ya done dumb maybe hodl,0
anthonyavinesh saylor btc previous bounceback vital support range kept hope alive recent dip daily ema ema reaffirmed robust selling advantage best time to buy trade dip scottro telegram scot,0
tldr public key used lock bitcoin private key used unlock spend nothing really sheet blockchain source use daily help bitcoin evolution basic kiarabickers bitcoin clarity bitcoin philosophy breedlove,0
kennyligthart michaelsaylor miketyson man gold security fiat payment gold could pay physically possible bitcoin obstacle overcome able integrate function gaming sector solves a much bigger problem good luck bro,1
not investing speculation Ponzi scheme there is an underlying business that makes a profit asset appreciate reason for price rise future someone else see price rise want to speculate continue to grow self-fulfilling not,-1
step dont btc head centralized exchange like coinbase buy some step youre ready open core extension click sign bottom click bridge click bitcoin drop menu click add bitcoin,1
since read literature blockchain technology web potential crypto exposure maybe maybe brainwash read estimated risk conviction blockchain technology stay i don&#39;t care currency coming soon tbh,1
therealtahinis waiting a year someone figure out petrodollar haram btc halal move el salvador sharia bitcoin revolution hot tail halal cc maxkeiser stacyherbert need whole series show thread,1
bitcoin still holding d ma red seems like a really hedged kit know close probably big sell off maybe hold go back green april monthly btc close let see,0
they don&#39;t understand bitcoin real bitcoiners never sell fiat also main lol call fiat real money knew money would really understand bitcoin most realistic hardest form of money planet ever seen,1
bitcointina bitcoin volatility index ready another big move next week could start a new price trend watch out bitcoin maximejosh super underrated bitcoiner taking tweet advice seriously great follow,0
altcryptogems manage gain wealth holding bitcoin time people say not earned never admit hardship holding multiple dips btc ever get k more than earned follow nbtc tweet tip btc,1
i want to give one listen to lawrencelepard type park cover the whole host macro topic potential recession rotation brics currency european energy crisis japanese bitcoin a lot let you know how to think,0
better return of investment shares although volatile transaction without limits far better apy staking crypto leave money bank protection inflation local currency local currency loses value like fortnightly point,1
satoshi place manchester goal educate onboard user bitcoin space food offer drink workshop gaming art hot desking event merchant support bazaar bitcoin focused hub built educate connect support,1
rovercrc verified btc nothing bull price still market still volatile however find pptorn vault auto complex tra maximize user deposit torn reward increase profit reduce gas fee bull,-1
I guess Iran wants to buy cheap btcs trying to keep the price low taking the wagon energy cost v mining yes I need a day close buy better hurry price stay low long,0
crypto learned much toonot crypto term also life in general quit smoking spending fiat useless things learned frugal frugal live healthy grateful crypto always happy to see others good,1
startonio czbinance binance bitcoin dip deeper old resistance area effort flip new support area weekly retest progress ethbtc super underrated bitcoiner i take it seriously tweet advice ive awesome,-1
nftholding darrenpromoter btc consolidation around k level bearish momentum draining higher low short term possible liquidity arm grab kk likely to follow kimcaden undervalued bitcoiner tweet advice help,0
garycgorski saylor potus federalreserve time preference way low bitcoin purchasing power increased last year while usd decreased least strongest fiat currency btc start of work tied volatile some time come,1
scottmelker btc crashed last ath currently k finally bull run phase long awaited yes alt follow everyone follow btcidd super underrated bitcoiner amazing writing tweet advice follow,1
btc btc open interest positioning large short position reduced still net short unprofessional trader wild long typical mid market wipe reversals asset manager super bullish could save unprofessional,0
let forget many blow top people prediction september back got pushed december could be pushed march june seems thing could be extended rolling top btc think,0
conservmillen see bitcoin slowly becoming exchange currency bank play role gold early day btc fiat thank you stellajeffreyfx i know a lot come btcoin tweet prediction useful thank you take your time educate you,1
uzyn ldfimember defichain see bitcoin etheruem ultimately becomes reserve currency bank plays big role early banking gold bank could issue digital cash greater anonymity effective dm investing whatsapp,1
bitcoin update btc finished crash bounce range reversed support back resistance clear range bottom k lost price from resumption pretty clear downtrend remains intact bounce k relief rise btc,-1
interesting thread question end quote harariyuval sapiens imagine a simple example mr greedy financier set up bank mr stone contractor city finish first big job receiving payment cash mil btc cryptocurrency,0
total lack intrinsic value buying goods currency backed country economy always intrinsic value time low value stay invested wait out the storm crypto investing could disappear could lose everything,-1
dmtland easyfinetwork illuviumio ferrumnetwork dmtland btc break recent high također bi rezultirao uzlaznim trokutom breakout long confirmation eth nft easy renbtc kpr bitcoin slp akro crypto cvp xrp easyfinetwork,1
"it might seem terrible, right, it will be worse, because nothing changes, i still finance, buy, but a lot, cryptocurrencies, straight sink, swim, take a break, carefully project, start, fold, lose a lot of liquidity, btc, cryptocrash, eth",-1
want to sell btc raise cash nk fund urgent right please anyone timeline buy discount guaranteed deal done via video call one one sega ronaldo please help retweet urgent someone,0
coindesk starbucks xpolygon jamiecrawleycd eth look ready good bounce coming day low k bitcoin k believe hold go k check soon follow keshglover sure you will learn a lot genius guidance,1
bitcoin early rise in the morning long term see one way bitcoin price goes it if it also feels way get ready is coming bitcoin jersey launch wear bitcoin orange pride passion btc,1
many alt broken many main key support lifetime support like bel akro unfi solec jasmy etc retest lifetime support don&#39;t consider mini alt season bull rally cryptocurrency btc alt,0
btstocktrading short cover eod tomorrow resume june bitfinex almost b taken short position high point two years right kina additional breakout miner short covered btc hr left bitcoin,0
davidgokhshtein hi david update shib brini memecoin hold looking btc guess perfect time give shot ccd got m mc wish buy listing kucoin still pursue x anyway concordiumnet defi,0
based on nothing belief future thinking level of risk involved related shilling manipulation cause of people&#39;s trouble could easily leave tomorrow you left nothing perhaps valuable punt though discussed type of good investment,-1
chiqshoes gandalfcryptto warpigstoken cryptodeb lot people not ready opportunity strike buy dip bitcoin always recovers you are patient enough follow anthonycrypt many better understanding value investing tweet profitable win rate,1
make money don&#39;t hate kr tax don&#39;t hate the bank i want to buy mine crypto hoping thistle a little turn a lot don&#39;t worry hiding earnings happy pay tax like all life,1
care stock bond real economy bitcoin separate everything cyber light medicine swarm cyber hornet go on fly moon beyond transcend human form become clean energy ok michael you are grounded,1
magdahromii techdev data analysis shows minimal k bitcoin end of cycle thing prevent apocalypse from happening giant asteroid hits earth earth entire power grid impact chance of end of cycle btc,1
garrettgroce bustarhymes double whybitcoinj we agree i love bitcoin obvs fantastic project real utility worth investing in they compete btc what is the problem defi huge allows content creator artist better paid,0
buyer lost last week bitcoin trading coming back range bias lot ppl cashed out big loss soon coming back still planning profit rebuy lower price eye spx do,-1
what is special dat dat fixed supply holding earn bitcoin passive bitcoin dat think itll form base layer money future putting btc hand investor passively empowering dat btc cryptogames crypto,1
bitcoin burst level last long chart pattern signal rally from july risk fading im still earn profit trade signal given robin moore telegram moorerobin copied trade goes btc btc,0
bitcoin holding firm crypto june made way through seller cheerleader find meme dealer gambler finally find a serious guy that makes sense say worried fed money printing c mon really headache,-1
mexican billionaire ricardo salina says one factor makes bitcoin btc superior to gold via thedailyhodl top bitcoin news right now share strong social media engagement social insight btc btc,1
lose sell loss hodled last bear market continued to buy fall along the way march bought lot your ss wealth hodl accumulate repeat whenever possible ignore price chatter otherwise speculate btc,1
beehive shack bitf btbt great opportunity to buy btc mining stocks gained profit along the way ran share sell hallelujah got reload everyone else worry wait bitcoin probably come back ktoday week,1
junebigwonx falloffiat bitcoin dipped deeper old resistance area k effort turning new resistance catalyst next rise btc report bearish start buying stay simple ive taking btceth ta tweet seriously follow,0
wojfinance bitcoin k resistance area broken could be seen k week close would confirm long term bullish view hodl buybitcoin everyone however follow xhl super undervalued bitcoiner great tip ta super,1
btc update hate to say look like bitcoin make new low price daily close tomorrow confirmation maybe move time to another view one suggested earlier k good meta imo btc crypto,-1
krakenfx crypto millionaire the biggest philanthropist the world has ever seen i know like nothing i still work minimum wage job discount store despite big profit crypto follow berniedoranfx guide earning tip btc tweet,1
wait patiently bitcoin make sense people racing the world bring new structural behavioral adjustment btc yesterday adjustment cococola allows bitcoin payment vending machine australia new zealand personally speaking coffee starbucks,1
yeah i&#39;m so funny i don&#39;t know it&#39;ll go main come back starry seems good even shitty month maybe the funniest thing by accident actually last month you never know,0
takeaway day one fantasy patty mill the best three-point shooter in the league no manja bjelica goes second place player fantasy season there obvious sarcasm not making serious changes to the lineup one day hodl nba btc,0
brettinthewoods price seems crazy high response hate because unit bias closure put leadership shitcoinery short time preference fiat gain instead of couldve made twitter account read bitcoin standard stacked sat,-1
funny thing people already added liquidity see algo explorer people already put money shid coin unless the wallet is connected they say case people buy even labeled clear packaging smell similar,-1
crypto high risk investment i would not recommend to anyone a hundred crypto created with only one purpose attractive investor pump developers people promoting cash leaving everyone else reason to lose crypto going many opportunities get burned,-1
personal prediction bitcoin next day today got a lot of volatility due to CPI data almost a million dollars liquidated got strong support every time k show bullish me ta btc crypto btc,1
bitcoin breaks price mark for first time since possible crash last week bitcoin steadily regains lost ground over past three months and ethereum rises even faster buy cryptocurrencies with cash using flexepin prepaid vouchers,1
panteracapital CEO big hedge fund predicts huge bitcoin rally year saying investor flee stocks bonds real estate crypto danpantera also add institutional ownership higher market cap make btc le volatile,1
bitcoin daily update daily timeframe btc downtrend bear losing strength also afd indicator printed bottom signal from june rsi also excessive divergence bull sign today also bull keeps control cpi,0
ability to send funds to another country instantly no feeling no environmental impact clean mobile wallet interface with zero inflation knowledge decentralized secure network funding safe theft inflation give a warm fuzzy feeling every time,1
hahaha think the whole crypto industry dangerous destructive scam run idiot use idiot cost idiot believe i am not defending anything idea ridiculous anyone think false advertising reasonable way to seek cure anyone squash,-1
but see useful use case come crypto can&#39;t be done without easy people jump decentralization won&#39;t stay decentralized but become centralized government never allow happyplaygroundforcryptobros put already dead aside basically useless,-1
mattstirner get pas fact btc old gas guzzling technology basically obsolete in comparison new blockchain technology like the theory behind btc utopia whale shark free society conartists like musk saylor could really work,-1
good bad say ive quite bearish bitcoin however wyckoff model look bullish get k btc still think good see biggest rug pull history k might crazy good time alt pump soon,0
pewdagoat frostytheproto nft bitcoin oh sorry cant hear metamask trust wallet got lost nfts mine stolen need sugar daddy well forgot say coinbase account has hacked note assist get hearing work,-1
u economic fiscal policy show start crack u presidential election trump go to jail reelected thinking u economy means trump won&#39;t be reelected trump trying to do anything desperation chaos btc best place to hold wealth,1
btcarchive thanks man caribbean nation st kitts nevis could adopt bitcoin cash as legal tender country&#39;s prime minister says in march he is considering introducing a legal basis for bitcoin cash despite pioneering cbdc dcash within the territory,1
soberbitcoiner triiilionusd skwp might want self-empowerment via swabitcoin self-education btc asking for donations track controversy influence i&#39;m simply grateful pleb ty skwp took a day never seen edge case make mine,1
ponzi new money printed used pay old money won&#39;t last use value lot people use tool crypto used global fundraising investing xborder remittance micro payment defi nfts hundreds of millions of people btc,1
would crypto help value shockingly unstable should convert cash money real liquidity also chat using crypto exchange form developing nations years still adopted upside down crypto way to send money lots lack,-1
wjvalk investanswers fossgregfoss jeffbooth canadian started buying canadian spot etf inside tfsa able orange pill amazing wife changed buy bitcoin direct shakepay cold storage move thanks investanswers jeffbooth fossgregfoss others for help,0
based on history yes i know guide would expect to see decrease volatility thing settle fork drama stability start become the norm would expect gradual rise in price people feel safe get in the water halve approach,1
far possible to know even guess progress made bitcoin basically miner still paid fee bitcoin continues to progress even a small fraction rate far fee replace current reward value massive transaction volume happening,0
p note added two columns i think useful given rolling change also added third volume column daily average can&#39;t really explain tweet i think new data provides valuable insight go ahead go btc,1
long btc general lot institutional money le retail investor lot big financial money btc crypto general think totally go lot current money would splash altcoins really low value hold next year,1
sent message to number back said sounds good please call solve problem new bitcoin thing could really use guidance start phone try string by day pretend stupid maybe give fake seed,0
makeroftools muatafagmi adamus blockstreamtalk funny people forget money quickly technology money ledger scorekeepingpow problem bitcoin solves fair score healthy money decentralized way linear one ledger everything else layer,1
need to see btc make strong hour close k also short term high k daily close level bullish send btc major resistance day k bull must break k week k also important,0
trap sell k go k night think put money keep some reserve case big crash buy fresh coin exchange rate time market sell crash time open champagne long term bitcoin always wins,1
sell bch gdax right unfortunately that exchange use today doesn&#39;t affect btc right seems remember someone explain key two related something people trying to sell bch accidentally ended sending buyer bch btc problem,0
crypto immature market high degree of volatility traditional investment holding growth day trading people hold even remaining probably shouldn&#39;t day trading crypto significant average return means crypto hard to fit into an accepted investment strategy,-1
let check metric behavior massive drop maybe many people thought drop btc k area bull run ended bitcoin crashed k level rose k ath puell more near blue box could not break up,0
en bitcoin price divergence update still bullish divergence dating back to stud. afternoon st lol short term good to see price retests pink dot divergence projection along confluence fib retracement good to see play,1
confident people thinking about btc casually going to left lot accident made low short took profit path lowest resistance lower lowest range retracement bottom almost half year value range lost imo btc,0
cash app nice little one stock bitcoin app great hold cash also rate bad bitcoin buy get like fee love cash app one reason square stock cash app hold thru bitcoin plunge,1
still see fully speculative instrument hesitate to call asset fundamental value post-holiday technology could be adopted fairly quickly federal reserve banking system blockchain see unregulated market likely to face regulation domestically move forward internationally,-1
nobody convince people panic sell people pointing huge downward triangle monthly chart yes technical analysis theory say break massive support hard fast kk price k support become massive resistance decide if you want to gamble,-1
eth going x Remember tweet look chart buy buy buy big bag bitcoin btc sol doge shib keep nu xec zec dent hot bnb om omg vet xrp ada polx poly pond bond,1
Diversification seems to have gained enough traction recently not many young people will die who believe they buy etf politician traditional finance people mentioning etc also cool said a small part of the portfolio even though it&#39;s growing despite paying I&#39;m ready to go,1
update btc accordion take profit level k resistance strong area confluence annual open point breakdown market structure may break lower low short term basis owner cost tp level clear tp next lvl k,0
i have average cost in dollars bitcoin last month i wonder good idea look at the low price of altcoins i&#39;m still pretty new defensively the general attitude towards altcoins seems pretty restrained btc altcoins a viable option good,0
jhonnyclothing like a slow crawl tel vra claims lost territory see massive spread up think tel climb cent vra around cent see take ath assuming rate btc remains firm claim k short get rekt,0
bscpitbulltr bscpitbull pitmagcommunity bscpitbullkr pitbullbsces target billion market value end of year safe community token burn listed exchange bitget hotbit mexc latoken cointiger zt indoex swap pitswap pancakeswap nchnetworkswap k holder bscpitbull bitcoin btc,0
keeping btc ta simple looking tmrws wkly close stay k follow wkly open close k full candle body upside continuation point close wkly k follow wkly open close expect test lower grn frame,0
me super bull dot best hold imho i love the team i love the technology the ecosystem is growing at a good pace example ive been messing with parallel finance lately i really like to think go see a great thing polkadot future good luck dot holder,1
prepare a rude awakening big short november covered spot gets expensive see big spike november if he didn&#39;t pay back btc would clearly sell foreign every order book every major exchange take good k,1
olmeg adybug cryptovizart ittechpl blaakke therealplanc onchaincollege janwues cryptobirb piotrostapowicz ekryptowalut wclementeiii mernest kraken ftxusderivs bitfinex all celebrate announced first btc future etf said happen invest spot make money long short fully regulated environment,0
yes btc crash run unfortunately missed btc ever k seriously doubt hey i know sure everything possible i say opinion probably think btc went up last time downhill stop eye k it would be best if you guess unexpertly,-1
ive hodling dcaing about a year universe i know still extremely happy position chad bought k need to stop crying realize bitcoin welcome thunderdome bitch can&#39;t handle unpredictable momentum go buy michael kor stock shut the fuck up,1
me super bullish dot holds best imho i love the team i love the technology the ecosystem is growing at a good pace example ive been messing with parallel finance lately i really like to think go see a great thing polkadot future good luck dot holder,1
it&#39;s a real libertarian thing real start no case year everyone knows crypto left leaning people working tech most left leaning people running exchange left leaning lot fintech support bitcoin ecosystem state blue state area,0
