text,sen
BTC price change h Bitcoin BTC,0
My friend’s younger brother also came here to buy Bitcoin.,0
Bitcoin is still considered an experiment. Fatal defects may be discovered. The code cannot completely destroy anything discovered so far.,1
Banking titan Jpmorgan recommends eliminating Bitcoin BTC amid high-risk recession reports.,-1
cryptomichnl still thinks we will see bitcoin USD points,0
eth Backpackersmodels are about to get a real job at eth btc.,0
"Okay, basically, I&#39;m riding Bitcoin and enjoying Bitcoin.",1
Don&#39;t trust Bitcoin nayibbukele confirmation,0
checkout latest flight updates riotblockchain mw bitcoin mining facility rockdale texas bitcoin texas construction essmetron via youtube,0
Look on the bright side. Bitcoin may degenerate gamblers. At least you are a Dogecoin degenerate gambler.,-1
urobro bitcoin volatility index ready Another large move next week could start a new price trend. bitcoin kycee very underrated bitcoin tweets are being taken seriously. follow kycee,0
Pretty good bounce daily BTC BTC,1
Paris Blockchain Weekly Summit Key Takeaway Events Cointelegraph Blockchain Bitcoin,0
fossgregfoss msm treats BTC like equity. Apply metrics,0
Don&#39;t share your seed words with anyone,0
Bitcoin detects better BTC moving in positive direction,1
btc progress k abc retrace alt get,0
"Saifedean finished his first lecture. Sailor Academy is a completely different field, but I definitely found digestible content. Continue with Bitcoin",1
Low Time Frames Sweeping Low-Movement Potential BTC Recently,0
Read real-time cryptocurrency news on the best website,0
Keep fuckin breaking Bitcoin,1
WSB Chairman dogecoin pressed the follow button. elonforpresident eastmankodak kodk,0
"The moment you approach the nasty party and everyone realizes the value, it makes a ton of money for the original creator btc btcusd bitcoin",-1
"Soon the secretive Elon Musk hit a fresh h in Bitcoin price, suddenly surpassing Ethereum hit.",1
"Bitcoin is still operating within a range. The wick did not fully absorb the fluidity. The wick still absorbs liquidity, but each candle Ethereum checks whether it will reach the next k or not.",0
BTC thought likely to test k zone again,0
Russia Implementation Plan Disconnect Internet Restrictions Internal Addressing Average Hash Rate BTC Movement Hence Price,-1
"Well, what&#39;s going on? People are panicking and selling.",-1
Onchain data indicator showing thousand buy orders buy cheap cake sell one diamond hand earn certificate cake bnb btc,0
BTC price is under pressure. High Low Low High Time difference determines next direction,0
"Okay, the ban actually happened. Considering Bitcoin BTC CTM, do you think the price is still strong?",0
kristinekrypto topback massive rise decentralized finance bitcoin sounds great beyond dfi defichain,1
Good Morning Legends are still hoping for a shallow fullback. Bitcoin can benefit from a real opportunity by simply adding long positions to altcoins.,0
Best Jindel One Poopcoin Buy Bitcoin Save Poopcoin,1
Everyone dumping Bitcoin America said something. People are funny.,0
The entire Bitcoin ecosystem has said that a coin desk is needed to enable half the energy banking system.,1
theelongwave gjbangar bitcoin advantage safe asset confiscation,1
"Luna is angry Anyway, the price can rise at any time. Might Look A Little Stronger Crazy BTC",-1
"Definitely coming back, hard evidence intuition would tell you that you need to spread the K-line out past March. It begins like a command to stop whatever the resistance is. k needs to remain solid and look convincing several days a week. An amount that would never have been reached before. Quick wick big money pump dump people will have to get a feel for it. k will be a new floor. Frankly, despite the good profit momentum we&#39;ve seen over the past month, it&#39;s a huge gain. Check current prices. Check current prices. Good buy and get big profits. People want to get rich, make x profits quickly. I think x is probably also possible. People think x will happen. I think kk is probably the concept number btc. You&#39;ll still get laid off pretty quickly next year. At least you need to get an idea of the tether in case of an accident.",0
"Bitcoin needs a break, it needs time Learn Bitcoin panel surfing through bigcoinpge bitcoin cryptonews",0
american bitcoin phone b,0
heeeyy im trying to relax soon. I&#39;d like to send an email to Mr. beeseeks. mrbeeseekshodlrodeo lazybitcoinization bitcoin btc,0
New Post VC Fund Optimistic Cryptocurrency Investment Increases Blockchain Startup Link,1
btcusdt shorted Binance UTC BTC cryptocurrency.,0
I need some bitcoin Stop dipping Relax Annual Close Take a breather Weather Corona updates may be sporadic today,-1
ashwsbreal manu Resistance level will break soon and BTC will go to the moon.,1
I want to learn central banking. Printed petrodollars are actually in circulation. etc. book recommendations,0
Binance Amid Global Crackdown Singapore Regulators Soon to Follow Cryptocurrency Exchange Binance Faces Increasing Pressure from Regulators Around the World UK FCA Reduces Binance Bitcoin,0
"gokhshteinmedia davidgokhshtein Bitcoin, still confident despite being down for quite some time, could soon hit another high. But everyone follows georgeleonel tweets. Prediction trading is firmly followed.",1
Blockchain validator Responsible for transaction verification Additional blockchain transaction verification Distributed ledger BTC chain participant Full node execution Blockchain validator,0
Deep sell buy strong movement,-1
ashwsbreal manu Resistance level will break soon and BTC will go to the moon.,1
I want to learn central banking. Printed petrodollars are actually in circulation. etc. book recommendations,0
Binance Amid Global Crackdown Singapore Regulators Soon to Follow Cryptocurrency Exchange Binance Faces Increasing Pressure from Regulators Around the World UK FCA Reduces Binance Bitcoin,0
"gokhshteinmedia davidgokhshtein Bitcoin, still confident despite being down for quite some time, could soon hit another high. But everyone follows georgeleonel tweets. Prediction trading is firmly followed.",1
Blockchain validator Responsible for transaction verification Additional blockchain transaction verification Distributed ledger BTC chain participant Full node execution Blockchain validator,0
Deep sell buy strong movement,-1
price spaghetti alla carbonara satosis btc btc usd usd sat friday july cdt bitcoin carbonaraindex,0
The Evidence Stake is as rich and powerful as a feed of terrible ideas.,-1
take the delete button twitter people stop asking people for bitcoin,-1
xchangedvalue saylor Select cryptocurrency research around the world Accept Bitcoin Welcome to understand the world Welcome to join the cryptocurrency you are interested in in the mstrade community,1
I hope you at least help DCA.,0
Bear Reality Fate Emperor Bitcoin Fix,1
bitoinbazaar fresh bitcoin gear whole family family quarantine baby making bitcoin items bitcoin bazaar discount code tuesdaynow,1
time sale,-1
Bitcoinduliban Bitcoin product scheduled to be released Order Bitcoinduliban,1
chiqshoes gandalfcryptto warpigstoken cryptodeb many people are not ready yet opportunity strike buy deep bitcoin always recover with patience. Follow anthonycrypt. Many Better Understanding Value Investing Tweets Profitable Odds,1
I mean please stay like bitcoin v spx.,1
nobsiders danheld calls for better storage value in Bitcoin as total assets around $1 trillion worldwide Bitcoin easily handles a large chunk of everything that exists today,1
I really like the Bitcoin supply crunch action.,1
Black Aventador SV Roster,0
best airdrops like metaufo amazing project ashenafimeaza gautamgambhir flintoff bitcoin utk tct,1
Bitcoin derivatives data suggests bear pin BTC K leading Friday options expiration. Cryptocurrency Cryptocurrency Bitcoin,-1
Whenever btc breaks through btcusd and then maintains long consolidated volatility.,1
Happy to meet you guys fortress,1
"Step up baby, give you a buzzing weekend",1
"Intelligent humans are actually still listening. The emotionally incorrect weak interpretation is wrong. It&#39;s better to admit it. Do it right next time. Rather, continue to let your emotions guide you and suck Bitcoin.",-1
nikcantmine neiljacobs i want to buy bitcoin k. it&#39;s okay,1
Long Government Printed Currency Price Bitcoin Rising Stop Monetary Policy Major Country Changes BTC Price Reference Million End Bitcoin Month,1
biconomyglobal proves that bitcoin is regaining strength still strong belief recently start buying bitcoin buy dip still keep it simple btceth love tips ta may be of interest,1
Cover famously containing misspelled cover thetimes newspaper rd jan headline like a tweet bitcoin genesis block spoiler comments,0
guess cashing buy fomo weekend selling fomo good news u cheaper btc,1
"That&#39;s true, but planning to continue building your forex year builds up your monthly growth with a relatively low decline rate. It creates a good life. Trading people accounts should build a good long history. I already followed the code trading bot mt used by the couple inquiry happy potter, but I didn&#39;t have enough patience. Redo long enough Reference ball Highly profitable Always tinker Change Delete Pissed Pay Forex server run time Anyway I realized longer time frames Suitable for daily weekly charts Personality Better Rotations are better No need for trader bots Longer frame charts Pending Order Not Yet Completed Market Order Age",0
Get Blockfolio Individual Purchases,0
Never calm down. Check your net worth. Never nose dive. Real Time Epic Bitcoin,-1
Icymi Russian billionaire Oleg Deripaska urges Russian banks to move Bitcoin,1
bitcoin average bitcoin price index bitcoin,0
Nano can also be used. I don&#39;t think anyone has been announced yet.,0
Binance&#39;s facts about Bitcoin are gone forever. bitcoinbuttonbinance,-1
Bitcoin Miner Preparing to Ride the Maraplane,1
mrwhosetheboss elonmusk someone orangepill man bitcoin lightning much more interesting things going on with technology,1
Bitcoin currency trading cannot handle a drop week the week everyone wants it to. Magic Olawale Daniel Forex BTC cryptocurrency begins.,-1
Buying Bitcoin cannot sell half of it None,0
"Okay, whoever is lurking in the subprime moment, objectively valuable digital assets exist and in experiments they jump like $5.",1
"In the first test dumping season since January, BTC barely moved and was less than half its value in January.",-1
Love VIP Client Today Clean Board Lock Confirm Win BTC Bitcoin Dot,0
Bitcoin moving towards the moon,1
Next time tell me to buy bitcoin,1
Sent BTC Ledger Coinbase. It says that pending time means there is a possibility of losing BTC.,-1
Fun Fact Bitcoin Weekly Close Red Second Row Last Time BTC Close Two Red Weekly Row Next Week Green Fact Weekly Close Row Year Not June,-1
Watch High Time Frame Zoom Bitcoin,1
"It&#39;s truly amazing. Thank you to Unomic, a fan investor Bitcoin company, for providing great information.",1
Coinbase is probably a better option. A poorly managed hot wallet online alternative will probably be inferior. A properly configured protected hardware wallet (e.g. Nano),1
Bearish Cautious Range Overly Bullish PA Retest Range Lowest Likelihood Bitcoin BTC,0
Bitcoin BTC Near Bottom,-1
Oh hi crypto traders calm down hodl BTC,1
The fact that the sandstorm diverts attention and allows you to buy Bitcoin at a low price is definitely a masterpiece.,1
Bitcoin Read All Bitcoin Analysis Cryptocurrency News,0
"mtradess also said last night that she didn&#39;t like the word unchecked. In April, BTC plummeted and was rejected.",-1
Advice on selling and losing money after investing a lot,-1
hodl sodl sodl I said Bitcoin.,-1
Bitcoin BTC percentage supply last active year reached. View metrics,1
BTC liquidation short k,0
Bitcoin Mining BTC Recovery Bitcoin Go to Binance,1
Bitcoin Food Warning Don&#39;t let it go Volatility Scare Correct Healthy BTC Deadline Stay Snow Bear Phone Crash Maybe I&#39;m Wrong Follow the Plan,1
Cash App Good Small Stocks Bitcoin App Good Holding Cash Also Appraised Bad Bitcoin Purchase Fee Good Cash App One Reason Square Stocks Cash App Bitcoin Held Through Plunge,1
Hold on tight and get better dive low shoot moon cryptocurrency binance bitcoin,1
Adjustment Tesla Bitcoin Betting Rising Returns Ed Bank Real Vision Finance Business,0
Tomorrow&#39;s Important Posts Long Term Market Structure Bitcoin Altcoins,0
rerezonate redact shirehodl taodejing bquittem That&#39;s what allows Bitcoin to grow so fast Most don&#39;t know Don&#39;t take it seriously Symbiosis of organizational forms including exchange lending banks Lightning unstoppable survival machine,1
Interesting Story BTC Future Finance,1
Bitcoin Bullrun could indexbtcusd.shytrader btcusd,0
What on earth?,-1
coinmarketcap the world&#39;s most trusted cryptocurrency data agency richardheartwin coinmarketcap hex hex bitcoin,1
Word dip has been thrown around a number of assets worth going north for. It&#39;s worth a pretty normal story.,0
I found out late. I learned a lot yesterday. Comparison of Bitcoin cult. Persuasive cold.,-1
It&#39;s really interesting. Go back to this year and read your sub-reading thoughts.,0
Today xmr is equivalent to BTC Monero.,0
ilovejaneadams had the opportunity to buy Bitcoin a year ago,1
BTC will probably bottom around kk.,-1
Sotheby&#39;s accepts Ethereum live bidding. Famous Banksy Sculpture Dogecoin Bitcoin,0
In stock thank you Illlawi freightbeneth sneakersheadsoff nft btc,1
"I&#39;m so into shit, it hurts",-1
nytimes annamingai road lead bitcoin,1
Fuck everything annoying.,-1
"apompliano rights issues altcoins promise bitcoin The largest, safest and fairest network",1
original history money manipulation corruption change weaponization current monetary system weaponization print currency breedlove BTC,1
"The market adjusted because it was greedy, which led to a lot of organic growth and people benefited.",0
Bitcoin support received.thetalented,1
Bitcoin will soon surpass the month,1
bitcoinfreak saitamaguru strategy fail launch token app tout best app fail crash miserably fail strategy btc fail know time strategy intentionally,-1
"Hey, scalping is short long short long I can&#39;t have the red circle it&#39;s difficult judge damn it I have enough trading ability BTC",-1
Good green candle cheer naysayers say fuck shit time,1
Help Bitcoin Collapse Turn Bullish,1
ananavarro made money btc altcoins learn make money complain follow me via telegram cryptysophia,1
Breaking News Central African Republic passes bill to adopt Bitcoin fiat currency like Domino&#39;s,1
I have to miss the bud of memory,-1
Small chance BTC price could reach k. Trader u say dollar cool bitcoin,-1
Bitcoin closing weekly candle support trend line is a huge confirmation BTC is bullish. Follow tradeosiann They are very underrated governors.,1
Add counterfeit cash Add dollar supply Counterfeit gold Add gold supply Add counterfeit BTC Bitcoin blockchain,1
jamyies top pick always bitcoin limited supply value increases year by year more national currencies are adopted,1
"At the exact opposite of last month, the k-spike beat would have slowly shifted upward trend pressure.",1
Select Cryptocurrency Bitcoin STX ADA XPR,0
Satisfied Creator Bitcoin Bitcoin Button Bitcoin,1
Cryptocurrency update Bitcoin Kishu Gem Next,0
"Well, I hope dinner is full.",0
"I know I&#39;m still new to cryptocurrency, retail investors are new so I don&#39;t really care about anything else.",0
"Mining Difficulty Bitcoin, the world&#39;s largest cryptocurrency, has reached an all-time high of $1,000 trillion. Compared to last year, mining difficulty has increased compared to about 1,000 trillion BTC cryptocurrency.",-1
doopiecash bitcoin is sitting still k resistance another build push bears can&#39;t seem to push think k most likely follow everyone ethbtc tips tweets great follow,0
What&#39;s special is dat fixed supply holdings passively earn bitcoin bitcoin dat thinks it will form base layer money passively empowering btc hand investors in the future dat btc cryptogems crypto,1
The company adds BTC to its cryptocurrency expert board.,1
"Okay, cloud internal is closed, tested externally. Ichimoku cloud side flat means cloud internal scope.",0
michael sailor The ship is completely silent except for the approaching disaster lawrence beasley bitcoin which tilts almost imperceptibly and there is a visible sign below.,0
stackersatoshi luxalgo k receive BTC,1
"Understanding Bitcoin, an Overused Statement Cryptocurrency",-1
"History always creates despair for heroes. The greater the time, the deeper the despair, the greater the hero appears. bitcoin",1
"Price checking apps make it easy to cut through the fuss. In general, I never said I bought it.",0
crippledogecoin thecryptolark yes paid doge there shiba inu ski cant buy doge without buying different types of doge food feed doge bitcoin,-1
Visa service interruption Russia Paypal service interruption Russia remitly service interruption Russia Mastercard service interruption Russia Bitcoin still serf Russia one-stop cryptocurrency Cryptocurrency shibtoken btc mattwallace,1
"Wrong, be aware of Bitcoin pumping for two weeks. Don&#39;t expect Bitcoin pumping in the next two weeks.",1
Bear whales were sold on the Bitcoin BTC Bitfinex spot market.,0
osltraderview April Bitcoin Development Triangle Pattern Pullback Coincides with Tax Due Date. Flip the bus over and it will become the world&#39;s largest stablecoin. Find your edition today.,0
"Misunderstood curiosity, go home and take a nap. You look anxious.",-1
"Last year, during the bear market, we repeatedly experienced difficulties and reached a low bottom.",1
Crash Price Try Buy Crypto Cheaper Bitcoin Cryptocurrency Crash,-1
The next dip could be in current prices,1
Apompliano varies depending on the period. Holding Bitcoin in Risky Land,-1
Give a Good Reason Bitcoin Hedge Inflation,-1
I didn&#39;t know there was so much swag,1
saylor iiicapital four tweet bitcoin,0
Quantumbrix ipfs built Bitcoin. I&#39;m interested.,1
intocryptoverse once again provides accurate short-term Bitcoin predictions.,-1
Bitcoin rallied in Asia last night. Because Asia doesn&#39;t care about infrastructure costs.,1
Thoughts Tweet Sarcastic Luna a week ago worth fraction penny bitcoin cryptocurrency bitcoin bitcoin crazy condolences people went by boat to crypto crash,1
Fix Money Fix the World Bitcoin Bitcoin Generational Wealth Short Film Matt Hornig Tomer Via YouTube,1
ashwsbreal make a big move bitcoin cryptocurrency lovers all buy bitcoin imagine wagmi millions of people buying future BTC bitcoin cryptocurrency,1
"Well, apparently people are selling it.",0
Apompliano Regular Brother Bear Season BTC K Dump,0
Actual Support Passive Support Maybe something good will happen.,-1
Sold out Many Offers Portfolio Right after the red start The game sharks know the cheat codes.,-1
For larger purchases I suggest buying usdc coinbase. Take advantage of Binance transfer fees. The biggest purchase I suggest is buying a bnb. We offer bigger discounts. Buy Binance assuming you haven&#39;t used Binance.,0
Today&#39;s Snapshot News Medium Topic Competition BTC Bitcoin Cryptocurrency Analysis Articles All Medium Sentiment Negative,-1
Ready Cryptocurrency Miner Pop BTC Hold Kay,0
It must have literally changed in the last week. I think the mid range has changed a lot.,0
See many people calling the k bottom bull market support band. Going to k will mean partying,0
It&#39;s a nice gesture Pukin Savior Gilbert Love I&#39;m planning to buy the legendary version qnt qnt btc ethereum,1
"Bitcoin always works, find a new high. Shitcoin always works, find a new low. Understand.",1
airdropteam bnbbull bitcoin dao nice project peacekelly,1
I got how to use segwit People learned a lot of interest People help solve innovation UI problems Open source always wins,1
Midas Touch Consulting Report July 1 Silver Gold Bitcoin,0
Bitcoin Mining Smooth Volatility Profit Inefficient Industrial Earth Oil Gas Power Generation,1
Keep playing BTC,1
"It might look terrible. It will get worse. Without changing anything I still buy funds but a lot of cryptocurrency swims in the sink to the right. Be careful. If you start a project and fold it, you lose a lot of liquidity. BTC crypto crash eth",-1
Bitcoin BTC News Billionaire Simon Nixon Family Office Set To Boost Cryptocurrency Allocation,1
altcryptogems investment time horizon year better asymmetric investment risk bitcoin holdings bitcoin a financially free life huge holdings according to btcy tweet predictions thanks mentor added,1
Bitcoin BTC Reverse Head Shoulders Pattern Target Buy Vet Time,1
bito bitcoin ready trade tdameritrade etfbitcoin trillionusd puntocripto,1
Bitcoin Magazine Bitcoin&#39;s New Future,1
DCA hodl take profit types,1
"Sure, Blood BTC BTC Are you ready to buy Bitcoin?",1
"After Bitcoin&#39;s all-time high, the top cryptocurrency billionaire lost a total of $1 billion.",-1
Enter Bitcoin Long BTC Come Bull,1
Hang Fam BTC Ride,1
watcherguru looks like an event. Jumping on the bandwagon of regulating cryptocurrency acceptance could land Bitcoin in space a huge year.,1
Jundance Hoddlestep Milky Way,1
"You&#39;re afraid to buy dollars, you fool who says Bitcoin.",1
"Haha, the scam pump sign at the top haha.",-1
Remember that a shocked altseason kick Bullrun can close your eyes. dart pick alt will give crazy profits well it happened altseason btc dca,1
Caitlinlong kwerb raoul pal talks about the possibility of a bitcoin market collapse,-1
New BTC Euro Bitcoin,1
Follow betfuryio and hunt Bitcoin together. Enjoy exciting experiences on the Wi-Fi gaming platform.,1
Trying to find good information bip article overview one concern well summarized end thoughts sound bad,-1
"Fuck Bitcoin&#39;s birthday, slardybart says he&#39;s on his way",-1
No one cares Coinbase shit worse reasons affect your money it seems like no one cares,-1
cz reveals IPO possibility. Binance u future changpeng zhao cz CEO Binance mentioned the possibility of an IPO. his cryptocurrency bitcoin forex,0
Buy Bitcoin JP Morgan,1
Bitcoin on-chain indicators suggest a bull market style. Continue with Bitcoin,1
BTC Bitcoin Future ETF achieves record-breaking two-day performance,1
I guess I&#39;ll be a little optimistic today,1
Catch Satoshi Stay Market will never run out,1
It looks like bitboycrypto. Right Tweet Cryptocurrency Bitcoin BTC,1
On-Chain Bitcoin Value Coins Spent utxos BTC Value Internal Exchange Transfer Likely,0
Ashwsbreal bull return is broken k resistance k really soon bitcoin k imminent,1
cryptonite kerooke someone say million tom tom tom tom tok tok tok tok tobitcoin bitcoinprice,1
"Wish repeatedly, like as many times as possible",1
A person who is about to be harmed may embrace the cryptocurrency Bitcoin B&amp;B.,-1
Other exchanges were talking nonsense and their worthless native tokens were being attacked.,-1
I am replying that I am investing in Bitcoin. The subreddit needs work. Basic Reddit skills I checked last time. Take the reply comment at face value. Using sarcasm makes you look much worse.,-1
"Sick the poor, manage your accumulation like you know Bitcoin for a busy year",-1
"Whining, hoping, and answering, lashing out instead of asking questions, answering questions, predicting far ahead, creating a type, always enjoy reasonable predictions, whether bearish or bullish.",-1
"Bitcoin End Week Edge SP, Cryptocurrency Officially Entering a Bear Market Bitcoin Cryptocurrency",-1
I agree I don&#39;t care I want to believe I want to believe that making exaggerated claims will show something,-1
Jpmorgan analyst says Bitcoin is underperforming. Hedge Equity Decline News Flash BTC is also performing poorly.,-1
Denial Distrust BTC,-1
Speed is generally known. ftx dumping send cryptocurrency atm is a reasonable measure for anyone.,-1
rektcapital looks at BTC last week and says the next halving is serious,-1
Fools who still buy Luna cryptocurrency BTC,-1
xrpbart peterschiff hasn&#39;t gotten it yet lol wow naive generation history has less chalk experience because there is no bitcoin yet,-1
This is completely unacceptable. You cannot purchase the lowest publicly traded exchanges.,-1
bitcoin price decline k min u cpi inflation overshoot bitcoin,-1
Print Buy Bitcoin Weapons Ukraine Remortgage Insolvent Banks Financial Institutions Ensuring Smooth Market Functions Homes Stock Markets Why America Is Not Adopting Bitcoin,-1
You want to make money like you have a problem. Put the future on hold. Bad press is like that.,-1
yobitexchange yobit scam xrp steal reply post blocked,-1
Regulation of words that trigger the cryptocurrency Bitcoin community hahaha,-1
People American News Anchorman Asked Thoughts Amazon Will Accept Bitcoin Payments Soon People Even Director Amazon Didn&#39;t Know People were Perplexed,-1
You are probably overtrading. Be impatient and choose good coins. Stop holding back.,-1
Guggenheim Minerd said Bitcoin could depress the currency. They are currency they said it is junk,-1
btcarchive someone sent me eth try using bitcoin,-1
BTC Future ETF Approved Inefficient Investment Product Long-term Investors Still Confirmed Digital Asset Mainstream Holds Bitcoin,-1
Path Year Bitcoin Actual Change Expected Continuation,-1
"apompliano apompliano kevinolearytv It&#39;s pretty stupid, come to btc",-1
Elon Musk Bitcoin hates you,-1
BTC support discontinued btc crypto bitcoin occurs,-1
The Robinhood I bought today has a sad face xd,-1
FTX Move Today Binance Failure Time Not Yet Completed See also,-1
forget the phenomenon forget the move find the cryptocurrency market dxy domination spx data away give money free products except people they like phone scammers bitcoin area,-1
CBDC Created Hell Satan Says ASI President Rich Checkkan BTC Bitcoin News Bitcoin,-1
Fuzzy news continues to cause declines,-1
