text,sen
dmtland easyfinetwork Iluviumio ferrumnetwork dmtland btc break The recent high will also result in a rising triangle breakout long confirmation eth nft easy renbtc kpr bitcoin slp akro crypto cvp xrp easyfinetwork,1
"It might look terrible. It will get worse. If I don&#39;t change anything I still buy funds but a lot of cryptocurrencies swim in the sink to the right. Be careful. When you start a project, you lose a lot of liquidity. BTC cryptocurrency crash eth",-1
I want to sell BTC cash raise nk fund urgent rights pls anyone timeline purchase discount guaranteed transaction completed via video call 1 unit sega ronaldo pls help me retweet anyone urgent,0
coindesk starbucks xpolygon jamiecrawleycd eth ready good bounce coming day low k bitcoin k trust me go check it out soon follow kashglober you will learn many genius guidelines,1
"Bitcoin Wake up early and watch the long run in the morning Bitcoin price goes up and if you feel good, get ready Bitcoin jersey launch wear Bitcoin orange pride passion btc",1
Many alts are broken. Lifetime support like bel akro unfi soletc jasmy etc has been discontinued. We&#39;re retesting lifetime support. Don&#39;t consider mini alt season bull rally cryptocurrency btc alt.,0
btstocktrading short cover EOD held tomorrow June 1 bitfinex almost b short position peak 2 years right China&#39;s additional crackdown minor short cover btc hr left Bitcoin,0
davidgokhshtein hi david update shib worried memecoin hold looking btc guess perfect time shoot i hope ccd comes to m mc bought the list kucoin still pursuing x and anyway concordiumnet defi,0
"Believing in nothing Future thinking level Risk-related shilling Manipulation causes What people don&#39;t like because it can easily go tomorrow We&#39;ve discussed the types of sound investments, but we&#39;ve left nothing worth a punt on",-1
chiqshoes gandalfcryptto warpigstoken cryptodeb many people are not ready opportunity strike buy deep bitcoin always be patient and recover enough. Follow anthonycrypt. Many Better Understanding Value Investing Tweets Profitable Odds,1
Make money KR Don&#39;t hate taxes Don&#39;t hate banks I want to buy mine cryptocurrency I hope thistle bits change a lot Don&#39;t worry Hide your income Be willing to pay taxes like you do your whole life,1
Governance Stocks Bonds Real Economy Bitcoin Everything Separated Cyber Light Therapy Swarm Cyber Hornet I think it&#39;s going to fly Beyond the Moon Transcending the human form Becoming pure energy Okay Michael you&#39;re grounded,1
magdahromii techdev data analysis show min k bitcoin end cycle prevent something from happening apocalypse giant asteroid hit earth hit entire earth power grid chance something happens end cycle BTC,1
Garrettgroce Bustarhymes adouble Whybitcoinj agree bitcoin obvs fantastic project. It&#39;s a real utility worth investing in. They are competing with btc. What is the problem? It allows huge content creator artists to make more money.,0
Buyers lost Bitcoin in last week&#39;s transactions. It&#39;s coming back. Bias lot ppl suffered a lot of loss. Will be back soon. Still planning for profits. I would repurchase even child spx at a low price.,-1
What&#39;s special dat dat fixed supply holdings passively get bitcoin bitcoin dat thinks it will form base layer money passively empower btc hand investors in the future dat btc cryptogems crypto,1
Bitcoin Burst Level Past Long Chart Pattern Signal Rally Risk Fading Since July I&#39;m Still Taking Profits Trade Signals Given Robin Moore Telegram Robin Moore Copied Trades Went To BTC BTC,0
Bitcoin holding company cryptocurrency june found its way through cheerleader salesman. Find Memes Trader Gambler Finally Found Someone Serious It Makes Sense Say I&#39;m Worried Feed Print Money C Month What a Headache,-1
Mexican billionaire Ricardo Salina says via Thedailyhodl that one thing that makes Bitcoin BTC superior to gold is that he frequently shares the current top Bitcoin news and shares strong engagement across social media. Social Insights BTC BTC,1
Lose Sell Lose Loss Continue to Buy in the Last Bear Market Decline Buy in March Bought a Lot You ss Accumulate Wealth Repeat Accumulation Whenever Possible Ignore Price Chat Otherwise Speculate BTC,1
hive hut bitf btbt good buying opportunity btc mining stocks made profits along the way. Running shared sales hallelujah all reloaded. Don&#39;t worry about everyone else. Bitcoin is likely. I will return to ktoday week.,1
Junebigwonx falloffiat Bitcoin goes deeper. Old resistance area k effort flip new resistance catalyst next rally BTC report bearish buying start keep it simple ive follow btceth ta tweet seriously,0
wojfinance bitcoin k resistance zone broken can see k will confirm long term bullish outlook in near week hodl buybitcoin all but follow xhl very underrated bitcoiner great tips ta great,1
btc update make new lows to make it look like bitcoin you hate wait every day confirmation of tomorrow&#39;s deadline may be time shifted to another perspective one suggested previously k good goal imo btc crypto,-1
"krakenfx cryptocurrency millionaire world&#39;s greatest philanthropist the world seems to know nothing. Even though I have earned a lot of cryptocurrency, I am still working at a discount store minimum wage job. follow berniedoranfx guide btc profit tips tweets",1
Be patient and wait Bitcoin Come to your senses Bring new structural and behavioral adaptations as people race around the world BTC Yesterday Adapt Coco Cola Accepted Bitcoin Payment Vending Machines Australia New Zealand Personally Speaking Coffee Starbucks,1
"Yeah, I don&#39;t know if it&#39;s funny either, I don&#39;t know if it&#39;s going to go major. First of all, I think it&#39;s better than stellar. I think it&#39;s even more ridiculous than a month, but I did it randomly, actually, I have no idea about the last month.",0
takeaway first day fantasy patty mill best 3 point shooter league nemanja bjelica 2nd place player fantasy season there obvious sarcasm real serious don&#39;t change roster someday hodl nba btc,0
brettinthewoods prices seem crazy high I don&#39;t like the answer because unit bias closed mind path leads Shitcoinery short time preferred fiat gains instead read twitter account bitcoin standard stacked sat could be made,-1
"The funny thing is that the explorer people already put money in, knowing that people have already added liquidity. Unless it&#39;s a wallet-related case point, people also buy a lot of scents in clearly labeled packaging.",-1
Cryptocurrency high-risk investments no one would recommend A hundred cryptocurrencies were created with the sole purpose Attractive investors Pump developers People who promote cash Leaving others Reasons for losses Cryptocurrencies can burn a lot of opportunities,-1
"Personal Predictions for Next Day Bitcoin got a lot of volatility today due to CPI data. Nearly $1 million was liquidated. Whenever k shows me being optimistic, I get strong support. ta btc crypto btc",1
"Bitcoin Pass price falls for the first time since its plunge last week. Bitcoin has been steadily recovering and has remained in a downward trend for the past three months, while Ethereum has risen even faster. Buy cryptocurrency cash using Flexpin prepaid vouchers",1
"The CEO of major hedge fund Pantereracapital predicts a massive Bitcoin rally year, saying investors will shun stocks and bonds and real estate cryptocurrencies will also add institutional ownership, destabilizing BTC as its market value rises.",1
bitcoin daily update daily timeframe btc downtrend bearish power loss also afd indicator print lower signal since june rsi also exaggerated divergence bullish signal bullish control cpi maintains today as well,0
You can instantly send money to another country without impacting the environment. Clean mobile wallet interface with zero inflation Decentralized security network Funds Safe theft Inflation gives you warm and fuzzy feelings every time.,1
Hahaha I think the entire crypto industry is running a dangerous and destructive scam stupid benefits stupid costs stupid I believe it defends nothing the idea is ridiculous I think anyone would seek remedies for false advertising in a reasonable way Gourd,-1
"But see useful use cases: Cryptocurrency is not easy to do. People will not maintain decentralization. We already have a centralized government, which never allows a happy playground for cryptocurrencies. It&#39;s already dead and basically useless.",-1
"mattstirner gets the facts btc old gas guzzling technology is basically outdated. Compared to new blockchain technology like the theory behind a btc utopian society without whale sharks, artists like Musk Sailor might actually work.",-1
Well I&#39;d say pretty bearish bitcoin but the wyckoff model seems bullish so I think we&#39;ll get k btc still see record for biggest rug pull k is going to be a crazy good time. Get a replacement pump soon,0
pewdagoat Frostytheproto nft Bitcoin Oh sorry I can&#39;t hear you My metamask trust wallet is gone nfts were stolen from me I need a sugar daddy I forgot to tell you my coinbase account was hacked Reference support Hearing Start working,-1
u Economy Fiscal Policy Start Show Crack u Presidential Election Trump Goes to Jail Re-elected Tank u Economy Means Trump Won&#39;t Be Re-elected Trump Doesn&#39;t Try Anything Despair Chaos BTC Best Place to Hold Wealth,1
btcarchive thks man caribbean nation saint kitts and nevis may adopt bitcoin cash legal tender.,1
soberbitcoiner triiilionusd skwp may want self-empowerment through swabitcoin self-education. The pursuit of btc donations follows the ramifications of controversy. I am simply grateful. pleb ty skwp had a day. I&#39;ve never seen it before. Create an edge case.,1
ponzi new money printed used payments old money won&#39;t be worth last utility many people use tools crypto used global fundraising investments xborder transfers micropayments defi nfts hundreds of millions btc,1
"For cryptocurrencies to become shockingly unstable in value, they would need to be converted to cash. Real liquidity is also talked about using cryptocurrency format exchange developing countries. The year is still adopting an upward cryptocurrency approach. Send lots of money.",-1
wjvalk investment answers fossgregfoss jeffbooth canadians started buying canadian spot etfs inside tfsa. Competent Orange Pill Amazing Wife Switched to Buying Bitcoin Directly. shakepay moving refrigerated storage thank you investment reply jeffbooth fossgregfoss others who helped,0
Based History Yes I Know Guide Will Expect Reduction Volatility Stability Fork Drama Stabilization Start Normalization Expected Gradual Price Rise People Feel Safe Enter the Water Halving Closer,1
"It may be far off, or you may assume that Bitcoin has evolved. Basically, miners still pay fees. Bitcoin continues to evolve, albeit at a small rate. The remote fee replaces the current reward value. Large transactions occur.",0
Two columns have been added to p notes. A useful blade rolling change has also been added. The daily average in the third volume column is not really explainable. Tweet We believe the new data provides valuable insights going forward. Go to BTC.,1
Long BTC general lot institutional funds le retail investor lot big financial funds btc cryptocurrency general idea will go completely. Liquid cash will bounce next year with altcoins at really low valuations.,1
He texted me and said the phone number is good. Call me and solve the problem. I think the new Bitcoin will really help. Call with guidance. Try it patiently all day. Act like a fool. Maybe give me fake seeds.,0
makeroftools muatafagmi adamus blockstreamtalk funny people forget money quickly technology money ledger score keeping problem bitcoin fair score sound money decentralized linear approach one ledger solves all other layers.,1
btc should make strong time k also short term high k daily closing level bullish send btc major resistance day k bullish should break k week k also important,0
trap sell k go k night think keep money small spare case big crash buy fresh coin course time market sell crash time open champagne long term bitcoin always win,1
bch gdax sale right unfortunately today exchange use has no effect on btc. That&#39;s right I think I remember someone explaining that it was connected to key 2 People were trying to sell bch and accidentally ended sending bch btc issue to buyer,0
Cryptocurrency Immature Market High Volatility Traditional Investments Holding Growth Day Trading People May Even Remain Day Trading Cryptocurrency Meaningful Average Return Average Cryptocurrency Not Fitting Accepted Investment Strategies,-1
Let&#39;s check the metric action The massive pullback may have led many to think that it couldn&#39;t break upwards near the btc drop k local rise exit bitcoin bust k levels rose k ath puell multiple blue boxes.,0
hr bitcoin price divergence update still optimistic divergence date november afternoon st lol take a good look at short term price retest pink dotted line divergence projection confluence fib retracement well reference play,1
Surely people btc went without a hitch and there were a lot of casualties to the k left. took low short profits path minimum resistance back below lower range almost half year worth range loss imo btc,0
Cash App Good Small Stocks Bitcoin App Good Holding Cash Also Appraised Bad Bitcoin Purchase Fee Good Cash App One Reason Square Stocks Cash App Bitcoin Held Through Plunge,1
Still considered a fully speculative product Asset Call Asset Fundamental Value technology could be adopted relatively quickly Federal Reserve System Confirms that blockchain is an unregulated market likely to face regulation domestically and internationally advance to,-1
no one convinces people panic selling people recommend huge downward triangle monthly chart example technical analysis theory break massive support hard fast kk price k support becomes massive resistance decision u want to gamble,-1
eth going x remember tweet view chart buy buy buy big bag bitcoin btc sol doge shib maintain nu xec zec dent hot bnb om omg vet,1
"Diversification seems to have gained ample traction recently. Young people believe in buying ETFs. Politicians traditional finance people mention, etc. It&#39;s cool too, but it rises despite the payments, but a small portion of the portfolio is ready.",1
BTC Update Harmonic Take Profit Level k Joining Strong Resistance Zone Annual Open Point Analysis Market Structure May Break Down Low Short-Term Holding Cost Based on tp level clear tp next lvl k,0
I wonder if the average Bitcoin cost last month was $1. That&#39;s a good idea. Altcoin prices seem to be low. I feel like I&#39;ve skimmed through quite a bit of new material. The general attitude towards altcoins seems to be quite bleak with btc altcoins being a viable option.,0
jhonnyclothing like slow creep tel vra claims lost territory view massive expansion view phone rise cents vra about cents view btc still solid claim k view process assuming short requests,0
bscpitbulltr bscpitbull pitmagcommunity bscpitbullkr Pitbullbseth target 1 billion market value year-end safe community token burning listed exchange bitget hotbit mexc latoken cointiger zt indoex swap pitswap pancakeswap nchnetworkswap k holder bscpitbull bitcoin btc,0
btc ta simple looking tmrws wkly close hold k follow wkly open close k full candle body upper continuous point close wkly k follow wkly open close expectation test bottom grn box,0
I&#39;m super bullish dot top hold imho love team love technology ecosystem growth good pace instance ive tinkering parallel finance recently really good idea going good job polka dot future good luck dot holder,1
Get ready for a rude awakening Big short November cover points are getting more expensive Look at the big jump November Yes it hasn&#39;t paid off yet BTC will clear the sell side of all order books on all major exchanges Take it well k,1
olmeg adybug cryptovizart ittechpl blaakke therealplanc onchaincollege janwues cryptobirb piotrostapowicz ekryptowalut wclementeiii mernest kraken ftxusderivs bitfinex Everyone celebrated the first BTC future announcement. etf said it would happen. Investments can make money in kind. Shorten your fully regulated environment,0
yes btc crash run sadly i missed btc k seriously doubt it hello one definitely know anything is possible my opinion is btc will stop on its downhill last time i think it would be best to stop near k unexpert guess,-1
I have been dcaing for a year. It&#39;s still a very happy position. chad bought k You need to stop crying. Welcome to Bitcoin. You need to realize Thunderdome. Can&#39;t handle erratic swings. Go buy Michael Kor stock. Shut the fuck up,1
I am super bullish dot top hold imho love team love technology ecosystem growth good pace instance ive tinkering parallel finance recently really good idea going good job polka dot future good luck dot holder,1
"That&#39;s true, the liberal thing, in fact, the beginning had no event year, everyone knows it, cryptocurrency, left-wing people, working technology, majority, left-wing people, running exchanges, left-wing fintech, sponsors, state of the Bitcoin ecosystem, blue state regions.",0
"One signer who has not sent money from the account is not actually moving money within a suspicious bank account. The second address can refer to payments to anyone, anywhere in the world. You can definitely cancel. Month Required Date Clear Notification Visa Unconfirmed Amount",0
Cash is untraceable. Many countries may still allow it. Bitcoin adoption may be slow. Bitcoin adoption may be slow. Exchanges can be prevented in an effective way. Bitcoin may slow down or stop. It will actually be of great help to the government. It can be adopted for the long term.,0
"Bitcoin Rest The cryptocurrency market has gone through an incredible amount of turmoil in the last decade or so. Still, the biggest critics embrace the impact of technology. Blockchain technology is a web-like decentralized AI supply chain definition name enormous comparison market tulip willful ignorance.",1
bitcoin price realization cap many thanks hodlers fact realization cap average cost price m btc m utxo ath b near doubt realization cap lead btc next price ath expectations k btc b realization cap,1
Currency There is not yet a single US currency available. Major online stores Bitcoin Especially places like Venezuela Venezuela is actually a good example The good world exists. feed family farming runescape rather hunger death dictatorship oppression,1
ti real time stock scanning gapper scanning chart relative strength stock market spy spx tsla amzn amc spx gme nio aapl googl nflx amd gme baba btc eth pltr qqq wmt pypl roku shop bitcoin stock,0
congratulations on achieving your sushi nd goal in one hour sushi btc egld sol luna matic vra ersdl igg ubx mir coti ksm hnt ftt kc tel trias dot ftm vnla fet oxt rsr mir lit lina,1
Data science models suggest that the btc peak is much higher. other best crypto discord group k member even app join shib btc eth doge sol crv ath sl algo matic fib boa gme tnt h amc ct tp,1
"I would also like to remove the biggest criticism of Ethereum moving pow po, several studies estimate a reduction in energy costs, and we are working hard to improve transaction rates. I want challenges like visa mastercard process order size transaction p.",1
A plug is required. A plug is required. Please send an example. trezor connected mobile wallet See also right phone hot wallet. trezor separate portfolio live value difference send coins trezor wallet sit in a safe place no need to access offline trezor,0
"Will probably get a downvote Speculative look Biggest companies investing around Look Cryptocurrency Business Era Still seen around Many cryptocurrencies Still popular, higher risk means higher reward Implied fact Cryptocurrency most risky invest",-1
Bitcoin Hedge Bank Bailout Literally Genisys Block Bitcoin Hedge Entire Financial System Central Banks Commercial Banks People Buy Bitcoin Hedge Run Inflation People Bitcoin Banks Collapse Credit Card Purchases Stop Work Grocery Stores Allow Lightning Payments,1
Considering cryptocurrencies are fundamentally deflationary making a terrible currency with limited supply currency purpose promote investment trade deflation currency always rises in value limited supply causes people to trade instead inflation currency hand incentive people to actively lose value to use a good investment,-1
Cryptocurrency profit dependence Bigger fool buying course Someone portfolio Bitcoin Going reality Cryptocurrency has really exploded Speculation Love Low interest rate Easy money The world is alive from the beginning Bitcoin monetary policy Strengthening speculation Shit bed occurrence,-1
Three Scams Scam Coins Kwon Terra Team Default Coin View First Failed Stablecoin People Lost Everything Luna v ust Luna v Scammers Fucking Ruin Cryptocurrency Will Ruin Everyone All in One Case Scammer Terra is Responsible Yes I hope so,-1
Bitcoin&#39;s Ambiguous Purpose The biggest problem is that it means that the original cash system has become a store of value. digital gold hedge inflation how people think,-1
"Like traditional gold, it lacks intrinsic value to produce anything that generates cash flow that almost no one seems to fully understand. Having a thorough understanding of the workings of the underlying blockchain technology can prove to be incredibly valuable. It&#39;s hard to see a single type of digital coin being considered valuable without some very obvious and illicit utility.",-1
Three Scams Scam Coins Kwon Terra Team Default Coin View First Failed Stablecoin People Lost Everything Luna v ust Luna v Scammers Fucking Ruin Cryptocurrency Will Ruin Everyone All in One Case Scammer Terra is Responsible Yes I hope so,-1
"Yes, the government bans one important thing. A full backbone cryptocurrency liquid stablecoin called Tether has already been banned. ny sec backs 1 dollar backing the coin. I don&#39;t believe in anything. Federally Closed Exchange Becomes One Giant Ponzi Scheme",-1
yes actually build a good ton of solutions best blockchain first mover advantages player provided smart contract features course cons limitations duh adapt move think etc stupid still won&#39;t buy it weak average even stupidly expensive gas fees solid solution,1
Conceivable purchase rate Email traffic capacity Bitcoin Email money Boring Important changes Slowly already working well enough Large-scale network effects projects Centralized messenger services become popular Definitely centralized Convenient option gmailhotmail coinbasekraken Email still has a permissionless base layer,1
The problem is that we don&#39;t understand its full potential. Bitcoin Bitcoin Unauthorized Unmonitored ESP Lightning Pure Trade Whatever the reason Bitcoin Worthy Bitcoin Worthy Fiat Replenishment Buy Bitcoin See Bitcoin Jobs I would rather see cooperation and choose to pay all payments Select Bitcoin payment,1
wow tron seems like a stolen idea like eth copy tfl folly tron labeled coin coinside yt founder tron. The man who once triggered the ust death spiral also triggered one usdd predicts that unsecured stablecoins will eventually be banned.,-1
ETH development is ultimately important. Blockchain-enabled people The right finished product cryptocurrency actually justifies its market capitalization performance point. People still say that early speculative value placement cryptocurrencies could upset the ETH roadmap. This is your best opportunity to be scalable and developer-friendly.,1
I found few of the coins worthless service purpose issues. Creation such as governance tokens does not require any cryptographic process. Lend cryptocurrency. Others have borrowed cryptocurrencies and realized almost entirely self-referencing closed-loop systems. A cold-blooded merchant with ambitious dreams was helped.,-1
Bitcoin Offers 1 Billion People Worldwide Access to Bank Accounts Storage Spending Growth Earning Wealth Time Adoption Increases Volatility Larger Market Cap Due to Trading Volume Look at the World Today Huge Need Decentralized Incorruptible Money Definitely Disagree Lots of BTC,1
Some level of comfort threshold person investment wallet wallet cost game really valuable everyone paranoia exchange coin sit get hacked crash whatever you use shakepay trust life whatever somewhat comfortable leave btc feel good time cash probably wallet hard invested.,0
"The good news is that I really understand btc, but don&#39;t expect it laugh good worry a little respect volatility love fud good time buy btc eth simple brain stomach wait easy bring bad news bring blood bring negative emotions Fundamentally nothing has changed btc eth",1
"When the trading venue puts the fee and opens a one-time channel, the main hub payment transaction fee is high enough, so it is confirmed. The paid channel closure rules are still vague. The big rule is that it will generally be closed. Will Spend Money on Promised Lightning Network Channels",0
Ethereum ecosystem developers Competitor developers Combine all smart contract platforms Excluding Bitcoin developers Combine all cryptocurrencies Results Developer innovation All dictionary definitions Occurrence First Ethereum chain dapp Almost exclusive clone development First Ethereum amount Value lock definition Mainmet All chains combined double of,1
last squeeze k hour candle see easy example price flattening BTC ultra low liquidity hard whales group pumps enough to kick start chain reaction loss liquidation leveraged shorts not thinking yet not thinking about people underloading despite potential to go to market greed It gets worse,0
