text,sen
Data science models suggest that the btc peak is much higher. other best crypto discord group k member even app join shib btc eth doge sol crv ath sl algo matic fib boa gme tnt h amc ct tp,1
swan good place to buy bitcoin love spirit stand end date commission high price display,0
matthewhyland btc care people said it fell hodl relax,1
Bitcoin Breaks K Sets New All-Time High Currency Time itoldyouso Bitcoin,1
There&#39;s a reason why lbrycom needs another Bitcoin.,1
"Haha, yeah, selling shit is the point.",1
A person who said he invested in Bitcoin but regretted it,1
Tonight looks short BTC,0
mfhoz expects hodl bitcoin,1
k looking for worst case SF at the end of the year you are ok x instead of x you will make it rain,1
"Musk, CEO of Teslaspacex, said Tesla will likely start accepting Bitcoin vehicle purchases. I want due diligence. You should check the percentage of renewable energy you use. Tesla resumes accepting Bitcoin. Musk said:",1
"Wow, I can&#39;t believe I&#39;m running out of money",0
coinsquare thank you opportunity stpatricksday bitcoin coinsquare tag utksrvstv,0
For some economic activity it would be better to point out a wallet node. Additional address monitoring nodes can identify wallets that have been spoofed by malicious actors.,0
Price Bitcoin Current Cryptocurrency BTC BTC,0
We&#39;ve added the Bitcoin ChainAnalysis Balance Sheet from our long-time partner nydigbtc.,1
"olmeg adybug cryptovizart ittechpl blaakke therealplanc onchaincollege janwues cryptobirb piotrostapowicz ekryptowalut wclementeiii mernest kraken ftxusderivs bitfinex Everyone celebrated the first BTC future announcement. etfs said investors want to make money in cash, shortening the fully regulated environment.",0
cmon BTC Fight Love,1
mowgliasia krugemacro whale gaming BTC hits new high in less than a month,1
"Bitcoin Caution Index Surprised by Correlation Last Year Unfortunately, Bitcoin will probably continue to be correlated. Traditional Asset Maturity Bitcoin BTC",0
One Bitcoin Value Bitstamp High Low Market Capitalization 1 Billion Bitcoin,0
Tremendous Love Exodusio never saw it coming. Alhamdulillah Exodus Wallet Cryptocurrency Freedom Feel blessed with Bitcoin,1
"Congratulations, you will be successful all the way p",0
Price Action Leaving a Annoying Week,0
The price of Bitcoin has decisively collapsed. Key downward resistance lines are showing signs of strengthening in the future. The next uptick is interesting. Look for it to surpass the important highs it made nearby last June.,0
The Story Behind the Texas Oklahoma Movement Bitcoin Sportsbook,0
Market movement warning BTC signal detected seconds ago. Stay tuned BTC BTC,0
I thought about BTC Bitcoin. See Donyakkas Ideas Tradingview Trade.,0
The Exit LTC chart shows Litecoin being destroyed compared to Bitcoin.,1
Cryptocurrency Market Updates Available Bitcoin Ethereum Cryptocurrency,0
Bitcoin miners collect TX fees,0
eth short alert exchange ftx market eth perp volume price btc btc eth eth,0
What is it I know BTC is starting to see short term correlation last statement,0
german bank bullish btc eu blocks btc wtf attempts,0
harrygbeckwith Adamus thank you so much brother for joking about bitcoin,0
"btc short deribit btc perp To learn business, you want to make friends. Carl Icahn",0
bitcoin price moved daily moving average short term signal continues to remain positive btc expert side fence bitcoin test k said bitcoin moon said,1
"Admittedly, I&#39;m digging green today, so I&#39;m a bit disappointed. Watch Bitcoin rise at a faster rate. Heck, I swear people seem to have learned.",1
A plug is required. A plug is required. Please send an example. trezor connected mobile wallet See also right phone hot wallet. trezor separate portfolio live value difference send coins trezor wallet sit in a safe place no need to access offline trezor,0
"Wow, that&#39;s good, shorts.",1
bitcoin price canadian dollar btc xbt btccad btc price cad average last hour average time h change h low h high information,0
Watching the Tesla market Avoiding Tesla model smoke Devil Impressive investment Ethereum Watching Bitcoin,0
day ago btc trading today btc touch growth day btc broken support bull abhi baki hai,0
Good news bitcoin cme gap closes recent dump due to high expected cpi numbers.,0
warning bitcoin price short term fluctuation high resistance level m oct pm,0
Go deep enough and you will still benefit in the new year. They say you&#39;re stupid,0
A good question might even temporarily create some good long-term pressure competition between the big players. good BTC,1
"bitcoinbtccryptocurrency Interesting facts btc establishes a cryptocurrency bubble after a year of negative candlesticks, but consecutive positive candlestick records are repeated as follows:",0
peterschiff books saved as peterschiff bitcoin eth cryptocurrency elonmusk joerogan.,0
iran want to buy cheap trying to keep btcs price energy cost of taking the wagon v mining yep i need a day conclusion buy better hurry keep price low long,0
bollinger break btcusdt minute time zone BTC Bitcoin,0
DocumentationBTC cynthiaamlummis Bitcoin Magic,1
Remember the YouTube Twitter account that said you can see the market bottoming out a day ago already priced in. Remember Better Feed. confirmation bias audience upside down trust btc,0
What&#39;s New Help Report misleading or incorrect information. Thanks to bitcoin users like elonmusk mcuban.,1
It would have been better to pick the exact date and compare prices last year.,0
Squirrel bits are better than BTC,1
kshib long alert ticker kshib market kshibperp volume price btc btc eth eth,0
It&#39;s getting bigger and bigger and testnet is expected at the end of November wagmi znn qsr btc bitcoin altcoin is strong,1
enter trend long close short btcusd follow notification btc doge crypto,0
btc bitcoin situation like btcusdt chart,0
"hodlmagoo fossgregfoss believes in a limited, distinct, fixed rights Bitcoin supply, fixed million Ethereum supply, limited production rate per unit of time.",0
mp can also be partially paid in Bitcoin. Minimal Bitcoin altshitcoins help protect your funds. government help with inflation rakyat kasthurishankar yeobeeyin hannahyeoh syedsaddiq,1
binanceus interest fee trading BTC dust clean,1
Bitcoin Burst Level Past Long Chart Pattern Signal Rally Risk Fading Since July I&#39;m Still Taking Profits Trade Signals Given Robin Moore Telegram Robin Moore Copied Trades Went To BTC BTC,0
omnifinn princeysov lucky bump bitcoin timeline lucky swallow orange pill lucky lucid goal path future,1
Bitcoin Transformation Right Active Bear Passive Bull,0
LOL I can&#39;t close the circuit breaker anywhere.,0
Everything about cryptocurrency Bitcoin,0
epic ambitious lucky bitcoin er,1
That&#39;s right lol Anyone who followed last month&#39;s price predictions could have made a lot of money idk people will be mad and curse the moon especially next month,0
Separate currency status BTC,0
Anyone can try the nexo app,0
Bitcoin will surprise everyone starting in September,1
Apompliano Q2 Liquidity Send Baby Connect Node Bitcoin,1
Failed Bitcoin Banking Hodler Bitcoin Fix,0
Bitcoin Unique Event Life,1
nftmechaen rainmakergaming potential relationshipsnitroleaguegameunique gems like championshuntershence market volatility best focus projects much scope makes the future bright nfts rain btc rain,0
bitcoin bitcoin btc btcusd,0
Bitcoin rose against the US dollar yesterday.,1
Man Love Sailor Guardian Food Savior BTC Fighting Good Fight,1
Think of it as completely possible. People who see big declines sell.,0
watch out nebraskangooner one day it will be worth real bitcoin,0
"I won&#39;t bet, I&#39;ll probably ask for the stake.",0
Don&#39;t think it&#39;s due today. It wasn&#39;t today. Comments have stopped being accepted on the date.,0
I wonder if the average Bitcoin cost last month was $1. That&#39;s a good idea. Altcoin prices seem to be low. I feel like I&#39;ve skimmed through quite a bit of new material. The general attitude towards altcoins seems to be quite bleak with btc altcoins being a viable option.,0
Determines the price of Bitcoin. Read the market dynamics carefully.,0
altcryptocom token support btc mining mining cryptocurrency safety learning,1
Bigtamao rally project to launch btc carecoinfamily,1
acceldefi Of course. btc year change defi game acceldefi,1
It already looks like BTC price has skyrocketed. Maybe people are slower to react to Bitcoin today.,0
time to buy dip btbt bitcoin shortsqueeze bagger let&#39;s see what&#39;s coming,0
last chance bull btc resistance k highlighted march st failure break k time could break k level bitcoin btc crypto,0
pitch finance bsc pitch finance bitcoin project good amazing project cryptocurrency global powerful project proud project hope project better development,1
Long term may be a short term goal,1
"As a result of Hastecoin, many families are struggling to pay the price and have come across a clear Bitcoin large part solution.",1
see cameron reference el salvador btc part country important citizen daniagonzalz nayibbukele true leader people people are excited to see government actually working citizens,1
"People want secure wallets, but hardware wallets have plenty of concerns. Safe wallet UI seed word protection stress kind of wacky",0
Binance placed a transaction for the cryptocurrency BTC.,0
Week good day strap,1
Unfortunately many people assume they never used paper hands,0
Here we see that the Bitcoin bottom is not a bull trap.,0
whatbitcoindid w davidzell Great guy Bitcoin core thesis summary The Internet has changed the world. Changed interaction information. How Bitcoin Changed the Values Humanity Interacts with,1
Paul Tudor Jones talks about true Bitcoin-first hedged inflation,1
A crazy idea is to trade Bitcoin after the game,1
Cryptocurrency Think Current State of Bitcoin After Fear Greed Index Neutral Moment Price. The usd analysis team has completed a detailed analysis of BTC and would like to hear your thoughts.,0
price spaghetti alla carbonara satosis btc btc usd usd saturday june pm edt bitcoin carbonaraindex,0
btc btc k destroyed saturday pump k monday retest fill cme gap maybe,0
BTC Bitcoin BTC is also available,0
"Like a coin, it depends.",0
I hope everyone has a good weekend,1
Exciting Chainbyte Bitcoin ATM import leybitcoin nayibbukele bitcoinbeach,0
"Be patient longer, stand firm hodl storm hodl people",1
btcperp shorted ftx utc btc cryptocurrency.,0
btc crypto country legalization cryptocurrency bitcoin,1
Feeling touched arm wall knock knock kool aid man break arm wall oh oh oh yeah oh oh,0
"bojidarkostov Still confident despite being downtrend for quite some time, Bitcoin could see another strong year. But everyone follows ethb. Tweet predictions follow solidly.",1
Amount Tax Calculated one depending on case Sell Cheaper Expensive one Always curious Eve dcaing last month Thought ID work Average initial price Tax calculation seems to be Sell Bitcoin Pay le tax say I sold expensive buy btc For example buy btc k Another k decision sell btc say 1 pay k timeline buy doesn&#39;t matter. I hope you understand.,0
The decision was literally made. I bought a dip bar like in the morning haha I regret it.,0
Bitcoin h rejected h bearish retest see you later,0
Daydream Sitting on Bitcoin,1
Cryptocurrency Goodbye BTC Bull Trap,0
grt warming btc btc,0
Cryptography promotes clean energy through Bitcoin.,1
finexcz BTC Everyone who wants to create a Bitcoin bear market,1
hswapdex good project hakz ochendoglobal mary airdrop cypto bitcoin,1
dianaprealtor Make Money Online Staying at Home Believe It Vacation Earn Every Hour Get Cash Out Instant No Referrals No Hidden Fees Request a Message with Bitcoin Direct Messages,1
"Do everyone a favor, it&#39;s perfect if you make a lot of money on the last day.",1
"See you next time, Bear Glotters Cave friend.",0
BTC derivative sheet tweet every minute cme delayed min g delayed min oi share,0
exahash mil mc riot exahash bil mc gme amc spy spce tsla mrin aapl sndl pltr nvda tlry rkt ge expr sol spy disk c coin pfe ge nio jnj plug amzn aal nok bb ccl sofi Wish hood snap nflx apearmy walltreetbets doge btc eth btc,0
bitcoin bitcoin btc btcusd,0
Wizardia Magic PlayToUn Metaverse Bitcoin Diamante Blockchain,1
Movement View Correction BTC Cryptocurrency,0
Tyler Herro is still betting BTC on tonight&#39;s game.,0
You should read Sparrowwallet Bitcoin Best Practices.,0
bitcoinqutes bitcoin advocate commoner,0
You can also earn more Bitcoin by selling it. sell hodl,1
goonrich minikishu babybitcoinbsc next path btc title new ath btc bnb,1
coinswitchkuber bitcoin fall moon low dive drop btc k believe support local holds bear trap eventually bravo mjtru proud tweet ta helped best,0
Bitcoin currently scheduled to expire Bitcoin conference held in Miami Florida in April,1
"Temporary well processes are considered and reported for all transaction years, regardless of country.",0
commissions are fucked buy btc price lucky one in heaven right sell problem profit total rights bc fuck say make a profit commissions are made you name it,0
"Basically, leave the cryptocurrency alone for a year. The powerful men of the world have probably seen moderate interest.",0
dineke metatravelers believe in recording history. Chronicles of Ideas Again History Bitcoin On Chain LED Encryption Card Collection Issue Jan Discord Entire Mood Come Say Hello,0
Earn Bitcoin and explore Chop City whenever you want.,0
citizenbitcoin thoughts sell bitcoin buy someone invest in purchase safe cryptocurrency strategy to achieve financial goals,1
BTC Lost Monday Low Short,0
special shout out new friend great job btc susiebdds oflowshow jeremican kobiduran camilacampton younger pleb take the trip fun and inspirational win thank you so much to the kids.,1
Amount Legendary Crypto Trader Bitcoin Onchain Metric Analyst Discusses Future Funding Options Expiration Correlation Price Action. No more premature showings. b Derivatives dominate short-term price action.,0
Meth Addiction Symptoms Disconnect Humanity The Natural Bitcoin Way,1
Bitcoin Clinkay Federal Signal Rate Increase Bitcoin,0
"bitcoin trading assets trading assets control whale whale take money control assets think like a whale control money bitcoin sign wyckoff meaning bitcoin future void meaning need money month bitcoin in general bitcoin always go big money can catch way control market awareness In fact, when someone pushes a sale against the fact that they know it&#39;s going to happen, they&#39;re likely to eventually come around.",0
iohkcharles bro cordano sell btc buy,1
californiahodl Enter the bullish stack market. Hello fiat bitcoin purchase,1
"Keep your hopes fresh on top of built-in layers. I know I am wise enough. We understand that technology is not guaranteed. Technology moves at lightning speed, leaving many old technologies behind in the dust. I hear many people saying hold on to btc. Another year is truly worth it. btc another 20 year old word betting 1 year old technology maybe worth it. A reasonable person admits that it may be so.",0
"Oh, I&#39;m sorry. I guess I&#39;m a little sensitive because someone attacked me earlier. Are you worried?",0
Rainio Rainio like Simpson Bitcoin,1
Pumped the next day with a positive mid-mark slightly downwards.,0
sbfftx method is a bit strange try international differentiation u like ok ok south american people ok american people big deal ftx bitcoin,0
Statistically best time buy pst strangely I have never bought time lol.,0
"I don&#39;t know about thedustybc yet, but does anyone know what BTC is?",0
Recycle Cryptocurrency Earn Green World Recycle Today Better Tomorrow Don&#39;t miss your chance Sign up for crb Use recycling contest Register link Convert carbon crb Bitcoin,0
flernft crazylizardarmy bitcoin eth best options trading profit accumulation I want to invest my money in a better place and build wealth bitcoin mining kindly follow cryptostewart help me achieve my goal,1
Long Term Outlook Bitcoin Prediction Best Things to Start Notifications Monthly Channel Strength Log Charts Understanding Best Tools See Real Value Trends Without Clouding Your Judgment,1
Bitcoin is ready. I woke up and wanted it all. What&#39;s the problem?,1
You have to keep buying something,1
bitcoin attack h ema rejection since ema shutdown finally look break htf channel follow cryptochartsm know stuff could mean you can see with btc cryptocurrency,0
"Hi Larry I&#39;m sad, I&#39;ve seen withdrawal times increase every year.",1
"Very good, slowly grinding higher",0
What&#39;s really the big deal that Bitcoin can&#39;t use legalization? Bitcoin can never control its legitimacy.,0
Jasonplowery Bitcoin hopes for a better world.,1
Bitcoin is already in circulation. BTC is mined.,0
BTC Liquidated Long K,0
btc google trends last day btc bitcoin cryptocurrency details,0
Hello blessed opportunity join the ukbitcoinmaster podcast today I want to talk about bitcoin trading cards check out the project podcast interview start min,0
Current Price Bitcoin Last Hour Rise Bitcoin BTC Cryptocurrency,1
BTC Hold Kill,0
themooncarl BTC will see the gems holding the bag tightly.,1
"Well, don’t say anything right away.",0
queen dani viceroy takes flying carpet moon thc eth btc,0
airdropfather project bright future I really think project perfect and awesome innovative project project the future belongs to mizimaruf munna ahsankabirsanto ummenipa airdrop airdrop bitcoin,1
guess you&#39;re wrong lmao accept it&#39;s wrong everyone downvoted think crystal ball will happen next time,0
Coinbase Others Bitcoin,0
Someone&#39;s really pushing to the right,0
Paulserious KingHoward Still Thinking About Fixing Bitcoin,1
unsustainable bitcoin get diamonds shitcoin left right center s percent time completely unknown how to get coins can continue pure gambling is poor time most honest coins cannot prevail almost no one buy basic skills gambling well bottoming out proper honest Coin Rise Happening Friend Rather Wouldn&#39;t Have Happened Basic Logic Good Bitcoin Edit Edited,1
Garrettgroce Bustarhymes adouble Whybitcoinj agree bitcoin obvs fantastic project. It&#39;s a real utility worth investing in. They are competing with btc. What is the problem? It allows huge content creator artists to make more money.,0
Pizza Day Bit Record Zone Bitcoin,0
stackinfatsats goldshellminer kadenaio needs kda box btc prediction. wait soon kda starts massive pump hmmmmm,0
Bitcoin Test Week Sure Yes,0
The balajis ledger records created Bitcoin.,0
Download github Insert USB stick Insert USB stick Open offline device indexhtml Offline device Follow instructions Get private public key Exchange funds Verify public key private key Don&#39;t lose your private key Also keep your device key permanently offline Old laptop Labsby Pi Please use it,0
BTC hr change bitcoin worth BTC stimulus,0
"Nothing is wrong, fired without thinking Altcoin, Shitcoin, coexist happily Bitcoin",0
"Yeah, what I&#39;m saying is the market can&#39;t handle it.",0
Let&#39;s talk about BTC dogecoin xrp.,0
blockchain bitcoin amount btc amount usd transaction type transfer hash dcbacbefbcbdabeacfefdefcebd,0
burned renbtc usd avax darknodes fee btc usd,0
UK&#39;s Argo Blockchain Becomes First Climate-Friendly Cryptocurrency Mining Company Cryptocurrency Trading Bitcoin,1
protected storage defi exploit upgrade bitcoin multisignature security,1
BTC Wave LTF Min Chart,0
Owning Bitcoin just got easier,1
BTC Derivatives Sheet Tweet every minute cme delayed min g delayed min oi share,0
Building a project Good development Long-term opportunities open to all users Also a rapidly developing projectI believed in success. future uponexex bitcoin defi hariom sumitk jaising,1
"Yeah, I didn&#39;t know the recommendation would be low today.",0
Money Goes Market Levels Adoption Money Printing Problems The World Knows It Could Happen k Think It Will Hit It Fast Bitcoin The Year We Learned One Thing K Years Ago Bitcoin Surprises Most Unexpected Last Quarter Bitcoin Generally Good Bull Market Year Timing Pretty Good institutions have jumped through hoops and don&#39;t know any big news from corner countries adopting ETFs. twitter integration lightning network big companies like facebook amazon purchasing bank adoption nydig feels like bull run has begun fundamentals are by no means strong,1
bitcoin btc perp oi climbing funds dip negative bounce seems shorted could be fun,0
Bitcoin looks good next week looks good,1
Bitcoin quick return k shows will soon go into hibernation. hodl,1
No one in my Austrian school knows two talented men who are managing great bitcoins in their retirement years. I think the pace is accelerating these days.,1
marketspotter investing in usdt holding altcoin bitcoin today had the best daily big accumulation today.,1
key key encryption bitcoin,0
"joshyoung jameshmackay thinks bitcoin is different. Well, I&#39;m looking forward to opposing cryptocurrencies. Others are burning Bitcoin Rising Ash.",1
Bitcoin Possibility Evaluation Full-fledged bull market Crypto News Bitcoin,1
States of Interest Bitcoin Ethereum Find Answers Articles Research Study CoinGecko,0
Calm down rudely and watch the money rise,1
BTC profits since yesterday think bull trap going back to k.,1
Valkyrie Liquidation BTC ETF End of October BTC ETF,0
Check out the volatile next hour minute BTC options expiry utc midnight pst apr,0
The bulls need to take control and see the price quickly. k revisit bitcoin btc btc eth bnb.,1
"kevinolearytv disagrees. View mining of the future The process requires heat generation. Look at glass houses, heated swimming pools and more. By-products generated from btc mining must stop being thermally disposed of.",0
I&#39;m a bit nervous lol I really care about long term holders Watch next time February 2nd Low Why would you want to manage long term holders? Even if you buy a year you still absolutely want to check the support level for February you can see the hold likely to break on February 2nd low probability to hold each week within the next week support level law permanence creep investor minds many you I&#39;m still having a hard time. Remember to get lower prices every week. Part of the price. Please consider the regular price. Memory Buy Bitcoin Gets More and More Far Away. memory replacement new standard support level respect february day pretty big deal pending need rebuild permanence value new price appreciation people sold symbol solidarity respect,0
zodasadi elonmusk teslaownerssv boring company btc global definition mtn global health medical chain,1
Microstrategy Bitcoin Treasures Worth US Dollars,1
steveinmanuic fbi bitcoin steve save your neck,1
BTC Derivatives Sheet Tweet every minute cme delayed min g delayed min oi share,0
wclementeiii I&#39;m also interested in Bitcoin&#39;s great open source project. Monetary innovation indicates wealth potential. Makes everything else sustainable. thank you wilkes tip forecasts can allow for large holdings.,1
Bitcoin Social Activity Galaxy Score altrank Social Mentions Social Engagement Social Contributors Social Dominance Share Links btc bitcoin lunarshare,0
profit btcusd target buy btcusd le last purchase shock volatility reduction total purchase sell click tracking movement,1
Morning everyone I hope men women usdt atm btc bitcoin,1
Coin Bureau Bitcoin Life Rent Free Mind Buffet Munger Constant Protest Collectively Coordinated,0
btcusdt shorted Binance UTC BTC cryptocurrency.,0
I think I&#39;ll have some time to tell you that I&#39;ve become a BTC artist soon.,1
Beware of the current Bitcoin trading resistance zone longsbtc,0
btc btc open interest positioning big short position cut still net short non-professional traders very long generally clear market reverse asset manager super bullish can save non-pro,0
officialtravlad complete teacher mufc bnb btc,0
pascalnajadi recalls coiling bitcoin all the time.,1
lopp banks use information money like good reason. Stop using technology. Start using cryptocurrencies like bitcoin ethereum eth ox near other people.,1
Peter Schiff BTC Ready Rally Gold,1
btc sent kraken unknown wallet tx blockchain btc,0
ath before last round interval number,0
track price increase buyer deal advanced cryptoscanner btc eth ksm hot trx lrc xem dash comp kc chz omg grt hnt amp miota wave neo leo crv,0
Hawaiian cryptocurrency like Bitcoin Love DFI DeFi Chain,1
Hold Bitcoin by buying it at a low price,1
jermehlikeshash maxkeiser observe kk next resistance bitcoin breakout range confirmed nd halving bull market begins next rawkzt tweet every single tip seriously great follow,0
bitcoin daily update daily timeframe btc downtrend bearish power loss also afd indicator print lower signal since june rsi also exaggerated divergence bullish signal bullish control cpi maintains today as well,0
Liquidated long sell BTC super large size rekt bitcoin,0
"I emailed my senator, Fingers crossed Bitcoin.",0
highest dca k months ago dcaed k i still average cost btc bit k bit,0
aave short alert exchange ftx market aave perp volume price btc btc eth eth,0
People love love around them. I know the difference. Bitcoin Bitcoin Love Story,1
"Although you sold BTC, the leverage could be pushed to the btc venus you borrowed using the usdt collateral sold yesterday. Basically, you receive short BTC payments without leverage. Altcoins Have a nice day.",0
btcusdt m macd cross btc btc bitcoin,0
acmecryptocorp glad to see bitcoin helping country mexico el salvador,1
"Haha, to be exact, I want to play blackjack and spin roulette at a casino.",0
say something break small amount negate ta will appreciate the majority of the deal. Use bot algorithm ta real explanation price movement,0
"Try cashapp robinhood updates. I want to send my wallet. Try Cash App. Although they allow deposit withdrawals, robinhood doesn&#39;t have that option yet.",0
Sold out k always happens at stack BTC time.,0
