text,sen
network stronger than ever overestimated to follow soon,1
i&#39;m going to smoke and keep buying bitcoin,1
raspberry price ticker btc lightningnetwork bitcoin,0
take the coin dealer he doesn&#39;t deserve lol,0
farming bitcoin ocean fire inbox open,0
miss k bitcoin come back tonight,0
low cryptocurrency prices are not going away,1
beautyofhelin kupio btc hodling next option,1
btcusd shorted binance utc btc kriptovaluta,0
gold pure bitcoin bitcoin better gold,1
anyone brain stacking much possible right,1
plan to invest a small amount each month,1
check ousd look great moderate return,1
bennsimmo hegde global adoption dominates bitcoin,1
"congratulations, you made the whole time p",0
btcusdt shorted binance utc btc kriptovaluta,0
action bitcoin attack hope free society,1
I thought I would get a better chance in mid-July,0
like the decentralized nature of crypto get nice,1
people thank buy bitcoin eth bnb,1
bitcoin entered btc come bull a long time ago,1
obiwankenobit bitcoin year compared to last year,1
price bitcoin currently crypto btc btc,0
quantumbrix ipfs built bitcoin i am interested,1
ill speaking novčić nation summit bitcoin,0
week one feels that something huge is happening,1
change development bitcoin btc crypto ada,0
lol yes point of sale hodl shit,1
crypto future plain simple buy perish,1
Feelin cute could buy bitcoin idk,1
does anyone else know that bluewallet allows payment,0
xlm works really well exchange transfer,1
watcherguru wclementeiii one decentralized bitcoin protocol,0
many traded alt btc hit k,0
crypto nerd know farm bitcoin tarkov,1
anyone have a juicy clip of bitcoin conferences,0
btc bitcoin situation like btcusdt chart,0
cryptoptimist btc put top rich world,1
never share seed word with anyone ever,0
best website read live crypto news,0
last round interval number previous ath,0
btc btc eth eth bnb bnb,0
hodlonaut see the word buy bitcoin see,1
amitkhemka doge wala also loves bitcoin,1
iohkcharles bro sell cordano buy btc,1
too many laws are a bad thing,0
trillionusd hear more bitcoin available purchase,0
I think I really need to wait to get an answer,0
feel like atm bitcoin cryptocurrency planb,0
laynio laynio like a simpsons bitcoin,1
i need to drop k lol it happens,0
haha enjoy optimism enthusiasm thread realistic,1
bitcoin cryptocurrency price update btc source,0
closing time high today btc crypto,1
don&#39;t try to convince anyone of the good,0
quite nice bounce daily btc btc,1
update bitcoin weekly chart btc jclcapital,0
called the emailed senator a finger over bitcoin,0
bitcoin technical score btc bitcoin technical,0
lot bitcoin lil bita doge ethereum,0
ilovejaneadams opportunity to buy bitcoin a year ago,1
today xmr equals btc monero privacy,0
dogecoin bitcoin crypto doge friend everything,0
btc btc eth eth bnb bnb,0
don&#39;t think they understand the bitcoin investment business,0
btc price change h bitcoin btc,0
ee think ee feel bickly bitcoin,1
buy low make a difference hold bitcoin,1
another chance to buy btc cryptocurrency shib,1
hawaiicryptogod like bitcoin love dfi defichain,1
like the original digital gold i know bitcoin,1
ok basically bitcoin enjoy driving bitcoin,1
sparrowwallet bitcoin best practice must read,0
random term bitcoin glossary bitcoin btc,0
whatever you have to keep buying the watch,1
btcusdt shorted binance utc btc kriptovaluta,0
buying fear bitcoin k financial advice,0
eh I didn&#39;t expect a low referral today,0
be patient fomo based min chart,0
btc will soon accept payphone,1
real beauty crypto cant printed government,1
bitcoin read full bitcoin analysis cryptocurrency news,0
get rude ohladiti see money rise,1
climb up baby give you a lively weekend,1
rovercrc hell yea baby dracarys bitcoin,1
still bullish dogecoin favorite coin right,1
next time you tell him to buy bitcoin,1
btc bitcoin back to low earlier,1
look high time frame zoom bitcoin,1
elonmusk coming clutch btc bitcoin kripto,1
bitcoin miner prepare take maraplan,1
bitcoin supply crunch action love to see,1
good morning boosted today bitcoin fix,1
great way to bring money help ukraine,1
jasonplowery bitcoin hopes for a better world bro,1
bitcoin already circulation btc other mined,0
to wish as many times as possible,1
officialtravlad done gosobine mufc bnb btc,0
bitcoin cryptocurrency price update btc source,0
love see btc btc respect ta,1
umm don&#39;t say a word man soon,0
btc breakout binancebtcusdt tawfiktrading bitcoin btc,0
btcusdt shorted binance utc btc kriptovaluta,0
btc btc eth eth bnb bnb,0
peterdiamandis many others hopefully bitcoin definitely,0
pizza day broke the record john bitcoin,0
btcusdt shorted binance utc btc kriptovaluta,0
bitcoin stable shares chosen by le stable,1
mkbhd looks a lot like a bitcoin altcoin,0
i feel like a quick fuse coming btc,0
btcperp shorted ftx utc btc kriptovaluta,0
stay fear want btfd ltc btc,1
bitcoin change planet country certain part,1
hi believe that bitcoin gives financial freedom,0
id say dot worth the investment well,1
polygon lowno cost ethereum good book,1
the percentage of the investment portfolio currently allocated bitcoin,0
btc crypto country legalized bitcoins cryptocurrency,1
there is also the possibility of btc bitcoin btc,0
letter published bitcoinmagazine teaching daughter bitcoin,1
binance walked deal hang crypto btc,0
bitcoin point daily foothold daily negative,0
as bitcoin currency pay attention to the price,1
fun doesn&#39;t make sense it seems,0
assuming that it is not a paper hand unfortunately many,0
crypto whole need win rooting smooth transition,1
whalealert keep transferred hundreds of btc wallets,0
guide business uncertain market crypto btc bitfinex,0
absolutely nothing coinbase user coinbase btc eth,0
thought btc bitcoin see danilblink&#39;s idea tradingview,0
job still driver delivery make figure years,0
price update usdt sat btc eth xrp,0
bitcoin mining recovery btc go bitcoin binance,1
paulserious kinghoward still domain think bitcoin fix,1
rather gold medal bitcoin medal btc,0
sigurni spreman buy blood btc btc bitcoin,1
zerosumx sundhaug hacked bitcoin using a weird trick,-1
sold k always happens stack btc time,0
recommended yesterday went a lot today bsc btc,1
whale can not manipulate like sell sorry btc,0
recover from scratch from recovery plan soon,1
well gon na end well break the rule,0
waiting bear runwell said panda run btc,0
bitcoin bnb binance important crypto new year,1
airdropteam bnbbull bitcoin gave nice project peacekelly,1
amount of txns taking place btc network bullish,1
yep time to accumulate big guy btc eth,1
apompliano apompliano kevinolearytv pretty stupid come btc,-1
buy dip dont go btc bnb bsc,1
bitcoin absolute piece of crap slow outdated technology,-1
btc usd transferred unknown wallet unknown wallet,0
remember that people said bitcoin scam good time,1
collect an even better price next week week,1
retweet want lunc hit year kriptovaluta bitcoin,0
remember exactly how the party started joining late,1
computerart bitcoin blockchain last block height see,0
forget bitcoin altcoins move analyze volumeprice movin,-1
ripple price prediction xrp continue to outperform bitcoin,0
awesome post reasoningmetric see supply shock listopad,0
lbrycom there is a reason why it needs another bitcoin,1
long position taken dydx pump btc btc,0
thought store valuewhered value go btc nothing,-1
happened se btc pumped k btc kripto bikovski,1
big bearocratic iron fist look little man,0
love keep filling the bag good price,1
bitcoin was visiting usd yesterday the past day bitcoin,1
invested more bitcoin complain say said person,1
totally possible to think of a big pullback that people are selling,0
thought k video amazing dance Indian,0
I bought my first bitcoin today to learn,1
rdrlfe that a friend calls payment go bitcoin,1
excited bitcoin event scotland follow jimduffy bitcoinconfuk,1
joecarlasare bitcoin last bastion free market pricing,1
the whole market is falling red in recent weeks monthly load,1
btc share market family member endure,1
get the popular hardware wallet vault one bitcoin,0
grab satoshi to stay in the market it will never fall,1
glorified ponzi scheme to waste people&#39;s time electricity,-1
the weekly chart looks like a yearly chart,0
buy july watch fly btc kriptovaluta crypto,1
advisorshares latest firm file bitcoin future etf,1
buy bitcoin can&#39;t sell half sell nothing,0
swing trend btcusdt minute timeframe btc bitcoin,1
square bitcoin treasure worth usd usd bitcoin,0
btc daily weekly ones gon na win,0
saylor flag cross moving time frame h btc,0
"Bitcoin could last much longer, warns academic",-1
thanks spreading the news monero really everyone&#39;s portfolio,1
bitcoin new ath soooo close sat oprezno,1
fuck alt btc all red almighty red,-1
microstrategys bitcoin treasure valuable usd usd bitcoin,1
whale already craving lol btc bitcoin,0
steveinmanuic fbi bitcoin steve protect ya neck,1
elonmusk please say positive bitcoin portfolio green,1
btcusdt m macd cross btc btc bitcoin,0
nothing sometimes the price needs to simmer come to a boil,0
everyone is checking the address anyway good reminder,0
inverse cramer index officially confirms bitcoin month,1
soon news day dinosaur is extinct btc,0
cryptoshillnye hey screw trx next bitcoin bitch,-1
k held in theory return test k,0
usdt potential scam big enough demolish crypto,-1
alexdreyfus cointelegraph turkish state crypto tokenavocado btc,1
k wick clear was not a dip because of the news,0
way talking meme room noise speculation bitcoin,0
back line support guy bitcoin luna btc,-1
bitcoin woke up lol dan nuke downpatience though,0
ocsc demo putem youtube libonomy interoperable bitcoin,0
follow the advice of creating great content bitcoin fix,1
yeh agreed trying to think the reason was done,0
a lot of shitcoins substance putting black casino anyway,-1
meant please stay like bitcoin v spx,1
theelongwave gjbangar bitcoin advantage safe asset seized,1
thought btc bitcoin see xcvbss idea tradingview,0
cryptosea moov dotmoovs uskoro bitcoin binance,0
short even increase probably somehow supported option,0
crazy thinking about bitcoin trading since game year,1
price update usd sat btc eth xrp,0
houston astros vs texas ranger bitcoin betting,0
perfect morning shop buy fucking dip folk,1
btc incentive worth btc hr change bitcoin,0
actually though she would come back earlier xd,0
misao btc bitcoin vidi decisiontrades idea tradingview,0
altcoindailyio bitcoin crypto crypto exists without bitcoin,1
path year bitcoin real change expectation continuation,-1
bitcoin brainwallet alat za oporavak python python bitcoin,0
largo plazo bitcoin btc eth ada link,0
nikcantmine neiljacobs let buy bitcoin k fine,1
word regulation that drives the bitcoin cryptocurrency community lol,-1
order save market need satoshi make look,0
wallstreetsilv silverguru goldswitzerland digitalno zlato bro bitcoin,1
here he knew that the bitcoin bottom was not a bull trap,0
terra bad investment cryptocurrencies are doing ponzi scheme,-1
anyone buy direct trezoris better exchange transfer,0
maybe change outcome basic weak change ban,0
bitcoin looks nice next week looks good,1
opinion though start small earn smart bitcoins,1
btc usd transferred coinbase unknown wallet powered,0
limit buy cash app buying bitcoin go,0
nothing proud everyone knew sorry dude btc,-1
thought btc bitcoin see desmondlzws idea tradingview,0
btctokoloshe kendallnear magdawierzycka dobro pokna bitcoin ngmi,0
k bitcoin btc short liquidation bybit btcusdt,0
bitcoin shapeshifting right active bear passive bull,0
happened btc lost support btc crypto bitcoin,-1
wtf dream seeing btc bnb eth dream,-1
cryptomichnl still thinks to see bitcoin usd point,0
thought btc bitcoin see navidmemaris idea tradingview,0
the sooner the trash falls the better fuck Justin Sun,-1
haha bikovsko market miss meme bitcoin bitcoinetf,1
waiting shibainucoin go bonkers beat bitcoinfun watching,0
eth ton alt built suffers crazy fee,-1
btc price h change stonks bitcoin btc,0
another arrogant stab at an algorithmic stablecoin is inevitable,-1
ar satoshis right satoshi ar right bitcoin,0
bitcoin hit at the end of the week give a lucky follower,0
to leave emotions locked box somewhere hodl,1
bull run among u signal bitcoin bitlord,1
doge coiner buy doge shitcoin buy bitcoin,1
think you are bitcoins le volatile cash mistaken,-1
danheld cagr hell financial freedom thanks to bitcoin,1
thought btc bitcoin see maleknafaas idea tradingview,0
bitcoin stopped try to draw attention to bitcoin,1
thought btc bitcoin see fxcms idea tradingview,0
bitcoin ethereum crypto crypto market update available,0
crypto giving in the avenue travel financial world,1
make think asset overvalued last two years,-1
fucking sick cryptocurrency market crypto btc bitcoin,-1
help even make the bitcoin fall way bullish,1
Misao BTC Bitcoin Vidi Aryanouris Idea TradingView,0
defiantnews camirusso ftxofficial question bitcoin affected negatively,0
crypto wild ride high low doge hodl,1
binanceus attention fee trading btc dust cleaning,1
newbie revolut tho is ready for coinbase kraken,0
check opensea item list by opensea bitcoin,0
btcfuel btc always bullish fud bullish signal,1
someone&#39;s advice invest bitcoin crypto investor today,-1
bitzippofficial projekt dobar projekt bella mohdshaanu nsnoman,1
don&#39;t stay in altcoins much because you become homeless,-1
lol some kind of rule i can&#39;t joke,0
eudora funk byron harvey bart jim btc,0
ashbit popis pancakeswap dan bitcoin binancesmartchain bitcoinashtech,0
i think shib will run much longer tbh,-1
think btc bitcoin vidi pnchans idea tradingview,0
yes i don&#39;t look good bitcoin,-1
every altcoin scam you diversify your victim,-1
monero probably the best coin atm change your mind,1
btc eth ltc algo solid starting place,1
think bitcoin change lot life read pioneercryptocurrency,1
danheld bitcoin back sometime take together,-1
price update usd sat btc eth dot,0
wizardia magic playtoearn metaverse bitcoin diamante blockchain,1
bollinger break btcusdt minute weather frame btc bitcoin,0
bitcoin daily closed sr expect expansion today,0
go kart fun buy nft bitcoin ethereum,0
altcryptocom first btc second eth third usdt,1
ago a week ago a month ago a year ago bitcoin,0
invested bitcoin a year ago alltime high youd,-1
buy ford bitcoin buy money lose wisdom,-1
btc goes to abc retracement bring alt,0
watch bitcoin go back see doubt disappear,1
let the world&#39;s smallest violin play a sad song,-1
lots of emotion control also like real btc,1
exchanging irresponsible list of luna tokens allowed to die,-1
everyone bought k don&#39;t sell going back,1
written buy dip btc btc ftm ftm,1
thinking retest k region looks likely btc,0
larry dunlop kirk macpherson regan judson btc,0
open eye guy don&#39;t give fund manipulator,-1
"well that&#39;s what happens, people panic sell",-1
holding long really complaining much big profit,0
still before rich stage bitcoin btc crypto,1
afaqshah philakonecrypto to wish evil on bitcoin rude,-1
mullvat vpn name record email take bitcoin,1
ago a week ago a month ago a year ago bitcoin,0
bitcoin bullrun could be made indexbtcusd shytrader btcusd,0
price update usdt sat btc eth xrp,0
beffjindel jedan shitcoiner buy bitcoin save shitcoins,1
one christopher lambert highlander bitcoin right saylor,1
happy friday fiat continues to become worthless bitcoin,1
food thought btc crypto stay let it sink,1
people trash xlm think long term further,1
dogecoin b although everything goes a lot of others,-1
use real currency hell full site could,1
btc girl nft world btc nft eth,1
trader ticking profit market bitcoin crypto trading,0
tell cryptocurrency invest bitcoin come back,1
i must say fucking crap btc trading,-1
breaking publish newsletter pleb stacking watch bitcoin,0
mark slatki william gallacher sheila freeman btc,0
the high fee for ethereum gas makes it worth using,-1
bitcoin go to more support long bitstampbtcusd signalprovider,1
"yes, you are right, you cannot make such a conclusion",0
btc hold line binancebtcusdt mynameisjeffxyz bitcoin btc,0
got ta think year cro jos rano,1
non kyc stock trading bitcoin crypto cryptocurrency,0
really sent wrong bitcoin address wow fml,-1
man one emperor alt could get banned,-1
trust opinion crypto concise effective simple lol,-1
spreman get put cryptominer pop btc hold k,0
shit coin shit coin ništa nada rien nothing,-1
fyi general rule never reveal much btccrypto internet,0
big picture bear market means almost nothing btc,1
rogerkver really disappointed bcash holder million friend expensive,-1
got much bigger unless it was bought in the last two weeks,1
bitcoin bull soon sent an epic mission moon bitcoin,1
fidelity add exposure to bitcoin traditional etf bitcoin magazine,1
thought btc bitcoin see telofxs idea tradingview trade,0
spent a month resentful of the high price to get another race,1
new york mine bitcoin home stand protest nonsense,0
go say wants freedom well keep stevienicks bitcoin,1
proof bitcoin hidden dark corner serves vehicle criminal,1
lost money every cryptocurrency purchase never sold,-1
damn sleep track idk i hate damn sleep,0
mega bitcoin dump starting right x short btc,0
cryptobusy snakenftking good luck bro bitcoin twitter crypto,0
intocryptoverse yet another accurate short term bitcoin prediction,-1
crypto crash trend twitter bitcoin pad dogecoin bitcoin,-1
rolandstautz bitcoin real cbdc cryptographically backed decentralized currency,1
cryptocurrencies would remain a bitcoin ethereum bear market area,-1
whalecointalk probability bitcoin mined uncertain life turn turn,0
bad news bitcoin crash current rate usd btc,-1
that time btc btc know way supercyclical wave,1
bad news bitcoin crash current rate usd btc,-1
usdt worth bitcoin sold last minute big order,0
really tired bitcoins bipolar bitch like btc,-1
a lot of energy wasted people masturbating bet a lot hear,0
free economy equal access create a free world btc,1
tiny play win big btc btc stock crypto,1
oh yes you are right you look like a real fool,0
apompliano normal sibling bear season btc k dump,0
real support passive support probably coming all good,-1
change details h low h high bitcoin btc,0
goingparabolic drop imo good opinion of other bitcoin hodl,0
bitcoin block byte transaction btc reward information visit,0
knowledge potential becomes power becomes power using btc,0
spending bitcoin flex bitcoin the fastest way le bitcoin,0
traded m portfolio taken k discipline crypto bitcoin,1
bitcoin monetary energy latently ready burst moment stopped,1
bito bitcoin ready trade tdameritrade etfbitcoin trillionusd puntocripto,1
marry christmas all bitcoin update crypto bitcoin btc,0
thought btc bitcoin see tradinghubs idea tradingview trade,0
dvije regulated stock exchange lcx bikovski eos lcx btc,0
arcbtc steefbtc another bitcoin moment amazing work steefbtc,1
tesla current million investment in bitcoins buy dip elon,-1
I love getting people rited one hobby look history,0
coindcx i believe btc ogn beats other crypto december,1
"Many times, people learn to trust a guy",-1
canica dont know bitcoin love love canica bitcoin,1
open investments trade bitcoin btc investments weekly profit,1
stone ridge trust filed a sec filing mentioning bitcoin,0
stevephillipsmd mangan bitcoin reci fuck one take buybitcoin,1
don&#39;t care bitcoin broke bad fix tomorrow think,-1
humanifold blockstream shesek sorry interested bitcoin better coins,-1
cryptohayes i&#39;m willing to bet i won&#39;t see btc k,-1
going long term btc eth coin buy imo,1
drewpflaum bitcolncash bitcoincashfund bchmeetups sorry interested bitcoin cash,-1
yobitexchange yobit scam theft xrp blocked post reply,-1
ill never retake anything fixed term lesson learned,-1
going long term btc eth coin buy imo,1
panama could offer a discount on channel usage paid btc,1
CEO making false promises problem that is bitcoin king,1
alt coin purchase let the bitcoin cryptocurrency discussion begin,0
hold stocks appreciate illlawi faresbeneth sneakerheadsoff nft btc,1
hot price reach spring binancehotusdt wildbill bitcoin crypto,0
nothing like receiving bitcoin merchandise best tribute collect,1
excited donori chainbytes bitcoin atm leybitcoin nayibbukele bitcoinbeach,0
taking binance personally lost faith as money locked,-1
the amount of bitcoins awarded to a miner is cut in half for about a day,0
ninny bitcoin bitcoin goal conversion fiat price pointless,0
pricewise think good time get lrc good luck,1
bitcoin dead crypto tweeter fake going rekt enjoy,-1
america right to bear arms state i want oh wait,0
shhhh cash app king le know more lol,0
last minute crap better television that&#39;s for sure,0
you need to buy anything take profit result le sat,0
welcome full path btc bitstampbtcusd voxhit bitcoin btc,0
i am sure i bought gbtc roth ira account fidelity,0
new york clamp bitcoin mining newly promulgated law,-1
heading gun show today we hope to buy ammo bitcoin,1
bitcoin gold i still don&#39;t understand it got a lot of value,-1
determines the price of bitcoin a good reading dynamic market outlook,0
I&#39;m pretty sure the transactional blockchain is orchestrated pumping,-1
Im job even think wrong fix bitcoin too,1
btc maxi run exit k bitcoin shitcoin link,-1
long-term maybe that short-term annual goal,1
scratch gambling itch make learn investment economy general,1
breakout bitcoin new time high indexbtcusd trader btcusd,1
bearish thing bitcoin right retail trader freaking dip,0
"bitcoin is currently trading in a resistance zone, watch out, longsbtc",0
i think i have enough tips sub luna nail coffin,-1
cheat sheet bitcoin trading failed btc btc though,1
buy luna deserve financial ruin type pure scammers,-1
bitcoin h rejection h bearish retest see you,0
bitcoin block byte transaction btc reward information visit,0
drill team reporting past core next station australia,0
historical bitcoin price today february via twitter,0
coinbase pro allow withdrawal bc address withdrawal failed,-1
sense a better thing moving in a positive direction bitcoin btc,1
it sounds even bad lol it&#39;s a slightly worse gamble,-1
wsbchairman dogecoin press follow button elonforpresident eastmankodak kodk,0
bitcoin btc kripto btc oh oh budi se k,1
levioo kingsalman btc entered bullish mtn next medical chain,1
shaky day crypto market right btc binance ftx,-1
u dropped ball bitcoin crypto regulation sec commissioner,-1
today bitcoin fear greed index neutral crypto cryptocurrency,0
hey mr kite please pump bitcoin position under water,-1
another exchange kept the crap original token worthless attacked,-1
positive sign half way down a little the next day pumping,0
probably popular opinion monero criminally undervalued enough said,1
thedustybc I don&#39;t know who else knows how to do btc,0
btc transferred kraken unknown wallet tx blockchain btc,0
learn a lot enjoy the continuous learning to go with bitcoin,1
rebounding back damn luda brzina bitcoin recovering fall,1
meth addiction symptom humanity disconnect nature bitcoin way,1
bitcoin mining operation finger lake spark local concern,-1
ladyofcrypto bitcoin b cheap upcoming day week minutes,-1
crypto technology boost clean energy global warming via bitcoin,1
bitcoin block byte transaction btc reward information visit,0
you will get unless you are extremely lucky pure gambling,-1
medvjed gloaters cave friend see yall next ath,0
think final swamp drain official run eth btc,0
bitcoin cling to fed signal increase rate hike bitcoin,0
wassup larry sad seen withdrawal gain time yearly,1
layahheilpern correct chinese communist party bitcoin favor know,1
tyler herro is still playing heat bet btc tonight,0
bitcoin ready slept woke up all wanted what&#39;s the problem,1
sell bitcoin also earn bitcoin harder to sell hodl,1
eth Backpackersmodels will get a real job eth btc,0
taillarb tresolas deitaone gold move forward back btc,1
mayor mayorconger jackson tennessee convert next paycheck to bitcoin,1
really interesting go back a year under read the thinking,0
huge amount of btc is probably breaking,1
"yes, definitely compare bitcoin vs gold term volatile",-1
valkyrie liquidate btc etf end of october btc etf,0
bitcoin opportunity assessment fullscale bull run cryptonews bitcoin,1
follow many people lose mind stick plan btc,0
main book vote good book better document harder to screw up,0
seashell might call exchange shellys seashell,0
elon reason doge perpetual dip from snl occurrence,-1
binance fact about bitcoin lost forever bitcoinbutton binance,-1
even worried about making money within a month,1
coinsquare thanks opportunity stpatricksday bitcoin coinsquare tag utksrvstv,0
person indicirati republican edit nvm post history check,0
buy order spread in a bear market game to accumulate,1
alert bitcoin pause strong bar m oct am,0
eth feeling pain fell bounced much sample btc,0
news block bitcoin pad btc btc bitcoin bitcoin,-1
really sad to see a coin cashed out for two years,-1
bitcoin block byte transaction btc reward information visit,0
minted renbtc usd eth darknodes fee btc usd,0
helpful bitcoin tip that talks about buying completed cashout identification,1
kirthpal deitaone better chance increase next month bitcoin,0
as bitcoin idiot holding rgbo said real soon,1
whalealert getting ready buy btc shoot the guy,1
czbinance pidgin translator no one controls the bitcoin network,0
crypto company prepare pause activity ethereum merge bitcoin,0
trying to crash the price buy cheaper cryptocurrency bitcoin cryptocrash,-1
life really quite simple get vaccinated buy btc,1
misunderstood curiosity go home nap seem nervous,-1
bitcoin has lost half of its value since hitting an all-time high,-1
bitcoinpizza would pay you just the last hour of bitcoin,0
time dollar cost average bitcoin position grandchildren thank you,1
bearwhale sold worth bitcoin btc bitfinex spot market,0
hm bitcoin is constantly improving evolving main root pretty huge,1
oh hai crypto trader keep calm hodl btc,1
kwon monetization billions collapse biggest scam in history,-1
