text,sen
Bitcoin derivative data suggests pin bear btc k expires option friday leader cryptocurrency cryptocurrency,-1
each time btc held long consolidation volatility after btcusd breakout high,1
happy to see the boy citadel,1
Get up baby have a spirited weekend,1
smart human actually still listen to the guy who emotionally bad interpretation weak wrong it&#39;s better to admit suck do good next time instead of keep leading emotion suck bitcoin,-1
nikcantmine neiljacobs let&#39;s buy bitcoin k ben,1
long government print money price bitcoin stop increasing monetary policy leader change country see btc price millions end bitcoin moon,1
biconomyglobal bitcoin demonstrating regain strength the last day still strong conviction bitcoin start buying buy dive still simple follow btceth love advice ta can interest well,1
as tweet detected misspelling cover thetimes newspaper rd jan headline included famous bitcoin genesis block spoiler comment,0
guess cash we went shopping weekend we went sell good news u cheaper btc,1
that&#39;s true however plan to move on forex year build track record get growth per month relatively low reduction make a living trading account of people need to build a good long track record already happy couple question potter together use of mt trading bot code however didn&#39;t have enough patience to run again long enough see gong profitable always tinkering changing deleting piss off pay server forex run hours anyway realized a longer time period weekly chart daily adapted personality better become better trader no need bot chart of frames longer the order pending to carry out the order of the market age,0
blockfolio see win individual purchase,0
never quiet see net worth take an absolute dive real time bitcoin epic,-1
Russian billionaire icymi Oleg Deripaska urges Russian bank to move bitcoins,1
Bitcoin Average Bitcoin Price Index,0
available nano also i&#39;m sure it&#39;s available anyone still think advertised,0
done binance around bitcoin lost forever bitcoinbutton binance,-1
bitcoin miner preparing to take maraplane,1
mrwhosetheboss elonmusk someone orangepill guy bitcoin lightning away exciting thing going technology,1
trade bitcoin currency everybody wants the week can&#39;t handle the fall week starting witchcraft olawale daniel forex cryptocurrency btc,-1
buy bitcoin cant sell half sell none,0
"aight, anyone lurking sub-prime moment bet objectively a valuable digital asset exists jump like five dollars even experience",1
"first test dumping season since January, BTC has barely moved, but not even half of January&#39;s value",-1
I love vip customer sweep board today blocking win verified btc bitcoin dot,0
bitcoin advancing head to moon,1
next time tell him to buy bitcoins,1
sent btc ledger coinbase say pending hours is the possibility of losing btc,-1
fun fact bitcoin weekly closed red second row last time btc closed two weeks red row next week green fact not closed weekly row year june,-1
aim high time zoom bitcoin,1
absolutely awesome stuff bitcoin company fanatic investors thanks Woonomic providing excellent information,1
coinbase secures probably a better option poorly managed hot wallet online alternative probably inferior a properly configured secured hardware wallet eg nano,1
bearish looking range cautious too bullish low retest range looks likely bitcoin btc,0
Bitcoin Btc case below,-1
oh hai crypto trader keep calm hodl btc,1
sandstorm divert attention bitcoin buy lowest price true definitely masterpiece,1
bitcoin read full analysis of bitcoins cryptocurrencies,0
mtradess also said last night he didn&#39;t like the word something happened unconfirmed aapl year btc dipped denied,-1
invested heavily sell loss tips,-1
dixo hodl sodl sodl bitcoin,-1
The percentage supply of bitcoin btc last active year reached view metric,1
btc liquidated short k,0
bitcoin mining recovering btc go bitcoin binance,1
bitcoin fud warning don&#39;t let a little volatility scare you healthy correction btc expiration day keep your eyes on the dip maybe i&#39;m wrong follow the plan,1
cash application. Nice little stock bitcoin app. Great cash retention. They also rate bad bitcoins. The purchase of bitcoins receives as a fee. I love the cash app. One reason why the square share cash application is maintained through Bitcoin.,1
holding on tight improve diving under shooting moon cryptocurrency binance bitcoin,1
tune tesla bitcoin bet performance increase ed take bank real vision finance business the,0
important tomorrow the structure of the long-term market Bitcoin altcoins,0
rresonate redact shirehodl taodejing bquittem that allows bitcoin to grow rapidly most don&#39;t know don&#39;t take the symbiosis organization seriously including the bank of the bank an unstoppable lightning survival machine,1
fascinating story btc future finance,1
Bitcoin bullrun could facerse indexbtcusd shytrader btcusd,0
like hell,-1
coinmarketcap world trusted cryptocurrency data authority richardheartwin coinmarketcap hexadecimal bitcoin,1
word immersion thrown around a lot of assets worth the north k go hundred that&#39;s pretty normal it&#39;s worth talking about,0
know late heard yesterday learned a lot comparison bitcoin cult persuasive chill,-1
really interesting to go back to the year sub read thinking,0
hoxe xmr equal btc monero privacy,0
Ilovejeneadams opportunity to buy bitcoins a year ago,1
btc probably down around kk,-1
Sotheby acepta ethereum live bid famosa peza de banksy dogecoin bitcoin,0
manter stock apreciar illlawi faresbeneth sneakerheadsoff nft btc,1
it was shit dive hurt,-1
nytimes annamingai road lead bitcoin,1
annoying as hell to everyone,-1
apompliano right matter altcoins promise bitcoins the safest and fairest network,1
first time history money manipulated corrupt changed armed current money system armed print money breedlove btc,1
market achieved greedy organic growth many people taking profits therefore correction,0
sat down to the talented bitcoin stand,1
overcome ready bitcoin moon,1
bitcoinfreak saitamaguru strategy failed token app launch promoted best app failed miserably btc crash failure strategy know timing fails deliberate strategy,-1
hey man scalping short long short long couldn&#39;t take the red circle hard to judge damn enough trading ability btc,-1
good green candle encourage the opposite say negative luck shit damn time,1
It helps bitcoin crash to be bullish,1
ananavarro earned money btc altcoins learn earn grow money complaining follow via telegram cryptysophia,1
breaking news the central african republic has passed a bill to adopt bitcoin as legal tender like dominoes,1
you must lose your memory bud,-1
small chance that the price of btc could reach ak say that the trader u dollar bitcoin cool,-1
bitcoin pecha weekly candle support trend line huge confirmation btc alcista follow tradeosiann are super underestimated doge,1
add fake cash dollar supply add fake gold supply add fake btc bitcoin blockchain,1
jamyies best choice always bitcoin supply value limited increase year go adopting many countries currency,1
"exactly the opposite, last month would be slowly trending k peak little slowly trending upward pressure as",1
cryptographic option bitcoin stx ada xpr,0
creador satisfeito bitcoin bitcoinbutton bitcoin,1
crypto update loading bitcoin kishu gem next x,0
ummm I expect a full dinner,0
I&#39;m still new crypto I know safe retail investor new I don&#39;t care much more put money crypto market belief btc maximalists all fair doesn&#39;t mean much control wealth,0
"difficulty to mine the world&#39;s largest cryptocurrency, bitcoin has reached the highest level of all trillions. The mining difficulty has grown compared to last year, around one billion btc cryptos",-1
doopiecash bitcoin still sitting k resistance building another push bear seems unable to hold push think k likely everyone will follow ethbtc tip tweet excellent follow up,0
what is special fixed supply exploitation date earn bitcoins passively bitcoin that i think will form base layer future money putting btc investor in hand passively empower da cryptogems btc crypto,1
the company engade a btc cryptocurrency expert board,1
ok closed inside the cloud tested outside ichimoku the flat cloud side would mean the range inside the cloud would be the first time i see i open trade bitcoin daytrade,0
michaelsaylor boat absolutely quiet except gentle tilt case imperceptible face below signal visible approaching disaster lawrence beesley bitcoin,0
stackersatoshi luxalgo k incoming btc,1
overutilized statement crypto bitcoin understand,-1
history has always produced hero despair greater time depth despair greater hero appears bitcoin,1
use the price check app with the easy uproar generally never said it was bought,0
crippledogecoin thecryptolark yes paid doge there shiba inu ski i cant buy doge without buying a wide variety of food doge doge bitcoin,-1
visa suspended service rusia paypal service suspended rusia service suspended remitly rusia mastercard service suspended rusia bitcoin still servant rusia cryptocurrencies cryptocurrencies cryptocurrencies shibtoken btc mattwallace,1
you made a mistake you know the bitcoin bomb two weeks you don&#39;t expect the bomb the next two weeks,1
bearwhale sold for bitcoin value btc bitfinex spot market,0
osltraderview april bitcoin developing retracement triangle pattern matches tax day u ust flip busd become the rd largest stablecoin find today edition,0
misunderstood curiosity go home take this look nervous,-1
difficult time low low flat last year repeatedly all bearish markets,1
testing crash price buy cheapest cryptocurrency bitcoin cryptocrash,-1
next drop could current price,1
Apompliano depends on the period of time to be entitled to dangerous land bitcoin hold,-1
give a good reason for bitcoin hedge inflation,-1
he didn&#39;t know much that he had met,1
saylor iiicapital si tweet bitcoin,0
Quantmbrix ipfs built bitcoins I&#39;m interested,1
crypto again accurate short term bitcoin prediction,-1
Bitcoin rallied in Asia last night because Asia doesn&#39;t care about the infrastructure bill,1
I thought tweet sarcastic moon a week ago it&#39;s worth fraction cent bitcoin crypto bitcoin bitcoin insane condolence people went send cryptocrash,1
raise money raise world bitcoin bitcoin xerational wealth shortmetraxe matt hornick tomer through youtube,1
ashwsbreal leave big move bitcoin crypto lover everyone buy bitcoin let wagmi imagine millions bought future btc bitcoin,1
well obviously people sell,0
apompliano brother normal season btc k dump,0
real support passive support anything good coming probably,-1
sold bought many times red wallet since the game started right shark know cheat code,-1
bigger buy would suggest buy usdc coinbase transfer binance taking advantage of bigger buy fee suggest buy bnb offer even bigger discount buy binance assuming i don&#39;t use binance,0
today breaking news medium topic competitor btc bitcoin crypto analyzed article medium general sentiment negative,-1
list to put cryptominer pop btc keep k,0
idk i change literally last week i think the average coverage has changed a lot,0
seeing a lot of people calling k fondo support band to the bull market to go k would mean a party,0
handsome xesto señor fookin salvador gilbert amor will buy the legendary version qnt qnt btc ethereum,1
bitcoin always working find new highs shitcoins always working find new lows understand,1
airdropteam bnbbull bitcoin gives beautiful peacekelly project,1
got continued use people learned a lot interest people help solve the problem of innovation user interface always win,1
midas touch july gold silver bitcoin consulting report,0
mining bitcoin smooth volatility revenue inefficient industry land oil gas power generation,1
keep playing the btc game,1
"it may seem terrible, it won&#39;t get worse at all change, still finance buy, but lots of crypto just sink swimming break careful project start double lose a lot of liquidity btc cryptocrash eth",-1
Bitcoin Btc News Billionaire Simon Nixon Family Office Set Crypto Allocation Increase,1
altcryptogems investment time horizon year best asymmetric investment risk bitcoins holding bitcoin financially free life following btcy tweet prediction hugely added thanks mentor,1
bitcoin btc reverse head shoulder pattern target buy vet time,1
bito bitcoin ready trade tdameritrade etfbitcoin trillionusd puntocripto,1
bitcoinmagazine bitcoin new future,1
dca hodl take profit type,1
insurance that is ready to buy blood btc btc bitcoin,1
Top crypto billionaire has lost billions since bitcoin&#39;s all-time high,-1
bitcoin entered long time btc come bull,1
hang fam btc ride,1
watcherguru looks like the event that regulates acceptance of the crypto classification that can gain bitcoin space,1
June hodlstep dance milky way,1
you are afraid to buy dollar you are an idiot saying bitcoins,1
lol marked the top burnout bomb lol,-1
shocked the high season kick remembers the bullfight could turn a blind eye throw an alt dart would give an insane profit well done high season btc dca,1
Caitlinlong Kwerb Raoul Pal talks about the possibility of a bitcoin market crash,-1
novo btc euro ath bitcoin,1
follow betfuryio let&#39;s hunt bitcoins together get an exciting experience wi gaming platform,1
trying to find a good information beep article outline a well summarized concern final thought it sounds bad,-1
bitcoin di que fuck birthday slardybart goin,-1
no one cares coinbase shit worse reason affect money no one seems to care,-1
cz reveals possibility of ipo binance u future changpeng zhao cz ceo binance hinted at possibility of initial public offering ipo its cryptocurrency bitcoin forex,0
comprar bitcoin jp morgan,1
Bitcoin onchain metrics suggest bull run style continues bitcoin,1
btc bitcoin future etf broke record two days,1
things seem a little optimistic today,1
grab the satoshi permanence market that will never fall,1
parecer bitboycrypto right tweet crypto bitcoin btc,1
onchain bitcoin value spent currency utxos per btc value moi probable internal exchange transfer,0
ashwsbreal bull back charge broke k resistance k real ready bitcoin k imminent,1
cryptonite kerooke someone says million sitting m sitting m sitting m sitting k sitting k sitting k sitting bitcoin bitcoin price,1
wish repeatedly as often as possible,1
hard to know almost harmed would embrace cryptocrash bitcoin bnb,-1
another exchange held a worthless hacked native token,-1
said investing bitcoins are you replying subreddit you need to work on basic reddit skills last flagged replied comment take face value looks even worse using sarcasm,-1
make someone poor sick as he knew bitcoin from year rushed manage accumulate,-1
he said whining waiting to answer the question instead of whipping answering the question asked prediction away doing type as always enjoy a well reasoned prediction if it&#39;s bearish bullish,-1
bitcoin end week edge sp officially enters the bearish bitcoin cryptocurrency market,-1
agree it doesn&#39;t matter to believe want point make exaggerated claims would seem something want to believe,-1
Jpmorgan&#39;s analyst stated that bitcoin hedge capital drawdowns are poor. Newsflash btc is also poor,-1
denial disbelief btc,-1
speed generally knows ftx dumping shipping crypto atm any reasonably catastrophic caliber,-1
rektcapital well almost looking at btc last week say the next half seriously,-1
idiot still buying cryptocurrency luna btc,-1
xrpbart peterschiff still not getting it yet lol wow the naïve generation history is decimated chalk experience as not much bitcoin yet,-1
"completely unacceptable, you couldn&#39;t buy a stock exchange crap base",-1
The price of bitcoin falls in k minutes and CPI inflation exceeds bitcoin,-1
print bitcoin buy gun Ukraine recollateralize poorly managed banks financial institution ensure the proper functioning of the market housing stock market reason united state never adopt bitcoin,-1
I want to make money as a problem for sure that the future holds a bad press that&#39;s for sure,-1
yobitexchange yobit scam steal xrp blocked reply publication,-1
word regulation that activates the cryptocurrency bitcoin community lol,-1
the american news anchor asked thinking that amazon would soon accept bitcoin payment the person wasn&#39;t even the chief executive of amazon he didn&#39;t know people panicked,-1
"You are probably over trading, impatient, pick a good coin",-1
Guggenheim Minerd says that bitcoin could fall the currency is its currency,-1
btcarchive someone sent eth prove bitcoin,-1
take btc future approval etf investment product inefficient long term investor still confirmation digital assets current bitcoin,-1
Bitcoin route year continues gives expectation of real change,-1
apompliano apompliano kevinolearytv quite stupid eats btc,-1
elonmusk bitcoin i hate you,-1
passed btc lost support btc crypto bitcoin,-1
robinhood bought today falling ow sad face xd,-1
moving ftx today binance failed hour still done refe,-1
forget the phenomenon forget move cryptomarket looking domain dxy data spx stay away give money free product except people who are like a phone scam bitcoin kingdom,-1
cbdcs invented hell satan di asi president rico checkan btc bitcoinnews bitcoin,-1
the news arrives while still falling,-1
seems like every night almost around morning cst sunday always negative day last week minus,-1
well peterschiff malfed destroy asset market mistreat bitcoin active risk bitcoin decouple mes top head good altcoins like eth sun head many destroyed blood come,-1
no one convinces people panic sell people referring huge descending triangle monthly chart yes technical analysis theory says break massive support hard fast kk price k support become massive resistance decide what you want to bet,-1
maxkeiser imagine build big ponzi could buy a thousand bitcoins still crash hard lose epic hour fail goat level fail,-1
interstellarbit thanks folo fear of losing bitcoin ponzi scam shitcoin,-1
ask btc crash think black swan event cryptocurrency ban russia global geopolitical problem russia ukraine conflict,-1
"man, that&#39;s everyone&#39;s first time it&#39;s kind of stressful. You are trying to send a cold storage",-1
black venres offer crypto smh ada ethereum bitcoin,-1
Anyone experiencing voyager app support seems non existent maybe overloaded free btc freebie know you want to keep active it takes a week to hear from support email,-1
time valuable bitcoin drawing,-1
andydestroyer non compre btc bsv bitcoin non siga a multitude de bombos andy fala kurtwuckertjr,-1
cryptosavy couldn&#39;t agree i started calling i&#39;m tired of seeing a phrase tweet rocket emojis bitcoins,-1
crypto rich speaking beforehand projecting reveal are you hoping to get crypto get rich yes it won&#39;t end well friend,-1
Shib does not import bitcoin dumping,-1
wtf woke up crazy,-1
oh god crypto winter sugar flakes ceo falling all venden venden venden liquidan todo venden muller fillo,-1
a day ago meet someone seemed to know something bitcoin understood he didn&#39;t say bitcoins like bcash like cryptocurrency answer media bcash bitcoin man lost zero credibility like bcash,-1
nothing proud everyone knew sorry friend btc,-1
btc a sufficiently stable hedge inflation,-1
The change in TikTok&#39;s policy harms the bitcoin blockchain trade to the creator of cryptocurrencies,-1
damn well,-1
cryptocrash bitcoin investment without foundation cryptocurrency run computer institutional structure aman agrawal wednesdaythought,-1
intellectual laziness illness terrible consequence family wake study get smart opt bitcoin,-1
nah bo late,-1
cryptoshillnye hey fuck trx next bitcoin bitch,-1
Nickszabo monopoly bitcoin edition would be the least fun board game ever,-1
bad news bitcoin cae tax actual usd btc,-1
zerosumx sundhaug hacked bitcoin using a strange trick,-1
bitcoin core cult trapped world platonic form conference danielkrawisz satoshisvision,-1
"Hey here, whatever bitcoin goes sideways ever",-1
pwthornton bitcoin fan fuck fdic big government regulation also bitcoin fan fuck passed money,-1
illusionfoxe mining in fact bitcoins really end up spending a lot of money or burning down the house,-1
apompliano someone killed the bitcoin developer,-1
go home bitcoin babe,-1
coin exchange shit stupid exchange burn shit bitcoin litecoin shit easy exchange,-1
bad news bitcoin cae tax actual usd btc,-1
crypto collectible sen value sen website,-1
bitcoincashbch bitcoin rogerkver is stupid,-1
prediction satoshi comes to hide talking shit bitcoin cash bch btc,-1
be tired real bitcoins bipolar bitch like btc,-1
khunfyp btcmanager maybe hysterical that someone is calling bitcoin cash a scam,-1
everyone like bitcoin looks like a gym teacher is taken seriously,-1
never mind bitcoin broke a problem tomorrow think,-1
heart I believe bitcoin ridiculous iso is dandy,-1
Stopped checking crypto price rbitcoin everything back to normal but shit still hitting fans,-1
you know fake bitcoin joke still hilarious stupid fun real yet,-1
humanifold blockstream shesek perdón interestede bitcoin mellor moeda,-1
bitcoin dead kinzcash vivo,-1
heap hanging hipster pretentious bitcoin amiright,-1
bitcoinyuri blockstream forgive me more interested bitcoin,-1
"drewpflaum bitcolncash bitcoincashfund bchmeetups perdón, bitcoin cash interesado",-1
I wish I could drop the hard acid bitcoin price,-1
bitcoin currently tired of going to space visiting the moon seems to be the core of the earth new destination btc btc,-1
cointelegraph sorry more interested bitcoin,-1
hate people blow thing ruin fun everyone first youtube bitcoincryptos,-1
afaqshah philakonecrypto wishing bad about bitcoin rude,-1
cryptsnews blurred bitcoin authority proves forgery as fake dollar bill,-1
you actually sent the wrong bitcoin address wow fml,-1
I&#39;m the worst bitcoin,-1
mamawhale always pays pbr carallo bitcoin,-1
bitcoin feo,-1
Wife-to-be just gave a friend a dry hand job thought bitcoin was plummeting meanwhile I&#39;m a bitch,-1
Bitcoin Dead Crypto Tweeter False Go Rect Gozar,-1
The price of bitcoin could not overcome the level of news the potential closure of binance japan,-1
fucking sick market cryptocurrency cryptocurrency btc bitcoin,-1
flyguyinthesky bitcoin fedor,-1
The bitcoin concern seems like a currently wrong form of routing,-1
add two letters ch somewhere bitcoin yes right swiss bank conspiracy theory crap buy crap,-1
hello bitcoin,-1
"Hey, damn, bitcoin investment opportunity acting like you&#39;ve never heard of other coinbase",-1
cointelegraph bitcoin bubble crashes hard,-1
philakonecrypto bitcoin can find illegal child porn link embed blockchain maybe reason for panic selling,-1
broken bitcoin maximalists don&#39;t know,-1
whalepanda end boy bitcoin package morto,-1
btc maxi running exit k bitcoin shitcoin link,-1
singapore authority issues crypto warning pm bitcoin fall prey scammer,-1
Apple-approved bitcoin fraud application steals bitcoin mining from iPhone user,-1
Rogerkver really let bcash holder dear friend down,-1
quen pallasa btc bitcoin,-1
bitcoin btc fucking question,-1
look like king ponzi btc pour peasant bankers know a hate still asked to invest millions ponzi going worm rek you will blame an absolute fool bitcoin btc,-1
bitcoin needs approval political bitcoin people supported currency people existence made choice legal people political derive power people accept people way,1
trap,-1
pretty big news love see utility same global bear market fiat dca can convert ccd benefit get,1
gon na currency vr world definitely moving towards a giant corporation focus effort goal microsoft vr also seems logical growth point of view text screen moving image next logical step,1
yes moon go shit shit burato,-1
perfect time to buy moon,1
since read literature blockchain technology web potential crypto exposure could brainwash read risk assessed conviction blockchain technology stay no matter the coin is coming soon tbh,1
bitcoin rest crypto market has resisted an incredible amount fud around ten years i guess still the biggest critic embracing tech impact blockchain tech things like the decentralized web the supply chain of ai defi immense name compare tulip market willful ignorance,1
interesting course people who have earned crypto money disagree with crypto wallet btc eth fully understand the risk and strongly believe that it is profitable in the long term,1
suspect that bitcoins succeed no reason people talk about bitcoins inherent value inherent value distinct root advantage uncontrollable easily washable bitcoins perfect underground currency sell drugs prostitute sell murder bitcoins inherent value inherent value currency use safely conduct illegal transaction want bj how much fu lapd convert dollar bitcoins pay bitcoins presto end happy value bitcoin finally established money flow search currency well illicit let&#39;s say daily illicit transaction market m means every day m worth bitcoins bought used illicit purchases good services sold dollar so however many unique bitcoins happen market day total value m,1
The dotcom crash wiped out many useless tech companies that promised a future bubble crypto,-1
decade of joke,-1
it is not speculation investment ponzi scheme there is underlying business generating active profit appreciate reason future price increase someone else sees the price increase want to speculate keep going up self fulfillment is not,-1
trace common thread hippie counterculture s california today silicon valley ethos remains indisputable lsd inspired great music art crypto given you monkey jpegs,-1
put coin,-1
a bitcoin constantly improves the pivoting root in quite enormous evolution,1
A lot of rubbish surrounding the coin community has known about this smart investment. This coin sucks to earn money sucks coins really very rare.,-1
another ponzi waiting to collapse like earth,-1
bitcoins mined miner incentive continue validating transaction see bitcoin price break,-1
