text,sen
biden expert believes inflation temporary two-week stop spread said similar expert long temporary precedent expensive say year bitcoin help fix,1
I was thinking about investing btc celsius investment included i can&#39;t get a good reading risk of earning btc seems like a good way to earn still hold,1
one confident crypto investment anything ponzi scheme view service currency don&#39;t think great or question ask useful feature support current price,-1
transfer wallet transfer other exchange want trade buy sell local obscene premium trade polo bitstamp bitmex you are australia use livingroomofsatoshi pay bill,0
odell adamisapleb that might want to reconsider want public bitcoiner ultimate test integrity greed pride ego might become a problem low key stay humble,0
trying process big week go Barry said big week crash real estate company china didn&#39;t wait didn&#39;t wait see place etf accepted bitcoin,0
tmobile breach includes name phone number physical address also sensitive data such as ssn driver&#39;s license information imei number information sold bitcoin tmus,-1
cashapp jackdorsey bitcoin the world&#39;s biggest podcaster joe rogan accepts bitcoin payment joe rogan the world&#39;s most successful podcaster comedian accepts bitcoin payment shares finance,1
network growth continues to accelerate the fastest pace in history the number of short-term catalyst could solidify the formed effect of the network truly bring bitcoin billion people bitcoin lightningnetwork,1
find way trace report sent first address node gave never showed up anywhere multiple confirmation im clueless well versed in bitcoin wallet,0
jtsglobal utodayen govbrazil indiainbrazil apompliano brazilbrian brodienbcs ukinbrazil jack amazing big country it would be bad to become a third country make bitcoin official btc,1
bitcoin price canadian dollar btc xbt btccad btc price cad avg. last hour avg. hour x change x low x high information,0
USD Elsalvador Bitcoinday Got Sat Sat USD BTC USD USD Sub Pet Lis CDT BTC USD USD Sub Uto Ruj CDT Bitcoin,0
erossiniuk despite pullback quite long still confident bitcoin we see new high soon year but everyone follow sotbc tweet prediction follow closely,1
watch update crypto market result btc result alt v btc result alt v market cap tb btc dom eth btc,0
project built good development open long-term opportunity every user also project is developing fast i believe success future ascendex bitcoin defi hariom sumitk jaising,1
yes he could correct the statement although under worst analysis except analysis bitcoin real value crypto currency people therefore love the thing much profit percentage,1
cryptotowneu project professionally implemented clear development plan created professional experienced team no doubt one of the best project itssmariyan mahaburtech topondey boss airdrop bitcoin,1
see a fast deflationary market chasing riches diminishing returns they are still returning keep trying to trick people into buying with no one holding the bag market crash,-1
right lol like anyone who follows price prediction last month could make a lot of money idk people get mad especially next curse month,0
bitcoin mining container shipped across the united states take methane gas ventilated atmosphere recycle bitcoin bitcoin mining industry travel remote location gas ventilated,1
last chance bull btc resistance k highlighted mart st fails break k time could break k level coming day bitcoin btc crypto,0
project airdropfather bright future really think project perfect truly cool innovative project the future belongs to the project mizimaruf munna ahsankabirsanto ummenipa airdrop airdrop bitcoin,1
bitcoin ethereum trying to stay kk weekend red week inbound jumping pray leg finally fully oversold thought btceth falls below k week,0
movement offer income stream earn easy publish share like used social media sell rent items marketplace earn business support platform bitcoin keyboard revolutionaries,1
looking for new start job one most popular company bitcoin imperviousai hiring senior backend engineer apply today build impervious browser pp internet standard,0
advantage bitcoin additionally merchant processor there merchant assistance transaction processing convert bitcoin to fiat currency deposit funds directly merchant bank account daily bitcoin,1
everything that happens human behavior think great time get in sure take it easy greedy metisdao sovrynbtc btc eth chart say though reflect thing a little slower,1
immediately cash every red cent soon fact he fully compensates the victim enough to lose trust fact trust important enough to lose trust con,-1
michael saylor bought bitcoin el salvador bought bitcoin elon musk bought bitcoin smart kit i don&#39;t want to follow follow one bought the bottom of the market,0
vibraniumvbn project bright future really think project perfect truly cool innovative project the future belongs to the project mizimaruf munna ahsankabirsanto ummenipa airdrop airdrop bitcoin,1
all bitcoin july internal working fed revealed daily fail mairead mcguiness money laundering meme review rawavocado sponsor cryptocloaks host bitvolt coinicarus,0
anyone have voyager app support experience there seems to be no maybe overloaded free btc giveaway i know i want to keep assets take a week even hear support email,-1
simuliu diversity despite decline rise bitcoin still earns through mining trading bitcoin time sell time investing contact abrantesrene investing earned money investing,1
mikejvoorhees jimmyjacked theamericanhodl bitcoin usdt trading pair history nothing really new i want to remind bottomed march k trading k absurd get speak people,0
no don&#39;t think we&#39;re celebrating the spirit of satoshi bitcoin i think pizza day is a very fitting thing bitcoin doesn&#39;t celebrate the community of leaders maybe el salvador day,0
probably nothing thread roll entrepreneur explores value creation with bitcoin full potential spectrum bitcoin monetary paywall jeffbooth jeffdeist saifedean perbylund bobmurphyecon williamjluther stephanlivera,0
btc fully deployed place owning near btc busy day today stopped position done decent almost generally little day could be a lot worse,1
go run regression bitcoin v basket tech stocks following um please suggest palantir tesla nio alphabet feel free or add suggest basket,0
anyway i&#39;m still optimistic failed part btc first kicked out id millionaire i&#39;m making a point mistake pretending i&#39;m holding like shiryo dca,1
got banned for crossposting sub know good investment frantically ban silence anyone even remotely negative meanwhile keep finding new customer lose money,-1
margin lending multiplier effect asset liability netted supply chain say bitcoin can be used fractional reserve system top network hold base money,1
btc ripping important yellow zone resistance turning support hr next target important big resistance k yellow zone bull flag moment of breaking bitcoin,0
btc spiked fake news btc go back k tomorrow dead cat bouncewhhh btw sub i don&#39;t even know what that means you have a sad life fudder,1
bitcoin price canadian dollar btc xbt btccad btc price cad avg. last hour avg. hour x change x low x high information,0
jack CEO twitter confirms confirmed btc role company future mr. Dorsey advocate btc long plan integrates cryptocurrency existing product service information scn,1
coal oil gas company received tn bank from paris climate deal bitcoin mining big question hmkaaay sentiment neutral summary of world&#39;s largest bank,0
vailshirecap bitcoin asset galaxy started btc millionaire everything changed found bitcoin following aacrypt learned investing right publish tip added massive btc holding,1
nepalneedscrypto day nepalneedscrypto protest government decision ban bitcoin crypto changing the world don&#39;t want left join post hashtag nepalneedscrypto hellosarkar mahabirpun,1
ashwsbreal make a big move crypto bitcoin lover everyone buy bitcoin let make wagmi imagine millions of people bought future btc bitcoin crypto,1
mining difficulty world&#39;s largest cryptocurrency bitcoin reaches peak value trillion scaling mining difficulty increased compared to last year number around trillion btc crypto,-1
end of ww the dismantling of the new deal meant that your government cut spending amazingly you have seen an extraordinary boom year in the economy saifedean ammous thebitcoinstandard bitcoin cryptocurrency,0
cz reveals the possibility of ipo binance in the future changpeng zhao cz ceo binance alluded to the possibility of an initial public offering of his cryptocurrency bitcoin forex,0
money mate money point youll love tech upgrade offer looking deip aim tokenize intangible asset bringing em onchain interesting move defi whole,1
blockchain dispute pool dispute dispute transaction pool transaction pool enough incentivize people stakemine secure network fallback fraud case extremely inefficient non-competitive system design,-1
speculate need bitcoinlightning use remittance part make whole business model work trading algos mention win win user plus prof lightning scale genius,1
amid global crackdown on binance singapore regulator ma to follow soon crypto exchange binance faces increasing pressure regulator worldwide uk fca restricts binance bitcoin,0
marketsbylili beeforbacon elonmusk le intellectual laziness understanding games played higher level regardless feel public buy bitcoin holding benefits hodlers regardless reason benefits,1
cryptogist bitcoin price dip k genesis woe exec defend gbtc latest casualty ftx meltdown rise zabrinutost grayscale bitcoin trust institucionalni investicijski fond,-1
point another key person founding kadena dr stuart haber coinventor blockchain technology cited author bitcoin whitepaper coinmarketcap kadena built second bitcoin cryptocurrency,1
bitcoin neutral support resistance bullish countertrend signal calls for a weekly close bitcoin btc continued growth around the week signals uncertainty among market participants,0
may may shiba inu has seen a sudden surge in popularity rise in price around all time according to coinmarketcap data via newsweek cryptocurrency investsmart bitcoin,1
question assumes one crypto btc current market leader name recognition superior technology maybe immediate future maybe point usually superior technology win,1
protection from store of value big investor trade like stock market go to market still early take a long time thing to come true people resistant to change,1
amid global crackdown on binance singapore regulator ma to follow soon crypto exchange binance faces increasing pressure regulator worldwide uk fca restricts binance bitcoin,0
coindesk canaanio aoyona nakamotogames offers players around the world the opportunity to participate in countless blockchain-based games generate sustainable significant income naka nakamotogames btc binance binance gateio,1
thebitcoinbum bitcoinissaving think well bitcoin huge freedom run away from the country take a small amount of money the difference run away from nothing run away a little money start somewhere else,1
challenge the future payment system saying backend drive to use blockchain b crypto decentralized finance effectively cut middleman bank start earning yield asset,1
finished reading bitcoin standard professor saifedean best read last year hard to maintain quality level next book to read looking forward to coming fiat standard author,1
nftmechaen rainmakergaming potential relationship nitroleaguegame unique gem like Championhuntersherefore market volatile best focus project lot scope make future bright nfts rain btc rain,0
know safekeyuf coldstorage device used store inheriticom plan share want safe delivery inherit user order safekeys setup decentralized plan crypto btc sha safehavenio,0
say something break a small amount of minutes deny that may like appreciate the vast majority of trading run bot algorithm use that real explanation price movement,0
spy consolidation towards ath recalls certain btc exact things last week evidence suggests reduction in btc volatility shift spy btc inversely correlated direction of movement,1
mp accept bitcoin even partially pay maybe donation at least bitcoin altshitcoins help protect fund inflation devaluation caused by government help rakyat kasthurishankar yeobeeyin hannahyeoh syedsaddiq,1
shouldn&#39;t last a full work week exhausting hour day understand bitcoin safe fund multisig concierge team get run hour start scratch bitcoin resource best,1
said chirping hoping to answer the question instead of whipping answer the question posed far prediction make type like always enjoy well reasoned prediction whether bearish bullish,-1
bitcoin price decisively broken major descending resistance line appears to be consolidating ahead next move up interesting to see if it surpasses last june&#39;s significant high near,0
gokhshteinmedia davidgokhshtein despite pullback pretty long still confident bitcoin we see another high near year however everyone follow georgeleonel tweet prediction trading follow hard,1
gokhshteinmedia davidgokhshtein despite pullback pretty long still confident bitcoin we see another high near year however everyone follow georgeleonel tweet prediction trading follow hard,1
btc worked to hedge inflation given record gold price v bitcoin price store value adagium also game happening cryptomichnl raoulgmi trillionusd thecryptolark scottmelker woonomic,-1
best thing crypto earnings weekly stake last year interest bank giving combined bank literally robbing people of money running one successful scam world,1
glmr going x Remember tweet look chart buy buy buy big bag bitcoin btc sol doge shib keep nu xec zec dent hot,1
monsterscoins i have everything except bullish right still confidence alt sys eth cvp syscoin optimistic l nearinstant fulfillment bitcoin pow background multiquorum finality syscoin,-1
mmcrypto market overview btc price trade k most traded different direction xrp ada luna market cap t btc dominance fear greed index fear,0
fair get more concern about hardware wallet though at the end of the day people want things secure wallet user interface seed word protection stress kind crap,0
crypto think bitcoin current state of fear greed index neutral moment price usd analytics team made detailed analysis regarding btc i want to hear opinion,0
target btcs h chart currently btc price holds broken resistance trend positioned in line with technical upswing reach target maybe still early stage of bitcoin,1
long term outlook bitcoin prediction best thing start reminder monthly channel understand bullish log chart best tool see real value trend without clouded judgment,1
crypto opinion current state of bitcoin from fear greed index neutral price usd analysis team did extended research regarding btc also want to hear opinion,0
jackmallers time alive future generation writing moment nd rd country adapting bitcoin legal tender domino fell strike played a big role jack you are amazing,1
whatbitcoindid w davidzell excellent minute bitcoin core thesis summary lots of ways the internet has changed the world it has changed information interaction bitcoin has changed the way humanity communicates value,1
pantera one first fund enter crypto investing bitcoin founder danpantera remains bullish defi belief we&#39;ve seen the start of institutional adoption listen to the latest camirusso podcast,1
bitcoin ecash continuation bitcoin cash project set to develop bitcoin abc ecash ecash protocol arrival reinvested ecash fund awarded annual global network council gnc,0
el salvador recognized bitcoin country imho el salvador lab rat country closely watching makes risk factor takes long cryptocurrency accepted legal tender,1
interesting course people who have made money crypto going strong disagree portfolio crypto btc eth fully understand risky af strongly believe long term profitable,1
usd elsalvador bitcoinday got sat sat usd btc usd usd sub pet feb pm cst btc usd usd sub uto sep cdt bitcoin,0
now is a good time start following the news think happen get learn bitcoin could appreciate better opinion align vi hoarding bitcoin slowly low good idea,1
trace a common thread hippie counterculture california today silicon valley ethos remains undeniable lsd inspired great music art crypto dat u monkey jpegs,-1
usd elsalvador bitcoinday got sat sat usd btc usd usd sub ned apr pm cdt btc usd usd sub uto sep cdt bitcoin,0
pair btc scenario watching find support around k move to next level around k close hard k turn resistance test mid range bitcoin crypto,0
hold the bag exit strategy good thing new proposal needed change implementation burn new code already written needed community approval far voted yes,1
usd elsalvador bitcoinday got sat sat usd btc usd usd sat sat svibanj pm cdt btc usd usd sub uto sep cdt bitcoin,0
problem many thousands crypto do nothing thing many copy pasted small difference limitation use case one market diluted means many chains fade ambiguity,-1
recycle earn crypto green world recycle today better tomorrow don&#39;t miss the chance win crb join the recycling contest use the link register convertcarbon crb bitcoin,0
chrisllucas lexrlxrqamjcz cel kit moving btc eth coordinated way ftx pull rug kit chat leaked could happen independence day next week people distracted,0
sell you are sold forever chance recover loss can lead to sell occur actual loss long hold position i haven&#39;t technically lost a cent crazy sell loss,0
nautiluscap curious could compile study historical forward return btc momentum thrust ie consecutive positive day thanks in advance love work as usual btc,0
trojan timevalueofbtc sorry bro no point talking buyer discovered difference asset announcement fiat real estate online platform world everything price bitcoin future,1
exchange rate margin trading exchange owner otherwise dump market different coin time short in usually make huge money soon all green until next short dip,1
tommycatbsc award great keep up the success thanks shared nice opportunity forever grateful get award dimple vexo luckel kukizp lon bnb btc solana,1
two bitcoin funds launched singapore mass regulated fund manager new bitcoin fund aim to provide simple secure exposure to bitcoin professional investor bitcoin btc btc cryptocurrency,1
petermccormack misery elastic money supply brings benefactors damn central banking core tenant marxism man fallible reliable level power bitcoin fix money fix world,1
bitcoin hope separate money state need separation together better benefit bitcoin stablecoin staking bring wealth prosperity end scarcity jobs in the world AI robot pundixlabs,1
beincrypto no doubt bitcoin eth first two follow sol matic could also invest torn torn pptorn vault would give autocompounded return high apy,1
constitution can end despotism when people become corrupt necessity despotic government incompetent b franklin bitcoin one chance desperate money state you read resistance don&#39;t screw up,1
bitcoin ethereum trading little new all time high funding rate future premium positive area almost overheated may crash btc eth ethbtc sol dot atom ltc,0
bitcoin bug kind of compulsive urge come up with a new statement like every month first gon na revolutionize crossborder payment super going unite gop dems lost sir,-1
earningsharks general market sentiment good market crypto also going through tough times eth btc crash cvp leading cypto sphere term raw technology they started marketing,-1
mikealfred celsius filing chapter bankruptcy hope regulator seize opportunity bash bitcoin instead of swift legislation prevent bad actor like mashinsky use user fund gambling,0
mutenro team professional guide trade check publication follow don&#39;t miss anything crypto analysis best way show result better understanding crypto space btc trading,1
proud to announce bitcoin matrix podcast sponsored by hodlwithledn building world class financial products using btc lets deliver harder hitting deeper even cool content further up lfg,1
bitcoin note red box show price gone four months reverse symmetry can you come back within the next four months much feel free to remind,0
rckstardev bitblockboom investment time horizon year better asymmetric investment risk bitcoin hold bitcoin financial free life following ethbtc tweet prediction added hold thanks mentor,1
green energy already widely used bitcoin mining according to recent report bitcoin miner already uses total electricity sustainable renewable source use council member even better,1
btc go k refutes previous cycle top next cycle bottom good don&#39;t see don&#39;t score never up macro environment btc era interesting see play,-1
finished monetization croeuro investing cryptocom year still regret selling fund since i made profit fund average price i wont buy cro enjoy the coming btc rally,1
wanted ath today many who honestly slow steady growth best thing bitcoin i&#39;m starting to think i can&#39;t stop crash forward up slow steady win the race,1
iyiprofil will fly soon should look for an alternative hard fork like bitcoinlatinum aim to bring better greener cheaper btc true believe fork keep improving satoshi work,1
shibreports that&#39;s great news watch add another zero let me know bitcoin hit bull run watch shib boom till let him trade forex make money,1
may mean long term price action btc eth even though the eth product is traded with much lower volume it is clear that the big player is pushing serious volume bito,0
and even a newer investor says he has experienced a cryptocurrency crash kill you get stronger last find your way back stay relax enjoy life buy philosophy,1
juanfraescudero best decision make today invest bitcoin gttrade deposit min bitcoin wallet sign up start earning every week send dm google gttrade learn start,0
hey joined a network called surveyj earn today get paid testing new free apps post on social media login link instant signup bonus surveyj cashapp bitcoin,1
don&#39;t miss the week money talk tune friday pst interview cardano founder iohkcharles weekly update bitcoin market latest abra opportunity ask billbarhydt anything abra crypto,0
cobie choosing the right investment strategy reducing risk make money btc profit year regardless of market conditions buy dip understanding trade signal implementation delivered by georgeleonel,1
probably asking me a lot worried tether talk a long time btc price artificially supported usdt looks like usdt collapse could really hurt public perception of btc,-1
davidgokhshtein choosing the right investment strategy reducing risk make money btc profit years regardless of market conditions buy dip understanding trade signal implementation delivered by georgeleonel,1
speaker no thecakechat ben founder CEO cake also ux design elliptical chat based on decentralized support crypto ecosystem speaker looking forward to hearing crypto blockchain bitcoin,0
bitcoin used interesting technology prototype digital currency failed unstable slow useful bag holders rebranded digital gold try throwing bag investment bitcoin functionally identical ponzi scheme,-1
count another big drop brought by day trader whale people continue to learn recovery could last near k people become confident bear unless the idea of a bear market,0
bitcoin witness a massive short squeeze btc massive rise within an hour next month after taking cryptochartsm tweet any advice seriously super crypto follow,1
ethereum better bitcoin better money continues to scale meet demand better financial support services needed money defi better storage value lower inflation long term security,-1
inflation one thing everyone sees thing hard founding try to hide tip eat potatoes cheap diet right now one top post reddit real lifeprotip bitcoin ngmi,1
altcryptogems investments time horizon year better asymmetric risk investment bitcoinones hold bitcoin financial free life following btcy tweet prediction added huge hold thanks mentor,1
remember the youtube twitter account that says the bottom could be seen in the market already the price situation a day ago remember better feed confirmation bias audience upside downside trust btc,0
bitcoin attacking h ema rejected ema since hit close could finally mean look break htf channel follow cryptoella know stuff come btc cryptocurrency,0
basically leave crypto alone freshman year powerful man the world happened probably saw medium attention elon getting comments i couldn&#39;t get attention i highly doubt the idea crypto,0
eh culture money secrecy u hurt worker people want to share salary number bitcoin savings whatever clap except know he full brag everything else credibility,0
fee fucked buy btc price go sky luck one right sell problem profit total right bc fuck say pravljenje profita fee made daj ime,0
bitcoin price moved back daily moving average short term signal continue to stay positive btc expert side fence say bitcoin test k say bitcoin month,1
every new ath reshapes the bitcoin price narrative really read market price news every day distort understanding long term path opportunity daily news panic fomo stay away,0
still hearing use case would cause i want bitcoin even living argentina trying to hedge inflation still would buy usd want something drop matter month,-1
said bitcoin investment you answer subreddit needs work basic reddit skill last checked replied comment take face value look worse using sarcasm,-1
an intelligent man actually still listens to the guy what emotional wrong weak interpretation wrong better admit shit correct yourself next time rather continue to lead emotions suck bitcoin,-1
bitcoin attacking h ema rejected ema since hit close could finally mean look break htf channel follow cryptochartsm know stuff come btc cryptocurrency,0
btc hodl economy since hodl economy worked gold in use jewelry ornament irreplaceable industry really timeless unique asset thousands of different blockchains biggest hashrate change,-1
