text,sen
Demand haha Bitcoin actual value,-1
There are too many shitcoins,-1
CEO Is the King of Bitcoin Creating a Fake Promise Problem,1
Cryptocurrency looks really bad due to drug dealers dark web users money laundering,-1
Goodbye shitty Ethereum,-1
Hustle investing look way portrayal social media pumping craze travel salesman second hand peddling snake oil old fashioned gambling hope finding mug willing to pay you are one left carrying bag white paper notwithstanding intrinsic value world doesn&#39;t tell tin people purely persuasive fool pay People Arguing Coin Currency Decentralized Money Still Nothing Constantly Comparing Value Cryptocurrency Currency Primary Purpose Outside of True Stablecoins Minimally Used Cheap Way to Transfer Money Without Risk Value Changed Within Second Volatility No Crypto At least I am honest The reason for saying this is that the only purpose is to make people want money at the end of their pockets. Especially investing in meme coins is not bullshit. Like Dojiship,-1
"When future payment systems talk to their backend, they will use blockchain. Cryptocurrency decentralized finance effectively reduces middlemen. Banks start earning profitable assets.",1
Buy Hold Bitcoin Sell Load Cryptocurrency Never sold Bitcoin Expect to get rich instantly Tolerate paper losses,1
Maximum Fraud Career Vol. No one buys B stfu,-1
two words free fall,-1
Bitcoin Gold Still Don&#39;t Understand It Has Gained Much Value,-1
Good Post Make Money Easy Cryptocurrency Patience Long Time Horizon Investment Sound Project Deep Plan Return Year Share Patient Value Investor Stop Try Select Winning Numbers Lottery Basic Investing Principles Stop ClickRead View Coins That Say Anything x Time Stick Strong Fundamentals Easy x Investment Year Maybe You will look sexy and make amazing profits,1
Honestly attractive thing cryptocurrency literally paid learning shit 6 degrees diploma certification couple really different field love learning clearly studied everything. Pursuing career opportunities I also like a comfortable life Paid learning Investing time Delayed payments Cryptocurrency Actively paying Learning Macroeconomics Finance Infrastructure Coding Politics Sociology Games Art Marketing,1
Cryptocurrency Immature Market High Volatility Traditional Investments Holding Growth Day Trading People May Even Remain Day Trading Cryptocurrency Meaningful Average Returns Average Cryptocurrency Not Fitting Accepted Investment Strategies,-1
Additional Milbaek Janggi Stay Strong Bada Bing Bada Boom,1
The Fair Guy Sub Made guide literally created a shitcoin called buttcoin.,-1
"Almost a bad monkey expects it to fail, but has no idea if it will be a pump dump.",-1
Safety may take a week. Recovery may take months Hell of a decline Generally people say that cryptocurrencies are definitely safe Recommended lack Volatility Consistent returns Limited losses.,-1
It might be hated. Ethereum&#39;s best smart contract platform. Moderate amount of dapp smart contract competition.,1
"The Hype Over NFT Collectibles Is A Bad Thing Someone Will Throw One Hundred Million JPEG Monkeys At It. It looks exactly like 5,000 JPEG monkeys, except with different colored teeth, which are currently beyond the NFT market. Giant Bubble Ready Burst Punishment NFTs are actually created. Artistically randomly generated modified images that are actually unique and artistic",-1
Bitcoin like a natural DMT floating brain Everyone can access it without cost Understand reading the process Understand definitions without intermediaries Slow flow cannot be stopped,1
"For cryptocurrencies to become shockingly unstable in value, they would need to be converted to cash. Real liquidity is also talked about using cryptocurrency format exchange developing countries. The year is still adopting an upward cryptocurrency approach. Send lots of money.",-1
The decentralized internet looks like a cool smart contract voting title deed digital blockchain.,1
"Just as decentralized cryptocurrency is good,",1
"Three Scams Scam Coins Kwon Terra Team Default Coin View First, it failed. Stablecoin people lost everything. Luna v ust Luna v scammer will destroy the damn cryptocurrency All in one case I hope this becomes an example where scammer Terra is held accountable.",-1
"Developing countries lack traditional banking and internet connectivity, making it impossible for many businesses to be conducted efficiently.",1
Well cryptocurrency shitcoin scam coin,-1
"I&#39;m going to smoke, but I&#39;m going to buy Bitcoin",1
I looked for cryptocurrency far and wide. Use Case Consider transferring money. It costs a lot of money.,-1
Think of Bitcoin continuing to rise at an infinite rate. One day it keeps crashing.,-1
Send $1000 Using XRP No Second Fee,1
Love Tech Damn It&#39;s Cool Mixed Current Upcoming Technology Will Continue To Run Wild,1
"I would also like to remove the biggest criticism of Ethereum moving pow po, several studies estimate a reduction in energy costs, and we are working hard to improve transaction rates. I want challenges like visa mastercard process order size transaction p.",1
Buy orders accumulate throughout the Bear Market game.,1
"Celsius temperatures destroy ust pegs, causing retailers to lose huge amounts of money. Anything and everything recovers money.",-1
ll useless ghost chain dead first year care ada besides ada tards,-1
ive bought a year and keep having the problem. A volatile year alone is enough proof that cryptocurrencies aren&#39;t going anywhere.,1
I found out that Bitcoin starts today,1
"I&#39;m going on sale, I&#39;m going to sell bitcoin to get fat, I&#39;m going to call people whale.",1
"Environmental Impact Bitcoin Alone Environmental Impact Joint Emissions Small National Currency Primarily Used Stored Value Transactions Incredibly Problematic Innovative Home Computing Efficiency Proof of Work Progress Obfuscation Long-Term Value Cryptography Complexity Smart Non-Technical Friends Literally k Don&#39;t Trust Titan Crypto Fund Costly Error Buying Coin Advice He still continues to confidently trade coins at his early working technology company. The problem continues. Widespread Adoption Fraudulent Coin Thread Love Shit Elizabeth Warren Is Trying to Regulate the Crypto Space I think where like-minded people will often get the details wrong. But we want widespread adoption. No need for a news article. People are pulling the rug out from under the rug, getting hacked, etc. Regulations, especially the basics around verification projects, are very valuable, giving consumers confidence and preventing them from buying. It prevents people from pulling the rug out. Cryptocurrency detractors littleedge case Consumer utility Self-explanatory Real broad consumer market applications Still rolling dice casinos.",-1
Currency Useful Exchanged Good Good Service Trade Buy Local Country Currency Cool Mostly Correct Volatile Reliable Medium Exchange,-1
Best cryptocurrency to make money in a week giving interest bank combined bank last year literally robbing people of money running one successful scam world.,1
I found almost none of the coins useless service purpose issues. Creation such as governance tokens does not require a cryptographic process. Lend cryptocurrency. Others borrow cryptocurrencies to buy cryptocurrencies. An almost completely self-referencing closed-loop system has been realized. Ambition&#39;s Dream A cold-blooded merchant helped.,-1
Buy monkey photos with the brand new Poopcoin,-1
"Diversification seems to have gained ample traction recently. Young people believe in buying ETFs. Politicians traditional finance people mention, etc. It&#39;s cool too, but it rises despite the payments, but a small portion of the portfolio is ready.",1
"Like traditional gold, it lacks intrinsic value to produce anything that generates cash flow. Almost no one seems to fully understand the basic workings of blockchain technology. It could prove an incredibly valuable point. It&#39;s hard to see a single type of digital coin being considered valuable without some overtly illegal utility.",-1
Kwon Cash collapses by 1 billion Biggest fraudster of all time,-1
Shit Cryptocurrency Isn&#39;t Safe Volatility Rugpulls Honeypot Scam There&#39;s One Thing Isn&#39;t Safe So Higher Returns Make The Market Survive,-1
"Bitcoin youth, give me time, give me a chance, I&#39;m sorry",1
"Put money in 10 years ago Real estate instead of Bitcoin Remains high Forseeable future Real estate Significant holding costs (e.g. taxes Maintenance insurance) Occasionally fees Interest Real estate is not liquid. Very high transaction costs ultimately come into play. Real Estate Rent Limited Income Example In the long run, people will not be able to pay their mortgage rent. You can buy a percent net income place that you can realistically afford, so real estate prices limit income. Over the long term, your income tends to barely keep up with inflation. Long Term Historical Data Case Healer Popular Real Estate Market Looks at the Facts. Real estate prices barely track inflation. In particular, the significant holding costs have been adequately accounted for. Bitcoin Limit Bitcoin Holding Cost Bitcoin Liquid Bitcoin Trading Usually the price of a small Bitcoin doubles every year. Long term average mentioned Reasonably expected continued rapid rise Real estate Current bubble evidence Price to income ratio Current bubble pop Previous bubble eventually pop Real estate nailed Bitcoin can be taken anywhere World real estate Sitting duck Higher taxes Real estate seized Private keys Properly stored Bitcoin Confiscated Knowing that someone you know will buy real estate instead of a total idiot said Bitcoin investment plan will eventually use a small percentage of Bitcoin. hold buy dream house pay bitcoin still end sit serious stack sit zero regret bitcoin investment real estate never",1
"Buying fully speculative assets Selling bit money created in the past Immature legislation Oblivion Also a significant use case, but also used in money laundering transactions Currency deflation Intrinsically well-established Price volatility disruption Also has a story Store value is weak Prices fluctuate significantly Unlike traditional assets Considering international payments End Reference No need for cryptocurrency I think everyone is holding the maximum profit dump bag. value coins backed by others underlying assets supply demand demand collapse price well publicized manipulation insider trading heavily regulated mature stock market cryptocurrency wild west rights diversified tracker find tracking thousand companies something exists cryptocurrency investing in highly volatile stocks It provides the same conceptual stability as Happy Guess Play Money Lack of Regulation Putting Primary Investment Selection",-1
ETH development is ultimately important. Blockchain-enabled people The right finished product cryptocurrency actually justifies its market capitalization performance points. People still say that early speculative value placement cryptocurrencies could upset the ETH roadmap. This is your best opportunity to be scalable and developer-friendly.,1
"But see useful use cases: Cryptocurrency is not easy to do. People will not maintain decentralization. We already have a centralized government, which will never allow a happy playground for cryptocurrencies. It&#39;s already dead and basically useless.",-1
The sad truth about cryptocurrencies is that half the luck is in safe investments.,-1
I&#39;m still investing in Quartist Coin.,-1
"Things have changed in the last 10 years. Fortunately, Bitcoin provides an alternative system to recover power costs.",1
Many things destroy the planet faster. Bitcoin mining is not a cryptocurrency. Let&#39;s all rake in some energy,1
dot real transaction bank level security stability kusama basically copy dot development testing new updates real world real economic environment implementation dot guarantee dot does not always run smoothly security breach project dot is also a sister network kusama basically new features get features first or cheaper Use regular kusama rotating art gaming hub it&#39;s really cool. moonrivermoonbeam karuraacala heikoparallel khalaphala etc kusamadot sister network team building kusama version function dot version,1
Intrinsic Value Cryptocurrency That&#39;s Hyperbole Objective Fact Cryptocurrency Speculation Real Fiat Big Disaster Scenario Social Collapse Will Almost Immediately Become Equally Worthless Even the Internet Will Still Run Anyway Cryptocurrency Soon Scarcity Instability Scale Physical Good Material Possible Gold I&#39;m sure you&#39;ll be able to use it for those interested in the exchange as well to end up starving death piles of shiny metal.,-1
Lots of scams Unliked intrinsic value Used by financial institutions Reliant on criminals Seemingly random value Most likely based on manipulating market environment influences,-1
Currency US currency is not yet available. Major Online Stores Bitcoin Especially Places Like Venezuela Venezuela Actually Good Examples The good world exists. feed family farming run escape rather hunger,1
I lost money every time I purchased cryptocurrency. will never sell,-1
Better returns investing stocks volatility but borderless trading much better apy staking cryptocurrency leaving money aside bank protection inflation local currency local currency loses value per 2 weeks points.,1
"Debanking Access Bank-Like Services People Access Banks Nowadays Cheap Transfers Sending Money Like Money Family Overseas Smart Contracts Need to Secure Ownership Information Expensive Notaries See Cryptocurrency New Industrial Revolution New Internet Next Step Live Believe in 15 Years Society Without Blockchain Look around everywhere Look at a society without smartphones Remember, there&#39;s no going back, kid, understand.",1
There is a high probability that dumping will become more severe. Don&#39;t burn. The distribution supply did not change the coin lol.,-1
"people used salt clams cigarettes etc money money currency good tools used money used store value exchange good unit account good tools make money used money prison cigarettes make money good used money other good tools worse money depending on quality requirements type of Physical Requirements Job Le Work Store Value Average Unit of Exchange Account Fungible Transportable Durable Easy Verification etc Bitcoin Asset Design Excel Stored Value Volatility Bitcoin Includes Volatility Human Volatility Issues Due to Volatility Increase in Value Remaining for Long Value Time Time b Volatility Issues You may need it far Years of ownership The better it gets, the higher its value People will continue to refer to it If you increase the store value, it is likely to be worth a lot more. I think I will continue to work. I&#39;m betting on Bitcoin Gold. Today you will do something bad. We will exchange everyday objects. Perhaps people can verify digital digital excellence saving time.",1
Cryptocurrency giving you the world of avenue passenger finance,1
Cryptocurrency long-term investment deep newbie panic sell good things opportunity buy sell low sell high future game patience hold profit,1
Many people get burned. Learn to trust.,-1
"According to a recent report, green energy is already making widespread use of mining Bitcoin. Bitcoin miners are already using full power. Member council use of sustainable renewable energy sources is much better.",1
Bitcoin Lots of Right Doomsday Currency Inflation Hedge Speculative Asset Central Bank Hedge Technology Play Plus Hundred Components Price Value People Buy Sell Sell Hold See Other Reasons Inflation Hedge Inflation Also Hedge Central Bank Monetary Policy Central Bank Probably the Worst Branch BTC time consuming BTC wears many hats. Please let anyone tell me something else,1
Cryptocurrencies are fundamentally deflationary Making terrible currencies with limited supply Currency Purpose Stimulates investment Trade Deflation Currency always rises in value Limited supply gives people an incentive to trade inflationary currencies instead People actively lose good investments losing value,-1
Plan to invest a small amount each month,1
I really have deep doubts. Fans are greedy hopeful people. Mr. Kwon is greedy people. I think they also know the cryptocurrency space. Things like trust mean you can&#39;t make money anymore.,-1
"Yes, the government bans one important thing. A full backbone cryptocurrency liquid stablecoin called Tether has already been banned. ny sec looks for coins that support $1. I don&#39;t believe in anything. Federally Closed Exchange Becomes One Giant Ponzi Scheme",-1
"apecoin will have worse versions. This means that the pump is still sufficient, so we need to dump the reasoning logic.",-1
cryptocurrency version paxg serf buy real gold instead of real purpose,-1
Cryptocurrency future general simple purchase will be destroyed,1
I think buying Bitcoin cryptocurrency is a side hustle that is better off without feeling like an investment.,1
Dad Bitcoin is the real king,1
Harmony One Algorand Cardano Solana Bechain Will Fly During the Next Bull Market Otherwise buy Stack Satosis,1
Shit coins cannot survive even in a bull market.,-1
"The backed Luna project failed idk people are buying the volume, bullshit stupid shame, the volume idiot is happening twice",-1
Monero is probably the best coin ATM. change your mind,1
fall crash people lively hood,-1
"I may be a year out, but you can probably guess anything about where BTC is starting now and much into the future. Still, everything else is a gamble.",1
"De facto Gold Stable Year After testing, I chose an exchange mechanism that I was really happy with. Gold Verification Token Burning Process",1
Skeptical solana low public allocation launch solan team vc support leave retail investor responsibility abandonment says you never know what will happen,-1
"Then buy it cheap, buy it expensive, sell it and use it for something haha.",1
Forget Buying Process,1
"eth eth Proven, real-world operating environments are so secure you can&#39;t stress them out.",1
Many examples of Kwon&#39;s arrogance and the downfall of Terra are as stupid as his tweets.,-1
You can win pretty easily. You have to wait until the next BTC. It&#39;s literally guaranteed to be x current price.,1
Worse environment encryption seems like a statement using default mismatched encryption.,1
Not understanding Bitcoin Bitcoin Assets Bitcoin Payment Network The payment network alone operates efficiently. Fee companies like Western Union also have transparent and fast buffers. It costs a lot of money. I&#39;m developing Swift. It&#39;s almost cost-based. Bitcoin Payment Network Bitcoin is the equivalent of fiat currency.,1
"If the price of eth is high, you don&#39;t deserve the greatest alternative",-1
Bitcoin Stability Stocks have chosen stability.,1
Still refer to as a fully speculative instrument. Asset Call Asset Fundamental Value Technique can be adopted rather quickly at the break. Federal Reserve System Blockchain ensures that unregulated markets are likely to face regulation. Moving forward nationally and internationally.,-1
"Yes, blockchain has definitely improved in technology. Kudos to the developers. There are a lot of great, exciting people working there. At least It means things are flourishing quite a bit. Don&#39;t expect Ethereum to suddenly go null anytime soon.",1
"I spent a month, I was annoyed and the price was high so I ran again.",1
"If there isn&#39;t enough tether alignment public secret funds and there is a crash, everything will end up going down big time.",-1
A literally capsized boat relied on poor tokens. News Play Tweet,-1
"Three Scams Scam Coins Kwon Terra Team Default Coin View First, it failed. Stablecoin people lost everything. Luna v ust Luna v scammer will destroy the damn cryptocurrency All in one case I hope this becomes an example where scammer Terra is held accountable.",-1
Meaningless cryptocurrency exposure,-1
eth great matic way,1
I think the real currency is kind of crappy.,-1
Investigate the Bitcoin stock flow model. The new question is m wouldn&#39;t you want to invest in BTC? m id will tell about the actual question purchasing power m usd year.,1
"Bitcoin Great Hedge Inflation Increased Demand Fiat Money Continues to Print Still Few BTC Puts Existence Year Buying Trends BTC K Holding 10 Years BTC Lots of Scarce K Worth Lots of Stock Market Assets Hedge Inflation Commonly Calculated Sell Inflation Occurs Fallout Cryptocurrency Very Well Formed last 2 years execution lag cpi ethereum hedge inflation people spend million dollars. blockspace day mint m new coin sale day people want blockspace next year mint m new coin day forever i bet people blockspace future l compression protocol deployment s blockspace finite demand strong good bet pay away here Great site comparison pow po ethereum The argument for making hash rates cheaper is to generally keep existing mines open longer and allow them to be recycled. Otherwise, the wasted energy BTC average may go bankrupt. Although BTC is sent somewhere and generates as much power as oil used each year, the amount of new BTC mined per block is halved. There are many miners who rely on hashrate security difficulties to mine. One block reward average cost k mining btc is worth k today. The next halving cost k receiving k btc will force mining to stop. Find cheaper alternative price btc double safe notwithstanding btc maxi. I don&#39;t think doubling forever is possible. Ideally, to solve the problem, the cryptocurrency fees on which people buy block space would be steep enough. Today pre-inflation rate average ton pow done today earn commissions miners already pivot clean energy choice unthinkable years easier use coal otherwise energy debate global choose one cryptocurrency dishonest people completely ignorant cryptocurrency they use BTC legal currency multiple countries cryptocurrency World place bank not face real inflation argentina cheaper and faster traditional rail stripe reasons volatility average purchase price using the right price to card shop online visa. The house hasn&#39;t been forced back, and it may be a two-bedroom house. That might be okay. There is no mention of the actual issue cryptocurrency.",1
ethereum robinhood character reverse thief poor offer rich gas fees pure extortion problem time alt coin close ethereum,-1
Loss Another loss is always worse,-1
Also accept btc btc government,1
Bitcoin going to the dollar Purchasing power going to the dollar BTC still expected to be introduced in large quantities BTC future,1
Let&#39;s call the scammer Rugful Ponzi Scheme.,-1
BTC Old Fashioned,-1
Don&#39;t hit the moon it&#39;s really not that easy to post shit,-1
"Yes, there is still the mega strong dot canary chain Kusama.",1
bad acab encryption,-1
Negative Bitcoin Holding Frequently Trading Nasdaq Simply Trader Trading Time Divergence Exceeding Bearish Nasdaq Year Hedging Magical Hedge Powerful Unhacked Financial Network Limited Supply btc Dominance Cryptocurrency Rising Runaway Inflation Weakened Naturally Btc Hedge Degree Historically High Volatility But Relies on Short-Term Hedging can&#39;t do it,1
"You want a cryptocurrency that is practically unavoidable. If you&#39;re going to use the world&#39;s exchange currencies, Bitcoin will have a pretty big reversal point. I assume it&#39;s possible.",1
Bitcoin literally produces secure order times. The world&#39;s fastest supercomputer,1
"It&#39;s easiest to go to Luna. Fully developed ecosystem box. Soon, the furder will start whining and the boat will disappear. Haha.",1
I like the link. It&#39;s cheap. Chainlink locations are increasing these days.,1
Love keeps filling the bag. discount box price,1
don&#39;t bring luna excuse kiss sky don&#39;t bring anything luna don&#39;t bring substance fact don&#39;t bring it perfect example best coin annihilation hold me substance idiot hodl btceth,-1
"On my last visit the rterraluna had completely overwhelmed the detached moonboys, but the people of the page were considering suicide.",-1
congratulations. I have achieved a level of understanding of Bitcoin. There are many levels that no one knows about. I am at the level. Bitcoin is a beautiful invention.,1
I&#39;m sure it&#39;s a jumping hype train created by cash bastard hardon btc cryptocurrency scam.,-1
"Believe in luck, novelty, polka dot pattern, opportunity to see the road, never seen before, chain balance case, low interest rate borrowing story, low collateral",1
Yeah it seems to go a lot faster,-1
"Developer yes good big part first mover advantage Ethereum largest active community developer factor will estimate huge advantage. The technology platform has great documentation tools, easy to create API resources, build learning, obscure questions, build features, maybe help guides, Stack Overflow, YouTube tutorials, answers, and a large developer community gets a lot out of it too. Easier startup business to hire Engineers already experienced new technologies Google answers Probably expected Want to hear Analytics tps scalability Ethereum selection Logical solution scalability Lightweight layer Po system Sharding Excellent layer options Targets focused on high transaction throughput Longer Projects can use a much more stable and robust decentralized smart contract platform",1
a trickster,-1
That&#39;s right ada Far leader came and strongly believe coin,1
Cryptocurrency profit dependence Bigger fool buying course Someone portfolio Bitcoin Going reality Cryptocurrency has really exploded Speculation Love Low interest rate Easy money The world is alive from the beginning Bitcoin monetary policy Strengthening speculation Shit bed occurs,-1
"If you wake up, don&#39;t give money to money manipulators.",-1
correct xrp pure speculation zero shipping,-1
Something that seems stable stablecoin name go for it yeah it&#39;s really a fixed dollar not a lot of people care anymore,-1
