text,sen
One Walk Bitcoin Binance Smart Chain nft,0
taillarb tresolas deitaone gold move forward back btc,1
documentingbtc recently announced chinese mining ban creates new advantages crypto miners btc everyone is panicking thats a buying opportunity bitcoin went to btc btc trading signals frm robin moore whatsapp.,1
"Endless Opportunities Hello, I joined a network called Survey.j and I won it today. Get paid to test new free apps that you post on social media. Login Link Instant Signup Bonus Surveyj Cashapp Bitcoin",1
Opinion that Bitcoin should be far ahead of gold,1
BTC I thought it was Bitcoin. See navidmemaris ideas Tradingview.,0
run regression bitcoin v basket tech stocks next mind offer palantir tesla nio alphabet feel free to add or suggest basket,0
Another opportunity to buy BTC cryptocurrency shib,1
"BTC Busy Day Today I own a fully deployed branch near BTC, which was a decent finish on an overall slow day for the location. It could be much worse.",1
ee Thought ee Feeling Bullish Bitcoin,1
short won entry price stop loss link bio tz BTC bitcoin won,0
BTC price bitcoin cryptocurrency Q,0
XRP kicks BTC crypto,0
"Same idea, buy a log cabin, your family will also become homeless, cats need a place to stay.",1
People want to think and talk about Bitcoin hodl Bear.,0
lunar chart btc november lunar eclipse full moon degree taurus scorpio conjunction fixed star algol violent lunar eclipse full moon occurrence fixed star moon deal called algol,0
El Salvador Recognized Bitcoin Country Imho El Salvador Lab Rat Country Watch Risk Factors Take Long Time To Do Closely Cryptocurrency Approved Legal Tender,1
Year Alexa Alexa Bitcoin BTC,0
defiantnews camirusso ftxofficial question bitcoin negatively affected,0
Worst price prediction bitcoin using stock flow analysis bitcoin could reach in december according to planb crypto bitcoin.,0
BTC Liquidated Long K,0
Let experts trade youbitcoin cryptocurrency market,0
solana activatebuild Metagwaratoken aim moon set release native token mgt list project in progress bitgert chain ready soon guy move moon btc bitgert mgt,1
BTC BTC ETH ETH bnb bnb,0
Bitcoin daily closing SR expected to expand today,0
Apparently it&#39;s still within the scope of science fiction.,0
People who sell Bitcoin are trying to get their payday quickly by selling.,1
Those who play the soon-to-be hot potato asset Bitcoin have endless delicious potatoes,1
Shotbymatta Bitcoin Flux Cadena Bitcoin Price Prediction Cryptocurrency Winter v Global Adoption,0
hswapdex great project putratzy firdaus broar ht airdrop btc hecochain,1
The moment btc rejects h sma bit h chart could expand significantly average explosive move move fact sp good recovery day fundamental new cryptocurrency strength,0
all bitcoin july inner workings federal disclosure daily failure mairead mcguiness money laundering meme review rawavocado sponsor cryptocloaks host bitvolt coinicarus,0
I know it took a long time to proofread. I can&#39;t see you coming back for a long time.,0
"Yes, it&#39;s okay, thank you, friend",1
Swedish prisoner gets one million bitcoins back,1
longest podcast hours minutes gibberish bitcoin crypto btc mattysats crypto curator mashinsky alexandrelores infinitytimesme kryptovski,0
Upcoming Events Bitcoin Price Update,0
bitcoin mempool tx summary last second average median max days quant nob block height,0
Nice to finally see that Bitcoin has been manipulated for several days. Bitcoin is still popping in overvalued stock markets.,1
Bitcoin Technology Score BTC Bitcoin Technology,0
It is no accident that the power of le money widens the wealth gap. Oligarchic Empires Using Bitcoin Are Actually Easy to Understand,1
We are seeing BTC update soon.,0
"Yes, I&#39;m signing an executive order.",0
lenfantbon opinion call inflation consequences rapid expansion u money supply objects rapid decline market price bitcoin u dollar sign,1
"Many people tend to achieve their life goals by selling their holdings, earning a sufficiently high salary and retiring with a mortgage.",0
Buy Bitcoin Bullets,1
Bitcoin Block Byte Transaction BTC Reward Information Visit,0
RSI Progress btcusdt Min Period BTC Bitcoin Click Chart,0
Bitcoin HR chart interpretation,0
satsdart bitcoin btc btc adx weekly fake bullish trend indicator,0
I am tech savvy and use my computer to watch school stream games. Also I am sure your money will be safer with your habit of using vpntor.,1
I thought about BTC Bitcoin. See Danilblinkov&#39;s idea:tradingview,0
"Deep understanding of Bitcoin and realization of a complete global solution Wealth preservation projects, including Ethereum, still experimental",1
"michael saylors microstrategy purchased additional m bitcoin. Companies have been purchasing Bitcoin, bringing their total coin holdings and taking Bitcoin to another level.",1
Practical Oil Finite Gold Finite Silver Finite Real Estate Finite Bitcoin Finest Best Store Value,1
Bitcoin Block Byte Transaction BTC Reward Information Visit,0
Eudora Funk Byron Harvey Bart Jim BTC,0
Rising Triangle Break Break Good Volume Hold Expected BTC K Range Next Day Hold Eye Support Resistance Case Fakeout Bitcoin,0
knrubar johalmiles fed error plan Always pretend you know bitcoin Pretend you know nothing,1
"Think about the many changes in Bitcoin. Read Cryptocurrency, the Pioneer of Life.",1
huobi primelist new listing flz seize sales opportunity lead wealth deposit trading launch june click link details sign up crypto btc nfts,0
gegelsmr Imagine getting an all cash loan and receiving monkey bitcoins like WTF,0
"hive hut bitf btbt good buying opportunity btc mining stocks made profits along the way. Running shared sales hallelujah all reloaded. Everyone, worry. Bitcoin is likely. I will return to ktoday week.",1
Nini Bitcoin Bitcoin Goal Conversion Fiat Price is Meaningless,0
The amount of Bitcoin awarded to miners is halved in approximately one day.,0
btc bitcoin massive inverse head shoulder break k rovercrc reference,0
Fees coinbase are ridiculously high do not ask people coinbase account transfer gdax withdrawal free pondering questions free gdax free coinbase,0
"Bitcoin Lightning Node Management Imagine automated growth. Hahaha, the fiat coin is spinning.",1
mcshanewrites Buy Bitcoin Buy Hamstercoin,1
k went right held a massive dip mean boy happy atm,1
Sell loss hodled last bear market continue to buy continue downtrend March buy lot you ss wealth hodl repeat whenever possible ignore accumulation price chatter otherwise guess btc,1
Play BTC ending diagonally Nicely moving into Bitcoin k area Let&#39;s see many confirmation suggestions comments Say Bitcoin,1
"Ah, look at Bitcoin today.",0
"Beautyofhelin not only will the world never despise BTC, but it will also continue to hold Bitcoin.",1
BTC Buying Pressure Warning Price Bitcoin Cryptocurrency BTC Trading,0
avoid rain but killer make money bloodleft trade run sleep stop loss tight fast sniper trade sxp btc eth itallaboutstructure,1
Generally yes it&#39;s basically a secure hot wallet properly Watchtower etc.,0
Michael Saylor bought Bitcoin El Salvador bought Bitcoin Elon Musk bought Bitcoin I don&#39;t want to buy a smart whale I bought a follow The bottom of the market,0
Bitcoin Slave There&#39;s nothing better than receiving the highest praise,1
I feel like BTC will come out quickly,0
altcryptocom take a look saniwith extreme low volume lp tokens important long term vision selection sani holdings future bitcoin sanin selection,0
Entire Bitcoin Node Standby Case Cryptocloaks has had interesting times.,0
buy the dip dont go to btc bnb bsc,1
New Bitcoin Price Zone Detection Drop Down BTC Zone Detection Unlock Telegram Group PM u Trial Period Group End Prediction,0
Bitcoin freedom saved lives,1
"Don&#39;t be afraid, want btfd ltc btc",1
long position taken dydx pump BTC BTC,0
"I think everything that happens in human behavior is great. In a safe moment, slowly and greedily say metisdao sovrynbtc btc eth chart, but reflect a little more slowly.",1
Start discussion on purchasing alternative coins Bitcoin Cryptocurrency,0
Binance Recovers M Funds After Linked Ronin Bridge Exploit BTC cryptonews nft,0
bryce harper rock massive phillies chain ahead phillies braves game mlb bitcoin sportsbook,0
It&#39;s like dropping DCA,1
shanethazel tomerstrolight take back your power start moving towards k consider what&#39;s important k expect soon btcanne very underrated expert great insight tips ta btc follow seriously,1
Inflation is one thing everyone sees as a problem. established try hide tips eating potatoes cheap nutrition current one top post reddit real lifeprotip bitcoin ngmi,1
BTC D-back trendline,0
btc latest block information block holdings transactions total bitcoin block size bytes including block rewards,0
Peer Peer Work Better Ways to Use Bitcoin Lot Fees,1
Baht Bag Bitcoin Cryptocurrency BTC,0
Coal oil and gas company receives tn bank after paris climate talks. Mining Bitcoin&#39;s Big Problem Hmkaaay Sentiment Neutral World&#39;s Largest Bank Briefing,0
Scarcity Internet One-time discovery Repetition resistance Replicability Invention Knut Svanholm,0
BTC Scalp Long Fine Profit Two Wicks Reject Push Up Can Be Swept Down Same Low,0
Bitcoin ecash continues Bitcoin Cash project continues to be developed Bitcoin abc ecash ecash protocol profits reinvested ecash funds allocated annually Global Network Council GNC,0
twitter btc plans work coinbase oversubscription nfts news crypto btc,0
Limit purchase cash app Bitcoin purchase has been carried out.,0
I&#39;m so fucking confused I&#39;m on my way to BTC,0
wojespn adamschefter btc invest in cryptysophia today. Watch your life transform. Start earning money every day. Contact the administrator via telegram cryptysophia,1
apompliano vulkania Supply of one million exhausted Distribution of the remaining million Wallet circulation Also as a joke Big project Upcoming cryptocurrency league starts Million in the month zenkin vlk mdtusdt btc Thoughts,0
squawkcnbc Scaramucci says BTC has achieved K years like 500 million bits.,1
Bitcoin changes certain parts of planet Earth.,1
The question is which cryptocurrency BTC is the current market leader name awareness superior technology PA perhaps the immediate future perhaps the point generally assumes a superior technology win.,1
"According to CoinMarketCap data via Newsweek CryptoInvestSmartBitcoin, the popularity of Shiba Inu dogs suddenly surged in May, pushing the price to an all-time high.",1
Bitcoin cryptocurrency is becoming useful. I will release a video tonight.,1
K wick Clear was not a news-driven dip.,0
"Looking at the chart, I think it will be possible to settle down.",0
"Shhh, Cash App King, I know better haha.",0
I&#39;m going to find Rambo&#39;s legs,0
I&#39;m not broke. Don&#39;t fix Bitcoin.,1
Bitcoin Master Teaches Patience,1
Damn I think TV will get better at the last minute.,0
"I was finally able to invest around a month ago. I have been investing for a long time. k ATM for sure. I&#39;ll go to the deal first. I think I&#39;m going to Coinbase. People told me to use it, gdax opened an open thread. The man said he had never heard of a gdax gatehub being moved. You&#39;ve never heard me ask for advice. it&#39;s okay. CB I really like day trading like BTC, I am constantly changing coins and trying to make profits every day.",0
jeevsthecurious I like BTC finite supply. It can be owned by anyone with a mobile phone internet connection. Controlled governments around the world have been hacked.,1
"Indian payments giant paytm may offer Bitcoin services. Government legalizes cryptocurrency, says CFO via coinjupiter.",1
"Hahaha, time has stopped. Come and join us. You really need to take a break in this messy year. Real-time Bitcoin technology is needed Features Investment Hedge Inflation Join. Know the facts. Most Bitcoin trading buy selling trading investing currency usage could be explosive enough. BTC speculation investment much time development catch demand currency use growth currency takes a long time mass introduction year small moment rush pass take the first step",1
"As the world revolves around the United States, unlikely news affects the rest of the world&#39;s cryptocurrencies.",0
"Anyway, take your Coinbase and go. I&#39;m wondering if anyone else is having trouble connecting.",0
cryptohellspawn think of a smart idea give power to companies national currency innuendo let&#39;s print money what can go wrong bitcoin tether,1
Morning start cryptocurrency BTC,0
guess use bitcoinlightning make money transfer part full business model work trading algorithm mention win win user plus professor lightning scale genius,1
breakout bitcoin new time high index btcusd trader btcusd,1
Whales are already craving it lol BTC Bitcoin,0
Suscanicola Ryanvieira hodlberry Thorchain also spoke about self-repaying loan bitcoin liquidation risks.,1
Countries that pay for new things with Bitcoin,0
"Personal Predictions for the Next Day Bitcoin has seen a lot of volatility today due to CPI data. Nearly $1 million was liquidated. Whenever k shows optimism, it receives strong support. ta btc crypto btc",1
monday august moscow time supply btc real time blockchain price u value coin ub buy btc real time blockchain btc price minus service fee,0
intocryptoverse Exactly Trading Bitcoin High Leverage Overly Excited Move 3 Days Down,0
"Inflation data released on Thursday, a volatile day expected Bitcoin fell to its lowest price level since September 1, but BTC sp quickly recovered while traders tried to stop the bleeding.",0
Enough people understand the banking monetary system and believe that tomorrow morning Henry Ford Bitcoin will revolutionize it.,1
microstrategy puts in another m bitcoin despite price falling. k crashes via decryptmedia. bitcoin microstrategy cryptocurrency,1
Meitu holds 1 million BTC ether and has the latest Bitcoin purchases.,1
Of course haha Nostradamus is still worth 1 billion,1
"Bitcoin will be demoralizing if abandoned. Fortunately, it&#39;s shocking.",1
Calm down everyone it&#39;s done bitcoin it&#39;s reached new heights people act like they never dipped it was treated as a recovered investment tried pump dumping the investment quickly it&#39;s over later it might be stupid hodl,0
Buy Link Blockchaincom Explorer,0
Remember studying in college I was afraid of losing a lot of money buying bitcoin coins Remember understanding investing Regretting the learning experience,0
"Don&#39;t trade time sometimes, sit back, relax like a cartel, and don&#39;t take fiat tomorrow. Enjoy Hodley Day, be careful of long buying and dips.",1
Thank you for your support folk risk whatever don&#39;t really worry stay rooting for the long term,1
What I like most about zbdplay is definitely the great Bitcoin integration. I am waiting for sarutobi. Best one meplevorzbdgg,1
Crypto monthly newsletter announcing mobile app launch next week Bitcoin BTC,0
"Bitcoin Wake up early and watch the long run in the morning Bitcoin price goes up and if you feel good, get ready Bitcoin jersey launch wear Bitcoin orange pride passion btc",1
New York&#39;s next mayor wants Bitcoin Newyork BTC Crypto,1
big name big project big opportunity buy trilly make milly mcontent bitcoin documentary el salvador v world bank drop september safemoon dogearmy peep get to know,1
stockmarketpr People tend to think Bitcoin is high. k Wait until October. k year end price year wait. Bitcoin follow jorgevr tweet post tip prediction added. I have a ton of it.,1
People believe that btc mining always causes damage to the planet. Create a Hydrowhalesclub Mine Using Renewable Energy Holder Wealthy Planet Save Time,1
"It is assumed that three-digit people tend to emphasize position, especially around parts.",0
"Yes, strangely enough, support starts today. Run it. I hope it starts soon.",0
Promoting the realization of the BTC introduction process BTC evangelist within the mirror reflection heaven and earth crust,1
Bitcoin Day h USD Undefined Price Change BTC Bitcoin,0
Someone please explain to me that banks don&#39;t make payments on weekends like people manually fix their bitcoins. Carl B Menger,1
One Small Step Exchange One Giant Leap Cryptocurrency Community Brewing Join a Privileged Community Through USDT Spot Market Bitcoin Market Cafe Swap Financial Failure Innovation Transformation Success,1
Money Printing Looks Like the End of Bitcoin,0
new report bitcoin filing agency digihost technology inc name frb registration statement ex filing reporting form,0
I definitely purchased gbtc roth ira account fidelity.,0
BTC Trading Pairs Crazy,0
I believe the project is a strong and fruitful team effort. We believe that great development makes BTC cryptocurrency the best moment.,1
bitcoin btc amount supply last active year reached monthly highs btc previous month highs btc observed june view metrics,0
bybitofficials wsot start june sun am utc still time register tealstreet join team bitcoin bybit wsot,0
beautyofhelin feels that Bitcoin is not ready for its biggest breakthrough. st century snow is still a record of ball system change cause.,1
abc correction 1st wave Bitcoin BTC,0
Welcome to the whole journey BTC bitstampbtcusd voxhit bitcoin btc,0
blk back blackcoinorg Another interesting development emerged on the last day of another chart update. More volume price spike exit long-term descending channel cryptocurrency positive accumulation course btc,1
Bitcoin Ethereum Trading Slightly New All-Time High Funding Rate Future Premium Positive Zone Almost Overheated BTC eth ethbtc sol dotato ltc could crash,0
mikealfred celsius filing chapter bankruptcy hopes regulators take advantage of opportunity bash bitcoin instead fast track bill prevents bad actors like mashinsky using customer funds gambling,0
Gold Market Cap Bitcoin Market Cap b Progress Bitcoin Surpasses Gold,0
Learn a lot and have fun. Keep learning. Follow Bitcoin.,1
I would say that any number of people can be flexible enough,0
Now leave the big tuna alone.,1
watch out overnight usd jpy gold ustyear yield bitcoin dn risk off front buy emini future pump options maket maker try vix uvxy currency premium,0
Miller said longtime Bitcoin bulls are starting to buy the coin. Investor Bill Miller Cryptocurrency Bitcoin Digital Gold YouTube BTC BTC,1
Exactly what do people think about whale attack people have invested a lot of money in cryptocurrencies to play live life and mind games ocean joe people want to invest money and make money period,0
I already sent the email and it was approved overnight.,0
long skl entry price stop loss link bio tz btc bitcoin skl,0
episode bitcoin magazine podcast host cksnarks sat infamous bitcoin twitter personality troll udiwertheimer discussion hardcore bitcoin faithful worried altcoins,0
Bitcoin Block Byte Transaction BTC Reward Information Visit,0
Target btcs h chart Current btcs price holding broken Resistance trend is placed along with technical uptrend Reaching target may still be in early stages Bitcoin moves,1
profit m volume sky pump mega pump powerful pump binance history dont,1
I think I&#39;ll start sprinting next year,1
Sophisticated password-protected recovery seed method protection storage seems like a weak link.,0
trap sell k go k night think keep money small spare case big crash buy fresh coin course time market sell crash time open champagne long term bitcoin always win,1
bitcoin btc current price gbp enjoy reading blog tips bcqtuzhlzexuueatkrrhajm,0
ar satoshis right satoshi ar right bitcoin,0
GM Welcomes BTC,0
It seems like everyone is talking about it,0
fschaeffler BTC Sieve King,1
Buy BTC Mill Perhu Care,1
Barron Front Page Bitcoin October,0
Bitcoin Week Alternative Rank Price BTC Bitcoin Lunarshare LunarCrush,0
Whale Stacking Monkey FTX Sand Link FTX Bullish Sentiment Hit Cryptocurrency Market Bitcoin,1
Brokers encouraging UK customers to trade with foreign companies Regulator FCA has already taken action. Brokers read cryptocurrency bitcoin forex.,0
Google launches new cryptocurrency search feature ETH wallet address balance etherscan launches bitcoin goog eth sync,0
Coinbase Kraken is ready for the beginner revolution.,0
Secret Bitcoin Be patient and buy on a consistent basis through a weekly monthly plan Short term long term goals Think Bitcoin,1
Network Growth Continues to Surge Fastest Rate in History Short-Term Catalyst Could Solidify Network Effect and Actually Bring Bitcoin to 1 Billion Bitcoin Lightning Network,1
new renaissance bitcoin o via peterschiff michaelsaylor bitcoin youtube,1
oof good bounce straight btc telegram channel jasmine crypto premium btc eth bravo,1
Messari CEO Ryan Selkis Bitcoin Stablecoin Cryptocurrency Regulation Cryptocurrency News Live Media Bitcoin Cryptocurrency Cryptocurrency,0
Bitcoin mempool tx statistics last minute average median max days quant nob block height,0
Check opensea item list via opensea bitcoin,0
Johar Miles confirmed as BTC CEO,0
It&#39;s hard to leave behind an ugly wick.,0
Ralph Glawischnik Crypto Valley Crypto Oasis BTC Crypto News nft,0
I want to give you one listen Laurence Leppard Knock Park Cover All Host Macro Topics Potential Recession Rotation BRICS Currency Europe Energy Crisis Japan Bitcoin All Please let me know what you think,0
Two columns have been added to p notes. A useful blade rolling change has also been added. The daily average in the third volume column is not really explainable. Tweet We believe the new data provides valuable insights going forward. Go to BTC.,1
"For prices, see Bitcoin first",0
airdropdet amazing good project hopefully the project will be successful. I will participate in support. man aagameruga atriantoko gillankperdhana airdrop improvement digital bitcoin,1
realvision raoulgmi maggielake may have asked the wrong question. Correction Bitcoin Average Dow Nasdaq Stock Market,0
Market Impact Haitamalgais Speech g Energy Transition Ministerial Meeting Bali Bitcoin,0
Coinbureau analytics team has performed a detailed analysis of BTC Fear Greed Index Neutral Moment Price USD. Consider the current state of Bitcoin.,0
"Cash is untraceable. Although many countries may allow it, Bitcoin adoption may be slow. Bitcoin adoption may be slow. Exchanges can be prevented in an effective way. Bitcoin may slow down or stop. It will actually be of great help to the government. It can be adopted for the long term.",0
BTC Standby Floor Quote,0
thedustybc I am still long btc recommended short resolution get rich hold cvp accumulation also great altcoin long term investment currently one hidden productive gem space,0
watchguru wclementeiii one decentralized protocol bitcoin,0
nftholding darrenpromoter btc about k levels bearish momentum exhausted higher lower short term possible leg liquidity secured kk likely to follow kimcaden underrated bitcoin tweet tips help,0
Crypto Geeks Know Farm Bitcoin Tarkov,1
BTC BTC K Support,0
hourly bitcoin statistics block hashrate ehs price last h fast fee sat slow fee sat tx unconfirmed diff t diff change block next diff block,0
Bitcoin mempool fee summary second average median max days quant nob interval fevb block height,0
Next year is going to be amazing,1
Stop thinking. You can make money. Seriously forget buying dip selling. Forget about constant pulling. Sometimes times will not trend upward in the long term. Almost everyone will lose Bitcoin as they can still create an upward trend that compensates for the loss of money. It&#39;s almost simply maintaining the point. Seriously week 2 3 4 you will make money. Even extreme bearish yes profits in the near future can be sold at perfectly timed prices. It is not possible to repurchase Deep Trust.,1
worry look bigger k look low 10 years time keep age dca ing k milestone increase a few hundred dollars end date nothing expected,1
Buy Bitcoin Get Rich Breakup State Main Control Mechanism Fiat Control Get Rich Side Impact Positive One Choice Freedom Voluntary Peaceful Money Forced Authorized Money,1
ada update checkout link bio encryption signal doge ocean btc omg xrp dogecoin cardano enj tomo sxp sol eth bitcoin,0
Princeysov people think bitcoin is high k wait till the end date k end year follow abtc super underrated bitcoin follow tweet tips really really great btc,1
Just wait and see the full moon.,1
"cryptoednl tends to agree, but no reasonable BTC seller will make a large sale over the weekend.",0
You may think it will be fair or it will not be enough. Things will have to be squeezed out for a long time.,0
Bitcoin is getting closer. fib area Everything looks optimistic. See Major Obstacle Hit Pass Behavior. BTC,1
keep accumulating keep staking keep holding keep building bitcoin shib torg dfi ada xrp bnb eth,1
The Year Doesn&#39;t Matter Bitcoin What Matters Purchase Purchase Bank Transfer Credit Card Apple Pay Google Pay,1
Bitcoin Block Byte Transaction BTC Reward Information Visit,0
icoffenderii yellow first day bitcoin,1
bitcoin ethereum working hard kk weekend red week receiving hopping begging legs finally completely oversold thinking btceth falling bellow k week,0
Anyone can use empty dry powder. subk bitcoin rn it&#39;s okay to breathe DCA today is the value of DCA Bitcoin. k loooong way is not possible btd save future DCA,1
Daily purchase strike app launched from December,1
fasb settles fair value accounting for measuring the crypto asset bitcoin.,0
intocryptoverse consensus time bitcoin hardening excuse accumulation authority,1
Bitcoin Measures Still Beauty Bubble Removal Firming Last Month Could Still Be B,1
wallet bid crawford porter bout set september bitcoin sportsbook,0
BTC Derivatives Sheet Tweet every minute cme delayed min g delayed min oi share,0
iyiprofil will fly away soon. An alternative hard fork like bitcoinlatinum is needed. We aim to bring a better environment more affordably. BTC believes that forks will continue to improve the work of Satosis.,1
"Leavescrypto truly understands that Bitcoin will never bet on a Bitcoin bullish trading payday. But if you follow Ray, he is a very underrated Bitcoin expert",1
