text,sen
jpmorgan sees higher BTC price potential. AZ unveils 1 billion cryptocurrency fund. PayPal Hint Cryptocurrency related hodler digest may crypto btc,1
Coinbase is probably a better option. A poorly managed hot wallet online alternative will probably be inferior. A properly configured protected hardware wallet (e.g. Nano),1
jeevsthecurious I like BTC finite supply. Anyone can own and control governments around the world have been hacked using a cell phone internet connection.,1
Skeptical solana low public allocation launch solan team vc support leave retail investor responsibility abandonment says you never know what will happen,-1
"roxyfighter Yes, it&#39;s really anomalous. We&#39;ll talk to you soon and help you become a bigger anomaly. Become the first female fighter to receive Bitcoin trading",0
cryptonite kerooke someone say million tom tom tom tom tok tok tok tok tobitcoin bitcoinprice,1
hello east asia australia market cap t past h tail wagging btc domination fear greed index show market fear,-1
I make automatic purchases collecting bitcoins every day through blockfi. Purchases through Trylolli Foldapp grow on cakedefi defichain dfi bonus code.,0
forex market year solid million budget mention use data center lousy crypto market support amazoncloudstyle system agent agent security exit ass fucking,-1
Lack of Bullish Indicators Volume General BTC Weakness Right Key Key Line Points Current Price Action Upswing Sustainable Time Caution,0
"Leavescrypto truly understands that Bitcoin will never bet on a Bitcoin bullish trading payday. But if you follow Ray, he&#39;s a very underrated Bitcoin user",1
Important Understanding Bitcoin Rights Manipulation Momentum Ignition Algorithm BTC Example Definition Here Source Trading Bitcoin Rights Dangerous BC Manipulation,-1
ada update checkout link bio encryption signal doge ocean btc omg xrp dogecoin cardano enj tomo sxp sol eth bitcoin,0
xrpbart peterschiff still hasn&#39;t gotten it yet. Haha wow naive generation history has less chalk experience because there is no bitcoin yet.,-1
um something bot someone whale catch BTC good shot ass looks good last two days moon boot justincase,-1
It has become a religion similar to an old religion. People are chosen like Greek gods to defend their coin tokens and wage war. It&#39;s honestly an exciting and also cringe-inducing time.,-1
altcoinsherpa honest le main part portfolio spread alt sol dot avax bigcaps oin adax aioz smallcaps another alt eth btc,0
Bitcoin approach resistance breakout means test k area requires k hold. The local upward trend is that we believe BTC has bottomed.,0
Ethereum decentralized computing platform United States Ethereum is Ethereum payment transaction fees gas developers use Ethereum operations Ethereum Bitcoin Binance.,0
"Look for really weird people. They keep saying they want to legalize regulation. Allow regional, institutional funding, and report regulated markets.",-1
Ensure consensus is achieved through an inflation-secure network with little chance of adoption and expansion of future generations to worry about. Peter Todd said:,1
Buy Cash App Buy High Fees Eat Privately Withdrawal Fees Send Lightning Wallet Like BTC Already Prevent High Fees Future,0
Lots of scams Dislike intrinsic value Used by financial institutions Rely on criminals Seemingly random value Most likely based on manipulating market environment influences,-1
Thoughts Tweet Sarcastic Luna a week ago worth fraction penny bitcoin cryptocurrency bitcoin bitcoin crazy condolences people went by boat to crypto crash,1
Cryptocurrency long-term investment deep newbie panic sell good things opportunity buy sell low sell high future game patience hold profit,1
altcryptocom take a look saniwith extreme low volume lp tokens important long term vision selection sani holdings future bitcoin sanin selection,0
Analysis October Current Price Bitcoin Dominance Market Psychology Points Extreme Fear Total Cryptocurrency Market Capitalization 1 Billion Approximately Trade u,0
"Rothschild Investment Corp triples Bitcoin exposure. q Investment firm Rothschild Investment Corp has increased its exposure to Bitcoin, focusing on cryptocurrencies. bitcoin forex",1
Long Government Printed Currency Price Bitcoin Rising Stop Monetary Policy Major Country Changes BTC Price Reference Million End Bitcoin Month,1
btc&#39;s soaring economic ease of service security blockchain-based protocols themooncarl issues time lovely and commonwealth-following look needs to be updated. It&#39;s easy and interesting.,1
"If we set higher highs since January and continue to do better in stock markets from November and get some good catalysts, we could soon be in the green",1
lopp banks use information money like good reason. Stop using technology. Start using cryptocurrencies like bitcoin ethereum eth ox near other people.,1
huobi primelist new listing flz seize sales opportunity lead wealth deposit trading launch june click link details sign up crypto btc nfts,0
Bitcoin bottom after break day That&#39;s a quick opportunity Hurry up The alternative was made It went lower I want to know Accumulation movement occurred Prepare for the worst,0
sbfftx method is a bit strange try to differentiate international u like okay south american people okay American people okay big deal ftx bitcoin,0
Really seriously tell everyone not to try it Hours Dollars Cost Average Cryptocurrency Free Money Years Literally Years Look back and feel satisfied,1
Rising Triangle Break Break Good Volume Hold Expected BTC K Range Next Day Hold Eye Support Resistance Case Fakeout Bitcoin,0
"The idea is to use it like Bitcoin, but with an added level. Idea Wallet also understands that mass adoption will occur and people will likely stay in places like Voyager Coinbase.",1
"Oh, I made a mistake. I took some financial advice. I recently downloaded it. Use Excel. I know a lot of analysis. I trust it. Really, the course was appreciated by the people. The best.",0
"I&#39;m tech savvy, I use one computer to watch school streaming games, and I&#39;m not even in the habit of using a VPN. It is definitely a safer exchange of money.",1
I keep telling everyone every day that Polygon Ethereum Match has made heaven. Nothing works. Mass adoption of Duo is slowly coming. For sure.,1
"Yeah, imagine Apple Amazon acting like Bitcoin. Bitcoin is so powerful and hates stupid arguments that financial experts pretend to understand anything. Bitcoin is impossible.",1
"michael saylors microstrategy purchased additional m bitcoin. Companies have been purchasing Bitcoin, bringing their total coin holdings and taking Bitcoin to another level.",1
bitcoin approval is needed politicians bitcoin people people currency supported people beings have made legitimate choices people politicians derived power people people accept people how,1
New Bitcoin Price Zone Detection Drop Down BTC Zone Detection Unlock Telegram Group PM u Trial Period Group End Prediction,0
Take note of asking for financial advice none take expert advice decision end date btc eth will always be good like algo one,1
cryptodaily think bank switch bitcoin fight central bank cbdc cbdc attack bank skip process private bank jump board btc loose,1
Look at Safemoon Even guesses are scammers from the development team Even though it&#39;s proven code people want to get rich Haha most humans are fucking stupid creatures,-1
usd mkt limit change last time btc b eth m bbnb m xlm m uni m okb m bitcoin cryptocurrency encryption,0
"Just whine and enter your opinion. Continue to think of Bitcoin as value. That&#39;s an opinion, don&#39;t whine on the phone. I am bearish Bitcoin trading.",-1
loumatyb ronfilipkowski one politician party country fiat system always fails cracks apparent disregard continues to buy bitcoin way financial freedom bitcoin,1
rovercrc Thank you rovercrc It&#39;s a great opportunity It&#39;s a really special project Project many attractions I hope there will be a lucky winner Good luck to everyone hasinha mallikarjunan topangavista bitcoin,1
Bitcoin like natural DMT Floating brain Everyone can access it without cost Understand reading the process Understand definitions without intermediaries Slow flow cannot be stopped,1
Overall all markets are looking good Current inflation war Corona situation very unlikely See BTC rise See pump See dump See crypto trading,-1
People American News Anchorman Asked Thoughts Amazon Will Accept Bitcoin Payments Soon The person wasn&#39;t even a director Amazon doesn&#39;t know People were confused,-1
"Believe in luck, novelty, polka dot pattern, opportunity to see the road, never seen before, chain balance case, low interest rate borrowing story, low collateral",1
usd mkt limit change last time btc b luna b avax b xrp m xec m ftt m bitcoin cryptocurrency crypto,0
"bitcoinbtccryptocurrency Interesting facts btc establishes a cryptocurrency bubble after a year of negative candlesticks, but consecutive positive candlestick records are repeated as follows:",0
bitcoin neverending story one usa criminal use odd use speculator use small world usa small company use small country use,1
hattankhalifah hello dollar has been liquidated around please help me recover start transaction transfer usdt wallet really need help tzadfwmhdwpfyxfqhqdyjelkmbye trc bitcoin btc eth,0
nobsiders danheld calls for better store value for bitcoin as total assets world around $1 trillion everything that exists now bitcoin handles big chunks with ease,1
bossgiveawayz bubbatoken prize whale altcryptogems cryptopoorboy flurbnb banggarr Bombshillers token boom recommended cryptocurrency friends don&#39;t go Docleiy Luckymanno blackkalonk bcqwdeazrkhdasqqcdnvjzzygauysczr btc,1
Remember that a shocked altseason kick Bullrun can close your eyes. dart pick alt will give crazy profits well it happened altseason btc dca,1
bitcoinfreak saitamaguru strategy fail launch token app tout best app fail crash miserably fail strategy btc fail knowing time intentionally strategy,-1
crippledogecoin thecryptolark yes paid doge there shiba inu ski cant buy doge without buying different types of doge food feed doge bitcoin,-1
"For your information, Bitcoin Closer Bottom Top Case is curious about Bitcoin regardless of the apparent economic environment you have never lived in. Bitcoin fundamentals have changed btc btc",0
osltraderview April Bitcoin Development Triangle Pattern Pullback Coincides with Tax Day. Flip the bus over and it will become the world&#39;s largest stablecoin. Find your edition today.,0
How Bitcoin Works Current System Exclusive Unjust Tendency Prey Weak Disenfranchisement Corrupt Allow the Davos Crowd to Walk Free Alex Gladstein Bitcoin BTC Quote,1
good night family go to bed see bitcoin absolutely bear k bullish morning look solid short entry BTC opening trade bed,1
btc pair macd cross daily pair agi co dcr mana nkn rcn xvg zil condition macd cross bullish btc binance login,1
Really fun thank you all crypto wisdom built in year experienced trader squeeze time session bitcoin cryptobanter cryptotrading sheldonsniper fibonaccili cryptobanter cryptomanran mammasniper,1
used coinbase coinbase pro bitstamp buy cna check calculator cointaxwtf short term profit sell stack page examples see,0
Edition Discussion Current Macro Environment Make Money Bitcoin Find Useful Problems Consider Share on Social Media Forward to Someone Who May Be Interested Bitcoin,0
The idea was to realize that overcoming established institutions was not important. Challenging Tasks Destroy Moral Obligations Destroy Tyranny Make the World a Better Place Fix Kids Bitcoin,1
"ercwl ercwl Ethereum Bitcoin Company Employees Unlike contractors, bull bitcoin users maxi people enjoy solving real problems with a focus on sound money and distracting themselves",1
dogecoin one fastest cryptocurrency cheapest cryptocurrency fees want to send money american friends india western union spend all day dogecoin cents max minutes,1
see cameron reference el salvador btc part country important citizen daniagonzalz nayibbukele true leader people people are excited to see government actually working citizens,1
hello i joined a network called surveyj i got paid today post survey social media login link instant signup bonus surveyj cashapp bitcoin,1
"bojidarkostov Still confident despite being downtrend for quite some time Bitcoin sees another high year, but everyone follows ethb. Tweet predictions follow solidly.",1
Yes definitely brave made changes in browser search engine stake bet dividend earned bitcoin axionnetwork member family switch brave made,1
Remember last summer&#39;s crash. One person has established a huge short position. bitfinex may reverse its short position. bitfinex increased today. good luck.,1
bitcoin golden rule never sell fear minimum hodl year plan hodl 10 years ignore price volatility stack bear market always build faith,1
Biden Expert Believes Inflation Temporary 2-Week Stop Spread Is Similar Similar Expert Says Long Temporary Precedent Set Year Bitcoin Help Fix,1
I am considering staking BTC. Celsius related staking is not a good read. Risk return BTC seems like a good bet. It&#39;s a good idea to keep your profits.,1
One is confident in investing in cryptocurrency See Ponzi Scheme Utility Currency I don&#39;t think either way is good Question Request a useful feature Support current price,-1
Wallet Transfer Other Exchange Wanted Trade Buy Sell Locally Dirty Premium Trade Polo Bit Stamp Bitmex Are You Australian Living Room Use Satoshi Pay Bill,0
odell adamisapleb may want to reconsider public bitcoin ultimate test integrity greed pride pride can be an issue low key stay humble,0
"Process of attempting a large state, Barry said. Big States Crash Real Estate Company China Defaults. There was no waiting for a seat. Bitcoin ETF Accepted",0
tmobile violations also include name phone number physical address. We also have sensitive data such as Ssn driver&#39;s license information. imei number information sold bitcoin tmus,-1
cashapp jackdorsey bitcoin world&#39;s biggest podcaster joe rogan accepts bitcoin payments. joe rogan world&#39;s successful podcaster comedian has financially accepted bitcoin payments.,1
Network growth continues to surge at the fastest pace in history Short-term catalysts could solidify the network effect and could actually bring Bitcoin to 1 billion Bitcoin Lightning Network,1
Directions Track Please let me know I sent you the first address I never gave a knot and it didn&#39;t show up anywhere Multiple confirmations I&#39;m savvy I&#39;m savvy with bitcoin wallets,0
jtsglobal utodayen govbrazil indiainbrazil apompliano brazilbrian brodienbcs ukinbrazil jack amazing big country bad thing will be a third country. create bitcoin official btc,1
bitcoin price canadian dollar btc xbt btccad btc price cad average last hour average time h change h low h high information,0
usd el salvador bitcoinday arrival sat sat usd btc usd usd sat fri october cdt btc usd usd sat tue sept cdt bitcoin,0
"erossiniuk Bitcoin, still confident despite being downtrend for quite some time, will soon see another high. But everyone follows sotbc tweet predictions and follows them firmly.",1
time update crypto market score score btc score alt v btc score alt v market cap tb btc dom eth btc,0
Building a project Good development Long-term opportunities open to all users Also a rapidly developing projectI believed in success. future uponexex bitcoin defi hariom sumitk jaising,1
"Okay, you can modify your statement by doing worst case analysis except Bitcoin real value cryptocurrency analysis. This makes people much more likely to like important issues.",1
The cryptotowneu project has undoubtedly created a professional and experienced team with a clear development plan that has been professionally implemented. itssmariyan mahaburtech topondey bos airdrop bitcoin,1
We see rapid deflation. Market wealth seeks diminishing returns. They still come back and keep trying to scam me. People buy without anyone holding their bags. market crash,-1
That&#39;s right lol Anyone who followed last month&#39;s price predictions could have made a lot of money idk people would be mad and curse the moon especially next month,0
Bitcoin Mining Containers Transported Across the United States Methane Off-gassing Air Recycling Bitcoin Bitcoin Mining Industry Travel Remote Locations Off-gassing,1
last chance bull btc resistance k highlighted march st failure break k time may break k level bitcoin btc crypto,0
airdropfather project bright future I really think project perfect and wonderful innovative project project to which the future belongs mizimaruf munna ahsankabirsanto ummenipa airdrop airdrop bitcoin,1
bitcoin ethereum working hard kk weekend red week receiving hopping begging legs finally completely oversold thinking btceth falling bellow k week,0
Workout Suggested Income Stream Earn Simple Post Share Used Like Social Media Share Items Rent Sell Marketplace Job Application Platform Bitcoin Keyboard Revolutionary,1
Most Popular Companies Looking for a New Job Bitcoin Impermeable AI Senior Frontend Backend Engineer Jobs Apply Today Impermeable Browser PP Building Internet Standards,0
Benefits Add Bitcoin Merchant Processor Presence Support Merchant Processing Transactions Bitcoin Conversion Fiat Currency Deposit Funds Direct Merchant Bank Account Daily Bitcoin,1
"I think everything that happens in human behavior is great. In a safe moment, slowly greedy metisdao sovrynbtc btc eth chart, but reflect a little more slowly.",1
I immediately cash out every red cent. Soon he lost enough credibility to fully compensate his victims. In fact trust has lost enough confidence to be a scam,-1
Michael Saylor bought Bitcoin El Salvador bought Bitcoin Elon Musk bought Bitcoin I don&#39;t want to buy a smart whale I bought a follow The bottom of the market,0
vibraniumvbn project bright future I really think project perfect and wonderful innovative project project to which the future belongs mizimaruf munna ahsankabirsanto ummenipa airdrop airdrop bitcoin,1
all bitcoin july inner workings federal disclosure daily failure mairead mcguiness money laundering meme review rawavocado sponsor cryptocloaks host bitvolt coinicarus,0
No one seems to have any experience with Voyager app support. Maybe it&#39;s overloaded. Free BTC Giveaway knows you want to keep your assets. It takes a week to even hear a support email.,-1
"Despite the downturn, various simulated Bitcoins still make money through mining transactions. Bitcoin Time Sell Time Invest Contact Us Abrantesrene Invest Coin Earn Invest",1
mikejvoorhees jimmyjacked theamericanhodl bitcoin usdt trading pair history nothing is really new i just want to remind you march k trade with bottom k tell people who are absurd,0
"No, don&#39;t think of Bitcoin celebrating the spirit of Satoshi. Think of it as pizza day. Bitcoin may not be celebrating its community of leaders. It could be El Salvador Day.",0
Probably nothing. Entrepreneur exploring value creation along Bitcoin&#39;s full potential spectrum Bitcoin currency paywall jeffbooth jeffdeist saifedean perbylund bobmurphyecon williamjluther stephanlivera,0
"BTC Busy Day Today I own a fully deployed branch near BTC, so the location finished decently on an overall slow day. It could be much worse.",1
run regression bitcoin v basket tech stocks next mind offer palantir tesla nio alphabet feel free to add or suggest basket,0
"In any case, I remain optimistic. The part that failed is BTC was kicked out for the first time. Id millionaire. I&#39;m making a mistake. I&#39;m switching to holding like shiryo DCA.",1
I have been banned from cross-posting subs. Anyone who knows a sound investment and bans silence like crazy is also remotely negative while constantly finding new buyers and losing money,-1
Margin Lending Multiplier Effect Asset Liability Net Supply Chain Answer Yes Bitcoin can use a fractional reserve system. Top Networks Holding Base Money,1
btc ripping important yellow zone resistance turning support time next target important key resistance k yellow zone bull flag breaking moment bitcoin,0
btc spike fake news btc go back k tomorrow dead cat bounce which btw sub doesn&#39;t even know the meaning you have to live a sad life,1
bitcoin price canadian dollar btc xbt btccad btc price cad average last hour average time h change h low h high information,0
jack ceo twitter confirmed btc role company&#39;s future. Dorsey advocate btc long term plan integrates cryptocurrencies. Existing product service information scn,1
Coal oil and gas company receives tn bank after paris climate talks. Mining Bitcoin&#39;s Big Problem Hmkaaay Sentiment Neutral World&#39;s Largest Bank Briefing,0
vailshirecap bitcoin assets galaxy startup btc millionaire all changed discover bitcoin next aacrypt learn investing right post tips bulk btc holdings added,1
nepalneedscrypto day nepalneedscrypto protest government decision ban bitcoin cryptocurrency changing world don&#39;t want to be left behind sign up post hashtag nepalneedscrypto hellosarkar mahabirpun,1
ashwsbreal make a big move bitcoin cryptocurrency enthusiasts all buy bitcoin imagine wagmi millions buying future BTC bitcoin cryptocurrency,1
"Mining difficulty Bitcoin, the world&#39;s largest cryptocurrency, has reached an all-time high. Mining difficulty has increased compared to last year for about 1 trillion BTC cryptocurrencies.",-1
End ww Breaking up the new deal meant u cutting government spending. Amazing u The economy has experienced a huge boom. saifedean ammous thebitcoinstandard bitcoin cryptocurrency,0
cz reveals IPO possibility. Binance u future changpeng zhao cz CEO Binance mentioned the possibility of an IPO. his cryptocurrency bitcoin forex,0
Money Mate Money Points You&#39;ll love our technology upgrade suggestions. Deep Goal Tokenization Interesting move to bring intangible assets on-chain DeFi overall,1
Blockchain Slow and Expensive Slow Transactions Expensive Transactions Enough Incentive for People Stakemine Secure Network Reliance Case Fraud Extremely Inefficient Non-competitive System Design,-1
guess use bitcoinlightning make money transfer part full business model work trading algorithm mention win win user plus professor lightning scale genius,1
Binance Amid Global Crackdown Singapore Regulators Soon to Follow Cryptocurrency Exchange Binance Faces Increased Pressure from Regulators Around the World UK FCA Reduces Binance Bitcoin,0
"Marketsbylili beeforbacon elonmusk le intellectual laziness understanding game holds benefits at a higher level, regardless of why you feel like buying bitcoin openly.",1
cryptographer bitcoin price drop k genesis woes exec defense gbtc latest casualty ftx collapse raises concerns grayscale bitcoin trust institutional investment fund,-1
Point to another core persona founding kadena dr stuart haber coinventor blockchain technology quotes author bitcoin white paper coinmarketcap kadena created another bitcoin cryptocurrency.,1
"Bitcoin Neutral Support Resistance Bullish Countertrend Signal Requires Weekly Close. Bitcoin BTC continues to rally throughout the week, indicating uncertainty among market participants.",0
"According to CoinMarketCap data via Newsweek Crypto Invest SmartBitcoin, the surge in popularity of Shiba Inu dogs in May pushed their price to an all-time high.",1
The question is which cryptocurrency BTC is the current market leader name recognition superior technology PA perhaps the immediate future perhaps points generally assumes a superior technology win.,1
Stored Value Hedges It takes a long time for large investors like the stock market to get to the market while it&#39;s still early. Fruitful people resist change.,1
Binance Amid Global Crackdown Singapore Regulators Soon to Follow Cryptocurrency Exchange Binance Faces Increased Pressure from Regulators Around the World UK FCA Reduces Binance Bitcoin,0
"coindesk canaanio aoyona nakamotogames provides opportunities to gamers around the world. Participate in countless blockchain-based games to generate significant, sustainable income. naka nakamotogames btc binance binancegateio",1
thebitcoinbum bitcoinissaving Think about it Bitcoin Amazing freedom Run away Country Take a small difference Run away Nothing Run small money Start somewhere else,1
"When future payment systems talk to their backend, they will use blockchain. Cryptocurrency decentralized finance effectively reduces middlemen. Banks start earning profitable assets.",1
I&#39;ve read it all Bitcoin Standards Professor Cyphedin Best Reading Maintaining a difficult level of quality in recent years Looking forward to reading the next book Arrival Arrival Fiat Standard Author,1
nftmechaen rainmakergaming potential relationshipsnitroleaguegameunique gems like championshuntershence market volatility best focus projects much scope makes the future bright nfts rain btc rain,0
safekeyuf storage using cold storage unit heirhavencom plan sharing secure india inheritance beneficiary order safekeys setup decentralized plan encryption btc sha want safehavenio,0
Stop saying something small amount negative ta will like to evaluate the majority of the deal. Use bot algorithm ta real explanation price movements,0
The spy integration towards ath reminds us of the exact facts of the past week for a particular BTC. Evidence suggests BTC volatility is decreasing. Spy BTC indicates decorrelated direction of movement.,1
mp can be donated by paying only a portion of Bitcoin. Minimal Bitcoin altshitcoins help protect your funds. government support due to inflation rakyat kasthurishankar yeobeeyin hannahyeoh syedsaddiq,1
You Shouldn&#39;t Work All Week Hard Hours A Day Understanding Bitcoin Security Funds Multisig Concierge Team Starts Time From Scratch Best Bitcoin Resources,1
