text,sen
"A man dies, love, even when he gets old, a man is Bitcoin today",1
bitcoin btc impulse bar btc bar close cryptocurrency short term volatility detection,0
Bitcoin Mining Difficulty Adjustment Expansion of Miner Incentives End of Operation China Ped,1
"thecryptolark Ethereum Flip Bitcoin We Lost Fiat. Still, winners don&#39;t change the world.",-1
anarchylak bitcoin no gambling unless you have extra money. Cryptocurrency is always a gamble anyway.,-1
Rising Wedge Rising Wedge Anywhere Target Current Rising Wedge k BTC Bitcoin,1
Every day in discussion groups we criticize those who have it. Stop stealing karma. thank you,0
A tragic life Coiner thought the fraud could have happened earlier. Bitcoin BTC,1
Bitcoin funding rate remains negative BTC price surges k Bitcoin BTC cryptocurrency,-1
Life goal: Participate in many Bitcoin conferences. It is always possible to acquire speakers by adopting BTC.,1
best cryptocurrency watch weekly btc ltc icp theta ftt btc bitcoinnews bitcoin,1
Knowing and leaving is never a problem. The fixed transaction fees are very small. Very useful.,1
First Company Ticket Monster Major Failure Why It Matters Why I Didn&#39;t Touch Dog Shit,-1
peterschiff think change mindset bitcoin hodlers cool calm great msd hurt heart,1
whoissuperpower support project success bsc airdrop btc maharunn earnpolash fuadfuad ahatikhasan trtizlehd,1
suscanicola ryanvieira hodlberry thorchain also spoke about self-repaying loan bitcoin liquidation risk.,1
Metaverse Blockchain Game Altcoin Rally Bitcoin View Support Blockchain Altcoin Bitcoin,-1
bryce harper rock massive phillies chain ahead phillies braves game mlb bitcoin sportsbook,0
gegelsmr Imagine getting an all cash loan and receiving monkey bitcoins like WTF,0
grayscale btc etf get approved in july btc defi ponzis hand cleansing,-1
I know it took a long time to proofread. I can&#39;t see you coming back for a long time.,0
Shotbymatta Bitcoin Flux Cadena Bitcoin Price Prediction Cryptocurrency Winter v Global Adoption,0
Those who play the soon-to-be hot potato asset Bitcoin have endless delicious potatoes,1
ETH Largest Active Community Developer Issues Best Technology World Using Useless Developers,1
short won entry price stop loss link bio tz BTC bitcoin won,0
Avalanche continues to build partnerships maintain best smart team thinking well,1
Got Caught News Narrative Cryptocurrency Is Much Better Don&#39;t Attack The Environment,1
Low Cost Liquidity Physical Storage Risk Easily Portable Maximum Benefit Interest nexo,1
long audio item price tz stop loss link profile audio BTC bitcoin,0
shortwave entry price stop loss link bio tz BTC bitcoin wave,0
crypto whalealert btc recently sent value unknown unknown btc transaction hash fbefaaeddcdaaebbdcdebc,0
BTC Price Drop Fill Bitcoin Future Gap Focus Rotation K Bull Target,0
czbinance almost born as cryptocurrency money fight freedom progressive people like bitcoin ethereum xdag,1
BTC Lightning Network provides a behind-the-scenes view of the bull market fractal as Bitcoin breaks above k,1
"nft news floki metaverse, nfts metaverse function integration Globenewswire nft btc bitcoin",0
What is it I know BTC is starting to see short term correlation last statement,0
"Buying dips in a good way lowers the average purchase price, making Bitcoin cheaper overall.",1
Coin Bureau Bitcoin Life Rent Free Mind Buffet Munger Constant Protest Collectively Coordinated,0
People love love around them. I know the difference. Bitcoin Bitcoin Love Story,1
Many businesses in developing countries cannot be conducted efficiently because they do not have traditional banking or internet connectivity.,1
The guy keeps on repeating the true dog bounce like an endless supply of Bitcoin Bitcoin,-1
"Oh, I&#39;m sorry. I guess I&#39;m a little sensitive because someone attacked me earlier. Are you worried?",0
Go deep enough and you will still benefit in the new year. They say you&#39;re stupid,0
Drug dealers Dark web users money laundering makes cryptocurrencies look really bad.,-1
Bitcoin has been down for most of last week. Experts believe it will still fall.,-1
"Almost a bad monkey expects it to fail, but has no idea whether a pump dump will occur.",-1
Market Wrap Bitcoin could see declining trading volume. BTC Bitcoin Market Cryptocurrency,-1
I think the Ethereum-enabled healthcare verification vaccine passport blockchain is pretty cool.,1
warning bitcoin price short term fluctuation high resistance level m oct pm,0
Bitcoin currently scheduled to expire Bitcoin conference held in Miami Florida in April,1
UK&#39;s Argo Blockchain Becomes First Climate-Friendly Cryptocurrency Mining Company Cryptocurrency Trading Bitcoin,1
The dot-com bust wiped out many useless tech companies promising future bubble-busting cryptocurrencies.,-1
Check out the volatile next hour minute BTC options expiration utc midnight PST April,0
"Although currency IDs are sufficiently stable to be usable, they actually present a reason for adoption.",0
m sat bitcoin lightning network liquidity swap triangle btcln yes routing node connection,0
Bitcoin surpasses k after massive volatility. The market watches the market overnight.,1
I think Bitcoin will soon see fireworks. First you need to rest. descending trend line lfg,1
Moon Soon the secretive Elon Musk hit a fresh h with Bitcoin price suddenly surpassing Ethereum hit.,1
Middle East Blockchain Ecosystem Cryptocurrency Oasis Estimated Reach Organizational Goals q BTC cryptonews nft,1
"It&#39;s best to treat BTC like a child. In the end, we don&#39;t know exactly what&#39;s going on with BTC.",-1
hurt see the entire cryptocurrency portfolio decline minus money buy deep dogecoin bitcoin eth,-1
Be sure to go invest usdt bitcoin at the best time don&#39;t miss it yet early,1
Edmonton student warns others to lose k phone scammers CBC News Bitcoin BTC,-1
coin exchange trash idiot exchange burn trash bitcoin litecoin trash easy u exchange,-1
I&#39;m sure it&#39;s a jumping hype train created by cash bastard hardon btc cryptocurrency scam.,-1
On-Chain Bitcoin Value Coins Spent utxos BTC Value Internal Exchange Transfer Likely,0
Ashwsbreal bull return is broken k resistance k really soon bitcoin k imminent,1
"As Willy read the tweet, the vague lot times actually provide lot details.",-1
Cryptocurrency Bill Received Russian Ministry of Finance Public Comment Period BTC cryptonews nft,1
"It&#39;s a world of worry, and like clockwork Bitcoin, it&#39;s always a great comfort to know the different blocks.",1
Go for day trading. Don&#39;t care either way. The price is regardless of the year.,0
Bitcoin BTC Mining Nate Food Group Purchase SJ Pro Bitcoin Mining Operation News,0
"Last week we see Bitcoin consolidating, hopefully making Ethereum look better technically.",-1
"Bitcoin needs a break, it needs time Learn Bitcoin panel surfing through bigcoinpge bitcoin cryptonews",0
Mythical Game Raise Millions Series C Funding Round Led az Bitcoin News Bitcoin,1
People concerned about sudden rise in decline k minimum eoy btc hodl chill investment bitcoin,1
"I&#39;m going on sale, I&#39;m going to sell bitcoin to get fat, I&#39;m going to call people whale.",1
kristinekrypto topback massive rise decentralized finance bitcoin sounds great beyond dfi defichain,1
"Okay, the ban actually happened. Considering Bitcoin BTC CTM, do you think the price is still strong?",0
"If cryptocurrency implodes in Celsius, eth loses $1 billion. Coinbase announced.",-1
"Even if it&#39;s the same, it will cool down when you play it. imo the highlighted area diagram is hypothetically Bitcoin simple.",0
gradybooch bitcoin doesn&#39;t belong exchange exactly why twitter genius knows everything abt ting,-1
Good news bitcoin cme gap closes recent dump due to high expected cpi numbers.,0
"Bitcoin, a federally regulated makmoth coin, has created many idiots who are making cryptocurrencies even worse.",-1
Bitcoin BTC Plan Break Week Looking Tag Back K Mid Possibly K Weekend,0
"Ahmadosiddiqi Read Thread Suggests the gold standard would improve the lives of Argentinians better, say Bitcoin",1
Typical rbitcoin user He bought BTC with his grandmother&#39;s birthday money. He cried.,-1
"I don&#39;t know if I can sell Luna, people will have the opportunity to sell it and take it instead of course.",-1
btc btc k destroyed saturday pump k monday retest fill cme gap maybe,0
Bitcoin Measures Still Beauty Bubble Removal Firming Last Month Could Still Be B,1
oof good bounce straight btc telegram channel jasmine crypto premium btc eth bravo,1
I really like the Bottlepay app. Beautiful UI I recommend fellow UK bitcoiners stackinsats btc.,1
michaelmwebe president nmwendwa has been busy trading bitcoin cryptocurrency linkedin new business venture swerriapp,1
A developer ecosystem makes one look like a community. eth is easily adaptable.,1
themooncarl missed the BTC level and the biggest opportunity accumulated last week inari tokeninari inariraffle,0
Purchased ico per coin. It helped us store everything we sold a month ago and buy a bigger house.,1
andydestroyer btc bsv don&#39;t buy bitcoin don&#39;t follow the hype crowd andy talk kurtwuckertjr,-1
Forced Coexistence El Salvador&#39;s Bitcoin Law Could Change Global Finance. Cointelegraph Magazine Cointelegraph,0
Central Bank TRF Turkey will follow El Salvador and see a deflationary economy immediately. BTC BTC,1
Whale Stacking Monkey FTX Sand Link FTX Bullish Sentiment Hit Cryptocurrency Market Bitcoin,1
"With a major Bitcoin relief rally imminent, sellers have lost confidence, said cryptocurrency analyst Nicolas Merten.",-1
cryptocrash bitcoin investment without foundation cryptocurrency operation computer system structure aman agrawal wednesdaythought,-1
Send Bitcoin Value Friends View Long Takes Send Nano Value View Long Takes,0
bitcoin ethereum tron xrp value looting large cryptocurrency exchange hacking ethereum bitcoin,-1
The btc small pumplink video sub that rejects the aforementioned r already does not have eth trading psychology.,0
All coins other than Bitcoin Ethereum were invented to make their creators rich.,-1
Mention the trinity of bitcoin developers users miners and check something. Don&#39;t let users obey developers.,1
Demand Bitcoin and start replacing fiat currencies logically. Perhaps one day there will be global reserves.,1
"Despite the sounds of a downtrend, I believe the trouble times will spread and we will survive a true cryptocurrency winter.",1
guess you&#39;re wrong lmao accept it&#39;s wrong everyone downvoted think crystal ball will happen next time,0
microstrategy puts in another m bitcoin despite price falling. k crashes via decryptmedia. bitcoin microstrategy cryptocurrency,1
utc btc price rising currently rising changes after midnight bitcoin btcusd btcusd btc,0
"Yeah, changing currencies all the time, like talking about the next version of the iPad lol, I guess it will take some time.",1
Is it really a big deal that Bitcoin can&#39;t be used as fiat currency? Bitcoin can never be controlled for its legality.,0
Cryptocurrency Bitcoin BTC to send monthly newsletter after announcing mobile app launch next week,0
Promoting the realization of the BTC introduction process BTC evangelist within the mirror reflection heaven and earth crust,1
I was scared the last time I saw a big corporation being manipulated like I&#39;ve seen in the past few days.,-1
Nice to finally see that Bitcoin has been manipulated over the past few days. Bitcoin still blowing up in overvalued stock markets.,1
You want to make money like you have a problem. Put the future on hold. Bad press is like that.,-1
heeeyy im trying to relax soon. I&#39;d like to send an email to Mr. beeseeks. mrbeeseekshodlrodeo lazybitcoinization bitcoin btc,0
"I used Kraken Small x Leveraged Long, but the hourly rollover fee seemed expensive.",-1
"apecoin will have worse versions. This means that the pump is still sufficient, so we need to dump the reasoning logic.",-1
"If the opportunity dumping gets worse, don&#39;t get burned. The circulating supply did not change the coins lol.",-1
Smiling Bitcoin Beanie Baby became valuable from day one. Even a millionaire can smile,1
Hold on tight and get better dive low shoot moon cryptocurrency binance bitcoin,1
Every movement becomes dangerous Every ship sailing Risk Fact Strength Courage Show your face,1
mattwallace elonmusk therationalroot says he will put bitcoin dogecoin in multiple currencies. I hope it gets adopted.,1
best airdrops like metaufo amazing project ashenafimeaza gautamgambhir flintoff bitcoin utk tct,1
"Remember I&#39;m going to say Bitcoin will never go down, listen to your favorite ct influencers",-1
"Baltimore Oriole Adley Lutschmann, Gunnar Henderson Arrive Flippin&#39; Bat Provides Spark to Bitcoin Sportsbook",0
Does anyone understand that Bitcoin is hanging? It will be painful enough when the k feed is weak. please.,0
I found a good home Other printed matter I want paid bitcoin trading BTC art let m,1
"Partially because of the accumulation of Bitcoin bullish buying in the first place, the price began to fall precisely in the closing period.",0
GM Everyone chooses to build better systems for the future. Stop building legacy technology. bitcoin levopico,1
Useless stupidly named greed tokens boast apy. Cryptocurrency photos that are constantly being spammed are an absolutely safe investment.,-1
Small chance BTC price could reach k. Trader u say dollar cool bitcoin,-1
kshib long alert ticker kshib market kshibperp volume price btc btc eth eth,0
live scene petergwall typing march operations update rn new mining equipment churning,0
What&#39;s New Help Report misleading or incorrect information. Thanks to bitcoin users like elonmusk mcuban.,1
"History always creates despair for heroes. The greater the time, the deeper the despair, the greater the hero appears. Bitcoin",1
"Bitcoin, worth $100 billion, looks set to decline. Indicators remain optimistic. It looks like we&#39;ll reach a new year.",1
bad bitcoin triangle sign june day really low volume pump cctipcom airdrop eth,-1
Tremendous Love Exodusio never saw it coming. Alhamdulillah Exodus Wallet Cryptocurrency Freedom Feel blessed with Bitcoin,1
Love Tech Damn It&#39;s Cool Mixed Current Upcoming Technology Will Continue To Run Wild,1
Bitcoin rallied in Asia last night. Because Asia doesn&#39;t care about infrastructure costs.,1
balance feed k usd btc reference imo btc bitcoin cryptocurrency btcusd,1
"btc short deribit btc perp If you want to learn business, you want to make friends. dog carl icahn",0
"Bitcoin always works, find a new high. Shitcoin always works, find a new low. Understand.",1
Watching the Tesla Market Tesla Model Avoiding Smoke Devil Impressive Investment Ethereum Bitcoin,0
"I&#39;m going on sale, I&#39;m going to sell bitcoin to get fat, I&#39;m going to call people whale.",1
I walked yesterday. See the BTC pump a little today. Otherwise you missed the weekend.,1
Two stars colliding create a black hole. Bitcoin crashes. DeFi Portal Finance knows the answer.,0
Consider yourself trustworthy. Choose the right stablecoin. Manage your risks accordingly. Generally higher returns higher risk,1
They say that over the next two years you will slowly receive Luna tokens.,-1
Average Daily Volume Average Daily Active Users Average Positive Price Action Long Term,1
eth short alert ticker eth market ethperp volume price btc btc eth eth,0
The Central African Republic has adopted the Bitcoin base currency for its presidency. btc cryptonews nft btc,1
The Fair Guy Sub Made guide literally created a shitcoin called buttcoin.,-1
Apompliano wants the country to replace old fiat mindreading personalities like nayibbukele bitcoin.,1
People soon realize that coins like ada Pump require Bitcoin to be pumped first.,1
Never calm down. Check your net worth. Never nose dive. Real Time Epic Bitcoin,-1
I believe that the definite hashrate price will remain constant at the general speed supply rate at which BTC is mined.,0
BTC derivative sheet tweet every minute cme delayed min g delayed min oi share,0
A good cryptocurrency tank electricity consumption waste comes with a huge amount of segregated speculative cryptocurrency usage.,-1
"It can be realized every time the community never fails a project again. Finally, we implement burn execution speculation.",-1
I buy Cro and start the tank for the first time the next day. The entire cryptocurrency market has learned a lesson.,-1
"Wrong, be aware of Bitcoin pumping for two weeks. Don&#39;t expect Bitcoin pumping in the next two weeks.",1
"I don&#39;t want to worry, but unfortunately I worry enough. I&#39;m glad I own Bitcoin.",1
bitcoin mempool tx statistics last minute average median max days quant nob block height,0
realvision raoulgmi maggielake may have asked the wrong question. Correction Bitcoin Average Dow Nasdaq Stock Market,0
BTC derivative sheet tweet every minute cme delayed min g delayed min oi share,0
I&#39;m going to panic and save money at home. I&#39;m going to calm down. I believe in Bitcoin and go tell my family.,1
"Brother, I&#39;m glad LTC is finally paying attention. Focus on privacy determinants and hold off on ccd monero.",1
bitcoin mempool current mb transaction pending block total fee transaction sat intermediate fee satvb,0
I want to learn central banking. Printed petrodollars are actually in circulation. etc. book recommendations,0
BTC derivative sheet tweet every minute cme delayed min g delayed min oi share,0
"Despite bad regulation, the value of the Russian cryptocurrency market can be seen through technical analysis of the cryptocurrency Bitcoin.",1
elonmusk can fix your money and make your kid affordable. Jeff Chata bit system place bitcoin technology help,1
Leave the node unsupervised. Check your safety. Turn on monitoring. Attend bitcoinconfeur tabconf bitcoin lightningnetwork.,0
btc free signal future btcusdt entry le x max put max total future tp,0
Sold Purchased In Many Cases After Portfolio Red Start Right Game Shark Knows Cheat Codes,-1
It was my first time buying Bitcoin and I honestly liked the idea of sending money online. The unreliable approach seemed revolutionary. Right?,1
Hopes for the Bitcoin cryptocurrency may be priced in on predictions that it will continue to hold.,1
citizenbitcoin thoughts sell bitcoin buy someone invest in purchase safe cryptocurrency strategy achieve financial goals,1
Bitcoin BTC Bitcoin Hits K Ahead Of July Inflation Report One Fractal Hints A Looming Correction,0
BTC Hovering k Fed Rate Hike Basis Points Announced Today Highest Increase Year in History,1
Trolling serious advice means you don&#39;t want to lose money and still not be in debt.,0
BTC derivative sheet tweet every minute cme delayed min g delayed min oi share,0
Executable Reset Eot looks fine. Let the computer manage the price time cycle.,0
"People buy a lot of DCA alcohol every weekend, wasteful, unnecessary, stack toe BTC",1
Bitcoin is getting closer. fib area Everything looks optimistic. See major obstacle hit pass behavior. BTC,1
You may think it will be fair or it will not be enough. Things will have to be squeezed out for a long time.,0
I want to learn central banking. Printed petrodollars are actually in circulation. etc. book recommendations,0
"cryptoednl tends to agree, however, no reasonable BTC seller would make a large sale over the weekend.",0
BTC derivative sheet tweet every minute cme delayed min g delayed min oi share,0
"Maybe it&#39;s half as good as getting your DCA quickly, or maybe you really want to go with your daily purchases.",1
It feels really good to have started playing. I also like the idea of listing coins anywhere. I believe it&#39;s great.,1
BTC derivative sheet tweet every minute cme delayed min g delayed min oi share,0
"I have used cryptocurrency gambling sites to make illegal purchases, and the common issue has also been resolved.",-1
BTC price is under pressure. High Low Low High Time difference determines next direction,0
bitcoin btc perp oi climbing funds dip negative bounce seems shorted could be fun,0
"Same idea, buy a log cabin, leave your family without a house, cats need a place to stay.",1
philakonecrypto Bitcoin Illegal Discovery Inserts Child Porn Link Blockchain Maybe Reasons Panic Sold Out,-1
Adjustment Tesla Bitcoin Betting Rising Returns Ed Bank Real Vision Finance Business,0
Hmm raul has become a cash fanboy sorry maybe just always be careful arkk tsla bitcoin,0
Like channels are still active. ATM BTC mid-channel market structure is turning bullish.,1
The bulls need to take control and see the price quickly. k revisit bitcoin btc btc eth bnb.,1
Russia Implementation Plan Disconnect Internet Restrictions Internal Addressing Average Hash Rate BTC Movement Hence Price,-1
Bitcoin Bull Despair Leading Model Bitcoin Trajectory Prediction Still Tracking Hit Triple Digits BTC,1
I want someone else bag holder poopcoin bail money wrong choice growthbtc crypto celsius network,-1
dogecoin Plain and simple payment method Cryptocurrency Nothing fancy Overly complicated Anyone can understand The biggest advantage,1
"It&#39;s truly amazing. Thank you to Unomic, a fan investor Bitcoin company, for providing great information.",1
I agree I don&#39;t care I want to believe I want to believe that making exaggerated claims will show something,-1
Indian cryptocurrency exchange btc trading volume time zebpay btc coindcx btc wazirx btc bitcoin btc,0
aave short alert exchange ftx market aave perp volume price btc btc eth eth,0
Crypto Community Withstood Pressure Sell Abandon Hope Bitcoin Altcoin Deep Salute Forward Prosperity,1
Bearish Cautious Range Overly Bullish PA Retest Range Lowest Likelihood Bitcoin BTC,0
BTC derivative sheet tweet every minute cme delayed min g delayed min oi share,0
Breaking News Central African Republic passes bill to adopt Bitcoin fiat currency like Domino&#39;s,1
senlummis hopes mix altcoin security ethical companies are trying to capitalize on the moment by incorporating Bitcoin prioritization proposals.,1
ananavarro made money btc altcoins learn make money complain follow me via telegram cryptysophia,1
Bitcoin&#39;s first decentralized cryptocurrency market with many good people options,1
"An unbelievable amount of people taking selfies on the moon, enjoying the annual rush of people and many ideas of wanting to go to the gym.",0
bitcoin mempool tx summary last second average median max days quant nob block height,0
Know all the sales out there Buyer Rights Fear of Buying Greed of Selling May want to DCA in DCA way,1
BTC derivative sheet tweet every minute cme delayed min g delayed min oi share,0
"Bitcoin Lightning Node Management Imagine automated growth. Hahaha, the fiat coin is spinning.",1
Then I think something good will happen. Related price security arises. I&#39;m glad I invested in a good future.,1
danheld bitcoin savings account also austria tax bitcoin profits rise hodl trading buy bitcoin,1
Crypt Engineer heard Strikex Bitcoin falling. Strikex continues to rise. Something big is happening. Great project Strikexofficial,-1
Brothers who hate finance took Bitcoin. A pegged fiat Bitcoin can hedge against inflation. Assumed financial brothers,-1
dot long notification exchange ftx market dot puff volume price btc btc eth eth,0
k combination bitcoin BTC short term liquidation last minute huobi k binance k bybit k,0
Atom long alert exchange ftx market Atom perp volume price btc btc eth eth,0
This is really an important question to ask a stranger. Be sure to get healthy meaning the answer is you will probably need professional advice,0
China&#39;s central bank has banned banks providing financial services from using cryptocurrencies such as Bitcoin to trade.,-1
"Fold App Oh my god, the game is fun. It gets better for the first time. A man sits in the metaverse. Fold App BTC.",1
Still Slightly Bullish Divergence Bitcoin Toss Tic Tac Toe Indicator Won Win Cryptocurrency theindicator,1
Depends on what&#39;s new. hit k dip back k still spot end one future prediction,0
BTC derivative sheet tweet every minute cme delayed min g delayed min oi share,0
"Unless elonmusk introduces integrated technology Tesla Solar, garyblack makes bitcoin mining green and energy efficient.",1
Remember Michael Sailor borrowed a million dollars from the clown Buy Bitcoin K Send Michael Condolences Bear,1
Knownews bitcoin eth major australian baseball league team perth heat pay player bitcoin hold,1
Cathie Autosmash Buy Mode Level Share Million Dollar Worth of gbtc Looks Like Bitcoin Last Week,1
BTC derivative sheet tweet every minute cme delayed min g delayed min oi share,0
btc has discontinued support for k. I hear the investment app has been removed. Twitter is killing me.,0
Jamie Dimon Is Skeptical About Bitcoin Citing Bitcoin Regulatory Government Click Details,-1
Stay focused. Consider your goals. You will not regret trading cryptocurrency Bitcoin BTC BNB. Huge adjustments are inevitable.,1
It already looks like BTC price has skyrocketed. Maybe people are slower to react to Bitcoin today.,0
bitcoin mempool current mb transaction pending block total fee transaction sat intermediate fee satvb,0
Cortrobinson anarchocanadian comicdavesmith patrickbetdavid guyswann sum total wealth connection bitcoin network easily maintains decentralization,1
BTC derivative sheet tweet every minute cme delayed min g delayed min oi share,0
btc usd move multiple addresses unknown wallet date gmt blockchain bitcoin symbol btc details,0
"Ha Hen Sir, please pay attention for about two weeks. I will give you three Rooster thigh eggs.",0
"The good part is that it has actually built an Ethereum first mover advantage. In reality, it won&#39;t be good. That wasn&#39;t the case today.",1
buy btc nayibbukele presidenciasv el salvador average price million dollars worth time buy million dollars,1
Don&#39;t panic remember the dip sell shib dump x spike buythedip cryptocurrency btc shib dinger,1
