text,sen
The network is stronger than ever. Pricing will soon follow.,1
"I&#39;m going to smoke, but I&#39;m going to buy Bitcoin",1
Raspberry Price Ticker BTC Lightning Network Bitcoin,0
Take the coin seller. I don&#39;t deserve it lol,0
Agricultural Bitcoin Ocean Fire inbox opened,0
Miss K Bitcoin Come back tonight,0
Cryptocurrencies with low prices will not disappear,1
beautyofhelin bought BTC holdings with the following options:,1
btcusd shorted Binance UTC BTC cryptocurrency.,0
gold pure bitcoin bitcoin better gold,1
I think anyone can build a brain.,1
Plan to invest a small amount each month,1
check if ousd looks good mediocre returns,1
bennsimmo hegde global adoption dominance bitcoin,1
"Congratulations, you will be successful all the way p",0
btcusdt shorted Binance UTC BTC cryptocurrency.,0
Action Bitcoin Attack Hope Free Society,1
I thought there would be a better chance in mid-July.,0
Cryptocurrency benefits like decentralized nature are good,1
people thank you for buying bitcoin eth bnb,1
Enter Bitcoin Long BTC Come Bull,1
obiwankenobit bitcoin year compared to last year,1
price bitcoin current cryptocurrency BTC BTC,0
Quantumbrix ipfs built Bitcoin. I&#39;m interested.,1
Coin Nation Summit Bitcoin Talks Badly,0
Lord man feels like something big is going to happen,1
Development Changes Bitcoin BTC Crypto ADA,0
"Haha, yeah, yeah, I have to sell shit.",1
Cryptocurrency future general simple purchase perishes,1
It&#39;s cute so I think I could buy bitcoins idk,1
Does anyone know of a bluewallet that still allows withdrawals?,0
xlm works really well. exchange transfer,1
watchguru wclementeiii one decentralized protocol bitcoin,0
Most traded Alt BTC Hit K,0
Crypto Geeks Know Farm Bitcoin Tarkov,1
Anyone out there probably has some great clips from Bitcoin conferences.,0
btc bitcoin situation like btcusdt chart,0
Cryptooptimist BTC has taken the rich world by storm.,1
Don&#39;t share your seed words with anyone,0
Read real-time cryptocurrency news on the best website,0
ath before last round interval number,0
BTC BTC ETH ETH bnb bnb,0
hodlonaut bitcoin purchase word reference,1
amitkhemka doge wala also likes bitcoin,1
iohkcharles bro cordano sell btc buy,1
There are so many bad laws,0
You can still buy Bitcoin.,0
"If you think you really need it, just wait and get an answer.",0
Feels like an ATM Bitcoin cryptocurrency plan,0
Rainio Rainio like Simpson Bitcoin,1
I need a drop lol that will happen,0
Haha enjoy the optimism enthusiasm thread realistically,1
Price Update Bitcoin Cryptocurrency BTC Source,0
Highest closing time today,1
Don&#39;t try to convince anyone of that.,0
Pretty good bounce daily BTC BTC,1
bitcoin weekly chart update btc jclcapital,0
"I emailed my senator, Fingers crossed Bitcoin.",0
Bitcoin Technology Score BTC Bitcoin Technology,0
Lots of Bitcoin Reel Vita Doji Ethereum,0
ilovejaneadams had the opportunity to purchase Bitcoin a year ago.,1
Today xmr is equivalent to BTC Monero.,0
dogecoin bitcoin cryptocurrency dog friend everything,0
BTC BTC ETH ETH bnb bnb,0
I don&#39;t think you understand how Bitcoin investing works,0
BTC price change h Bitcoin BTC,0
ee Thoughts ee Bitcoin Makes You Feel Good,1
Hold Bitcoin by buying it at a low price,1
Another opportunity to buy BTC cryptocurrency shib,1
Hawaiian cryptocurrency like Bitcoin Love DFI DeFi Chain,1
Know Bitcoin like the original digital gold,1
"Okay, basically I&#39;m riding Bitcoin and enjoying Bitcoin.",1
You should read Sparrowwallet Bitcoin Best Practices.,0
Random Terms Bitcoin Glossary Bitcoin BTC,0
You have to keep buying something,1
btcusdt shorted Binance UTC BTC cryptocurrency.,0
Fear Buying Bitcoin K Financial Advice,0
"Yeah, I didn&#39;t know the recommendation would be low today.",0
Please remain patient. fomo based minimal chart,0
BTC will soon allow phone booths,1
The Real Beauty Cryptocurrency Can&#39;t Print Government,1
Bitcoin Read All Bitcoin Analysis Cryptocurrency News,0
"Calm down rudely, watch the money rise",1
"Step up baby, give you a buzzing weekend",1
rovercrc damn yeah baby dracaris bitcoin,1
"Dogecoin, which is still going strong, is my favorite coin. Yes?",1
Next time tell me to buy bitcoin,1
BTC Bitcoin returns to previous k lows.,1
Watch High Time Frame Zoom Bitcoin,1
Elonmusk plans to launch BTC Bitcoin Cryptocurrency Clutch,1
"Bitcoin Miner Preparing, Take Maraplane",1
I really like the Bitcoin supply crunch action.,1
Good morning Bitcoin correction strengthened today,1
A great way to bring money to help Ukraine,1
Jasonplowery Bitcoin hopes for a better world.,1
Bitcoin is already in circulation. BTC is mined.,0
"Wish repeatedly, like as many times as possible",1
officialtravlad complete teacher mufc bnb btc,0
Price Update Bitcoin Cryptocurrency BTC Source,0
I love you BTC I respect BTC,1
"Well, don’t say anything right away.",0
btc breakout binancebtcusdt tawfiktrading bitcoin btc,0
btcusdt shorted Binance UTC BTC cryptocurrency.,0
BTC BTC ETH ETH bnb bnb,0
peterdiamandis Many others certainly hope for Bitcoin.,0
Pizza Day Bit Record Zone Bitcoin,0
btcusdt shorted Binance UTC BTC cryptocurrency.,0
Bitcoin Stability Stocks have chosen stability.,1
mkbhd looks very similar to the Bitcoin altcoin.,0
I feel like BTC will come out quickly,0
btcperp shorted ftx utc btc cryptocurrency.,0
"Don&#39;t be afraid, want btfd ltc btc",1
Bitcoin changes certain parts of planet Earth.,1
"Hello, I believe Bitcoin gives you financial freedom.",0
I think you should make a good and worthwhile investment.,1
Polygon low-cost Ethereum good book,1
Percentage of investment portfolio currently allocated to Bitcoin,0
btc cryptocurrency The country has legalized the cryptocurrency Bitcoin.,1
BTC Bitcoin BTC is also available,0
A letter teaching Bitcoin to my daughter published in Bitcoin Magazine,1
Binance placed a transaction for the cryptocurrency BTC.,0
Bitcoin Points Daily Fulcrum Daily Negative,0
"Just like Bitcoin currency, pay attention to the price",1
I guess fun doesn&#39;t make sense,0
Unfortunately many people assume they never used paper hands,0
Cryptocurrency as a whole needs to win and have a smooth transition,1
whalealert continues to transfer hundreds of wallet BTC.,0
Guide Trading Uncertain Market Cryptocurrency BTC Bitfinex,0
None at all Coinbase Users Coinbase BTC ETH,0
I thought about BTC Bitcoin. See Danilblinkov&#39;s idea: tradingview,0
making work yet delivery driver illustration year,0
price update usdt time btc eth xrp,0
Bitcoin Mining BTC Recovery Bitcoin Go to Binance,1
Paulserious KingHoward Still Thinking About Fixing Bitcoin,1
I&#39;d rather have a gold medal Bitcoin medal BTC,0
"Sure, Blood BTC BTC Are you ready to buy Bitcoin?",1
zerosumx sundhaug used a strange trick to hack bitcoin.,-1
Sold out k always happens at stack BTC time.,0
"Recommended yesterday, went a lot today bsc btc",1
Whales can&#39;t be manipulated Sell sorry BTC,0
"A recovery plan will be in place soon, so recover 0.",1
"Well gon na end, break the rules",0
"Runwell, the bear in waiting, told the panda to run BTC.",0
Bitcoin B&amp;B Binance Important Cryptocurrency New Year,1
airdropteam bnbbull bitcoin dao nice project peacekelly,1
Strong volume taking place on the BTC network,1
Yes time accumulates big guy BTC ETH,1
"apompliano apompliano kevinolearytv It&#39;s pretty stupid, come to btc",-1
buy the dip don&#39;t go to BTC bnb bsc,1
Bitcoin is an absolute piece of shit slow outdated technology,-1
BTC USD Sent Unknown Wallet Unknown Wallet,0
Remember when people said it was a great time to buy Bitcoin?,1
Collect better prices next week,1
Retweet and want to win the lunch jackpot Cryptocurrency Bitcoin,0
I remember exactly how late the party started,1
Computer Art Bitcoin Blockchain Last Block Height Reference,0
Forget about moving Bitcoin altcoins. Analyze trading volume prices.,-1
ripple price prediction xrp continues to outperform bitcoin,0
See the October supply shock for a nice ex post facto metric.,0
There&#39;s a reason why lbrycom needs another Bitcoin.,1
long position taken dydx pump BTC BTC,0
Thoughts Store Value Where BTC Worth Nothing Goes,-1
btc pumping k btc crypto strength occurs,1
"Look at the iron fist of the great coercist, little man.",0
Love keeps filling the bag. discount box price,1
Bitcoin rose against the US dollar yesterday.,1
A person who invested in Bitcoin but said he regrets it,1
Think of it as completely possible. Big downturn people are selling,0
I thought the K video was an Indian dude doing a cool dance.,0
I bought my first Bitcoin today.,1
"rdrlfe Yes, I called my friend to pay with Bitcoin.",1
Exciting Bitcoin Events Scotland Follow jimduffy bitcoinconfuk,1
joecarlasare bitcoin last bastion free market price,1
The entire market has been in the red for the past few weeks.,1
BTC Market Share Family Member Wait a minute,1
Popular Hardware Wallet Trezor One Earn Bitcoin,0
Grab it Satoshi Stay Market will never run out,1
Glorious Ponzi Scheme Waste People Time Electricity,-1
The main graph looks like a year graph.,0
July Purchase Fly BTC Cryptocurrency Cryptocurrency Watch,1
Advisorshares Latest Company Files Bitcoin Future ETF,1
Buying Bitcoin cannot sell half of it None,0
Swing Trends btcusdt Minute Time Zone BTC Bitcoin,1
Square Bitcoin Treasure with USD USD Bitcoin Value,0
BTC Daily Weekly One will win,0
Sailor Flag Cross Movement Period h BTC,0
"Bitcoin could last much longer, academic warns",-1
Thank you for spreading the word about Monero. This is truly everyone&#39;s portfolio.,1
What&#39;s new about Bitcoin? I&#39;m really careful about the deadline.,1
"Fuck all the BTC, Red Almighty Red",-1
Microstrategy Bitcoin Treasures Worth US Dollars,1
Whales are already craving it lol BTC Bitcoin,0
steveinmanuic fbi bitcoin steve save your neck,1
Please tell me Elon Musk&#39;s positive Bitcoin portfolio is green.,1
btcusdt m macd cross btc btc bitcoin,0
Nothing sometimes needs a price and needs to be boiled.,0
"Everyone is checking their addresses again. Anyway, it&#39;s a good reminder.",0
Inverse Cramer Index Officially Confirms Bitcoin Month,1
Newsday Dinosaurs Will Be Extinct Soon BTC,0
cryptoshillnye hey next trx fuck bitcoin bitch,-1
"k Holdin&#39;s theory, back to testing k",0
usdt has the potential for fraud big enough to demolish the cryptocurrency.,-1
Alex Dreyfus Cointelegraph Türkiye National Cryptocurrency TokenAvocado BTC,1
K wick Clear was not a news-driven dip.,0
way of speaking meme room noise speculation bitcoin,0
Last Line Applicant Bitcoin Luna BTC,-1
Bitcoin has woken up lol It&#39;s been a day but nuclear weapons have no patience,0
YouTube libonomy interoperable ocsc demo with bitcoin,0
Follow these tips for creating great content. Bitcoin Fix,1
"Yes, I agreed. The reason for thinking is over.",0
"Anyway, a lot of shitcoins are betting on black casinos.",-1
I meant please stay like bitcoin v spx,1
theelongwave gjbangar bitcoin advantage safe asset confiscation,1
I thought about BTC Bitcoin. See xcvbss idea Tradingview.,0
cryptosea moov dotmoovs coming soon bitcoin binance,0
"Even if it&#39;s short, it will probably increase the supported options somehow.",0
A crazy idea is to trade Bitcoin after the game,1
Price Update USD Time BTC ETH XRP,0
Houston Astros vs Texas Rangers Bitcoin Betting,0
"Perfect breakfast store, buy the damn deep fork.",1
BTC hr change bitcoin worth BTC stimulus,0
Actually I will be back sooner xd,0
BTC bitcoin desiciontrades ideas see Tradingview.,0
altcoindailyio bitcoin crypto Cryptocurrency exists even without Bitcoin.,1
Path Year Bitcoin Actual Change Expected Continuation,-1
Bitcoin BrainWallet Recovery Tool Python Python Bitcoin,0
Largo Plaza Bitcoin BTC ETH ADA Link,0
nikcantmine neiljacobs i want to buy bitcoin k. it&#39;s okay,1
Regulation of words that trigger the cryptocurrency Bitcoin community hahaha,-1
Order storage market Satoshi should appear,0
wallstreetsilv silverguru goldswitzerland digital gold bro bitcoin,1
Here we see that the Bitcoin bottom is not a bull trap.,0
Terra Bad Investment Cryptocurrency Runs Ponzi Scheme,-1
Anyone can buy Trezoris directly for better exchange transfers,0
Maybe the result of change is fundamentally weak and prohibits change.,0
Bitcoin looks good next week looks good,1
Opinions: Start small but earn smart Bitcoin,1
BTC USD transferred to Coinbase unknown wallet running,0
Limit purchase cash app Bitcoin purchase has been carried out.,0
"Nothing to be proud of, everyone knew, sorry buddy BTC",-1
I thought about BTC Bitcoin. See desmondlzws ideas Tradingview.,0
btctokoloshe kendallnear magdawierzycka know bitcoin ngmi well,0
k bitcoin BTC short term liquidation bybit btcusdt,0
Bitcoin Transformation Right Active Bear Passive Bull,0
BTC support discontinued btc crypto bitcoin occurs,-1
dream of seeing btc bnb eth dream,-1
cryptomichnl still thinks we will see bitcoin USD points,0
BTC I thought it was Bitcoin. See navidmemaris ideas Tradingview.,0
"You better get the crap out of the way sooner, fuck Justin Sun.",-1
Haha bull market miss meme bitcoin bitcoinetf,1
Waiting for shibainucoin. Beat Bitcoin like crazy. I&#39;m having fun watching it.,0
eth ton alt suffers huge fees.,-1
btc price h change disrupts bitcoin btc.,0
Another Arrogant Algorithm Stablecoin Failure Is Inevitable,-1
ar satoshis right satoshi ar right bitcoin,0
Give a Lucky Follower a Bitcoin Heat Weekend,0
"Yeah, leave the emotional box somewhere.",1
bull running signals bitcoin bitload,1
Buy Doge Coiner Buy Doge Shitcoin Bitcoin,1
Think of Bitcoin as unstable cash. I think you&#39;re delusional.,-1
danheld cagr financial freedom from hell thank you bitcoin,1
BTC I thought it was Bitcoin. See Maleknafaas Ideas Tradingview.,0
Bitcoin is stopped. Try diverting your attention. Bitcoin,1
BTC I thought it was Bitcoin. See fxcms ideas Tradingview.,0
Cryptocurrency Market Updates Available Bitcoin Ethereum Cryptocurrency,0
Cryptocurrency giving you the world of avenue passenger finance,1
Make me think that assets have been overvalued over the last two years.,-1
Fucking Sick Market Cryptocurrency Crypto BTC Bitcoin,-1
Help Bitcoin Collapse Turn Bullish,1
BTC I thought about Bitcoin. See Aryanouris Idea TradingView.,0
defiantnews camirusso ftxofficial question bitcoin negatively affected,0
cryptocurrency wild ride high low doge hodl,1
binanceus interest fee trading BTC dust clean,1
"It&#39;s a beginner revolution, Coinbase Kraken is ready",0
Check opensea item list via opensea bitcoin,0
btcfuel btc always bullish fud bullish signal,1
Invest in Bitcoin Cryptocurrency Investors with Some Advice Today,-1
bitzippofficial project good project bella mohdshaanu nsnoman,1
"If you want to become homeless, don&#39;t use a lot of altcoins.",-1
"Haha, be kind and the rule is no joking.",0
Eudora Funk Byron Harvey Bart Jim BTC,0
Ashbit Listing Pancake Swap Day Bitcoin Binance Smart Chain bitcoinashtech,0
I think Shib will work for much longer.,-1
I thought about BTC Bitcoin. See pchan&#39;s ideas Tradingview,0
"Yeah, Bitcoin doesn&#39;t look so good.",-1
All altcoin scams are diversifying their victims,-1
Monero is probably the best coin ATM. change your mind,1
A clear starting point to know about BTC ETH LTC,1
Think Bitcoin will change many lives. Read Pioneer Cryptocurrency,1
Please return Danheld Bitcoin someday and take it with you.,-1
Price Update USD Time BTC ETH Dot,0
Wizardia Magic PlayToUn Metaverse Bitcoin Diamante Blockchain,1
bollinger break btcusdt minute time zone BTC Bitcoin,0
Bitcoin daily closing SR expected to expand today,0
Drive Gokart and Buy NFT Bitcoin Ethereum,0
altcryptocom first BTC second eth third usdt,1
Bitcoin a week ago a month ago a year ago,0
I invested in Bitcoin at an all-time high a year ago.,-1
ford buy bitcoin buy money lose wit,-1
btc progress k abc retrace alt get,0
Watch Bitcoin Run Watch Your Doubts Disappear,1
"Let&#39;s play a sad song, the smallest violin in the world",-1
Having a lot of control over your emotions is also the same as BTC on the right.,1
Irresponsible List Token Exchange Luna Allowed Death,-1
Everyone bought K. I&#39;m not selling it. I&#39;ll be back,1
written buy dip btc btc ftm ftm,1
BTC thought likely to test k zone again,0
Larry Dunlop Kirk McPherson Regan Judson BTC,0
"If you wake up, don&#39;t give money to money manipulators.",-1
"Well, what&#39;s going on? People are panicking and selling.",-1
They complain that they hold on for a long time and make really big profits.,0
Bitcoin BTC cryptocurrency not yet rich,1
afaqshah philakonecrypto wants you to be rude to bitcoin,-1
mullvat vpn name email history bitcoin usage,1
Bitcoin a week ago a month ago a year ago,0
Bitcoin Bullrun could indexbtcusd.shytrader btcusd,0
price update usdt time btc eth xrp,0
Best Jindel One Poopcoin Buy Bitcoin Save Poopcoin,1
christopher lambert highlander bitcoin right mahler,1
Happy Friday Fiat continues to become worthless Bitcoin,1
Food Thoughts BTC Cryptocurrency Maintenance Sink,1
people trash xlm think long term,1
dogecoin b everything is going well but there are many others,-1
Using real currency can be a hell of a place,1
btc girl nft world btc nft eth,1
Bitcoin crypto trading trader checking profit market,0
Tell Cryptocurrency to Invest in Bitcoin. Go back,1
I have to say that fucking BTC trading sucks.,-1
Breaking News Post Newsletter Pleb Stacking Toe Bitcoin,0
Mark Sweet William Gallacher Sheila Freeman BTC,0
Ethereum gas fees are high so it is worth using,-1
Bitcoin supports the long bitstampbtcusd signal provider to a higher level.,1
"Yeah you&#39;re right, I can&#39;t come to that conclusion.",0
btc hold line binancebtcusdt mynameisjeffxyz bitcoin btc,0
I think it&#39;s still early this year,1
Non-KYC Exchange Trading Bitcoin Cryptocurrency Cryptocurrency,0
I really sent the wrong Bitcoin address. Wow fml,-1
Substituting for Friend One Care may be banned,-1
Opinion Trust me that sums up cryptocurrencies effectively lol.,-1
Ready Crypto Miner Pop BTC Hold Kay,0
shit coin shit coin nothing nada rien nothing,-1
"FYI, the general rule is that btccrypto doesn&#39;t reveal much to the internet.",0
The Big Picture A bear market means little for BTC.,1
rogerkver really disappointed bcash holder million friends it&#39;s expensive,-1
"Unless you&#39;ve made a purchase in the last two weeks, it&#39;s gotten a lot bigger.",1
The Bitcoin bull soon sent Bitcoin on an epic mission month.,1
Adding Fidelity Bitcoin Exposure to Existing ETFs Bitcoin Magazine,1
I thought about BTC Bitcoin. See the telofxs idea. TradingView Trading,0
It&#39;s been a month. Run again because you are annoyed and the price is high.,1
New York Mining Bitcoin Homestand Protest Nonsense,0
Go say you want freedom and keep Stevienicks bitcoin,1
evidence bitcoin hidden dark corner sub vehicle criminal,1
I lost money every time I purchased cryptocurrency. will never sell,-1
"Damn it, sleep and keep tracking. I don&#39;t know. I don&#39;t like sleeping. Damn it.",0
Mega Bitcoin dump starting right x short BTC,0
cryptobusy snakenftking good luck brother bitcoin twitter crypto,0
intocryptoverse once again provides accurate short-term Bitcoin predictions.,-1
Cryptocurrency Crash Trend Twitter Bitcoin Fall Dogecoin Bitcoin,-1
decentralized currency backed by rolandstautz bitcoin true cbdc crypto,1
Cryptocurrencies will remain a bear market territory.,-1
whalecointalk Probability Bitcoin Mining Uncertain Life Table of Contents,0
bad news bitcoin decline current exchange rate usd btc,-1
ta time btc btc I know the way super cycle wave,1
bad news bitcoin decline current exchange rate usd btc,-1
USDT worth of Bitcoin sold in last minute bulk order,0
Really tired of receiving bitcoin and bipolar year with btc,-1
People who use a lot of energy masturbate and bet a lot.,0
"Free Economy, Equal Access, Free World, BTC Creation",1
Little plays win big BTC BTC stock cryptocurrency.,1
"Oh yeah, you&#39;re right. It looks really stupid.",0
Apompliano Regular Brother Bear Season BTC K Dump,0
Actual Support Passive Support Maybe something good will happen.,-1
Change Details h Low h High Bitcoin BTC,0
Going parabolic drop imo well opinion other bitcoin hodl,0
Bitcoin Block Byte Transaction BTC Reward Information Visit,0
"Knowledge potential becomes power, and the use of power becomes BTC.",0
Bitcoin Flex The fastest way to use Bitcoin is to use Bitcoin.,0
The m portfolio traded used the k disciplined cryptocurrency Bitcoin.,1
Bitcoin currency energy potential ready burst moment stopped,1
bito bitcoin ready trade tdameritrade etfbitcoin trillionUSD puntocripto,1
Marry Christmas All Bitcoin Updates Cryptocurrency Bitcoin BTC,0
I thought about BTC Bitcoin. See Tradinghub. See Ideas Tradingview Trade.,0
two regulated exchanges lcx bullish eos lcx btc,0
arcbtc steefbtc Another Bitcoin Moment Amazing Work steefbtc,1
Tesla is currently purchasing Deep Elon with a 1 million Bitcoin investment.,-1
I like making people angry and my hobby is watching history.,0
coindcx believes btc ogn outperforms the rest of the cryptocurrencies in december.,1
Many people get burned. Learn to trust.,-1
Canica doesn’t know Bitcoin love love Canica Bitcoin,1
Public Investment Trading Bitcoin BTC Investment Weekly Returns,1
Draft submission mentioning Bitcoin to Stone Ridge Trust,0
"stevephillipsmd mangan bitcoin Fuck the talk, buy bitcoin.",1
"It doesn&#39;t matter, Bitcoin is broken, I plan on fixing it tomorrow.",-1
Humanifold blockstream shesek sorry I&#39;m interested bitcoin better coin,-1
cryptohayes I bet you won&#39;t see BTC K,-1
"If you want to buy BTC ETH coins for the long term, buy imo.",1
drawpflaum bitcolncash bitcoincashfund bchmeetups sorry im interested bitcoin cash,-1
yobitexchange yobit scam xrp steal reply post blocked,-1
I will never go back to what I learned over a set period of time.,-1
"If you want to buy BTC ETH coins for the long term, buy imo.",1
Panama could pay canal usage fees and offer discounts in BTC.,1
CEO Is the King of Bitcoin Creating a Fake Promise Problem,1
Start discussion on purchasing alternative coins Bitcoin Cryptocurrency,0
In stock thank you Illlawi freightbeneth sneakersheadsoff nft btc,1
Hot prices reach in spring binancehotusdt wildbill bitcoin crypto,0
Bitcoin Slaves There&#39;s nothing better than receiving the best collection of tributes,1
Exciting Chainbyte Bitcoin ATM import leybitcoin nayibbukele bitcoinbeach,0
I personally lost faith in Binance like I lost money.,-1
The amount of Bitcoin awarded to miners is halved in approximately one day.,0
Nini Bitcoin Bitcoin Goal Conversion Fiat Price is Meaningless,0
Think in terms of price Good time get LRC Good luck,1
Bitcoin Dead Cryptocurrency Twitter Going Fake Rekt Enjoy,-1
"America right, carry a gun. I want you, oh wait a minute",0
"Shhh, you know the king of cash apps haha.",0
Holy shit I think TV will get better at the last minute.,0
You have to buy something. Make a profit. Result le sat,0
Welcome to the whole journey BTC bitstampbtcusd voxhit bitcoin btc,0
I definitely bought gbtc roth ira account fidelity.,0
New York Clamps Bitcoin Mining Newly Passed Bill,-1
Hope you buy ammo bitcoin today at the heading gun show,1
Bitcoin Gold Still Don&#39;t Understand It Has Gained Much Value,-1
Determines the price of Bitcoin. Read the market dynamics carefully.,0
I am confident that pump dump transactions will be structured on the blockchain.,-1
"I think I&#39;m in the wrong job, so I fixed Bitcoin too",1
BTC maxi running exit k bitcoin poopcoin link,-1
Long term may be a short term goal,1
Scratch Gambling Itch Learn Investing Economy General,1
breakout bitcoin new time high index btcusd trader btcusd,1
Bearish Bitcoin Rights Retail Traders Have Terrible Dip,0
Bitcoin is currently trading in a resistance zone. Be careful. longsbtc,0
I think the advice is enough Sub Luna Nail Hall,-1
Cheat Sheet Trading Bitcoin Has Yet to Fail BTC BTC,1
"If you buy Luna, you deserve financial ruin. You are a pure scammer.",-1
Bitcoin h rejected h bearish retest see you later,0
Bitcoin Block Byte Transaction BTC Reward Information Visit,0
The drill team has moved past the core and is reporting to the next stop. australia,0
Historical Bitcoin price via Twitter today February,0
coinbase pro allows BC address withdrawals. withdrawal failed,-1
Bitcoin detects better BTC moving in positive direction,1
"It even seems bad lol, that&#39;s an even worse gamble.",-1
WSB Chairman dogecoin pressed the follow button. elonforpresident eastmankodak kodk,0
Bitcoin BTC Crypto BTC Oh oh wake up K,1
levioo kingsalman btc entered bullish mtn next Medicalchain.,1
Shaky Day Cryptocurrency Market Right BTC Binance FTX,-1
You Dropped the Ball Bitcoin Cryptocurrency Regulator SEC Commissioner,-1
Today Bitcoin Fear Greed Index Neutral Cryptocurrency Cryptocurrency,0
"Hello Mr. Whale, please pump my Bitcoin position underwater.",-1
Other exchanges were talking nonsense and their worthless native tokens were being attacked.,-1
Pumped the next day with a positive mid-mark slightly downwards.,0
Perhaps public opinion is that Monero is criminally underrated.,1
"Thedustybc doesn&#39;t know yet, but no one knows what&#39;s going on with BTC.",0
btc transfer kraken unknown wallet tx blockchain btc,0
Learn a lot and have fun. Keep learning. Follow Bitcoin.,1
Bitcoin recovery falls again at a damn crazy pace,1
Meth Addiction Symptoms Disconnect Humanity The Natural Bitcoin Way,1
Bitcoin Mining Operations Concerned in Finger Lakes Sparks Region,-1
ladyofcrypto bitcoin b cheap coming day week minutes,-1
Cryptography promotes clean energy through Bitcoin.,1
Bitcoin Block Byte Transaction BTC Reward Information Visit,0
"Unless you&#39;re pure gambling and get extremely lucky, you can win.",-1
"See you next time, Bear Glotters Cave friend.",0
Think The Final Swamp Drain Is Officially Launching ETH BTC,0
bitcoin clink k federal signal rate increase bitcoin,0
"Hi Larry, I&#39;m sad, I&#39;ve seen withdrawal times increase every year.",1
Layahheilpern Know the Correct Chinese Communist Party Bitcoin Favors,1
