text,sen
one work bitcoin binancesmartchain nft,0
taillarb tresolas deitaone gold advancing face behind btc,1
documentingbtc recent announcement banning china mining creates a new advantage crypto miner btc everyone panics that&#39;s the chance to buy bitcoin foi btc btc tradng sign robin moore whatsapp,1
"undefined and endless opportunity, joined the network called survey. win today get paid by trying new free apps social media post instant sign up sign link cashapp bitcoin bonus survey",1
Opinion that bitcoin behind should really outperform gold,1
pensou btc bitcoin ver navidmemaris idea tradingview,0
go run regression bitcoin v basket technology stock next mind please suggest palantir tesla nio alphabet feel free to add suggest basket,0
another chance buy shib cryptocurrency btc,1
btc fully deployed owning a place near btc hectic day today got a decent position done decent near general day slightly could much worse,1
I think I&#39;m feeling optimistic bitcoin,1
short one entry price stop loss link bio tz btc bitcoin one,0
price btc bitcoin crypto q,0
xrp kick btc crypto,0
like the way to think buy log cabin fam also go homeless cat need place to stay,1
people want to say want to hear think bitcoin hodl bear,0
lunar chart btc november lunar eclipse full moon taurus scorpion conjunction fixed star algol violent lunar eclipse full moon occurring fixed star called algol moontrading,0
el salvador recognized bitcoin country inho el salvador laboratory rat country watching closely performs risk factor takes a long time cryptocurrency accepted legal tender,1
ano alexa alexa bitcoin btc,0
defiantnews camirusso ftxofficial question bitcoin negatively affected,0
Worst case bitcoin price prediction using stock flow analysis could see bitcoin hit december planb crypto bitcoin,0
btc settled longa k,0
let an expert trade or youbitcoin cryptocurrency market,0
solana activatebuild metagwaratoken pointing out conxunto de lúa launch of native tokens mgt list of project that is carried out bitgert chain ready prepare guy move moon btc bitgert mgt,1
btc btc eth eth bnb bnb,0
bitcoin daily closed sr expects to expand today,0
apparently within the sf range yet,0
people selling bitcoins trying to sell get payday coming soon,1
soon people playing hot potato active bitcoin delicious endless loaded potato,1
shotsbymatta bitcoin flux kadena bitcoin price prediction crypto winter v global adoption,0
HSWAPDEX Grand Proxecto Putratzy Firdaus Broar Ht Airdrop BTC Hecochain,1
btc rejecting h sma moment can withdraw bit h considerably extended chart medium explosive move made sp nice fundamental recovery day new crypto strength,0
all bitcoin july th inner workings powered revealed daily failure mairead mcguiness money laundering meme review rawavocado sponsor cryptocloaks host bitvolt coinicarus,0
one knows you spent a lot of time correcting and I don&#39;t see you coming back for a long time,0
ok thanks man,1
swedish convict gets millions of bitcoins returned twenty nothing bitcoin cryptocurrency,1
"longest podcast hour, minute, rambling, rambling, bitcoin, crypto, btc, mattysats, cryptocurrencies conservator, mashinsky, alexandrelores, infinitetimesme, kryptovski",0
Next bitcoin price update event,0
Bitcoin mempool tx summary last second average average max. block height nob quantity,0
finally it&#39;s nice to see that bitcoin built last weeks overvalued stock market would still be,1
bitcoin technical score btc bitcoin technical,0
The power of money widening the wealth gap is not an accidental use of the bitcoin oligarchic empire really easy to understand,1
looking for shorting btc update soon,0
yes signing executive order,0
lenfantbon opinion asking inflation resulted in rapid expansion or monetary supply strong decline market price bitcoin denominated dollar,1
Many people tend to sell the holding price get high enough pay off the mortgage retire fulfill the life goal,0
buy gun ammo for bitcoins,1
bitcoin block byte transaction btc reward information visit,0
rsi will btcusdt minimum time frame btc bitcoin click chart,0
Bitcoin chart interpretation,0
satsdart bitcoin btc btc adx shows weekly trend of false bull,0
"I&#39;m tech savvy, I use a computer, stream games, watch porn, I don&#39;t often use vpnstor either, a safer money exchange.",1
pensou btc bitcoin ver danilblinkovs idea tradingview,0
deeply understand bitcoin perform flawless global solution and wealth preservation project still experience including ethereum,1
michael saylors microstrategy bought more m bitcoin company revealed buy bitcoin bringing total coin hold put bitcoin mouth taken another level,1
practice finite oil finite gold finite silver finite real estate finite bitcoin finite though finite best store value,1
bitcoin block byte transaction btc reward information visit,0
eudora funk byron harvey bart jim btc,0
ascending triangle break break volume expect to see BTC rank the next day maintains support resistance in case of bitcoin falsification,0
knrubar johalmiles fed planned error always pretend to know bitcoin pretend anything,1
i think bitcoin is very life changing read pioneercryptocurrecy,1
huobi primelist new listing flz sale seize opportunity lead wealth deposit trade open june click link join detail crypto btc nfts,0
gegelsmr imagine taking every cash loan get a bitcoin like wtf,0
beehive hut bitf btbt great buying opportunity btc mining stocks have made profits along the way running stocks sell hallelujah reloaded everyone else worry hang onbitcoin probably come back today week,1
ninny bitcoin bitcoin target conversion fiat price pointless,0
the amount of bitcoins awarded to the miner was cut in half by about a day,0
btc bitcoin massive reverse head shoulder break see k rovercrc,0
ridiculously high coinbase fee tell people coinbase account transfer gdax withdraw free weigh ask free gdax not free coinbase,0
imagine the impact bitcoin lightning node management automated growth takes hahaha fiat shitcoins go poof,1
mcshanewrites buys bitcoin buys hamstercoin,1
it was k right massive dive celebrated half happy kid atm,1
lose sell accumulated loss last bear market keep buying dip along the way march buy lots you are ss wealth hodl accumulate repeat whenever possible ignore price chat otherwise speculate btc,1
end diagonal stained btc play well bitcoin go k zone many confirmations suggesting see opinion say bitcoin,1
oh look good today bitcoin,0
beautyofhelin would still hold bitcoins plus the world would never despise btc,1
btc buying pressure alert price around bitcoin crypto btc,0
raining blood but killer make money blood trade left run sleeping stop loss tight fast sniper trade sxp btc eth itsallaboutstructure,1
usually yes basically hot wallet secure properly watchtower etc,0
Michael Saylor bought bitcoins Salvador bought bitcoins Elon Musk bought bitcoins Smart Whale I don&#39;t want to follow the bottom of the bought market,0
nothing like receiving the best Bitcoin slave tribute,1
Feels like the quick lock coming btc,0
altcryptocom look saniwith extreme amount burned lp token important long term view choose sani keep win future bitcoin sanin,0
got a full part of the bitcoin node waiting for the cryptocloaks case exciting moment,0
buy dip non boos btc bnb bsc,1
New falling bitcoin price zone detected unlock btc zone detection join telegram group pm u trial period group ended prediction,0
Bitcoin freedom saves lives,1
stay scared want btfd ltc btc,1
long position taken dydx pump btc btc,0
all the human behavior that&#39;s going on i think an excellent time enters sure slowly greedy metisdao sovrynbtc btc eth chart say still reflects something slower,1
purchase of alternative currencies let&#39;s start the discussion cryptocurrency bitcoin,0
binance recupera m fund conectado ronin bridge exploit btc cryptonews nft,0
bryce harper rock masivo phillies chain onwards philliesbraves xogo mlb bitcoin sportsbooks,0
like sweet dca drop,1
shanethazel tomerstrolight regain strength move towards ak started important thing consider wait k soon btcanne specialist super underrated great insight advice ta btc taking seriously continue,1
inflation one thing everyone sees matters difficult establishment try to hide tip eat potato cheap nutrition currently a main post reddit life realprotip bitcoin ngmi,1
btc d return trendline july,0
btc the last block information block holds the total bitcoin transaction including block reward block size byte,0
bitcoin best used peer peer work best way batch fee,1
bart back bitcoin crypto btc,0
"coal, oil, gas, received tn bank from paris, climate deal bitcoin mining big deal hmkaaay neutral sentiment world&#39;s largest bank report",0
scarcity internet once discovery resistance repeated replicability invention knut svanholm,0
btc scalp long microscopic profit two strands rejecting push up equal low below can be swept again,0
bitcoin ecash continuation bitcoin cash project continues development bitcoin abc ecash ecash protocol reinvested income ecash funds allocated annually gnc global network board,0
twitter btc plan action coinbase oversubscribed nfts news crypto btc,0
cash purchase limit the bitcoin purchase application was,0
fucking confusing indo btc,0
wojespn adamschefter btc invest cryptysophia today aim for life to turn around and start earning daily contact administrator via telegram cryptysophia,1
apompliano vulkania supply millions burned distribute the remaining millions wallet circulation also millions around the joke big project coming a crypto league from the month think zenkin vlk mdtusdt btc,0
squawkcnbc scaramucci says that btc hit k year as average bitcoin bill,1
bitcoin change planet earth private part,1
The question assumes a current market leader crypto btc name recognition top tech step maybe immediate future maybe point generally top tech win,1
may shiba inu has seen a sudden surge in popularity driving the price around an all-time high according to coinmarketcap data via newsweek investsmart bitcoin cryptocurrency,1
"Bitcoin crypto becomes a useful day, I hope the video drops tonight",1
k mecha clear was not news driven dive,0
the look graph could be solved possible,0
shhhh king money app you know better lol,0
I will find the lambo bridge wrong,0
it&#39;s not broken it doesn&#39;t fix bitcoin,1
the bitcoin master teaching him patience,1
last minute crap better tv that&#39;s for sure,0
I can finally pull the trigger investing a month ago around ak regardless finally I can invest wanting a lot of time I&#39;m investing k atm I&#39;m sure go transaction first go to coinbase apparently easy people saying use gdax opened the thread kind of said transfer gatehub from gdax never heard ask for advice is good use cb am really btc how am I trading daily constantly changing alt currency trying to make profit everyday,0
jeevsthecurious i love btc finite supply own any amount using mobile phone internet connection completely secure globally controlled government hacked,1
Indian payments giant Paytm could offer bitcoin service,1
ha ha you&#39;re stuck time join you messy year you really need to rest your step get real time bitcoins technology need function investment hedging inflation join you know what you know fact vast majority transaction bitcoin buy sell trade investment use of currency might well explode enough people btc speculative investment a long time ago development capture demand use of currency grow currency takes a long time gain mass adoption year small blip there is a rush pass take the first step,1
the whole world revolves around the united states unlikely news has affected the rest of the crypto world,0
move keeping coinbase anyway it&#39;s funny that anyone is having trouble connecting,0
cryptohellspawn i think a smart idea empowers the corporation currency of the nation sarcasm let money print possibly go wrong Bitcoin tether,1
crypto btc starts tomorrow,0
speculate need bitcoinlightning use part of remittances do all business model work some business mentioned win win user plus prof lightning scale genius,1
breakout bitcoin new time high indexbtcusd trader btcusd,1
the whale that goes x is lol btc bitcoin,0
suscanicola ryanvieira hodlberry thorchain also said the bitcoin loan liquidation risk,1
country paying bitcoin something new,0
personal prediction bitcoin the next day today got a lot of volatility due to CPI data almost a million dollars was liquidated get strong support every time you show me optimistic ta btc crypto btc,1
monday august hr moscow time lot supply realtime blockchain price btc pay ub coin buy lot realtime btc blockchain value less service price,0
intocryptover exactly trading bitcoins high leverage very enthusiastic three day movement falling,0
thursday volatile expected day inflation data released bitcoin fell to lowest price level since september 1 however trader amid stop bleeding btc sp quickly recovered,0
people enough the nation understands the banking monetary system believe that the revolution tomorrow morning henry ford bitcoin,1
microstrategy I pull another bitcoin despite the price fails through decryptmedia bitcoin microstrategy cryptomoneda,1
Meitu hold million btc ether latest bitcoin purchase bitcoinnews,1
sure lol mr nostradamus still a billion,1
poured would be a demoralizing event bitcoin good thing there supply shock,1
everyone calm down damn bitcoins done hit a new high people act like never dipped investment recovered investment treated looking fast pump dump well it&#39;s done dumb can well hodl,0
ligazón buy blockchaincom explorer,0
remember college researching buy bitcoin currency afraid of losing a lot of money understand investment regret learning experience,0
Sometimes the time trading does not go better than relaxing like a poster that does not stay tomorrow.,1
thanks support folk risk anything lose much care hodling long term joy,1
zbdplay favorite secure gran integration bitcoin I&#39;m waiting sarutobi mellor un meplevorzbdgg,1
cryptocurrency sending out monthly newsletter since it said that next week it will release the bitcoin btc mobile app,0
bitcoin rise early morning long term see a way to go bitcoin price that is if it also feels like get ready to arrive t-shirt bitcoin launch wear bitcoin orange pride passion btc,1
the next mayor of new york wants to pay bitcoins newyork btc crypto,1
big name big project big opportunity buy trilly facer milly mcontent bitcoin documentary el salvador v world bank fall september where safemoon dogearmy peep know go,1
stockmarketpr people usually think that bitcoin high wait until k october k end of year price year wait bitcoin following jorgevr tweet post tip prediction massively added keeping amazing,1
people believe btc mining always damages the planet stay in the hydrobalenor club using renewable energy makes mine rich saving planet time,1
supposed three-digit people tend to speak amplify position especially around the part,0
"if the unusual enough support starts working today, hopefully it will start soon",0
btc started the process accelerate the realization mirror reflection heaven earth within the perception btc evangelist,1
bitcoin day h cambio USD prezo indefinido btc bitcoin,0
Someone explain why the bank doesn&#39;t make payments on the weekend like people who manually fix bitcoin carl b menger,1
a small step exchange a giant leap crypto community craft the usdt spot market allows the privileged community to join the market bitcoincafeswapfinance fail innovation spin success,1
Money printing seems to end with bitcoins,0
new report bitcoin filing entity digihost technology inc name frb registration statement ex filing report form,0
I&#39;m sure you purchased gbtc roth ira account loyalty,0
silly btc trading pair,0
believe that the project strong charity team made an excellent effort a great development makes the best minute BTC crypto,1
bitcoin btc supply amount last active aa reached max month btc previous month btc observed june see metric,0
bybitofficials start june th am utc still time sign up join tealstreet team bitcoin bybit wsot,0
beautyofhelin is not ready to feel bitcoin go a greater innovation the st century still ball sys change cause history,1
abc correction th wave bitcoin btc,0
Welcome to complete viaxe btc bitstampbtcusd voxhit bitcoin btc,0
blk back blackcoinorg another chart update the last day showed an interesting development higher volume price peak exit long-term descending channel put positive crypto accumulation course btc,1
Bitcoin ethereum trading slightly new funding rate all time high future premium positive territory almost overheated may fail btc eth ethbtc sol dot atom ltc,0
mikealfred celsius chapter presentation bankruptcy hope regulator use opportunity bash bitcoin instead of fast track legislation prevent bad actor like mashinsky from using customer funds bets,0
gold market capitalization bitcoin market capitalization b bitcoin progress surpassing gold,0
much learn enjoy continued learning follow bitcoin,1
I say I could a guy in number flexible enough,0
c mon atún grande release,1
coidado overnight usd jpy gold ustyear yield bitcoin dn riskoff buying emini future bomb option maket manufacturer trying to kill vix uvxy call premium,0
Miller Bitcoin Bull said investor Bill Miller crypto bitcoin digital gold youtube btc btc started buying coins,1
exactly people who talk about whale attack think people invested a lot of money crypto live life playing the mind game ocean joe people who invest money want to make money period,0
Email point already sent get gbtc gap approval overnight,0
long skl entry price stop loss link bio tz btc bitcoin skl,0
episode magazine bitcoin podcast host cksnarks sitting infamous bitcoin twitter personality troll udiwertheimer hard drive bitcoin faithful worried altcoins,0
bitcoin block byte transaction btc reward information visit,0
h chart of btcs target currently btcs price holds broken resistance trend positioned according to technical escalation reach target may still be in early stage bitcoin ir,1
benefit m volume sky pump megapump powerful bomb binance history non,1
he thinks he&#39;s going to start running next year,1
The elaborate protection store of the password-protected recovery seed method seems like a weak link,0
trap sell k go k night think put money save little reserve case big accident buy fresh currency course time market sell accident time open champagne long term bitcoin always win,1
bitcoin btc current price gbp enjoy reading the blog tip bcqtuzhlzexuueatkrrhajm,0
ar satoshis right satoshi ar right bitcoin,0
gm welcome anon btc,0
everyone seems to be talking,0
fschaeffler btc shib king,1
btc mil perwho care bought,1
barron bitcoin cover october,0
alternative price from week bitcoin btc bitcoin lunarshare lunarcrush,0
whale stacking ape ftx sand link ftx bullish sentiment has hit the bitcoin crypto market,1
broker encouraging trading of UK clients foreign firm regulator fca has already taken action broker read cryptocurrency bitcoin forex,0
Google has released a new crypto search feature that synchronizes eth wallet address balance etherscan start bitcoin goog eth,0
newbie revolut though prepared coinbase kraken,0
bitcoin secret patience buying a consistent basis through weekly plan month stick think short term goal long term bitcoin,1
Network growth continues to increase at the fastest pace historical number Short-term catalyst could solidify the network effect formed really brings bitcoin millions of people bitcoin lightningnetwork,1
peterschiff michaelsaylor bitcoin new renaissance via youtube bitcoin the,1
oof good bounce straight btc telegram channel jasmine crypto premium btc eth bravo,1
ceo de messari ryan selkis bitcoin stablecoins crypto regulation crypto news live media cryptocurrency crypto bitcoin,0
last hour bitcoin mempool tx statistics average average max. height of block nob how much,0
check or list opensea items via opensea bitcoin,0
johalmiles btc CEO confirm,0
ugly locks that are hard to leave behind,0
ralf glabischnig crypto valley crypto oasis btc cryptonews nft,0
i want to give a listen lawrencelepard play park cover everything host macro topic potential recession rotation brics european currency energy crisis japan bitcoin everything you know think,0
p note added two columns I think the continuous change of the business day also added the average of the day of the third volume column can not explain the tweet I think the new data provides valuable information in the future go btc,1
I want to see bitcoin first,0
airdropdet amazing nice project hope the project is successful join the support type aagameruga atriantoko gillankperdhana digital bitcoin airdrop improvement,1
Realvision Raoulgmi Maggielake maybe asked the wrong question correction bitcoin media dow nasdaq stock market,0
market impact haithamalghais address g energy transition ministerial meeting bali bitcoin,0
Coinbureau&#39;s analytical team has done a detailed analysis on btc fear greed index neutral moment price usd think the current state of bitcoin,0
Money is untraceable many countries would still allow it may slow down bitcoin adoption may even increase interest regardless of how effective it is to prevent bitcoin exchange from slowing down perhaps stopping it would actually benefit the government in the long run.,0
btc quote waiting background,0
thedustybc i am still long btc recommended short determination get rich keeping accumulating cvp also great altcoin long term investment currently a productive gem hidden space,0
watcherguru wclementeiii a decentralized bitcoin protocol,0
nftholding darrenpromoter btc consolidating around k level bearish momentum exhausting lowest possible short term leg grab liquidity kk likely follow kimcaden undervalued bitcoiner tweet tip help,0
cripto nerd sabe farm bitcoin tarkov,1
support btc btc k,0
hourly bitcoin statistics block hashrate ehs price last hours fast rate sat slow rate sat tx differential unconfirmed diff exchange block next diff block,0
Summary of bitcoin mempool rate segunda media media max. interval when nob block height feevb,0
next year will be amazing,1
stop thinking you could make money trade buy down sell seriously forget to pull constantly sometimes time will not go up trend how long term you will lose bitcoins how almost everyone can still make money compensated uptrend almost simply a holding point buy wait seriously week two three four you will get profits near future extreme dive yes profit even could time perfectly sell buy back confidence dive won&#39;t be able,1
worry look bigger picture k seen under ten years old keep dca ing k milestone increase about a hundred dollars end day nothing near projected,1
buy bitcoins get rich dismantle main control mechanism of the state control fiat money get rich a positive side effect choose freedom voluntary peaceful money forced money authorized,1
ada update payment link bio crypto signal doge ocean btc omg xrp dogecoin cardano enj tomo sxp sol eth bitcoin,0
princeysov people think bitcoin is high wait till the end of the month ko end of the year follow abtc super underrated bitcoiner following tweet advice seriously very cool btc,1
wait for the full moon and you&#39;ll see,1
cryptoednl tends to agree with everything rational BTC seller would not sell massive volume all weekend long,0
just could happen one could think short would pile thing that happen long squeeze,0
bitcoin approached fib zone everything looks bullish key obstacle hitpass see btc behavior,1
keep accumulating keep betting keep holding keep building bitcoin shib torg dfi ada xrp bnb eth,1
year won&#39;t matter buy bitcoin important thing shopping buy bank transfer credit card apple pay google pay,1
bitcoin block byte transaction btc reward information visit,0
icoffenderii yellow first day bitcoin,1
bitcoin ethereum trying to stay kk weekend incoming red week jumping begging leg finally oversold completely thought btceth falling down k week,0
anyone in empty dry powder can take advantage of subk bitcoin rn breathe well dca today worth dca bitcoins back k loooong way cant btd save future dca,1
daily shopping strike application since the beginning of December,1
fasb liquidate fair value accounting measuring bitcoin crypto assets,0
intocryptover agreed time bitcoin strengthens excuse accumulating right,1
bitcoin measure still beauty foam compensation reaffirmation last month could still go b,1
bolsa de ofertas crawfordporter bout set sept bitcoin sportsbook,0
btc derivs sheet tweet every min cme delayed min g delayed min oi share,0
iyiprofil is going to fly soon need to look for an alternative hard fork like bitcoinlatinum looking to bring better greener cheaper btc i really think the fork keep improving Satoshi&#39;s work,1
leavescrypto truly understand bitcoin would never bet bitcoin bullish trading payday everyone however follow ray super underrated great bitcoiner,1
btc prezo h cambio stonks bitcoin btc,0
I love bottlepay app beautiful ui recommend to other uk bitcoiners stackinsats btc,1
makerofttools muatafagmi adamus blockstreamtalk funny people quickly forget money technology money accounting keep problem bitcoin solve fair score decentralized money linear way a book counts everything else layer,1
buying down great the average buying price down makes bitcoins cheaper overall,1
ten lil btc eth tranquilo fomo shhhhhhhhhhhhhhhh k shhhh,0
nftworldnews would make a great pow coin coin except bitcoin maybe eth can beat bitcoin i think it proves randomness become another much admired protocol blockchain technology rise in popularity,1
elonmusk btc mtn money do-it-yourself rico Medicalchain do-it-yourself millionaire,1
