text,sen
let&#39;s say go day trading no matter what the price go course years regardless,0
bitcoin btc mining nate food co buy sj pro bitcoin mining operations news,0
see bitcoin consolidation hoping last week ethereum looked even better technical bitcoin ask,-1
bitcoin needs rest needs time learn surfin bitcoin panel via bigcoinpge bitcoin crypto news,0
mythic game raising millions series c funding round led az bitcoin news bitcoin,1
dip dobitak sudda svetjati ljudi k minimum eoy btc hodl chill investirati bitcoin,1
ide prodaja im gon na get fat bitcoin sell people going call whale,1
kristinekrypto top bag off dfi defichain massive upside of decentralized finance bitcoin sounds great,1
ok the ban actually happened let me think the price is still strong considering bitcoin btc ctm,0
crypto implode celsius go eth take beating billion lost know coinbase made announcement,-1
although it would identically be cool af play imo to highlight the area diagram hypothetically bitcoin simplet,0
gradybooch bitcoin doesn&#39;t belong on an exchange the exact reason twitter genius knows all about it,-1
good news bitcoin cme gap closed recent layoff due to higher expected cpi number,0
markmoss coin federally regulated go all bitcoin has created many idiots making crypto worse,-1
bitcoin btc plan vacation week tag search back mid k possible k weekend,0
ahmadosiddiqi read thread say gold standard better argentina suggest people improve life bitcoin,1
typical rbitcoin user who used grandma birthday money buy btc he cries he,-1
dont see would sell luna right people got a chance to sell instead of obviously take,-1
btc btc k destroyed saturday pump k monday retest will fill the gap maybe,0
bitcoin measure still beauty lather cleaning firming last month could still disappear b,1
oof good bounce straight btc telegram kanal jasmine crypto premium btc eth bravo,1
I absolutely love the bottlepay app nice looking user interface recommend to fellow UK bitcoiners stackinsats btc,1
michaelmwebe fighting president nmwendwa busy trading bitcoin crypto linkedin new business venture swerriapp,1
developer ecosystem eth make one seems like a community eth let fail easily adaptable,1
themooncarl missed btc level missed the biggest opportunity inari collect last week tokeninari inariraffle,0
bought ico by coin holds everything sold a month ago helped buy a bigger house,1
andydestroyer ne buy btc bsv bitcoin ne prati hype crowd andy govori kurtwuckertjr,-1
coercion coexistence el salvador bitcoin law may change global finance cointelegraph magazine cointelegraph,0
centralbanktrf turkey follows el salvador would see deflation economy immediately thinks btc btc,1
whale stacking ape ftx sand link ftx bullish sentiment hit crypto market bitcoin,1
big bitcoin recovery inevitable seller loses confidence says crypto analyst nicholas merten,-1
cryptocrash bitcoin unfounded investment crypto currency run computer institutional structure aman agrawal wednesdaythought,-1
send vrijedan bitcoin friend see long take send vrijedan nano see long take,0
bitcoin ethereum tron xrp worth looted massive crypto exchange hacking ethereum bitcoin via,-1
btc little pump rejecting r mentioned earlier link video sub no longer eth tradingpsychology,0
every coin outside of bitcoin ethereum invented only the creator would be enriched by a different one,-1
spomenuti bitcoin devsusersminers trinity keeping provjeriti nešto po coin dont user beying devs,1
demand bitcoin go logically start replacing fiat currency maybe one day global reserve,1
important spread time although bearish sound i believe survive real crypto winter many alt,1
look wrong lmao accept wrong everyone voted against crystal ball think know happen next,0
microstrategy put another m bitcoin despite falling price k via decryptmedia bitcoin microstrategy cryptocurrency,1
utc btc price rise currently rising change since midnight bitcoin btcusd btcusd btc,0
"yes, as always say, changing currency, talking about the next version of the ipad, it takes time",1
what&#39;s the big deal i can&#39;t actually use bitcoin as a legal tender bitcoin has never been controlled for legality,0
cryptocurrency has been sending out a monthly newsletter since the release of a mobile app was announced next week bitcoin btc,0
btc introduced process accelerate realization mirror reflection sky earth within perception btc evangelist,1
as seen in the last couple of days being manipulated by big corporation shit fear last time,-1
finally nice to see bitcoin projected the past days weeks overvalued stock market popping bitcoin still,1
I want to make money as the problem is sure of the future to hold against the bad press that&#39;s for sure,-1
heeeyy anon try relax im Mr Beeseeks email me mrbeeseekshodlrodeo lazybitcoinization bitcoin btc,0
I used Kraken Small x Leverage Longs rollover fees every hour seemed expensive,-1
apecoin is going to become a worse version of shib i.e. enough pump still dump logic reason,-1
possibility of dumping worsen burning goes or circulation supply didn&#39;t change coin lol,-1
laughing bitcoin beanie baby first day brought value instead would laugh millionaire even,1
holding hold tight popravi se take low dive shoot moon kriptovaluta binance bitcoin,1
every move make risky every ship sail risk fact power courage make face,1
mattwallace elonmusk therationalroot say bet bitcoin dogecoin more currency time see adopt,1
metaufo najloji airdrop ikad poput svetnogo projekta ashenafimeaza gautamgambhir flintoff bitcoin utk tct,1
remember i will say bitcoin never goes down favorite ct influencers listen carefully,-1
baltimore orioles adley rutschman provides spark gunnar hendersons arrival flippin bat bitcoin sportsbook,0
anyone understand bitcoin clinging sure arent blasting k feed bearish enough pain please,0
found a good home another print paid bitcoin want trade btc art let m,1
part first bitcoin rise longs accumulate end of period price return exactly started decline,0
gm everyone chooses build the future a better system stop building legacy technology bitcoin revofico,1
useless stupidlynamed greed token boast apy see spam continuously rcryptomoonshots absolutely safe investment,-1
small chance btc price could hit k say dollar trader cool bitcoin,-1
kshib long alert ticker kshib market kshibperp volume price btc btc eth eth,0
live scene petergwall typing march operational update rn new mining equipment churning thro,0
new feature help reporting wrong misinformation bitcoin people like elonmusk mcubana thanks jack,1
history has always produced heroes despair greater depth of time despair greater hero bitcoin emerges,1
trillionusd bitcoin seems bearish metrics still bullish I think it will come in the new year,1
bad bitcoin triangle sine june th really missing volume pump cctipcom airdrop eth,-1
mass love exodusio never saw the coming reality i feel blessed alhamdulillah exoduswallet crypto freedom bitcoin,1
love technology damn cool mixed current upcoming technology i will continue the wild ride,1
bitcoin rallied in asia last night as asia doesn&#39;t care about the infrastructure bill,1
balance feed see k usd btc before later imo btc bitcoin cryptocurrencies btcusd,1
btc short deribit btc perp learn job i want a friend get a dog carl icahn,0
bitcoin always works find new highs shitcoins always works find new lows understanding,1
watching tesla market saw tesla model smoke dodge demon impressive investment ethereum bitcoin,0
ide prodaja im gon na get fat bitcoin sell people going call whale,1
hanging irl last day happy see btc pump little today else missed the weekend,1
collision of two stars creates a black hole happens bitcoin collision defi portalfinance know the answer,0
think dependable pick right stablecoin manage risk accordingly generally higher return higher risk,1
talking next two years slowly going to receive luna token supposed trust two years,-1
mean daily volume mean value of daily active user mean value of positive price long term,1
eth short alert ticker eth market ethperp volume price btc btc eth eth,0
central african republic adopted bitcoin reference currency office presidency btc cryptonews nft btc,1
fair guy sub made guide make shitcoin literally called buttcoin pumped surprised point,-1
apompliano wants the country to replace the old fiat-prone personality of the leader like nayibbukele bitcoin,1
people soon realize to order crap coin like ada pump has to pump bitcoin first,1
never calm see net worth take absolute nose dive real time epic bitcoin,-1
sure hash rate price i think btc miners regular rate supply rate remains consistent,0
btc derivs sheet tweet every min cme delayed min g delayed min oi share,0
good crypto refueling electricity consumption waste produced along side huge apart speculation crypto use,-1
well hell get it wherever the community doesn&#39;t support the project fails finally implement burn lunc guess,-1
bought cro for the first time start tanking the next day the whole crypto market go learned a lesson,-1
"you&#39;re wrong, you know bitcoin pumping for two weeks, don&#39;t expect pumping for the next two weeks",1
I absolutely don&#39;t want to be worried though unfortunately I&#39;m worried enough in the dollar I&#39;m glad I&#39;m holding bitcoin,1
bitcoin mempool tx statistika last minute mean median max th quant nob block height,0
realvision raoulgmi maggielake maybe asked the wrong question correction bitcoin mean dow nasdaq stock market,0
btc derivs sheet tweet every min cme delayed min g delayed min oi share,0
panicked put money on house deposit gon na chill right believe bitcoin go tell family,1
preach brother dear ltc final occupation focusing on privacy deciding factor hold ccd monero,1
bitcoin mempool currently mb transaction pending block total fee transaction sat mean fee satvb,0
i want to learn to do central banking petrodollar printed money actually get circulation etc book recommendation,0
btc derivs sheet tweet every min cme delayed min g delayed min oi share,0
russian crypto market worth b despite bad regulation say exec cryptocurrency bitcoin technical analysis,1
elonmusk fix money make child affordable jeff chata bit system place bitcoin technology help,1
safe leave node unattended safe check enable monitoring attend bitcoinconfeur tabconf bitcoin lightningnetwork,0
btc free signal future btcusdt input le x max put max total future tp,0
sold bought many occasions portfolio red from the beginning real game shark knows cheat code,-1
bought bitcoin for the first time I honestly loved the idea of sending money online without trust it seemed revolutionary right,1
made a prediction back may price action after pretty close hope continues aave bitcoin crypto,1
citizenbitcoin thinking bitcoin selling ask someone buying investing safe crypto strategy achieving financial goal,1
bitcoin btc bitcoin hit k advance July inflation report one fractal hint looming correction,0
btc hovering to today interest rate increase basis point announcement of the historically largest increase in years,1
trolling serious advice I don&#39;t want to lose money means won&#39;t owe anything and still a lot,0
btc derivs sheet tweet every min cme delayed min g delayed min oi share,0
viable reset eot look good go let computer manage price time cycle remove,0
people dca alcohol every weekend many things buy wasteful excessive unnecessary stack sat btc,1
bitcoin got close fib area everything looks bullish key obstacle hitpass see behavior btc,1
fair could happen one would think short a bunch thing should happen long squeeze,0
i want to learn to do central banking petrodollar printed money actually get circulation etc book recommendation,0
cryptoednl usually agrees but a rational btc seller wouldn&#39;t sell large amounts on a long weekend,0
btc derivs sheet tweet every min cme delayed min g delayed min oi share,0
maybe a little half as fast as getting a dca maybe a day shopping thing I really want to go,1
started playing seems great far also love the idea of getting coins listed anywhere believe great,1
btc derivs sheet tweet every min cme delayed min g delayed min oi share,0
time i ever used a crypto gambling site illegal purchase even pain in the balls to settle,-1
btc price squeezed higher low lower high hourly breakout determine next direction,0
bitcoin btc perp oi climbing funding falling negative bounce seems short lived could become ridiculous,0
like way thinking buy log cabin fam also go beskućnik cat need place stay,1
philakonecrypto bitcoin maybe illegally found child pornography link embed blockchain maybe reason for panic selloff,-1
tune tesla bitcoin bet rising yield ed take bank real vision finance business,0
hmmmm raoul become a cathie fanboy sorry maybe always pay attention arkk tsla bitcoin,0
ok channel still worth dunk atm btc medium channel market structure becomes bullish min,1
bull take control must see price quickly revisit k bitcoin btc btc eth bnb,1
russia implement plan disconnect internet limit internal addressing medium hashrate btc go therefore price,-1
bitcoin bull despair leading model predicting the trajectory of bitcoin say still track hit tripledigit btc,1
want someone else bag holder shitcoin bail bad choice rising btc crypto celsiusnetwork,-1
dogecoin plain easy way to pay crypto nothing fancy overcomplicated everyone understands the greatest power,1
absolutely amazing stuff fan investor bitcoin company thanks woonomic providing you great information,1
"I agree, I don&#39;t care I believe I want to make a point making an exaggerated claim it would seem something I want to believe",-1
indian crypto exchange btc trading volume hours zebpay btc coindcx btc wazirx btc bitcoin btc,0
aave short exchange alert ftx market aave perp volume price btc btc eth eth,0
the cryptocurrency community withstood the pressure sell abandon hope bitcoin altcoin dip hello go forward prosper,1
bearish cautious view range overly bullish so retest range low seems likely bitcoin btc,0
btc derivs sheet tweet every min cme delayed min g delayed min oi share,0
latest news Central African Republic passes law to adopt bitcoin legal tender amp like domino,1
senlummis bitcoin integration priority proposal hope mix altcoin security ethical company trying to capitalize on the moment,1
ananavarro earn money btc altcoin learn earn increase money complain follow via telegram cryptysophia,1
bitcoin first player decentralized crypto market these are good people who also use many options,1
enjoying the annual rush of people wanting to go to the gym many ideas gone month the amount of selfies incredible,0
bitcoin mempool tx summary last second mean mid max th quant nob block height,0
know every sale there buyer right buy fear sell greed desire could dca road dca,1
btc derivs sheet tweet every min cme delayed min g delayed min oi share,0
imagine the impact of bitcoin lightning node management automated growth take hahaha fiat shitcoins go poof,1
good to see something good related to price safety is happening good crap dear investment good future,1
danheld bitcoin saving account too austria tax bitcoin gain ups buy hodl trade bitcoin,1
cryptengineer heard strikeex bitcoin crash strikeex constantly rising big thing happening great project strikeexofficial,-1
hate finance bros take bitcoin pegged fiat bitcoin could hedge inflation suposposed finance bros,-1
dot long alert exchange ftx market dot perp volume price btc btc eth eth,0
k combined bitcoin btc short liquidation last minute huobi k binance k bybit k,0
atom long exchange alert ftx market atom perp volume price btc btc eth eth,0
"I&#39;m really asking a stranger an important question, I&#39;m sure I&#39;ll get a benevolent answer, I probably need professional advice",0
China&#39;s central bank bans banks that offer financial services from trading cryptocurrencies like bitcoin,-1
foldapp omg game much fun fix first time guy sat metaverse foldapp btc,1
still mild bullish divergence bitcoin throw tic tac toe indicator circle beat cryptocurrency theindicator,1
ovisi novi ath hit k dip back k still spot end one predict future,0
btc derivs sheet tweet every min cme delayed min g delayed min oi share,0
garyblack unless elonmusk integrates tech tesla solar make bitcoin mining much greener energy efficient,1
remember michaelsaylor becoming a clown borrowing millions buy bitcoin k michael please send condolences bear,1
knownews bitcoin eth australian major league baseball team perth heat pay player bitcoin hold,1
look like cathie autosmash buy mode level million worth gbtc stake last week bitcoin,1
btc derivs sheet tweet every min cme delayed min g delayed min oi share,0
btc broke k support hear investment apps uninstalled twitter common sense gon na die,0
jamie dimon remains bitcoin skeptic citing bitcoin regulated government click detail leapwealth texasadvisor bitcoin,-1
stay focused think about the goal you won&#39;t regret trading cryptocurrency bitcoin btc bnb big adjustment inevitable,1
minute they look like btc price Fed rate hike already maybe people are slow to react bitcoin today,0
bitcoin mempool currently mb transaction pending block total fee transaction sat mean fee satvb,0
cortrobinson anarchocanadian comicdavesmith patrickbetdavid guyswann sum total wealth included bitcoin network easy stay decentralized,1
btc derivs sheet tweet every min cme delayed min g delayed min oi share,0
btc usd move multiple address unknown wallet date gmt blockchain bitcoin symbol btc detail,0
ha hen sir shell make two weeks maybe interest rooster leg three eggs each,0
a good portion of the alt actually built ethereum first mover advantage actually well would not today is not,1
btc nayibbukele presidenciasv bought el salvador average price worth a million buying time worth a million,1
bez panike prodaj dip remember shib damped x spike buythedip kriptovalute btc shib dinger,1
bitcoin mempool current mb transaction pending block total fee transaction sat mean fee satvb,0
yield from high interest earn program crypto loan already quite large become huge disruptive cefi,1
silk road bitcoin stash used pay ross ulbrichts milijun fine decrypt actadi btc bitcoin,0
bitcoin mempool tx statistika last minute mean median max th quant nob block height,0
setback sec case ripple sudac order release hinman govor ethereum nfts crypto cryptocurrency bitcoin,0
monero coin original use case that serves a purpose without hidden influencers keep buying in a bear market,1
blockchainchick equalizer bitcoin trustless system man currently central banker has caused untold untold suffering around the world,1
feed reached pure capitulation idea bitcoin go next may enough pain bull rise ashes,0
"wife-to-be jus let the guy hang out to dry, she thought bitcoin was going down meanwhile, i&#39;m a bitch",-1
pwthornton bitcoin fan fuck fdic big government regulation also bitcoin fan fuck desio money,-1
stopped checking rbitcoin cryptocurrency price back everything back to normal but shit still hitting the fans,-1
tether sort open secret not enough funds crash eventually everything will take a lot of time,-1
eth short alert exchange ftx market eth perp quantity price btc btc eth eth,0
algo short exchange alert ftx market algo perp volume price btc btc eth eth,0
tonton dogboss airdrop new round total airdrop set worth dogboss airdrop bitcoin di youtube,0
btc derivs sheet tweet every min cme delayed min g delayed min oi share,0
last year&#39;s thing crap bitcoin magazine trying to create a big tent conference freaking affinity scammer,-1
swan dobro mjesto buy bitcoin love ethos stand end day fee high price marked,0
bitcoin fall k trader say bull need hail mary avoid bear market bitcoin via,-1
apparently mining green today somewhat disappointingly sees bitcoin gain outperformed by alt kunam people are learning,1
btc really interesting reaction time i feel like a relief due to extremely high negativity in the market,0
total crypto market cap continues to tumble dollar index hits annual value crypto bitcoin cryptocurrency,-1
feel touched sell the wall knock knock kool help the man break sell the wall ohhhh yeahhhh,0
money laundering arrested UAE Dubai million stolen cryptocurrency bitcoin good job law enforcement agency,-1
i need some beginners crypto mining i really work finished piece argoblockchain arbk arb riot bitcoin ethereum,0
hastecoin result many families pay the price struggle to make ends meet clearly bitcoin a large part of the solution,1
new video subscribe urgent alert central bank pump binance centralized download bitcoin xrp altcoins,0
bitcoin bear market can take btc price k say stock trader due to capitulation bitcoin via,-1
"as a stable thing the name of the stable coin to go to the really tied dollar, many did not care anymore",-1
wait k week buy next two weeks sell k wait till you get k get hodl,1
bullish scenario goes right shown latest youtube video subscribe don&#39;t miss update bitcoin cryptocurrency crypto,0
joshyoung jameshmackay thinks bitcoin different good anti crypto rejoice others burn bitcoin ash rises,1
bitcoin price move big win in coming week caution trader can bull trap cryptocurrency news via cojupiter,0
fix money fix the world bitcoin bitcoin generational wealth short film matt hornick tomer via youtube,1
btc latest block data block hold transaction total bitcoin including block reward block size byte,0
play get cashback play betfury higher cashback get username user betfurysuccess bitcoin staking,1
hodl crypto show love ledger unisex t-shirt buy today free shipping find cryptoclothing bitcoin,0
take two things happy bitcoin secure private key extend time horizon it&#39;s the purchase price that matters,1
rektcapital case btc would close weekly candle wick word renounce back up k sunday midnight,0
longest podcast hour minutes rambling ranting bitcoin crypto btc mattysats cryptocurator mashinsky alexandrelores infinitytimesme kryptovski,0
enemy monetary system money transfer base creation target scarcity bitcoin born release enemy,1
le money power the widening wealth gap is not a coincidence bitcoin use oligarchic empire is actually easy to understand,1
Many people tend to sell keeping the price of gain high enough to pay the mortgage to retire to fulfill a life goal,0
deeply understand bitcoin realize a completely seamless global solution wealth preservation project and further experiment including ethereum,1
today&#39;s snapshot news media topic contest btc bitcoin crypto analyzed article total medium sentiment negative,-1
got boner cause bought dip noobies kid run screaming sell made money lost cause noob,1
indicator that looks may be in line with fibonacci chart extension blowoff top k range years bear market,-1
to see a lot of people calling k bottom bull market support band goes to k would mean a party,0
im crypto from far found usecase transfer money come mind defi well far cost money,-1
btc bitcoin primary trend remains bearish right primary cycle support k thursday die day btc,-1
zrx symmetrical triangle h tf wait touch red line decided whether to enter btc bitcoin crypto trading,0
congratulation reached level of understanding bitcoin nobody know many level im level bitcoin wonderful invention ever,1
the world&#39;s largest cryptocurrency bitcoin lost trade the total crypto market suffered a broad selloff loss of billions forbes,-1
last visited rterraluna completely overwhelmed separate moonbois though site of people who are thinking about suicide amazing,-1
the biggest dca k month ago dcaed k still costs them average btc bit k bit,0
damn race k is really happening tidal wave institutional money is flooding every possible sector fear is missing,1
long yfi entry price stop loss telegram channel link bio tz btc bitcoin lrc inch,0
gain far minutes btc trade short would stock fall published would caught rebound more published,1
trying to find good information beep article outline one concern well summarized end thought sounds bad,-1
omnifinn princeysov happy stumbled upon bitcoin timeline happy swallowed the orange pill happy lucid goal path future,1
bitcoin hope love many people purchase investment long child great grandfather neices nephew hope love,1
defacto gold stable year really satisfied tested exchange mechanism selected gold verifying token burned process,1
natbrunell araksya foxla inflation destroys long term investments unless you invest some btc profit value time,1
first test dumping season since january btc barely moved alt not even half worth in january,-1
guy breakout coming btc ethereum gala sand mana lrc shib vet trx sol xrp ada,0
adviser president colombia call bitcoin brilliant piece of software ever bitcoin magazine bitcoinmagazine btc colombia cyptopotato,1
level of trade given the progress Asia is getting a big shift still respecting the technicals bitcoin btc cryptocurrency trading,0
nice vechain shill account don&#39;t tell you you&#39;re dirty in your mid thirties the lowest dweller could say,-1
sheldonevans btc eth holder strategy lend hodlnautdotcom earn a decent amount of interest insurance free withdrawal,1
btc latest block data block hold transaction total bitcoin including block reward block size byte,0
bitcoin derivatives data suggests bear pin btc k leading friday option expiration cryptocurrency crypto bitcoin,-1
the internet allows information to be transferred around the world bitcoin allows money to be transferred around the world an amazing revolutionary technology,1
haha lucky number dice mine super win betfury amount usdt username babygun betfurysuccess bitcoin staking,1
vivekreal tether helps Lugano become bitcoin city reason also El Salvador thinks everything is fine btc,1
long yfi entry price stop loss telegram channel link bio tz btc bitcoin lrc inch,0
good question maybe temporarily set good long term pressure competition among big players good btc,1
increasing higher th november end testnet expectation wagmi znn qsr btc bitcoin altcoin bullish,1
